title,published,text,link,og:site_name,og:url,site_description,name,url,scrape_time
Det gådefulde maleri på ekskonge Konstantins forladte slot,03.01.2023 00:00,,https://politiken.dk/podcast/dulyttertilpolitiken/art9186795/Det-g%C3%A5defulde-maleri-p%C3%A5-ekskonge-Konstantins-forladte-slot,Politiken,https://politiken.dk/nyheder/,"Hold dig opdateret pÃ¥ de seneste nyheder pÃ¥ politiken.dk: Seneste Politiken, Seneste Danmark, Seneste Kultur og Seneste Internationalt. ",Politiken,https://politiken.dk/nyheder/,27.01.2023 07:17
USA hævder at have ramt markant IS-leder i Somalia,09.01.2023 00:00,,https://politiken.dk/udland/art9187992/USA-h%C3%A6vder-at-have-ramt-markant-IS-leder-i-Somalia,Politiken,https://politiken.dk/nyheder/,"Hold dig opdateret pÃ¥ de seneste nyheder pÃ¥ politiken.dk: Seneste Politiken, Seneste Danmark, Seneste Kultur og Seneste Internationalt. ",Politiken,https://politiken.dk/nyheder/,27.01.2023 07:17
Stadig flere får ikke lov til at betale gæld til det offentlige,09.01.2023 00:00,,https://politiken.dk/indland/art9187983/Stadig-flere-f%C3%A5r-ikke-lov-til-at-betale-g%C3%A6ld-til-det-offentlige,Politiken,https://politiken.dk/nyheder/,"Hold dig opdateret pÃ¥ de seneste nyheder pÃ¥ politiken.dk: Seneste Politiken, Seneste Danmark, Seneste Kultur og Seneste Internationalt. ",Politiken,https://politiken.dk/nyheder/,27.01.2023 07:17
Spanien vil sende gamle kampvogne til Ukraine,10.01.2023 00:00,,https://politiken.dk/udland/art9187878/Spanien-vil-sende-gamle-kampvogne-til-Ukraine,Politiken,https://politiken.dk/nyheder/,"Hold dig opdateret pÃ¥ de seneste nyheder pÃ¥ politiken.dk: Seneste Politiken, Seneste Danmark, Seneste Kultur og Seneste Internationalt. ",Politiken,https://politiken.dk/nyheder/,27.01.2023 07:17
Fem betjente anklages for drab efter brutal anholdelse i USA,10.01.2023 00:00,,https://politiken.dk/udland/art9187973/Fem-betjente-anklages-for-drab-efter-brutal-anholdelse-i-USA,Politiken,https://politiken.dk/nyheder/,"Hold dig opdateret pÃ¥ de seneste nyheder pÃ¥ politiken.dk: Seneste Politiken, Seneste Danmark, Seneste Kultur og Seneste Internationalt. ",Politiken,https://politiken.dk/nyheder/,27.01.2023 07:17
Flemming Ytzen: Dan Jørgensen er mere afvikler end udvikler,10.01.2023 00:00,,https://politiken.dk/debat/art9147177/Dan-J%C3%B8rgensen-er-mere-afvikler-end-udvikler,Politiken,https://politiken.dk/nyheder/,"Hold dig opdateret pÃ¥ de seneste nyheder pÃ¥ politiken.dk: Seneste Politiken, Seneste Danmark, Seneste Kultur og Seneste Internationalt. ",Politiken,https://politiken.dk/nyheder/,27.01.2023 07:17
"Iran truer: »Hvis europæerne begår en fejl, må de også acceptere konsekvenserne«",10.01.2023 00:00,,https://politiken.dk/udland/art9182858/Iran-truer-%C2%BBHvis-europ%C3%A6erne-beg%C3%A5r-en-fejl-m%C3%A5-de-ogs%C3%A5-acceptere-konsekvenserne%C2%AB,Politiken,https://politiken.dk/nyheder/,"Hold dig opdateret pÃ¥ de seneste nyheder pÃ¥ politiken.dk: Seneste Politiken, Seneste Danmark, Seneste Kultur og Seneste Internationalt. ",Politiken,https://politiken.dk/nyheder/,27.01.2023 07:17
"Ja tak til kvindelig værnepligt. Lad os også få indført borgerpligten, nu vi er i gang",10.01.2023 00:00,,https://politiken.dk/debat/ledere/art9186609/Ja-tak-til-kvindelig-v%C3%A6rnepligt.-Lad-os-ogs%C3%A5-f%C3%A5-indf%C3%B8rt-borgerpligten-nu-vi-er-i-gang,Politiken,https://politiken.dk/nyheder/,"Hold dig opdateret pÃ¥ de seneste nyheder pÃ¥ politiken.dk: Seneste Politiken, Seneste Danmark, Seneste Kultur og Seneste Internationalt. ",Politiken,https://politiken.dk/nyheder/,27.01.2023 07:17
Læser: Jeg er virkelig bange for at blive forelsket,10.01.2023 00:00,,https://politiken.dk/ibyen/art9185055/L%C3%A6ser-Jeg-er-virkelig-bange-for-at-blive-forelsket,Politiken,https://politiken.dk/nyheder/,"Hold dig opdateret pÃ¥ de seneste nyheder pÃ¥ politiken.dk: Seneste Politiken, Seneste Danmark, Seneste Kultur og Seneste Internationalt. ",Politiken,https://politiken.dk/nyheder/,27.01.2023 07:17
Sigtelse: Dødfunden kvinde var påvirket og blev voldtaget,10.01.2023 00:00,,https://politiken.dk/indland/art9187937/Sigtelse-D%C3%B8dfunden-kvinde-var-p%C3%A5virket-og-blev-voldtaget,Politiken,https://politiken.dk/nyheder/,"Hold dig opdateret pÃ¥ de seneste nyheder pÃ¥ politiken.dk: Seneste Politiken, Seneste Danmark, Seneste Kultur og Seneste Internationalt. ",Politiken,https://politiken.dk/nyheder/,27.01.2023 07:17
Guide: Sådan går du udenom flourstoffer i din hverdag,11.01.2023 00:00,,https://politiken.dk/indland/art9185179/Guide-S%C3%A5dan-g%C3%A5r-du-udenom-flourstoffer-i-din-hverdag,Politiken,https://politiken.dk/nyheder/,"Hold dig opdateret pÃ¥ de seneste nyheder pÃ¥ politiken.dk: Seneste Politiken, Seneste Danmark, Seneste Kultur og Seneste Internationalt. ",Politiken,https://politiken.dk/nyheder/,27.01.2023 07:17
Efter PFAS-fund i æg: Flere fødevarer skal undersøges,11.01.2023 00:00,,https://politiken.dk/indland/art9187504/Efter-PFAS-fund-i-%C3%A6g-Flere-f%C3%B8devarer-skal-unders%C3%B8ges,Politiken,https://politiken.dk/nyheder/,"Hold dig opdateret pÃ¥ de seneste nyheder pÃ¥ politiken.dk: Seneste Politiken, Seneste Danmark, Seneste Kultur og Seneste Internationalt. ",Politiken,https://politiken.dk/nyheder/,27.01.2023 07:17
"Christian Bengtson: »Hele min barndom har jeg leget med dem i bunden af samfundet, og at jeg nu leger med dem på toppen. Der er bare så uendelig langt«",12.01.2023 00:00,,https://politiken.dk/kultur/art9151072/Christian-Bengtson-%C2%BBHele-min-barndom-har-jeg-leget-med-dem-i-bunden-af-samfundet-og-at-jeg-nu-leger-med-dem-p%C3%A5-toppen.-Der-er-bare-s%C3%A5-uendelig-langt%C2%AB,Politiken,https://politiken.dk/nyheder/,"Hold dig opdateret pÃ¥ de seneste nyheder pÃ¥ politiken.dk: Seneste Politiken, Seneste Danmark, Seneste Kultur og Seneste Internationalt. ",Politiken,https://politiken.dk/nyheder/,27.01.2023 07:17
Elisabet Svane efter opsigtsvækkende meningsmåling: Lige nu bringer modstanden de tre endnu tættere sammen,12.01.2023 00:00,,https://politiken.dk/indland/art9187789/Elisabet-Svane-efter-opsigtsv%C3%A6kkende-meningsm%C3%A5ling-Lige-nu-bringer-modstanden-de-tre-endnu-t%C3%A6ttere-sammen,Politiken,https://politiken.dk/nyheder/,"Hold dig opdateret pÃ¥ de seneste nyheder pÃ¥ politiken.dk: Seneste Politiken, Seneste Danmark, Seneste Kultur og Seneste Internationalt. ",Politiken,https://politiken.dk/nyheder/,27.01.2023 07:17
»Fantastisk dag for dansk forsvar«: Danmark forhandler med israelere om nyt artilleri,13.01.2023 00:00,,https://politiken.dk/indland/art9187844/%C2%BBFantastisk-dag-for-dansk-forsvar%C2%AB-Danmark-forhandler-med-israelere-om-nyt-artilleri,Politiken,https://politiken.dk/nyheder/,"Hold dig opdateret pÃ¥ de seneste nyheder pÃ¥ politiken.dk: Seneste Politiken, Seneste Danmark, Seneste Kultur og Seneste Internationalt. ",Politiken,https://politiken.dk/nyheder/,27.01.2023 07:17
Jesper Wung-Sung har forstemmende lidt at byde på i sin nye bog,13.01.2023 00:00,,https://politiken.dk/kultur/boger/art9182134/Jesper-Wung-Sung-har-forstemmende-lidt-at-byde-p%C3%A5-i-sin-nye-bog,Politiken,https://politiken.dk/nyheder/,"Hold dig opdateret pÃ¥ de seneste nyheder pÃ¥ politiken.dk: Seneste Politiken, Seneste Danmark, Seneste Kultur og Seneste Internationalt. ",Politiken,https://politiken.dk/nyheder/,27.01.2023 07:17
"»Hvis du råber ad mig, begynder jeg jo at græde«, svarer den lille pige, hvortil hun med et overdøvende »UD!« bortvises",14.01.2023 00:00,,https://politiken.dk/kultur/set_og_hoert/art9138339/%C2%BBHvis-du-r%C3%A5ber-ad-mig-begynder-jeg-jo-at-gr%C3%A6de%C2%AB-svarer-den-lille-pige-hvortil-hun-med-et-overd%C3%B8vende-%C2%BBUD%C2%AB-bortvises,Politiken,https://politiken.dk/nyheder/,"Hold dig opdateret pÃ¥ de seneste nyheder pÃ¥ politiken.dk: Seneste Politiken, Seneste Danmark, Seneste Kultur og Seneste Internationalt. ",Politiken,https://politiken.dk/nyheder/,27.01.2023 07:17
»Det var som en krigszone«: Deltagere klager over Netflix-optagelser til -Squid Game--realityshow,14.01.2023 00:00,,https://politiken.dk/kultur/film_og_tv/art9186042/%C2%BBDet-var-som-en-krigszone%C2%AB-Deltagere-klager-over-Netflix-optagelser-til-%E2%80%99Squid-Game%E2%80%99-realityshow,Politiken,https://politiken.dk/nyheder/,"Hold dig opdateret pÃ¥ de seneste nyheder pÃ¥ politiken.dk: Seneste Politiken, Seneste Danmark, Seneste Kultur og Seneste Internationalt. ",Politiken,https://politiken.dk/nyheder/,27.01.2023 07:17
"Regeringen står til at miste 21 mandater: »Det var nogle korte hvedebrødsdage, de havde«",15.01.2023 00:00,,https://politiken.dk/indland/art9186503/Regeringen-st%C3%A5r-til-at-miste-21-mandater-%C2%BBDet-var-nogle-korte-hvedebr%C3%B8dsdage-de-havde%C2%AB,Politiken,https://politiken.dk/nyheder/,"Hold dig opdateret pÃ¥ de seneste nyheder pÃ¥ politiken.dk: Seneste Politiken, Seneste Danmark, Seneste Kultur og Seneste Internationalt. ",Politiken,https://politiken.dk/nyheder/,27.01.2023 07:17
»Det her handler ikke om populisme eller meningsmålinger«: Kulturminister redder Dannebrog ved Kronborg Slot på 43 minutter,15.01.2023 00:00,,https://politiken.dk/kultur/art9187657/%C2%BBDet-her-handler-ikke-om-populisme-eller-meningsm%C3%A5linger%C2%AB-Kulturminister-redder-Dannebrog-ved-Kronborg-Slot-p%C3%A5-43-minutter,Politiken,https://politiken.dk/nyheder/,"Hold dig opdateret pÃ¥ de seneste nyheder pÃ¥ politiken.dk: Seneste Politiken, Seneste Danmark, Seneste Kultur og Seneste Internationalt. ",Politiken,https://politiken.dk/nyheder/,27.01.2023 07:17
"Når spaen er overstået, så fordyb dig i byernes skønhed",15.01.2023 00:00,,https://politiken.dk/rejser/art9025568/N%C3%A5r-spaen-er-overst%C3%A5et-s%C3%A5-fordyb-dig-i-byernes-sk%C3%B8nhed,Politiken,https://politiken.dk/nyheder/,"Hold dig opdateret pÃ¥ de seneste nyheder pÃ¥ politiken.dk: Seneste Politiken, Seneste Danmark, Seneste Kultur og Seneste Internationalt. ",Politiken,https://politiken.dk/nyheder/,27.01.2023 07:17
Kovending: 24syv-direktør lægger sig fladt ned,16.01.2023 00:00,,https://politiken.dk/kultur/medier/art9186393/Kovending-24syv-direkt%C3%B8r-l%C3%A6gger-sig-fladt-ned,Politiken,https://politiken.dk/nyheder/,"Hold dig opdateret pÃ¥ de seneste nyheder pÃ¥ politiken.dk: Seneste Politiken, Seneste Danmark, Seneste Kultur og Seneste Internationalt. ",Politiken,https://politiken.dk/nyheder/,27.01.2023 07:17
»Helt vilde tal« for skolebørn med psykiatriske diagnoser vækker opsigt: Lærere og forskere peger på en tredje vej,16.01.2023 00:00,,https://politiken.dk/indland/art9186083/%C2%BBHelt-vilde-tal%C2%AB-for-skoleb%C3%B8rn-med-psykiatriske-diagnoser-v%C3%A6kker-opsigt-L%C3%A6rere-og-forskere-peger-p%C3%A5-en-tredje-vej,Politiken,https://politiken.dk/nyheder/,"Hold dig opdateret pÃ¥ de seneste nyheder pÃ¥ politiken.dk: Seneste Politiken, Seneste Danmark, Seneste Kultur og Seneste Internationalt. ",Politiken,https://politiken.dk/nyheder/,27.01.2023 07:17
Ritt Bjerregaard giver det sidste ord til Mikael Bertelsen,16.01.2023 00:00,,https://politiken.dk/kultur/art9187398/Ritt-Bjerregaard-giver-det-sidste-ord-til-Mikael-Bertelsen,Politiken,https://politiken.dk/nyheder/,"Hold dig opdateret pÃ¥ de seneste nyheder pÃ¥ politiken.dk: Seneste Politiken, Seneste Danmark, Seneste Kultur og Seneste Internationalt. ",Politiken,https://politiken.dk/nyheder/,27.01.2023 07:17
"»Det er ungdommen, der efter valget i november er blevet de allerstørste tabere«",16.01.2023 00:00,,https://politiken.dk/debat/kroniken/art9173153/%C2%BBDet-er-ungdommen-der-efter-valget-i-november-er-blevet-de-allerst%C3%B8rste-tabere%C2%AB,Politiken,https://politiken.dk/nyheder/,"Hold dig opdateret pÃ¥ de seneste nyheder pÃ¥ politiken.dk: Seneste Politiken, Seneste Danmark, Seneste Kultur og Seneste Internationalt. ",Politiken,https://politiken.dk/nyheder/,27.01.2023 07:17
Flere og flere danskere over 85 år dør af covid-19,17.01.2023 00:00,,https://politiken.dk/forbrugogliv/sundhedogmotion/art9187106/Flere-og-flere-danskere-over-85-%C3%A5r-d%C3%B8r-af-covid-19,Politiken,https://politiken.dk/nyheder/,"Hold dig opdateret pÃ¥ de seneste nyheder pÃ¥ politiken.dk: Seneste Politiken, Seneste Danmark, Seneste Kultur og Seneste Internationalt. ",Politiken,https://politiken.dk/nyheder/,27.01.2023 07:17
"Lyt til Valget: »Der var en masse lorte på forhandlingsbordet i forvejen, men så lagde regeringen den største«",17.01.2023 00:00,,https://politiken.dk/podcast/valget/art9186868/%C2%BBDer-var-en-masse-lorte-p%C3%A5-forhandlingsbordet-i-forvejen-men-s%C3%A5-lagde-regeringen-den-st%C3%B8rste%C2%AB,Politiken,https://politiken.dk/nyheder/,"Hold dig opdateret pÃ¥ de seneste nyheder pÃ¥ politiken.dk: Seneste Politiken, Seneste Danmark, Seneste Kultur og Seneste Internationalt. ",Politiken,https://politiken.dk/nyheder/,27.01.2023 07:17
Kvinde stukket med kniv ved jobcenter i Aabenraa,17.01.2023 00:00,,https://politiken.dk/indland/art9187165/Kvinde-stukket-med-kniv-ved-jobcenter-i-Aabenraa,Politiken,https://politiken.dk/nyheder/,"Hold dig opdateret pÃ¥ de seneste nyheder pÃ¥ politiken.dk: Seneste Politiken, Seneste Danmark, Seneste Kultur og Seneste Internationalt. ",Politiken,https://politiken.dk/nyheder/,27.01.2023 07:17
Tidligere brigadegeneral kalder mulig våbenhandel med Israel tåbelig. Militæranalytiker er uenig,09.01.2023 00:00,,https://politiken.dk/indland/art9188103/Tidligere-brigadegeneral-kalder-mulig-v%C3%A5benhandel-med-Israel-t%C3%A5belig.-Milit%C3%A6ranalytiker-er-uenig,Politiken,https://politiken.dk/nyheder/,"Hold dig opdateret pÃ¥ de seneste nyheder pÃ¥ politiken.dk: Seneste Politiken, Seneste Danmark, Seneste Kultur og Seneste Internationalt. ",Politiken,https://politiken.dk/nyheder/,27.01.2023 07:17
Fredag skyder weekenden i gang med flot vejr og masser af sol,01.01.2023 00:00,,https://politiken.dk/indland/art9188014/Fredag-skyder-weekenden-i-gang-med-flot-vejr-og-masser-af-sol,Politiken,https://politiken.dk/nyheder/,"Hold dig opdateret pÃ¥ de seneste nyheder pÃ¥ politiken.dk: Seneste Politiken, Seneste Danmark, Seneste Kultur og Seneste Internationalt. ",Politiken,https://politiken.dk/nyheder/,27.01.2023 07:17
Alle undrer sig over eksplosionen i diagnoser hos børn. Ekspert hælder til en anden hypotese end den gængse,09.01.2023 00:00,,https://politiken.dk/indland/art9073271/Alle-undrer-sig-over-eksplosionen-i-diagnoser-hos-b%C3%B8rn.-Ekspert-h%C3%A6lder-til-en-anden-hypotese-end-den-g%C3%A6ngse,Politiken,https://politiken.dk/nyheder/,"Hold dig opdateret pÃ¥ de seneste nyheder pÃ¥ politiken.dk: Seneste Politiken, Seneste Danmark, Seneste Kultur og Seneste Internationalt. ",Politiken,https://politiken.dk/nyheder/,27.01.2023 07:17
Stadig flere får ikke lov til at betale gæld til det offentlige,09.01.2023 00:00,,https://politiken.dk/indland/art9187983/Stadig-flere-f%C3%A5r-ikke-lov-til-at-betale-g%C3%A6ld-til-det-offentlige,Politiken,https://politiken.dk/nyheder/,"Hold dig opdateret pÃ¥ de seneste nyheder pÃ¥ politiken.dk: Seneste Politiken, Seneste Danmark, Seneste Kultur og Seneste Internationalt. ",Politiken,https://politiken.dk/nyheder/,27.01.2023 07:17
Sigtelse: Dødfunden kvinde var påvirket og blev voldtaget,10.01.2023 00:00,,https://politiken.dk/indland/art9187937/Sigtelse-D%C3%B8dfunden-kvinde-var-p%C3%A5virket-og-blev-voldtaget,Politiken,https://politiken.dk/nyheder/,"Hold dig opdateret pÃ¥ de seneste nyheder pÃ¥ politiken.dk: Seneste Politiken, Seneste Danmark, Seneste Kultur og Seneste Internationalt. ",Politiken,https://politiken.dk/nyheder/,27.01.2023 07:17
Guide: Sådan går du udenom flourstoffer i din hverdag,11.01.2023 00:00,,https://politiken.dk/indland/art9185179/Guide-S%C3%A5dan-g%C3%A5r-du-udenom-flourstoffer-i-din-hverdag,Politiken,https://politiken.dk/nyheder/,"Hold dig opdateret pÃ¥ de seneste nyheder pÃ¥ politiken.dk: Seneste Politiken, Seneste Danmark, Seneste Kultur og Seneste Internationalt. ",Politiken,https://politiken.dk/nyheder/,27.01.2023 07:17
Efter PFAS-fund i æg: Flere fødevarer skal undersøges,11.01.2023 00:00,,https://politiken.dk/indland/art9187504/Efter-PFAS-fund-i-%C3%A6g-Flere-f%C3%B8devarer-skal-unders%C3%B8ges,Politiken,https://politiken.dk/nyheder/,"Hold dig opdateret pÃ¥ de seneste nyheder pÃ¥ politiken.dk: Seneste Politiken, Seneste Danmark, Seneste Kultur og Seneste Internationalt. ",Politiken,https://politiken.dk/nyheder/,27.01.2023 07:17
"Energiselskaber skal aflevere 1,2 milliarder kroner tilbage til forbrugerne",11.01.2023 00:00,,https://politiken.dk/indland/art9187867/Energiselskaber-skal-aflevere-12-milliarder-kroner-tilbage-til-forbrugerne,Politiken,https://politiken.dk/nyheder/,"Hold dig opdateret pÃ¥ de seneste nyheder pÃ¥ politiken.dk: Seneste Politiken, Seneste Danmark, Seneste Kultur og Seneste Internationalt. ",Politiken,https://politiken.dk/nyheder/,27.01.2023 07:17
Elisabet Svane efter opsigtsvækkende meningsmåling: Lige nu bringer modstanden de tre endnu tættere sammen,12.01.2023 00:00,,https://politiken.dk/indland/art9187789/Elisabet-Svane-efter-opsigtsv%C3%A6kkende-meningsm%C3%A5ling-Lige-nu-bringer-modstanden-de-tre-endnu-t%C3%A6ttere-sammen,Politiken,https://politiken.dk/nyheder/,"Hold dig opdateret pÃ¥ de seneste nyheder pÃ¥ politiken.dk: Seneste Politiken, Seneste Danmark, Seneste Kultur og Seneste Internationalt. ",Politiken,https://politiken.dk/nyheder/,27.01.2023 07:17
Paludan optrapper sin koranafbrænding og flytter scenen til Tyrkiets ambassade i København,12.01.2023 00:00,,https://politiken.dk/indland/art9187853/Paludan-optrapper-sin-koranafbr%C3%A6nding-og-flytter-scenen-til-Tyrkiets-ambassade-i-K%C3%B8benhavn,Politiken,https://politiken.dk/nyheder/,"Hold dig opdateret pÃ¥ de seneste nyheder pÃ¥ politiken.dk: Seneste Politiken, Seneste Danmark, Seneste Kultur og Seneste Internationalt. ",Politiken,https://politiken.dk/nyheder/,27.01.2023 07:17
»Fantastisk dag for dansk forsvar«: Danmark forhandler med israelere om nyt artilleri,13.01.2023 00:00,,https://politiken.dk/indland/art9187844/%C2%BBFantastisk-dag-for-dansk-forsvar%C2%AB-Danmark-forhandler-med-israelere-om-nyt-artilleri,Politiken,https://politiken.dk/nyheder/,"Hold dig opdateret pÃ¥ de seneste nyheder pÃ¥ politiken.dk: Seneste Politiken, Seneste Danmark, Seneste Kultur og Seneste Internationalt. ",Politiken,https://politiken.dk/nyheder/,27.01.2023 07:17
Sådan reagerer unge på værnepligt for kvinder,14.01.2023 00:00,,https://politiken.dk/indland/art9186166/S%C3%A5dan-reagerer-unge-p%C3%A5-v%C3%A6rnepligt-for-kvinder,Politiken,https://politiken.dk/nyheder/,"Hold dig opdateret pÃ¥ de seneste nyheder pÃ¥ politiken.dk: Seneste Politiken, Seneste Danmark, Seneste Kultur og Seneste Internationalt. ",Politiken,https://politiken.dk/nyheder/,27.01.2023 07:17
"Regeringen står til at miste 21 mandater: »Det var nogle korte hvedebrødsdage, de havde«",15.01.2023 00:00,,https://politiken.dk/indland/art9186503/Regeringen-st%C3%A5r-til-at-miste-21-mandater-%C2%BBDet-var-nogle-korte-hvedebr%C3%B8dsdage-de-havde%C2%AB,Politiken,https://politiken.dk/nyheder/,"Hold dig opdateret pÃ¥ de seneste nyheder pÃ¥ politiken.dk: Seneste Politiken, Seneste Danmark, Seneste Kultur og Seneste Internationalt. ",Politiken,https://politiken.dk/nyheder/,27.01.2023 07:17
Grafikoverblik: Se den seneste Megafon samt årtiers målinger og valgresultater,15.01.2023 00:00,,https://politiken.dk/indland/politik/folketingsvalg_2022/art7158336/Se-den-seneste-Megafon-samt-%C3%A5rtiers-m%C3%A5linger-og-valgresultater,Politiken,https://politiken.dk/nyheder/,"Hold dig opdateret pÃ¥ de seneste nyheder pÃ¥ politiken.dk: Seneste Politiken, Seneste Danmark, Seneste Kultur og Seneste Internationalt. ",Politiken,https://politiken.dk/nyheder/,27.01.2023 07:17
»Det her handler ikke om populisme eller meningsmålinger«: Kulturminister redder Dannebrog ved Kronborg Slot på 43 minutter,15.01.2023 00:00,,https://politiken.dk/kultur/art9187657/%C2%BBDet-her-handler-ikke-om-populisme-eller-meningsm%C3%A5linger%C2%AB-Kulturminister-redder-Dannebrog-ved-Kronborg-Slot-p%C3%A5-43-minutter,Politiken,https://politiken.dk/nyheder/,"Hold dig opdateret pÃ¥ de seneste nyheder pÃ¥ politiken.dk: Seneste Politiken, Seneste Danmark, Seneste Kultur og Seneste Internationalt. ",Politiken,https://politiken.dk/nyheder/,27.01.2023 07:17
»Helt vilde tal« for skolebørn med psykiatriske diagnoser vækker opsigt: Lærere og forskere peger på en tredje vej,16.01.2023 00:00,,https://politiken.dk/indland/art9186083/%C2%BBHelt-vilde-tal%C2%AB-for-skoleb%C3%B8rn-med-psykiatriske-diagnoser-v%C3%A6kker-opsigt-L%C3%A6rere-og-forskere-peger-p%C3%A5-en-tredje-vej,Politiken,https://politiken.dk/nyheder/,"Hold dig opdateret pÃ¥ de seneste nyheder pÃ¥ politiken.dk: Seneste Politiken, Seneste Danmark, Seneste Kultur og Seneste Internationalt. ",Politiken,https://politiken.dk/nyheder/,27.01.2023 07:17
Kvinde stukket med kniv ved jobcenter i Aabenraa,17.01.2023 00:00,,https://politiken.dk/indland/art9187165/Kvinde-stukket-med-kniv-ved-jobcenter-i-Aabenraa,Politiken,https://politiken.dk/nyheder/,"Hold dig opdateret pÃ¥ de seneste nyheder pÃ¥ politiken.dk: Seneste Politiken, Seneste Danmark, Seneste Kultur og Seneste Internationalt. ",Politiken,https://politiken.dk/nyheder/,27.01.2023 07:17
Regeringsflertal for værnepligt for kvinder,18.01.2023 00:00,,https://politiken.dk/indland/art9186975/Regeringsflertal-for-v%C3%A6rnepligt-for-kvinder,Politiken,https://politiken.dk/nyheder/,"Hold dig opdateret pÃ¥ de seneste nyheder pÃ¥ politiken.dk: Seneste Politiken, Seneste Danmark, Seneste Kultur og Seneste Internationalt. ",Politiken,https://politiken.dk/nyheder/,27.01.2023 07:17
Gymnasier opretter særlige linjer for unge med diagnoser som angst og adhd,18.01.2023 00:00,,https://politiken.dk/indland/art9072263/Gymnasier-opretter-s%C3%A6rlige-linjer-for-unge-med-diagnoser-som-angst-og-adhd,Politiken,https://politiken.dk/nyheder/,"Hold dig opdateret pÃ¥ de seneste nyheder pÃ¥ politiken.dk: Seneste Politiken, Seneste Danmark, Seneste Kultur og Seneste Internationalt. ",Politiken,https://politiken.dk/nyheder/,27.01.2023 07:17
Trods formandsstop får Vermund fremtrædende rolle i Nye Borgerlige,18.01.2023 00:00,,https://politiken.dk/indland/politik/art9186817/Trods-formandsstop-f%C3%A5r-Vermund-fremtr%C3%A6dende-rolle-i-Nye-Borgerlige,Politiken,https://politiken.dk/nyheder/,"Hold dig opdateret pÃ¥ de seneste nyheder pÃ¥ politiken.dk: Seneste Politiken, Seneste Danmark, Seneste Kultur og Seneste Internationalt. ",Politiken,https://politiken.dk/nyheder/,27.01.2023 07:17
"Loke Norlin har lejet varmepumpe: »Det er grønnere, og jeg gider altså heller ikke støtte Ruslands krig mod Ukraine«",20.01.2023 00:00,,https://politiken.dk/indland/kobenhavn/art9184241/Loke-Norlin-har-lejet-varmepumpe-%C2%BBDet-er-gr%C3%B8nnere-og-jeg-gider-alts%C3%A5-heller-ikke-st%C3%B8tte-Ruslands-krig-mod-Ukraine%C2%AB,Politiken,https://politiken.dk/nyheder/,"Hold dig opdateret pÃ¥ de seneste nyheder pÃ¥ politiken.dk: Seneste Politiken, Seneste Danmark, Seneste Kultur og Seneste Internationalt. ",Politiken,https://politiken.dk/nyheder/,27.01.2023 07:17
16-årig tiltalt for tilslutning til højreradikal terror,20.01.2023 00:00,,https://politiken.dk/indland/art9186504/16-%C3%A5rig-tiltalt-for-tilslutning-til-h%C3%B8jreradikal-terror,Politiken,https://politiken.dk/nyheder/,"Hold dig opdateret pÃ¥ de seneste nyheder pÃ¥ politiken.dk: Seneste Politiken, Seneste Danmark, Seneste Kultur og Seneste Internationalt. ",Politiken,https://politiken.dk/nyheder/,27.01.2023 07:17
DFs næstformand stopper i partiet,20.01.2023 00:00,,https://politiken.dk/indland/art9186406/DFs-n%C3%A6stformand-stopper-i-partiet,Politiken,https://politiken.dk/nyheder/,"Hold dig opdateret pÃ¥ de seneste nyheder pÃ¥ politiken.dk: Seneste Politiken, Seneste Danmark, Seneste Kultur og Seneste Internationalt. ",Politiken,https://politiken.dk/nyheder/,27.01.2023 07:17
Minister vil undersøge om det skal være ulovligt at fjerne kondom uden samtykke,21.01.2023 00:00,,https://politiken.dk/indland/art9186232/Minister-vil-unders%C3%B8ge-om-det-skal-v%C3%A6re-ulovligt-at-fjerne-kondom-uden-samtykke,Politiken,https://politiken.dk/nyheder/,"Hold dig opdateret pÃ¥ de seneste nyheder pÃ¥ politiken.dk: Seneste Politiken, Seneste Danmark, Seneste Kultur og Seneste Internationalt. ",Politiken,https://politiken.dk/nyheder/,27.01.2023 07:17
Ellemann vil have værnepligt - men Socialdemokratiet tøver,22.01.2023 00:00,,https://politiken.dk/indland/art9186169/Ellemann-vil-have-v%C3%A6rnepligt-%E2%80%93-men-Socialdemokratiet-t%C3%B8ver,Politiken,https://politiken.dk/nyheder/,"Hold dig opdateret pÃ¥ de seneste nyheder pÃ¥ politiken.dk: Seneste Politiken, Seneste Danmark, Seneste Kultur og Seneste Internationalt. ",Politiken,https://politiken.dk/nyheder/,27.01.2023 07:17
"»Nu ser de hinanden i øjnene, når de møder ind om morgenen«",23.01.2023 00:00,,https://politiken.dk/indland/art9172449/%C2%BBNu-ser-de-hinanden-i-%C3%B8jnene-n%C3%A5r-de-m%C3%B8der-ind-om-morgenen%C2%AB,Politiken,https://politiken.dk/nyheder/,"Hold dig opdateret pÃ¥ de seneste nyheder pÃ¥ politiken.dk: Seneste Politiken, Seneste Danmark, Seneste Kultur og Seneste Internationalt. ",Politiken,https://politiken.dk/nyheder/,27.01.2023 07:17
Flere ældre bekymrer sig over at være skubbet ud i kulden af digitaliseringen,28.01.2023 00:00,,https://politiken.dk/indland/art9183992/Flere-%C3%A6ldre-bekymrer-sig-over-at-v%C3%A6re-skubbet-ud-i-kulden-af-digitaliseringen,Politiken,https://politiken.dk/nyheder/,"Hold dig opdateret pÃ¥ de seneste nyheder pÃ¥ politiken.dk: Seneste Politiken, Seneste Danmark, Seneste Kultur og Seneste Internationalt. ",Politiken,https://politiken.dk/nyheder/,27.01.2023 07:17
