title,published,text,link,og:site_name,og:url,site_description,name,url,scrape_time
"Regeringen vil sige undskyld for »ubegribelige, horrible overgreb« til tidligere anbragte i særforsorgen",09.03.2023 00:00,,https://politiken.dk/indland/art9245991/Regeringen-vil-sige-undskyld-for-%C2%BBubegribelige-horrible-overgreb%C2%AB-til-tidligere-anbragte-i-s%C3%A6rforsorgen,Politiken,https://politiken.dk/nyheder/,"Hold dig opdateret pÃ¥ de seneste nyheder pÃ¥ politiken.dk: Seneste Politiken, Seneste Danmark, Seneste Kultur og Seneste Internationalt. ",Politiken,https://politiken.dk/nyheder/,08.03.2023 07:17
Politiets teori: Flere står bag knivdrab på to unge - og knivstikkerierne menes ikke at være tilfældige,09.03.2023 00:00,,https://politiken.dk/indland/art9245987/Flere-st%C3%A5r-bag-knivdrab-p%C3%A5-to-unge-%E2%80%93-og-knivstikkerierne-menes-ikke-at-v%C3%A6re-tilf%C3%A6ldige,Politiken,https://politiken.dk/nyheder/,"Hold dig opdateret pÃ¥ de seneste nyheder pÃ¥ politiken.dk: Seneste Politiken, Seneste Danmark, Seneste Kultur og Seneste Internationalt. ",Politiken,https://politiken.dk/nyheder/,08.03.2023 07:17
»Folk bliver selvfølgelig chokerede«: Kontrollører med vagt- og politibeskyttelse tjekker ulovlige kolonihaver,09.03.2023 00:00,,https://politiken.dk/indland/art9224982/Kontroll%C3%B8rer-med-vagt-og-politibeskyttelse-tjekker-ulovlige-kolonihaver,Politiken,https://politiken.dk/nyheder/,"Hold dig opdateret pÃ¥ de seneste nyheder pÃ¥ politiken.dk: Seneste Politiken, Seneste Danmark, Seneste Kultur og Seneste Internationalt. ",Politiken,https://politiken.dk/nyheder/,08.03.2023 07:17
"»Jeg havde noget at leve for, men nu er jeg reduceret til en tigger«",09.03.2023 00:00,,https://politiken.dk/indland/art9230027/%C2%BBJeg-havde-noget-at-leve-for-men-nu-er-jeg-reduceret-til-en-tigger%C2%AB,Politiken,https://politiken.dk/nyheder/,"Hold dig opdateret pÃ¥ de seneste nyheder pÃ¥ politiken.dk: Seneste Politiken, Seneste Danmark, Seneste Kultur og Seneste Internationalt. ",Politiken,https://politiken.dk/nyheder/,08.03.2023 07:17
Snestorm får nordjyske skoler til at rykke undervisningen online,09.03.2023 00:00,,https://politiken.dk/indland/art9245757/Snestorm-f%C3%A5r-nordjyske-skoler-til-at-rykke-undervisningen-online,Politiken,https://politiken.dk/nyheder/,"Hold dig opdateret pÃ¥ de seneste nyheder pÃ¥ politiken.dk: Seneste Politiken, Seneste Danmark, Seneste Kultur og Seneste Internationalt. ",Politiken,https://politiken.dk/nyheder/,08.03.2023 07:17
To tredjedele af taget på nyt supersygehus er lagt forkert,09.03.2023 00:00,,https://politiken.dk/indland/art9244172/To-tredjedele-af-taget-p%C3%A5-nyt-supersygehus-er-lagt-forkert,Politiken,https://politiken.dk/nyheder/,"Hold dig opdateret pÃ¥ de seneste nyheder pÃ¥ politiken.dk: Seneste Politiken, Seneste Danmark, Seneste Kultur og Seneste Internationalt. ",Politiken,https://politiken.dk/nyheder/,08.03.2023 07:17
Sådan påvirker snestormen togene,09.03.2023 00:00,,https://politiken.dk/indland/art9245158/S%C3%A5dan-p%C3%A5virker-snestormen-togene,Politiken,https://politiken.dk/nyheder/,"Hold dig opdateret pÃ¥ de seneste nyheder pÃ¥ politiken.dk: Seneste Politiken, Seneste Danmark, Seneste Kultur og Seneste Internationalt. ",Politiken,https://politiken.dk/nyheder/,08.03.2023 07:17
Splittet landsret giver 12 års fængsel for drab med 78 læsioner,09.03.2023 00:00,,https://politiken.dk/indland/art9245155/Splittet-landsret-giver-12-%C3%A5rs-f%C3%A6ngsel-for-drab-med-78-l%C3%A6sioner,Politiken,https://politiken.dk/nyheder/,"Hold dig opdateret pÃ¥ de seneste nyheder pÃ¥ politiken.dk: Seneste Politiken, Seneste Danmark, Seneste Kultur og Seneste Internationalt. ",Politiken,https://politiken.dk/nyheder/,08.03.2023 07:17
"Partitop freder Jon Stephensen: Det er trist, men det handler ikke om Moderaterne",09.03.2023 00:00,,https://politiken.dk/indland/politik/art9245072/Det-er-trist-men-det-handler-ikke-om-Moderaterne,Politiken,https://politiken.dk/nyheder/,"Hold dig opdateret pÃ¥ de seneste nyheder pÃ¥ politiken.dk: Seneste Politiken, Seneste Danmark, Seneste Kultur og Seneste Internationalt. ",Politiken,https://politiken.dk/nyheder/,08.03.2023 07:17
Her spiser topkokken David Zilber igen og igen i København,09.03.2023 00:00,,https://politiken.dk/ibyen/art9222971/Her-spiser-topkokken-David-Zilber-igen-og-igen-i-K%C3%B8benhavn,Politiken,https://politiken.dk/nyheder/,"Hold dig opdateret pÃ¥ de seneste nyheder pÃ¥ politiken.dk: Seneste Politiken, Seneste Danmark, Seneste Kultur og Seneste Internationalt. ",Politiken,https://politiken.dk/nyheder/,08.03.2023 07:17
11 tiltalt for at bryde bandeforbud med fællesfoto og middag,09.03.2023 00:00,,https://politiken.dk/indland/art9244647/11-tiltalt-for-at-bryde-bandeforbud-med-f%C3%A6llesfoto-og-middag,Politiken,https://politiken.dk/nyheder/,"Hold dig opdateret pÃ¥ de seneste nyheder pÃ¥ politiken.dk: Seneste Politiken, Seneste Danmark, Seneste Kultur og Seneste Internationalt. ",Politiken,https://politiken.dk/nyheder/,08.03.2023 07:17
Forsvarsministeriet forbyder TikTok på ansattes telefoner,09.03.2023 00:00,,https://politiken.dk/indland/art9244681/Forsvarsministeriet-forbyder-TikTok-p%C3%A5-ansattes-telefoner,Politiken,https://politiken.dk/nyheder/,"Hold dig opdateret pÃ¥ de seneste nyheder pÃ¥ politiken.dk: Seneste Politiken, Seneste Danmark, Seneste Kultur og Seneste Internationalt. ",Politiken,https://politiken.dk/nyheder/,08.03.2023 07:17
Her er anklagerne mod Jon Stephensen,09.03.2023 00:00,,https://politiken.dk/indland/politik/art9244321/Her-er-anklagerne-mod-Jon-Stephensen,Politiken,https://politiken.dk/nyheder/,"Hold dig opdateret pÃ¥ de seneste nyheder pÃ¥ politiken.dk: Seneste Politiken, Seneste Danmark, Seneste Kultur og Seneste Internationalt. ",Politiken,https://politiken.dk/nyheder/,08.03.2023 07:17
"Tidligere næstformand melder sig ud af Nye Borgerlige: »Folk, jeg naivt troede, jeg havde et fællesskab med, har været medvirkende til at føre kniven«",09.03.2023 00:00,,https://politiken.dk/indland/politik/art9244294/%C2%BBFolk-jeg-naivt-troede-jeg-havde-et-f%C3%A6llesskab-med-har-v%C3%A6ret-medvirkende-til-at-f%C3%B8re-kniven%C2%AB,Politiken,https://politiken.dk/nyheder/,"Hold dig opdateret pÃ¥ de seneste nyheder pÃ¥ politiken.dk: Seneste Politiken, Seneste Danmark, Seneste Kultur og Seneste Internationalt. ",Politiken,https://politiken.dk/nyheder/,08.03.2023 07:17
Lidl udnytter konkurrents exit fra Danmark til at åbne 60 nye butikker,09.03.2023 00:00,,https://politiken.dk/indland/art9244400/Lidl-udnytter-konkurrents-exit-fra-Danmark-til-at-%C3%A5bne-60-nye-butikker,Politiken,https://politiken.dk/nyheder/,"Hold dig opdateret pÃ¥ de seneste nyheder pÃ¥ politiken.dk: Seneste Politiken, Seneste Danmark, Seneste Kultur og Seneste Internationalt. ",Politiken,https://politiken.dk/nyheder/,08.03.2023 07:17
"Politiet har intensiveret jagten på stalkere, men undlader at bruge vigtigt værktøj",09.03.2023 00:00,,https://politiken.dk/indland/art9235732/Politiet-har-intensiveret-jagten-p%C3%A5-stalkere-men-undlader-at-bruge-vigtigt-v%C3%A6rkt%C3%B8j,Politiken,https://politiken.dk/nyheder/,"Hold dig opdateret pÃ¥ de seneste nyheder pÃ¥ politiken.dk: Seneste Politiken, Seneste Danmark, Seneste Kultur og Seneste Internationalt. ",Politiken,https://politiken.dk/nyheder/,08.03.2023 07:17
Sannes stalker ringede 17.000 gange på 53 dage. Tre år efter ser hun sig stadig over skulderen,09.03.2023 00:00,,https://politiken.dk/indland/art9225672/Sannes-stalker-ringede-17.000-gange-p%C3%A5-53-dage.-Tre-%C3%A5r-efter-ser-hun-sig-stadig-over-skulderen,Politiken,https://politiken.dk/nyheder/,"Hold dig opdateret pÃ¥ de seneste nyheder pÃ¥ politiken.dk: Seneste Politiken, Seneste Danmark, Seneste Kultur og Seneste Internationalt. ",Politiken,https://politiken.dk/nyheder/,08.03.2023 07:17
Lejere kan først forvente akut huslejehjælp efter sommerferien,09.03.2023 00:00,,https://politiken.dk/indland/art9244283/Lejere-kan-f%C3%B8rst-forvente-akut-huslejehj%C3%A6lp-efter-sommerferien,Politiken,https://politiken.dk/nyheder/,"Hold dig opdateret pÃ¥ de seneste nyheder pÃ¥ politiken.dk: Seneste Politiken, Seneste Danmark, Seneste Kultur og Seneste Internationalt. ",Politiken,https://politiken.dk/nyheder/,08.03.2023 07:17
På Refshaleøen kan man klatre 15 meter op i luften - men det kan nye planer sætte en stopper for,09.03.2023 00:00,,https://politiken.dk/indland/kobenhavn/art9233587/P%C3%A5-Refshale%C3%B8en-kan-man-klatre-15-meter-op-i-luften-%E2%80%93-men-det-kan-nye-planer-s%C3%A6tte-en-stopper-for,Politiken,https://politiken.dk/nyheder/,"Hold dig opdateret pÃ¥ de seneste nyheder pÃ¥ politiken.dk: Seneste Politiken, Seneste Danmark, Seneste Kultur og Seneste Internationalt. ",Politiken,https://politiken.dk/nyheder/,08.03.2023 07:17
Flere uheld på motorvejen ved Brøndby skaber køkaos,09.03.2023 00:00,,https://politiken.dk/indland/art9244301/Flere-uheld-p%C3%A5-motorvejen-ved-Br%C3%B8ndby-skaber-k%C3%B8kaos,Politiken,https://politiken.dk/nyheder/,"Hold dig opdateret pÃ¥ de seneste nyheder pÃ¥ politiken.dk: Seneste Politiken, Seneste Danmark, Seneste Kultur og Seneste Internationalt. ",Politiken,https://politiken.dk/nyheder/,08.03.2023 07:17
Udenlandske arbejdere kæmper med at få en bankkonto i Danmark,06.03.2023 00:00,,https://politiken.dk/indland/art9236232/Udenlandske-arbejdere-k%C3%A6mper-med-at-f%C3%A5-en-bankkonto-i-Danmark,Politiken,https://politiken.dk/nyheder/,"Hold dig opdateret pÃ¥ de seneste nyheder pÃ¥ politiken.dk: Seneste Politiken, Seneste Danmark, Seneste Kultur og Seneste Internationalt. ",Politiken,https://politiken.dk/nyheder/,08.03.2023 07:17
Kulturminister blæser til kamp for mangfoldighed med ny pris og får hjælp af flere kendte,01.03.2023 00:00,,https://politiken.dk/kultur/art9235478/Kulturminister-bl%C3%A6ser-til-kamp-for-mangfoldighed-med-ny-pris-og-f%C3%A5r-hj%C3%A6lp-af-flere-kendte,Politiken,https://politiken.dk/nyheder/,"Hold dig opdateret pÃ¥ de seneste nyheder pÃ¥ politiken.dk: Seneste Politiken, Seneste Danmark, Seneste Kultur og Seneste Internationalt. ",Politiken,https://politiken.dk/nyheder/,08.03.2023 07:17
"Intet er for småt, intet for stort til en podcast i minimum otte afsnit",09.03.2023 00:00,,https://politiken.dk/kultur/set_og_hoert/art9187901/Intet-er-for-sm%C3%A5t-intet-for-stort-til-en-podcast-i-minimum-otte-afsnit,Politiken,https://politiken.dk/nyheder/,"Hold dig opdateret pÃ¥ de seneste nyheder pÃ¥ politiken.dk: Seneste Politiken, Seneste Danmark, Seneste Kultur og Seneste Internationalt. ",Politiken,https://politiken.dk/nyheder/,08.03.2023 07:17
"Tidligere ansatte langer ud efter Jon Stephensen: Han er egenrådig, arrogant og grænseoverskridende",12.03.2023 00:00,,https://politiken.dk/kultur/art9244877/Tidligere-ansatte-langer-ud-efter-Jon-Stephensen-Han-er-egenr%C3%A5dig-arrogant-og-gr%C3%A6nseoverskridende,Politiken,https://politiken.dk/nyheder/,"Hold dig opdateret pÃ¥ de seneste nyheder pÃ¥ politiken.dk: Seneste Politiken, Seneste Danmark, Seneste Kultur og Seneste Internationalt. ",Politiken,https://politiken.dk/nyheder/,08.03.2023 07:17
En bomstærk film om fortidens ustyrlige danske kvinder,13.03.2023 00:00,,https://politiken.dk/kultur/film_og_tv/art9204034/En-bomst%C3%A6rk-film-om-fortidens-ustyrlige-danske-kvinder,Politiken,https://politiken.dk/nyheder/,"Hold dig opdateret pÃ¥ de seneste nyheder pÃ¥ politiken.dk: Seneste Politiken, Seneste Danmark, Seneste Kultur og Seneste Internationalt. ",Politiken,https://politiken.dk/nyheder/,08.03.2023 07:17
Man skal være belagt med teflon for ikke at blive berørt,15.03.2023 00:00,,https://politiken.dk/kultur/art9236111/Man-skal-v%C3%A6re-belagt-med-teflon-for-ikke-at-blive-ber%C3%B8rt,Politiken,https://politiken.dk/nyheder/,"Hold dig opdateret pÃ¥ de seneste nyheder pÃ¥ politiken.dk: Seneste Politiken, Seneste Danmark, Seneste Kultur og Seneste Internationalt. ",Politiken,https://politiken.dk/nyheder/,08.03.2023 07:17
Direktør forsvarer ny omdiskuteret P3-chef,15.03.2023 00:00,,https://politiken.dk/kultur/art9246278/Direkt%C3%B8r-forsvarer-ny-omdiskuteret-P3-chef,Politiken,https://politiken.dk/nyheder/,"Hold dig opdateret pÃ¥ de seneste nyheder pÃ¥ politiken.dk: Seneste Politiken, Seneste Danmark, Seneste Kultur og Seneste Internationalt. ",Politiken,https://politiken.dk/nyheder/,08.03.2023 07:17
5 hjerter: Lille bog om at være forfatter er genial,18.03.2023 00:00,,https://politiken.dk/kultur/boger/boganmeldelser/skonlitteratur_boger/art9234384/Lille-bog-om-at-v%C3%A6re-forfatter-er-genial,Politiken,https://politiken.dk/nyheder/,"Hold dig opdateret pÃ¥ de seneste nyheder pÃ¥ politiken.dk: Seneste Politiken, Seneste Danmark, Seneste Kultur og Seneste Internationalt. ",Politiken,https://politiken.dk/nyheder/,08.03.2023 07:17
Jon Stephensen varsler flere sager om sig selv,18.03.2023 00:00,,https://politiken.dk/kultur/art9247059/Jon-Stephensen-varsler-flere-sager-om-sig-selv,Politiken,https://politiken.dk/nyheder/,"Hold dig opdateret pÃ¥ de seneste nyheder pÃ¥ politiken.dk: Seneste Politiken, Seneste Danmark, Seneste Kultur og Seneste Internationalt. ",Politiken,https://politiken.dk/nyheder/,08.03.2023 07:17
"De blev spærret inde og kaldt åndssvage, men de unge kvinder var i virkeligheden bare lystfulde og livlige",20.03.2023 00:00,,https://politiken.dk/kultur/art9188692/De-blev-sp%C3%A6rret-inde-og-kaldt-%C3%A5ndssvage-men-de-unge-kvinder-var-i-virkeligheden-bare-lystfulde-og-livlige,Politiken,https://politiken.dk/nyheder/,"Hold dig opdateret pÃ¥ de seneste nyheder pÃ¥ politiken.dk: Seneste Politiken, Seneste Danmark, Seneste Kultur og Seneste Internationalt. ",Politiken,https://politiken.dk/nyheder/,08.03.2023 07:17
Gadagung gadagung: Derfor går bogen lige i hjertet,21.03.2023 00:00,,https://politiken.dk/kultur/boger/art9237006/Derfor-g%C3%A5r-bogen-lige-i-hjertet,Politiken,https://politiken.dk/nyheder/,"Hold dig opdateret pÃ¥ de seneste nyheder pÃ¥ politiken.dk: Seneste Politiken, Seneste Danmark, Seneste Kultur og Seneste Internationalt. ",Politiken,https://politiken.dk/nyheder/,08.03.2023 07:17
Dansk direktør og svensk leder pillede nordmændenes maleri ned. Nu er debatten eksploderet,22.03.2023 00:00,,https://politiken.dk/kultur/art9239417/Dansk-direkt%C3%B8r-og-svensk-leder-pillede-nordm%C3%A6ndenes-maleri-ned.-Nu-er-debatten-eksploderet,Politiken,https://politiken.dk/nyheder/,"Hold dig opdateret pÃ¥ de seneste nyheder pÃ¥ politiken.dk: Seneste Politiken, Seneste Danmark, Seneste Kultur og Seneste Internationalt. ",Politiken,https://politiken.dk/nyheder/,08.03.2023 07:17
»Alle begyndte at løbe«: To personer mast ihjel efter panik under rapkoncert,09.03.2023 00:00,,https://politiken.dk/kultur/art9245975/To-personer-mast-ihjel-efter-panik-under-rapkoncert,Politiken,https://politiken.dk/nyheder/,"Hold dig opdateret pÃ¥ de seneste nyheder pÃ¥ politiken.dk: Seneste Politiken, Seneste Danmark, Seneste Kultur og Seneste Internationalt. ",Politiken,https://politiken.dk/nyheder/,08.03.2023 07:17
5 hjerter: Selvfølgelig varer lykken ikke ved. Selvfølgelig ender det med vold,09.03.2023 00:00,,https://politiken.dk/kultur/boger/boganmeldelser/skonlitteratur_boger/art9232115/Selvf%C3%B8lgelig-varer-lykken-ikke-ved.-Selvf%C3%B8lgelig-ender-det-med-vold,Politiken,https://politiken.dk/nyheder/,"Hold dig opdateret pÃ¥ de seneste nyheder pÃ¥ politiken.dk: Seneste Politiken, Seneste Danmark, Seneste Kultur og Seneste Internationalt. ",Politiken,https://politiken.dk/nyheder/,08.03.2023 07:17
Hun kender til langt flere end 50 måder at skride fra sin elsker på,09.03.2023 00:00,,https://politiken.dk/kultur/musik/art9223862/Hun-kender-til-langt-flere-end-50-m%C3%A5der-at-skride-fra-sin-elsker-p%C3%A5,Politiken,https://politiken.dk/nyheder/,"Hold dig opdateret pÃ¥ de seneste nyheder pÃ¥ politiken.dk: Seneste Politiken, Seneste Danmark, Seneste Kultur og Seneste Internationalt. ",Politiken,https://politiken.dk/nyheder/,08.03.2023 07:17
Internationalt topnavn er kommet til København: »Jeg har stor respekt for deres personlighed i orkestret«,09.03.2023 00:00,,https://politiken.dk/kultur/art9232387/%C2%BBJeg-har-stor-respekt-for-deres-personlighed-i-orkestret%C2%AB,Politiken,https://politiken.dk/nyheder/,"Hold dig opdateret pÃ¥ de seneste nyheder pÃ¥ politiken.dk: Seneste Politiken, Seneste Danmark, Seneste Kultur og Seneste Internationalt. ",Politiken,https://politiken.dk/nyheder/,08.03.2023 07:17
Hvorfor skulle mor skæres ud af familieportrættet?,09.03.2023 00:00,,https://politiken.dk/kultur/kunst/art9215889/Hvorfor-skulle-mor-sk%C3%A6res-ud-af-familieportr%C3%A6ttet,Politiken,https://politiken.dk/nyheder/,"Hold dig opdateret pÃ¥ de seneste nyheder pÃ¥ politiken.dk: Seneste Politiken, Seneste Danmark, Seneste Kultur og Seneste Internationalt. ",Politiken,https://politiken.dk/nyheder/,08.03.2023 07:17
"Når hun sammenligner kussen med en pandestegt fisk, bliver det altså for absurd",09.03.2023 00:00,,https://politiken.dk/kultur/boger/boganmeldelser/skonlitteratur_boger/art9235015/N%C3%A5r-hun-sammenligner-kussen-med-en-pandestegt-fisk-bliver-det-alts%C3%A5-for-absurd,Politiken,https://politiken.dk/nyheder/,"Hold dig opdateret pÃ¥ de seneste nyheder pÃ¥ politiken.dk: Seneste Politiken, Seneste Danmark, Seneste Kultur og Seneste Internationalt. ",Politiken,https://politiken.dk/nyheder/,08.03.2023 07:17
Det er umådeligt meget hårdere at se børnene blive stemt fra bagedyst end de voksne,09.03.2023 00:00,,https://politiken.dk/kultur/set_og_hoert/art9187900/Det-er-um%C3%A5deligt-meget-h%C3%A5rdere-at-se-b%C3%B8rnene-blive-stemt-fra-bagedyst-end-de-voksne,Politiken,https://politiken.dk/nyheder/,"Hold dig opdateret pÃ¥ de seneste nyheder pÃ¥ politiken.dk: Seneste Politiken, Seneste Danmark, Seneste Kultur og Seneste Internationalt. ",Politiken,https://politiken.dk/nyheder/,08.03.2023 07:17
"Henrik Palle: Der mangler sex, der mangler drugs, der mangler rock-n-roll",09.03.2023 00:00,,https://politiken.dk/kultur/film_og_tv/art9195717/Der-mangler-sex-der-mangler-drugs-der-mangler-rock%E2%80%99n%E2%80%99roll,Politiken,https://politiken.dk/nyheder/,"Hold dig opdateret pÃ¥ de seneste nyheder pÃ¥ politiken.dk: Seneste Politiken, Seneste Danmark, Seneste Kultur og Seneste Internationalt. ",Politiken,https://politiken.dk/nyheder/,08.03.2023 07:17
Provokunstner erkender hærværk på Jorn-maleri og accepterer millionkrav,09.03.2023 00:00,,https://politiken.dk/kultur/art9245735/Provokunstner-erkender-h%C3%A6rv%C3%A6rk-p%C3%A5-Jorn-maleri-og-accepterer-millionkrav,Politiken,https://politiken.dk/nyheder/,"Hold dig opdateret pÃ¥ de seneste nyheder pÃ¥ politiken.dk: Seneste Politiken, Seneste Danmark, Seneste Kultur og Seneste Internationalt. ",Politiken,https://politiken.dk/nyheder/,08.03.2023 07:17
Berlingske frifindes i strid med kunstner,09.03.2023 00:00,,https://politiken.dk/kultur/medier/art9245215/Berlingske-frifindes-i-strid-med-kunstner,Politiken,https://politiken.dk/nyheder/,"Hold dig opdateret pÃ¥ de seneste nyheder pÃ¥ politiken.dk: Seneste Politiken, Seneste Danmark, Seneste Kultur og Seneste Internationalt. ",Politiken,https://politiken.dk/nyheder/,08.03.2023 07:17
"Her er man aldrig rigtig en del af festen, og så fordamper interessen",09.03.2023 00:00,,https://politiken.dk/kultur/kunst/art9237834/Her-er-man-aldrig-rigtig-en-del-af-festen-og-s%C3%A5-fordamper-interessen,Politiken,https://politiken.dk/nyheder/,"Hold dig opdateret pÃ¥ de seneste nyheder pÃ¥ politiken.dk: Seneste Politiken, Seneste Danmark, Seneste Kultur og Seneste Internationalt. ",Politiken,https://politiken.dk/nyheder/,08.03.2023 07:17
Syv mennesker går mod den samme togstation. De vil alle dø,09.03.2023 00:00,,https://politiken.dk/kultur/boger/boganmeldelser/skonlitteratur_boger/art9235075/Syv-mennesker-g%C3%A5r-mod-den-samme-togstation.-De-vil-alle-d%C3%B8,Politiken,https://politiken.dk/nyheder/,"Hold dig opdateret pÃ¥ de seneste nyheder pÃ¥ politiken.dk: Seneste Politiken, Seneste Danmark, Seneste Kultur og Seneste Internationalt. ",Politiken,https://politiken.dk/nyheder/,08.03.2023 07:17
Kritikere brugte fladtrykt konge som argument mod at afskaffe stort begyndelsesbogstav i navneord,09.03.2023 00:00,,https://politiken.dk/kultur/art9128358/Kritikere-brugte-fladtrykt-konge-som-argument-mod-at-afskaffe-stort-begyndelsesbogstav-i-navneord,Politiken,https://politiken.dk/nyheder/,"Hold dig opdateret pÃ¥ de seneste nyheder pÃ¥ politiken.dk: Seneste Politiken, Seneste Danmark, Seneste Kultur og Seneste Internationalt. ",Politiken,https://politiken.dk/nyheder/,08.03.2023 07:17
De fjernede hendes venner og hendes mand. De truer med at fængsle hende. Alligevel udgiver hun bogen,09.03.2023 00:00,,https://politiken.dk/kultur/art9162332/De-fjernede-hendes-venner-og-hendes-mand.-De-truer-med-at-f%C3%A6ngsle-hende.-Alligevel-udgiver-hun-bogen,Politiken,https://politiken.dk/nyheder/,"Hold dig opdateret pÃ¥ de seneste nyheder pÃ¥ politiken.dk: Seneste Politiken, Seneste Danmark, Seneste Kultur og Seneste Internationalt. ",Politiken,https://politiken.dk/nyheder/,08.03.2023 07:17
Lynyrd Skynyrds sidste oprindelige medlem er død,06.03.2023 00:00,,https://politiken.dk/kultur/musik/art9244262/Lynyrd-Skynyrds-sidste-oprindelige-medlem-er-d%C3%B8d,Politiken,https://politiken.dk/nyheder/,"Hold dig opdateret pÃ¥ de seneste nyheder pÃ¥ politiken.dk: Seneste Politiken, Seneste Danmark, Seneste Kultur og Seneste Internationalt. ",Politiken,https://politiken.dk/nyheder/,08.03.2023 07:17
"Whistleblower afleverer lydfil, der belaster Jon Stephensen",06.03.2023 00:00,,https://politiken.dk/kultur/art9244162/Whistleblower-afleverer-lydfil-der-belaster-Jon-Stephensen,Politiken,https://politiken.dk/nyheder/,"Hold dig opdateret pÃ¥ de seneste nyheder pÃ¥ politiken.dk: Seneste Politiken, Seneste Danmark, Seneste Kultur og Seneste Internationalt. ",Politiken,https://politiken.dk/nyheder/,08.03.2023 07:17
Gnags-guitaristen Per Christian Frost er død,06.03.2023 00:00,,https://politiken.dk/kultur/musik/art9244200/Gnags-guitaristen-Per-Christian-Frost-er-d%C3%B8d,Politiken,https://politiken.dk/nyheder/,"Hold dig opdateret pÃ¥ de seneste nyheder pÃ¥ politiken.dk: Seneste Politiken, Seneste Danmark, Seneste Kultur og Seneste Internationalt. ",Politiken,https://politiken.dk/nyheder/,08.03.2023 07:17
"Nyt museum i København har færten af noget fedt, men har ikke helt knækket koden",05.03.2023 00:00,,https://politiken.dk/kultur/art9191243/Nyt-museum-i-K%C3%B8benhavn-har-f%C3%A6rten-af-noget-fedt-men-har-ikke-helt-kn%C3%A6kket-koden,Politiken,https://politiken.dk/nyheder/,"Hold dig opdateret pÃ¥ de seneste nyheder pÃ¥ politiken.dk: Seneste Politiken, Seneste Danmark, Seneste Kultur og Seneste Internationalt. ",Politiken,https://politiken.dk/nyheder/,08.03.2023 07:17
"Der er så meget energi på deres album, at det opvejer fraværet af noget rigtig originalt",05.03.2023 00:00,,https://politiken.dk/kultur/art9237965/Der-er-s%C3%A5-meget-energi-p%C3%A5-deres-album-at-det-opvejer-frav%C3%A6ret-af-noget-rigtig-originalt,Politiken,https://politiken.dk/nyheder/,"Hold dig opdateret pÃ¥ de seneste nyheder pÃ¥ politiken.dk: Seneste Politiken, Seneste Danmark, Seneste Kultur og Seneste Internationalt. ",Politiken,https://politiken.dk/nyheder/,08.03.2023 07:17
Steffen Grams gammeldags journalistik er som en Gammel Dansk om morgenen,05.03.2023 00:00,,https://politiken.dk/kultur/set_og_hoert/art9187899/Steffen-Grams-gammeldags-journalistik-er-som-en-Gammel-Dansk-om-morgenen,Politiken,https://politiken.dk/nyheder/,"Hold dig opdateret pÃ¥ de seneste nyheder pÃ¥ politiken.dk: Seneste Politiken, Seneste Danmark, Seneste Kultur og Seneste Internationalt. ",Politiken,https://politiken.dk/nyheder/,08.03.2023 07:17
I stedet for at tage mine venners kritik til mig er jeg langsomt gledet ud af folks liv,05.03.2023 00:00,,https://politiken.dk/kultur/art9206266/I-stedet-for-at-tage-mine-venners-kritik-til-mig-er-jeg-langsomt-gledet-ud-af-folks-liv,Politiken,https://politiken.dk/nyheder/,"Hold dig opdateret pÃ¥ de seneste nyheder pÃ¥ politiken.dk: Seneste Politiken, Seneste Danmark, Seneste Kultur og Seneste Internationalt. ",Politiken,https://politiken.dk/nyheder/,08.03.2023 07:17
Verden set i en rus: Ny roman er en syret opløsning af grænser,05.03.2023 00:00,,https://politiken.dk/kultur/boger/art9214042/Ny-roman-er-en-syret-opl%C3%B8sning-af-gr%C3%A6nser,Politiken,https://politiken.dk/nyheder/,"Hold dig opdateret pÃ¥ de seneste nyheder pÃ¥ politiken.dk: Seneste Politiken, Seneste Danmark, Seneste Kultur og Seneste Internationalt. ",Politiken,https://politiken.dk/nyheder/,08.03.2023 07:17
"Ã h, de gode gamle dage i 1998. Bortset fra, at de slet ikke var så gode endda",05.03.2023 00:00,,https://politiken.dk/kultur/set_og_hoert/art9187898/%C3%85h-de-gode-gamle-dage-i-1998.-Bortset-fra-at-de-slet-ikke-var-s%C3%A5-gode-endda,Politiken,https://politiken.dk/nyheder/,"Hold dig opdateret pÃ¥ de seneste nyheder pÃ¥ politiken.dk: Seneste Politiken, Seneste Danmark, Seneste Kultur og Seneste Internationalt. ",Politiken,https://politiken.dk/nyheder/,08.03.2023 07:17
Så er det blevet bibliotekarernes tur til at spille helte,05.03.2023 00:00,,https://politiken.dk/kultur/boger/boganmeldelser/skonlitteratur_boger/art9203611/S%C3%A5-er-det-blevet-bibliotekarernes-tur-til-at-spille-helte,Politiken,https://politiken.dk/nyheder/,"Hold dig opdateret pÃ¥ de seneste nyheder pÃ¥ politiken.dk: Seneste Politiken, Seneste Danmark, Seneste Kultur og Seneste Internationalt. ",Politiken,https://politiken.dk/nyheder/,08.03.2023 07:17
