title,published,text,link,og:site_name,og:url,site_description,name,url,scrape_time
"To gange har jeg kastet op, fordi jeg troede, han var ved at forlade mig",10.03.2023 00:00,,https://politiken.dk/ibyen/art9246507/To-gange-har-jeg-kastet-op-fordi-jeg-troede-han-var-ved-at-forlade-mig,Politiken,https://politiken.dk/nyheder/,"Hold dig opdateret pÃ¥ de seneste nyheder pÃ¥ politiken.dk: Seneste Politiken, Seneste Danmark, Seneste Kultur og Seneste Internationalt. ",Politiken,https://politiken.dk/nyheder/,08.03.2023 07:17
Forældre er ikke altafgørende for deres børns lykke,10.03.2023 00:00,,https://politiken.dk/debat/kroniken/art9235619/For%C3%A6ldre-er-ikke-altafg%C3%B8rende-for-deres-b%C3%B8rns-lykke,Politiken,https://politiken.dk/nyheder/,"Hold dig opdateret pÃ¥ de seneste nyheder pÃ¥ politiken.dk: Seneste Politiken, Seneste Danmark, Seneste Kultur og Seneste Internationalt. ",Politiken,https://politiken.dk/nyheder/,08.03.2023 07:17
Pape og Olsen Dyhr i fælles kritik af regeringen: Statsministeren bør overtage tøjlerne på klimaområdet,11.03.2023 00:00,,https://politiken.dk/indland/politik/art9238987/Pape-og-Olsen-Dyhr-i-f%C3%A6lles-kritik-af-regeringen-Statsministeren-b%C3%B8r-overtage-t%C3%B8jlerne-p%C3%A5-klimaomr%C3%A5det,Politiken,https://politiken.dk/nyheder/,"Hold dig opdateret pÃ¥ de seneste nyheder pÃ¥ politiken.dk: Seneste Politiken, Seneste Danmark, Seneste Kultur og Seneste Internationalt. ",Politiken,https://politiken.dk/nyheder/,08.03.2023 07:17
"Hvor vi dog bedrog os selv, da vi skulle begrunde Danmarks krigsdeltagelse",11.03.2023 00:00,,https://politiken.dk/debat/ledere/art9246406/Hvor-vi-dog-bedrog-os-selv-da-vi-skulle-begrunde-Danmarks-krigsdeltagelse,Politiken,https://politiken.dk/nyheder/,"Hold dig opdateret pÃ¥ de seneste nyheder pÃ¥ politiken.dk: Seneste Politiken, Seneste Danmark, Seneste Kultur og Seneste Internationalt. ",Politiken,https://politiken.dk/nyheder/,08.03.2023 07:17
USAs centralbank venter højere og hurtigere rentestigninger,11.03.2023 00:00,,https://politiken.dk/oekonomi/art9247914/USAs-centralbank-venter-h%C3%B8jere-og-hurtigere-rentestigninger,Politiken,https://politiken.dk/nyheder/,"Hold dig opdateret pÃ¥ de seneste nyheder pÃ¥ politiken.dk: Seneste Politiken, Seneste Danmark, Seneste Kultur og Seneste Internationalt. ",Politiken,https://politiken.dk/nyheder/,08.03.2023 07:17
Sverige håber på Nato-medlemskab til sommer,11.03.2023 00:00,,https://politiken.dk/udland/art9247885/Sverige-h%C3%A5ber-p%C3%A5-Nato-medlemskab-til-sommer,Politiken,https://politiken.dk/nyheder/,"Hold dig opdateret pÃ¥ de seneste nyheder pÃ¥ politiken.dk: Seneste Politiken, Seneste Danmark, Seneste Kultur og Seneste Internationalt. ",Politiken,https://politiken.dk/nyheder/,08.03.2023 07:17
Derfor holder Mette Frederiksen ikke selv undskyldningstale,11.03.2023 00:00,,https://politiken.dk/indland/art9247894/Derfor-holder-Mette-Frederiksen-ikke-selv-undskyldningstale,Politiken,https://politiken.dk/nyheder/,"Hold dig opdateret pÃ¥ de seneste nyheder pÃ¥ politiken.dk: Seneste Politiken, Seneste Danmark, Seneste Kultur og Seneste Internationalt. ",Politiken,https://politiken.dk/nyheder/,08.03.2023 07:17
Lektor forventer afstemning om samlet mæglingsforslag til april,12.03.2023 00:00,,https://politiken.dk/indland/art9247863/Lektor-forventer-afstemning-om-samlet-m%C3%A6glingsforslag-til-april,Politiken,https://politiken.dk/nyheder/,"Hold dig opdateret pÃ¥ de seneste nyheder pÃ¥ politiken.dk: Seneste Politiken, Seneste Danmark, Seneste Kultur og Seneste Internationalt. ",Politiken,https://politiken.dk/nyheder/,08.03.2023 07:17
"Tidligere ansatte langer ud efter Jon Stephensen: Han er egenrådig, arrogant og grænseoverskridende",12.03.2023 00:00,,https://politiken.dk/kultur/art9244877/Tidligere-ansatte-langer-ud-efter-Jon-Stephensen-Han-er-egenr%C3%A5dig-arrogant-og-gr%C3%A6nseoverskridende,Politiken,https://politiken.dk/nyheder/,"Hold dig opdateret pÃ¥ de seneste nyheder pÃ¥ politiken.dk: Seneste Politiken, Seneste Danmark, Seneste Kultur og Seneste Internationalt. ",Politiken,https://politiken.dk/nyheder/,08.03.2023 07:17
To bortførte amerikanere i Mexico er fundet døde,12.03.2023 00:00,,https://politiken.dk/udland/art9247827/To-bortf%C3%B8rte-amerikanere-i-Mexico-er-fundet-d%C3%B8de,Politiken,https://politiken.dk/nyheder/,"Hold dig opdateret pÃ¥ de seneste nyheder pÃ¥ politiken.dk: Seneste Politiken, Seneste Danmark, Seneste Kultur og Seneste Internationalt. ",Politiken,https://politiken.dk/nyheder/,08.03.2023 07:17
Forligsmand opfordrer OK-parter til at fremskynde forhandlinger,12.03.2023 00:00,,https://politiken.dk/indland/art9247881/Forligsmand-opfordrer-OK-parter-til-at-fremskynde-forhandlinger,Politiken,https://politiken.dk/nyheder/,"Hold dig opdateret pÃ¥ de seneste nyheder pÃ¥ politiken.dk: Seneste Politiken, Seneste Danmark, Seneste Kultur og Seneste Internationalt. ",Politiken,https://politiken.dk/nyheder/,08.03.2023 07:17
En bomstærk film om fortidens ustyrlige danske kvinder,13.03.2023 00:00,,https://politiken.dk/kultur/film_og_tv/art9204034/En-bomst%C3%A6rk-film-om-fortidens-ustyrlige-danske-kvinder,Politiken,https://politiken.dk/nyheder/,"Hold dig opdateret pÃ¥ de seneste nyheder pÃ¥ politiken.dk: Seneste Politiken, Seneste Danmark, Seneste Kultur og Seneste Internationalt. ",Politiken,https://politiken.dk/nyheder/,08.03.2023 07:17
Han bliver kaldt Tyrkiets Gandhi. Nu vil han prøve at vippe Erdogan af pinden,13.03.2023 00:00,,https://politiken.dk/udland/art9246095/Han-bliver-kaldt-Tyrkiets-Gandhi.-Nu-vil-han-pr%C3%B8ve-at-vippe-Erdogan-af-pinden,Politiken,https://politiken.dk/nyheder/,"Hold dig opdateret pÃ¥ de seneste nyheder pÃ¥ politiken.dk: Seneste Politiken, Seneste Danmark, Seneste Kultur og Seneste Internationalt. ",Politiken,https://politiken.dk/nyheder/,08.03.2023 07:17
Kender du byen? Den har to navne og selvstyre,14.03.2023 00:00,,https://politiken.dk/rejser/art9232192/Kender-du-byen-Den-har-to-navne-og-selvstyre,Politiken,https://politiken.dk/nyheder/,"Hold dig opdateret pÃ¥ de seneste nyheder pÃ¥ politiken.dk: Seneste Politiken, Seneste Danmark, Seneste Kultur og Seneste Internationalt. ",Politiken,https://politiken.dk/nyheder/,08.03.2023 07:17
Dobbeltdrab ryster naboer i Taastrup: »Det er tragisk og forfærdeligt«,14.03.2023 00:00,,https://politiken.dk/indland/kobenhavn/art9246220/Dobbeltdrab-ryster-naboer-i-Taastrup-%C2%BBDet-er-tragisk-og-forf%C3%A6rdeligt%C2%AB,Politiken,https://politiken.dk/nyheder/,"Hold dig opdateret pÃ¥ de seneste nyheder pÃ¥ politiken.dk: Seneste Politiken, Seneste Danmark, Seneste Kultur og Seneste Internationalt. ",Politiken,https://politiken.dk/nyheder/,08.03.2023 07:17
Den britiske regering har ikke opgivet Rwanda-plan. Tværtimod,14.03.2023 00:00,,https://politiken.dk/udland/art9245841/Den-britiske-regering-har-ikke-opgivet-Rwanda-plan.-Tv%C3%A6rtimod,Politiken,https://politiken.dk/nyheder/,"Hold dig opdateret pÃ¥ de seneste nyheder pÃ¥ politiken.dk: Seneste Politiken, Seneste Danmark, Seneste Kultur og Seneste Internationalt. ",Politiken,https://politiken.dk/nyheder/,08.03.2023 07:17
Man skal være belagt med teflon for ikke at blive berørt,15.03.2023 00:00,,https://politiken.dk/kultur/art9236111/Man-skal-v%C3%A6re-belagt-med-teflon-for-ikke-at-blive-ber%C3%B8rt,Politiken,https://politiken.dk/nyheder/,"Hold dig opdateret pÃ¥ de seneste nyheder pÃ¥ politiken.dk: Seneste Politiken, Seneste Danmark, Seneste Kultur og Seneste Internationalt. ",Politiken,https://politiken.dk/nyheder/,08.03.2023 07:17
Explainer: Hjernedød og hjertedød organdonor - hvad er forskellen?,15.03.2023 00:00,,https://politiken.dk/forbrugogliv/sundhedogmotion/art9246305/Hjerned%C3%B8d-og-hjerted%C3%B8d-organdonor-%E2%80%93-hvad-er-forskellen,Politiken,https://politiken.dk/nyheder/,"Hold dig opdateret pÃ¥ de seneste nyheder pÃ¥ politiken.dk: Seneste Politiken, Seneste Danmark, Seneste Kultur og Seneste Internationalt. ",Politiken,https://politiken.dk/nyheder/,08.03.2023 07:17
17-årig har meldt sig selv i sag om dobbeltdrab i Taastrup,16.03.2023 00:00,,https://politiken.dk/indland/art9247619/17-%C3%A5rig-har-meldt-sig-selv-i-sag-om-dobbeltdrab-i-Taastrup,Politiken,https://politiken.dk/nyheder/,"Hold dig opdateret pÃ¥ de seneste nyheder pÃ¥ politiken.dk: Seneste Politiken, Seneste Danmark, Seneste Kultur og Seneste Internationalt. ",Politiken,https://politiken.dk/nyheder/,08.03.2023 07:17
Ibyen guider: Her skal du fejre kvindernes kampdag,16.03.2023 00:00,,https://politiken.dk/ibyen/art9223044/Ibyen-guider-Her-skal-du-fejre-kvindernes-kampdag,Politiken,https://politiken.dk/nyheder/,"Hold dig opdateret pÃ¥ de seneste nyheder pÃ¥ politiken.dk: Seneste Politiken, Seneste Danmark, Seneste Kultur og Seneste Internationalt. ",Politiken,https://politiken.dk/nyheder/,08.03.2023 07:17
Uligheden vokser i Danmark: Dem med de højeste indkomster tjener mere og mere,16.03.2023 00:00,,https://politiken.dk/indland/art9246064/Uligheden-vokser-i-Danmark-Dem-med-de-h%C3%B8jeste-indkomster-tjener-mere-og-mere,Politiken,https://politiken.dk/nyheder/,"Hold dig opdateret pÃ¥ de seneste nyheder pÃ¥ politiken.dk: Seneste Politiken, Seneste Danmark, Seneste Kultur og Seneste Internationalt. ",Politiken,https://politiken.dk/nyheder/,08.03.2023 07:17
Dansk lyspanel skal hjælpe Andreas Mogensen og andre astronauter med at sove i rummet,16.03.2023 00:00,,https://politiken.dk/indland/art9244503/Dansk-lyspanel-skal-hj%C3%A6lpe-Andreas-Mogensen-og-andre-astronauter-med-at-sove-i-rummet,Politiken,https://politiken.dk/nyheder/,"Hold dig opdateret pÃ¥ de seneste nyheder pÃ¥ politiken.dk: Seneste Politiken, Seneste Danmark, Seneste Kultur og Seneste Internationalt. ",Politiken,https://politiken.dk/nyheder/,08.03.2023 07:17
"Anbragt: »Der var også nogle, der kom ind i et bur ligesom et dyr«",16.03.2023 00:00,,https://politiken.dk/indland/art9246195/Anbragt-%C2%BBDer-var-ogs%C3%A5-nogle-der-kom-ind-i-et-bur-ligesom-et-dyr%C2%AB,Politiken,https://politiken.dk/nyheder/,"Hold dig opdateret pÃ¥ de seneste nyheder pÃ¥ politiken.dk: Seneste Politiken, Seneste Danmark, Seneste Kultur og Seneste Internationalt. ",Politiken,https://politiken.dk/nyheder/,08.03.2023 07:17
Ansat i styrelse har snaget i tusinders dybt personlige oplysninger,16.03.2023 00:00,,https://politiken.dk/indland/art9247373/Ansat-i-styrelse-har-snaget-i-tusinders-dybt-personlige-oplysninger,Politiken,https://politiken.dk/nyheder/,"Hold dig opdateret pÃ¥ de seneste nyheder pÃ¥ politiken.dk: Seneste Politiken, Seneste Danmark, Seneste Kultur og Seneste Internationalt. ",Politiken,https://politiken.dk/nyheder/,08.03.2023 07:17
"Lyt til Valget: Med Mette Frederiksen på Balkan - Leninstatuer, flygtninge og kortegekørsel",17.03.2023 00:00,,https://politiken.dk/podcast/valget/art9247385/Med-Mette-Frederiksen-p%C3%A5-Balkan-%E2%80%93-Leninstatuer-flygtninge-og-kortegek%C3%B8rsel,Politiken,https://politiken.dk/nyheder/,"Hold dig opdateret pÃ¥ de seneste nyheder pÃ¥ politiken.dk: Seneste Politiken, Seneste Danmark, Seneste Kultur og Seneste Internationalt. ",Politiken,https://politiken.dk/nyheder/,08.03.2023 07:17
Statsministeriet forbyder ansatte at have TikTok på tjenestetelefoner,17.03.2023 00:00,,https://politiken.dk/viden/Tech/art9247240/Statsministeriet-forbyder-ansatte-at-have-TikTok-p%C3%A5-tjenestetelefoner,Politiken,https://politiken.dk/nyheder/,"Hold dig opdateret pÃ¥ de seneste nyheder pÃ¥ politiken.dk: Seneste Politiken, Seneste Danmark, Seneste Kultur og Seneste Internationalt. ",Politiken,https://politiken.dk/nyheder/,08.03.2023 07:17
"Et traume fra nattelivet rammer mig, når jeg går i fitness. Smider en picker mig ud nu?",17.03.2023 00:00,,https://politiken.dk/ibyen/art9227735/Et-traume-fra-nattelivet-rammer-mig-n%C3%A5r-jeg-g%C3%A5r-i-fitness.-Smider-en-picker-mig-ud-nu,Politiken,https://politiken.dk/nyheder/,"Hold dig opdateret pÃ¥ de seneste nyheder pÃ¥ politiken.dk: Seneste Politiken, Seneste Danmark, Seneste Kultur og Seneste Internationalt. ",Politiken,https://politiken.dk/nyheder/,08.03.2023 07:17
Forlig i byggeriet: Flere penge til udenlandske arbejdere,18.03.2023 00:00,,https://politiken.dk/indland/art9247075/Flere-penge-til-udenlandske-arbejdere,Politiken,https://politiken.dk/nyheder/,"Hold dig opdateret pÃ¥ de seneste nyheder pÃ¥ politiken.dk: Seneste Politiken, Seneste Danmark, Seneste Kultur og Seneste Internationalt. ",Politiken,https://politiken.dk/nyheder/,08.03.2023 07:17
Tilsyn undersøger mistanker om insiderhandel på energimarkedet,03.03.2023 00:00,,https://politiken.dk/indland/art9248200/Tilsyn-unders%C3%B8ger-mistanker-om-insiderhandel-p%C3%A5-energimarkedet,Politiken,https://politiken.dk/nyheder/,"Hold dig opdateret pÃ¥ de seneste nyheder pÃ¥ politiken.dk: Seneste Politiken, Seneste Danmark, Seneste Kultur og Seneste Internationalt. ",Politiken,https://politiken.dk/nyheder/,08.03.2023 07:17
»Der er mere rødstrømpe i de yngre«: Unge kvinder vil have kontrol over deres økonomi,01.03.2023 00:00,,https://politiken.dk/indland/art9241225/%C2%BBDer-er-mere-r%C3%B8dstr%C3%B8mpe-i-de-yngre%C2%AB-Unge-kvinder-vil-have-kontrol-over-deres-%C3%B8konomi,Politiken,https://politiken.dk/nyheder/,"Hold dig opdateret pÃ¥ de seneste nyheder pÃ¥ politiken.dk: Seneste Politiken, Seneste Danmark, Seneste Kultur og Seneste Internationalt. ",Politiken,https://politiken.dk/nyheder/,08.03.2023 07:17
SF foreslår at indføre fodlænke når tilhold bliver brudt,02.03.2023 00:00,,https://politiken.dk/indland/art9248121/SF-foresl%C3%A5r-at-indf%C3%B8re-fodl%C3%A6nke-n%C3%A5r-tilhold-bliver-brudt,Politiken,https://politiken.dk/nyheder/,"Hold dig opdateret pÃ¥ de seneste nyheder pÃ¥ politiken.dk: Seneste Politiken, Seneste Danmark, Seneste Kultur og Seneste Internationalt. ",Politiken,https://politiken.dk/nyheder/,08.03.2023 07:17
»PAS NU PÃ !!!«: Politikredse advarer om meget glatte veje,02.03.2023 00:00,,https://politiken.dk/indland/art9248123/Politikredse-advarer-om-meget-glatte-veje,Politiken,https://politiken.dk/nyheder/,"Hold dig opdateret pÃ¥ de seneste nyheder pÃ¥ politiken.dk: Seneste Politiken, Seneste Danmark, Seneste Kultur og Seneste Internationalt. ",Politiken,https://politiken.dk/nyheder/,08.03.2023 07:17
Børns Vilkår: Ofre for svigt får sværere ved at søge erstatning,09.03.2023 00:00,,https://politiken.dk/indland/art9248051/Ofre-for-svigt-f%C3%A5r-sv%C3%A6rere-ved-at-s%C3%B8ge-erstatning,Politiken,https://politiken.dk/nyheder/,"Hold dig opdateret pÃ¥ de seneste nyheder pÃ¥ politiken.dk: Seneste Politiken, Seneste Danmark, Seneste Kultur og Seneste Internationalt. ",Politiken,https://politiken.dk/nyheder/,08.03.2023 07:17
Mandlige chefer i det private tjener stadig mere end kvinder,09.03.2023 00:00,,https://politiken.dk/indland/art9248021/Mandlige-chefer-i-det-private-tjener-stadig-mere-end-kvinder,Politiken,https://politiken.dk/nyheder/,"Hold dig opdateret pÃ¥ de seneste nyheder pÃ¥ politiken.dk: Seneste Politiken, Seneste Danmark, Seneste Kultur og Seneste Internationalt. ",Politiken,https://politiken.dk/nyheder/,08.03.2023 07:17
Pape og Olsen Dyhr i fælles kritik af regeringen: Statsministeren bør overtage tøjlerne på klimaområdet,11.03.2023 00:00,,https://politiken.dk/indland/politik/art9238987/Pape-og-Olsen-Dyhr-i-f%C3%A6lles-kritik-af-regeringen-Statsministeren-b%C3%B8r-overtage-t%C3%B8jlerne-p%C3%A5-klimaomr%C3%A5det,Politiken,https://politiken.dk/nyheder/,"Hold dig opdateret pÃ¥ de seneste nyheder pÃ¥ politiken.dk: Seneste Politiken, Seneste Danmark, Seneste Kultur og Seneste Internationalt. ",Politiken,https://politiken.dk/nyheder/,08.03.2023 07:17
Derfor holder Mette Frederiksen ikke selv undskyldningstale,11.03.2023 00:00,,https://politiken.dk/indland/art9247894/Derfor-holder-Mette-Frederiksen-ikke-selv-undskyldningstale,Politiken,https://politiken.dk/nyheder/,"Hold dig opdateret pÃ¥ de seneste nyheder pÃ¥ politiken.dk: Seneste Politiken, Seneste Danmark, Seneste Kultur og Seneste Internationalt. ",Politiken,https://politiken.dk/nyheder/,08.03.2023 07:17
Lektor forventer afstemning om samlet mæglingsforslag til april,12.03.2023 00:00,,https://politiken.dk/indland/art9247863/Lektor-forventer-afstemning-om-samlet-m%C3%A6glingsforslag-til-april,Politiken,https://politiken.dk/nyheder/,"Hold dig opdateret pÃ¥ de seneste nyheder pÃ¥ politiken.dk: Seneste Politiken, Seneste Danmark, Seneste Kultur og Seneste Internationalt. ",Politiken,https://politiken.dk/nyheder/,08.03.2023 07:17
Forligsmand opfordrer OK-parter til at fremskynde forhandlinger,12.03.2023 00:00,,https://politiken.dk/indland/art9247881/Forligsmand-opfordrer-OK-parter-til-at-fremskynde-forhandlinger,Politiken,https://politiken.dk/nyheder/,"Hold dig opdateret pÃ¥ de seneste nyheder pÃ¥ politiken.dk: Seneste Politiken, Seneste Danmark, Seneste Kultur og Seneste Internationalt. ",Politiken,https://politiken.dk/nyheder/,08.03.2023 07:17
Dobbeltdrab ryster naboer i Taastrup: »Det er tragisk og forfærdeligt«,14.03.2023 00:00,,https://politiken.dk/indland/kobenhavn/art9246220/Dobbeltdrab-ryster-naboer-i-Taastrup-%C2%BBDet-er-tragisk-og-forf%C3%A6rdeligt%C2%AB,Politiken,https://politiken.dk/nyheder/,"Hold dig opdateret pÃ¥ de seneste nyheder pÃ¥ politiken.dk: Seneste Politiken, Seneste Danmark, Seneste Kultur og Seneste Internationalt. ",Politiken,https://politiken.dk/nyheder/,08.03.2023 07:17
17-årig har meldt sig selv i sag om dobbeltdrab i Taastrup,16.03.2023 00:00,,https://politiken.dk/indland/art9247619/17-%C3%A5rig-har-meldt-sig-selv-i-sag-om-dobbeltdrab-i-Taastrup,Politiken,https://politiken.dk/nyheder/,"Hold dig opdateret pÃ¥ de seneste nyheder pÃ¥ politiken.dk: Seneste Politiken, Seneste Danmark, Seneste Kultur og Seneste Internationalt. ",Politiken,https://politiken.dk/nyheder/,08.03.2023 07:17
Uligheden vokser i Danmark: Dem med de højeste indkomster tjener mere og mere,16.03.2023 00:00,,https://politiken.dk/indland/art9246064/Uligheden-vokser-i-Danmark-Dem-med-de-h%C3%B8jeste-indkomster-tjener-mere-og-mere,Politiken,https://politiken.dk/nyheder/,"Hold dig opdateret pÃ¥ de seneste nyheder pÃ¥ politiken.dk: Seneste Politiken, Seneste Danmark, Seneste Kultur og Seneste Internationalt. ",Politiken,https://politiken.dk/nyheder/,08.03.2023 07:17
Dansk lyspanel skal hjælpe Andreas Mogensen og andre astronauter med at sove i rummet,16.03.2023 00:00,,https://politiken.dk/indland/art9244503/Dansk-lyspanel-skal-hj%C3%A6lpe-Andreas-Mogensen-og-andre-astronauter-med-at-sove-i-rummet,Politiken,https://politiken.dk/nyheder/,"Hold dig opdateret pÃ¥ de seneste nyheder pÃ¥ politiken.dk: Seneste Politiken, Seneste Danmark, Seneste Kultur og Seneste Internationalt. ",Politiken,https://politiken.dk/nyheder/,08.03.2023 07:17
"Anbragt: »Der var også nogle, der kom ind i et bur ligesom et dyr«",16.03.2023 00:00,,https://politiken.dk/indland/art9246195/Anbragt-%C2%BBDer-var-ogs%C3%A5-nogle-der-kom-ind-i-et-bur-ligesom-et-dyr%C2%AB,Politiken,https://politiken.dk/nyheder/,"Hold dig opdateret pÃ¥ de seneste nyheder pÃ¥ politiken.dk: Seneste Politiken, Seneste Danmark, Seneste Kultur og Seneste Internationalt. ",Politiken,https://politiken.dk/nyheder/,08.03.2023 07:17
Ansat i styrelse har snaget i tusinders dybt personlige oplysninger,16.03.2023 00:00,,https://politiken.dk/indland/art9247373/Ansat-i-styrelse-har-snaget-i-tusinders-dybt-personlige-oplysninger,Politiken,https://politiken.dk/nyheder/,"Hold dig opdateret pÃ¥ de seneste nyheder pÃ¥ politiken.dk: Seneste Politiken, Seneste Danmark, Seneste Kultur og Seneste Internationalt. ",Politiken,https://politiken.dk/nyheder/,08.03.2023 07:17
Forlig i byggeriet: Flere penge til udenlandske arbejdere,18.03.2023 00:00,,https://politiken.dk/indland/art9247075/Flere-penge-til-udenlandske-arbejdere,Politiken,https://politiken.dk/nyheder/,"Hold dig opdateret pÃ¥ de seneste nyheder pÃ¥ politiken.dk: Seneste Politiken, Seneste Danmark, Seneste Kultur og Seneste Internationalt. ",Politiken,https://politiken.dk/nyheder/,08.03.2023 07:17
Retsordfører skal alligevel ikke betale 325.000 til fyret medarbejder,18.03.2023 00:00,,https://politiken.dk/indland/politik/art9246961/Retsordf%C3%B8rer-skal-alligevel-ikke-betale-325.000-til-fyret-medarbejder,Politiken,https://politiken.dk/nyheder/,"Hold dig opdateret pÃ¥ de seneste nyheder pÃ¥ politiken.dk: Seneste Politiken, Seneste Danmark, Seneste Kultur og Seneste Internationalt. ",Politiken,https://politiken.dk/nyheder/,08.03.2023 07:17
Flere fløj i februar: Pilen peger opad for SAS,18.03.2023 00:00,,https://politiken.dk/indland/art9246506/Pilen-peger-opad-for-SAS,Politiken,https://politiken.dk/nyheder/,"Hold dig opdateret pÃ¥ de seneste nyheder pÃ¥ politiken.dk: Seneste Politiken, Seneste Danmark, Seneste Kultur og Seneste Internationalt. ",Politiken,https://politiken.dk/nyheder/,08.03.2023 07:17
Politiet har skudt en hund ved en børnehave,20.03.2023 00:00,,https://politiken.dk/indland/art9246684/Politiet-har-skudt-en-hund-ved-en-b%C3%B8rnehave,Politiken,https://politiken.dk/nyheder/,"Hold dig opdateret pÃ¥ de seneste nyheder pÃ¥ politiken.dk: Seneste Politiken, Seneste Danmark, Seneste Kultur og Seneste Internationalt. ",Politiken,https://politiken.dk/nyheder/,08.03.2023 07:17
Det begyndte som en idé hos servicedirektøren. Nu har vvs- og elvirksomhed indført faste rammer inspireret af militæret,20.03.2023 00:00,,https://politiken.dk/indland/uddannelse/undervisningsprisen/art9229944/Det-begyndte-som-en-id%C3%A9-hos-servicedirekt%C3%B8ren.-Nu-har-vvs-og-elvirksomhed-indf%C3%B8rt-faste-rammer-inspireret-af-milit%C3%A6ret,Politiken,https://politiken.dk/nyheder/,"Hold dig opdateret pÃ¥ de seneste nyheder pÃ¥ politiken.dk: Seneste Politiken, Seneste Danmark, Seneste Kultur og Seneste Internationalt. ",Politiken,https://politiken.dk/nyheder/,08.03.2023 07:17
Poul Nyrups far blev stemplet som »moralsk åndssvag« og anbragt på anstalt: Undskyldning kan frigøre efterladte fra følelse af skam,21.03.2023 00:00,,https://politiken.dk/indland/art9246333/Undskyldning-kan-frig%C3%B8re-efterladte-fra-f%C3%B8lelse-af-skam,Politiken,https://politiken.dk/nyheder/,"Hold dig opdateret pÃ¥ de seneste nyheder pÃ¥ politiken.dk: Seneste Politiken, Seneste Danmark, Seneste Kultur og Seneste Internationalt. ",Politiken,https://politiken.dk/nyheder/,08.03.2023 07:17
"Her er Mette Frederiksens undskyldninger, siden hun blev statsminister",22.03.2023 00:00,,https://politiken.dk/indland/art9246101/Her-er-Mette-Frederiksens-undskyldninger-siden-hun-blev-statsminister,Politiken,https://politiken.dk/nyheder/,"Hold dig opdateret pÃ¥ de seneste nyheder pÃ¥ politiken.dk: Seneste Politiken, Seneste Danmark, Seneste Kultur og Seneste Internationalt. ",Politiken,https://politiken.dk/nyheder/,08.03.2023 07:17
Ballerup afprøver en ny grænseoverskridende strategi i kampen mod ulovlig brug af kolonihaver,23.03.2023 00:00,,https://politiken.dk/indland/art9222377/Ballerup-afpr%C3%B8ver-en-ny-gr%C3%A6nseoverskridende-strategi-i-kampen-mod-ulovlig-brug-af-kolonihaver,Politiken,https://politiken.dk/nyheder/,"Hold dig opdateret pÃ¥ de seneste nyheder pÃ¥ politiken.dk: Seneste Politiken, Seneste Danmark, Seneste Kultur og Seneste Internationalt. ",Politiken,https://politiken.dk/nyheder/,08.03.2023 07:17
"Efter 11 måneder har Casper Enemark fået en bankkonto - og han ved allerede, hvad han skal købe for de penge, der nu endelig tikker ind",09.03.2023 00:00,,https://politiken.dk/indland/art9244857/Efter-11-m%C3%A5neder-har-Casper-Enemark-f%C3%A5et-en-bankkonto-%E2%80%93-og-han-ved-allerede-hvad-han-skal-k%C3%B8be-for-de-penge-der-nu-endelig-tikker-ind,Politiken,https://politiken.dk/nyheder/,"Hold dig opdateret pÃ¥ de seneste nyheder pÃ¥ politiken.dk: Seneste Politiken, Seneste Danmark, Seneste Kultur og Seneste Internationalt. ",Politiken,https://politiken.dk/nyheder/,08.03.2023 07:17
"Endnu en fra Moderaterne i modvind: I dag bliver det afgjort, om retsordfører skal betale 400.000 kroner for uretmæssig fyring",09.03.2023 00:00,,https://politiken.dk/indland/art9245805/I-dag-bliver-det-afgjort-om-retsordf%C3%B8rer-skal-betale-400.000-kroner-for-uretm%C3%A6ssig-fyring,Politiken,https://politiken.dk/nyheder/,"Hold dig opdateret pÃ¥ de seneste nyheder pÃ¥ politiken.dk: Seneste Politiken, Seneste Danmark, Seneste Kultur og Seneste Internationalt. ",Politiken,https://politiken.dk/nyheder/,08.03.2023 07:17
»Det er så dumt«: Det kan ikke betale sig for Azad Ibrahim Ali at begynde som lærling trods mangel på faglært arbejdskraft,09.03.2023 00:00,,https://politiken.dk/indland/politik/art9223547/Det-kan-ikke-betale-sig-for-Azad-Ibrahim-Ali-at-begynde-som-l%C3%A6rling-trods-mangel-p%C3%A5-fagl%C3%A6rt-arbejdskraft,Politiken,https://politiken.dk/nyheder/,"Hold dig opdateret pÃ¥ de seneste nyheder pÃ¥ politiken.dk: Seneste Politiken, Seneste Danmark, Seneste Kultur og Seneste Internationalt. ",Politiken,https://politiken.dk/nyheder/,08.03.2023 07:17
Overblik: Sådan påvirker snevejret trafikken,09.03.2023 00:00,,https://politiken.dk/indland/art9245993/Overblik-S%C3%A5dan-p%C3%A5virker-snevejret-trafikken,Politiken,https://politiken.dk/nyheder/,"Hold dig opdateret pÃ¥ de seneste nyheder pÃ¥ politiken.dk: Seneste Politiken, Seneste Danmark, Seneste Kultur og Seneste Internationalt. ",Politiken,https://politiken.dk/nyheder/,08.03.2023 07:17
Borgerlige partier vender på en tallerken og indgår fængselsaftale med regeringen,09.03.2023 00:00,,https://politiken.dk/indland/art9245992/Borgerlige-partier-vender-p%C3%A5-en-tallerken-og-indg%C3%A5r-f%C3%A6ngselsaftale-med-regeringen,Politiken,https://politiken.dk/nyheder/,"Hold dig opdateret pÃ¥ de seneste nyheder pÃ¥ politiken.dk: Seneste Politiken, Seneste Danmark, Seneste Kultur og Seneste Internationalt. ",Politiken,https://politiken.dk/nyheder/,08.03.2023 07:17
