title,published,text,link,og:site_name,og:url,site_description,name,url,scrape_time
"Efter rugemor-dom: Nicolai Køster Rimvall håber, at han kan blive anerkendt som forælder",11.12.2033 00:00,,https://politiken.dk/indland/art9110802/Efter-rugemor-dom-Nicolai-K%C3%B8ster-Rimvall-h%C3%A5ber-at-han-kan-blive-anerkendt-som-for%C3%A6lder,Politiken,https://politiken.dk/nyheder/,"Hold dig opdateret pÃ¥ de seneste nyheder pÃ¥ politiken.dk: Seneste Politiken, Seneste Danmark, Seneste Kultur og Seneste Internationalt. ",Politiken,https://politiken.dk/nyheder/,11.12.2022 07:17
Twitter vil gøre blåt flueben dyrere for Apple-brugere,11.12.2043 00:00,,https://politiken.dk/viden/Tech/art9118171/Twitter-vil-g%C3%B8re-bl%C3%A5t-flueben-dyrere-for-Apple-brugere,Politiken,https://politiken.dk/nyheder/,"Hold dig opdateret pÃ¥ de seneste nyheder pÃ¥ politiken.dk: Seneste Politiken, Seneste Danmark, Seneste Kultur og Seneste Internationalt. ",Politiken,https://politiken.dk/nyheder/,11.12.2022 07:17
Neymar efter nederlag: »Jeg er psykisk ødelagt«,11.12.2051 00:00,,https://politiken.dk/sport/fodbold/VM_2022/art9118176/Neymar-efter-nederlag-%C2%BBJeg-er-psykisk-%C3%B8delagt%C2%AB,Politiken,https://politiken.dk/nyheder/,"Hold dig opdateret pÃ¥ de seneste nyheder pÃ¥ politiken.dk: Seneste Politiken, Seneste Danmark, Seneste Kultur og Seneste Internationalt. ",Politiken,https://politiken.dk/nyheder/,11.12.2022 07:17
"Mand er død i alvorlig færdselsulykke på Falster: »Som det ser ud lige nu, er det en fodgænger på motorvejen«",01.12.2022 00:00,,https://politiken.dk/indland/art9118175/%C2%BBSom-det-ser-ud-lige-nu-er-det-en-fodg%C3%A6nger-p%C3%A5-motorvejen%C2%AB,Politiken,https://politiken.dk/nyheder/,"Hold dig opdateret pÃ¥ de seneste nyheder pÃ¥ politiken.dk: Seneste Politiken, Seneste Danmark, Seneste Kultur og Seneste Internationalt. ",Politiken,https://politiken.dk/nyheder/,11.12.2022 07:17
Nobelprismodtager: Russisk regering har bedt os takke nej til pris,01.12.2022 00:00,,https://politiken.dk/udland/art9118178/Russisk-regering-har-bedt-os-takke-nej-til-pris,Politiken,https://politiken.dk/nyheder/,"Hold dig opdateret pÃ¥ de seneste nyheder pÃ¥ politiken.dk: Seneste Politiken, Seneste Danmark, Seneste Kultur og Seneste Internationalt. ",Politiken,https://politiken.dk/nyheder/,11.12.2022 07:17
Engelsk landstræner vil overveje sin position efter exit,01.12.2022 00:00,,https://politiken.dk/sport/fodbold/VM_2022/art9118173/Engelsk-landstr%C3%A6ner-vil-overveje-sin-position-efter-exit,Politiken,https://politiken.dk/nyheder/,"Hold dig opdateret pÃ¥ de seneste nyheder pÃ¥ politiken.dk: Seneste Politiken, Seneste Danmark, Seneste Kultur og Seneste Internationalt. ",Politiken,https://politiken.dk/nyheder/,11.12.2022 07:17
Morten Meldal har fået sin Nobelpris af Sveriges konge,08.12.2022 00:00,,https://politiken.dk/viden/Viden/art9118057/Morten-Meldal-har-f%C3%A5et-sin-Nobelpris-af-Sveriges-konge,Politiken,https://politiken.dk/nyheder/,"Hold dig opdateret pÃ¥ de seneste nyheder pÃ¥ politiken.dk: Seneste Politiken, Seneste Danmark, Seneste Kultur og Seneste Internationalt. ",Politiken,https://politiken.dk/nyheder/,11.12.2022 07:17
Zlatko Buric kåret til Bedste Europæiske Skuespiller,09.12.2022 00:00,,https://politiken.dk/kultur/film_og_tv/art9118149/Zlatko-Buric-k%C3%A5ret-til-Bedste-Europ%C3%A6iske-Skuespiller,Politiken,https://politiken.dk/nyheder/,"Hold dig opdateret pÃ¥ de seneste nyheder pÃ¥ politiken.dk: Seneste Politiken, Seneste Danmark, Seneste Kultur og Seneste Internationalt. ",Politiken,https://politiken.dk/nyheder/,11.12.2022 07:17
"Goth er tilbage, og hvor har den været savnet",09.12.2022 00:00,,https://politiken.dk/ibyen/art9081689/Goth-er-tilbage-og-hvor-har-den-v%C3%A6ret-savnet,Politiken,https://politiken.dk/nyheder/,"Hold dig opdateret pÃ¥ de seneste nyheder pÃ¥ politiken.dk: Seneste Politiken, Seneste Danmark, Seneste Kultur og Seneste Internationalt. ",Politiken,https://politiken.dk/nyheder/,11.12.2022 07:17
Englands kaptajn brændte fra pletten og sendte Frankrig videre,10.12.2022 00:00,,https://politiken.dk/sport/fodbold/VM_2022/art9114693/Englands-kaptajn-br%C3%A6ndte-fra-pletten-og-sendte-Frankrig-videre,Politiken,https://politiken.dk/nyheder/,"Hold dig opdateret pÃ¥ de seneste nyheder pÃ¥ politiken.dk: Seneste Politiken, Seneste Danmark, Seneste Kultur og Seneste Internationalt. ",Politiken,https://politiken.dk/nyheder/,11.12.2022 07:17
"5 hjerter: Dette er krimien for dem, som ellers snobbet rynker på næsen ad den slags",10.12.2022 00:00,,https://politiken.dk/kultur/boger/boganmeldelser/skonlitteratur_boger/art9114126/Dette-er-krimien-for-dem-som-ellers-snobbet-rynker-p%C3%A5-n%C3%A6sen-ad-den-slags,Politiken,https://politiken.dk/nyheder/,"Hold dig opdateret pÃ¥ de seneste nyheder pÃ¥ politiken.dk: Seneste Politiken, Seneste Danmark, Seneste Kultur og Seneste Internationalt. ",Politiken,https://politiken.dk/nyheder/,11.12.2022 07:17
Her er 13 bud på Københavns sjæl,11.12.2022 00:00,,https://politiken.dk/indland/art9114174/Her-er-13-bud-p%C3%A5-K%C3%B8benhavns-sj%C3%A6l,Politiken,https://politiken.dk/nyheder/,"Hold dig opdateret pÃ¥ de seneste nyheder pÃ¥ politiken.dk: Seneste Politiken, Seneste Danmark, Seneste Kultur og Seneste Internationalt. ",Politiken,https://politiken.dk/nyheder/,11.12.2022 07:17
Se listen: Københavns Kommune giver 50 bygninger særstatus,11.12.2022 00:00,,https://politiken.dk/indland/kobenhavn/art9109886/K%C3%B8benhavns-Kommune-giver-50-bygninger-s%C3%A6rstatus,Politiken,https://politiken.dk/nyheder/,"Hold dig opdateret pÃ¥ de seneste nyheder pÃ¥ politiken.dk: Seneste Politiken, Seneste Danmark, Seneste Kultur og Seneste Internationalt. ",Politiken,https://politiken.dk/nyheder/,11.12.2022 07:17
Cowboys med Marlboro-cigaretter rider gennem Louisiana. Det er vildt godt,12.12.2022 00:00,,https://politiken.dk/kultur/kunst/art9091629/Cowboys-med-Marlboro-cigaretter-rider-gennem-Louisiana.-Det-er-vildt-godt,Politiken,https://politiken.dk/nyheder/,"Hold dig opdateret pÃ¥ de seneste nyheder pÃ¥ politiken.dk: Seneste Politiken, Seneste Danmark, Seneste Kultur og Seneste Internationalt. ",Politiken,https://politiken.dk/nyheder/,11.12.2022 07:17
Spændinger får Kosovo til at udskyde lokalvalg i serbisk område,12.12.2022 00:00,,https://politiken.dk/udland/art9118112/Sp%C3%A6ndinger-f%C3%A5r-Kosovo-til-at-udskyde-lokalvalg-i-serbisk-omr%C3%A5de,Politiken,https://politiken.dk/nyheder/,"Hold dig opdateret pÃ¥ de seneste nyheder pÃ¥ politiken.dk: Seneste Politiken, Seneste Danmark, Seneste Kultur og Seneste Internationalt. ",Politiken,https://politiken.dk/nyheder/,11.12.2022 07:17
Se billederne: Marokkanere verden over i vild jubel,12.12.2022 00:00,,https://politiken.dk/sport/art9118087/Marokkanere-verden-over-i-vild-jubel,Politiken,https://politiken.dk/nyheder/,"Hold dig opdateret pÃ¥ de seneste nyheder pÃ¥ politiken.dk: Seneste Politiken, Seneste Danmark, Seneste Kultur og Seneste Internationalt. ",Politiken,https://politiken.dk/nyheder/,11.12.2022 07:17
"Vi kan ikke løse det hele. Vi skal tænke over, hvordan vi bruger ressourcerne klogt",13.12.2022 00:00,,https://politiken.dk/indland/art9112268/Vi-kan-ikke-l%C3%B8se-det-hele.-Vi-skal-t%C3%A6nke-over-hvordan-vi-bruger-ressourcerne-klogt,Politiken,https://politiken.dk/nyheder/,"Hold dig opdateret pÃ¥ de seneste nyheder pÃ¥ politiken.dk: Seneste Politiken, Seneste Danmark, Seneste Kultur og Seneste Internationalt. ",Politiken,https://politiken.dk/nyheder/,11.12.2022 07:17
Nobelprismodtagere: Man kan ikke søge fred med Putin,14.12.2022 00:00,,https://politiken.dk/udland/art9118021/Man-kan-ikke-s%C3%B8ge-fred-med-Putin,Politiken,https://politiken.dk/nyheder/,"Hold dig opdateret pÃ¥ de seneste nyheder pÃ¥ politiken.dk: Seneste Politiken, Seneste Danmark, Seneste Kultur og Seneste Internationalt. ",Politiken,https://politiken.dk/nyheder/,11.12.2022 07:17
Efter rekord og dårlig opførsel: Fifa åbner sag mod Argentina og Holland,14.12.2022 00:00,,https://politiken.dk/sport/fodbold/VM_2022/art9117490/Fifa-%C3%A5bner-sag-mod-Argentina-og-Holland,Politiken,https://politiken.dk/nyheder/,"Hold dig opdateret pÃ¥ de seneste nyheder pÃ¥ politiken.dk: Seneste Politiken, Seneste Danmark, Seneste Kultur og Seneste Internationalt. ",Politiken,https://politiken.dk/nyheder/,11.12.2022 07:17
Russisk tv-station flygtede i eksil i Letland. Nu er den endt i store problemer,15.12.2022 00:00,,https://politiken.dk/udland/art9113459/Russisk-tv-station-flygtede-i-eksil-i-Letland.-Nu-er-den-endt-i-store-problemer,Politiken,https://politiken.dk/nyheder/,"Hold dig opdateret pÃ¥ de seneste nyheder pÃ¥ politiken.dk: Seneste Politiken, Seneste Danmark, Seneste Kultur og Seneste Internationalt. ",Politiken,https://politiken.dk/nyheder/,11.12.2022 07:17
DR bruger samme greb som i 1991. Det virker forbilledligt,15.12.2022 00:00,,https://politiken.dk/kultur/set_og_hoert/art8977162/DR-bruger-samme-greb-som-i-1991.-Det-virker-forbilledligt,Politiken,https://politiken.dk/nyheder/,"Hold dig opdateret pÃ¥ de seneste nyheder pÃ¥ politiken.dk: Seneste Politiken, Seneste Danmark, Seneste Kultur og Seneste Internationalt. ",Politiken,https://politiken.dk/nyheder/,11.12.2022 07:17
Marokko slår sensationelt Portugal og bliver det første afrikanske hold nogensinde i VM-semifinalen,16.12.2022 00:00,,https://politiken.dk/sport/art9114854/Marokko-sl%C3%A5r-sensationelt-Portugal-og-bliver-det-f%C3%B8rste-afrikanske-hold-nogensinde-i-VM-semifinalen,Politiken,https://politiken.dk/nyheder/,"Hold dig opdateret pÃ¥ de seneste nyheder pÃ¥ politiken.dk: Seneste Politiken, Seneste Danmark, Seneste Kultur og Seneste Internationalt. ",Politiken,https://politiken.dk/nyheder/,11.12.2022 07:17
"Når man har været igennem 14 fertilitetsbehandlinger uden præmie til sidst, så kan man godt føle sig en smule desillusioneret og tom for energi",16.12.2022 00:00,,https://politiken.dk/debat/kroniken/art9106041/N%C3%A5r-man-har-v%C3%A6ret-igennem-14-fertilitetsbehandlinger-uden-pr%C3%A6mie-til-sidst-s%C3%A5-kan-man-godt-f%C3%B8le-sig-en-smule-desillusioneret-og-tom-for-energi,Politiken,https://politiken.dk/nyheder/,"Hold dig opdateret pÃ¥ de seneste nyheder pÃ¥ politiken.dk: Seneste Politiken, Seneste Danmark, Seneste Kultur og Seneste Internationalt. ",Politiken,https://politiken.dk/nyheder/,11.12.2022 07:17
Javier Bardem glitrer med veloplagt upålidelighed i familiefilm om en sød krokodille,17.12.2022 00:00,,https://politiken.dk/kultur/film_og_tv/art9057109/Javier-Bardem-glitrer-med-veloplagt-up%C3%A5lidelighed-i-familiefilm-om-en-s%C3%B8d-krokodille,Politiken,https://politiken.dk/nyheder/,"Hold dig opdateret pÃ¥ de seneste nyheder pÃ¥ politiken.dk: Seneste Politiken, Seneste Danmark, Seneste Kultur og Seneste Internationalt. ",Politiken,https://politiken.dk/nyheder/,11.12.2022 07:17
"Hun overraskede, da hun pludselig forsvarede Qatar fra talerstolen. Nu er hun mistænkt for korruption",17.12.2022 00:00,,https://politiken.dk/udland/art9118005/Hun-overraskede-da-hun-pludselig-forsvarede-Qatar-fra-talerstolen.-Nu-er-hun-mist%C3%A6nkt-for-korruption,Politiken,https://politiken.dk/nyheder/,"Hold dig opdateret pÃ¥ de seneste nyheder pÃ¥ politiken.dk: Seneste Politiken, Seneste Danmark, Seneste Kultur og Seneste Internationalt. ",Politiken,https://politiken.dk/nyheder/,11.12.2022 07:17
Noa Redington: Kært barn har mange navne. Men kun ét er præcist: Løftebrud,17.12.2022 00:00,,https://politiken.dk/debat/klummer/art9114287/K%C3%A6rt-barn-har-mange-navne.-Men-kun-%C3%A9t-er-pr%C3%A6cist-L%C3%B8ftebrud,Politiken,https://politiken.dk/nyheder/,"Hold dig opdateret pÃ¥ de seneste nyheder pÃ¥ politiken.dk: Seneste Politiken, Seneste Danmark, Seneste Kultur og Seneste Internationalt. ",Politiken,https://politiken.dk/nyheder/,11.12.2022 07:17
"Hvad sker der for harmoniske Frankrig?: »Nu har vi været sammen i tre uger, og der har ikke været problemer«",18.12.2022 00:00,,https://politiken.dk/sport/fodbold/VM_2022/art9111511/%C2%BBNu-har-vi-v%C3%A6ret-sammen-i-tre-uger-og-der-har-ikke-v%C3%A6ret-problemer%C2%AB,Politiken,https://politiken.dk/nyheder/,"Hold dig opdateret pÃ¥ de seneste nyheder pÃ¥ politiken.dk: Seneste Politiken, Seneste Danmark, Seneste Kultur og Seneste Internationalt. ",Politiken,https://politiken.dk/nyheder/,11.12.2022 07:17
"Amerikansk forfatter: Her er, hvad aktiv dødshjælp har gjort ved Canada",18.12.2022 00:00,,https://politiken.dk/debat/art9110912/Her-er-hvad-aktiv-d%C3%B8dshj%C3%A6lp-har-gjort-ved-Canada,Politiken,https://politiken.dk/nyheder/,"Hold dig opdateret pÃ¥ de seneste nyheder pÃ¥ politiken.dk: Seneste Politiken, Seneste Danmark, Seneste Kultur og Seneste Internationalt. ",Politiken,https://politiken.dk/nyheder/,11.12.2022 07:17
"Saudi-Arabien har noget, som Putins Rusland ikke kan tilbyde Kina",19.12.2022 00:00,,https://politiken.dk/udland/art9115747/Saudi-Arabien-har-noget-som-Putins-Rusland-ikke-kan-tilbyde-Kina,Politiken,https://politiken.dk/nyheder/,"Hold dig opdateret pÃ¥ de seneste nyheder pÃ¥ politiken.dk: Seneste Politiken, Seneste Danmark, Seneste Kultur og Seneste Internationalt. ",Politiken,https://politiken.dk/nyheder/,11.12.2022 07:17
Gidselstager død af sine kvæstelser efter tysk politiaktion,19.12.2022 00:00,,https://politiken.dk/udland/art9117994/Gidselstager-d%C3%B8d-af-sine-kv%C3%A6stelser-efter-tysk-politiaktion,Politiken,https://politiken.dk/nyheder/,"Hold dig opdateret pÃ¥ de seneste nyheder pÃ¥ politiken.dk: Seneste Politiken, Seneste Danmark, Seneste Kultur og Seneste Internationalt. ",Politiken,https://politiken.dk/nyheder/,11.12.2022 07:17
Lotte Folke Kaarsholm: Inden længe har vi bragt et falsk læserbrev,20.12.2022 00:00,,https://politiken.dk/debat/art9117181/Inden-l%C3%A6nge-har-vi-bragt-et-falsk-l%C3%A6serbrev,Politiken,https://politiken.dk/nyheder/,"Hold dig opdateret pÃ¥ de seneste nyheder pÃ¥ politiken.dk: Seneste Politiken, Seneste Danmark, Seneste Kultur og Seneste Internationalt. ",Politiken,https://politiken.dk/nyheder/,11.12.2022 07:17
Bestsellerforfatters bog er en finger lige i synet på Putin,20.12.2022 00:00,,https://politiken.dk/kultur/boger/art9109320/Bestsellerforfatters-bog-er-en-finger-lige-i-synet-p%C3%A5-Putin,Politiken,https://politiken.dk/nyheder/,"Hold dig opdateret pÃ¥ de seneste nyheder pÃ¥ politiken.dk: Seneste Politiken, Seneste Danmark, Seneste Kultur og Seneste Internationalt. ",Politiken,https://politiken.dk/nyheder/,11.12.2022 07:17
"»Det er tid til at stoppe med at være naive, også når det gælder Kina«",20.12.2022 00:00,,https://politiken.dk/udland/int_kina/art9111956/%C2%BBDet-er-tid-til-at-stoppe-med-at-v%C3%A6re-naive-ogs%C3%A5-n%C3%A5r-det-g%C3%A6lder-Kina%C2%AB,Politiken,https://politiken.dk/nyheder/,"Hold dig opdateret pÃ¥ de seneste nyheder pÃ¥ politiken.dk: Seneste Politiken, Seneste Danmark, Seneste Kultur og Seneste Internationalt. ",Politiken,https://politiken.dk/nyheder/,11.12.2022 07:17
Sådan får du en juleweekend med god samvittighed,20.12.2022 00:00,,https://politiken.dk/ibyen/art9105317/S%C3%A5dan-f%C3%A5r-du-en-juleweekend-med-god-samvittighed,Politiken,https://politiken.dk/nyheder/,"Hold dig opdateret pÃ¥ de seneste nyheder pÃ¥ politiken.dk: Seneste Politiken, Seneste Danmark, Seneste Kultur og Seneste Internationalt. ",Politiken,https://politiken.dk/nyheder/,11.12.2022 07:17
USA: Rusland og Iran forbereder fælles produktion af dræbende droner,21.12.2022 00:00,,https://politiken.dk/udland/art9117983/Rusland-og-Iran-forbereder-f%C3%A6lles-produktion-af-dr%C3%A6bende-droner,Politiken,https://politiken.dk/nyheder/,"Hold dig opdateret pÃ¥ de seneste nyheder pÃ¥ politiken.dk: Seneste Politiken, Seneste Danmark, Seneste Kultur og Seneste Internationalt. ",Politiken,https://politiken.dk/nyheder/,11.12.2022 07:17
Denne bygning er drevet af næsten usynlige solceller,21.12.2022 00:00,,https://politiken.dk/klima/art9099822/Denne-bygning-er-drevet-af-n%C3%A6sten-usynlige-solceller,Politiken,https://politiken.dk/nyheder/,"Hold dig opdateret pÃ¥ de seneste nyheder pÃ¥ politiken.dk: Seneste Politiken, Seneste Danmark, Seneste Kultur og Seneste Internationalt. ",Politiken,https://politiken.dk/nyheder/,11.12.2022 07:17
Læg en hård pakke under træet: Anmelderne udvælger årets bedste bøger,21.12.2022 00:00,,https://politiken.dk/kultur/boger/art9100302/L%C3%A6g-en-h%C3%A5rd-pakke-under-tr%C3%A6et-Anmelderne-udv%C3%A6lger-%C3%A5rets-bedste-b%C3%B8ger,Politiken,https://politiken.dk/nyheder/,"Hold dig opdateret pÃ¥ de seneste nyheder pÃ¥ politiken.dk: Seneste Politiken, Seneste Danmark, Seneste Kultur og Seneste Internationalt. ",Politiken,https://politiken.dk/nyheder/,11.12.2022 07:17
"Fransk politolog: Sorte og brune kvinder udnyttes, så hvide kvinder kan leve et let og behageligt liv",21.12.2022 00:00,,https://politiken.dk/debat/art9033549/Sorte-og-brune-kvinder-udnyttes-s%C3%A5-hvide-kvinder-kan-leve-et-let-og-behageligt-liv,Politiken,https://politiken.dk/nyheder/,"Hold dig opdateret pÃ¥ de seneste nyheder pÃ¥ politiken.dk: Seneste Politiken, Seneste Danmark, Seneste Kultur og Seneste Internationalt. ",Politiken,https://politiken.dk/nyheder/,11.12.2022 07:17
"Aggressioner, hån og spot skæmmede Argentinas sejr over Holland",22.12.2022 00:00,,https://politiken.dk/sport/fodbold/VM_2022/art9117913/Aggressioner-h%C3%A5n-og-spot-sk%C3%A6mmede-Argentinas-sejr-over-Holland,Politiken,https://politiken.dk/nyheder/,"Hold dig opdateret pÃ¥ de seneste nyheder pÃ¥ politiken.dk: Seneste Politiken, Seneste Danmark, Seneste Kultur og Seneste Internationalt. ",Politiken,https://politiken.dk/nyheder/,11.12.2022 07:17
Lugten af olie hænger tungt over område i Kansas efter stor læk,22.12.2022 00:00,,https://politiken.dk/udland/int_usa/art9117872/Lugten-af-olie-h%C3%A6nger-tungt-over-omr%C3%A5de-i-Kansas-efter-stor-l%C3%A6k,Politiken,https://politiken.dk/nyheder/,"Hold dig opdateret pÃ¥ de seneste nyheder pÃ¥ politiken.dk: Seneste Politiken, Seneste Danmark, Seneste Kultur og Seneste Internationalt. ",Politiken,https://politiken.dk/nyheder/,11.12.2022 07:17
Kendt prodemokratisk aktivist får ny dom i Hongkong,23.12.2022 00:00,,https://politiken.dk/udland/art9117890/Kendt-prodemokratisk-aktivist-f%C3%A5r-ny-dom-i-Hongkong,Politiken,https://politiken.dk/nyheder/,"Hold dig opdateret pÃ¥ de seneste nyheder pÃ¥ politiken.dk: Seneste Politiken, Seneste Danmark, Seneste Kultur og Seneste Internationalt. ",Politiken,https://politiken.dk/nyheder/,11.12.2022 07:17
Norsk minister er rystet efter artikel om TikTok og træningsvideoer,23.12.2022 00:00,,https://politiken.dk/kultur/art9117348/Norsk-minister-er-rystet-efter-artikel-om-TikTok-og-tr%C3%A6ningsvideoer,Politiken,https://politiken.dk/nyheder/,"Hold dig opdateret pÃ¥ de seneste nyheder pÃ¥ politiken.dk: Seneste Politiken, Seneste Danmark, Seneste Kultur og Seneste Internationalt. ",Politiken,https://politiken.dk/nyheder/,11.12.2022 07:17
"Efter rugemor-dom: Nicolai Køster Rimvall håber, at han kan blive anerkendt som forælder",11.12.2033 00:00,,https://politiken.dk/indland/art9110802/Efter-rugemor-dom-Nicolai-K%C3%B8ster-Rimvall-h%C3%A5ber-at-han-kan-blive-anerkendt-som-for%C3%A6lder,Politiken,https://politiken.dk/nyheder/,"Hold dig opdateret pÃ¥ de seneste nyheder pÃ¥ politiken.dk: Seneste Politiken, Seneste Danmark, Seneste Kultur og Seneste Internationalt. ",Politiken,https://politiken.dk/nyheder/,11.12.2022 07:17
"Mand er død i alvorlig færdselsulykke på Falster: »Som det ser ud lige nu, er det en fodgænger på motorvejen«",01.12.2022 00:00,,https://politiken.dk/indland/art9118175/%C2%BBSom-det-ser-ud-lige-nu-er-det-en-fodg%C3%A6nger-p%C3%A5-motorvejen%C2%AB,Politiken,https://politiken.dk/nyheder/,"Hold dig opdateret pÃ¥ de seneste nyheder pÃ¥ politiken.dk: Seneste Politiken, Seneste Danmark, Seneste Kultur og Seneste Internationalt. ",Politiken,https://politiken.dk/nyheder/,11.12.2022 07:17
Her er 13 bud på Københavns sjæl,11.12.2022 00:00,,https://politiken.dk/indland/art9114174/Her-er-13-bud-p%C3%A5-K%C3%B8benhavns-sj%C3%A6l,Politiken,https://politiken.dk/nyheder/,"Hold dig opdateret pÃ¥ de seneste nyheder pÃ¥ politiken.dk: Seneste Politiken, Seneste Danmark, Seneste Kultur og Seneste Internationalt. ",Politiken,https://politiken.dk/nyheder/,11.12.2022 07:17
Se listen: Københavns Kommune giver 50 bygninger særstatus,11.12.2022 00:00,,https://politiken.dk/indland/kobenhavn/art9109886/K%C3%B8benhavns-Kommune-giver-50-bygninger-s%C3%A6rstatus,Politiken,https://politiken.dk/nyheder/,"Hold dig opdateret pÃ¥ de seneste nyheder pÃ¥ politiken.dk: Seneste Politiken, Seneste Danmark, Seneste Kultur og Seneste Internationalt. ",Politiken,https://politiken.dk/nyheder/,11.12.2022 07:17
Se billederne: Marokkanere verden over i vild jubel,12.12.2022 00:00,,https://politiken.dk/sport/art9118087/Marokkanere-verden-over-i-vild-jubel,Politiken,https://politiken.dk/nyheder/,"Hold dig opdateret pÃ¥ de seneste nyheder pÃ¥ politiken.dk: Seneste Politiken, Seneste Danmark, Seneste Kultur og Seneste Internationalt. ",Politiken,https://politiken.dk/nyheder/,11.12.2022 07:17
"Vi kan ikke løse det hele. Vi skal tænke over, hvordan vi bruger ressourcerne klogt",13.12.2022 00:00,,https://politiken.dk/indland/art9112268/Vi-kan-ikke-l%C3%B8se-det-hele.-Vi-skal-t%C3%A6nke-over-hvordan-vi-bruger-ressourcerne-klogt,Politiken,https://politiken.dk/nyheder/,"Hold dig opdateret pÃ¥ de seneste nyheder pÃ¥ politiken.dk: Seneste Politiken, Seneste Danmark, Seneste Kultur og Seneste Internationalt. ",Politiken,https://politiken.dk/nyheder/,11.12.2022 07:17
Nobelprismodtagere: Man kan ikke søge fred med Putin,14.12.2022 00:00,,https://politiken.dk/udland/art9118021/Man-kan-ikke-s%C3%B8ge-fred-med-Putin,Politiken,https://politiken.dk/nyheder/,"Hold dig opdateret pÃ¥ de seneste nyheder pÃ¥ politiken.dk: Seneste Politiken, Seneste Danmark, Seneste Kultur og Seneste Internationalt. ",Politiken,https://politiken.dk/nyheder/,11.12.2022 07:17
"Næstformand for Folketingets Præsidium har milliongæld til det offentlige efter konkurs: »Jeg er ked af de fejl, jeg har begået«",15.12.2022 00:00,,https://politiken.dk/indland/art9117922/%C2%BBJeg-er-ked-af-de-fejl-jeg-har-beg%C3%A5et%C2%AB,Politiken,https://politiken.dk/nyheder/,"Hold dig opdateret pÃ¥ de seneste nyheder pÃ¥ politiken.dk: Seneste Politiken, Seneste Danmark, Seneste Kultur og Seneste Internationalt. ",Politiken,https://politiken.dk/nyheder/,11.12.2022 07:17
Denne bygning er drevet af næsten usynlige solceller,21.12.2022 00:00,,https://politiken.dk/klima/art9099822/Denne-bygning-er-drevet-af-n%C3%A6sten-usynlige-solceller,Politiken,https://politiken.dk/nyheder/,"Hold dig opdateret pÃ¥ de seneste nyheder pÃ¥ politiken.dk: Seneste Politiken, Seneste Danmark, Seneste Kultur og Seneste Internationalt. ",Politiken,https://politiken.dk/nyheder/,11.12.2022 07:17
"»Det er også svært at tænke på, at jeg bliver 40 næste år, og jeg har ikke nogen veninder at invitere«",22.12.2022 00:00,,https://politiken.dk/indland/art9071827/%C2%BBDet-er-ogs%C3%A5-sv%C3%A6rt-at-t%C3%A6nke-p%C3%A5-at-jeg-bliver-40-n%C3%A6ste-%C3%A5r-og-jeg-har-ikke-nogen-veninder-at-invitere%C2%AB,Politiken,https://politiken.dk/nyheder/,"Hold dig opdateret pÃ¥ de seneste nyheder pÃ¥ politiken.dk: Seneste Politiken, Seneste Danmark, Seneste Kultur og Seneste Internationalt. ",Politiken,https://politiken.dk/nyheder/,11.12.2022 07:17
S og V forbereder baglandet på kompromisets kunst,23.12.2022 00:00,,https://politiken.dk/indland/politik/art9115665/S-og-V-forbereder-baglandet-p%C3%A5-kompromisets-kunst,Politiken,https://politiken.dk/nyheder/,"Hold dig opdateret pÃ¥ de seneste nyheder pÃ¥ politiken.dk: Seneste Politiken, Seneste Danmark, Seneste Kultur og Seneste Internationalt. ",Politiken,https://politiken.dk/nyheder/,11.12.2022 07:17
Politi rykker ind med narkohunde på eksklusiv natklub ejet af kendis,12.12.2022 00:00,,https://politiken.dk/indland/kobenhavn/art9117885/Politi-rykker-ind-med-narkohunde-p%C3%A5-eksklusiv-natklub-ejet-af-kendis,Politiken,https://politiken.dk/nyheder/,"Hold dig opdateret pÃ¥ de seneste nyheder pÃ¥ politiken.dk: Seneste Politiken, Seneste Danmark, Seneste Kultur og Seneste Internationalt. ",Politiken,https://politiken.dk/nyheder/,11.12.2022 07:17
Styrelse sætter sanktionering af kontanthjælpsmodtagere i bero,12.12.2022 00:00,,https://politiken.dk/indland/art9117853/Styrelse-s%C3%A6tter-sanktionering-af-kontanthj%C3%A6lpsmodtagere-i-bero,Politiken,https://politiken.dk/nyheder/,"Hold dig opdateret pÃ¥ de seneste nyheder pÃ¥ politiken.dk: Seneste Politiken, Seneste Danmark, Seneste Kultur og Seneste Internationalt. ",Politiken,https://politiken.dk/nyheder/,11.12.2022 07:17
"VU-formand: »Jeg er ikke sikker på, at Venstres Ungdom kommer til at hænge Venstre-plakater op til næste folketingsvalg«",12.12.2022 00:00,,https://politiken.dk/indland/art9117833/%C2%BBJeg-er-ikke-sikker-p%C3%A5-at-Venstres-Ungdom-kommer-til-at-h%C3%A6nge-Venstre-plakater-op-til-n%C3%A6ste-folketingsvalg%C2%AB,Politiken,https://politiken.dk/nyheder/,"Hold dig opdateret pÃ¥ de seneste nyheder pÃ¥ politiken.dk: Seneste Politiken, Seneste Danmark, Seneste Kultur og Seneste Internationalt. ",Politiken,https://politiken.dk/nyheder/,11.12.2022 07:17
Nu løftes sløret for prisen på Tour de France i Danmark: »I bund og grund har vi betalt for at lave reklame for Frankrig«,12.12.2022 00:00,,https://politiken.dk/indland/kobenhavn/art9116433/%C2%BBI-bund-og-grund-har-vi-betalt-for-at-lave-reklame-for-Frankrig%C2%AB,Politiken,https://politiken.dk/nyheder/,"Hold dig opdateret pÃ¥ de seneste nyheder pÃ¥ politiken.dk: Seneste Politiken, Seneste Danmark, Seneste Kultur og Seneste Internationalt. ",Politiken,https://politiken.dk/nyheder/,11.12.2022 07:17
