title,published,text,link,og:site_name,og:url,site_description,name,url,scrape_time
Samfund Abonnement Det offentlige har et »særlig stort problem« med højt sygefravær: »Helt ærligt«,07.03.2023 00:00,,https://www.berlingske.dk/samfund/det-offentlige-har-et-saerlig-stort-problem-med-hoejt-sygefravaer-helt,Berlingske.dk,https://www.berlingske.dk/nyheder,Læs alle nyhederne fra Danmark og resten af verden på berlingske.dk. Med Berlingske Nyheder får du det seneste nyhedsoverblik fra både ind- og udland. ,Berlingske,https://www.berlingske.dk/nyheder,06.03.2023 07:18
Internationalt Vrede grækere støder sammen med politi i Athen efter togtragedie,07.03.2023 00:00,,https://www.berlingske.dk/internationalt/vrede-graekere-stoeder-sammen-med-politi-i-athen-efter-togtragedie,Berlingske.dk,https://www.berlingske.dk/nyheder,Læs alle nyhederne fra Danmark og resten af verden på berlingske.dk. Med Berlingske Nyheder får du det seneste nyhedsoverblik fra både ind- og udland. ,Berlingske,https://www.berlingske.dk/nyheder,06.03.2023 07:18
Samfund Snestorm på vej til Danmark,07.03.2023 00:00,,https://www.berlingske.dk/samfund/snestorm-paa-vej-til-danmark,Berlingske.dk,https://www.berlingske.dk/nyheder,Læs alle nyhederne fra Danmark og resten af verden på berlingske.dk. Med Berlingske Nyheder får du det seneste nyhedsoverblik fra både ind- og udland. ,Berlingske,https://www.berlingske.dk/nyheder,06.03.2023 07:18
Internationalt Krigen i Ukraine kaster skygger over Estlands valg,07.03.2023 00:00,,https://www.berlingske.dk/internationalt/krigen-i-ukraine-kaster-skygger-over-estlands-valg,Berlingske.dk,https://www.berlingske.dk/nyheder,Læs alle nyhederne fra Danmark og resten af verden på berlingske.dk. Med Berlingske Nyheder får du det seneste nyhedsoverblik fra både ind- og udland. ,Berlingske,https://www.berlingske.dk/nyheder,06.03.2023 07:18
Politik Abonnement Venstre reagerer skarpt på kritik fra Vanopslagh: Det har ingen hold i virkeligheden,07.03.2023 00:00,,https://www.berlingske.dk/politik/venstre-reagerer-skarpt-paa-kritik-fra-vanopslagh-det-har-ingen-hold-i,Berlingske.dk,https://www.berlingske.dk/nyheder,Læs alle nyhederne fra Danmark og resten af verden på berlingske.dk. Med Berlingske Nyheder får du det seneste nyhedsoverblik fra både ind- og udland. ,Berlingske,https://www.berlingske.dk/nyheder,06.03.2023 07:18
Samfund To mistænkte mænd er fængslet efter knivstik på Mors,07.03.2023 00:00,,https://www.berlingske.dk/samfund/to-mistaenkte-maend-er-faengslet-efter-knivstik-paa-mors,Berlingske.dk,https://www.berlingske.dk/nyheder,Læs alle nyhederne fra Danmark og resten af verden på berlingske.dk. Med Berlingske Nyheder får du det seneste nyhedsoverblik fra både ind- og udland. ,Berlingske,https://www.berlingske.dk/nyheder,06.03.2023 07:18
Internationalt Abonnement Ingen har set tunnelen i 4.500 år. Nu kan nyt foto muligvis vise Kleopatras hemmelighed,07.03.2023 00:00,,https://www.berlingske.dk/internationalt/ingen-har-set-tunnelen-i-4500-aar-nu-kan-nyt-foto-muligvis-vise,Berlingske.dk,https://www.berlingske.dk/nyheder,Læs alle nyhederne fra Danmark og resten af verden på berlingske.dk. Med Berlingske Nyheder får du det seneste nyhedsoverblik fra både ind- og udland. ,Berlingske,https://www.berlingske.dk/nyheder,06.03.2023 07:18
Høj beskæftigelse sender danskerne på ferie,07.03.2023 00:00,,https://politiken.dk/rejser/art9235491/H%C3%B8j-besk%C3%A6ftigelse-sender-danskerne-p%C3%A5-ferie,Politiken,https://politiken.dk/nyheder/,"Hold dig opdateret pÃ¥ de seneste nyheder pÃ¥ politiken.dk: Seneste Politiken, Seneste Danmark, Seneste Kultur og Seneste Internationalt. ",Politiken,https://politiken.dk/nyheder/,06.03.2023 07:18
Whistleblower afleverer belastende lydfil med Jon Stephensen,06.03.2049 00:00,,https://politiken.dk/kultur/art9244162/Whistleblower-afleverer-belastende-lydfil-med-Jon-Stephensen,Politiken,https://politiken.dk/nyheder/,"Hold dig opdateret pÃ¥ de seneste nyheder pÃ¥ politiken.dk: Seneste Politiken, Seneste Danmark, Seneste Kultur og Seneste Internationalt. ",Politiken,https://politiken.dk/nyheder/,06.03.2023 07:18
Bomberyddere og politi undersøger sprængning ved butik i Dragør,01.03.2023 00:00,,https://politiken.dk/indland/kobenhavn/art9244188/Bomberyddere-og-politi-unders%C3%B8ger-spr%C3%A6ngning-ved-butik-i-Drag%C3%B8r,Politiken,https://politiken.dk/nyheder/,"Hold dig opdateret pÃ¥ de seneste nyheder pÃ¥ politiken.dk: Seneste Politiken, Seneste Danmark, Seneste Kultur og Seneste Internationalt. ",Politiken,https://politiken.dk/nyheder/,06.03.2023 07:18
Den danske dynamo i Sydamerika,02.03.2023 00:00,,https://politiken.dk/navne/art9206666/Den-danske-dynamo-i-Sydamerika,Politiken,https://politiken.dk/nyheder/,"Hold dig opdateret pÃ¥ de seneste nyheder pÃ¥ politiken.dk: Seneste Politiken, Seneste Danmark, Seneste Kultur og Seneste Internationalt. ",Politiken,https://politiken.dk/nyheder/,06.03.2023 07:18
Klassekamp: Hvem kan koderne til det behagelige liv?,04.03.2023 00:00,,https://politiken.dk/podcast/dulyttertilpolitiken/art9240142/Klassekamp-Hvem-kan-koderne-til-det-behagelige-liv,Politiken,https://politiken.dk/nyheder/,"Hold dig opdateret pÃ¥ de seneste nyheder pÃ¥ politiken.dk: Seneste Politiken, Seneste Danmark, Seneste Kultur og Seneste Internationalt. ",Politiken,https://politiken.dk/nyheder/,06.03.2023 07:18
Stationsforstander fængslet efter græsk togulykke,09.03.2023 00:00,,https://politiken.dk/udland/art9244156/Stationsforstander-f%C3%A6ngslet-efter-gr%C3%A6sk-togulykke,Politiken,https://politiken.dk/nyheder/,"Hold dig opdateret pÃ¥ de seneste nyheder pÃ¥ politiken.dk: Seneste Politiken, Seneste Danmark, Seneste Kultur og Seneste Internationalt. ",Politiken,https://politiken.dk/nyheder/,06.03.2023 07:18
"Nyt museum i København har færten af noget fedt, men har ikke helt knækket koden",11.03.2023 00:00,,https://politiken.dk/kultur/art9191243/Nyt-museum-i-K%C3%B8benhavn-har-f%C3%A6rten-af-noget-fedt-men-har-ikke-helt-kn%C3%A6kket-koden,Politiken,https://politiken.dk/nyheder/,"Hold dig opdateret pÃ¥ de seneste nyheder pÃ¥ politiken.dk: Seneste Politiken, Seneste Danmark, Seneste Kultur og Seneste Internationalt. ",Politiken,https://politiken.dk/nyheder/,06.03.2023 07:18
»Vores største problem er at finde plads nok til at begrave alle de døde russere«,11.03.2023 00:00,,https://politiken.dk/udland/art9235218/%C2%BBVores-st%C3%B8rste-problem-er-at-finde-plads-nok-til-at-begrave-alle-de-d%C3%B8de-russere%C2%AB,Politiken,https://politiken.dk/nyheder/,"Hold dig opdateret pÃ¥ de seneste nyheder pÃ¥ politiken.dk: Seneste Politiken, Seneste Danmark, Seneste Kultur og Seneste Internationalt. ",Politiken,https://politiken.dk/nyheder/,06.03.2023 07:18
"Anne Kirstine Cramon: Nu er prepping blevet noget, man taler om på københavnske vinbarer",11.03.2023 00:00,,https://politiken.dk/debat/klummer/art9237135/Nu-er-prepping-blevet-noget-man-taler-om-p%C3%A5-k%C3%B8benhavnske-vinbarer,Politiken,https://politiken.dk/nyheder/,"Hold dig opdateret pÃ¥ de seneste nyheder pÃ¥ politiken.dk: Seneste Politiken, Seneste Danmark, Seneste Kultur og Seneste Internationalt. ",Politiken,https://politiken.dk/nyheder/,06.03.2023 07:18
FCK scorer syv gange i rekordkamp med to røde kort,11.03.2023 00:00,,https://politiken.dk/sport/art9241865/FCK-scorer-syv-gange-i-rekordkamp-med-to-r%C3%B8de-kort,Politiken,https://politiken.dk/nyheder/,"Hold dig opdateret pÃ¥ de seneste nyheder pÃ¥ politiken.dk: Seneste Politiken, Seneste Danmark, Seneste Kultur og Seneste Internationalt. ",Politiken,https://politiken.dk/nyheder/,06.03.2023 07:18
Politiken mener: Europas sidste diktator truer vores egen sikkerhed,12.03.2023 00:00,,https://politiken.dk/debat/ledere/art9243737/Europas-sidste-diktator-truer-vores-egen-sikkerhed,Politiken,https://politiken.dk/nyheder/,"Hold dig opdateret pÃ¥ de seneste nyheder pÃ¥ politiken.dk: Seneste Politiken, Seneste Danmark, Seneste Kultur og Seneste Internationalt. ",Politiken,https://politiken.dk/nyheder/,06.03.2023 07:18
"Amalie Kestler: Lad os håbe, store bededag er begyndelsen på flere upopulære beslutninger",12.03.2023 00:00,,https://politiken.dk/debat/klummer/art9233785/Lad-os-h%C3%A5be-store-bededag-er-begyndelsen-p%C3%A5-flere-upopul%C3%A6re-beslutninger,Politiken,https://politiken.dk/nyheder/,"Hold dig opdateret pÃ¥ de seneste nyheder pÃ¥ politiken.dk: Seneste Politiken, Seneste Danmark, Seneste Kultur og Seneste Internationalt. ",Politiken,https://politiken.dk/nyheder/,06.03.2023 07:18
"Assistenten, der blev chef, mærker nu den første modvind",12.03.2023 00:00,,https://politiken.dk/sport/art9239342/Assistenten-der-blev-chef-m%C3%A6rker-nu-den-f%C3%B8rste-modvind,Politiken,https://politiken.dk/nyheder/,"Hold dig opdateret pÃ¥ de seneste nyheder pÃ¥ politiken.dk: Seneste Politiken, Seneste Danmark, Seneste Kultur og Seneste Internationalt. ",Politiken,https://politiken.dk/nyheder/,06.03.2023 07:18
Liverpool ydmyger United i historisk afklapsning,12.03.2023 00:00,,https://politiken.dk/sport/art9244091/Liverpool-ydmyger-United-i-historisk-afklapsning,Politiken,https://politiken.dk/nyheder/,"Hold dig opdateret pÃ¥ de seneste nyheder pÃ¥ politiken.dk: Seneste Politiken, Seneste Danmark, Seneste Kultur og Seneste Internationalt. ",Politiken,https://politiken.dk/nyheder/,06.03.2023 07:18
"Der er så meget energi på deres album, at det opvejer fraværet af noget rigtig originalt",12.03.2023 00:00,,https://politiken.dk/kultur/art9237965/Der-er-s%C3%A5-meget-energi-p%C3%A5-deres-album-at-det-opvejer-frav%C3%A6ret-af-noget-rigtig-originalt,Politiken,https://politiken.dk/nyheder/,"Hold dig opdateret pÃ¥ de seneste nyheder pÃ¥ politiken.dk: Seneste Politiken, Seneste Danmark, Seneste Kultur og Seneste Internationalt. ",Politiken,https://politiken.dk/nyheder/,06.03.2023 07:18
Putin har smadret Bakhmut for at få byen,12.03.2023 00:00,,https://politiken.dk/udland/art9243919/Putin-har-smadret-Bakhmut-for-at-f%C3%A5-byen,Politiken,https://politiken.dk/nyheder/,"Hold dig opdateret pÃ¥ de seneste nyheder pÃ¥ politiken.dk: Seneste Politiken, Seneste Danmark, Seneste Kultur og Seneste Internationalt. ",Politiken,https://politiken.dk/nyheder/,06.03.2023 07:18
"»Det kan godt være, at far sidder deroppe og tænker, hold kæft, hun er idiot, kællingen, men jeg fik det bedre«",13.03.2023 00:00,,https://politiken.dk/sport/art9236070/%C2%BBDet-kan-godt-v%C3%A6re-at-far-sidder-deroppe-og-t%C3%A6nker-hold-k%C3%A6ft-hun-er-idiot-k%C3%A6llingen-men-jeg-fik-det-bedre%C2%AB,Politiken,https://politiken.dk/nyheder/,"Hold dig opdateret pÃ¥ de seneste nyheder pÃ¥ politiken.dk: Seneste Politiken, Seneste Danmark, Seneste Kultur og Seneste Internationalt. ",Politiken,https://politiken.dk/nyheder/,06.03.2023 07:18
Ukrainsk efterretningschef: Rusland løber tør for våben,13.03.2023 00:00,,https://politiken.dk/udland/art9244071/Ukrainsk-efterretningschef-Rusland-l%C3%B8ber-t%C3%B8r-for-v%C3%A5ben,Politiken,https://politiken.dk/nyheder/,"Hold dig opdateret pÃ¥ de seneste nyheder pÃ¥ politiken.dk: Seneste Politiken, Seneste Danmark, Seneste Kultur og Seneste Internationalt. ",Politiken,https://politiken.dk/nyheder/,06.03.2023 07:18
Steffen Grams gammeldags journalistik er som en Gammel Dansk om morgenen,13.03.2023 00:00,,https://politiken.dk/kultur/set_og_hoert/art9187899/Steffen-Grams-gammeldags-journalistik-er-som-en-Gammel-Dansk-om-morgenen,Politiken,https://politiken.dk/nyheder/,"Hold dig opdateret pÃ¥ de seneste nyheder pÃ¥ politiken.dk: Seneste Politiken, Seneste Danmark, Seneste Kultur og Seneste Internationalt. ",Politiken,https://politiken.dk/nyheder/,06.03.2023 07:18
I stedet for at tage mine venners kritik til mig er jeg langsomt gledet ud af folks liv,14.03.2023 00:00,,https://politiken.dk/kultur/art9206266/I-stedet-for-at-tage-mine-venners-kritik-til-mig-er-jeg-langsomt-gledet-ud-af-folks-liv,Politiken,https://politiken.dk/nyheder/,"Hold dig opdateret pÃ¥ de seneste nyheder pÃ¥ politiken.dk: Seneste Politiken, Seneste Danmark, Seneste Kultur og Seneste Internationalt. ",Politiken,https://politiken.dk/nyheder/,06.03.2023 07:18
Tredjeplads til Mads Pedersen i årets første duel mellem Vingegaard og Pogacar,14.03.2023 00:00,,https://politiken.dk/sport/art9243991/Tredjeplads-til-Mads-Pedersen-i-%C3%A5rets-f%C3%B8rste-duel-mellem-Vingegaard-og-Pogacar,Politiken,https://politiken.dk/nyheder/,"Hold dig opdateret pÃ¥ de seneste nyheder pÃ¥ politiken.dk: Seneste Politiken, Seneste Danmark, Seneste Kultur og Seneste Internationalt. ",Politiken,https://politiken.dk/nyheder/,06.03.2023 07:18
Ny aftale om havbeskyttelse er »ret vild«. Men den bekymrer også eksperter,15.03.2023 00:00,,https://politiken.dk/udland/art9243707/Ny-aftale-om-havbeskyttelse-er-%C2%BBret-vild%C2%AB.-Men-den-bekymrer-ogs%C3%A5-eksperter,Politiken,https://politiken.dk/nyheder/,"Hold dig opdateret pÃ¥ de seneste nyheder pÃ¥ politiken.dk: Seneste Politiken, Seneste Danmark, Seneste Kultur og Seneste Internationalt. ",Politiken,https://politiken.dk/nyheder/,06.03.2023 07:18
"De er dem, som ingen voksne vil lytte til",15.03.2023 00:00,,https://politiken.dk/indland/art9234030/De-er-dem-som-ingen-voksne-vil-lytte-til,Politiken,https://politiken.dk/nyheder/,"Hold dig opdateret pÃ¥ de seneste nyheder pÃ¥ politiken.dk: Seneste Politiken, Seneste Danmark, Seneste Kultur og Seneste Internationalt. ",Politiken,https://politiken.dk/nyheder/,06.03.2023 07:18
Verden set i en rus: Ny roman er en syret opløsning af grænser,15.03.2023 00:00,,https://politiken.dk/kultur/boger/art9214042/Ny-roman-er-en-syret-opl%C3%B8sning-af-gr%C3%A6nser,Politiken,https://politiken.dk/nyheder/,"Hold dig opdateret pÃ¥ de seneste nyheder pÃ¥ politiken.dk: Seneste Politiken, Seneste Danmark, Seneste Kultur og Seneste Internationalt. ",Politiken,https://politiken.dk/nyheder/,06.03.2023 07:18
"Ã h, de gode gamle dage i 1998. Bortset fra, at de slet ikke var så gode endda",16.03.2023 00:00,,https://politiken.dk/kultur/set_og_hoert/art9187898/%C3%85h-de-gode-gamle-dage-i-1998.-Bortset-fra-at-de-slet-ikke-var-s%C3%A5-gode-endda,Politiken,https://politiken.dk/nyheder/,"Hold dig opdateret pÃ¥ de seneste nyheder pÃ¥ politiken.dk: Seneste Politiken, Seneste Danmark, Seneste Kultur og Seneste Internationalt. ",Politiken,https://politiken.dk/nyheder/,06.03.2023 07:18
Så er det blevet bibliotekarernes tur til at spille helte,17.03.2023 00:00,,https://politiken.dk/kultur/boger/boganmeldelser/skonlitteratur_boger/art9203611/S%C3%A5-er-det-blevet-bibliotekarernes-tur-til-at-spille-helte,Politiken,https://politiken.dk/nyheder/,"Hold dig opdateret pÃ¥ de seneste nyheder pÃ¥ politiken.dk: Seneste Politiken, Seneste Danmark, Seneste Kultur og Seneste Internationalt. ",Politiken,https://politiken.dk/nyheder/,06.03.2023 07:18
"Det er 30 år siden, DDR faldt. Alligevel huserer resterne af nationens røde aristokrati stadig i de særlige bydele",17.03.2023 00:00,,https://politiken.dk/udland/art9222604/Det-er-30-%C3%A5r-siden-DDR-faldt.-Alligevel-huserer-resterne-af-nationens-r%C3%B8de-aristokrati-stadig-i-de-s%C3%A6rlige-bydele,Politiken,https://politiken.dk/nyheder/,"Hold dig opdateret pÃ¥ de seneste nyheder pÃ¥ politiken.dk: Seneste Politiken, Seneste Danmark, Seneste Kultur og Seneste Internationalt. ",Politiken,https://politiken.dk/nyheder/,06.03.2023 07:18
På Sveriges største sø kan du komme tæt på gamle skibsvrag og smukt slot,18.03.2023 00:00,,https://politiken.dk/rejser/art8989275/P%C3%A5-Sveriges-st%C3%B8rste-s%C3%B8-kan-du-komme-t%C3%A6t-p%C3%A5-gamle-skibsvrag-og-smukt-slot,Politiken,https://politiken.dk/nyheder/,"Hold dig opdateret pÃ¥ de seneste nyheder pÃ¥ politiken.dk: Seneste Politiken, Seneste Danmark, Seneste Kultur og Seneste Internationalt. ",Politiken,https://politiken.dk/nyheder/,06.03.2023 07:18
Stor brand er brudt ud i verdens største flygtningelejr,18.03.2023 00:00,,https://politiken.dk/udland/art9243840/Stor-brand-er-brudt-ud-i-verdens-st%C3%B8rste-flygtningelejr,Politiken,https://politiken.dk/nyheder/,"Hold dig opdateret pÃ¥ de seneste nyheder pÃ¥ politiken.dk: Seneste Politiken, Seneste Danmark, Seneste Kultur og Seneste Internationalt. ",Politiken,https://politiken.dk/nyheder/,06.03.2023 07:18
De kalder ham -Last (Ger)man Standing: Kevin Magnussens nye holdkammerat har en kedelig verdensrekord i formel 1,19.03.2023 00:00,,https://politiken.dk/sport/formel1/art9228776/Kevin-Magnussens-nye-holdkammerat-har-en-kedelig-verdensrekord-i-formel-1,Politiken,https://politiken.dk/nyheder/,"Hold dig opdateret pÃ¥ de seneste nyheder pÃ¥ politiken.dk: Seneste Politiken, Seneste Danmark, Seneste Kultur og Seneste Internationalt. ",Politiken,https://politiken.dk/nyheder/,06.03.2023 07:18
Overenskomst for 40.000 ansatte i servicefagene er på plads,19.03.2023 00:00,,https://politiken.dk/indland/art9243763/Overenskomst-for-40.000-ansatte-i-servicefagene-er-p%C3%A5-plads,Politiken,https://politiken.dk/nyheder/,"Hold dig opdateret pÃ¥ de seneste nyheder pÃ¥ politiken.dk: Seneste Politiken, Seneste Danmark, Seneste Kultur og Seneste Internationalt. ",Politiken,https://politiken.dk/nyheder/,06.03.2023 07:18
Arkitekterne bag udskældt kandidatforslag forklarer sig: Vi foreslår ikke at komprimere to år til ét,21.03.2023 00:00,,https://politiken.dk/indland/uddannelse/art9203704/Vi-foresl%C3%A5r-ikke-at-komprimere-to-%C3%A5r-til-%C3%A9t,Politiken,https://politiken.dk/nyheder/,"Hold dig opdateret pÃ¥ de seneste nyheder pÃ¥ politiken.dk: Seneste Politiken, Seneste Danmark, Seneste Kultur og Seneste Internationalt. ",Politiken,https://politiken.dk/nyheder/,06.03.2023 07:18
Bekymrede danskere med fitnessure skaber kø hos lægen,22.03.2023 00:00,,https://politiken.dk/forbrugogliv/sundhedogmotion/art9243723/Bekymrede-danskere-med-fitnessure-skaber-k%C3%B8-hos-l%C3%A6gen,Politiken,https://politiken.dk/nyheder/,"Hold dig opdateret pÃ¥ de seneste nyheder pÃ¥ politiken.dk: Seneste Politiken, Seneste Danmark, Seneste Kultur og Seneste Internationalt. ",Politiken,https://politiken.dk/nyheder/,06.03.2023 07:18
Drillesyg bolsjevik fik tirret Pia Olsen Dyhr,22.03.2023 00:00,,https://politiken.dk/magasinet/sketiugen/art9235443/Drillesyg-bolsjevik-fik-tirret-Pia-Olsen-Dyhr,Politiken,https://politiken.dk/nyheder/,"Hold dig opdateret pÃ¥ de seneste nyheder pÃ¥ politiken.dk: Seneste Politiken, Seneste Danmark, Seneste Kultur og Seneste Internationalt. ",Politiken,https://politiken.dk/nyheder/,06.03.2023 07:18
De krydrer skandinavisk design med japansk wabi-sabi,23.03.2023 00:00,,https://politiken.dk/kultur/art9205409/De-krydrer-skandinavisk-design-med-japansk-wabi-sabi,Politiken,https://politiken.dk/nyheder/,"Hold dig opdateret pÃ¥ de seneste nyheder pÃ¥ politiken.dk: Seneste Politiken, Seneste Danmark, Seneste Kultur og Seneste Internationalt. ",Politiken,https://politiken.dk/nyheder/,06.03.2023 07:18
»Jeg er overvældet af den internationale interesse« Kasper Thorups stol fra Danmarks næste klassiker er blevet et hit,23.03.2023 00:00,,https://politiken.dk/kultur/art9205408/Kasper-Thorups-stol-fra-Danmarks-n%C3%A6ste-klassiker-er-blevet-et-hit,Politiken,https://politiken.dk/nyheder/,"Hold dig opdateret pÃ¥ de seneste nyheder pÃ¥ politiken.dk: Seneste Politiken, Seneste Danmark, Seneste Kultur og Seneste Internationalt. ",Politiken,https://politiken.dk/nyheder/,06.03.2023 07:18
"Københavns politi oplever mange svindlere, der møder op personligt hos de ældre",23.03.2023 00:00,,https://politiken.dk/indland/art9243709/K%C3%B8benhavns-politi-oplever-mange-svindlere-der-m%C3%B8der-op-personligt-hos-de-%C3%A6ldre,Politiken,https://politiken.dk/nyheder/,"Hold dig opdateret pÃ¥ de seneste nyheder pÃ¥ politiken.dk: Seneste Politiken, Seneste Danmark, Seneste Kultur og Seneste Internationalt. ",Politiken,https://politiken.dk/nyheder/,06.03.2023 07:18
Udenlandske arbejdere kæmper med at få en bankkonto i Danmark,16.03.2023 00:00,,https://politiken.dk/indland/art9236232/Udenlandske-arbejdere-k%C3%A6mper-med-at-f%C3%A5-en-bankkonto-i-Danmark,Politiken,https://politiken.dk/nyheder/,"Hold dig opdateret pÃ¥ de seneste nyheder pÃ¥ politiken.dk: Seneste Politiken, Seneste Danmark, Seneste Kultur og Seneste Internationalt. ",Politiken,https://politiken.dk/nyheder/,06.03.2023 07:18
Bomberyddere og politi undersøger sprængning ved butik i Dragør,01.03.2023 00:00,,https://politiken.dk/indland/kobenhavn/art9244188/Bomberyddere-og-politi-unders%C3%B8ger-spr%C3%A6ngning-ved-butik-i-Drag%C3%B8r,Politiken,https://politiken.dk/nyheder/,"Hold dig opdateret pÃ¥ de seneste nyheder pÃ¥ politiken.dk: Seneste Politiken, Seneste Danmark, Seneste Kultur og Seneste Internationalt. ",Politiken,https://politiken.dk/nyheder/,06.03.2023 07:18
"Bank skrotter kunder, der ikke taler dansk",11.03.2023 00:00,,https://politiken.dk/indland/art9239637/Bank-skrotter-kunder-der-ikke-taler-dansk,Politiken,https://politiken.dk/nyheder/,"Hold dig opdateret pÃ¥ de seneste nyheder pÃ¥ politiken.dk: Seneste Politiken, Seneste Danmark, Seneste Kultur og Seneste Internationalt. ",Politiken,https://politiken.dk/nyheder/,06.03.2023 07:18
"De er dem, som ingen voksne vil lytte til",15.03.2023 00:00,,https://politiken.dk/indland/art9234030/De-er-dem-som-ingen-voksne-vil-lytte-til,Politiken,https://politiken.dk/nyheder/,"Hold dig opdateret pÃ¥ de seneste nyheder pÃ¥ politiken.dk: Seneste Politiken, Seneste Danmark, Seneste Kultur og Seneste Internationalt. ",Politiken,https://politiken.dk/nyheder/,06.03.2023 07:18
Overenskomst for 40.000 ansatte i servicefagene er på plads,19.03.2023 00:00,,https://politiken.dk/indland/art9243763/Overenskomst-for-40.000-ansatte-i-servicefagene-er-p%C3%A5-plads,Politiken,https://politiken.dk/nyheder/,"Hold dig opdateret pÃ¥ de seneste nyheder pÃ¥ politiken.dk: Seneste Politiken, Seneste Danmark, Seneste Kultur og Seneste Internationalt. ",Politiken,https://politiken.dk/nyheder/,06.03.2023 07:18
Lokalt kan der falde op mod 30-40 cm sne: DMI varsler snestorm over Danmark,20.03.2023 00:00,,https://politiken.dk/indland/art9243756/DMI-varsler-snestorm-over-Danmark,Politiken,https://politiken.dk/nyheder/,"Hold dig opdateret pÃ¥ de seneste nyheder pÃ¥ politiken.dk: Seneste Politiken, Seneste Danmark, Seneste Kultur og Seneste Internationalt. ",Politiken,https://politiken.dk/nyheder/,06.03.2023 07:18
Arkitekterne bag udskældt kandidatforslag forklarer sig: Vi foreslår ikke at komprimere to år til ét,21.03.2023 00:00,,https://politiken.dk/indland/uddannelse/art9203704/Vi-foresl%C3%A5r-ikke-at-komprimere-to-%C3%A5r-til-%C3%A9t,Politiken,https://politiken.dk/nyheder/,"Hold dig opdateret pÃ¥ de seneste nyheder pÃ¥ politiken.dk: Seneste Politiken, Seneste Danmark, Seneste Kultur og Seneste Internationalt. ",Politiken,https://politiken.dk/nyheder/,06.03.2023 07:18
"Københavns politi oplever mange svindlere, der møder op personligt hos de ældre",23.03.2023 00:00,,https://politiken.dk/indland/art9243709/K%C3%B8benhavns-politi-oplever-mange-svindlere-der-m%C3%B8der-op-personligt-hos-de-%C3%A6ldre,Politiken,https://politiken.dk/nyheder/,"Hold dig opdateret pÃ¥ de seneste nyheder pÃ¥ politiken.dk: Seneste Politiken, Seneste Danmark, Seneste Kultur og Seneste Internationalt. ",Politiken,https://politiken.dk/nyheder/,06.03.2023 07:18
"»Jeg synes, det er så synd. Jeg kan slet ikke bære det«",07.03.2023 00:00,,https://politiken.dk/indland/art9209666/%C2%BBJeg-synes-det-er-s%C3%A5-synd.-Jeg-kan-slet-ikke-b%C3%A6re-det%C2%AB,Politiken,https://politiken.dk/nyheder/,"Hold dig opdateret pÃ¥ de seneste nyheder pÃ¥ politiken.dk: Seneste Politiken, Seneste Danmark, Seneste Kultur og Seneste Internationalt. ",Politiken,https://politiken.dk/nyheder/,06.03.2023 07:18
"Specialhospitalet forsvarer sig: »Vi kan kun beklage, at det er nødvendigt«",07.03.2023 00:00,,https://politiken.dk/indland/art9218338/%C2%BBVi-kan-kun-beklage-at-det-er-n%C3%B8dvendigt%C2%AB,Politiken,https://politiken.dk/nyheder/,"Hold dig opdateret pÃ¥ de seneste nyheder pÃ¥ politiken.dk: Seneste Politiken, Seneste Danmark, Seneste Kultur og Seneste Internationalt. ",Politiken,https://politiken.dk/nyheder/,06.03.2023 07:18
Politi og forsvar undersøger rudeknusende brag i Ballerup,07.03.2023 00:00,,https://politiken.dk/indland/art9243678/Politi-og-forsvar-unders%C3%B8ger-rudeknusende-brag-i-Ballerup,Politiken,https://politiken.dk/nyheder/,"Hold dig opdateret pÃ¥ de seneste nyheder pÃ¥ politiken.dk: Seneste Politiken, Seneste Danmark, Seneste Kultur og Seneste Internationalt. ",Politiken,https://politiken.dk/nyheder/,06.03.2023 07:18
Politiet tager Audi fra 19-årig efter vanvittig fart på landevej,07.03.2023 00:00,,https://politiken.dk/indland/art9243584/Politiet-tager-Audi-fra-19-%C3%A5rig-efter-vanvittig-fart-p%C3%A5-landevej,Politiken,https://politiken.dk/nyheder/,"Hold dig opdateret pÃ¥ de seneste nyheder pÃ¥ politiken.dk: Seneste Politiken, Seneste Danmark, Seneste Kultur og Seneste Internationalt. ",Politiken,https://politiken.dk/nyheder/,06.03.2023 07:18
Ringsted forbyder TikTok på kommunens telefoner,07.03.2023 00:00,,https://politiken.dk/indland/art9243562/Ringsted-forbyder-TikTok-p%C3%A5-kommunens-telefoner,Politiken,https://politiken.dk/nyheder/,"Hold dig opdateret pÃ¥ de seneste nyheder pÃ¥ politiken.dk: Seneste Politiken, Seneste Danmark, Seneste Kultur og Seneste Internationalt. ",Politiken,https://politiken.dk/nyheder/,06.03.2023 07:18
Hader du også Politikens nye design? Her er godt nyt,07.03.2023 00:00,,https://politiken.dk/indland/art9234828/Hader-du-ogs%C3%A5-Politikens-nye-design-Her-er-godt-nyt,Politiken,https://politiken.dk/nyheder/,"Hold dig opdateret pÃ¥ de seneste nyheder pÃ¥ politiken.dk: Seneste Politiken, Seneste Danmark, Seneste Kultur og Seneste Internationalt. ",Politiken,https://politiken.dk/nyheder/,06.03.2023 07:18
