title,published,text,link,og:site_name,og:url,site_description,name,url,scrape_time
Guvernør: Vi vil ikke hjælpe med at udlevere Trump,04.03.2023 00:00,"Beslutningen om at tiltale Donald Trump er både ""uamerikansk"" og et misbrug af det juridiske system.Sådan lyder meldingen fra Floridas guvernør, Ron DeSantis, som siger, at hans delstat ikke vil assistere i forbindelse med en eventuel anmodning om en udlevering af Donald Trump.Ekspræsidenten har nemlig adresse i Florida, men tiltales på Manhattan i delstaten New York, hvor han forventes at skulle møde op på tirsdag.DeSantis anses af bookmakere og iagttagere for at være Trumps største rival til posten som partiets præsidentkandidat i 2024, selv om han endnu ikke officielt har meddelt sit kandidatur.Få seneste nyt i historien om tiltalen mod Trump i vores liveblog.",https://www.dr.dk,DR,https://www.dr.dk/nyheder,"DR nyheder - Hold dig opdateret. Få de seneste nyheder fra Danmark og udlandet. Læs om de største sager, Kultur, Politik, Viden & Sport her",DR,https://www.dr.dk/nyheder,31.03.2023 07:16
"Tivoli indgår forlig med gæst, som fik metalbor i hovedet fra 60 meter høj forlystelse",11.03.2023 00:00,"Et efterspil i kølvandet på en ulykke i Tivoli i 2019 har nu nået sin afslutning, idet forlystelsesparken har indgået et forlig med en gæst, som fik et metalbor i hovedet.Tivoli skulle ellers have været i retten, hvor anklageren krævede forlystelsesparken idømt en bøde på 140.000 samt en erstatning til gæsten. Det skriver B.T..- Det er korrekt, at der en var sag tilbage fra 2019, som beklageligvis ikke havde fundet sin afslutning. Vi har besluttet at betale. Vi har i øvrigt efterfølgende iværksat en række stramninger og ser med stor alvor på hændelsen, som vi gerne ville have været foruden, siger Tivolis pressechef, Torben Plank, til B.T..Ulykken fandt sted i juni 2019, da et 12 centimeter langt bor landede i hovedet på gæsten fra omkring 60 meters højde.En håndværker tabte to bor fra sin lomme, mens han var ved at udføre noget arbejde i forlystelsen Det Gyldne Tårn, har lokalmediet KøbenhavnLIV, beskrevet.",https://www.dr.dk,DR,https://www.dr.dk/nyheder,"DR nyheder - Hold dig opdateret. Få de seneste nyheder fra Danmark og udlandet. Læs om de største sager, Kultur, Politik, Viden & Sport her",DR,https://www.dr.dk/nyheder,31.03.2023 07:16
Piraterne har forladt danskejet tankskib i Guineabugten: Har taget dele af besætningen med sig,11.03.2023 00:00,"Piraterne har forladt det danskejede tankskib, som blev angrebet i Guineabugten den 25. marts.Det oplyser det danske olie- og shippingselskab Monjasa i en pressemeddelelse.Skibet sejler under liberisk flag og besætningen er ikke dansk.En del af skibets besætningsmedlemmer er blevet befriet og har det ifølge Monjasa godt, men piraterne har samtidig ""taget dele af besætningen med sig"", lyder det.- Vores tanker går til besætningsmedlemmerne, der fortsat er savnet, og deres familier i denne stressende periode, skriver selskabet i pressemeddelelsen.Angrebet fandt sted vest for Pointe-Noire i Congo.Opdateres...",https://www.dr.dk,DR,https://www.dr.dk/nyheder,"DR nyheder - Hold dig opdateret. Få de seneste nyheder fra Danmark og udlandet. Læs om de største sager, Kultur, Politik, Viden & Sport her",DR,https://www.dr.dk/nyheder,31.03.2023 07:16
"I dag lukker coronatestcentrene: Rammer krisen igen, skal selvtest være våbnet",31.03.2023 00:00,"En tur i coronatestcenter var hverdag for mange, da coronapandemien var på sit højeste.Men i dag er den sidste dag, hvor man kan komme ind i de offentlige testcentre og få foretaget en PCR-test for coronavirus på statens regning.Fra april kan man kun blive testet på det offentliges regning, hvis en læge vurderer, at det er nødvendigt.Men rammer krisen hårdt igen, vil selvtest blive våbnet, siger Statens Serum Institut (SSI).- Planen er ikke, at vi vil opsætte egentlige testcentre senere, selvom der skulle blive behov for et større antal test, siger Anne-Marie Vangsted, faglig direktør i SSI, til Ritzau.- Planen er, at vi vil opsætte et selvtestsystem.Systemet skal i så fald fungere ved, at borgere med symptomer får udleveret et testkit, registrerer sig med MitID på en app, tester sig selv derhjemme, afleverer testen og modtager testsvaret.Det er muligt at købe selvtest fra private udbydere.",https://www.dr.dk,DR,https://www.dr.dk/nyheder,"DR nyheder - Hold dig opdateret. Få de seneste nyheder fra Danmark og udlandet. Læs om de største sager, Kultur, Politik, Viden & Sport her",DR,https://www.dr.dk/nyheder,31.03.2023 07:16
Endnu en dag med grå skyer og regn,31.03.2040 00:00,"Morgenen har været særdeles regnvåd og især på sjællandske egne.Det bliver da også endnu en dag uden plads til, at solen får mulighed for at bryde gennem skyerne, og i perioder i løbet af dagen vil det også regne i det meste af landet.I eftermiddag trækker et nyt regnvejr op fra syd, og det giver vand i aften- og nattetimerne.Temperaturen ligger mellem 4 og 10 grader, længst mod syd dog op til 12 grader, mens det i Vendsyssel kun bliver omkring 1-3 grader.Vinden er svag til jævn fra sydvest.",https://www.dr.dk,DR,https://www.dr.dk/nyheder,"DR nyheder - Hold dig opdateret. Få de seneste nyheder fra Danmark og udlandet. Læs om de største sager, Kultur, Politik, Viden & Sport her",DR,https://www.dr.dk/nyheder,31.03.2023 07:16
Magnussen langsomst under kaotisk træning i Melbourne,31.03.2041 00:00,"Kevin Magnussen kom ikke flyvende fra start under træningen til det australske Formel 1 grand prix.Af alle racernes hurtigste omgangstider satte den 30-årige dansker den langsomste. Det blev således til en tid på 1 minut og 21,147 sekunder.Den hurtigste omgang blev sat af Aston Martins Fernando Alonso på 1 minut og 18,887 sekunder.Magnussen fik problemer efter banens nye DRS-zone og kørte en tur i sandet, inden han kom tilbage på banen. Også Sergio Perez måtte en tur i sandet.Forklaringen kom dog, antageligvis, kort efter, da det viste sig, at Albert Park banens GPS-system var brudt sammen.Magnussen og resten af feltet blev sat ned i fart og instrueret til at finde sig på plads i pitten, mens GPS-problemerne blev løst.Små ti minutter senere fik kørerne lov til at komme på banen igen.Lørdag er der kvalifikation, mens det officielle løb skydes i gang klokken søndag morgen dansk tid.",https://www.dr.dk,DR,https://www.dr.dk/nyheder,"DR nyheder - Hold dig opdateret. Få de seneste nyheder fra Danmark og udlandet. Læs om de største sager, Kultur, Politik, Viden & Sport her",DR,https://www.dr.dk/nyheder,31.03.2023 07:16
Prisstigninger rammer overførselsmodtagere hårdt: Først om to år får de mærkbart flere penge,31.03.2051 00:00,Prisstigninger rammer overførselsmodtagere hårdt: Først om to år får de mærkbart flere penge,https://www.dr.dk,DR,https://www.dr.dk/nyheder,"DR nyheder - Hold dig opdateret. Få de seneste nyheder fra Danmark og udlandet. Læs om de største sager, Kultur, Politik, Viden & Sport her",DR,https://www.dr.dk/nyheder,31.03.2023 07:16
Korrespondent om tiltale mod Trump: Mange detaljer i sagen får vi først i næste uge,31.03.2023 07:56,"En storjury på Manhattan har valgt at rejse tiltale mod tidligere præsident i USA Donald Trump.Alene en tiltale mod en forhenværende præsident er historisk, siger DR's korrespondent i USA Lillian Gjerulf Kretz.Men der er fortsat mange detaljer omkring sagen, som offentligheden ikke kender til.Hvad tiltalen handler om vides for eksempel ikke med sikkerhed.- Der er mange uklarheder, fordi tiltalen er forseglet. Måske kommer vi først til at kende omfanget og detaljegraden på tirsdag, forklarer hun.Den dag skal den tidligere præsident stilles for en dommer i New York, hvor han skal have taget fingeraftryk og have taget sit foto til politiets arkiv.Det er også her, han skal forklare, hvordan han forholder sig til tiltalen, om han vil erklære sig skyldig eller ikke skyldig.- Lige nu og her er der meget, vi ikke ved. I amerikanske medier forlyder det dog, at der kan være over 30 tilfælde af forretningssvindel om, hvordan betalinger for eksempel er blevet bogført i Trump-organisationen, og hvorvidt det kan dække over en anden forbrydelse; at det er blevet brugt som kampagnebidrag til en politisk kampagne i 2016.- Det kan være nogle af de anklagepunkter vi taler om i denne tiltale, siger Lillian Gjerulf Kretz.Du kan følge med i reaktionerne på tiltalen mod Trump i vores liveblog.",https://www.dr.dk,DR,https://www.dr.dk/nyheder,"DR nyheder - Hold dig opdateret. Få de seneste nyheder fra Danmark og udlandet. Læs om de største sager, Kultur, Politik, Viden & Sport her",DR,https://www.dr.dk/nyheder,31.03.2023 07:16
"Hvor skal vi lægge en ø, der kan give strøm til fire millioner husstande?",31.03.2023 07:25,"Hvor skal vi lægge en ø, der kan give strøm til fire millioner husstande?",https://www.dr.dk,DR,https://www.dr.dk/nyheder,"DR nyheder - Hold dig opdateret. Få de seneste nyheder fra Danmark og udlandet. Læs om de største sager, Kultur, Politik, Viden & Sport her",DR,https://www.dr.dk/nyheder,31.03.2023 07:16
Politiet søger vidner til skyderi på Frederiksberg i går aftes,31.03.2023 07:17,"Sent i går blev der affyret skud ved Solbjerg Have 28 på Frederiksberg - og nu efterlyser politiet vidner i sagen.Det oplyser Henrik Svejstrup, der er vagtchef ved Københavns Politi til Ritzau.Ingen blev ramt af skud, siger vagtchefen.Politiet søger vidner, der har været i området omkring klokken 23.51 torsdag, som også er det tidspunkt, hvor politiet modtog en anmeldelse om skyderiet.Den formodede gerningsmand beskrives som en mand på 18 til 20 år, der er mellem 160 og 170 centimeter høj. Han skulle være løbet fra stedet.Vagtchefen fortæller, at den formodede gerningsmand beskrives som mellemøstlig af udseende og med et kort fuldskæg, og som ved gerningstidspunktet var iført en sort jakke med hætte, mørke jeans og hvide sko.Politiet kan kontaktes på telefon 1-1-4.",https://www.dr.dk,DR,https://www.dr.dk/nyheder,"DR nyheder - Hold dig opdateret. Få de seneste nyheder fra Danmark og udlandet. Læs om de største sager, Kultur, Politik, Viden & Sport her",DR,https://www.dr.dk/nyheder,31.03.2023 07:16
Næsten to år efter krav fra Folketinget har Team Danmark ikke oprettet whistleblower-ordning,31.03.2023 06:54,Næsten to år efter krav fra Folketinget har Team Danmark ikke oprettet whistleblower-ordning,https://www.dr.dk,DR,https://www.dr.dk/nyheder,"DR nyheder - Hold dig opdateret. Få de seneste nyheder fra Danmark og udlandet. Læs om de største sager, Kultur, Politik, Viden & Sport her",DR,https://www.dr.dk/nyheder,31.03.2023 07:16
Dødstallet stiger voldsomt efter hinduistisk tempel kollapsede,31.03.2023 06:41,"35 personer har mistet livet, og mindst 16 andre er kommet til skade i et hinduistisk tempel, der i går kollapsede i Indore i det centrale Indien.Det oplyser lokale myndigheder ifølge nyhedsbureauet Reuters.- Vi har reddet 18 mennesker, siger en lokal embedsmand ved navn Ilayaraja T.Det er uklart, hvordan ulykken kunne ske, og der er både meldinger om, at taget på templet kollapsede, og at det var gulvet, som kollapsede.Ulykken skete, da bedende var samlet i Indore for at fejre den hinduistiske festival Ram Navami.Redningsarbejdet er fortsat i gang, idet flere personer er faldet ned i en brønd ved templet. Mindst 75 redningsarbejdere og soldater arbejder arbejder på at få dem op, skriver Reuters.",https://www.dr.dk,DR,https://www.dr.dk/nyheder,"DR nyheder - Hold dig opdateret. Få de seneste nyheder fra Danmark og udlandet. Læs om de største sager, Kultur, Politik, Viden & Sport her",DR,https://www.dr.dk/nyheder,31.03.2023 07:16
E-Boks har stadig tekniske problemer - borgere kan ikke logge ind,31.03.2023 06:35,"Hvis du higer efter at finkæmme lønsedlen før fredagsbaren senere i dag, så må du væbne dig med tålmodighed.E-Boks er nemlig stadig nede.- Vi oplever i øjeblikket tekniske problemer, som kan medføre, at du ikke kan logge på, står der på hjemmesiden.De henviser til, at man i mellemtiden kan få vist post fra det offentlige på Borger.dk og Virk.dk.- Vi arbejder på en løsning og beklager ulejligheden, lyder det slutteligt.E-boks har været nede siden i går aftes.",https://www.dr.dk,DR,https://www.dr.dk/nyheder,"DR nyheder - Hold dig opdateret. Få de seneste nyheder fra Danmark og udlandet. Læs om de største sager, Kultur, Politik, Viden & Sport her",DR,https://www.dr.dk/nyheder,31.03.2023 07:16
Fem personer er anholdt for deres rolle i dødelig brand på migrantcenter,31.03.2023 06:32,"Fem personer er blevet anholdt for deres rolle i en af de mest dødelige i Mexico i årevis.Det oplyser mexicanske myndigheder ifølge Ritzau.39 migranter fra El Salvador, Guatemala, Honduras og Colombia døde i branden på et detentionscenter for migranter.Ifølge Mexicos sikkerhedsminister, Rosa Icela Rodriguez, efterforsker man otte personer, der kan være medvirkende til, at branden overhovedet kunne ske, og at disse tæller både statslige og føderale ansatte.Myndighederne mener, at migranterne selv startede branden, da de satte ild til en madras som en protest mod, at de skulle sendes tilbage til deres hjemland.",https://www.dr.dk,DR,https://www.dr.dk/nyheder,"DR nyheder - Hold dig opdateret. Få de seneste nyheder fra Danmark og udlandet. Læs om de største sager, Kultur, Politik, Viden & Sport her",DR,https://www.dr.dk/nyheder,31.03.2023 07:16
Gwyneth Paltrow frikendt i sag om skiulykke,31.03.2023 06:10,"Skuespilleren Gwyneth Paltrow er ikke er ansvarlig for en skiulykke i delstaten Utah i 2016.Det har et nævningeting afgjort.En 76-årig pensioneret optiker ved navn Terry Sanderson havde sagsøgt hende for 300.000 dollar for de skader, han pådrog sig under ulykken.Omvendt hævdede Paltrow, at manden stødte ind i hende bagfra, og det har hun nu fået medhold i.Paltrow havde indgivet et modsøgsmål mod Terry Sanderson, hvor hun søgte om erstatning på én dollar som et symbolsk beløb.Ifølge skuespillerens advokat ønsker hun ikke at kommentere afgørelsen.",https://www.dr.dk,DR,https://www.dr.dk/nyheder,"DR nyheder - Hold dig opdateret. Få de seneste nyheder fra Danmark og udlandet. Læs om de største sager, Kultur, Politik, Viden & Sport her",DR,https://www.dr.dk/nyheder,31.03.2023 07:16
Alle New Yorks betjente beordres på job efter Trump-tiltale,31.03.2023 06:10,"Alle uniformerede betjente i New York City skal fredag være i tjeneste fra klokken syv om morgenen.Det oplyser politiet i New York torsdag i en meddelelse til betjentene ifølge det amerikanske medie NBC News.Meddelelsen blev udsendt klokken 17.33 lokal tid, ganske kort tid efter nyheden om at en storjury på Manhattan havde stemt for at rejse tiltale mod tidligere præsident Donald Trump.Politibetjente af enhver rang skal være klar til tjeneste, og de skal forberede sig på at blive udkommanderet, lyder det i meddelelsen.Meddelelsen minder også betjentene om, at de skal være bekendte med politiets regler for identifikation og deres pligter under ""usædvanlig uorden"".Følg med i situationen efter Trumps tiltale i vores liveblog.",https://www.dr.dk,DR,https://www.dr.dk/nyheder,"DR nyheder - Hold dig opdateret. Få de seneste nyheder fra Danmark og udlandet. Læs om de største sager, Kultur, Politik, Viden & Sport her",DR,https://www.dr.dk/nyheder,31.03.2023 07:16
Korrespondent om tiltale mod Trump: Det her er uden fortilfælde i USA’s historie,31.03.2023 06:05,"Det her er uden fortilfælde i USA’s historie. En tidligere amerikansk præsident - tilmed en kandidat til næste præsidentvalg - er blevet tiltalt.Det er på alle måder ukendt farvand. Alle er lige for loven. Men en anklage mod en tidligere præsident, den måske mest polariserende præsident i nyere amerikansk historie, vil på alle måder blive et opgør også uden for retssalen i New York.Det ser vi allerede. Inden nogen kender anklagerne til fulde, før offentligheden er blevet præsenteret for vidner, fakta eller beviser, så hagler det ned med beskyldninger om politisk forfølgelse på højrefløjen.Det er en dag for historiebøgerne. For USA er nu på vej ned ad en vej, som er ukendt terræn. I mere end 200 år er ingen amerikansk præsident blevet retsforfulgt. Og det er svært at forudse, hvor betændt situationen kan blive frem mod en afgørelse i sagen, og ikke mindst hvilke konsekvenser, den kan få. Der venter et nyt kapitel i USA’s historie.Følg reaktionerne i kølvandet på Trumps tiltalte i vores liveblog.",https://www.dr.dk,DR,https://www.dr.dk/nyheder,"DR nyheder - Hold dig opdateret. Få de seneste nyheder fra Danmark og udlandet. Læs om de største sager, Kultur, Politik, Viden & Sport her",DR,https://www.dr.dk/nyheder,31.03.2023 07:16
Trump bliver tiltalt: Det her er uden fortilfælde i USA’s historie,31.03.2023 06:18,Trump bliver tiltalt: 'Det her er uden fortilfælde i USA’s historie',https://www.dr.dk,DR,https://www.dr.dk/nyheder,"DR nyheder - Hold dig opdateret. Få de seneste nyheder fra Danmark og udlandet. Læs om de største sager, Kultur, Politik, Viden & Sport her",DR,https://www.dr.dk/nyheder,31.03.2023 07:16
Ny måling: Mette Frederiksens popularitet er styrtdykket,31.03.2023 06:00,Ny måling: Mette Frederiksens popularitet er styrtdykket,https://www.dr.dk,DR,https://www.dr.dk/nyheder,"DR nyheder - Hold dig opdateret. Få de seneste nyheder fra Danmark og udlandet. Læs om de største sager, Kultur, Politik, Viden & Sport her",DR,https://www.dr.dk/nyheder,31.03.2023 07:16
LIVE Følg med i reaktionerne efter Trumps tiltale,31.03.2023 05:42,LIVE Følg med i reaktionerne efter Trumps tiltale,https://www.dr.dk,DR,https://www.dr.dk/nyheder,"DR nyheder - Hold dig opdateret. Få de seneste nyheder fra Danmark og udlandet. Læs om de største sager, Kultur, Politik, Viden & Sport her",DR,https://www.dr.dk/nyheder,31.03.2023 07:16
Donald Trump tiltales i sag om tys tys-penge,31.03.2023 01:31,Donald Trump tiltales i sag om 'tys tys'-penge,https://www.dr.dk,DR,https://www.dr.dk/nyheder,"DR nyheder - Hold dig opdateret. Få de seneste nyheder fra Danmark og udlandet. Læs om de største sager, Kultur, Politik, Viden & Sport her",DR,https://www.dr.dk/nyheder,31.03.2023 07:16
Lars Løkke Rasmussen: Finsk Nato-medlemskab styrker vores fælles sikkerhed,01.04.2023 23:28,"Finland kan efter alt at dømme meget snart kalde sig det 31. medlem af forsvarsalliancen Nato, efter Tyrkiets parlament har givet grønt lys til finsk medlemskab.Det glæder Danmarks udenrigsminister, Lars Løkke Rasmussen (M).- Det er meget positivt, at alle 30 Nato-allierede nu har ratificeret Finlands medlemskab af Nato, lyder det fra udenrigsministeren i en skriftlig kommentar.- Finsk medlemskab styrker alliancen og vores fælles sikkerhed. Nu gælder det om at få Sverige med ind over målstregen hurtigst muligt.Sverige afventer stadig svar på deres ansøgning til forsvarsalliancen, som mangler godkendelse af Tyrkiet og Ungarn.",https://www.dr.dk,DR,https://www.dr.dk/nyheder,"DR nyheder - Hold dig opdateret. Få de seneste nyheder fra Danmark og udlandet. Læs om de største sager, Kultur, Politik, Viden & Sport her",DR,https://www.dr.dk/nyheder,31.03.2023 07:16
Tyrkiets parlament har godkendt Finlands ansøgning til Nato,01.04.2023 23:04,"Det tyrkiske parlament vender tommelfingeren opad til Finland som medlem af Nato.Det viser en afstemning i Tyrkiet her til aften ifølge nyhedsbureauet Reuters.Mandag fik finnerne et ja fra Ungarn.Samtlige af Natos 30 medlemslande har således sagt ja til finsk medlemskab, og dermed er det kun formaliteter, der skal klares, før Finland er medlem af forsvarsalliancen, skriver NRK.Tyrkiets præsident Recep Tayyip Erdogan skal officielt godkende beslutningen.Finland ansøgte om optagelse i Nato efter Ruslands invasion af Ukraine sidste år. Det samme gjorde Sverige, der dog endnu afventer grønt lys fra Ungarn og Tyrkiet.",https://www.dr.dk,DR,https://www.dr.dk/nyheder,"DR nyheder - Hold dig opdateret. Få de seneste nyheder fra Danmark og udlandet. Læs om de største sager, Kultur, Politik, Viden & Sport her",DR,https://www.dr.dk/nyheder,31.03.2023 07:16
Flere fagforbund er positivt stemte over arbejdsmiljøaftale,01.04.2023 22:48,"Regeringen og resten af Folketingets partier får overordnet set varme ord med på vejen fra fagforbundene for den arbejdsmiljøaftale, de har indgået i dag.Hos Fagbevægelsens Hovedorganisation (FH) kalder de det en ""stor sejr for danskernes arbejdsmiljø"".- I fagbevægelsen har vi efterlyst en stabil bevilling til Arbejdstilsynet i mange år, og jeg er først og fremmest glad på vegne af de danske lønmodtagere over, at det nu er blevet en realitet, udtaler Morten Skov Christiansen, næstformand i FH, i en pressemeddelelse.Dansk Magisterforenings (DM) formand, Camilla Gregersen, glæder sig over, ""at forligspartierne har valgt at rette et tiltrængt fokus på det psykiske arbejdsmiljø"", mens også HK Handel ser flere positive elementer ved aftalen, som du kan læse mere om her.Formanden for Blik&Rør, der blandt andet har kæmpet for autorisationsordning på asbest-området, er også glad for, at en sådan ordning med aftalen ser ud til at blive en realitet, skriver arbejderforbundet på deres hjemmeside.Dansk Arbejdsgiverforening (DA) er også ""meget tilfreds med balancerne i aftalen"".- Den bygger videre på de mange spor, som allerede er lagt ud i de seneste år blandt andet på baggrund af indspil fra arbejdsmarkedets parter, siger viceadminstrerende direktør i DA Pernille Knudsen.",https://www.dr.dk,DR,https://www.dr.dk/nyheder,"DR nyheder - Hold dig opdateret. Få de seneste nyheder fra Danmark og udlandet. Læs om de største sager, Kultur, Politik, Viden & Sport her",DR,https://www.dr.dk/nyheder,31.03.2023 07:16
En alvorlig diplomatisk krise: Amerikansk journalist anholdt for spionage i Rusland for første gang siden den kolde krig,01.04.2023 21:47,'En alvorlig diplomatisk krise': Amerikansk journalist anholdt for spionage i Rusland for første gang siden den kolde krig,https://www.dr.dk,DR,https://www.dr.dk/nyheder,"DR nyheder - Hold dig opdateret. Få de seneste nyheder fra Danmark og udlandet. Læs om de største sager, Kultur, Politik, Viden & Sport her",DR,https://www.dr.dk/nyheder,31.03.2023 07:16
USA i opsigtsvækkende øvelse: Vi skal vænne os til større militærøvelser i et splittet Arktis,01.04.2023 21:33,USA i opsigtsvækkende øvelse: Vi skal vænne os til større militærøvelser i et splittet Arktis,https://www.dr.dk,DR,https://www.dr.dk/nyheder,"DR nyheder - Hold dig opdateret. Få de seneste nyheder fra Danmark og udlandet. Læs om de største sager, Kultur, Politik, Viden & Sport her",DR,https://www.dr.dk/nyheder,31.03.2023 07:16
Video: Voldsom skovbrand omslutter bjerg i Thailand,01.04.2023 21:31,"Brandfolk forsøger at få kontrol med en voldsom skovbrand, som er brudt ud på to bjerge i Thailand onsdag aften lokal tid.Brandmænd har dog haft svært ved at nå frem og bekæmpe ilden, da bjergene er meget stejle, så i stedet er der indsat helikoptere, som sprøjter vand på flammerne.Skovbranden er brudt ud i provinsen Nakhon Nayok, som ligger 114 kilometer nordøst for Bangkok, skriver nyhedsbureauet AP.",https://www.dr.dk,DR,https://www.dr.dk/nyheder,"DR nyheder - Hold dig opdateret. Få de seneste nyheder fra Danmark og udlandet. Læs om de største sager, Kultur, Politik, Viden & Sport her",DR,https://www.dr.dk/nyheder,31.03.2023 07:16
Det Hvide Hus: Rusland vil tilbyde mad til Nordkorea i bytte for våben,01.04.2023 21:30,"Rusland forsøger at skaffe våben og ammunition fra Nordkorea. I stedet vil russerne tilbyde mad, som der er mangel på i Nordkorea.Det siger talsmand i Det Hvide Hus, John Kirby, ifølge BBC.Nordkorea har tidligere afvist at levere våben, men John Kirby siger på en pressekonference, at USA har fået nye informationer om våbenhandlen.- Ifølge vores informationer vil Rusland sende en delegation til Nordkorea og tilbyde mad i bytte for våben, siger talsmanden.",https://www.dr.dk,DR,https://www.dr.dk/nyheder,"DR nyheder - Hold dig opdateret. Få de seneste nyheder fra Danmark og udlandet. Læs om de største sager, Kultur, Politik, Viden & Sport her",DR,https://www.dr.dk/nyheder,31.03.2023 07:16
‘Der er faldet en sten fra mit hjerte’: Seniorpension betød alt for Lars Vendelbo,01.04.2023 21:17,‘Der er faldet en sten fra mit hjerte’: Seniorpension betød alt for Lars Vendelbo ,https://www.dr.dk,DR,https://www.dr.dk/nyheder,"DR nyheder - Hold dig opdateret. Få de seneste nyheder fra Danmark og udlandet. Læs om de største sager, Kultur, Politik, Viden & Sport her",DR,https://www.dr.dk/nyheder,31.03.2023 07:16
Det største kokain-fund i Norge nogensinde,01.04.2023 20:17,"I Norge har politiet beslaglagt den største mængde kokain nogensinde.I alt fik politiet i Oslo fat i 800 kilo kokain, og værdien er flere hundrede millioner kroner, skriver NRK.Beslaglæggelsen kommer i forbindelse med, at tysk politi i tirsdags beslaglagde 1.200 kilo kokain i nogle banankasser i Potsdam. Derefter tippede de norsk politi.- Vi har et godt internationalt samarbejde, og med den information vi fik, kunne toldere spore kokainen, siger Tim Gurrik fra de norske toldmyndigheder.",https://www.dr.dk,DR,https://www.dr.dk/nyheder,"DR nyheder - Hold dig opdateret. Få de seneste nyheder fra Danmark og udlandet. Læs om de største sager, Kultur, Politik, Viden & Sport her",DR,https://www.dr.dk/nyheder,31.03.2023 07:16
Bolsonaro vender tilbage – til jubelbrøl og bekymring,01.04.2023 19:59,Bolsonaro vender tilbage – til jubelbrøl og bekymring,https://www.dr.dk,DR,https://www.dr.dk/nyheder,"DR nyheder - Hold dig opdateret. Få de seneste nyheder fra Danmark og udlandet. Læs om de største sager, Kultur, Politik, Viden & Sport her",DR,https://www.dr.dk/nyheder,31.03.2023 07:16
