title,published,text,link,og:site_name,og:url,site_description,name,url,scrape_time
Rusland: Amerikanske efterretninger om Nord Stream-sprængning er en afledningsmanøvre,14.03.2023 00:00,"Det er et forsøg på at aflede opmærksomheden, når internationale medier på baggrund af efterretninger, som amerikanske embedsfolk har gennemgået, skriver, at det tyder på, at en pro-ukrainsk gruppe står bag sprængningerne på Nord Stream-ledningerne i Østersøen.Sådan lyder det fra den russiske regering i Kreml.Talsperson Dmitry Peskov siger ifølge Reuters, at Rusland er forvirret over, hvordan amerikanske myndigheder kan antage noget som helst, når der ikke foreligger en færdig undersøgelse.- Det er tydeligt, at forfatterne til angrebet vil aflede opmærksomheden. Det er tydeligvis en koordineret fodring af medierne, siger han.Også Tyskland har i dag kommenteret efterretningerne.Ifølge Tysklands forsvarsminister, Boris Pistorius, skal man være varsom med at lave forhastede konklusioner om, hvem der står bag sprængningerne.- Det kan lige så vel have været en false-flag operation, iscenesat til at skyde skylden på Ukraine, siger han ifølge Reuters.DR kan ikke be- eller afkræfte nogen af meldingerne.",https://www.dr.dk,DR,https://www.dr.dk/nyheder,"DR nyheder - Hold dig opdateret. Få de seneste nyheder fra Danmark og udlandet. Læs om de største sager, Kultur, Politik, Viden & Sport her",DR,https://www.dr.dk/nyheder,08.03.2023 07:17
ANALYSE Ruslands krig kan forvandle EU til en krigsmaskine,19.03.2023 00:00,ANALYSE Ruslands krig kan forvandle EU til en krigsmaskine,https://www.dr.dk,DR,https://www.dr.dk/nyheder,"DR nyheder - Hold dig opdateret. Få de seneste nyheder fra Danmark og udlandet. Læs om de største sager, Kultur, Politik, Viden & Sport her",DR,https://www.dr.dk/nyheder,08.03.2023 07:17
"Kulturministeriet opretter ny pris: Vil hylde dem, der gør en indsats for ligestilling",08.03.2032 00:00,"En ny pris skal sætte fokus på ligestilling i kulturlivet. Det er visionen for Kulturmininister Jakob Engel-Schmidt, skriver Kulturministeriet i en pressemeddelelse i anledning af Kvindernes Internationale Kampdag.Prisen er opkaldt efter den socialdemokratiske politiker Bodil Koch, som blandt andet var Kirkeminister og Kulturminister i løbet af sin tid i Folketinget fra 1947 til 1971.- Vi skriver 2023 i kalenderen, men alligevel er det sådan, at ens mulighed for at udfolde sig og få succes påvirkes af ens køn og hudfarve, udtaler Kulturministeren i pressemeddelelsen.- Bodil Koch-prisen skal hylde dem, der tager ansvar og gør en forskel for at skabe ligestilling og diversitet i kulturlivet, og så håber jeg, at prisen vil skabe masser af debat og inspirere endnu flere til at tage kampen op.Prisen uddeles første gang i år, og komitéen, der skal udpege vinderen i samarbejde med ministeren, består i 2023 af Caspar Eric, Christina Rosendahl, Fallulah, Marie-Lydie Nokouda, Sofie Linde og Mette Bennedsen.",https://www.dr.dk,DR,https://www.dr.dk/nyheder,"DR nyheder - Hold dig opdateret. Få de seneste nyheder fra Danmark og udlandet. Læs om de største sager, Kultur, Politik, Viden & Sport her",DR,https://www.dr.dk/nyheder,08.03.2023 07:17
"SF foreslår at give fodlænke på, når tilhold bliver brudt",08.03.2040 00:00,"Ifølge SF skal personer, der bryder med et tilhold, fremover kunne iføres en fodlænke.Det kunne eksempelvis være en voldelig mand, der chikanerer sin ekskæreste. På den måde har politiet mulighed for at opdage, om han kommer for tæt på sit offer.Det er ét af otte initiativer, som SF ifølge Ritzau foreslår skal hjælpe kvinder, der er udsat for vold.- Vi kan desværre se, at ud af de brud, der sker på tilhold i dag, begås størstedelen af en lille kreds, siger Karina Lorentzen Dehnhardt, som er SF's retsordfører, til Ritzau.- Jeg tænker, at det vil være oplagt at give dem en fodlænke på, fordi jeg tænker, at det vil hjælpe dem til at lade være med at bryde tilholdet igen.SF foreslår, at fodlænken skal suppleres med en GPS, hvis et tilhold bliver overtrådt.",https://www.dr.dk,DR,https://www.dr.dk/nyheder,"DR nyheder - Hold dig opdateret. Få de seneste nyheder fra Danmark og udlandet. Læs om de største sager, Kultur, Politik, Viden & Sport her",DR,https://www.dr.dk/nyheder,08.03.2023 07:17
Det er glat derude her til morgen: Stor risiko for sort is og lokalt utroligt glatte veje nogle timer endnu,08.03.2023 07:03,Det er glat derude her til morgen: 'Stor risiko for sort is og lokalt utroligt glatte veje nogle timer endnu',https://www.dr.dk,DR,https://www.dr.dk/nyheder,"DR nyheder - Hold dig opdateret. Få de seneste nyheder fra Danmark og udlandet. Læs om de største sager, Kultur, Politik, Viden & Sport her",DR,https://www.dr.dk/nyheder,08.03.2023 07:17
Dansk cykelsports guldalder vinder cykelløb på stribe: Der har aldrig været noget lignende,08.03.2023 07:02,Dansk cykelsports 'guldalder' vinder cykelløb på stribe: 'Der har aldrig været noget lignende',https://www.dr.dk,DR,https://www.dr.dk/nyheder,"DR nyheder - Hold dig opdateret. Få de seneste nyheder fra Danmark og udlandet. Læs om de største sager, Kultur, Politik, Viden & Sport her",DR,https://www.dr.dk/nyheder,08.03.2023 07:17
"Guldfund afslører: Danskerne troede på Odin, Thor og Loke langt tidligere end først antaget",08.03.2023 06:53,"Guldfund afslører: Danskerne troede på Odin, Thor og Loke langt tidligere end først antaget",https://www.dr.dk,DR,https://www.dr.dk/nyheder,"DR nyheder - Hold dig opdateret. Få de seneste nyheder fra Danmark og udlandet. Læs om de største sager, Kultur, Politik, Viden & Sport her",DR,https://www.dr.dk/nyheder,08.03.2023 07:17
Wagner-gruppens stifter: Vi har taget kontrol med det østlige Bakhmut,08.03.2023 06:51,"Wagner-gruppen har taget fuld kontrol med den østlige del af den østukrainske by Bakhmut.I hvert fald ifølge stifteren af det russiske, private militærfirma, Jevgenij Prigozjin, skriver nyhedsbureauet Reuters.- Enheder fra det private militærfirma Wagner har taget kontrol over den østlige del af Bakhmut, sagde Jevgenij Prigozjin i en stemmeoptagelse på beskedtjenesten Telegram.- Alt øst for Bakhmut-floden er fuldstændig under kontrollen med Wagner.Reuters har ikke uafhængigt kunnet verificere udtalelserne. Jevgenij Prigozjin har før udstedt påstande om succes, der ikke holdt stik.Bakhmut har i flere måneder været et omdrejningspunkt i krigen mellem Ukraine og Rusland.",https://www.dr.dk,DR,https://www.dr.dk/nyheder,"DR nyheder - Hold dig opdateret. Få de seneste nyheder fra Danmark og udlandet. Læs om de største sager, Kultur, Politik, Viden & Sport her",DR,https://www.dr.dk/nyheder,08.03.2023 07:17
"Onsdag starter kold, men giver meget sol",08.03.2023 06:30,"Hele landet kan stå op til temperaturer under frysepunktet.Vi har målt de laveste temperaturer i år med – 11,1 grader ved Tylstrup i Nordjylland, og flere steder i Jylland er minusgraderne også tocifrede.Det betyder også, at der er stor risiko for meget glatte veje i hele landet.Temperaturen stiger langsomt til et niveau mellem 0 og 4 grader, da solen får en del plads på himlen i dag. Der kan være enkelte byger med sne eller slud.Vinden er aftaget og er de fleste steder svag til jævn fra skiftende retninger. Igen i nat kan temperaturen nå samme niveau som vi ser i dag.",https://www.dr.dk,DR,https://www.dr.dk/nyheder,"DR nyheder - Hold dig opdateret. Få de seneste nyheder fra Danmark og udlandet. Læs om de største sager, Kultur, Politik, Viden & Sport her",DR,https://www.dr.dk/nyheder,08.03.2023 07:17
Fem kvinder sagsøger Texas for at nægte abort trods livsfare,08.03.2023 06:26,"Fem kvinder, som siger, de er blevet nægtet at få en abort på trods af alvorlig fare for deres liv, har sagsøgt delstaten Texas i USA.Det skriver Reuters. Det er den første kendte sag, hvor kvinder har indgivet søgsmål mod de begrænsninger, en afgørelse ved højesteret sidste år medførte for kvinders abortrettigheder i USA.Søgsmålet, der blev sendt mandag, har bedt en domstol i Austin gøre klart, at læger ikke kan straffes, hvis de udfører en abort, hvis deres vurdering er, at kvinden ellers ville være i livsfare.I Texas betyder nye abortregler nemlig, at læger kan blive straffet for at udføre en abort.De nye regler kom som resultat af, at den amerikanske højesteret sidste år omstødte en afgørelse fra 1973, der gav kvinder ret til abort, og det har betydet strammere regler flere steder i landet.",https://www.dr.dk,DR,https://www.dr.dk/nyheder,"DR nyheder - Hold dig opdateret. Få de seneste nyheder fra Danmark og udlandet. Læs om de største sager, Kultur, Politik, Viden & Sport her",DR,https://www.dr.dk/nyheder,08.03.2023 07:17
Rigspolitiet har skrottet åbenhed i klager over politiet,08.03.2023 06:05,Rigspolitiet har skrottet åbenhed i klager over politiet ,https://www.dr.dk,DR,https://www.dr.dk/nyheder,"DR nyheder - Hold dig opdateret. Få de seneste nyheder fra Danmark og udlandet. Læs om de største sager, Kultur, Politik, Viden & Sport her",DR,https://www.dr.dk/nyheder,08.03.2023 07:17
Veterankoordinatorer sendes til Kosovo for første gang,08.03.2023 06:03,"Flere af de såkaldte veterankoordinatorer, som er ansat i 68 af landets 98 kommuner, har ikke selv erfaring fra Forsvaret.Det skal den første studietur for veterankoordinatorer nu lave om på.Turen går til Kosovo, hvor 14 veterankoordinatorer i denne uge blandt andet skal besøge lejren Camp Filmcity i Pristina og Camp Novo Selo nord for Pristina.Her skal de tale med de danske soldater i lejren om boligforhold, restriktioner på bevægelsesfrihed, afsavn til familien, arbejdslivet i en fremmed kultur og missionsopgaver.- To dage er vidt forskelligt fra et halvt års udsendelse, men det giver dog et indblik i de forhold, man arbejder og lever under, mens man er udsendt, forklarer veterankoordinator fra Skive Kommune Claus Mosbæk, der står bag turen.Kommunerenes veterankoordinatorer hjælper soldater med de behov, der kan opstå efter en udsationering, for eksempel boligsøgning, gældsrådgivning eller psykologhjælp.",https://www.dr.dk,DR,https://www.dr.dk/nyheder,"DR nyheder - Hold dig opdateret. Få de seneste nyheder fra Danmark og udlandet. Læs om de største sager, Kultur, Politik, Viden & Sport her",DR,https://www.dr.dk/nyheder,08.03.2023 07:17
I dag bliver den første CO2 pumpet tilbage i undergrunden,08.03.2023 06:00,I dag bliver den første CO2 pumpet tilbage i undergrunden,https://www.dr.dk,DR,https://www.dr.dk/nyheder,"DR nyheder - Hold dig opdateret. Få de seneste nyheder fra Danmark og udlandet. Læs om de største sager, Kultur, Politik, Viden & Sport her",DR,https://www.dr.dk/nyheder,08.03.2023 07:17
STIL SPØRGSMÅL Fagforeninger og arbejdsgivere diskuterer lige nu din løn og dine arbejdsvilkår. Hvor står forhandlingerne?,08.03.2023 06:00,STIL SPØRGSMÅL Fagforeninger og arbejdsgivere diskuterer lige nu din løn og dine arbejdsvilkår. Hvor står forhandlingerne?,https://www.dr.dk,DR,https://www.dr.dk/nyheder,"DR nyheder - Hold dig opdateret. Få de seneste nyheder fra Danmark og udlandet. Læs om de største sager, Kultur, Politik, Viden & Sport her",DR,https://www.dr.dk/nyheder,08.03.2023 07:17
Pas på derude - sne og is giver glatte veje i store dele af landet,08.03.2023 05:32,"Man bør være varsom, når man bevæger sig ud i morgentrafikken her til morgen. Snevejret, der i går og i nat væltede ned over store dele af Danmark, har efterladt sig spor.Og det betyder, at der er risiko for isglatte veje i store dele af landet. Det viser et trafikkort hos Vejdirektoratet.Næsten hele Sjælland, Odense og Jylland er dækket af en blå farve, der varsler om pletvist glat føre.Også politiet advarer her til morgen mod isen på vejen. Midt- og Vestsjællands Politi oplyser til Ritzau, at glatte veje har ført til småuheld i løbet af natten.- Der er pletvis isglatte veje flere steder. Sæt hastigheden ned, hold afstand og vis hensyn, skriver politiet på Twitter.",https://www.dr.dk,DR,https://www.dr.dk/nyheder,"DR nyheder - Hold dig opdateret. Få de seneste nyheder fra Danmark og udlandet. Læs om de største sager, Kultur, Politik, Viden & Sport her",DR,https://www.dr.dk/nyheder,08.03.2023 07:17
Amerikansk toppolitiker bekræfter besøg med Taiwans præsident,08.03.2023 05:16,"Den Republikanske formand for Repræsentanternes Hus, Kevin McCarthy, bekræfter, at han har planer om at mødes med Taiwans præsident, Tsai Ing-wen.Det skriver det amerikanske medie Bloomberg ifølge Ritzau.Også Tsai Ing-wens stab har bekræftet, at der lægges planer om en udenlandsrejse, og at detaljer vil blive offentliggjort, når de er på plads.Nyheden kommer, dagen efter at Kinas nye udenrigsminister har understreget, at Taiwan er en rød linje, som USA ikke må krydse.- Det er den første røde linje, som ikke må blive overskredet i forholdet mellem Kina og USA, sagde udenrigsminister Qin Gang.",https://www.dr.dk,DR,https://www.dr.dk/nyheder,"DR nyheder - Hold dig opdateret. Få de seneste nyheder fra Danmark og udlandet. Læs om de største sager, Kultur, Politik, Viden & Sport her",DR,https://www.dr.dk/nyheder,08.03.2023 07:17
Chelsea overvinder nederlag i første kamp og er i CL-kvartfinalen,09.03.2023 23:12,"Chelsea skulle bruge en sejr for at kunne gå videre fra Champions Leagues ottendedelsfinaler, da de i første kamp tabte 1-0 i Dortmund.Den opgave levede englænderne op til, da de tirsdag aften besejrede tyske Borussia Dortmund med 2-0.Raheem Sterling bragte Chelsea foran med 1-0 lige inden pausen, og så var opgøret helt lige.Scoringen til 2-0 sørgede Kai Havertz for på straffespark. Tyskeren brændte ellers sit forsøg, men fik en chance til, da dommeren dømte omspark på grund af, at flere spillere var løbet i feltet, inden Havertz havde nået at trykke til kuglen.På anden forsøg svigtede angriberen ikke, og så kan Chelsea glæde sig over at være i kvartfinalen i Europas fineste klubturnering.",https://www.dr.dk,DR,https://www.dr.dk/nyheder,"DR nyheder - Hold dig opdateret. Få de seneste nyheder fra Danmark og udlandet. Læs om de største sager, Kultur, Politik, Viden & Sport her",DR,https://www.dr.dk/nyheder,08.03.2023 07:17
Helsingørmotorvejen åben for trafik igen: Lukkede grundet usædvanligt glat føre,09.03.2023 23:08,"En strækning på Helsingørmotorvejen har tirsdag aften været spærret på grund af usædvanligt glat føre.Men lidt før klokken 23.00 er motorvejen genåbnet, da der nu er blevet saltet, oplyser Nordsjællands Politi på Twitter.- Generelt er der meget glat i hele kredsen, så husk tæpper og mobiltelefon, hvis du skal ud at køre. Kør meget forsigtigt, lyder det.Motorvejen blev spærret tidligere tirsdag aften, da politikredsen efter flere færdselsuheld vurderede, at den ikke kunne stå inde for sikkerheden på strækket.Også flere andre steder i landet er der meget glat på vejene. I store dele af Østjylland er der således ""sort is"", skriver Østjyllands Politi ligeledes på Twitter.",https://www.dr.dk,DR,https://www.dr.dk/nyheder,"DR nyheder - Hold dig opdateret. Få de seneste nyheder fra Danmark og udlandet. Læs om de største sager, Kultur, Politik, Viden & Sport her",DR,https://www.dr.dk/nyheder,08.03.2023 07:17
Benfica smadrer Club Brugge og går i kvartfinalen i Champions League,09.03.2023 23:02,"Benfica ligner en velsmurt maskine og en modstander, som de andre Champions League bør frygte.Her til aften vandt portugiserne, der startede med danske Alexander Bah på højre back, nemlig med hele 5-1 over belgiske Club Brugge.Casper Nielsen startede inde for belgierne, mens den skadede Andreas Skov Olsen var ud ude med skade.Der var aldrig tvivl om kampens udfald, og man kunne have håbet på debut til danske Casper Tengstedt for Benfica, da de førte med 5-0, da der var et kvarter igen.Det skete dog ikke, men i stedte fik Brugge et trøstemål med 3 minutter igen.Portugiserne går videre med sammenlagt 7-1 over de to kampe.",https://www.dr.dk,DR,https://www.dr.dk/nyheder,"DR nyheder - Hold dig opdateret. Få de seneste nyheder fra Danmark og udlandet. Læs om de største sager, Kultur, Politik, Viden & Sport her",DR,https://www.dr.dk/nyheder,08.03.2023 07:17
"Det Hvide Hus støtter lovforslag, der skal muliggøre et nationalt forbud mod TikTok",09.03.2023 22:35,"Den amerikanske regering bakker op om et lovforslag, som vil give den beføjelser til at forbyde TikTok og andre udenlandske teknologier, såfremt de vurderes at udgøre en national sikkerhedsrisiko.Det oplyser USA's nationale sikkerhedsrådgiver, Jake Sullivan, ifølge Reuters i en udtalelse tirsdag.Samtidig opfordrer den amerikanske regering Kongressen til at vedtage lovforslaget, som møder opbakning fra både Demokrater og Republikanere, hurtigst muligt.- Vi ser frem til at fortsætte samarbejdet med Demokraterne og Republikanerne om lovforslaget, og vi opfordrer Kongressen til hurtigst muligt at sende det til præsidentens skrivebord, siger Jake Sullivan ifølge Reuters.",https://www.dr.dk,DR,https://www.dr.dk/nyheder,"DR nyheder - Hold dig opdateret. Få de seneste nyheder fra Danmark og udlandet. Læs om de største sager, Kultur, Politik, Viden & Sport her",DR,https://www.dr.dk/nyheder,08.03.2023 07:17
Internationale medier: Nye oplysninger inddrager mystisk båd og Christiansø i Nordstream-sprængninger,09.03.2023 22:24,Internationale medier: Nye oplysninger inddrager mystisk båd og Christiansø i Nordstream-sprængninger,https://www.dr.dk,DR,https://www.dr.dk/nyheder,"DR nyheder - Hold dig opdateret. Få de seneste nyheder fra Danmark og udlandet. Læs om de største sager, Kultur, Politik, Viden & Sport her",DR,https://www.dr.dk/nyheder,08.03.2023 07:17
Motorvejsstrækning lukket af politiet grundet vejret: Vi kan ikke stå inde for sikkerheden,09.03.2023 21:46,"Vejret i dag har mildest talt ikke været forårsagtigt, og det har påvirket forholdene på vejene.Flere af landets politikredse oplyser, at man oplever mange færdselsuheld grundet sne og glatte veje, og bilister opfordres til at køre forsigtigt.Vintervejret har blandt andet medført, at Nordsjællands Politi har set sig nødsaget til at lukke en strækning på Helsingørmotorvejen mellem Kokkedal og Espergærde grundet ""sort is"".- Problemet er omfangsrigt og vi kan ikke stå inde for sikkerheden p.t. En del færdselsuheld er sket på strækningen, hvor man næsten ikke kan stå uden at glide, skriver politikredsen på Twitter.Sort is er is, der dannes på vejbanen, men som på grund af isens gennemsigtighed kan være svær at se. Også Østjyllands Politi advarer om sort is i store dele af Østjylland.",https://www.dr.dk,DR,https://www.dr.dk/nyheder,"DR nyheder - Hold dig opdateret. Få de seneste nyheder fra Danmark og udlandet. Læs om de største sager, Kultur, Politik, Viden & Sport her",DR,https://www.dr.dk/nyheder,08.03.2023 07:17
Havde adgang til personlige oplysninger om tusinder af borgere: Styrelse har politianmeldt tidligere ansat,09.03.2023 21:18,Havde adgang til personlige oplysninger om tusinder af borgere: Styrelse har politianmeldt tidligere ansat,https://www.dr.dk,DR,https://www.dr.dk/nyheder,"DR nyheder - Hold dig opdateret. Få de seneste nyheder fra Danmark og udlandet. Læs om de største sager, Kultur, Politik, Viden & Sport her",DR,https://www.dr.dk/nyheder,08.03.2023 07:17
"Korrespondent: Den koster dem nu, men i det lange løb kan byggearbejderne vinde på ny aftale",09.03.2023 21:02,"Korrespondent: Den koster dem nu, men i det lange løb kan byggearbejderne vinde på ny aftale",https://www.dr.dk,DR,https://www.dr.dk/nyheder,"DR nyheder - Hold dig opdateret. Få de seneste nyheder fra Danmark og udlandet. Læs om de største sager, Kultur, Politik, Viden & Sport her",DR,https://www.dr.dk/nyheder,08.03.2023 07:17
"På Vestbredden lever to kvinder i samme by, men i hvert deres univers",09.03.2023 20:50,"På Vestbredden lever to kvinder i samme by, men i hvert deres univers",https://www.dr.dk,DR,https://www.dr.dk/nyheder,"DR nyheder - Hold dig opdateret. Få de seneste nyheder fra Danmark og udlandet. Læs om de største sager, Kultur, Politik, Viden & Sport her",DR,https://www.dr.dk/nyheder,08.03.2023 07:17
Erdogan sakker bagud i ny meningsmåling,09.03.2023 20:25,"I går valgte seks oppositionspartier deres præsidentkandidat, som skal op imod Recep Tayyip Erdogan ved præsidentvalget i Tyrkiet den 14. maj. Valget landede på 74-årige Kemal Kilicdarogly fra Det Republikanske Folkeparti (CHP).Og i dag viser en ny meningsmåling fra ORC Asatirma, at vælgerne foretrækker Kilicdaroglu lige nu. 56,8 procent af vælgerne siger nemlig, at de ville stemme på Kilicdaroglu, hvis de skulle vælge mellem ham og præsident Erdogan.Tilbage står Erdogan med 43,2 procent af stemmerne.Meningsmålingen er lavet 4.-6. marts, og altså dermed før Kilicdaroglu officielt blev valgt som præsidentkandidaten for oppositionen.",https://www.dr.dk,DR,https://www.dr.dk/nyheder,"DR nyheder - Hold dig opdateret. Få de seneste nyheder fra Danmark og udlandet. Læs om de største sager, Kultur, Politik, Viden & Sport her",DR,https://www.dr.dk/nyheder,08.03.2023 07:17
"Storbritannien vil afvise og tilbageholde asylansøgere, der kommer til landet i gummibåd",09.03.2023 20:12,"Storbritannien vil afvise og tilbageholde asylansøgere, der kommer til landet i gummibåd",https://www.dr.dk,DR,https://www.dr.dk/nyheder,"DR nyheder - Hold dig opdateret. Få de seneste nyheder fra Danmark og udlandet. Læs om de største sager, Kultur, Politik, Viden & Sport her",DR,https://www.dr.dk/nyheder,08.03.2023 07:17
"Cort er i gult og Vingegaard vandt, men alligevel er Pogacar favorit, mener ekspert",09.03.2023 19:31,"Cort er i gult og Vingegaard vandt, men alligevel er Pogacar favorit, mener ekspert",https://www.dr.dk,DR,https://www.dr.dk/nyheder,"DR nyheder - Hold dig opdateret. Få de seneste nyheder fra Danmark og udlandet. Læs om de største sager, Kultur, Politik, Viden & Sport her",DR,https://www.dr.dk/nyheder,08.03.2023 07:17
Partier vil sikre ofre for grove politifejl økonomisk plaster på såret,09.03.2023 19:30,Partier vil sikre ofre for grove politifejl økonomisk plaster på såret,https://www.dr.dk,DR,https://www.dr.dk/nyheder,"DR nyheder - Hold dig opdateret. Få de seneste nyheder fra Danmark og udlandet. Læs om de største sager, Kultur, Politik, Viden & Sport her",DR,https://www.dr.dk/nyheder,08.03.2023 07:17
Forligsinstitutionen opfordrer til at fremskynde resterende overenskomstforhandlinger,09.03.2023 18:57,"Der skal ekstra fart på de resterende overenskomstforhandlinger.Forligsmand Jan Reckendorff opfordrer til at fremskynde forhandlingerne på alle områder, hvor parterne endnu ikke er nået til enighed om en ny overenskomst.Det oplyser Forligsinstitutionen i en pressemeddelelse.- Jeg opfordrer fortsat alle overenskomstparter, hvor der endnu ikke er opnået forlig, til at fremskynde forhandlingerne om at forny overenskomsterne mest muligt med henblik på en afklaring, skriver Jan Reckendorff.I meddelelsen fremgår det også, at de resterende forhandlinger nu foregår i Forliginstitutionens regi, hvilket betyder, at Forligsinstitutionen har den overordnede styring med forhandlingerne, der dog fortsat foregår direkte mellem parterne.Tidligere i dag blev 3F og Dansk Industri enige om en ny overenskomst, der sætter rammerne for omtrent 165.000 ansatte i bygge- og anlægssektoren, og dermed faldt den sidste store brik på plads i årets overenskomtsforhandlinger.",https://www.dr.dk,DR,https://www.dr.dk/nyheder,"DR nyheder - Hold dig opdateret. Få de seneste nyheder fra Danmark og udlandet. Læs om de største sager, Kultur, Politik, Viden & Sport her",DR,https://www.dr.dk/nyheder,08.03.2023 07:17
Vindmølleindustrien kritiserer regeringen for at nøle med plan for havvindmøller,09.03.2023 18:44,Vindmølleindustrien kritiserer regeringen for at nøle med plan for havvindmøller,https://www.dr.dk,DR,https://www.dr.dk/nyheder,"DR nyheder - Hold dig opdateret. Få de seneste nyheder fra Danmark og udlandet. Læs om de største sager, Kultur, Politik, Viden & Sport her",DR,https://www.dr.dk/nyheder,08.03.2023 07:17
Christian vil stemme nej til ny aftale: Højere miminumsløn vil hjælpe udenlandske arbejdere - ikke et boligtillæg,09.03.2023 18:33,Christian vil stemme nej til ny aftale: 'Højere miminumsløn vil hjælpe udenlandske arbejdere - ikke et boligtillæg',https://www.dr.dk,DR,https://www.dr.dk/nyheder,"DR nyheder - Hold dig opdateret. Få de seneste nyheder fra Danmark og udlandet. Læs om de største sager, Kultur, Politik, Viden & Sport her",DR,https://www.dr.dk/nyheder,08.03.2023 07:17
Nu må børn overnatte på krisecenter uden forældrenes tilladelse,09.03.2023 18:30,Nu må børn overnatte på krisecenter uden forældrenes tilladelse,https://www.dr.dk,DR,https://www.dr.dk/nyheder,"DR nyheder - Hold dig opdateret. Få de seneste nyheder fra Danmark og udlandet. Læs om de største sager, Kultur, Politik, Viden & Sport her",DR,https://www.dr.dk/nyheder,08.03.2023 07:17
Fem palæstinensere dræbt i israelsk angreb,09.03.2023 17:53,"Israelsk militær har i dag stormet en flygtningelejr og omringet et hus på den besatte Vestbred.Mindst fem pælestinensere er dræbt og ni såret i angrebet, oplyser de palæstinensiske sundhedsmyndigheder ifølge Reuters.Ifølge nyhedsbureauet AP meddeler det isralske militær, at en af de dræbte mistænkes for at være gerningsmanden bag skuddrabene på to jødiske brødre fra en bosættelse nær den palæstinesiske landsby Huwara i sidste uge.Huwara har den seneste tid dannet ramme om en række blodige sammenstød mellem palæstinensere og israelere.",https://www.dr.dk,DR,https://www.dr.dk/nyheder,"DR nyheder - Hold dig opdateret. Få de seneste nyheder fra Danmark og udlandet. Læs om de største sager, Kultur, Politik, Viden & Sport her",DR,https://www.dr.dk/nyheder,08.03.2023 07:17
