title,published,text,link,og:site_name,og:url,site_description,name,url,scrape_time
13-årig dreng kører i stjålet bil: Tre kvinder mister livet i trafikulykke,05.05.2023 00:00,"To kvinder og en teenagepige har mistet livet i en trafikulykke i Maryborough i det østlige Australien. Ifølge politiet var ulykken forårsaget af en 13-årig dreng, der kørte i en stjålet Mercedes.Det skriver medierne ABC News og The Guardian.Den 13-årige dreng påkørte en anden bil bagfra, som blev skubbet over i den modsatte side af kørebanen. Her ramte bilen en tredje bil.Ved sammenstødet blev en 52-årig kvinde, en 17-årig pige og en 29-årig kvinde dræbt. En fjerde kvinde på 23 år overlevede, men fik alvorlige kvæstelser.Efterfølgende har politiet oplyst, at den 23-årige kvinde ""kæmper for sit liv"", skriver ABC News.Den 13-årige dreng slap selv fra ulykken med skader i sin ene fod. Han er nu sigtet for at have kørt hensynsløst og i den forbindelse at have forårsaget de tre dødsfald.",https://www.dr.dk,DR,https://www.dr.dk/nyheder,"DR nyheder - Hold dig opdateret. Få de seneste nyheder fra Danmark og udlandet. Læs om de største sager, Kultur, Politik, Viden & Sport her",DR,https://www.dr.dk/nyheder,01.05.2023 07:17
Formandspost i Legos pengetank skifter fra far til søn,14.05.2023 00:00,"Som ventet overtager Thomas Kirk Kristiansen mandag posten som bestyrelsesformand i pengetanken bag Lego, Kirkbi.Det oplyser Kirkbi i en pressemeddelelse.Thomas Kirk Kristiansen er søn af den afgående bestyrelsesformand, Kjeld Kirk Christiansen.Med overgangen ""er det glidende generationsskifte fra tredje generation til fjerde generation i Kirk Kristiansen-familien formelt afsluttet"", meddeler holding- og investeringsselskabet.Ændringen finder sted i forbindelse med en generalforsamling i Kirkbi mandag. Her indtræder Agnete Kirk Kristiansen, der også er blandt den afgående bestyrelsesformands børn, i bestyrelsen.Kirkbi ejer 75 procent af Lego Koncernen.",https://www.dr.dk,DR,https://www.dr.dk/nyheder,"DR nyheder - Hold dig opdateret. Få de seneste nyheder fra Danmark og udlandet. Læs om de største sager, Kultur, Politik, Viden & Sport her",DR,https://www.dr.dk/nyheder,01.05.2023 07:17
Justitsminister vil undersøge mulighed for sejlforbud ved havvindmøller,16.05.2023 00:00,Justitsminister vil undersøge mulighed for sejlforbud ved havvindmøller,https://www.dr.dk,DR,https://www.dr.dk/nyheder,"DR nyheder - Hold dig opdateret. Få de seneste nyheder fra Danmark og udlandet. Læs om de største sager, Kultur, Politik, Viden & Sport her",DR,https://www.dr.dk/nyheder,01.05.2023 07:17
Mai Villadsen i angreb på S: De har valgt at være regering for arbejdsgiverne og de rigeste,19.05.2023 00:00,"Enhedslisten er dybt utilfreds med Socialdemokratiet. Og derfor lægger politisk ordfører Mai Villadsen i sin 1. maj-tale ud med at sende en direkte verbal lussing til statsminister Mette Frederiksen (S).- Det kan ikke komme bag på dig, at der er mange på arbejdspladserne og til 1. maj, der vender ryggen til dig. Du har valgt side, du har vendt ryggen til arbejderbevægelsen, raser hun fra talerstolen.Mai Villadsen er vred over, at regeringen vil afskaffe store bededag, som også er primær årsag til, at meget få socialdemokrater i år er inviteret på talerstolen rundt om i fagbevægelsen.- De har valgt at være regering for arbejdsgiverne og de rigeste, siger hun om regeringen.- Den her regeringsperiode har allerede udviklet sig til en rigtig gyserfilm. Socialdemokratiet har en eller anden Dr. Jekyll og Mr. Hyde-ting kørende. Og som et genstridigt genfærd bliver Lars Løkke ved med at vende tilbage til regeringskontorerne, siger hun.Derudover opfordrer Enhedslisten sammen med SF regeringen til at droppe planerne om seniorpensionen.- Der er mange hvis kroppe ikke kan holde til den skyhøje pensionsalder, siger hun.Følg dækningen af 1. maj på DR1, DRTV og her på dr.dk.",https://www.dr.dk,DR,https://www.dr.dk/nyheder,"DR nyheder - Hold dig opdateret. Få de seneste nyheder fra Danmark og udlandet. Læs om de største sager, Kultur, Politik, Viden & Sport her",DR,https://www.dr.dk/nyheder,01.05.2023 07:17
Elbiler sælger stadig godt i Danmark,01.05.2046 00:00,"Salget af elbiler i Danmark går strygende, og udviklingen fortsatte i april, hvor 29 procent af de solgte biler var elbiler.Det ligger et stykke over elbilandelen på 21 procent i 2022 - og kun et enkelt procentpoint under det høje niveau fra årets første tre måneder.Det viser tal, som De Danske Bilimportører har offentliggjort mandag morgen.Privatøkonom hos Arbejdernes Landsbank Brian Friis Helmer forventer, at den høje interesse for elbiler fortsætter.- Prisfald driver en del af det høje salg, men faktisk har danskerne over en længere periode for alvor taget elbilerne til sig, siger han i en skriftlig kommentar til Ritzau.Priserne på elbiler begyndte at falde, efter at Tesla sænkede priserne markant på en række af selskabets modeller i januar.",https://www.dr.dk,DR,https://www.dr.dk/nyheder,"DR nyheder - Hold dig opdateret. Få de seneste nyheder fra Danmark og udlandet. Læs om de største sager, Kultur, Politik, Viden & Sport her",DR,https://www.dr.dk/nyheder,01.05.2023 07:17
Pia Olsen Dyhr raser mod regeringen i sin 1. maj-tale: De skaber en unødvendig utryghed,01.05.2023 08:14,Pia Olsen Dyhr raser mod regeringen i sin 1. maj-tale: De skaber en unødvendig utryghed,https://www.dr.dk,DR,https://www.dr.dk/nyheder,"DR nyheder - Hold dig opdateret. Få de seneste nyheder fra Danmark og udlandet. Læs om de største sager, Kultur, Politik, Viden & Sport her",DR,https://www.dr.dk/nyheder,01.05.2023 07:17
Ukraines luftforsvar nedskyder ny byge af russiske missiler og droner sendt mod Kyiv,01.05.2023 07:54,Ukraines luftforsvar nedskyder ny byge af russiske missiler og droner sendt mod Kyiv,https://www.dr.dk,DR,https://www.dr.dk/nyheder,"DR nyheder - Hold dig opdateret. Få de seneste nyheder fra Danmark og udlandet. Læs om de største sager, Kultur, Politik, Viden & Sport her",DR,https://www.dr.dk/nyheder,01.05.2023 07:17
Forening risikerer kæmpebøde for ulovligt spil i landets største bankospilretssag,01.05.2023 07:35,Forening risikerer kæmpebøde for ulovligt spil i landets største bankospilretssag,https://www.dr.dk,DR,https://www.dr.dk/nyheder,"DR nyheder - Hold dig opdateret. Få de seneste nyheder fra Danmark og udlandet. Læs om de største sager, Kultur, Politik, Viden & Sport her",DR,https://www.dr.dk/nyheder,01.05.2023 07:17
Hummelgaard: Forholdet til fagbevægelsen er som et ægteskab,01.05.2023 06:56,"Der er kold luft mellem Socialdemokratiet og Fagbevægelsen forud for dagens fejring af arbejdernes internationale kampdag.Alligevel beskriver justitsminister Peter Hummelgaard (S) forholdet som et ""solidt ægteskab"".- Man kan godt blive lidt sure på hinanden en gang i mellem, men når alt kommer til alt, har man både de gode tider at se tilbage på og ikke mindst de bedste år foran sig, siger han til Ritzau.Det historisk tætte bånd mellem fagbevægelsen og det gamle arbejderparti, Socialdemokratiet, har fået alvorlige ridser i lakken, efter at regeringspartiet afskaffede store bededag som en helligdag.Som konsekvens vil socialdemokratiske politikere i langt mindre grad være at finde på talerstolen til fagbevægelsens markeringer af 1. maj i dag.Ingen folketingspolitikere fra Socialdemokratiet kommer for eksempel til at tale hos Fagbevægelsens Hovedorganisations (FH) 17 lokalafdelinger i år.",https://www.dr.dk,DR,https://www.dr.dk/nyheder,"DR nyheder - Hold dig opdateret. Få de seneste nyheder fra Danmark og udlandet. Læs om de største sager, Kultur, Politik, Viden & Sport her",DR,https://www.dr.dk/nyheder,01.05.2023 07:17
Helt vanvittigt: Færøerne i berusende jubelfest efter historisk slutrundebillet,01.05.2023 06:40,'Helt vanvittigt': Færøerne i berusende jubelfest efter historisk slutrundebillet,https://www.dr.dk,DR,https://www.dr.dk/nyheder,"DR nyheder - Hold dig opdateret. Få de seneste nyheder fra Danmark og udlandet. Læs om de største sager, Kultur, Politik, Viden & Sport her",DR,https://www.dr.dk/nyheder,01.05.2023 07:17
Vejret i dag: Sol mod syd og regn mod nord,01.05.2023 06:31,"Skal du tilbringe 1. maj i den sydlige og østlige del af landet, kan du se frem til sol og lune temperaturer. Her vil termometeret de fleste steder komme op på 15-16 grader i dag.Anderledes ser det ud i Nordjylland, hvor temperaturerne vil ligge på 8-9 grader. Skyerne vil være til stede det meste af dagen, og i perioder giver det også en håndfuld millimeter regn.Sidst på dagen vil det langsomt brede sig mod sydøst.Vinden er svag til jævn fra sydvest.",https://www.dr.dk,DR,https://www.dr.dk/nyheder,"DR nyheder - Hold dig opdateret. Få de seneste nyheder fra Danmark og udlandet. Læs om de største sager, Kultur, Politik, Viden & Sport her",DR,https://www.dr.dk/nyheder,01.05.2023 07:17
De sidste coronalån skal tilbagebetales i dag,01.05.2023 06:16,"Mandag skal de sidste coronalån, der blev tilgængelige under pandemien, betales tilbage.Flere end 53.000 virksomheder har benyttet lånemuligheden og i alt taget lån for omkring 36,4 milliarder kroner. Heraf har der allerede været betalingsfrist for 34,3 milliarder kroner.- I og med at størstedelen af beløbet er betalt, giver det et billede af, at ordningerne har hjulpet til at få langt de fleste virksomheder godt igennem pandemien, siger David Fjord Nielsen, der er fagdirektør i Skattestyrelsen, til Ritzau.Folketinget vedtog i 2020 og 2021 en række låneordninger. Mandagens betalingsfrist er den sjette og sidste af de lovfastsatte datoer for tilbagebetaling.Der er godt 6.000 virksomheder, der har betalingsfrist i dag, og Skattestyrelsen forventer, at størstedelen af beløbet tilbagebetales til tiden.",https://www.dr.dk,DR,https://www.dr.dk/nyheder,"DR nyheder - Hold dig opdateret. Få de seneste nyheder fra Danmark og udlandet. Læs om de største sager, Kultur, Politik, Viden & Sport her",DR,https://www.dr.dk/nyheder,01.05.2023 07:17
Afgørende møde i kræftsagen: Nu skal politikerne tage stilling til hospitalsledelses fremtid,01.05.2023 06:05,Afgørende møde i kræftsagen: Nu skal politikerne tage stilling til hospitalsledelses fremtid,https://www.dr.dk,DR,https://www.dr.dk/nyheder,"DR nyheder - Hold dig opdateret. Få de seneste nyheder fra Danmark og udlandet. Læs om de største sager, Kultur, Politik, Viden & Sport her",DR,https://www.dr.dk/nyheder,01.05.2023 07:17
"250 betjente i Texas jager mand, der er mistænkt for at skyde fem naboer",01.05.2023 05:55,"Mere end 250 politibetjente i den amerikanske delstat Texas leder efter en mand, der er mistænkt for at skyde og dræbe fem naboer i byen Cleveland fredag aften.Det skriver NBC News.Den 38-årige mand er mistænkt for at have skudt og dræbt fem naboer, efter at de fredag aften bad ham stoppe med at skyde med sit semiautomatiske våben, fordi det holdt deres baby vågen.- Vi er løbet ind i blindgyder. Lige nu har vi ingen spor, siger James Smith, der leder efterforskningen for FBI, til journalister søndag.Myndighederne udlover en dusør på 80.000 dollar for oplysninger, der fører til anholdelsen af den 38-årige. Det svarer til omkring 540.000 kroner.Ofrene var i alderen fra 31 til otte år gamle. De boede alle i nabohuset, men var ikke alle i familie med hinanden.",https://www.dr.dk,DR,https://www.dr.dk/nyheder,"DR nyheder - Hold dig opdateret. Få de seneste nyheder fra Danmark og udlandet. Læs om de største sager, Kultur, Politik, Viden & Sport her",DR,https://www.dr.dk/nyheder,01.05.2023 07:17
Rystet fagbevægelse holder 1. maj: Det er et ordentligt slag på sinkadusen til os,01.05.2023 05:45,Rystet fagbevægelse holder 1. maj: 'Det er et ordentligt slag på sinkadusen til os',https://www.dr.dk,DR,https://www.dr.dk/nyheder,"DR nyheder - Hold dig opdateret. Få de seneste nyheder fra Danmark og udlandet. Læs om de største sager, Kultur, Politik, Viden & Sport her",DR,https://www.dr.dk/nyheder,01.05.2023 07:17
Konservative Santiago Peña vinder præsidentvalg i Paraguay,01.05.2023 05:42,"Santiago Peña vinder præsidentvalget i Paraguay, og det konservative parti, Colorado, bevarer magten. Det skriver Reuters.Med mere end 99 procent af stemmerne talt op har 44-årige Peña fået 42,7 procent af stemmerne og slår dermed rivalen Efrain Alegre med mere end 15 procentpoint.Peña er gået til valg på at bibeholde Paraguays diplomatiske forbindelser til Taiwan, mens Alegre havde argumenteret for at skifte alliance til Kina.Paraguay er et af blot 13 lande, der har formelle diplomatiske relationer til den selvstyrende ø, som Kina ser som en del af dets territorium.Foran sig har Peña nu en opgave med at skulle sætte gang i Paraguays landbrugsdrevne økonomi, forsøge at skrumpe et stort underskud samt håndtere et stigende pres fra soja- og oksekødsproducenter, der vil have, at Paraguay dropper relationen til Taiwan til fordel for Kina og det store marked, der findes der.",https://www.dr.dk,DR,https://www.dr.dk/nyheder,"DR nyheder - Hold dig opdateret. Få de seneste nyheder fra Danmark og udlandet. Læs om de største sager, Kultur, Politik, Viden & Sport her",DR,https://www.dr.dk/nyheder,01.05.2023 07:17
Holger Rune sendt ud efter drama i Madrid,01.05.2023 05:17,"Det bliver ikke til den anden titel i træk for Holger Rune, som langt over midnat natten til mandag blev slået ud af ATP Masters 1000-turneringen i Madrid af spanske Alejandro Davidovich Fokina.Danskeren kæmpede med både et dårligt håndled og et lettere fjendtligt spansk publikum, der hjalp Davidovich Fokina frem mod sejren 7-6, 5-7, 7-6 i en maratondyst på over tre timer, skriver Ritzau.Holger Rune vandt i sidste uge ATP-turneringen i München for andet år i træk",https://www.dr.dk,DR,https://www.dr.dk/nyheder,"DR nyheder - Hold dig opdateret. Få de seneste nyheder fra Danmark og udlandet. Læs om de største sager, Kultur, Politik, Viden & Sport her",DR,https://www.dr.dk/nyheder,01.05.2023 07:17
Erdogan: Tyrkiske styrker har dræbt Islamisk Stat-leder i Syrien,02.05.2023 23:13,"Ifølge Tyrkiets præsident, Tayyip Erdogan, har tyrkiske styrker dræbt den formodede leder af Islamisk Stat i Syrien, Abu Hussein al-Qurashi.Det skulle være sket lørdag, siger han ifølge Reuters.- Denne person blev i går eliminieret i en operation, som blev udført af Tyrkiets efterretningstjeneste i Syrien, siger Erdogan.Ifølge præsidenten havde efterretningstjenesten fulgt IS-lederen gennem længere tid.",https://www.dr.dk,DR,https://www.dr.dk/nyheder,"DR nyheder - Hold dig opdateret. Få de seneste nyheder fra Danmark og udlandet. Læs om de største sager, Kultur, Politik, Viden & Sport her",DR,https://www.dr.dk/nyheder,01.05.2023 07:17
SF og Enhedslisten presser S på gammel aftale - vil udvide retten til seniorpensionen,02.05.2023 22:50,"Mens de røde faner støves af til 1. maj i morgen, har to af de traditionelle arbejderpartier, Enhedslisten og SF, præsenteret en politisk ambition, som faktisk også var en aftale med den tidligere S-regering.De to partier vil udvide retten til seniorpension, siger de til Avisen Danmark.I dag må man maksimalt have en arbejdsevne på 15 timer om ugen eller derunder for at komme på seniorpension. Det partierne hæve til, at ens arbejdsevne må være op til 18 timer.Forslaget indeholder det samme, som den tidligere Socialdemokratiske etpartiregering aftalte at ville gennemføre sammen med SF, Enhedslisten og Dansk Folkeparti.Det er netop en aftale, Socialdemokratiet er kritiseret for at løbe fra i SVM-regeringen.Den nye regering vil afskaffe seniorpensionen og i stedet indføre en Arne-plusordning.",https://www.dr.dk,DR,https://www.dr.dk/nyheder,"DR nyheder - Hold dig opdateret. Få de seneste nyheder fra Danmark og udlandet. Læs om de største sager, Kultur, Politik, Viden & Sport her",DR,https://www.dr.dk/nyheder,01.05.2023 07:17
Pave Frans: Vatikanet bidrager til fredsmission i Ukraine,02.05.2023 22:41,"Vatikanet er involveret i arbejdet mod at sikre fred i Ukraine, siger pave Frans.- Jeg er villig til at gøre alt, der skal gøres. Der er en mission i gang nu, men den er endnu ikke offentlig. Når den bliver offentlig, så vil jeg offentliggøre det, siger paven ifølge Reuters.- Jeg tror på, at fred altid kommer ved at åbne kanaler. Man kan aldrig opnå fred gennem lukkethed, siger han.Pave Frans tilføjer, at han har talt om situationen i Ukraine med Ungarns premierminister, Victor Orbán og en udsending for den russisk ortodokse kirke i Budapest, hvor han i dag har været på besøg.I torsdags mødtes pave Frans med Ukraines premierminister, Denys Shmyhal, hvorefter paven sagde, at de havde drøftet en ""fredsformel"", som var blevet fremsat af Volodymyr Zelenskyj.",https://www.dr.dk,DR,https://www.dr.dk/nyheder,"DR nyheder - Hold dig opdateret. Få de seneste nyheder fra Danmark og udlandet. Læs om de største sager, Kultur, Politik, Viden & Sport her",DR,https://www.dr.dk/nyheder,01.05.2023 07:17
HK-boss var hurtig til at trække støtten til Risgaard: Det udviklede sig til at være en sag om svigt,02.05.2023 22:24,HK-boss var hurtig til at trække støtten til Risgaard: 'Det udviklede sig til at være en sag om svigt',https://www.dr.dk,DR,https://www.dr.dk/nyheder,"DR nyheder - Hold dig opdateret. Få de seneste nyheder fra Danmark og udlandet. Læs om de største sager, Kultur, Politik, Viden & Sport her",DR,https://www.dr.dk/nyheder,01.05.2023 07:17
30 amerikanske helikoptere og andet militærmateriel er ankommet i Esbjerg,02.05.2023 21:10,"I dag er omkring 30 amerikanske helikoptere sammen med 1.000 kørertøjer og andet militært materiel fra USA ankommet til Esbjerg.Byen har nemlig lagt havn til transporten af amerikansk materiel til Operation Atlantic Resolve, som er USA's tilstedeværelse i Østeuropa. Det skriver Forsvaret i en pressemeddelelse.Torsdag meddelte Forsvaret og politiet, at der blev oprettet to midlertidige militære områder i Esbjerg. De varer frem til starten af juni.Det er ikke første gang, at Danmark lægger land til militært udstyr. Det sker gennem den såkaldte værtsnationsstøtte i Nato. Senest tog Oksbøl imod 500 soldater.",https://www.dr.dk,DR,https://www.dr.dk/nyheder,"DR nyheder - Hold dig opdateret. Få de seneste nyheder fra Danmark og udlandet. Læs om de største sager, Kultur, Politik, Viden & Sport her",DR,https://www.dr.dk/nyheder,01.05.2023 07:17
Straffespark på stadionmenuen: Se alle weekendens superligamål her,02.05.2023 20:45,Straffespark på stadionmenuen: Se alle weekendens superligamål her,https://www.dr.dk,DR,https://www.dr.dk/nyheder,"DR nyheder - Hold dig opdateret. Få de seneste nyheder fra Danmark og udlandet. Læs om de største sager, Kultur, Politik, Viden & Sport her",DR,https://www.dr.dk/nyheder,01.05.2023 07:17
EU forlænger gunstige handelsforhold for Ukraine,02.05.2023 20:37,"Medlemslandene i EU er blevet enige om at give Ukraine endnu et år med handelsfordele over for de europæiske lande.Dermed bliver told og kvoter på import fra Ukraine suspenderet i yderligere et år. Det bekræfter det svenske EU-formandskab ifølge Ritzau.Aftalen giver en økonomisk håndsrækning til det krigsramte land.Men tiltaget er ikke lige populært i alle lande. I april forbød eksempelvis Polen og Ungarn import af korn fra Ukraine.EU-Kommissionen forsøger ifølge Ritzau at komme de kritiske medlemslande i møde. Den foreslår fem lande, der støder op til Ukraine, at de kan få udbetalt kompensation til deres landmænd.",https://www.dr.dk,DR,https://www.dr.dk/nyheder,"DR nyheder - Hold dig opdateret. Få de seneste nyheder fra Danmark og udlandet. Læs om de største sager, Kultur, Politik, Viden & Sport her",DR,https://www.dr.dk/nyheder,01.05.2023 07:17
Sudans hær bekræfter forlænget våbenhvile,02.05.2023 20:21,"Tidligere i dag lød det fra den paramilitære gruppe Rapid Support Forces (RSF), at en våbenhvile i Sudan bliver folænget yderligere 72 timer.Det er nu også bekræftet fra den anden part i stridighederne, Sudans hær, lyder det ifølge Reuters i en udtalelse.Den forlængede våbenhvile tager over efter midnat.Sudans hær skriver desuden, at nogle udbrydere har forsøgt at starte angreb flere steder, men at hæren håber, de vil efterleve våbenhvilen.Begge parter har tidligere i dag beskyldt hinanden for at bryde våbenhvileaftalen.",https://www.dr.dk,DR,https://www.dr.dk/nyheder,"DR nyheder - Hold dig opdateret. Få de seneste nyheder fra Danmark og udlandet. Læs om de største sager, Kultur, Politik, Viden & Sport her",DR,https://www.dr.dk/nyheder,01.05.2023 07:17
"Det blev langt fra sindssygt kedeligt, da russisk brøler afgjorde VM-match",02.05.2023 20:08,"Det blev langt fra 'sindssygt kedeligt', da russisk brøler afgjorde VM-match",https://www.dr.dk,DR,https://www.dr.dk/nyheder,"DR nyheder - Hold dig opdateret. Få de seneste nyheder fra Danmark og udlandet. Læs om de største sager, Kultur, Politik, Viden & Sport her",DR,https://www.dr.dk/nyheder,01.05.2023 07:17
Lizette Risgaards vikar: For tidligt at snakke om ny formand,02.05.2023 19:59,Lizette Risgaards vikar: For tidligt at snakke om ny formand,https://www.dr.dk,DR,https://www.dr.dk/nyheder,"DR nyheder - Hold dig opdateret. Få de seneste nyheder fra Danmark og udlandet. Læs om de største sager, Kultur, Politik, Viden & Sport her",DR,https://www.dr.dk/nyheder,01.05.2023 07:17
Færøerne kvalificerer sig til første håndboldslutrunde nogensinde,02.05.2023 19:51,"Færøerne kunne søndag spille sig til sin første håndboldslutrunde nogensinde.Det krævede en sejr eller et uafgjort resultat i søndagens EM-kvalifikationskamp på udebane mod Østrig.Her vandt østrigerne opgøret 38-33 - efter en pauseføring på 24-16.Men da de fire bedste treere i EM-kvalifikationen også sikrer sig en billet til EM, kunne Peter Bredsdorff-Larsens mandskab trods nederlaget skrive færøsk håndboldhistorie.EM i herrehåndbold spilles i Tyskland fra 10. til 28. januar 2024.",https://www.dr.dk,DR,https://www.dr.dk/nyheder,"DR nyheder - Hold dig opdateret. Få de seneste nyheder fra Danmark og udlandet. Læs om de største sager, Kultur, Politik, Viden & Sport her",DR,https://www.dr.dk/nyheder,01.05.2023 07:17
"Præsidenten skal have en lur, før han kan arbejde: Biden grillet for sin alder ved den årlige pressemiddag",02.05.2023 19:45,"'Præsidenten skal have en lur, før han kan arbejde': Biden grillet for sin alder ved den årlige pressemiddag",https://www.dr.dk,DR,https://www.dr.dk/nyheder,"DR nyheder - Hold dig opdateret. Få de seneste nyheder fra Danmark og udlandet. Læs om de største sager, Kultur, Politik, Viden & Sport her",DR,https://www.dr.dk/nyheder,01.05.2023 07:17
Fire portugisiske brevdue-opdrættere døde efter skænderi,02.05.2023 19:26,"Fire portugisiske mænd, der alle opdrættede brevduer, har i dag mistet livet efter et højlydt skænderi i Portugal.Politiet oplyser ifølge Reuters, at tre mænd blev dræbt af skud, mens den fjerde mand begik selvmord, idet politiet ankom på gerningsstedet.Det står ikke klart, hvad der førte til skænderiet eller skudepisoden. Mændene var mellem 40 og 60 år gamle, skriver Ritzau.Ifølge CNN Portugal skete det omkring klokken 8 i morges i et fattigt kvarter af byen Setubal i det vestlige Portugal.",https://www.dr.dk,DR,https://www.dr.dk/nyheder,"DR nyheder - Hold dig opdateret. Få de seneste nyheder fra Danmark og udlandet. Læs om de største sager, Kultur, Politik, Viden & Sport her",DR,https://www.dr.dk/nyheder,01.05.2023 07:17
Brøndby-keeper piller straffespark i Parken og sikrer derbysejr,02.05.2023 18:45,Brøndby-keeper piller straffespark i Parken og sikrer derbysejr,https://www.dr.dk,DR,https://www.dr.dk/nyheder,"DR nyheder - Hold dig opdateret. Få de seneste nyheder fra Danmark og udlandet. Læs om de største sager, Kultur, Politik, Viden & Sport her",DR,https://www.dr.dk/nyheder,01.05.2023 07:17
Fynsk motorvej genåbnet efter uheld - én person er omkommet,02.05.2023 17:59,"Et alvorligt færdselsuheld betød tidligere på aftenen, at Fynske Motorvej var helt spærret i østgående retning mellem Blommenslyst og Odense.Nu er motorvejen åben igen, oplyser Vejdirektoratet på Twitter.Én person er afgået ved døden i uheldet, skriver Fyns Politi på Twitter. De pårørende er underrettet.Opdateret klokken 19.55 efter meldinger om genåbning og dødsfald.",https://www.dr.dk,DR,https://www.dr.dk/nyheder,"DR nyheder - Hold dig opdateret. Få de seneste nyheder fra Danmark og udlandet. Læs om de største sager, Kultur, Politik, Viden & Sport her",DR,https://www.dr.dk/nyheder,01.05.2023 07:17
Iransk præsident besøger Syrien for første gang siden 2011,02.05.2023 17:58,"Irans præsident, Ebrahim Raisi, besøger på onsdag Syrien.Det bliver første gang siden 2011, at en iransk præsident besøger det borgerkrigsramte land.Præsidenten tager til Damaskus, oplyser den iranske ambassade i Syrien ifølge Reuters.Ebrahim Raisi har en stor økonomisk og politisk delegation med sig, og besøget kommer til at vare i to dage, lyder det.",https://www.dr.dk,DR,https://www.dr.dk/nyheder,"DR nyheder - Hold dig opdateret. Få de seneste nyheder fra Danmark og udlandet. Læs om de største sager, Kultur, Politik, Viden & Sport her",DR,https://www.dr.dk/nyheder,01.05.2023 07:17
Team Esbjerg vinder den første af to kvartfinaler,02.05.2023 17:59,Team Esbjerg vinder den første af to kvartfinaler,https://www.dr.dk,DR,https://www.dr.dk/nyheder,"DR nyheder - Hold dig opdateret. Få de seneste nyheder fra Danmark og udlandet. Læs om de største sager, Kultur, Politik, Viden & Sport her",DR,https://www.dr.dk/nyheder,01.05.2023 07:17
