title,published,text,link,og:site_name,og:url,site_description,name,url,scrape_time
DI om ny overenskomst: Et »forholdsvist« dyrt forlig,07.03.2023 00:00,,https://jyllands-posten.dk/jperhverv/ECE15276569/di-om-ny-overenskomst-for-byggeriet-et-forholdsvist-dyrt-forlig/,Jyllands-Posten,https://jyllands-posten.dk/seneste/,"Få de seneste nyheder fra ind- og udland om samfund, erhverv, sport og kultur. ",Jyllandsposten,https://jyllands-posten.dk/seneste/,08.03.2023 07:17
Sådan ramte snestormen landet: Her målte DMI 30 cm sne tirsdag morgen,07.03.2023 00:00,,https://jyllands-posten.dk/indland/ECE15275825/saadan-ramte-snestormen-landet-et-sted-maalte-dmi-30-cm-sne/,Jyllands-Posten,https://jyllands-posten.dk/seneste/,"Få de seneste nyheder fra ind- og udland om samfund, erhverv, sport og kultur. ",Jyllandsposten,https://jyllands-posten.dk/seneste/,08.03.2023 07:17
Nye efterretninger om Nord Stream-sabotage: Denne gruppe kan stå bag,07.03.2023 00:00,,https://jyllands-posten.dk/international/ECE15276617/medie-proukrainsk-gruppe-kan-have-staaet-bag-gaslaek-i-oestersoeen/,Jyllands-Posten,https://jyllands-posten.dk/seneste/,"Få de seneste nyheder fra ind- og udland om samfund, erhverv, sport og kultur. ",Jyllandsposten,https://jyllands-posten.dk/seneste/,08.03.2023 07:17
Avanceret russisk militærfly udsat for sabotage i Belarus. Nu reagerer Lukasjenko,07.03.2023 00:00,,https://jyllands-posten.dk/international/ECE15275065/lukasjenko-usa-og-ukraine-traenede-terrorist-op-til-sabotage/,Jyllands-Posten,https://jyllands-posten.dk/seneste/,"Få de seneste nyheder fra ind- og udland om samfund, erhverv, sport og kultur. ",Jyllandsposten,https://jyllands-posten.dk/seneste/,08.03.2023 07:17
Retsordfører skal alligevel ikke betale 325.000 til fyret medarbejder,07.03.2023 00:00,,https://jyllands-posten.dk/politik/ECE15276306/retsordfoerer-skal-alligevel-ikke-betale-325000-til-fyret-medarbejder/,Jyllands-Posten,https://jyllands-posten.dk/seneste/,"Få de seneste nyheder fra ind- og udland om samfund, erhverv, sport og kultur. ",Jyllandsposten,https://jyllands-posten.dk/seneste/,08.03.2023 07:17
Har ingen kandidat-uddannelse: Stifter af børskandidat har opdigtet titler,07.03.2023 00:00,,https://jyllands-posten.dk/jperhverv/ECE15273093/stifter-af-boerskandidat-har-opdigtet-titler-har-ingen-kandidatuddannelse/,Jyllands-Posten,https://jyllands-posten.dk/seneste/,"Få de seneste nyheder fra ind- og udland om samfund, erhverv, sport og kultur. ",Jyllandsposten,https://jyllands-posten.dk/seneste/,08.03.2023 07:17
"Magtforholdet blev ændret mellem Vingegaard og Pogacar, mens Magnus Cort erobrede den gule trøje",07.03.2023 00:00,,https://jyllands-posten.dk/sport/ECE15273981/jonas-vingegaard-imponerede-i-vigtig-test-mod-tadej-pogacar-magnus-cort-overtog-foerertroejen/,Jyllands-Posten,https://jyllands-posten.dk/seneste/,"Få de seneste nyheder fra ind- og udland om samfund, erhverv, sport og kultur. ",Jyllandsposten,https://jyllands-posten.dk/seneste/,08.03.2023 07:17
Mand har meldt sig selv i sag om dobbeltdrab i Taastrup,07.03.2023 00:00,,https://jyllands-posten.dk/indland/ECE15276152/mand-har-meldt-sig-selv-i-sag-om-dobbeltdrab-i-taastrup/,Jyllands-Posten,https://jyllands-posten.dk/seneste/,"Få de seneste nyheder fra ind- og udland om samfund, erhverv, sport og kultur. ",Jyllandsposten,https://jyllands-posten.dk/seneste/,08.03.2023 07:17
At kalde denne serie en ukonventionel kærlighedshistorie må være årets største underdrivelse,07.03.2023 00:00,,https://jyllands-posten.dk/kultur/film/ECE15271465/problemer-er-der-nok-af-i-den-vildt-underholdende-rain-dogs/,Jyllands-Posten,https://jyllands-posten.dk/seneste/,"Få de seneste nyheder fra ind- og udland om samfund, erhverv, sport og kultur. ",Jyllandsposten,https://jyllands-posten.dk/seneste/,08.03.2023 07:17
"Gwyneth Paltrow har gjort yoga populært: Og det kan være et problem, mener indiske instruktører",07.03.2023 00:00,,https://jyllands-posten.dk/international/asien/ECE14712327/er-yoga-blevet-for-hvidt-og-udvandet-flere-indiske-instruktoerer-siger-ja/,Jyllands-Posten,https://jyllands-posten.dk/seneste/,"Få de seneste nyheder fra ind- og udland om samfund, erhverv, sport og kultur. ",Jyllandsposten,https://jyllands-posten.dk/seneste/,08.03.2023 07:17
Jon Stephensen varsler flere sager om sig selv,07.03.2023 00:00,,https://jyllands-posten.dk/politik/ECE15275518/jon-stephensen-varsler-flere-sager-om-sig-selv/,Jyllands-Posten,https://jyllands-posten.dk/seneste/,"Få de seneste nyheder fra ind- og udland om samfund, erhverv, sport og kultur. ",Jyllandsposten,https://jyllands-posten.dk/seneste/,08.03.2023 07:17
Corona og pris-stigninger har fået vores øjne op for en særlig form for ferie-luksus,07.03.2023 00:00,,https://jyllands-posten.dk/rejser/ECE14888946/corona-og-inflation-har-faaet-os-til-at-aendre-ferievaner/,Jyllands-Posten,https://jyllands-posten.dk/seneste/,"Få de seneste nyheder fra ind- og udland om samfund, erhverv, sport og kultur. ",Jyllandsposten,https://jyllands-posten.dk/seneste/,08.03.2023 07:17
Amerikansk forfatter er i chok efter fornem svensk hæder,07.03.2023 00:00,,https://jyllands-posten.dk/kultur/ECE15275500/amerikansk-forfatter-er-i-chok-efter-fornem-svensk-haeder/,Jyllands-Posten,https://jyllands-posten.dk/seneste/,"Få de seneste nyheder fra ind- og udland om samfund, erhverv, sport og kultur. ",Jyllandsposten,https://jyllands-posten.dk/seneste/,08.03.2023 07:17
Betjent skød truende hund ved børnehave med tre skud,07.03.2023 00:00,,https://jyllands-posten.dk/indland/ECE15274937/betjent-skoed-truende-hund-ved-boernehave-med-tre-skud/,Jyllands-Posten,https://jyllands-posten.dk/seneste/,"Få de seneste nyheder fra ind- og udland om samfund, erhverv, sport og kultur. ",Jyllandsposten,https://jyllands-posten.dk/seneste/,08.03.2023 07:17
»Slava Ukraini«: Søster hylder henrettet krigsfanges mod,07.03.2023 00:00,,https://jyllands-posten.dk/import/importjp/ritzau/ECE15275310/soester-hylder-henrettet-krigsfanges-mod/,Jyllands-Posten,https://jyllands-posten.dk/seneste/,"Få de seneste nyheder fra ind- og udland om samfund, erhverv, sport og kultur. ",Jyllandsposten,https://jyllands-posten.dk/seneste/,08.03.2023 07:17
Moderaternes retsordfører frifindes for brud på ligebehandlingslov,07.03.2023 00:00,,https://jyllands-posten.dk/politik/ECE15275364/moderaternes-retsordfoerer-frifindes-for-brud-paa-ligebehandlingslov/,Jyllands-Posten,https://jyllands-posten.dk/seneste/,"Få de seneste nyheder fra ind- og udland om samfund, erhverv, sport og kultur. ",Jyllandsposten,https://jyllands-posten.dk/seneste/,08.03.2023 07:17
Ruslands forsvarsminister: Bakhmut er nøglen,07.03.2023 00:00,,https://jyllands-posten.dk/international/ECE15274738/russisk-minister-udpeger-bakhmut-som-noegleby-for-videre-angreb/,Jyllands-Posten,https://jyllands-posten.dk/seneste/,"Få de seneste nyheder fra ind- og udland om samfund, erhverv, sport og kultur. ",Jyllandsposten,https://jyllands-posten.dk/seneste/,08.03.2023 07:17
På dybt vand: »Respekt for havmiljøet bør være en del af dit dykker-dna som gæst i et andet univers«,07.03.2023 00:00,,https://jyllands-posten.dk/rejser/ECE14952728/paa-dybt-vand-respekt-for-havmiljoeet-boer-vaere-en-del-af-dit-dykkerdna-som-gaest-i-et-andet-univers/,Jyllands-Posten,https://jyllands-posten.dk/seneste/,"Få de seneste nyheder fra ind- og udland om samfund, erhverv, sport og kultur. ",Jyllandsposten,https://jyllands-posten.dk/seneste/,08.03.2023 07:17
Ombudsmanden kritiserer politiets brug af nyt våbenregister,07.03.2023 00:00,,https://jyllands-posten.dk/indland/ECE15274955/ombudsmanden-kritiserer-politiets-brug-af-nyt-vaabenregister/,Jyllands-Posten,https://jyllands-posten.dk/seneste/,"Få de seneste nyheder fra ind- og udland om samfund, erhverv, sport og kultur. ",Jyllandsposten,https://jyllands-posten.dk/seneste/,08.03.2023 07:17
Ansat i styrelse under mistanke for at have søgt oplysninger om 3300 borgere,07.03.2023 00:00,,https://jyllands-posten.dk/indland/ECE15274770/ansat-i-styrelse-under-mistanke-for-at-have-soegt-oplysninger-om-3300-borgere/,Jyllands-Posten,https://jyllands-posten.dk/seneste/,"Få de seneste nyheder fra ind- og udland om samfund, erhverv, sport og kultur. ",Jyllandsposten,https://jyllands-posten.dk/seneste/,08.03.2023 07:17
"Ekspert: »Min tro på Holger Rune er kun blevet større, og han skal nok blive nummer et i verden på et tidspunkt«",07.03.2023 00:00,,https://jyllands-posten.dk/sport/tennis/ECE15115303/begyndelsen-paa-2023-har-vaeret-mere-end-godkendt-for-holger-rune/,Jyllands-Posten,https://jyllands-posten.dk/seneste/,"Få de seneste nyheder fra ind- og udland om samfund, erhverv, sport og kultur. ",Jyllandsposten,https://jyllands-posten.dk/seneste/,08.03.2023 07:17
Japansk rumraket destrueret efter opsendelse,07.03.2023 00:00,,https://jyllands-posten.dk/international/asien/ECE15274283/japansk-rumraket-destrueret-efter-opsendelse/,Jyllands-Posten,https://jyllands-posten.dk/seneste/,"Få de seneste nyheder fra ind- og udland om samfund, erhverv, sport og kultur. ",Jyllandsposten,https://jyllands-posten.dk/seneste/,08.03.2023 07:17
Forsvaret returnerer historiske el-fly efter to år,07.03.2023 00:00,,https://jyllands-posten.dk/indland/ECE15274037/forsvaret-returnerer-historiske-groenne-fly-efter-to-aar/,Jyllands-Posten,https://jyllands-posten.dk/seneste/,"Få de seneste nyheder fra ind- og udland om samfund, erhverv, sport og kultur. ",Jyllandsposten,https://jyllands-posten.dk/seneste/,08.03.2023 07:17
Red Bull-boss: Vores rivaler kommer stærkt tilbage,07.03.2023 00:00,,https://jyllands-posten.dk/sport/formel1/ECE15274316/red-bullboss-vores-rivaler-kommer-staerkt-tilbage/,Jyllands-Posten,https://jyllands-posten.dk/seneste/,"Få de seneste nyheder fra ind- og udland om samfund, erhverv, sport og kultur. ",Jyllandsposten,https://jyllands-posten.dk/seneste/,08.03.2023 07:17
"Politiet mener, at flere står bag knivdrab på to unge",07.03.2023 00:00,,https://jyllands-posten.dk/indland/ECE15274566/politiet-mener-at-flere-staar-bag-knivdrab-paa-to-unge/,Jyllands-Posten,https://jyllands-posten.dk/seneste/,"Få de seneste nyheder fra ind- og udland om samfund, erhverv, sport og kultur. ",Jyllandsposten,https://jyllands-posten.dk/seneste/,08.03.2023 07:17
Forslag vækker opsigt: Bådmigranter skal udvises permanent,07.03.2023 00:00,,https://jyllands-posten.dk/international/europa/ECE15268882/storbritannien-vil-slaa-haardt-ned-paa-ulovlige-baadmigranter/,Jyllands-Posten,https://jyllands-posten.dk/seneste/,"Få de seneste nyheder fra ind- og udland om samfund, erhverv, sport og kultur. ",Jyllandsposten,https://jyllands-posten.dk/seneste/,08.03.2023 07:17
»Slava Ukraini« siger soldaten. Så rammer salven ham: Mulig krigsforbrydelse får Zelenskyj til at love indsats,07.03.2023 00:00,,https://jyllands-posten.dk/international/ECE15273274/zelenskyj-lover-at-finde-de-skyldige-bag-paastaaet-henrettelse/,Jyllands-Posten,https://jyllands-posten.dk/seneste/,"Få de seneste nyheder fra ind- og udland om samfund, erhverv, sport og kultur. ",Jyllandsposten,https://jyllands-posten.dk/seneste/,08.03.2023 07:17
Se kortet: Knivstiks-bølge fortsætter efter dobbelt knivdrab på teenagere,07.03.2023 00:00,,https://jyllands-posten.dk/indland/ECE15273697/se-kortet-knivstiksboelge-fortsaetter-efter-dobbelt-knivdrab-paa-teenagere/,Jyllands-Posten,https://jyllands-posten.dk/seneste/,"Få de seneste nyheder fra ind- og udland om samfund, erhverv, sport og kultur. ",Jyllandsposten,https://jyllands-posten.dk/seneste/,08.03.2023 07:17
Danskermøde i Champions League: For 23 år siden fik faren en speciel aften uden at komme på banen - nu kan det samme ske for sønnike,07.03.2023 00:00,,https://jyllands-posten.dk/sport/fodbold/ECE15268330/tengstedt-har-taget-en-alternativ-vej-til-danskermoedet-i-champions-league/,Jyllands-Posten,https://jyllands-posten.dk/seneste/,"Få de seneste nyheder fra ind- og udland om samfund, erhverv, sport og kultur. ",Jyllandsposten,https://jyllands-posten.dk/seneste/,08.03.2023 07:17
Andre kan lære af hendes smertefulde erfaring,07.03.2023 00:00,,https://jyllands-posten.dk/indland/ECE15190650/andre-kan-laere-af-hendes-smertefulde-erfaring/,Jyllands-Posten,https://jyllands-posten.dk/seneste/,"Få de seneste nyheder fra ind- og udland om samfund, erhverv, sport og kultur. ",Jyllandsposten,https://jyllands-posten.dk/seneste/,08.03.2023 07:17
Trods rekordresultat: Lego-familien skærer i sit eget udbytte,07.03.2023 00:00,,https://jyllands-posten.dk/jperhverv/ECE15273658/trods-rekordresultat-legoejerne-skaerer-deres-eget-udbytte/,Jyllands-Posten,https://jyllands-posten.dk/seneste/,"Få de seneste nyheder fra ind- og udland om samfund, erhverv, sport og kultur. ",Jyllandsposten,https://jyllands-posten.dk/seneste/,08.03.2023 07:17
Dansk livstidsfange indlagt efter 12 år i berygtet fængsel – familien frygter for hans liv,07.03.2023 00:00,,https://jyllands-posten.dk/indland/ECE15272998/alkhawaja-ramt-af-hjerteproblemer-i-bahrain-familien-frygter-for-hans-liv/,Jyllands-Posten,https://jyllands-posten.dk/seneste/,"Få de seneste nyheder fra ind- og udland om samfund, erhverv, sport og kultur. ",Jyllandsposten,https://jyllands-posten.dk/seneste/,08.03.2023 07:17
Stor fransk strejke indledes med blokering af brændstof,07.03.2023 00:00,,https://jyllands-posten.dk/international/europa/ECE15273407/stor-fransk-strejke-indledes-med-blokering-af-braendstof/,Jyllands-Posten,https://jyllands-posten.dk/seneste/,"Få de seneste nyheder fra ind- og udland om samfund, erhverv, sport og kultur. ",Jyllandsposten,https://jyllands-posten.dk/seneste/,08.03.2023 07:17
Magnussen og Hülkenberg begraver strid: Vi er voksne nu,07.03.2023 00:00,,https://jyllands-posten.dk/sport/formel1/ECE15273116/magnussen-og-hulkenberg-begraver-strid-vi-er-voksne-nu/,Jyllands-Posten,https://jyllands-posten.dk/seneste/,"Få de seneste nyheder fra ind- og udland om samfund, erhverv, sport og kultur. ",Jyllandsposten,https://jyllands-posten.dk/seneste/,08.03.2023 07:17
Kina advarer USA: Det er vores anliggende. Og kun vores anliggende,07.03.2023 00:00,,https://jyllands-posten.dk/international/ECE15272802/kina-advarer-usa-mod-at-krydse-en-roed-linje-i-form-af-taiwan/,Jyllands-Posten,https://jyllands-posten.dk/seneste/,"Få de seneste nyheder fra ind- og udland om samfund, erhverv, sport og kultur. ",Jyllandsposten,https://jyllands-posten.dk/seneste/,08.03.2023 07:17
Lego sætter rekord igen: »Vi kan blive ved med at tage markedsandele«,07.03.2023 00:00,,https://jyllands-posten.dk/jperhverv/ECE15271006/legos-voldsomme-vaekst-loejer-af/,Jyllands-Posten,https://jyllands-posten.dk/seneste/,"Få de seneste nyheder fra ind- og udland om samfund, erhverv, sport og kultur. ",Jyllandsposten,https://jyllands-posten.dk/seneste/,08.03.2023 07:17
Lego satser milliarder: Gennembruddet mangler for miljøvenlig Lego-klods,07.03.2023 00:00,,https://jyllands-posten.dk/jperhverv/ECE15272520/lego-fyrer-op-under-sine-milliardinvesteringer/,Jyllands-Posten,https://jyllands-posten.dk/seneste/,"Få de seneste nyheder fra ind- og udland om samfund, erhverv, sport og kultur. ",Jyllandsposten,https://jyllands-posten.dk/seneste/,08.03.2023 07:17
Carlsbergs topchef stopper,07.03.2023 00:00,,https://jyllands-posten.dk/ECE15273220/carlsbergs-topchef-cees-t-hart-forlader-sin-stilling/,Jyllands-Posten,https://jyllands-posten.dk/seneste/,"Få de seneste nyheder fra ind- og udland om samfund, erhverv, sport og kultur. ",Jyllandsposten,https://jyllands-posten.dk/seneste/,08.03.2023 07:17
Trudeau vil have undersøgt påstået kinesisk påvirkning af valg,07.03.2023 00:00,,https://jyllands-posten.dk/international/ECE15272795/trudeau-vil-have-undersoegt-paastaaet-kinesisk-paavirkning-af-valg/,Jyllands-Posten,https://jyllands-posten.dk/seneste/,"Få de seneste nyheder fra ind- og udland om samfund, erhverv, sport og kultur. ",Jyllandsposten,https://jyllands-posten.dk/seneste/,08.03.2023 07:17
Xi Jinping fordømmer påstået amerikansk undertrykkelse,07.03.2023 00:00,,https://jyllands-posten.dk/international/ECE15272805/xi-fordoemmer-paastaaet-amerikansk-undertrykkelse-af-kina/,Jyllands-Posten,https://jyllands-posten.dk/seneste/,"Få de seneste nyheder fra ind- og udland om samfund, erhverv, sport og kultur. ",Jyllandsposten,https://jyllands-posten.dk/seneste/,08.03.2023 07:17
Vindfølsomme køretøjer er igen velkomne på Storebæltsbroen,07.03.2023 00:00,,https://jyllands-posten.dk/indland/ECE15273100/vindfoelsomme-koeretoejer-er-igen-velkomne-paa-storebaeltsbroen/,Jyllands-Posten,https://jyllands-posten.dk/seneste/,"Få de seneste nyheder fra ind- og udland om samfund, erhverv, sport og kultur. ",Jyllandsposten,https://jyllands-posten.dk/seneste/,08.03.2023 07:17
Med digital teknologi kan hvem som helst forvandle sine fantasier til livagtig seksualitet,07.03.2023 00:00,,https://jyllands-posten.dk/nyviden/ECE15146089/vi-kan-alle-sammen-lave-vores-digitale-porno-og-vi-behoever-ikke-tage-toejet-af/,Jyllands-Posten,https://jyllands-posten.dk/seneste/,"Få de seneste nyheder fra ind- og udland om samfund, erhverv, sport og kultur. ",Jyllandsposten,https://jyllands-posten.dk/seneste/,08.03.2023 07:17
Med sneploven i Nordjylland: Tirsdagens snevejr er »helt usædvanligt«,07.03.2023 00:00,,https://jyllands-posten.dk/indland/ECE15267678/tirsdagens-snevejr-er-helt-usaedvanligt/,Jyllands-Posten,https://jyllands-posten.dk/seneste/,"Få de seneste nyheder fra ind- og udland om samfund, erhverv, sport og kultur. ",Jyllandsposten,https://jyllands-posten.dk/seneste/,08.03.2023 07:17
Snestormen har sendt rutebus og biler i grøften,07.03.2023 00:00,,https://jyllands-posten.dk/indland/ECE15272497/snestormen-har-sendt-rutebus-og-biler-i-groeften/,Jyllands-Posten,https://jyllands-posten.dk/seneste/,"Få de seneste nyheder fra ind- og udland om samfund, erhverv, sport og kultur. ",Jyllandsposten,https://jyllands-posten.dk/seneste/,08.03.2023 07:17
Flertal er igen enigt om finansiering af fængsler og personale,07.03.2023 00:00,,https://jyllands-posten.dk/politik/ECE15272445/flertal-er-igen-enigt-om-finansiering-af-faengsler-og-personale/,Jyllands-Posten,https://jyllands-posten.dk/seneste/,"Få de seneste nyheder fra ind- og udland om samfund, erhverv, sport og kultur. ",Jyllandsposten,https://jyllands-posten.dk/seneste/,08.03.2023 07:17
Undskyldning er på vej til tidligere anbragte i særforsorgen,07.03.2023 00:00,,https://jyllands-posten.dk/indland/ECE15272682/undskyldning-er-paa-vej-til-tidligere-anbragte-i-saerforsorgen/,Jyllands-Posten,https://jyllands-posten.dk/seneste/,"Få de seneste nyheder fra ind- og udland om samfund, erhverv, sport og kultur. ",Jyllandsposten,https://jyllands-posten.dk/seneste/,08.03.2023 07:17
Kan ikke stå inde for sikkerheden: Farligt fænomen lukker motorvej,07.03.2023 00:00,,https://jyllands-posten.dk/dagensoverblik/ECE15272741/nyhedsoverblik/,Jyllands-Posten,https://jyllands-posten.dk/seneste/,"Få de seneste nyheder fra ind- og udland om samfund, erhverv, sport og kultur. ",Jyllandsposten,https://jyllands-posten.dk/seneste/,08.03.2023 07:17
To teenagere dræbt i knivstikkeri - politiet har brug for din hjælp,07.03.2023 00:00,,https://jyllands-posten.dk/indland/ECE15272232/to-teenagere-draebt-i-knivstikkeri-i-taastrup/,Jyllands-Posten,https://jyllands-posten.dk/seneste/,"Få de seneste nyheder fra ind- og udland om samfund, erhverv, sport og kultur. ",Jyllandsposten,https://jyllands-posten.dk/seneste/,08.03.2023 07:17
Hvornår er man død: Nye regler skal skaffe flere organer,07.03.2023 00:00,,https://jyllands-posten.dk/indland/ECE15253026/et-ekstra-doedskriterie-skal-skaffe-flere-organer-og-redde-liv/,Jyllands-Posten,https://jyllands-posten.dk/seneste/,"Få de seneste nyheder fra ind- og udland om samfund, erhverv, sport og kultur. ",Jyllandsposten,https://jyllands-posten.dk/seneste/,08.03.2023 07:17
Brentford nedlagde lokalrival og kan øjne top-5,06.03.2023 00:00,,https://jyllands-posten.dk/sport/fodbold/ECE15272761/brentford-nedlagde-lokalrival-og-kan-oejne-top5/,Jyllands-Posten,https://jyllands-posten.dk/seneste/,"Få de seneste nyheder fra ind- og udland om samfund, erhverv, sport og kultur. ",Jyllandsposten,https://jyllands-posten.dk/seneste/,08.03.2023 07:17
Færge er havareret under uvejret,06.03.2023 00:00,,https://jyllands-posten.dk/indland/ECE15272730/liveblog-foelg-snevejrets-udvikling-her/,Jyllands-Posten,https://jyllands-posten.dk/seneste/,"Få de seneste nyheder fra ind- og udland om samfund, erhverv, sport og kultur. ",Jyllandsposten,https://jyllands-posten.dk/seneste/,08.03.2023 07:17
Kvaliteten manglede: AaB og FCM delte i snevejret,06.03.2023 00:00,,https://jyllands-posten.dk/sport/ECE15270833/aab-og-fcm-delte-i-snevejret/,Jyllands-Posten,https://jyllands-posten.dk/seneste/,"Få de seneste nyheder fra ind- og udland om samfund, erhverv, sport og kultur. ",Jyllandsposten,https://jyllands-posten.dk/seneste/,08.03.2023 07:17
"Tre partier forstod ikke, hvor regningen kom fra: Men på det tidspunkt havde de allerede kendt til den i 10 måneder",06.03.2023 00:00,,https://jyllands-posten.dk/politik/ECE15271759/partiledere-erklaerede-sig-overraskede-over-ekstraregning-selv-om-den-blev-lagt-paa-bordet-bag-de-lukkede-doere/,Jyllands-Posten,https://jyllands-posten.dk/seneste/,"Få de seneste nyheder fra ind- og udland om samfund, erhverv, sport og kultur. ",Jyllandsposten,https://jyllands-posten.dk/seneste/,08.03.2023 07:17
"Analyse: Hold godt fast, nu bliver Mette Frederiksens spin for alvor avanceret",06.03.2023 00:00,,https://jyllands-posten.dk/politik/ECE15268147/i-bededagssagen-blev-mette-frederiksen-ramt-i-nakken-af-sine-egne-spintricks/,Jyllands-Posten,https://jyllands-posten.dk/seneste/,"Få de seneste nyheder fra ind- og udland om samfund, erhverv, sport og kultur. ",Jyllandsposten,https://jyllands-posten.dk/seneste/,08.03.2023 07:17
"Elbilen kunne lade sig selv delvist op, den var billig, men nu er produktionen endegyldigt droppet",06.03.2023 00:00,,https://jyllands-posten.dk/biler/ECE15203235/lyset-slukket-for-elektrisk-solcellebil/,Jyllands-Posten,https://jyllands-posten.dk/seneste/,"Få de seneste nyheder fra ind- og udland om samfund, erhverv, sport og kultur. ",Jyllandsposten,https://jyllands-posten.dk/seneste/,08.03.2023 07:17
Neymar skal opereres og misser resten af sæsonen,06.03.2023 00:00,,https://jyllands-posten.dk/sport/fodbold/ECE15272552/neymar-skal-opereres-og-misser-resten-af-saesonen/,Jyllands-Posten,https://jyllands-posten.dk/seneste/,"Få de seneste nyheder fra ind- og udland om samfund, erhverv, sport og kultur. ",Jyllandsposten,https://jyllands-posten.dk/seneste/,08.03.2023 07:17
Topembedsmand undersøgte sig selv: Fly og hotel betalt af Qatar udgjorde ikke et problem,06.03.2023 00:00,,https://jyllands-posten.dk/international/ECE15267774/europaeisk-vagthund-indleder-undersoegelse-af-topembedsmand/,Jyllands-Posten,https://jyllands-posten.dk/seneste/,"Få de seneste nyheder fra ind- og udland om samfund, erhverv, sport og kultur. ",Jyllandsposten,https://jyllands-posten.dk/seneste/,08.03.2023 07:17
"”Lazarus” på Teater Nordkraft er dragende sær, ligesom Bent Hallers roman",06.03.2023 00:00,,https://jyllands-posten.dk/kultur/teater/ECE15262848/lazarus-viser-et-udsnit-af-et-maerkvaerdigt-trekantsdrama/,Jyllands-Posten,https://jyllands-posten.dk/seneste/,"Få de seneste nyheder fra ind- og udland om samfund, erhverv, sport og kultur. ",Jyllandsposten,https://jyllands-posten.dk/seneste/,08.03.2023 07:17
Ukraine afviser tilbagetrækning: Vil opruste i Bakhmut,06.03.2023 00:00,,https://jyllands-posten.dk/international/ECE15272573/ukraine-afviser-tilbagetraekning-vil-opruste-i-bakhmut/,Jyllands-Posten,https://jyllands-posten.dk/seneste/,"Få de seneste nyheder fra ind- og udland om samfund, erhverv, sport og kultur. ",Jyllandsposten,https://jyllands-posten.dk/seneste/,08.03.2023 07:17
Peter Linde Busks udstilling i Holstebro er en raffineret lektion i materialernes muligheder,06.03.2023 00:00,,https://jyllands-posten.dk/kultur/ECE15264673/mester-i-raffineret-genbrug/,Jyllands-Posten,https://jyllands-posten.dk/seneste/,"Få de seneste nyheder fra ind- og udland om samfund, erhverv, sport og kultur. ",Jyllandsposten,https://jyllands-posten.dk/seneste/,08.03.2023 07:17
Den danske snerekord gemmer på en overraskelse,06.03.2023 00:00,,https://jyllands-posten.dk/indland/ECE15271524/den-danske-snerekord-overrasker-fordi-det-er-blevet-varmere/,Jyllands-Posten,https://jyllands-posten.dk/seneste/,"Få de seneste nyheder fra ind- og udland om samfund, erhverv, sport og kultur. ",Jyllandsposten,https://jyllands-posten.dk/seneste/,08.03.2023 07:17
Stor dansk triumf: Mads Pedersen erobrede den gule førertrøje - Vingegaard tabte tid til Pogacar,06.03.2023 00:00,,https://jyllands-posten.dk/sport/cykling/ECE15272390/mads-pedersen-vandt-foran-magnus-cort-i-parisnice/,Jyllands-Posten,https://jyllands-posten.dk/seneste/,"Få de seneste nyheder fra ind- og udland om samfund, erhverv, sport og kultur. ",Jyllandsposten,https://jyllands-posten.dk/seneste/,08.03.2023 07:17
Analytikere: Bakhmut skulle have været et springbræt. Det ser ud til at blive et punktum,06.03.2023 00:00,,https://jyllands-posten.dk/international/ECE15271000/analytikere-bakhmut-skulle-have-vaeret-et-springbraet-det-ser-ud-til-at-blive-et-punktum/,Jyllands-Posten,https://jyllands-posten.dk/seneste/,"Få de seneste nyheder fra ind- og udland om samfund, erhverv, sport og kultur. ",Jyllandsposten,https://jyllands-posten.dk/seneste/,08.03.2023 07:17
Heunicke vender rundt i miljøsag og kommune ånder lettet op,06.03.2023 00:00,,https://jyllands-posten.dk/indland/ECE15271932/heunicke-vender-rundt-i-miljoesag-og-kommune-aander-lettet-op/,Jyllands-Posten,https://jyllands-posten.dk/seneste/,"Få de seneste nyheder fra ind- og udland om samfund, erhverv, sport og kultur. ",Jyllandsposten,https://jyllands-posten.dk/seneste/,08.03.2023 07:17
