title,published,text,link,og:site_name,og:url,site_description,name,url,scrape_time
"Christopher Walken fylder 80 år: Han er så cool, at selv hans frisure er berømt",06.03.2023 00:00,,https://politiken.dk/navne/art9229322/Christopher-Walken-fylder-80-%C3%A5r-Han-er-s%C3%A5-cool-at-selv-hans-frisure-er-ber%C3%B8mt,Politiken,https://politiken.dk/nyheder/,"Hold dig opdateret pÃ¥ de seneste nyheder pÃ¥ politiken.dk: Seneste Politiken, Seneste Danmark, Seneste Kultur og Seneste Internationalt. ",Politiken,https://politiken.dk/nyheder/,31.03.2023 07:16
Løkke: »Nu gælder det om at få Sverige med ind over målstregen hurtigst muligt«,09.03.2023 00:00,,https://politiken.dk/udland/art9290103/%C2%BBNu-g%C3%A6lder-det-om-at-f%C3%A5-Sverige-med-ind-over-m%C3%A5lstregen-hurtigst-muligt%C2%AB,Politiken,https://politiken.dk/nyheder/,"Hold dig opdateret pÃ¥ de seneste nyheder pÃ¥ politiken.dk: Seneste Politiken, Seneste Danmark, Seneste Kultur og Seneste Internationalt. ",Politiken,https://politiken.dk/nyheder/,31.03.2023 07:16
Tyrkiets parlament træffer skelsættende afgørelse om finsk Nato-optagelse,10.03.2023 00:00,,https://politiken.dk/udland/art9287343/Tyrkiets-parlament-tr%C3%A6ffer-skels%C3%A6ttende-afg%C3%B8relse-om-finsk-Nato-optagelse,Politiken,https://politiken.dk/nyheder/,"Hold dig opdateret pÃ¥ de seneste nyheder pÃ¥ politiken.dk: Seneste Politiken, Seneste Danmark, Seneste Kultur og Seneste Internationalt. ",Politiken,https://politiken.dk/nyheder/,31.03.2023 07:16
Ben Affleck er faldet over en sko og går i legendes fodspor,10.03.2023 00:00,,https://politiken.dk/kultur/film_og_tv/art9170568/Ben-Affleck-er-faldet-over-en-sko-og-g%C3%A5r-i-legendes-fodspor,Politiken,https://politiken.dk/nyheder/,"Hold dig opdateret pÃ¥ de seneste nyheder pÃ¥ politiken.dk: Seneste Politiken, Seneste Danmark, Seneste Kultur og Seneste Internationalt. ",Politiken,https://politiken.dk/nyheder/,31.03.2023 07:16
Paven har det bedre og kan blive udskrevet de kommende dage,11.03.2023 00:00,,https://politiken.dk/udland/art9290053/Paven-har-det-bedre-og-kan-blive-udskrevet-de-kommende-dage,Politiken,https://politiken.dk/nyheder/,"Hold dig opdateret pÃ¥ de seneste nyheder pÃ¥ politiken.dk: Seneste Politiken, Seneste Danmark, Seneste Kultur og Seneste Internationalt. ",Politiken,https://politiken.dk/nyheder/,31.03.2023 07:16
Hurtig pletrens,11.03.2023 00:00,,https://politiken.dk/debat/ledere/art9287190/Hurtig-pletrens,Politiken,https://politiken.dk/nyheder/,"Hold dig opdateret pÃ¥ de seneste nyheder pÃ¥ politiken.dk: Seneste Politiken, Seneste Danmark, Seneste Kultur og Seneste Internationalt. ",Politiken,https://politiken.dk/nyheder/,31.03.2023 07:16
Bayern nægter at levere berømt Picasso-maleri tilbage,12.03.2023 00:00,,https://politiken.dk/kultur/art9282070/Bayern-n%C3%A6gter-at-levere-ber%C3%B8mt-Picasso-maleri-tilbage,Politiken,https://politiken.dk/nyheder/,"Hold dig opdateret pÃ¥ de seneste nyheder pÃ¥ politiken.dk: Seneste Politiken, Seneste Danmark, Seneste Kultur og Seneste Internationalt. ",Politiken,https://politiken.dk/nyheder/,31.03.2023 07:16
Rapport: Canadisk politi overså advarsler før massakre i 2020,12.03.2023 00:00,,https://politiken.dk/udland/art9290043/Canadisk-politi-overs%C3%A5-advarsler-f%C3%B8r-massakre-i-2020,Politiken,https://politiken.dk/nyheder/,"Hold dig opdateret pÃ¥ de seneste nyheder pÃ¥ politiken.dk: Seneste Politiken, Seneste Danmark, Seneste Kultur og Seneste Internationalt. ",Politiken,https://politiken.dk/nyheder/,31.03.2023 07:16
"Flertal afsætter 1,3 milliarder til bedre arbejdsmiljø",12.03.2023 00:00,,https://politiken.dk/indland/art9290035/Flertal-afs%C3%A6tter-13-milliarder-til-bedre-arbejdsmilj%C3%B8,Politiken,https://politiken.dk/nyheder/,"Hold dig opdateret pÃ¥ de seneste nyheder pÃ¥ politiken.dk: Seneste Politiken, Seneste Danmark, Seneste Kultur og Seneste Internationalt. ",Politiken,https://politiken.dk/nyheder/,31.03.2023 07:16
Succession-stjerne til sin kollega: Brug noget mere tid i Danmark,12.03.2023 00:00,,https://politiken.dk/kultur/art9260247/Brug-noget-mere-tid-i-Danmark,Politiken,https://politiken.dk/nyheder/,"Hold dig opdateret pÃ¥ de seneste nyheder pÃ¥ politiken.dk: Seneste Politiken, Seneste Danmark, Seneste Kultur og Seneste Internationalt. ",Politiken,https://politiken.dk/nyheder/,31.03.2023 07:16
FN-domstol giver Iran delvist ret i sag om indefrosne midler,13.03.2023 00:00,,https://politiken.dk/udland/art9290005/FN-domstol-giver-Iran-delvist-ret-i-sag-om-indefrosne-midler,Politiken,https://politiken.dk/nyheder/,"Hold dig opdateret pÃ¥ de seneste nyheder pÃ¥ politiken.dk: Seneste Politiken, Seneste Danmark, Seneste Kultur og Seneste Internationalt. ",Politiken,https://politiken.dk/nyheder/,31.03.2023 07:16
Danmark har i stor øvelse øvet sig i at modtage Nato-styrker,13.03.2023 00:00,,https://politiken.dk/indland/art9290002/Danmark-har-i-stor-%C3%B8velse-%C3%B8vet-sig-i-at-modtage-Nato-styrker,Politiken,https://politiken.dk/nyheder/,"Hold dig opdateret pÃ¥ de seneste nyheder pÃ¥ politiken.dk: Seneste Politiken, Seneste Danmark, Seneste Kultur og Seneste Internationalt. ",Politiken,https://politiken.dk/nyheder/,31.03.2023 07:16
"»Jeg har ventet på denne bog, som jeg engang ventede på en ny plade af David Bowie«",13.03.2023 00:00,,https://politiken.dk/kultur/boger/art9276360/%C2%BBJeg-har-ventet-p%C3%A5-denne-bog-som-jeg-engang-ventede-p%C3%A5-en-ny-plade-af-David-Bowie%C2%AB,Politiken,https://politiken.dk/nyheder/,"Hold dig opdateret pÃ¥ de seneste nyheder pÃ¥ politiken.dk: Seneste Politiken, Seneste Danmark, Seneste Kultur og Seneste Internationalt. ",Politiken,https://politiken.dk/nyheder/,31.03.2023 07:16
En forslået og dysfunktionel tysk regering halter videre,13.03.2023 00:00,,https://politiken.dk/udland/art9284810/En-forsl%C3%A5et-og-dysfunktionel-tysk-regering-halter-videre,Politiken,https://politiken.dk/nyheder/,"Hold dig opdateret pÃ¥ de seneste nyheder pÃ¥ politiken.dk: Seneste Politiken, Seneste Danmark, Seneste Kultur og Seneste Internationalt. ",Politiken,https://politiken.dk/nyheder/,31.03.2023 07:16
Lækkede dokumenter afslører Putins adgang til cybervåben,14.03.2023 00:00,,https://politiken.dk/udland/art9289975/L%C3%A6kkede-dokumenter-afsl%C3%B8rer-Putins-adgang-til-cyberv%C3%A5ben,Politiken,https://politiken.dk/nyheder/,"Hold dig opdateret pÃ¥ de seneste nyheder pÃ¥ politiken.dk: Seneste Politiken, Seneste Danmark, Seneste Kultur og Seneste Internationalt. ",Politiken,https://politiken.dk/nyheder/,31.03.2023 07:16
Kriminalitetsforsker: Skal vi gå i panik over stigende voldsanmeldelser? Det tror jeg ikke,15.03.2023 00:00,,https://politiken.dk/indland/art9287437/Kriminalitetsforsker-Skal-vi-g%C3%A5-i-panik-over-stigende-voldsanmeldelser-Det-tror-jeg-ikke,Politiken,https://politiken.dk/nyheder/,"Hold dig opdateret pÃ¥ de seneste nyheder pÃ¥ politiken.dk: Seneste Politiken, Seneste Danmark, Seneste Kultur og Seneste Internationalt. ",Politiken,https://politiken.dk/nyheder/,31.03.2023 07:16
Hele verden lugter. Også dig,15.03.2023 00:00,,https://politiken.dk/forbrugogliv/art9281071/Hele-verden-lugter.-Ogs%C3%A5-dig,Politiken,https://politiken.dk/nyheder/,"Hold dig opdateret pÃ¥ de seneste nyheder pÃ¥ politiken.dk: Seneste Politiken, Seneste Danmark, Seneste Kultur og Seneste Internationalt. ",Politiken,https://politiken.dk/nyheder/,31.03.2023 07:16
Kvaliteten er ikke god nok: Forældre skruer ned for arbejdstiden for selv at passe børn,15.03.2023 00:00,,https://politiken.dk/forbrugogliv/art9282797/Kvaliteten-er-ikke-god-nok-For%C3%A6ldre-skruer-ned-for-arbejdstiden-for-selv-at-passe-b%C3%B8rn,Politiken,https://politiken.dk/nyheder/,"Hold dig opdateret pÃ¥ de seneste nyheder pÃ¥ politiken.dk: Seneste Politiken, Seneste Danmark, Seneste Kultur og Seneste Internationalt. ",Politiken,https://politiken.dk/nyheder/,31.03.2023 07:16
IOC-boss: Russisk afgørelse kommer mindre end et år før OL,15.03.2023 00:00,,https://politiken.dk/sport/art9289951/Russisk-afg%C3%B8relse-kommer-mindre-end-et-%C3%A5r-f%C3%B8r-OL,Politiken,https://politiken.dk/nyheder/,"Hold dig opdateret pÃ¥ de seneste nyheder pÃ¥ politiken.dk: Seneste Politiken, Seneste Danmark, Seneste Kultur og Seneste Internationalt. ",Politiken,https://politiken.dk/nyheder/,31.03.2023 07:16
"En dag, hvor den medieliderlige kunstner ikke var omtalt i avisen, var en spildt dag",16.03.2023 00:00,,https://politiken.dk/kultur/kunst/art9263966/En-dag-hvor-den-medieliderlige-kunstner-ikke-var-omtalt-i-avisen-var-en-spildt-dag,Politiken,https://politiken.dk/nyheder/,"Hold dig opdateret pÃ¥ de seneste nyheder pÃ¥ politiken.dk: Seneste Politiken, Seneste Danmark, Seneste Kultur og Seneste Internationalt. ",Politiken,https://politiken.dk/nyheder/,31.03.2023 07:16
Spionerne var på plads. Dødslisterne var klar. Torturredskaberne var taget med. Alligevel fejlede russernes forberedelser,16.03.2023 00:00,,https://politiken.dk/udland/art9287836/Spionerne-var-p%C3%A5-plads.-D%C3%B8dslisterne-var-klar.-Torturredskaberne-var-taget-med.-Alligevel-fejlede-russernes-forberedelser,Politiken,https://politiken.dk/nyheder/,"Hold dig opdateret pÃ¥ de seneste nyheder pÃ¥ politiken.dk: Seneste Politiken, Seneste Danmark, Seneste Kultur og Seneste Internationalt. ",Politiken,https://politiken.dk/nyheder/,31.03.2023 07:16
Fem partier indkalder klimaminister til forespørgselsdebat,16.03.2023 00:00,,https://politiken.dk/indland/politik/art9289733/Fem-partier-indkalder-klimaminister-til-foresp%C3%B8rgselsdebat,Politiken,https://politiken.dk/nyheder/,"Hold dig opdateret pÃ¥ de seneste nyheder pÃ¥ politiken.dk: Seneste Politiken, Seneste Danmark, Seneste Kultur og Seneste Internationalt. ",Politiken,https://politiken.dk/nyheder/,31.03.2023 07:16
Næsten 2.000 køretøjer beslaglagt som følge af vanvidskørsel,16.03.2023 00:00,,https://politiken.dk/indland/art9289715/N%C3%A6sten-2.000-k%C3%B8ret%C3%B8jer-beslaglagt-som-f%C3%B8lge-af-vanvidsk%C3%B8rsel,Politiken,https://politiken.dk/nyheder/,"Hold dig opdateret pÃ¥ de seneste nyheder pÃ¥ politiken.dk: Seneste Politiken, Seneste Danmark, Seneste Kultur og Seneste Internationalt. ",Politiken,https://politiken.dk/nyheder/,31.03.2023 07:16
25-årig mand idømmes et års fængsel for grooming og sextortion,16.03.2023 00:00,,https://politiken.dk/indland/art9289693/25-%C3%A5rig-mand-id%C3%B8mmes-et-%C3%A5rs-f%C3%A6ngsel-for-grooming-og-sextortion,Politiken,https://politiken.dk/nyheder/,"Hold dig opdateret pÃ¥ de seneste nyheder pÃ¥ politiken.dk: Seneste Politiken, Seneste Danmark, Seneste Kultur og Seneste Internationalt. ",Politiken,https://politiken.dk/nyheder/,31.03.2023 07:16
Skatteminister vil se på indgreb mod enorme elprofitter,17.03.2023 00:00,,https://politiken.dk/indland/art9289661/Skatteminister-vil-se-p%C3%A5-indgreb-mod-enorme-elprofitter,Politiken,https://politiken.dk/nyheder/,"Hold dig opdateret pÃ¥ de seneste nyheder pÃ¥ politiken.dk: Seneste Politiken, Seneste Danmark, Seneste Kultur og Seneste Internationalt. ",Politiken,https://politiken.dk/nyheder/,31.03.2023 07:16
Ni personer meldes dræbt i helikopterulykke i USAs hær,17.03.2023 00:00,,https://politiken.dk/udland/art9289539/Ni-personer-meldes-dr%C3%A6bt-i-helikopterulykke-i-USAs-h%C3%A6r,Politiken,https://politiken.dk/nyheder/,"Hold dig opdateret pÃ¥ de seneste nyheder pÃ¥ politiken.dk: Seneste Politiken, Seneste Danmark, Seneste Kultur og Seneste Internationalt. ",Politiken,https://politiken.dk/nyheder/,31.03.2023 07:16
"Ãverste direktør i Region Midtjylland oven på kræftskandale: »I sidste ende er alt, der sker i Region Midtjylland, mit ansvar«",17.03.2023 00:00,,https://politiken.dk/indland/art9287497/%C3%98verste-direkt%C3%B8r-i-Region-Midtjylland-oven-p%C3%A5-kr%C3%A6ftskandale-%C2%BBI-sidste-ende-er-alt-der-sker-i-Region-Midtjylland-mit-ansvar%C2%AB,Politiken,https://politiken.dk/nyheder/,"Hold dig opdateret pÃ¥ de seneste nyheder pÃ¥ politiken.dk: Seneste Politiken, Seneste Danmark, Seneste Kultur og Seneste Internationalt. ",Politiken,https://politiken.dk/nyheder/,31.03.2023 07:16
"Smitten stiger, mens påsken står for døren, og udsigten lover indevejr",17.03.2023 00:00,,https://politiken.dk/forbrugogliv/sundhedogmotion/art9289185/Smitten-stiger-mens-p%C3%A5sken-st%C3%A5r-for-d%C3%B8ren-og-udsigten-lover-indevejr,Politiken,https://politiken.dk/nyheder/,"Hold dig opdateret pÃ¥ de seneste nyheder pÃ¥ politiken.dk: Seneste Politiken, Seneste Danmark, Seneste Kultur og Seneste Internationalt. ",Politiken,https://politiken.dk/nyheder/,31.03.2023 07:16
Minister truer med straffelov efter DF-ers åbenmundethed,17.03.2023 00:00,,https://politiken.dk/indland/art9288163/Minister-truer-med-straffelov-efter-DF%E2%80%99ers-%C3%A5benmundethed,Politiken,https://politiken.dk/nyheder/,"Hold dig opdateret pÃ¥ de seneste nyheder pÃ¥ politiken.dk: Seneste Politiken, Seneste Danmark, Seneste Kultur og Seneste Internationalt. ",Politiken,https://politiken.dk/nyheder/,31.03.2023 07:16
Huda Fahmy er en stolt hijabi,17.03.2023 00:00,,https://politiken.dk/kultur/boger/art9281981/Huda-Fahmy-er-en-stolt-hijabi,Politiken,https://politiken.dk/nyheder/,"Hold dig opdateret pÃ¥ de seneste nyheder pÃ¥ politiken.dk: Seneste Politiken, Seneste Danmark, Seneste Kultur og Seneste Internationalt. ",Politiken,https://politiken.dk/nyheder/,31.03.2023 07:16
"Socialdemokratiet: Løsningen på velfærdsstatens krise handler om de tre b-er. Bemanding, betaling og bureaukrati",17.03.2023 00:00,,https://politiken.dk/debat/kroniken/art9272563/L%C3%B8sningen-p%C3%A5-velf%C3%A6rdsstatens-krise-handler-om-de-tre-b%E2%80%99er.-Bemanding-betaling-og-bureaukrati,Politiken,https://politiken.dk/nyheder/,"Hold dig opdateret pÃ¥ de seneste nyheder pÃ¥ politiken.dk: Seneste Politiken, Seneste Danmark, Seneste Kultur og Seneste Internationalt. ",Politiken,https://politiken.dk/nyheder/,31.03.2023 07:16
"Lyt til Valget: Hvem er SF, når Mette Frederiksen ikke længere ringer?",17.03.2023 00:00,,https://politiken.dk/podcast/valget/art9289321/Hvem-er-SF-n%C3%A5r-Mette-Frederiksen-ikke-l%C3%A6ngere-ringer,Politiken,https://politiken.dk/nyheder/,"Hold dig opdateret pÃ¥ de seneste nyheder pÃ¥ politiken.dk: Seneste Politiken, Seneste Danmark, Seneste Kultur og Seneste Internationalt. ",Politiken,https://politiken.dk/nyheder/,31.03.2023 07:16
Tysk inflation har taget et pænt dyk i marts,18.03.2023 00:00,,https://politiken.dk/oekonomi/art9289116/Tysk-inflation-har-taget-et-p%C3%A6nt-dyk-i-marts,Politiken,https://politiken.dk/nyheder/,"Hold dig opdateret pÃ¥ de seneste nyheder pÃ¥ politiken.dk: Seneste Politiken, Seneste Danmark, Seneste Kultur og Seneste Internationalt. ",Politiken,https://politiken.dk/nyheder/,31.03.2023 07:16
"Titlen giver ikke megen mening, men det gør filmen til gengæld",18.03.2023 00:00,,https://politiken.dk/kultur/film_og_tv/art9244733/Titlen-giver-ikke-megen-mening-men-det-g%C3%B8r-filmen-til-geng%C3%A6ld,Politiken,https://politiken.dk/nyheder/,"Hold dig opdateret pÃ¥ de seneste nyheder pÃ¥ politiken.dk: Seneste Politiken, Seneste Danmark, Seneste Kultur og Seneste Internationalt. ",Politiken,https://politiken.dk/nyheder/,31.03.2023 07:16
Special: 1# Succession - The Munsters,19.03.2023 00:00,,https://politiken.dk/podcast/politikens_poptillaeg/art9288480/1-Succession-The-Munsters,Politiken,https://politiken.dk/nyheder/,"Hold dig opdateret pÃ¥ de seneste nyheder pÃ¥ politiken.dk: Seneste Politiken, Seneste Danmark, Seneste Kultur og Seneste Internationalt. ",Politiken,https://politiken.dk/nyheder/,31.03.2023 07:16
"Da Zelenskyj efter et år fik lov til at tale til Ãstrigs parlament, udvandrede det yderste højre",19.03.2023 00:00,,https://politiken.dk/udland/art9287258/Da-Zelenskyj-efter-et-%C3%A5r-fik-lov-til-at-tale-til-%C3%98strigs-parlament-udvandrede-det-yderste-h%C3%B8jre,Politiken,https://politiken.dk/nyheder/,"Hold dig opdateret pÃ¥ de seneste nyheder pÃ¥ politiken.dk: Seneste Politiken, Seneste Danmark, Seneste Kultur og Seneste Internationalt. ",Politiken,https://politiken.dk/nyheder/,31.03.2023 07:16
Historisk overenskomst på 30 timer og fuld løn: »Der er andet i livet end arbejde«,31.03.2033 00:00,,https://politiken.dk/indland/art9290016/Historisk-overenskomst-p%C3%A5-30-timer-og-fuld-l%C3%B8n-%C2%BBDer-er-andet-i-livet-end-arbejde%C2%AB,Politiken,https://politiken.dk/nyheder/,"Hold dig opdateret pÃ¥ de seneste nyheder pÃ¥ politiken.dk: Seneste Politiken, Seneste Danmark, Seneste Kultur og Seneste Internationalt. ",Politiken,https://politiken.dk/nyheder/,31.03.2023 07:16
Påskeferien begynder med en solrig weekend,02.03.2023 00:00,,https://politiken.dk/indland/art9290301/P%C3%A5skeferien-begynder-med-en-solrig-weekend,Politiken,https://politiken.dk/nyheder/,"Hold dig opdateret pÃ¥ de seneste nyheder pÃ¥ politiken.dk: Seneste Politiken, Seneste Danmark, Seneste Kultur og Seneste Internationalt. ",Politiken,https://politiken.dk/nyheder/,31.03.2023 07:16
"Flertal afsætter 1,3 milliarder til bedre arbejdsmiljø",12.03.2023 00:00,,https://politiken.dk/indland/art9290035/Flertal-afs%C3%A6tter-13-milliarder-til-bedre-arbejdsmilj%C3%B8,Politiken,https://politiken.dk/nyheder/,"Hold dig opdateret pÃ¥ de seneste nyheder pÃ¥ politiken.dk: Seneste Politiken, Seneste Danmark, Seneste Kultur og Seneste Internationalt. ",Politiken,https://politiken.dk/nyheder/,31.03.2023 07:16
Danmark har i stor øvelse øvet sig i at modtage Nato-styrker,13.03.2023 00:00,,https://politiken.dk/indland/art9290002/Danmark-har-i-stor-%C3%B8velse-%C3%B8vet-sig-i-at-modtage-Nato-styrker,Politiken,https://politiken.dk/nyheder/,"Hold dig opdateret pÃ¥ de seneste nyheder pÃ¥ politiken.dk: Seneste Politiken, Seneste Danmark, Seneste Kultur og Seneste Internationalt. ",Politiken,https://politiken.dk/nyheder/,31.03.2023 07:16
"Justitsminister: Jeg følger bare det råd, jeg har fået",13.03.2023 00:00,,https://politiken.dk/indland/art9287527/Justitsminister-Jeg-f%C3%B8lger-bare-det-r%C3%A5d-jeg-har-f%C3%A5et,Politiken,https://politiken.dk/nyheder/,"Hold dig opdateret pÃ¥ de seneste nyheder pÃ¥ politiken.dk: Seneste Politiken, Seneste Danmark, Seneste Kultur og Seneste Internationalt. ",Politiken,https://politiken.dk/nyheder/,31.03.2023 07:16
Kriminalitetsforsker: Skal vi gå i panik over stigende voldsanmeldelser? Det tror jeg ikke,15.03.2023 00:00,,https://politiken.dk/indland/art9287437/Kriminalitetsforsker-Skal-vi-g%C3%A5-i-panik-over-stigende-voldsanmeldelser-Det-tror-jeg-ikke,Politiken,https://politiken.dk/nyheder/,"Hold dig opdateret pÃ¥ de seneste nyheder pÃ¥ politiken.dk: Seneste Politiken, Seneste Danmark, Seneste Kultur og Seneste Internationalt. ",Politiken,https://politiken.dk/nyheder/,31.03.2023 07:16
Fem partier indkalder klimaminister til forespørgselsdebat,16.03.2023 00:00,,https://politiken.dk/indland/politik/art9289733/Fem-partier-indkalder-klimaminister-til-foresp%C3%B8rgselsdebat,Politiken,https://politiken.dk/nyheder/,"Hold dig opdateret pÃ¥ de seneste nyheder pÃ¥ politiken.dk: Seneste Politiken, Seneste Danmark, Seneste Kultur og Seneste Internationalt. ",Politiken,https://politiken.dk/nyheder/,31.03.2023 07:16
Næsten 2.000 køretøjer beslaglagt som følge af vanvidskørsel,16.03.2023 00:00,,https://politiken.dk/indland/art9289715/N%C3%A6sten-2.000-k%C3%B8ret%C3%B8jer-beslaglagt-som-f%C3%B8lge-af-vanvidsk%C3%B8rsel,Politiken,https://politiken.dk/nyheder/,"Hold dig opdateret pÃ¥ de seneste nyheder pÃ¥ politiken.dk: Seneste Politiken, Seneste Danmark, Seneste Kultur og Seneste Internationalt. ",Politiken,https://politiken.dk/nyheder/,31.03.2023 07:16
25-årig mand idømmes et års fængsel for grooming og sextortion,16.03.2023 00:00,,https://politiken.dk/indland/art9289693/25-%C3%A5rig-mand-id%C3%B8mmes-et-%C3%A5rs-f%C3%A6ngsel-for-grooming-og-sextortion,Politiken,https://politiken.dk/nyheder/,"Hold dig opdateret pÃ¥ de seneste nyheder pÃ¥ politiken.dk: Seneste Politiken, Seneste Danmark, Seneste Kultur og Seneste Internationalt. ",Politiken,https://politiken.dk/nyheder/,31.03.2023 07:16
Skatteminister vil se på indgreb mod enorme elprofitter,17.03.2023 00:00,,https://politiken.dk/indland/art9289661/Skatteminister-vil-se-p%C3%A5-indgreb-mod-enorme-elprofitter,Politiken,https://politiken.dk/nyheder/,"Hold dig opdateret pÃ¥ de seneste nyheder pÃ¥ politiken.dk: Seneste Politiken, Seneste Danmark, Seneste Kultur og Seneste Internationalt. ",Politiken,https://politiken.dk/nyheder/,31.03.2023 07:16
"Ãverste direktør i Region Midtjylland oven på kræftskandale: »I sidste ende er alt, der sker i Region Midtjylland, mit ansvar«",17.03.2023 00:00,,https://politiken.dk/indland/art9287497/%C3%98verste-direkt%C3%B8r-i-Region-Midtjylland-oven-p%C3%A5-kr%C3%A6ftskandale-%C2%BBI-sidste-ende-er-alt-der-sker-i-Region-Midtjylland-mit-ansvar%C2%AB,Politiken,https://politiken.dk/nyheder/,"Hold dig opdateret pÃ¥ de seneste nyheder pÃ¥ politiken.dk: Seneste Politiken, Seneste Danmark, Seneste Kultur og Seneste Internationalt. ",Politiken,https://politiken.dk/nyheder/,31.03.2023 07:16
Minister truer med straffelov efter DF-ers åbenmundethed,17.03.2023 00:00,,https://politiken.dk/indland/art9288163/Minister-truer-med-straffelov-efter-DF%E2%80%99ers-%C3%A5benmundethed,Politiken,https://politiken.dk/nyheder/,"Hold dig opdateret pÃ¥ de seneste nyheder pÃ¥ politiken.dk: Seneste Politiken, Seneste Danmark, Seneste Kultur og Seneste Internationalt. ",Politiken,https://politiken.dk/nyheder/,31.03.2023 07:16
Kongehuset fremviser røde tal på bundlinjen,20.03.2023 00:00,,https://politiken.dk/indland/art9288102/Kongehuset-fremviser-r%C3%B8de-tal-p%C3%A5-bundlinjen,Politiken,https://politiken.dk/nyheder/,"Hold dig opdateret pÃ¥ de seneste nyheder pÃ¥ politiken.dk: Seneste Politiken, Seneste Danmark, Seneste Kultur og Seneste Internationalt. ",Politiken,https://politiken.dk/nyheder/,31.03.2023 07:16
Kriminaliteten stiger for første gang i flere år,20.03.2023 00:00,,https://politiken.dk/indland/art9287315/Kriminaliteten-stiger-for-f%C3%B8rste-gang-i-flere-%C3%A5r,Politiken,https://politiken.dk/nyheder/,"Hold dig opdateret pÃ¥ de seneste nyheder pÃ¥ politiken.dk: Seneste Politiken, Seneste Danmark, Seneste Kultur og Seneste Internationalt. ",Politiken,https://politiken.dk/nyheder/,31.03.2023 07:16
"Der er social slagside, når unge dør efter indtag af alkohol",21.03.2023 00:00,,https://politiken.dk/indland/art9281407/Der-er-social-slagside-n%C3%A5r-unge-d%C3%B8r-efter-indtag-af-alkohol,Politiken,https://politiken.dk/nyheder/,"Hold dig opdateret pÃ¥ de seneste nyheder pÃ¥ politiken.dk: Seneste Politiken, Seneste Danmark, Seneste Kultur og Seneste Internationalt. ",Politiken,https://politiken.dk/nyheder/,31.03.2023 07:16
For knap 40 år siden tog lige mange mænd og kvinder en videregående uddannelse. Nu har kvinder lagt enorm afstand til mændene,22.03.2023 00:00,,https://politiken.dk/indland/uddannelse/art9287557/For-knap-40-%C3%A5r-siden-tog-lige-mange-m%C3%A6nd-og-kvinder-en-videreg%C3%A5ende-uddannelse.-Nu-har-kvinder-lagt-enorm-afstand-til-m%C3%A6ndene,Politiken,https://politiken.dk/nyheder/,"Hold dig opdateret pÃ¥ de seneste nyheder pÃ¥ politiken.dk: Seneste Politiken, Seneste Danmark, Seneste Kultur og Seneste Internationalt. ",Politiken,https://politiken.dk/nyheder/,31.03.2023 07:16
10 børnehaver og legepladser skal undersøges for PFAS,22.03.2023 00:00,,https://politiken.dk/indland/art9287486/10-b%C3%B8rnehaver-og-legepladser-skal-unders%C3%B8ges-for-PFAS,Politiken,https://politiken.dk/nyheder/,"Hold dig opdateret pÃ¥ de seneste nyheder pÃ¥ politiken.dk: Seneste Politiken, Seneste Danmark, Seneste Kultur og Seneste Internationalt. ",Politiken,https://politiken.dk/nyheder/,31.03.2023 07:16
Seniorer bliver frosset ud af arbejdsmarkedet,01.04.2023 00:00,,https://politiken.dk/indland/art9248196/Seniorer-bliver-frosset-ud-af-arbejdsmarkedet,Politiken,https://politiken.dk/nyheder/,"Hold dig opdateret pÃ¥ de seneste nyheder pÃ¥ politiken.dk: Seneste Politiken, Seneste Danmark, Seneste Kultur og Seneste Internationalt. ",Politiken,https://politiken.dk/nyheder/,31.03.2023 07:16
Røde partier: Regeringen stjal vores penge til rent drikkevand,01.04.2023 00:00,,https://politiken.dk/indland/art9276033/Regeringen-stjal-vores-penge-til-rent-drikkevand,Politiken,https://politiken.dk/nyheder/,"Hold dig opdateret pÃ¥ de seneste nyheder pÃ¥ politiken.dk: Seneste Politiken, Seneste Danmark, Seneste Kultur og Seneste Internationalt. ",Politiken,https://politiken.dk/nyheder/,31.03.2023 07:16
Region får lov til at bruge 454 millioner ekstra på supersygehus,01.04.2023 00:00,,https://politiken.dk/indland/art9287062/Region-f%C3%A5r-lov-til-at-bruge-454-millioner-ekstra-p%C3%A5-supersygehus,Politiken,https://politiken.dk/nyheder/,"Hold dig opdateret pÃ¥ de seneste nyheder pÃ¥ politiken.dk: Seneste Politiken, Seneste Danmark, Seneste Kultur og Seneste Internationalt. ",Politiken,https://politiken.dk/nyheder/,31.03.2023 07:16
Myndigheder undersøger muligt forbud mod bander,01.04.2023 00:00,,https://politiken.dk/indland/art9287063/Myndigheder-unders%C3%B8ger-muligt-forbud-mod-bander,Politiken,https://politiken.dk/nyheder/,"Hold dig opdateret pÃ¥ de seneste nyheder pÃ¥ politiken.dk: Seneste Politiken, Seneste Danmark, Seneste Kultur og Seneste Internationalt. ",Politiken,https://politiken.dk/nyheder/,31.03.2023 07:16
Objekt har næppe forbindelse til Nord Stream-eksplosioner,01.04.2023 00:00,,https://politiken.dk/indland/art9286906/Objekt-har-n%C3%A6ppe-forbindelse-til-Nord-Stream-eksplosioner,Politiken,https://politiken.dk/nyheder/,"Hold dig opdateret pÃ¥ de seneste nyheder pÃ¥ politiken.dk: Seneste Politiken, Seneste Danmark, Seneste Kultur og Seneste Internationalt. ",Politiken,https://politiken.dk/nyheder/,31.03.2023 07:16
