title,published,text,link,og:site_name,og:url,site_description,name,url,scrape_time
Rune fik publikum på nakken: Næste gang tager jeg en lur,01.05.2023 00:00,,https://jyllands-posten.dk/sport/tennis/ECE15717038/rune-fik-publikum-paa-nakken-naeste-gang-tager-jeg-en-lur/,Jyllands-Posten,https://jyllands-posten.dk/seneste/,"Få de seneste nyheder fra ind- og udland om samfund, erhverv, sport og kultur. ",Jyllandsposten,https://jyllands-posten.dk/seneste/,02.05.2023 07:16
USA: Alene dette sted er 20.000 russere blevet dræbt,01.05.2023 00:00,,https://jyllands-posten.dk/international/europa/ECE15717004/usa-20000-russiske-soldater-er-draebt-ved-bakhmut-siden-december/,Jyllands-Posten,https://jyllands-posten.dk/seneste/,"Få de seneste nyheder fra ind- og udland om samfund, erhverv, sport og kultur. ",Jyllandsposten,https://jyllands-posten.dk/seneste/,02.05.2023 07:16
3-0: Silkeborg kom 20 minutter for sent til Herning,01.05.2023 00:00,,https://jyllands-posten.dk/sport/fodbold/ECE15711159/midtjylland-tromlede-silkeborg/,Jyllands-Posten,https://jyllands-posten.dk/seneste/,"Få de seneste nyheder fra ind- og udland om samfund, erhverv, sport og kultur. ",Jyllandsposten,https://jyllands-posten.dk/seneste/,02.05.2023 07:16
Andre ville have jævnet det med jorden. Lin Cenholt og kæresten traf et andet valg,01.05.2023 00:00,,https://jyllands-posten.dk/bolig/ECE15663103/fra-nedrivningsmoden-bungalow-til-lys-familiebolig-det-goer-ondt-at-bore-huller-i-vaegge-man-selv-har-pudset/,Jyllands-Posten,https://jyllands-posten.dk/seneste/,"Få de seneste nyheder fra ind- og udland om samfund, erhverv, sport og kultur. ",Jyllandsposten,https://jyllands-posten.dk/seneste/,02.05.2023 07:16
108 politifolk såret i voldsomme sammenstød i Frankrig,01.05.2023 00:00,,https://jyllands-posten.dk/international/europa/ECE15716959/108-politifolk-saaret-i-voldsomme-sammenstoed-i-frankrig/,Jyllands-Posten,https://jyllands-posten.dk/seneste/,"Få de seneste nyheder fra ind- og udland om samfund, erhverv, sport og kultur. ",Jyllandsposten,https://jyllands-posten.dk/seneste/,02.05.2023 07:16
"»Det er sgu ikke okay«: Mette Frederiksen burde være populær i dette kvarter. Nej, viste det sig",01.05.2023 00:00,,https://jyllands-posten.dk/politik/ECE15710710/i-koebenhavns-gamle-arbejderkvarter-bryder-man-sig-ikke-om-den-nye-mette-frederiksen-selv-anker-ville-vende-sig-i-graven/,Jyllands-Posten,https://jyllands-posten.dk/seneste/,"Få de seneste nyheder fra ind- og udland om samfund, erhverv, sport og kultur. ",Jyllandsposten,https://jyllands-posten.dk/seneste/,02.05.2023 07:16
Ulv er igen set midt i jysk by,01.05.2023 00:00,,https://jyllands-posten.dk/indland/ECE15716927/ulv-er-igen-set-midt-i-jysk-by/,Jyllands-Posten,https://jyllands-posten.dk/seneste/,"Få de seneste nyheder fra ind- og udland om samfund, erhverv, sport og kultur. ",Jyllandsposten,https://jyllands-posten.dk/seneste/,02.05.2023 07:16
I Aarhus risikerer en bankoklub at få konfiskeret over 5 mio. kr. Og den er langtfra alene,01.05.2023 00:00,,https://jyllands-posten.dk/indland/ECE15716114/bankoforeninger-politianmeldt-paa-stribe-risikerer-kaempeboeder-for-ulovligt-spil/,Jyllands-Posten,https://jyllands-posten.dk/seneste/,"Få de seneste nyheder fra ind- og udland om samfund, erhverv, sport og kultur. ",Jyllandsposten,https://jyllands-posten.dk/seneste/,02.05.2023 07:16
Et helt klassetrin kan blive skrottet: Nyt forslag bliver kaldt »gennemtåbeligt«,01.05.2023 00:00,,https://jyllands-posten.dk/indland/ECE15714841/ny-vej-til-at-bliver-toemrer-eller-frisoer-et-bestemt-klassetrin-boer-afskaffes/,Jyllands-Posten,https://jyllands-posten.dk/seneste/,"Få de seneste nyheder fra ind- og udland om samfund, erhverv, sport og kultur. ",Jyllandsposten,https://jyllands-posten.dk/seneste/,02.05.2023 07:16
FN: Konflikt i Sudan kan sende over 800.000 på flugt,01.05.2023 00:00,,https://jyllands-posten.dk/international/Afrika/ECE15716714/fn-konflikt-i-sudan-kan-sende-over-800000-paa-flugt/,Jyllands-Posten,https://jyllands-posten.dk/seneste/,"Få de seneste nyheder fra ind- og udland om samfund, erhverv, sport og kultur. ",Jyllandsposten,https://jyllands-posten.dk/seneste/,02.05.2023 07:16
FN holder uforstående Taliban-styre uden for krisemøde,01.05.2023 00:00,,https://jyllands-posten.dk/international/ECE15716917/fn-holder-uforstaaende-talibanstyre-uden-for-krisemoede/,Jyllands-Posten,https://jyllands-posten.dk/seneste/,"Få de seneste nyheder fra ind- og udland om samfund, erhverv, sport og kultur. ",Jyllandsposten,https://jyllands-posten.dk/seneste/,02.05.2023 07:16
"Samme øksemord ""Love & Death"" fortæller præcis den samme historie som sidste års ""Candy"" og kaster intet nyt lys over tragedien",01.05.2023 00:00,,https://jyllands-posten.dk/kultur/film/ECE15706473/intet-nyt-fra-oeksemordet/,Jyllands-Posten,https://jyllands-posten.dk/seneste/,"Få de seneste nyheder fra ind- og udland om samfund, erhverv, sport og kultur. ",Jyllandsposten,https://jyllands-posten.dk/seneste/,02.05.2023 07:16
En forløsende dansk triumf i stort endagsløb: »Det er en virkelig stor sejr for mig«,01.05.2023 00:00,,https://jyllands-posten.dk/sport/cykling/ECE15716852/dansk-triumf-soeren-kragh-andersen-sluttede-sejrstoerke-med-sin-triumf-i-endagsklassiker/,Jyllands-Posten,https://jyllands-posten.dk/seneste/,"Få de seneste nyheder fra ind- og udland om samfund, erhverv, sport og kultur. ",Jyllandsposten,https://jyllands-posten.dk/seneste/,02.05.2023 07:16
"Heksekunst: Kedlen syder på Det Kongelige Teater, men i ”Hex” løber ingredienserne løbsk",01.05.2023 00:00,,https://jyllands-posten.dk/kultur/teater/ECE15706125/hex-spiller-paa-mange-tangenter-mens-konceptet-er-for-uklart/,Jyllands-Posten,https://jyllands-posten.dk/seneste/,"Få de seneste nyheder fra ind- og udland om samfund, erhverv, sport og kultur. ",Jyllandsposten,https://jyllands-posten.dk/seneste/,02.05.2023 07:16
"»Det beviser, at greenwashing virker«: Pensionskæmpe satser stort på kontroversiel klimasynder",01.05.2023 00:00,,https://jyllands-posten.dk/jperhverv/ECE15701291/pensionskaempe-satser-stort-paa-kontroversiel-klimasynder-det-beviser-at-greenwashing-virker/,Jyllands-Posten,https://jyllands-posten.dk/seneste/,"Få de seneste nyheder fra ind- og udland om samfund, erhverv, sport og kultur. ",Jyllandsposten,https://jyllands-posten.dk/seneste/,02.05.2023 07:16
"Hanne Petersen blev behandlet for sent: Nu venter hun på, at sagen får konsekvenser for de ansvarlige",01.05.2023 00:00,,https://jyllands-posten.dk/indland/ECE15641108/hanne-petersen-har-betalt-en-stor-pris-faar-kraeftsagen-fra-auh-andre-konsekvenser/,Jyllands-Posten,https://jyllands-posten.dk/seneste/,"Få de seneste nyheder fra ind- og udland om samfund, erhverv, sport og kultur. ",Jyllandsposten,https://jyllands-posten.dk/seneste/,02.05.2023 07:16
Flere end 30 meldes sårede i russiske missilangreb mod Ukraine,01.05.2023 00:00,,https://jyllands-posten.dk/international/europa/ECE15715867/flere-end-30-meldes-saarede-i-russiske-missilangreb-mod-ukraine/,Jyllands-Posten,https://jyllands-posten.dk/seneste/,"Få de seneste nyheder fra ind- og udland om samfund, erhverv, sport og kultur. ",Jyllandsposten,https://jyllands-posten.dk/seneste/,02.05.2023 07:16
Syv personer går efter jobbet som Søren Brostrøms afløser,01.05.2023 00:00,,https://jyllands-posten.dk/indland/ECE15716522/syv-personer-gaar-efter-jobbet-som-soeren-brostroems-afloeser/,Jyllands-Posten,https://jyllands-posten.dk/seneste/,"Få de seneste nyheder fra ind- og udland om samfund, erhverv, sport og kultur. ",Jyllandsposten,https://jyllands-posten.dk/seneste/,02.05.2023 07:16
Eksperter: Det kan topchefen lære af Lizette Risgaards afgang,01.05.2023 00:00,,https://jyllands-posten.dk/jperhverv/ECE15713196/eksperter-det-kan-topchefen-laere-af-lizette-risgaards-afgang/,Jyllands-Posten,https://jyllands-posten.dk/seneste/,"Få de seneste nyheder fra ind- og udland om samfund, erhverv, sport og kultur. ",Jyllandsposten,https://jyllands-posten.dk/seneste/,02.05.2023 07:16
For 900.000 kroner kan du bestille bord på denne restaurant,01.05.2023 00:00,,https://jyllands-posten.dk/international/ECE15633687/fransk-frokost-paa-et-sejlskib-mod-stjernerne/,Jyllands-Posten,https://jyllands-posten.dk/seneste/,"Få de seneste nyheder fra ind- og udland om samfund, erhverv, sport og kultur. ",Jyllandsposten,https://jyllands-posten.dk/seneste/,02.05.2023 07:16
Dansk landbrugsgigant får kæmpe tab på russisk exit,01.05.2023 00:00,,https://jyllands-posten.dk/jperhverv/ECE15711013/dansk-landbrugsgigant-faar-kaempe-tab-paa-russisk-exit/,Jyllands-Posten,https://jyllands-posten.dk/seneste/,"Få de seneste nyheder fra ind- og udland om samfund, erhverv, sport og kultur. ",Jyllandsposten,https://jyllands-posten.dk/seneste/,02.05.2023 07:16
Kræver handling nu: I brevet til miljøministeren er oplistet 5 punkter,01.05.2023 00:00,,https://jyllands-posten.dk/indland/ECE15699043/kommuner-og-vandvaerker-kraever-handling-nu-de-frygter-at-pfasforurening-kan-blive-langt-vaerre/,Jyllands-Posten,https://jyllands-posten.dk/seneste/,"Få de seneste nyheder fra ind- og udland om samfund, erhverv, sport og kultur. ",Jyllandsposten,https://jyllands-posten.dk/seneste/,02.05.2023 07:16
Nyt supersygehus skal finde ekstra plads til solceller,01.05.2023 00:00,,https://jyllands-posten.dk/indland/ECE15715438/nyt-supersygehus-skal-finde-ekstra-plads-til-solceller/,Jyllands-Posten,https://jyllands-posten.dk/seneste/,"Få de seneste nyheder fra ind- og udland om samfund, erhverv, sport og kultur. ",Jyllandsposten,https://jyllands-posten.dk/seneste/,02.05.2023 07:16
Tusindvis af borgeres personlige oplysninger er blevet kompromitteret,01.05.2023 00:00,,https://jyllands-posten.dk/indland/ECE15692373/tusindvis-af-borgeres-personlige-oplysninger-er-blevet-kompromitteret/,Jyllands-Posten,https://jyllands-posten.dk/seneste/,"Få de seneste nyheder fra ind- og udland om samfund, erhverv, sport og kultur. ",Jyllandsposten,https://jyllands-posten.dk/seneste/,02.05.2023 07:16
Paven har sendt meget gammel gave før kroning,01.05.2023 00:00,,https://jyllands-posten.dk/international/europa/ECE15686471/taerte-og-jesus-kors-faar-hovedroller-ved-kroning/,Jyllands-Posten,https://jyllands-posten.dk/seneste/,"Få de seneste nyheder fra ind- og udland om samfund, erhverv, sport og kultur. ",Jyllandsposten,https://jyllands-posten.dk/seneste/,02.05.2023 07:16
Først blev de budt velkommen. Nu vokser fjendtligheden: »De bebrejder os for alt«,01.05.2023 00:00,,https://jyllands-posten.dk/international/ECE15485088/syrerne-i-tyrkiet-foeler-sig-fanget-efter-jordskaelvene-kan-ingen-steder-tage-hen/,Jyllands-Posten,https://jyllands-posten.dk/seneste/,"Få de seneste nyheder fra ind- og udland om samfund, erhverv, sport og kultur. ",Jyllandsposten,https://jyllands-posten.dk/seneste/,02.05.2023 07:16
Nye tal: Flere mænd beretter om uønskede kommentarer og berøringer på jobbet,01.05.2023 00:00,,https://jyllands-posten.dk/jperhverv/ECE15710756/nye-tal-flere-maend-beretter-om-uoenskede-kommentarer-og-beroeringer-paa-jobbet/,Jyllands-Posten,https://jyllands-posten.dk/seneste/,"Få de seneste nyheder fra ind- og udland om samfund, erhverv, sport og kultur. ",Jyllandsposten,https://jyllands-posten.dk/seneste/,02.05.2023 07:16
"Dansker lander international toppost: Hendes joke blev til virkelighed, da telefonen ringede",01.05.2023 00:00,,https://jyllands-posten.dk/kultur/ECE15707377/dansker-lander-toppost-paa-beroemmet-museum/,Jyllands-Posten,https://jyllands-posten.dk/seneste/,"Få de seneste nyheder fra ind- og udland om samfund, erhverv, sport og kultur. ",Jyllandsposten,https://jyllands-posten.dk/seneste/,02.05.2023 07:16
Eksplosion: Russisk godstog afsporet,01.05.2023 00:00,,https://jyllands-posten.dk/international/ECE15711304/eksplosion-afsporer-russisk-godstog-naer-ukraines-graense/,Jyllands-Posten,https://jyllands-posten.dk/seneste/,"Få de seneste nyheder fra ind- og udland om samfund, erhverv, sport og kultur. ",Jyllandsposten,https://jyllands-posten.dk/seneste/,02.05.2023 07:16
Putin hylder organisation med danske rødder: Nu melder Danmark fra,01.05.2023 00:00,,https://jyllands-posten.dk/sport/ECE15704236/putin-hylder-organisation-med-danske-roedder-nu-melder-danmark-fra/,Jyllands-Posten,https://jyllands-posten.dk/seneste/,"Få de seneste nyheder fra ind- og udland om samfund, erhverv, sport og kultur. ",Jyllandsposten,https://jyllands-posten.dk/seneste/,02.05.2023 07:16
Hun er lidt af et mysterium og var i mange år forhadt. På lørdag kulminerer eventyret om hende,01.05.2023 00:00,,https://jyllands-posten.dk/international/europa/ECE15569377/den-forhadte-elskerinde-der-aldrig-gik-efter-at-blive-dronning/,Jyllands-Posten,https://jyllands-posten.dk/seneste/,"Få de seneste nyheder fra ind- og udland om samfund, erhverv, sport og kultur. ",Jyllandsposten,https://jyllands-posten.dk/seneste/,02.05.2023 07:16
Ugens aktie: Jeudans ejendomsportefølje står solidt i global turbulens,01.05.2023 00:00,,https://jyllands-posten.dk/jperhverv/ECE15690452/ugens-aktie-jeudans-ejendomsportefoelje-staar-solidt-i-global-turbulens/,Jyllands-Posten,https://jyllands-posten.dk/seneste/,"Få de seneste nyheder fra ind- og udland om samfund, erhverv, sport og kultur. ",Jyllandsposten,https://jyllands-posten.dk/seneste/,02.05.2023 07:16
Formand afdramatiserer fyringen af topchef: »Vi har ikke foretaget en politianmeldelse«,01.05.2023 00:00,,https://jyllands-posten.dk/jperhverv/ECE15710732/formand-afdramatiserer-fyringen-af-steen-michael-erichsen-vi-har-ikke-foretaget-en-politianmeldelse/,Jyllands-Posten,https://jyllands-posten.dk/seneste/,"Få de seneste nyheder fra ind- og udland om samfund, erhverv, sport og kultur. ",Jyllandsposten,https://jyllands-posten.dk/seneste/,02.05.2023 07:16
Syv milliardfirmaer har allerede forladt Danmark: Nu vil erhvervsministeren se på området,01.05.2023 00:00,,https://jyllands-posten.dk/jperhverv/ECE15700308/erhvervsminister-morten-boedskov-vil-have-danske-virksomheder-boersnoteret-i-danmark/,Jyllands-Posten,https://jyllands-posten.dk/seneste/,"Få de seneste nyheder fra ind- og udland om samfund, erhverv, sport og kultur. ",Jyllandsposten,https://jyllands-posten.dk/seneste/,02.05.2023 07:16
»Ualmindeligt vanskelig« kampdag: Mette Frederiksen nævnte selv elefanten i rummet,01.05.2023 00:00,,https://jyllands-posten.dk/politik/ECE15709995/kampdag-i-skyggen-af-metoosag-en-ualmindelig-svaer-dag-for-fagbevaegelsen/,Jyllands-Posten,https://jyllands-posten.dk/seneste/,"Få de seneste nyheder fra ind- og udland om samfund, erhverv, sport og kultur. ",Jyllandsposten,https://jyllands-posten.dk/seneste/,02.05.2023 07:16
AaB har fundet ny sportsdirektør i tysk investorgruppe,01.05.2023 00:00,,https://jyllands-posten.dk/sport/ECE15709175/aab-har-fundet-ny-sportsdirektoer-i-tysk-investorgruppe/,Jyllands-Posten,https://jyllands-posten.dk/seneste/,"Få de seneste nyheder fra ind- og udland om samfund, erhverv, sport og kultur. ",Jyllandsposten,https://jyllands-posten.dk/seneste/,02.05.2023 07:16
Flere europæiske havnebyer overvejer et forbud mod krydstogtskibe,01.05.2023 00:00,,https://jyllands-posten.dk/rejser/ECE15665556/flere-europaeiske-havnebyer-overvejer-et-forbud-mod-krydstogtskibe/,Jyllands-Posten,https://jyllands-posten.dk/seneste/,"Få de seneste nyheder fra ind- og udland om samfund, erhverv, sport og kultur. ",Jyllandsposten,https://jyllands-posten.dk/seneste/,02.05.2023 07:16
Hun blev model som 12-årig og er i dag kjoledesigner,01.05.2023 00:00,,https://jyllands-posten.dk/livsstil/ECE15613423/hun-blev-model-som-12aarig-og-er-i-dag-kjoledesigner/,Jyllands-Posten,https://jyllands-posten.dk/seneste/,"Få de seneste nyheder fra ind- og udland om samfund, erhverv, sport og kultur. ",Jyllandsposten,https://jyllands-posten.dk/seneste/,02.05.2023 07:16
Offentlig transport blev hans karrierevej,01.05.2023 00:00,,https://jyllands-posten.dk/indland/ECE15613420/offentlig-transport-blev-hans-karrierevej/,Jyllands-Posten,https://jyllands-posten.dk/seneste/,"Få de seneste nyheder fra ind- og udland om samfund, erhverv, sport og kultur. ",Jyllandsposten,https://jyllands-posten.dk/seneste/,02.05.2023 07:16
Tysklands nye skarpskytte har taget sigte på Kreml,01.05.2023 00:00,,https://jyllands-posten.dk/international/europa/ECE15662525/klar-tale-har-gjort-boris-pistorius-til-en-politisk-sensation/,Jyllands-Posten,https://jyllands-posten.dk/seneste/,"Få de seneste nyheder fra ind- og udland om samfund, erhverv, sport og kultur. ",Jyllandsposten,https://jyllands-posten.dk/seneste/,02.05.2023 07:16
Først gik han efter aborttilhængerne: Så kom de opsigtsvækkende oplysninger om hans fortid,01.05.2023 00:00,,https://jyllands-posten.dk/international/usa/ECE15704933/nye-kampe-i-vente-om-abort-i-usa/,Jyllands-Posten,https://jyllands-posten.dk/seneste/,"Få de seneste nyheder fra ind- og udland om samfund, erhverv, sport og kultur. ",Jyllandsposten,https://jyllands-posten.dk/seneste/,02.05.2023 07:16
Kofod forlader Folketinget - giver tre grunde,01.05.2023 00:00,,https://jyllands-posten.dk/politik/ECE15708680/jeppe-kofod-forlader-folketinget/,Jyllands-Posten,https://jyllands-posten.dk/seneste/,"Få de seneste nyheder fra ind- og udland om samfund, erhverv, sport og kultur. ",Jyllandsposten,https://jyllands-posten.dk/seneste/,02.05.2023 07:16
Midt i en historisk krise: Coop sætter begrænsning på bestyrelsen,01.05.2023 00:00,,https://jyllands-posten.dk/jperhverv/ECE15707404/coopraad-saetter-tidsbegraensning-for-formand-og-bestyrelse/,Jyllands-Posten,https://jyllands-posten.dk/seneste/,"Få de seneste nyheder fra ind- og udland om samfund, erhverv, sport og kultur. ",Jyllandsposten,https://jyllands-posten.dk/seneste/,02.05.2023 07:16
Den ypperste Lego-master giver byggeinstruksen videre til sin søn,01.05.2023 00:00,,https://jyllands-posten.dk/jperhverv/ECE15707361/den-ypperste-legomaster-giver-byggeinstruksen-videre-til-sin-soen/,Jyllands-Posten,https://jyllands-posten.dk/seneste/,"Få de seneste nyheder fra ind- og udland om samfund, erhverv, sport og kultur. ",Jyllandsposten,https://jyllands-posten.dk/seneste/,02.05.2023 07:16
Ekspert er forbløffet over nye Tesla-tal,01.05.2023 00:00,,https://jyllands-posten.dk/biler/ECE15707305/tesla-model-y-saelger-stadig-godt-men-nye-salgstal-indikerer-en-normalisering/,Jyllands-Posten,https://jyllands-posten.dk/seneste/,"Få de seneste nyheder fra ind- og udland om samfund, erhverv, sport og kultur. ",Jyllandsposten,https://jyllands-posten.dk/seneste/,02.05.2023 07:16
Missilangreb mod Kyiv afværget - længere mod øst gik det værre,01.05.2023 00:00,,https://jyllands-posten.dk/international/ECE15707233/missilangreb-mod-kyiv-afvaerget-laengere-mod-oest-gik-det-vaerre/,Jyllands-Posten,https://jyllands-posten.dk/seneste/,"Få de seneste nyheder fra ind- og udland om samfund, erhverv, sport og kultur. ",Jyllandsposten,https://jyllands-posten.dk/seneste/,02.05.2023 07:16
Erdogan melder IS-leder i Syrien dræbt af tyrkiske soldater,01.05.2023 00:00,,https://jyllands-posten.dk/international/ECE15707207/erdogan-melder-isleder-i-syrien-draebt-af-tyrkiske-soldater/,Jyllands-Posten,https://jyllands-posten.dk/seneste/,"Få de seneste nyheder fra ind- og udland om samfund, erhverv, sport og kultur. ",Jyllandsposten,https://jyllands-posten.dk/seneste/,02.05.2023 07:16
"Der skrives tekster som aldrig før: Hvor vi før kunne klare det meste med telefonen, er der ofte ingen vej uden om at skrive i dag",01.05.2023 00:00,,https://jyllands-posten.dk/nyviden/ECE15662112/forsker-vi-kan-ikke-tale-os-fra-teksters-betydning/,Jyllands-Posten,https://jyllands-posten.dk/seneste/,"Få de seneste nyheder fra ind- og udland om samfund, erhverv, sport og kultur. ",Jyllandsposten,https://jyllands-posten.dk/seneste/,02.05.2023 07:16
S-minister før 1. maj: Forhold til fagbevægelsen er som et ægteskab,01.05.2023 00:00,,https://jyllands-posten.dk/politik/ECE15707243/sminister-foer-1-maj-forhold-til-fagbevaegelsen-er-som-et-aegteskab/,Jyllands-Posten,https://jyllands-posten.dk/seneste/,"Få de seneste nyheder fra ind- og udland om samfund, erhverv, sport og kultur. ",Jyllandsposten,https://jyllands-posten.dk/seneste/,02.05.2023 07:16
Alliance-partier vil tillade udenlandsk arbejdskraft inden grønt lys,01.05.2023 00:00,,https://jyllands-posten.dk/politik/ECE15707205/alliancepartier-vil-tillade-udenlandsk-arbejdskraft-inden-groent-lys/,Jyllands-Posten,https://jyllands-posten.dk/seneste/,"Få de seneste nyheder fra ind- og udland om samfund, erhverv, sport og kultur. ",Jyllandsposten,https://jyllands-posten.dk/seneste/,02.05.2023 07:16
Klopp kritiserer dommer efter påtale ved fejring,01.05.2023 00:00,,https://jyllands-posten.dk/sport/ECE15707237/klopp-kritiserer-dommer-efter-paatale-ved-fejring/,Jyllands-Posten,https://jyllands-posten.dk/seneste/,"Få de seneste nyheder fra ind- og udland om samfund, erhverv, sport og kultur. ",Jyllandsposten,https://jyllands-posten.dk/seneste/,02.05.2023 07:16
6000 er flygtet fra Sudan til Den Centralafrikanske Republik,01.05.2023 00:00,,https://jyllands-posten.dk/international/Afrika/ECE15707214/6000-er-flygtet-fra-sudan-til-den-centralafrikanske-republik/,Jyllands-Posten,https://jyllands-posten.dk/seneste/,"Få de seneste nyheder fra ind- og udland om samfund, erhverv, sport og kultur. ",Jyllandsposten,https://jyllands-posten.dk/seneste/,02.05.2023 07:16
Peter Meinert tog 10 kilo mel på ryggen og lavede et forsøg,01.05.2023 00:00,,https://jyllands-posten.dk/indland/ECE15624407/cykeltest-paa-yding-skovhoejsaa-meget-betyder-din-vaegt-for-tiden-til-toppen/,Jyllands-Posten,https://jyllands-posten.dk/seneste/,"Få de seneste nyheder fra ind- og udland om samfund, erhverv, sport og kultur. ",Jyllandsposten,https://jyllands-posten.dk/seneste/,02.05.2023 07:16
Skal du løbe DHL Stafetten? Så meget betyder din vægt for din præstation,01.05.2023 00:00,,https://jyllands-posten.dk/indland/ECE15612812/hvad-betyder-din-vaegt-for-din-sportslige-praestationher-er-team-danmarks-beregninger/,Jyllands-Posten,https://jyllands-posten.dk/seneste/,"Få de seneste nyheder fra ind- og udland om samfund, erhverv, sport og kultur. ",Jyllandsposten,https://jyllands-posten.dk/seneste/,02.05.2023 07:16
Roman: Knausgårds store projekt er ved at finde sin form,01.05.2023 00:00,,https://jyllands-posten.dk/kultur/litteratur/ECE15278092/knausgaards-store-projekt-er-ved-at-finde-sin-form/,Jyllands-Posten,https://jyllands-posten.dk/seneste/,"Få de seneste nyheder fra ind- og udland om samfund, erhverv, sport og kultur. ",Jyllandsposten,https://jyllands-posten.dk/seneste/,02.05.2023 07:16
Fjendtligt publikum og kontroversiel dom: Holger Rune tabte i Madrid,01.05.2023 00:00,,https://jyllands-posten.dk/sport/ECE15707213/holger-rune-knaekkede-i-midnatsinferno-i-madrid/,Jyllands-Posten,https://jyllands-posten.dk/seneste/,"Få de seneste nyheder fra ind- og udland om samfund, erhverv, sport og kultur. ",Jyllandsposten,https://jyllands-posten.dk/seneste/,02.05.2023 07:16
Medie: Ny mystisk ballon i luften over USA,01.05.2023 00:00,,https://jyllands-posten.dk/dagensoverblik/ECE15706904/nyhedsoverblik/,Jyllands-Posten,https://jyllands-posten.dk/seneste/,"Få de seneste nyheder fra ind- og udland om samfund, erhverv, sport og kultur. ",Jyllandsposten,https://jyllands-posten.dk/seneste/,02.05.2023 07:16
Pænt og propert og tæt på døden: Her er Putins politiske fængsel,01.05.2023 00:00,,https://jyllands-posten.dk/international/europa/ECE15662533/moskvas-politiske-faengsel-lefortovo-har-igen-faaet-travlt/,Jyllands-Posten,https://jyllands-posten.dk/seneste/,"Få de seneste nyheder fra ind- og udland om samfund, erhverv, sport og kultur. ",Jyllandsposten,https://jyllands-posten.dk/seneste/,02.05.2023 07:16
Minister erkender efter hård kritik: Fagbevægelsen har fat i noget,01.05.2023 00:00,,https://jyllands-posten.dk/indland/ECE15671969/fagbevaegelsen-i-haardt-angreb-paa-regeringen-vi-er-vanvittigt-skuffede/,Jyllands-Posten,https://jyllands-posten.dk/seneste/,"Få de seneste nyheder fra ind- og udland om samfund, erhverv, sport og kultur. ",Jyllandsposten,https://jyllands-posten.dk/seneste/,02.05.2023 07:16
Børskandidat vil udfordre Mærsk & Co. - nu skal salget fordobles til 40 mia. kr.,01.05.2023 00:00,,https://jyllands-posten.dk/jperhverv/ECE15597935/boerskandidaten-scan-global-logistics-vil-bide-skeer-med-maersk-co-nu-skal-salget-loeftes-til-40-mia-kr/,Jyllands-Posten,https://jyllands-posten.dk/seneste/,"Få de seneste nyheder fra ind- og udland om samfund, erhverv, sport og kultur. ",Jyllandsposten,https://jyllands-posten.dk/seneste/,02.05.2023 07:16
Paven vil være fredsmægler i krig mellem Rusland og Ukraine,30.04.2023 00:00,,https://jyllands-posten.dk/international/europa/ECE15707184/paven-vil-vaere-fredsmaegler-i-krig-mellem-rusland-og-ukraine/,Jyllands-Posten,https://jyllands-posten.dk/seneste/,"Få de seneste nyheder fra ind- og udland om samfund, erhverv, sport og kultur. ",Jyllandsposten,https://jyllands-posten.dk/seneste/,02.05.2023 07:16
Enhedslisten og SF vil udvide retten til seniorpension,30.04.2023 00:00,,https://jyllands-posten.dk/politik/ECE15707163/enhedslisten-og-sf-vil-udvide-retten-til-seniorpension/,Jyllands-Posten,https://jyllands-posten.dk/seneste/,"Få de seneste nyheder fra ind- og udland om samfund, erhverv, sport og kultur. ",Jyllandsposten,https://jyllands-posten.dk/seneste/,02.05.2023 07:16
"En dansker har sat gang i festen på Færøerne: »Jeg forestiller mig, at folk kører rundt på gaderne med hornet i bund«",30.04.2023 00:00,,https://jyllands-posten.dk/sport/ECE15707139/en-dansk-haandboldtraener-har-sat-gang-i-festen-paa-faeroeerne-jeg-forestiller-mig-at-folk-koerer-rundt-paa-gaderne-med-hornet-i-bund/,Jyllands-Posten,https://jyllands-posten.dk/seneste/,"Få de seneste nyheder fra ind- og udland om samfund, erhverv, sport og kultur. ",Jyllandsposten,https://jyllands-posten.dk/seneste/,02.05.2023 07:16
