title,published,text,link,og:site_name,og:url,site_description,name,url,scrape_time
Efter flere år med fald: Flere meldte sig ud af folkekirken i 2022,23.02.2023 00:00,,https://politiken.dk/indland/art9216669/Flere-meldte-sig-ud-af-folkekirken-i-2022,Politiken,https://politiken.dk/nyheder/,"Hold dig opdateret pÃ¥ de seneste nyheder pÃ¥ politiken.dk: Seneste Politiken, Seneste Danmark, Seneste Kultur og Seneste Internationalt. ",Politiken,https://politiken.dk/nyheder/,17.02.2023 07:18
Antallet af nye lærlinge er det højeste i 20 år,18.02.2023 00:00,,https://politiken.dk/indland/uddannelse/art9216638/Antallet-af-nye-l%C3%A6rlinge-er-det-h%C3%B8jeste-i-20-%C3%A5r,Politiken,https://politiken.dk/nyheder/,"Hold dig opdateret pÃ¥ de seneste nyheder pÃ¥ politiken.dk: Seneste Politiken, Seneste Danmark, Seneste Kultur og Seneste Internationalt. ",Politiken,https://politiken.dk/nyheder/,17.02.2023 07:18
44-årig mand tilstår knivdrab på sin mor,18.02.2023 00:00,,https://politiken.dk/indland/art9216640/44-%C3%A5rig-mand-tilst%C3%A5r-knivdrab-p%C3%A5-sin-mor,Politiken,https://politiken.dk/nyheder/,"Hold dig opdateret pÃ¥ de seneste nyheder pÃ¥ politiken.dk: Seneste Politiken, Seneste Danmark, Seneste Kultur og Seneste Internationalt. ",Politiken,https://politiken.dk/nyheder/,17.02.2023 07:18
Forhandlinger om forsvaret udskudt,18.02.2023 00:00,,https://politiken.dk/indland/art9216602/Forhandlinger-om-forsvaret-udskudt1,Politiken,https://politiken.dk/nyheder/,"Hold dig opdateret pÃ¥ de seneste nyheder pÃ¥ politiken.dk: Seneste Politiken, Seneste Danmark, Seneste Kultur og Seneste Internationalt. ",Politiken,https://politiken.dk/nyheder/,17.02.2023 07:18
Ny rapport kaster nyt lys over lukningstruede jobcentre: »Brugernes tilfredshed står jo nærmest i skærende kontrast til al den dårlige presse«,18.02.2023 00:00,,https://politiken.dk/indland/art9212890/%C2%BBBrugernes-tilfredshed-st%C3%A5r-jo-n%C3%A6rmest-i-sk%C3%A6rende-kontrast-til-al-den-d%C3%A5rlige-presse%C2%AB,Politiken,https://politiken.dk/nyheder/,"Hold dig opdateret pÃ¥ de seneste nyheder pÃ¥ politiken.dk: Seneste Politiken, Seneste Danmark, Seneste Kultur og Seneste Internationalt. ",Politiken,https://politiken.dk/nyheder/,17.02.2023 07:18
Folketinget indkalder borgere til høring om store bededag,18.02.2023 00:00,,https://politiken.dk/indland/art9216500/Folketinget-indkalder-borgere-til-h%C3%B8ring-om-store-bededag,Politiken,https://politiken.dk/nyheder/,"Hold dig opdateret pÃ¥ de seneste nyheder pÃ¥ politiken.dk: Seneste Politiken, Seneste Danmark, Seneste Kultur og Seneste Internationalt. ",Politiken,https://politiken.dk/nyheder/,17.02.2023 07:18
Skuespil godkendes af Højesteret: Forklædt i røde og grå hættetrøjer åbnede politiagenter skydedøren på en varebil og fremviste 25 pistoler for en kurér,18.02.2023 00:00,,https://politiken.dk/indland/art9215849/Forkl%C3%A6dt-i-r%C3%B8de-og-gr%C3%A5-h%C3%A6ttetr%C3%B8jer-%C3%A5bnede-politiagenter-skyded%C3%B8ren-p%C3%A5-en-varebil-og-fremviste-25-pistoler-for-en-kur%C3%A9r,Politiken,https://politiken.dk/nyheder/,"Hold dig opdateret pÃ¥ de seneste nyheder pÃ¥ politiken.dk: Seneste Politiken, Seneste Danmark, Seneste Kultur og Seneste Internationalt. ",Politiken,https://politiken.dk/nyheder/,17.02.2023 07:18
"Da ekspedienten finder ud af, hvorfor Sabrina Gazier køber så meget modermælkserstatning, rejser han sig og betaler det hele",18.02.2023 00:00,,https://politiken.dk/indland/art9213973/Da-ekspedienten-finder-ud-af-hvorfor-Sabrina-Gazier-k%C3%B8ber-s%C3%A5-meget-moderm%C3%A6lkserstatning-rejser-han-sig-og-betaler-det-hele,Politiken,https://politiken.dk/nyheder/,"Hold dig opdateret pÃ¥ de seneste nyheder pÃ¥ politiken.dk: Seneste Politiken, Seneste Danmark, Seneste Kultur og Seneste Internationalt. ",Politiken,https://politiken.dk/nyheder/,17.02.2023 07:18
"Dansk forsker har fundet verdens ældste pindsvin: »Tænk sig at blive så gammel og så miste livet på grund af noget, der kunne være undgået«",18.02.2023 00:00,,https://politiken.dk/indland/art9215433/%C2%BBT%C3%A6nk-sig-at-blive-s%C3%A5-gammel-og-s%C3%A5-miste-livet-p%C3%A5-grund-af-noget-der-kunne-v%C3%A6re-undg%C3%A5et%C2%AB,Politiken,https://politiken.dk/nyheder/,"Hold dig opdateret pÃ¥ de seneste nyheder pÃ¥ politiken.dk: Seneste Politiken, Seneste Danmark, Seneste Kultur og Seneste Internationalt. ",Politiken,https://politiken.dk/nyheder/,17.02.2023 07:18
Hejremanden og »Danmarks farligste fugl« vækker opstandelse på Frederiksberg,15.02.2023 00:00,,https://politiken.dk/indland/kobenhavn/art9210624/Hejremanden-og-%C2%BBDanmarks-farligste-fugl%C2%AB-v%C3%A6kker-opstandelse-p%C3%A5-Frederiksberg,Politiken,https://politiken.dk/nyheder/,"Hold dig opdateret pÃ¥ de seneste nyheder pÃ¥ politiken.dk: Seneste Politiken, Seneste Danmark, Seneste Kultur og Seneste Internationalt. ",Politiken,https://politiken.dk/nyheder/,17.02.2023 07:18
»Det er skræmmende«: Fisk fra Nordsøen forurenede fiskemel med PFAS,14.02.2023 00:00,,https://politiken.dk/indland/art9212965/%C2%BBDet-er-skr%C3%A6mmende%C2%AB-Fisk-fra-Nords%C3%B8en-forurenede-fiskemel-med-PFAS,Politiken,https://politiken.dk/nyheder/,"Hold dig opdateret pÃ¥ de seneste nyheder pÃ¥ politiken.dk: Seneste Politiken, Seneste Danmark, Seneste Kultur og Seneste Internationalt. ",Politiken,https://politiken.dk/nyheder/,17.02.2023 07:18
Den kringlede vej til en lønaftale i industrien,14.02.2023 00:00,,https://politiken.dk/indland/art9210712/Den-kringlede-vej-til-en-l%C3%B8naftale-i-industrien,Politiken,https://politiken.dk/nyheder/,"Hold dig opdateret pÃ¥ de seneste nyheder pÃ¥ politiken.dk: Seneste Politiken, Seneste Danmark, Seneste Kultur og Seneste Internationalt. ",Politiken,https://politiken.dk/nyheder/,17.02.2023 07:18
Skatteminister forsøger igen at pålægge moms på kunst,14.02.2023 00:00,,https://politiken.dk/indland/art9215098/Skatteminister-fors%C3%B8ger-igen-at-p%C3%A5l%C3%A6gge-moms-p%C3%A5-kunst,Politiken,https://politiken.dk/nyheder/,"Hold dig opdateret pÃ¥ de seneste nyheder pÃ¥ politiken.dk: Seneste Politiken, Seneste Danmark, Seneste Kultur og Seneste Internationalt. ",Politiken,https://politiken.dk/nyheder/,17.02.2023 07:18
SAS hjemmeside var nede i flere timer efter cyberangreb,14.02.2023 00:00,,https://politiken.dk/indland/art9215107/SAS-hjemmeside-var-nede-i-flere-timer-efter-cyberangreb,Politiken,https://politiken.dk/nyheder/,"Hold dig opdateret pÃ¥ de seneste nyheder pÃ¥ politiken.dk: Seneste Politiken, Seneste Danmark, Seneste Kultur og Seneste Internationalt. ",Politiken,https://politiken.dk/nyheder/,17.02.2023 07:18
Mindst 13 våben er forsvundet fra forsvarsmuseum på Bornholm,14.02.2023 00:00,,https://politiken.dk/indland/art9214796/Mindst-13-v%C3%A5ben-er-forsvundet-fra-forsvarsmuseum-p%C3%A5-Bornholm,Politiken,https://politiken.dk/nyheder/,"Hold dig opdateret pÃ¥ de seneste nyheder pÃ¥ politiken.dk: Seneste Politiken, Seneste Danmark, Seneste Kultur og Seneste Internationalt. ",Politiken,https://politiken.dk/nyheder/,17.02.2023 07:18
53-årig kvinde får seks års fængsel for vold med døden til følge,14.02.2023 00:00,,https://politiken.dk/indland/art9214641/53-%C3%A5rig-kvinde-f%C3%A5r-seks-%C3%A5rs-f%C3%A6ngsel-for-vold-med-d%C3%B8den-til-f%C3%B8lge,Politiken,https://politiken.dk/nyheder/,"Hold dig opdateret pÃ¥ de seneste nyheder pÃ¥ politiken.dk: Seneste Politiken, Seneste Danmark, Seneste Kultur og Seneste Internationalt. ",Politiken,https://politiken.dk/nyheder/,17.02.2023 07:18
Politiet dropper sigtelser for skuddrab på 21-årig i Herlev,14.02.2023 00:00,,https://politiken.dk/indland/art9214568/Politiet-dropper-sigtelser-for-skuddrab-p%C3%A5-21-%C3%A5rig-i-Herlev,Politiken,https://politiken.dk/nyheder/,"Hold dig opdateret pÃ¥ de seneste nyheder pÃ¥ politiken.dk: Seneste Politiken, Seneste Danmark, Seneste Kultur og Seneste Internationalt. ",Politiken,https://politiken.dk/nyheder/,17.02.2023 07:18
"»Det er selvfølgelig også noget, vi skal kigge på«: Privatøkonomi kan spænde ben for regeringens ambition om livslang læring",14.02.2023 00:00,,https://politiken.dk/indland/politik/art9206983/Privat%C3%B8konomi-kan-sp%C3%A6nde-ben-for-regeringens-ambition-om-livslang-l%C3%A6ring,Politiken,https://politiken.dk/nyheder/,"Hold dig opdateret pÃ¥ de seneste nyheder pÃ¥ politiken.dk: Seneste Politiken, Seneste Danmark, Seneste Kultur og Seneste Internationalt. ",Politiken,https://politiken.dk/nyheder/,17.02.2023 07:18
Notat viser nye tal om arbejdsudbud ved afskaffelse af store bededag,14.02.2023 00:00,,https://politiken.dk/indland/art9213918/Notat-viser-nye-tal-om-arbejdsudbud-ved-afskaffelse-af-store-bededag,Politiken,https://politiken.dk/nyheder/,"Hold dig opdateret pÃ¥ de seneste nyheder pÃ¥ politiken.dk: Seneste Politiken, Seneste Danmark, Seneste Kultur og Seneste Internationalt. ",Politiken,https://politiken.dk/nyheder/,17.02.2023 07:18
Studieleder har lige fået arbejdsløshedstal for sine studerende. Nu forstår han slet ikke regeringens planer,14.02.2023 00:00,,https://politiken.dk/indland/art9207925/Studieleder-har-lige-f%C3%A5et-arbejdsl%C3%B8shedstal-for-sine-studerende.-Nu-forst%C3%A5r-han-slet-ikke-regeringens-planer,Politiken,https://politiken.dk/nyheder/,"Hold dig opdateret pÃ¥ de seneste nyheder pÃ¥ politiken.dk: Seneste Politiken, Seneste Danmark, Seneste Kultur og Seneste Internationalt. ",Politiken,https://politiken.dk/nyheder/,17.02.2023 07:18
Chefen i Justitsministeriet fik den hårdeste kritik i minksag,13.02.2023 00:00,,https://politiken.dk/indland/art9212984/Chefen-i-Justitsministeriet-fik-den-h%C3%A5rdeste-kritik-i-minksag,Politiken,https://politiken.dk/nyheder/,"Hold dig opdateret pÃ¥ de seneste nyheder pÃ¥ politiken.dk: Seneste Politiken, Seneste Danmark, Seneste Kultur og Seneste Internationalt. ",Politiken,https://politiken.dk/nyheder/,17.02.2023 07:18
Syv oppositionspartier deltager i forsvarsforhandlinger,13.02.2023 00:00,,https://politiken.dk/indland/art9213407/Syv-oppositionspartier-deltager-i-forsvarsforhandlinger,Politiken,https://politiken.dk/nyheder/,"Hold dig opdateret pÃ¥ de seneste nyheder pÃ¥ politiken.dk: Seneste Politiken, Seneste Danmark, Seneste Kultur og Seneste Internationalt. ",Politiken,https://politiken.dk/nyheder/,17.02.2023 07:18
Næsten 500 pakker med ulovlige svampe blev beslaglagt i 2022,13.02.2023 00:00,,https://politiken.dk/indland/art9213298/N%C3%A6sten-500-pakker-med-ulovlige-svampe-blev-beslaglagt-i-2022,Politiken,https://politiken.dk/nyheder/,"Hold dig opdateret pÃ¥ de seneste nyheder pÃ¥ politiken.dk: Seneste Politiken, Seneste Danmark, Seneste Kultur og Seneste Internationalt. ",Politiken,https://politiken.dk/nyheder/,17.02.2023 07:18
"Engang var der fyldt med autoværksteder. Nu bobler gaden med kunst, barer og spisesteder",13.02.2023 00:00,,https://politiken.dk/ibyen/art9102133/Engang-var-der-fyldt-med-autov%C3%A6rksteder.-Nu-bobler-gaden-med-kunst-barer-og-spisesteder,Politiken,https://politiken.dk/nyheder/,"Hold dig opdateret pÃ¥ de seneste nyheder pÃ¥ politiken.dk: Seneste Politiken, Seneste Danmark, Seneste Kultur og Seneste Internationalt. ",Politiken,https://politiken.dk/nyheder/,17.02.2023 07:18
40 brandfolk bekæmper brand i Rødovre,13.02.2023 00:00,,https://politiken.dk/indland/art9212678/40-brandfolk-bek%C3%A6mper-brand-i-R%C3%B8dovre,Politiken,https://politiken.dk/nyheder/,"Hold dig opdateret pÃ¥ de seneste nyheder pÃ¥ politiken.dk: Seneste Politiken, Seneste Danmark, Seneste Kultur og Seneste Internationalt. ",Politiken,https://politiken.dk/nyheder/,17.02.2023 07:18
DMI: Sådan bliver vejret i vinterferien,13.02.2023 00:00,,https://politiken.dk/indland/art9212627/S%C3%A5dan-bliver-vejret-i-vinterferien,Politiken,https://politiken.dk/nyheder/,"Hold dig opdateret pÃ¥ de seneste nyheder pÃ¥ politiken.dk: Seneste Politiken, Seneste Danmark, Seneste Kultur og Seneste Internationalt. ",Politiken,https://politiken.dk/nyheder/,17.02.2023 07:18
Din p-plads bliver et politisk slagsmål: I København kan en p-plads koste 800.000 kroner,13.02.2023 00:00,,https://politiken.dk/indland/kobenhavn/art9167663/Din-p-plads-bliver-et-politisk-slagsm%C3%A5l-I-K%C3%B8benhavn-kan-en-p-plads-koste-800.000-kroner,Politiken,https://politiken.dk/nyheder/,"Hold dig opdateret pÃ¥ de seneste nyheder pÃ¥ politiken.dk: Seneste Politiken, Seneste Danmark, Seneste Kultur og Seneste Internationalt. ",Politiken,https://politiken.dk/nyheder/,17.02.2023 07:18
Spillesteder har købt dyr rødvin og kobekød på kommunens regning: Borgmester er rystet,12.02.2023 00:00,,https://politiken.dk/kultur/art9212553/Spillesteder-har-k%C3%B8bt-dyr-r%C3%B8dvin-og-kobek%C3%B8d-p%C3%A5-kommunens-regning-Borgmester-er-rystet,Politiken,https://politiken.dk/nyheder/,"Hold dig opdateret pÃ¥ de seneste nyheder pÃ¥ politiken.dk: Seneste Politiken, Seneste Danmark, Seneste Kultur og Seneste Internationalt. ",Politiken,https://politiken.dk/nyheder/,17.02.2023 07:18
"59-årige Michael Henriksen har arbejdet, siden han var 14 år. Nu har banken skubbet ham på gaden. Uden en krone",12.02.2023 00:00,,https://politiken.dk/indland/art9204851/59-%C3%A5rige-Michael-Henriksen-har-arbejdet-siden-han-var-14-%C3%A5r.-Nu-har-banken-skubbet-ham-p%C3%A5-gaden.-Uden-en-krone,Politiken,https://politiken.dk/nyheder/,"Hold dig opdateret pÃ¥ de seneste nyheder pÃ¥ politiken.dk: Seneste Politiken, Seneste Danmark, Seneste Kultur og Seneste Internationalt. ",Politiken,https://politiken.dk/nyheder/,17.02.2023 07:18
"Hans Davidsen-Nielsen: Hvem har ikke siddet i møde voldsomt irriteret over kolleger, der ikke kan holde kæft?",12.02.2023 00:00,,https://politiken.dk/indland/art9203042/Hvem-har-ikke-siddet-i-m%C3%B8de-voldsomt-irriteret-over-kolleger-der-ikke-kan-holde-k%C3%A6ft,Politiken,https://politiken.dk/nyheder/,"Hold dig opdateret pÃ¥ de seneste nyheder pÃ¥ politiken.dk: Seneste Politiken, Seneste Danmark, Seneste Kultur og Seneste Internationalt. ",Politiken,https://politiken.dk/nyheder/,17.02.2023 07:18
Fireårig dreng overlever ulykke i svømmebad,12.02.2023 00:00,,https://politiken.dk/indland/art9212388/Fire%C3%A5rig-dreng-overlever-ulykke-i-sv%C3%B8mmebad,Politiken,https://politiken.dk/nyheder/,"Hold dig opdateret pÃ¥ de seneste nyheder pÃ¥ politiken.dk: Seneste Politiken, Seneste Danmark, Seneste Kultur og Seneste Internationalt. ",Politiken,https://politiken.dk/nyheder/,17.02.2023 07:18
"Anden halvleg: Regntøj er ikke bare praktik, men også en livsstilsmarkør",12.02.2023 00:00,,https://politiken.dk/indland/art9201927/Regnt%C3%B8j-er-ikke-bare-praktik-men-ogs%C3%A5-en-livsstilsmark%C3%B8r,Politiken,https://politiken.dk/nyheder/,"Hold dig opdateret pÃ¥ de seneste nyheder pÃ¥ politiken.dk: Seneste Politiken, Seneste Danmark, Seneste Kultur og Seneste Internationalt. ",Politiken,https://politiken.dk/nyheder/,17.02.2023 07:18
128 arbejdsskader indberettet efter skyderiet i Fields,12.02.2023 00:00,,https://politiken.dk/indland/art9212206/128-arbejdsskader-indberettet-efter-skyderiet-i-Fields,Politiken,https://politiken.dk/nyheder/,"Hold dig opdateret pÃ¥ de seneste nyheder pÃ¥ politiken.dk: Seneste Politiken, Seneste Danmark, Seneste Kultur og Seneste Internationalt. ",Politiken,https://politiken.dk/nyheder/,17.02.2023 07:18
"Spionsagen, der skrumpede: Sådan er det gået de fem anklagede i FE-affæren",12.02.2023 00:00,,https://politiken.dk/indland/art9207801/S%C3%A5dan-er-det-g%C3%A5et-de-fem-anklagede-i-FE-aff%C3%A6ren,Politiken,https://politiken.dk/nyheder/,"Hold dig opdateret pÃ¥ de seneste nyheder pÃ¥ politiken.dk: Seneste Politiken, Seneste Danmark, Seneste Kultur og Seneste Internationalt. ",Politiken,https://politiken.dk/nyheder/,17.02.2023 07:18
"Søren Gade: »Jeg har 170 ubesvarede opkald, 533 ulæste e-mails og 406 ulæste sms-er«",12.02.2023 00:00,,https://politiken.dk/indland/art9206047/%C2%BBJeg-har-170-ubesvarede-opkald-533-ul%C3%A6ste-e-mails-og-406-ul%C3%A6ste-sms%E2%80%99er%C2%AB,Politiken,https://politiken.dk/nyheder/,"Hold dig opdateret pÃ¥ de seneste nyheder pÃ¥ politiken.dk: Seneste Politiken, Seneste Danmark, Seneste Kultur og Seneste Internationalt. ",Politiken,https://politiken.dk/nyheder/,17.02.2023 07:18
40-årig mand fra piratsag har søgt asyl i Danmark,12.02.2023 00:00,,https://politiken.dk/indland/art9212062/40-%C3%A5rig-mand-fra-piratsag-har-s%C3%B8gt-asyl-i-Danmark,Politiken,https://politiken.dk/nyheder/,"Hold dig opdateret pÃ¥ de seneste nyheder pÃ¥ politiken.dk: Seneste Politiken, Seneste Danmark, Seneste Kultur og Seneste Internationalt. ",Politiken,https://politiken.dk/nyheder/,17.02.2023 07:18
Ny aftale med privathospitaler risikerer at ramme socialt skævt: »Det vil betyde en eksplosion i ulighed«,11.02.2023 00:00,,https://politiken.dk/indland/art9211859/%C2%BBDet-vil-betyde-en-eksplosion-i-ulighed%C2%AB,Politiken,https://politiken.dk/nyheder/,"Hold dig opdateret pÃ¥ de seneste nyheder pÃ¥ politiken.dk: Seneste Politiken, Seneste Danmark, Seneste Kultur og Seneste Internationalt. ",Politiken,https://politiken.dk/nyheder/,17.02.2023 07:18
Anklager vil have skærpet straf til 34-årig kvinde for voldtægt af 14-årig dreng,11.02.2023 00:00,,https://politiken.dk/indland/art9211869/Anklager-vil-have-sk%C3%A6rpet-straf-til-34-%C3%A5rig-kvinde-for-voldt%C3%A6gt-af-14-%C3%A5rig-dreng,Politiken,https://politiken.dk/nyheder/,"Hold dig opdateret pÃ¥ de seneste nyheder pÃ¥ politiken.dk: Seneste Politiken, Seneste Danmark, Seneste Kultur og Seneste Internationalt. ",Politiken,https://politiken.dk/nyheder/,17.02.2023 07:18
En øko-kunde handler i snit for 274 kroner - alle andre lander på 187 kroner,11.02.2023 00:00,,https://politiken.dk/indland/art9205638/En-%C3%B8ko-kunde-handler-i-snit-for-274-kroner-%E2%80%93-alle-andre-lander-p%C3%A5-187-kroner,Politiken,https://politiken.dk/nyheder/,"Hold dig opdateret pÃ¥ de seneste nyheder pÃ¥ politiken.dk: Seneste Politiken, Seneste Danmark, Seneste Kultur og Seneste Internationalt. ",Politiken,https://politiken.dk/nyheder/,17.02.2023 07:18
Han ligner og lyder som svigermors drøm. Men han er jo et mareridt!,01.02.2023 00:00,,https://politiken.dk/kultur/musik/art9183211/Han-ligner-og-lyder-som-svigermors-dr%C3%B8m.-Men-han-er-jo-et-mareridt,Politiken,https://politiken.dk/nyheder/,"Hold dig opdateret pÃ¥ de seneste nyheder pÃ¥ politiken.dk: Seneste Politiken, Seneste Danmark, Seneste Kultur og Seneste Internationalt. ",Politiken,https://politiken.dk/nyheder/,17.02.2023 07:18
"Det er en flot musikalsk opsætning, men teksten halter",10.02.2023 00:00,,https://politiken.dk/kultur/scene/art9193279/Det-er-en-flot-musikalsk-ops%C3%A6tning-men-teksten-halter,Politiken,https://politiken.dk/nyheder/,"Hold dig opdateret pÃ¥ de seneste nyheder pÃ¥ politiken.dk: Seneste Politiken, Seneste Danmark, Seneste Kultur og Seneste Internationalt. ",Politiken,https://politiken.dk/nyheder/,17.02.2023 07:18
Bruce Willis har fået konstateret demens,10.02.2023 00:00,,https://politiken.dk/kultur/art9218128/Bruce-Willis-har-f%C3%A5et-konstateret-demens,Politiken,https://politiken.dk/nyheder/,"Hold dig opdateret pÃ¥ de seneste nyheder pÃ¥ politiken.dk: Seneste Politiken, Seneste Danmark, Seneste Kultur og Seneste Internationalt. ",Politiken,https://politiken.dk/nyheder/,17.02.2023 07:18
"Kunstanmelderens bedste trick? »Ifør dig virkelig store og meget mørke solbriller, så ingen kan spore angsten i dine øjne«",12.02.2023 00:00,,https://politiken.dk/ibyen/art9138102/Kunstanmelderens-bedste-trick-%C2%BBIf%C3%B8r-dig-virkelig-store-og-meget-m%C3%B8rke-solbriller-s%C3%A5-ingen-kan-spore-angsten-i-dine-%C3%B8jne%C2%AB,Politiken,https://politiken.dk/nyheder/,"Hold dig opdateret pÃ¥ de seneste nyheder pÃ¥ politiken.dk: Seneste Politiken, Seneste Danmark, Seneste Kultur og Seneste Internationalt. ",Politiken,https://politiken.dk/nyheder/,17.02.2023 07:18
"Sarah Skarum: Skammen forsvinder ikke, men den svinder ind, når der sættes ord på den",14.02.2023 00:00,,https://politiken.dk/kultur/set_og_hoert/art9187881/Skammen-forsvinder-ikke-men-den-svinder-ind-n%C3%A5r-der-s%C3%A6ttes-ord-p%C3%A5-den,Politiken,https://politiken.dk/nyheder/,"Hold dig opdateret pÃ¥ de seneste nyheder pÃ¥ politiken.dk: Seneste Politiken, Seneste Danmark, Seneste Kultur og Seneste Internationalt. ",Politiken,https://politiken.dk/nyheder/,17.02.2023 07:18
"Lena Dunham, Cynthia Nixon og flere hundrede andre går til angreb på verdens mest prisvindende avis",16.02.2023 00:00,,https://politiken.dk/kultur/art9216747/Lena-Dunham-Cynthia-Nixon-og-flere-hundrede-andre-g%C3%A5r-til-angreb-p%C3%A5-verdens-mest-prisvindende-avis,Politiken,https://politiken.dk/nyheder/,"Hold dig opdateret pÃ¥ de seneste nyheder pÃ¥ politiken.dk: Seneste Politiken, Seneste Danmark, Seneste Kultur og Seneste Internationalt. ",Politiken,https://politiken.dk/nyheder/,17.02.2023 07:18
Det er giftig og saftig socialrealisme. Ã rets guilty pleasure,16.02.2023 00:00,,https://politiken.dk/kultur/boger/art9190890/Det-er-giftig-og-saftig-socialrealisme.-%C3%85rets-guilty-pleasure,Politiken,https://politiken.dk/nyheder/,"Hold dig opdateret pÃ¥ de seneste nyheder pÃ¥ politiken.dk: Seneste Politiken, Seneste Danmark, Seneste Kultur og Seneste Internationalt. ",Politiken,https://politiken.dk/nyheder/,17.02.2023 07:18
Bandet har været lidt af en velbevaret hemmelighed. Onsdag gav de en eminent koncert i København,18.02.2023 00:00,,https://politiken.dk/kultur/musik/art9158989/Bandet-har-v%C3%A6ret-lidt-af-en-velbevaret-hemmelighed.-Onsdag-gav-de-en-eminent-koncert-i-K%C3%B8benhavn,Politiken,https://politiken.dk/nyheder/,"Hold dig opdateret pÃ¥ de seneste nyheder pÃ¥ politiken.dk: Seneste Politiken, Seneste Danmark, Seneste Kultur og Seneste Internationalt. ",Politiken,https://politiken.dk/nyheder/,17.02.2023 07:18
Pernille Tranberg: Kampen mod de falske nyheder virker håbløs,18.02.2023 00:00,,https://politiken.dk/kultur/medier/art9215815/Kampen-mod-de-falske-nyheder-virker-h%C3%A5bl%C3%B8s,Politiken,https://politiken.dk/nyheder/,"Hold dig opdateret pÃ¥ de seneste nyheder pÃ¥ politiken.dk: Seneste Politiken, Seneste Danmark, Seneste Kultur og Seneste Internationalt. ",Politiken,https://politiken.dk/nyheder/,17.02.2023 07:18
Stjerneforfatter vender tilbage efter 13 års stilhed,19.02.2023 00:00,,https://politiken.dk/kultur/boger/art9212942/Stjerneforfatter-vender-tilbage-efter-13-%C3%A5rs-stilhed,Politiken,https://politiken.dk/nyheder/,"Hold dig opdateret pÃ¥ de seneste nyheder pÃ¥ politiken.dk: Seneste Politiken, Seneste Danmark, Seneste Kultur og Seneste Internationalt. ",Politiken,https://politiken.dk/nyheder/,17.02.2023 07:18
Danske eksperter finder »vanvittig potent gift« i død nobelpristagers tænder,23.02.2023 00:00,,https://politiken.dk/kultur/art9196923/Danske-eksperter-finder-%C2%BBvanvittig-potent-gift%C2%AB-i-d%C3%B8d-nobelpristagers-t%C3%A6nder,Politiken,https://politiken.dk/nyheder/,"Hold dig opdateret pÃ¥ de seneste nyheder pÃ¥ politiken.dk: Seneste Politiken, Seneste Danmark, Seneste Kultur og Seneste Internationalt. ",Politiken,https://politiken.dk/nyheder/,17.02.2023 07:18
Han smurte hundelort i ansigtet på kritiker. Men han nægter at undskylde,18.02.2023 00:00,,https://politiken.dk/kultur/art9215326/Han-smurte-hundelort-i-ansigtet-p%C3%A5-kritiker.-Men-han-n%C3%A6gter-at-undskylde,Politiken,https://politiken.dk/nyheder/,"Hold dig opdateret pÃ¥ de seneste nyheder pÃ¥ politiken.dk: Seneste Politiken, Seneste Danmark, Seneste Kultur og Seneste Internationalt. ",Politiken,https://politiken.dk/nyheder/,17.02.2023 07:18
"Den stumme klodsmajor Mr. Bean gør Maigret både mut, mørk og melankolsk",18.02.2023 00:00,,https://politiken.dk/kultur/set_og_hoert/art9187880/Den-stumme-klodsmajor-Mr.-Bean-g%C3%B8r-Maigret-b%C3%A5de-mut-m%C3%B8rk-og-melankolsk,Politiken,https://politiken.dk/nyheder/,"Hold dig opdateret pÃ¥ de seneste nyheder pÃ¥ politiken.dk: Seneste Politiken, Seneste Danmark, Seneste Kultur og Seneste Internationalt. ",Politiken,https://politiken.dk/nyheder/,17.02.2023 07:18
Selv blandt superhelte er nogle vist mest skabt til biroller,18.02.2023 00:00,,https://politiken.dk/kultur/film_og_tv/art9148695/Selv-blandt-superhelte-er-nogle-vist-mest-skabt-til-biroller,Politiken,https://politiken.dk/nyheder/,"Hold dig opdateret pÃ¥ de seneste nyheder pÃ¥ politiken.dk: Seneste Politiken, Seneste Danmark, Seneste Kultur og Seneste Internationalt. ",Politiken,https://politiken.dk/nyheder/,17.02.2023 07:18
Raquel Welch er død,18.02.2023 00:00,,https://politiken.dk/kultur/art9216544/Raquel-Welch-er-d%C3%B8d,Politiken,https://politiken.dk/nyheder/,"Hold dig opdateret pÃ¥ de seneste nyheder pÃ¥ politiken.dk: Seneste Politiken, Seneste Danmark, Seneste Kultur og Seneste Internationalt. ",Politiken,https://politiken.dk/nyheder/,17.02.2023 07:18
"Det makabert høje dødstal er et skræmmeeksempel på amerikansk kapitalisme, når den er allermest ryggesløs",18.02.2023 00:00,,https://politiken.dk/kultur/film_og_tv/art9148700/Det-makabert-h%C3%B8je-d%C3%B8dstal-er-et-skr%C3%A6mmeeksempel-p%C3%A5-amerikansk-kapitalisme-n%C3%A5r-den-er-allermest-ryggesl%C3%B8s,Politiken,https://politiken.dk/nyheder/,"Hold dig opdateret pÃ¥ de seneste nyheder pÃ¥ politiken.dk: Seneste Politiken, Seneste Danmark, Seneste Kultur og Seneste Internationalt. ",Politiken,https://politiken.dk/nyheder/,17.02.2023 07:18
Efter kritisk dokumentar: Indiske myndigheder gennemsøger flere BBC-kontorer og beslaglægger telefoner,18.02.2023 00:00,,https://politiken.dk/kultur/art9215481/Indiske-myndigheder-gennems%C3%B8ger-flere-BBC-kontorer-og-beslagl%C3%A6gger-telefoner,Politiken,https://politiken.dk/nyheder/,"Hold dig opdateret pÃ¥ de seneste nyheder pÃ¥ politiken.dk: Seneste Politiken, Seneste Danmark, Seneste Kultur og Seneste Internationalt. ",Politiken,https://politiken.dk/nyheder/,17.02.2023 07:18
