title,published,text,link,og:site_name,og:url,site_description,name,url,scrape_time
Kampen mod ekstra kilo: Danskerne peger fingre ad fødevare-industrien,27.01.2023 05:35,,https://jyllands-posten.dk/indland/ECE14900636/danskerne-mener-at-foedevareindustrien-har-et-ansvar-for-fedmeepidemi/,,,"FÃ¥ de seneste nyheder fra ind- og udland om samfund, erhverv, sport og kultur. ",Jyllandsposten,https://jyllands-posten.dk/seneste/,27.01.2023 07:17
USA hævder at have ramt markant Islamisk Stat-leder i Somalia,27.01.2023 05:33,,https://jyllands-posten.dk/international/ECE14904140/usa-haevder-at-have-ramt-markant-islamisk-statleder-i-somalia/,,,"FÃ¥ de seneste nyheder fra ind- og udland om samfund, erhverv, sport og kultur. ",Jyllandsposten,https://jyllands-posten.dk/seneste/,27.01.2023 07:17
Dannebrog er tilbage på Kronborg,27.01.2023 05:30,,https://jyllands-posten.dk/dagensoverblik/ECE14904097/nyhedsoverblik/,,,"FÃ¥ de seneste nyheder fra ind- og udland om samfund, erhverv, sport og kultur. ",Jyllandsposten,https://jyllands-posten.dk/seneste/,27.01.2023 07:17
21 køretøjer og 49 brandmænd rykkede ud til brand i København,27.01.2023 05:27,,https://jyllands-posten.dk/indland/ECE14904133/21-koeretoejer-og-49-brandmaend-rykkede-ud-til-brand-i-koebenhavn/,,,"FÃ¥ de seneste nyheder fra ind- og udland om samfund, erhverv, sport og kultur. ",Jyllandsposten,https://jyllands-posten.dk/seneste/,27.01.2023 07:17
Drømmen om frihed kræver opsparing,27.01.2023 05:15,,https://jyllands-posten.dk/jperhverv/ECE14889719/droemmen-om-frihed-kraever-opsparing/,,,"FÃ¥ de seneste nyheder fra ind- og udland om samfund, erhverv, sport og kultur. ",Jyllandsposten,https://jyllands-posten.dk/seneste/,27.01.2023 07:17
Han var urkilden til regeringens argument om at afskaffe store bededag: Nu modsiger han hele fundamentet for forslaget,27.01.2023 05:00,,https://jyllands-posten.dk/politik/ECE14893489/formand-saar-tvivl-om-regeringens-fundamentet-for-at-afskaffe-store-bededag/,,,"FÃ¥ de seneste nyheder fra ind- og udland om samfund, erhverv, sport og kultur. ",Jyllandsposten,https://jyllands-posten.dk/seneste/,27.01.2023 07:17
Stadig flere får ikke lov til at betale gæld til det offentlige,26.01.2023 00:00,,https://jyllands-posten.dk/indland/ECE14904083/stadig-flere-faar-ikke-lov-til-at-betale-gaeld-til-det-offentlige/,,,"FÃ¥ de seneste nyheder fra ind- og udland om samfund, erhverv, sport og kultur. ",Jyllandsposten,https://jyllands-posten.dk/seneste/,27.01.2023 07:17
Ronaldo missede chancen for første titel i Saudi-Arabien,26.01.2023 00:00,,https://jyllands-posten.dk/sport/fodbold/ECE14904013/ronaldo-missede-chancen-for-foerste-titel-i-saudiarabien/,,,"FÃ¥ de seneste nyheder fra ind- og udland om samfund, erhverv, sport og kultur. ",Jyllandsposten,https://jyllands-posten.dk/seneste/,27.01.2023 07:17
Fem betjente anklages for drab efter brutal anholdelse i USA,26.01.2023 00:00,,https://jyllands-posten.dk/international/usa/ECE14904005/fem-betjente-anklages-for-drab-efter-brutal-anholdelse-i-usa/,,,"FÃ¥ de seneste nyheder fra ind- og udland om samfund, erhverv, sport og kultur. ",Jyllandsposten,https://jyllands-posten.dk/seneste/,27.01.2023 07:17
Sigtelse: Dødfunden kvinde var påvirket og blev voldtaget,26.01.2023 00:00,,https://jyllands-posten.dk/indland/ECE14903939/sigtelse-doedfunden-kvinde-var-paavirket-og-blev-voldtaget/,,,"FÃ¥ de seneste nyheder fra ind- og udland om samfund, erhverv, sport og kultur. ",Jyllandsposten,https://jyllands-posten.dk/seneste/,27.01.2023 07:17
Ukraine stejler over mulig russisk OL-deltagelse i 2024,26.01.2023 00:00,,https://jyllands-posten.dk/international/europa/ECE14903945/ukraine-stejler-over-mulig-russisk-oldeltagelse-i-2024/,,,"FÃ¥ de seneste nyheder fra ind- og udland om samfund, erhverv, sport og kultur. ",Jyllandsposten,https://jyllands-posten.dk/seneste/,27.01.2023 07:17
Nu starter ømtålelig diskussion igen i USA: »Sådan noget skal aldrig igen ske for en siddende præsident«,26.01.2023 00:00,,https://jyllands-posten.dk/international/ECE14902730/metabeslutning-om-trump-igangsaetter-ny-diskussion-om-ytringsfrihed-i-usa/,,,"FÃ¥ de seneste nyheder fra ind- og udland om samfund, erhverv, sport og kultur. ",Jyllandsposten,https://jyllands-posten.dk/seneste/,27.01.2023 07:17
USAs ekspræsidenter opfordres til at lede efter hemmelige dokumenter,26.01.2023 00:00,,https://jyllands-posten.dk/international/usa/ECE14903812/usas-ekspraesidenter-opfordres-til-at-lede-efter-hemmelige-dokumenter/,,,"FÃ¥ de seneste nyheder fra ind- og udland om samfund, erhverv, sport og kultur. ",Jyllandsposten,https://jyllands-posten.dk/seneste/,27.01.2023 07:17
Danske håndboldherrer forbereder sig på alt andet end forandring og nytænkning,26.01.2023 00:00,,https://jyllands-posten.dk/sport/ECE14901556/danske-haandboldherrer-forbereder-sig-paa-alt-andet-end-forandring-og-nytaenkning/,,,"FÃ¥ de seneste nyheder fra ind- og udland om samfund, erhverv, sport og kultur. ",Jyllandsposten,https://jyllands-posten.dk/seneste/,27.01.2023 07:17
Banker ser vendepunkt for europæisk økonomi: Løfter deres prognoser på stribe,26.01.2023 00:00,,https://jyllands-posten.dk/jperhverv/ECE14901696/banker-ser-vendepunkt-for-europaeisk-oekonomi-loefter-deres-prognoser-paa-stribe/,,,"FÃ¥ de seneste nyheder fra ind- og udland om samfund, erhverv, sport og kultur. ",Jyllandsposten,https://jyllands-posten.dk/seneste/,27.01.2023 07:17
EU-lande vil bruge visa-restriktioner til at øge hjemsendelser,26.01.2023 00:00,,https://jyllands-posten.dk/international/europa/ECE14903758/eulande-vil-bruge-visarestriktioner-til-at-oege-hjemsendelser/,,,"FÃ¥ de seneste nyheder fra ind- og udland om samfund, erhverv, sport og kultur. ",Jyllandsposten,https://jyllands-posten.dk/seneste/,27.01.2023 07:17
Danmark får ny dommer ved Menneskerettighedsdomstolen,26.01.2023 00:00,,https://jyllands-posten.dk/international/europa/ECE14903668/danmark-faar-ny-dommer-ved-menneskerettighedsdomstolen/,,,"FÃ¥ de seneste nyheder fra ind- og udland om samfund, erhverv, sport og kultur. ",Jyllandsposten,https://jyllands-posten.dk/seneste/,27.01.2023 07:17
Forsvarsministeriet: Disse to våbensystemer kan snart være på vej til Danmark,26.01.2023 00:00,,https://jyllands-posten.dk/indland/ECE14903198/danmark-forhandler-om-at-koebe-israelsk-artilleri/,,,"FÃ¥ de seneste nyheder fra ind- og udland om samfund, erhverv, sport og kultur. ",Jyllandsposten,https://jyllands-posten.dk/seneste/,27.01.2023 07:17
"På få timer lavede S politisk kovending: I en østjysk gymnasieklasse sidder 7 kvinder, der kan rammes af lovændring",26.01.2023 00:00,,https://jyllands-posten.dk/indland/ECE14898541/skal-vaernepligten-ligestilles-her-er-syv-unge-kvinders-mening-om-sagen/?st=1,,,"FÃ¥ de seneste nyheder fra ind- og udland om samfund, erhverv, sport og kultur. ",Jyllandsposten,https://jyllands-posten.dk/seneste/,27.01.2023 07:17
Coronasmitten har snydt os - på den gode måde,26.01.2023 00:00,,https://jyllands-posten.dk/indland/ECE14901666/coronasmitten-har-snydt-os-paa-den-gode-maade/,,,"FÃ¥ de seneste nyheder fra ind- og udland om samfund, erhverv, sport og kultur. ",Jyllandsposten,https://jyllands-posten.dk/seneste/,27.01.2023 07:17
"Et Indien, vi ikke har set før: Louisianas fremragende udstilling med Gauri Gill viser mennesker, som mange middelklasseindere ved meget lidt om",26.01.2023 00:00,,https://jyllands-posten.dk/kultur/ECE14899032/louisianas-fremragende-udstilling-med-gauri-gill-viser-mennesker-som-mange-middelklasseindere-ved-meget-lidt-om/,,,"FÃ¥ de seneste nyheder fra ind- og udland om samfund, erhverv, sport og kultur. ",Jyllandsposten,https://jyllands-posten.dk/seneste/,27.01.2023 07:17
Svensk terrorforsker: Sag om 16-årig dreng bør Danmark tage meget seriøst,26.01.2023 00:00,,https://jyllands-posten.dk/indland/ECE14902704/dansk-dreng-har-ifoelge-politiet-haft-en-ledende-rolle-i-nynazistisk-bevaegelse/,,,"FÃ¥ de seneste nyheder fra ind- og udland om samfund, erhverv, sport og kultur. ",Jyllandsposten,https://jyllands-posten.dk/seneste/,27.01.2023 07:17
Kulturminister reddede Dannebrog ved Kronborg Slot på under en time,26.01.2023 00:00,,https://jyllands-posten.dk/indland/ECE14903600/kulturminister-reddede-dannebrog-ved-kronborg-slot-paa-under-en-time/,,,"FÃ¥ de seneste nyheder fra ind- og udland om samfund, erhverv, sport og kultur. ",Jyllandsposten,https://jyllands-posten.dk/seneste/,27.01.2023 07:17
Rusland fortsætter lukninger og slår ned mod populært medie,26.01.2023 00:00,,https://jyllands-posten.dk/international/europa/ECE14903592/rusland-fortsaetter-lukninger-og-slaar-ned-mod-populaert-medie/,,,"FÃ¥ de seneste nyheder fra ind- og udland om samfund, erhverv, sport og kultur. ",Jyllandsposten,https://jyllands-posten.dk/seneste/,27.01.2023 07:17
Sprøjtemidler er under stærk mistanke for at danne PFAS i jorden,26.01.2023 00:00,,https://jyllands-posten.dk/indland/ECE14902384/sproejtemidler-er-under-staerk-mistanke-for-at-danne-pfas-i-jorden/,,,"FÃ¥ de seneste nyheder fra ind- og udland om samfund, erhverv, sport og kultur. ",Jyllandsposten,https://jyllands-posten.dk/seneste/,27.01.2023 07:17
Riskær forsvarer sig i retten: Jeg må godt drive virksomhed,26.01.2023 00:00,,https://jyllands-posten.dk/indland/ECE14903561/riskaer-forsvarer-sig-i-retten-jeg-maa-godt-drive-virksomhed/,,,"FÃ¥ de seneste nyheder fra ind- og udland om samfund, erhverv, sport og kultur. ",Jyllandsposten,https://jyllands-posten.dk/seneste/,27.01.2023 07:17
USA nedlægger hjemmeside brugt til afpresning for 700 millioner kroner,26.01.2023 00:00,,https://jyllands-posten.dk/international/usa/ECE14903518/usa-nedlaegger-hjemmeside-brugt-til-afpresning-for-700-millioner-kroner/,,,"FÃ¥ de seneste nyheder fra ind- og udland om samfund, erhverv, sport og kultur. ",Jyllandsposten,https://jyllands-posten.dk/seneste/,27.01.2023 07:17
Sigtelse: Mand voldtog kvinde inden hendes død,26.01.2023 00:00,,https://jyllands-posten.dk/indland/ECE14903472/sigtelse-mand-voldtog-kvinde-inden-hendes-doed/,,,"FÃ¥ de seneste nyheder fra ind- og udland om samfund, erhverv, sport og kultur. ",Jyllandsposten,https://jyllands-posten.dk/seneste/,27.01.2023 07:17
400 år gammel flagtradition på Kronborg Slot slutter,26.01.2023 00:00,,https://jyllands-posten.dk/indland/ECE14903231/400-aar-gammel-flagtradition-paa-kronborg-slot-slutter/,,,"FÃ¥ de seneste nyheder fra ind- og udland om samfund, erhverv, sport og kultur. ",Jyllandsposten,https://jyllands-posten.dk/seneste/,27.01.2023 07:17
Tre astronauter er strandet på rumstation: »Der er noget meget mystisk ved den her historie«,26.01.2023 00:00,,https://jyllands-posten.dk/international/europa/ECE14897420/nasa-tre-astronauter-kan-blive-fanget-paa-rumstation-i-et-helt-aar/,,,"FÃ¥ de seneste nyheder fra ind- og udland om samfund, erhverv, sport og kultur. ",Jyllandsposten,https://jyllands-posten.dk/seneste/,27.01.2023 07:17
DIF: Asiens russiske OL-invitation snyder Europas atleter,26.01.2023 00:00,,https://jyllands-posten.dk/sport/ECE14903042/dif-asiens-russiske-olinvitation-snyder-europas-atleter/,,,"FÃ¥ de seneste nyheder fra ind- og udland om samfund, erhverv, sport og kultur. ",Jyllandsposten,https://jyllands-posten.dk/seneste/,27.01.2023 07:17
Salg af kvindelige fodboldspillere er eksploderet på få år,26.01.2023 00:00,,https://jyllands-posten.dk/sport/fodbold/ECE14902969/salg-af-kvindelige-fodboldspillere-er-eksploderet-paa-faa-aar/,,,"FÃ¥ de seneste nyheder fra ind- og udland om samfund, erhverv, sport og kultur. ",Jyllandsposten,https://jyllands-posten.dk/seneste/,27.01.2023 07:17
Spanien vil sende gamle kampvogne til Ukraine,26.01.2023 00:00,,https://jyllands-posten.dk/international/europa/ECE14902803/spanien-vil-sende-gamle-kampvogne-til-ukraine/,,,"FÃ¥ de seneste nyheder fra ind- og udland om samfund, erhverv, sport og kultur. ",Jyllandsposten,https://jyllands-posten.dk/seneste/,27.01.2023 07:17
Brandvæsen evakuerede 56 adresser efter gasudslip i Brande,26.01.2023 00:00,,https://jyllands-posten.dk/indland/ECE14903021/brandvaesen-evakuerede-56-adresser-efter-gasudslip-i-brande/,,,"FÃ¥ de seneste nyheder fra ind- og udland om samfund, erhverv, sport og kultur. ",Jyllandsposten,https://jyllands-posten.dk/seneste/,27.01.2023 07:17
Er en vigtig film altid god? Toppræstation i en ellers fersk historietime,26.01.2023 00:00,,https://jyllands-posten.dk/kultur/film/ECE14892189/danielle-deadwyler-leverer-en-toppraestation-som-emmett-tills-mor-i-et-filmdrama-der-foeles-som-en-historietime/,,,"FÃ¥ de seneste nyheder fra ind- og udland om samfund, erhverv, sport og kultur. ",Jyllandsposten,https://jyllands-posten.dk/seneste/,27.01.2023 07:17
Købte samme varer som i 2010: Så dyrt er det at fylde indkøbsvognen,26.01.2023 00:00,,https://jyllands-posten.dk/livsstil/ECE14840718/en-agurk-faas-stadig-for-en-femmer-men-prisen-paa-maelk-er-galopperet/,,,"FÃ¥ de seneste nyheder fra ind- og udland om samfund, erhverv, sport og kultur. ",Jyllandsposten,https://jyllands-posten.dk/seneste/,27.01.2023 07:17
Ritt Bjerregaard giver sidste ord til Mikael Bertelsen,26.01.2023 00:00,,https://jyllands-posten.dk/kultur/ECE14902756/ritt-bjerregaard-giver-sidste-ord-til-mikael-bertelsen/,,,"FÃ¥ de seneste nyheder fra ind- og udland om samfund, erhverv, sport og kultur. ",Jyllandsposten,https://jyllands-posten.dk/seneste/,27.01.2023 07:17
Forsvarschef håber på flere kvindelige soldater: Giver kampkraft,26.01.2023 00:00,,https://jyllands-posten.dk/politik/ECE14902658/forsvarschef-haaber-paa-flere-kvindelige-soldater-giver-kampkraft/,,,"FÃ¥ de seneste nyheder fra ind- og udland om samfund, erhverv, sport og kultur. ",Jyllandsposten,https://jyllands-posten.dk/seneste/,27.01.2023 07:17
Svensk regering skærper straf for bandekriminalitet,26.01.2023 00:00,,https://jyllands-posten.dk/international/europa/ECE14902472/svensk-regering-skaerper-straf-for-bandekriminalitet/,,,"FÃ¥ de seneste nyheder fra ind- og udland om samfund, erhverv, sport og kultur. ",Jyllandsposten,https://jyllands-posten.dk/seneste/,27.01.2023 07:17
23-årig kvinde er fundet død i lejlighed i Roskilde,26.01.2023 00:00,,https://jyllands-posten.dk/indland/ECE14902556/23aarig-kvinde-er-fundet-doed-i-lejlighed-i-roskilde/,,,"FÃ¥ de seneste nyheder fra ind- og udland om samfund, erhverv, sport og kultur. ",Jyllandsposten,https://jyllands-posten.dk/seneste/,27.01.2023 07:17
Kvindelig cyklist er død i højresvingsulykke i Nordsjælland,26.01.2023 00:00,,https://jyllands-posten.dk/indland/ECE14902574/kvindelig-cyklist-er-doed-i-hoejresvingsulykke-i-nordsjaelland/,,,"FÃ¥ de seneste nyheder fra ind- og udland om samfund, erhverv, sport og kultur. ",Jyllandsposten,https://jyllands-posten.dk/seneste/,27.01.2023 07:17
Efter PFAS-fund i æg: Minister vil undersøge flere fødevarer,26.01.2023 00:00,,https://jyllands-posten.dk/indland/ECE14902407/efter-pfasfund-i-aeg-minister-vil-undersoege-flere-foedevarer/,,,"FÃ¥ de seneste nyheder fra ind- og udland om samfund, erhverv, sport og kultur. ",Jyllandsposten,https://jyllands-posten.dk/seneste/,27.01.2023 07:17
Flere og flere danskere over 85 år dør af covid-19,26.01.2023 00:00,,https://jyllands-posten.dk/indland/ECE14902400/flere-og-flere-danskere-over-85-aar-doer-af-covid19/,,,"FÃ¥ de seneste nyheder fra ind- og udland om samfund, erhverv, sport og kultur. ",Jyllandsposten,https://jyllands-posten.dk/seneste/,27.01.2023 07:17
Kvinde stukket med kniv ved jobcenter i Aabenraa,26.01.2023 00:00,,https://jyllands-posten.dk/indland/ECE14902310/kvinde-stukket-med-kniv-ved-jobcenter-i-aabenraa/,,,"FÃ¥ de seneste nyheder fra ind- og udland om samfund, erhverv, sport og kultur. ",Jyllandsposten,https://jyllands-posten.dk/seneste/,27.01.2023 07:17
"Han fik et knæk efter drengekoret, men fandt et nyt spor i et forsvundet mesterværk og verdens bedste jazzmusikere",26.01.2023 00:00,,https://jyllands-posten.dk/kultur/ECE14862288/andreas-koefoed-sendte-en-mail-til-joergen-leth-og-pludselig-dukkede-leth-op/,,,"FÃ¥ de seneste nyheder fra ind- og udland om samfund, erhverv, sport og kultur. ",Jyllandsposten,https://jyllands-posten.dk/seneste/,27.01.2023 07:17
"Ãldre sparer selv op: Tror ikke på, at hjemmehjælpen kommer",26.01.2023 00:00,,https://jyllands-posten.dk/indland/ECE14888991/aeldre-er-glade-for-livet-men-ogsaa-ganske-bekymrede-for-fremtiden/,,,"FÃ¥ de seneste nyheder fra ind- og udland om samfund, erhverv, sport og kultur. ",Jyllandsposten,https://jyllands-posten.dk/seneste/,27.01.2023 07:17
S skifter mening på få timer: Flertal for værnepligt for kvinder,26.01.2023 00:00,,https://jyllands-posten.dk/politik/ECE14901982/s-skifter-mening-paa-faa-timer-flertal-for-vaernepligt-for-kvinder/,,,"FÃ¥ de seneste nyheder fra ind- og udland om samfund, erhverv, sport og kultur. ",Jyllandsposten,https://jyllands-posten.dk/seneste/,27.01.2023 07:17
Trods formandsstop får Vermund fremtrædende rolle i Nye Borgerlige,26.01.2023 00:00,,https://jyllands-posten.dk/politik/ECE14901778/trods-formandsstop-faar-vermund-fremtraedende-rolle-i-nye-borgerlige/,,,"FÃ¥ de seneste nyheder fra ind- og udland om samfund, erhverv, sport og kultur. ",Jyllandsposten,https://jyllands-posten.dk/seneste/,27.01.2023 07:17
Asteroide passerer tæt forbi Jorden natten til fredag,26.01.2023 00:00,,https://jyllands-posten.dk/international/ECE14901754/asteroide-passerer-taet-forbi-jorden-natten-til-fredag/,,,"FÃ¥ de seneste nyheder fra ind- og udland om samfund, erhverv, sport og kultur. ",Jyllandsposten,https://jyllands-posten.dk/seneste/,27.01.2023 07:17
Splidsboel: Russere forventer modsvar på kampvogne til Ukraine,26.01.2023 00:00,,https://jyllands-posten.dk/international/ECE14901638/forsker-russere-forventer-modsvar-paa-kampvogne-til-ukraine/,,,"FÃ¥ de seneste nyheder fra ind- og udland om samfund, erhverv, sport og kultur. ",Jyllandsposten,https://jyllands-posten.dk/seneste/,27.01.2023 07:17
"To mænd går til yderligheder for at bevise, hvor færdige de er med hinanden",26.01.2023 00:00,,https://jyllands-posten.dk/kultur/film/ECE14882413/colin-farrell-og-brendan-gleeson-straaler-i-veloplagt-irsk-komediedrama/,,,"FÃ¥ de seneste nyheder fra ind- og udland om samfund, erhverv, sport og kultur. ",Jyllandsposten,https://jyllands-posten.dk/seneste/,27.01.2023 07:17
Wimbledon-mester skal møde Sabalenka i Australian Open-finale,26.01.2023 00:00,,https://jyllands-posten.dk/sport/tennis/ECE14901032/wimbledonmester-skal-moede-sabalenka-i-australian-openfinale/,,,"FÃ¥ de seneste nyheder fra ind- og udland om samfund, erhverv, sport og kultur. ",Jyllandsposten,https://jyllands-posten.dk/seneste/,27.01.2023 07:17
Hvis Olsen Banden stjal børn: Original og varm film om en bande børnesælgere,26.01.2023 00:00,,https://jyllands-posten.dk/kultur/film/ECE14861780/hvis-olsen-banden-stjal-boern/,,,"FÃ¥ de seneste nyheder fra ind- og udland om samfund, erhverv, sport og kultur. ",Jyllandsposten,https://jyllands-posten.dk/seneste/,27.01.2023 07:17
"Prisen på æg blev detaljen, der afslørede svindelfinte",26.01.2023 00:00,,https://jyllands-posten.dk/international/europa/ECE14883635/giftige-korruptionssager-paa-hoejt-niveau-kan-udloese-politisk-krise-i-ukraine/,,,"FÃ¥ de seneste nyheder fra ind- og udland om samfund, erhverv, sport og kultur. ",Jyllandsposten,https://jyllands-posten.dk/seneste/,27.01.2023 07:17
16-årig tiltalt for tilslutning til højreradikal terror,26.01.2023 00:00,,https://jyllands-posten.dk/indland/ECE14900977/16aarig-tiltalt-for-tilslutning-til-hoejreradikal-terror/,,,"FÃ¥ de seneste nyheder fra ind- og udland om samfund, erhverv, sport og kultur. ",Jyllandsposten,https://jyllands-posten.dk/seneste/,27.01.2023 07:17
Sekterne pibler frem i Tyrkiet - og nu har en ung kvinde fået en skandale til at rulle,26.01.2023 00:00,,https://jyllands-posten.dk/international/ECE14807301/skandalen-om-en-tvangsgift-seksaarig-saetter-spot-paa-regeringsbaand-til-tyrkiske-sekter/,,,"FÃ¥ de seneste nyheder fra ind- og udland om samfund, erhverv, sport og kultur. ",Jyllandsposten,https://jyllands-posten.dk/seneste/,27.01.2023 07:17
Kvinde og børn har kontaktet kommune efter to ugers efterlysning,26.01.2023 00:00,,https://jyllands-posten.dk/indland/ECE14900697/kvinde-og-boern-har-kontaktet-kommune-efter-to-ugers-efterlysning/,,,"FÃ¥ de seneste nyheder fra ind- og udland om samfund, erhverv, sport og kultur. ",Jyllandsposten,https://jyllands-posten.dk/seneste/,27.01.2023 07:17
Dansk Folkepartis næstformand har fået nyt job og forlader posten,26.01.2023 00:00,,https://jyllands-posten.dk/politik/ECE14900791/dansk-folkepartis-naestformand-har-faaet-nyt-job-og-forlader-posten/,,,"FÃ¥ de seneste nyheder fra ind- og udland om samfund, erhverv, sport og kultur. ",Jyllandsposten,https://jyllands-posten.dk/seneste/,27.01.2023 07:17
Norsk VM-skurk forventede ikke passivt spil,26.01.2023 00:00,,https://jyllands-posten.dk/import/importjp/ritzau/ECE14900538/norsk-vmskurk-forventede-ikke-passivt-spil/,,,"FÃ¥ de seneste nyheder fra ind- og udland om samfund, erhverv, sport og kultur. ",Jyllandsposten,https://jyllands-posten.dk/seneste/,27.01.2023 07:17
Djokovics far har vakt opsigt med Putin-støtte i Australien,26.01.2023 00:00,,https://jyllands-posten.dk/sport/tennis/ECE14899550/djokovics-far-har-vakt-opsigt-med-putinstoette-i-australien/,,,"FÃ¥ de seneste nyheder fra ind- og udland om samfund, erhverv, sport og kultur. ",Jyllandsposten,https://jyllands-posten.dk/seneste/,27.01.2023 07:17
Hollandsk stjerne forlader Odense til sommer,26.01.2023 00:00,,https://jyllands-posten.dk/sport/handbold/ECE14897021/hollandsk-stjerne-forlader-odense-til-sommer/,,,"FÃ¥ de seneste nyheder fra ind- og udland om samfund, erhverv, sport og kultur. ",Jyllandsposten,https://jyllands-posten.dk/seneste/,27.01.2023 07:17
Streaming overhaler flow-tv for første gang nogensinde,26.01.2023 00:00,,https://jyllands-posten.dk/kultur/film/ECE14899719/streaming-overhaler-flowtv-for-foerste-gang-nogensinde/,,,"FÃ¥ de seneste nyheder fra ind- og udland om samfund, erhverv, sport og kultur. ",Jyllandsposten,https://jyllands-posten.dk/seneste/,27.01.2023 07:17
Danmark tilbudt hastelevering af Caesar-kanoner,26.01.2023 00:00,,https://jyllands-posten.dk/politik/ECE14899720/danmark-tilbudt-hastelevering-af-caesarkanoner/,,,"FÃ¥ de seneste nyheder fra ind- og udland om samfund, erhverv, sport og kultur. ",Jyllandsposten,https://jyllands-posten.dk/seneste/,27.01.2023 07:17
Minister vil undersøge om det skal være ulovligt at fjerne kondom uden samtykke,26.01.2023 00:00,,https://jyllands-posten.dk/politik/ECE14899296/minister-vil-undersoege-om-det-skal-vaere-ulovligt-at-fjerne-kondom-uden-samtykke/,,,"FÃ¥ de seneste nyheder fra ind- og udland om samfund, erhverv, sport og kultur. ",Jyllandsposten,https://jyllands-posten.dk/seneste/,27.01.2023 07:17
Få episoder beskriver ham bedre: Under beskidte trøjer gemte Mourinho sig i en vasketøjskurv og »var ved at dø«,26.01.2023 00:00,,https://jyllands-posten.dk/sport/fodbold/ECE14747220/den-dag-jose-mourinho-gemte-sig-i-en-vasketoejskurv-og-var-ved-at-doe/,,,"FÃ¥ de seneste nyheder fra ind- og udland om samfund, erhverv, sport og kultur. ",Jyllandsposten,https://jyllands-posten.dk/seneste/,27.01.2023 07:17
Topchef vil ændre Tryg: Der skal skrues op for disse forsikringer,26.01.2023 00:00,,https://jyllands-posten.dk/jperhverv/ECE14894657/topchefen-vil-aendre-tryg-efter-svensk-forbillede-flere-boern-gravide-og-kaeledyr-skal-forsikres/,,,"FÃ¥ de seneste nyheder fra ind- og udland om samfund, erhverv, sport og kultur. ",Jyllandsposten,https://jyllands-posten.dk/seneste/,27.01.2023 07:17
Russisk offensiv har dræbt 11 efter ja til kampvogne til Ukraine,26.01.2023 00:00,,https://jyllands-posten.dk/international/europa/ECE14897992/russisk-offensiv-har-draebt-11-efter-ja-til-kampvogne-til-ukraine/,,,"FÃ¥ de seneste nyheder fra ind- og udland om samfund, erhverv, sport og kultur. ",Jyllandsposten,https://jyllands-posten.dk/seneste/,27.01.2023 07:17
Skal kvinder have værnepligt? Nu svarer det største regeringsparti,26.01.2023 00:00,,https://jyllands-posten.dk/politik/ECE14897611/ellemann-vil-have-vaernepligt-men-socialdemokratiet-toever/,,,"FÃ¥ de seneste nyheder fra ind- og udland om samfund, erhverv, sport og kultur. ",Jyllandsposten,https://jyllands-posten.dk/seneste/,27.01.2023 07:17
Amerikanske kampvogne lander i Polen til foråret,26.01.2023 00:00,,https://jyllands-posten.dk/international/europa/ECE14897133/amerikanske-kampvogne-lander-i-polen-til-foraaret/,,,"FÃ¥ de seneste nyheder fra ind- og udland om samfund, erhverv, sport og kultur. ",Jyllandsposten,https://jyllands-posten.dk/seneste/,27.01.2023 07:17
Derfor har TV 2 Play svært ved at forhindre brugerne i at dele passwords,26.01.2023 00:00,,https://jyllands-posten.dk/kultur/ECE14889263/tv-2-mangler-folk-til-at-stoppe-misbrug-af-koder/,,,"FÃ¥ de seneste nyheder fra ind- og udland om samfund, erhverv, sport og kultur. ",Jyllandsposten,https://jyllands-posten.dk/seneste/,27.01.2023 07:17
»Skrækkelige tal«: Landets butikker er sendt ud i et markant fald,26.01.2023 00:00,,https://jyllands-posten.dk/jperhverv/ECE14895802/landets-butikker-er-sendt-ud-i-et-markant-fald/,,,"FÃ¥ de seneste nyheder fra ind- og udland om samfund, erhverv, sport og kultur. ",Jyllandsposten,https://jyllands-posten.dk/seneste/,27.01.2023 07:17
Mor mistænkt for at dræbe sine børn: Politiet forventer at kunne fastslå dødsårsag i den kommende uge,26.01.2023 00:00,,https://jyllands-posten.dk/indland/ECE14895727/mor-mistaenkt-for-at-draebe-sine-boern-politiet-forventer-at-kunne-fastslaa-doedsaarsag-i-den-kommende-uge/,,,"FÃ¥ de seneste nyheder fra ind- og udland om samfund, erhverv, sport og kultur. ",Jyllandsposten,https://jyllands-posten.dk/seneste/,27.01.2023 07:17
