title,published,text,link,og:site_name,og:url,site_description,name,url,scrape_time
Briterne har taget dansk orkannavn til sig,17.02.2023 05:15,,https://jyllands-posten.dk/dagensoverblik/ECE15072326/nyhedsoverblik/,Jyllands-Posten,https://jyllands-posten.dk/seneste/,"Få de seneste nyheder fra ind- og udland om samfund, erhverv, sport og kultur. ",Jyllandsposten,https://jyllands-posten.dk/seneste/,17.02.2023 07:18
"Kvinder fik lussinger, knytnæveslag og blev voldtaget: Gerningsmandens afsoning i åbent fængsel vækker vrede",17.02.2023 05:00,,https://jyllands-posten.dk/indland/ECE14956860/flere-politikere-vil-aendre-regler-efter-voldtaegtsforbryderes-flugt-fra-aabent-faengsel/,Jyllands-Posten,https://jyllands-posten.dk/seneste/,"Få de seneste nyheder fra ind- og udland om samfund, erhverv, sport og kultur. ",Jyllandsposten,https://jyllands-posten.dk/seneste/,17.02.2023 07:18
Sen udligning frarøvede FCM sensationel sejr i Portugal,16.02.2023 00:00,,https://jyllands-posten.dk/import/importjp/ritzau/ECE15073471/sen-udligning-fraroevede-fcm-sensationel-sejr-i-portugal/,Jyllands-Posten,https://jyllands-posten.dk/seneste/,"Få de seneste nyheder fra ind- og udland om samfund, erhverv, sport og kultur. ",Jyllandsposten,https://jyllands-posten.dk/seneste/,17.02.2023 07:18
Ten Hag efter 2-2 på Camp Nou: Vi dikterede kampen,16.02.2023 00:00,,https://jyllands-posten.dk/sport/fodbold/ECE15072976/ten-hag-efter-22-paa-camp-nou-vi-dikterede-kampen/,Jyllands-Posten,https://jyllands-posten.dk/seneste/,"Få de seneste nyheder fra ind- og udland om samfund, erhverv, sport og kultur. ",Jyllandsposten,https://jyllands-posten.dk/seneste/,17.02.2023 07:18
Frustreret Holger Rune trækker sig med skade i Rotterdam,16.02.2023 00:00,,https://jyllands-posten.dk/sport/tennis/ECE15073451/frustreret-holger-rune-traekker-sig-med-skade-i-rotterdam/,Jyllands-Posten,https://jyllands-posten.dk/seneste/,"Få de seneste nyheder fra ind- og udland om samfund, erhverv, sport og kultur. ",Jyllandsposten,https://jyllands-posten.dk/seneste/,17.02.2023 07:18
Biden: Nedskudte luftobjekter næppe brugt til spionage,16.02.2023 00:00,,https://jyllands-posten.dk/international/usa/ECE15071172/biden-nedskudte-luftobjekter-naeppe-brugt-til-spionage/,Jyllands-Posten,https://jyllands-posten.dk/seneste/,"Få de seneste nyheder fra ind- og udland om samfund, erhverv, sport og kultur. ",Jyllandsposten,https://jyllands-posten.dk/seneste/,17.02.2023 07:18
Åh nej: Sporting udlignede fire minutter inde i overtiden,16.02.2023 00:00,,https://jyllands-posten.dk/sport/fodbold/ECE15065765/genlaes-liveblog-fc-midtjylland-blev-snydt-for-sejren-i-portugal-i-overtiden/,Jyllands-Posten,https://jyllands-posten.dk/seneste/,"Få de seneste nyheder fra ind- og udland om samfund, erhverv, sport og kultur. ",Jyllandsposten,https://jyllands-posten.dk/seneste/,17.02.2023 07:18
Matchvinder Stryger blev slået til blods i europæisk triumf,16.02.2023 00:00,,https://jyllands-posten.dk/sport/fodbold/ECE15071020/matchvinder-stryger-blev-slaaet-til-blods-i-europaeisk-triumf/,Jyllands-Posten,https://jyllands-posten.dk/seneste/,"Få de seneste nyheder fra ind- og udland om samfund, erhverv, sport og kultur. ",Jyllandsposten,https://jyllands-posten.dk/seneste/,17.02.2023 07:18
Barcelona og United spillede lige op i underholdende gigantmøde,16.02.2023 00:00,,https://jyllands-posten.dk/sport/fodbold/ECE15071054/barcelona-og-united-deler-i-underholdende-gigantmoede/,Jyllands-Posten,https://jyllands-posten.dk/seneste/,"Få de seneste nyheder fra ind- og udland om samfund, erhverv, sport og kultur. ",Jyllandsposten,https://jyllands-posten.dk/seneste/,17.02.2023 07:18
Skønheden i det brutale Fotografen Nan Goldin er kendt for at overskride grænser i sine værker. Som aktivist er hun mindst lige så kompromisløs,16.02.2023 00:00,,https://jyllands-posten.dk/kultur/film/ECE15015702/all-the-beauty-and-the-bloodshed-fortaeller-baade-historien-om-nan-goldins-liv-og-om-hendes-korstog-mod-sacklerfamilien/,Jyllands-Posten,https://jyllands-posten.dk/seneste/,"Få de seneste nyheder fra ind- og udland om samfund, erhverv, sport og kultur. ",Jyllandsposten,https://jyllands-posten.dk/seneste/,17.02.2023 07:18
Dronningen mødte Putin i 2014: Har aldrig set så kolde øjne,16.02.2023 00:00,,https://jyllands-posten.dk/indland/ECE15069911/dronningen-moedte-putin-i-2014-har-aldrig-set-saa-kolde-oejne/,Jyllands-Posten,https://jyllands-posten.dk/seneste/,"Få de seneste nyheder fra ind- og udland om samfund, erhverv, sport og kultur. ",Jyllandsposten,https://jyllands-posten.dk/seneste/,17.02.2023 07:18
"I Japan bukker man, i Brasilien tungekysser man, i USA taler man om Gud",16.02.2023 00:00,,https://jyllands-posten.dk/kultur/ECE14856459/i-japan-bukker-man-i-brasilien-tungekysser-man-etnolog-ville-hellere-se-disse-programmer-end-laese-en-guidebog/,Jyllands-Posten,https://jyllands-posten.dk/seneste/,"Få de seneste nyheder fra ind- og udland om samfund, erhverv, sport og kultur. ",Jyllandsposten,https://jyllands-posten.dk/seneste/,17.02.2023 07:18
Kommer store bededag tilbage i 2027? Nu forsøger partier at presse regeringen med en ny manøvre,16.02.2023 00:00,,https://jyllands-posten.dk/politik/ECE15062674/partier-lancerer-ny-manoevre-i-kampen-om-store-bededag/,Jyllands-Posten,https://jyllands-posten.dk/seneste/,"Få de seneste nyheder fra ind- og udland om samfund, erhverv, sport og kultur. ",Jyllandsposten,https://jyllands-posten.dk/seneste/,17.02.2023 07:18
JP ved fronten i Ukraine: 16 minutter og otte granater – så lå »det russiske kød spredt« et sted ved fronten i Donbas,16.02.2023 00:00,,https://jyllands-posten.dk/international/ECE15035249/16-minutter-og-otte-granater-saa-laa-det-russiske-koed-spredt-et-sted-ved-fronten-i-donbas/,Jyllands-Posten,https://jyllands-posten.dk/seneste/,"Få de seneste nyheder fra ind- og udland om samfund, erhverv, sport og kultur. ",Jyllandsposten,https://jyllands-posten.dk/seneste/,17.02.2023 07:18
"Ligegyldig romantik ""Kærlighed på hjernen"" hittede på Tiktok. Det gør den ikke i bogform",16.02.2023 00:00,,https://jyllands-posten.dk/kultur/litteratur/ECE15044794/sex-og-videnskab-i-uskoen-forening-i-kaerlighed-paa-hjernen/,Jyllands-Posten,https://jyllands-posten.dk/seneste/,"Få de seneste nyheder fra ind- og udland om samfund, erhverv, sport og kultur. ",Jyllandsposten,https://jyllands-posten.dk/seneste/,17.02.2023 07:18
Storjury har afvist Trumps påstande om valgfusk i Georgia i 2020,16.02.2023 00:00,,https://jyllands-posten.dk/international/usa/ECE15067629/storjury-har-afvist-trumps-paastande-om-valgfusk-i-georgia-i-2020/,Jyllands-Posten,https://jyllands-posten.dk/seneste/,"Få de seneste nyheder fra ind- og udland om samfund, erhverv, sport og kultur. ",Jyllandsposten,https://jyllands-posten.dk/seneste/,17.02.2023 07:18
Magnus Cort spurtede sig til sejr på bjergetape,16.02.2023 00:00,,https://jyllands-posten.dk/sport/cykling/ECE15066671/magnus-cort-spurtede-sig-til-sejr-paa-bjergetape/,Jyllands-Posten,https://jyllands-posten.dk/seneste/,"Få de seneste nyheder fra ind- og udland om samfund, erhverv, sport og kultur. ",Jyllandsposten,https://jyllands-posten.dk/seneste/,17.02.2023 07:18
Hæmmet Tauson vandt sejtrækker i Tyskland,16.02.2023 00:00,,https://jyllands-posten.dk/sport/tennis/ECE15066449/haemmet-tauson-vandt-sejtraekker-i-tyskland/,Jyllands-Posten,https://jyllands-posten.dk/seneste/,"Få de seneste nyheder fra ind- og udland om samfund, erhverv, sport og kultur. ",Jyllandsposten,https://jyllands-posten.dk/seneste/,17.02.2023 07:18
Storoffensiv kan løbe ud i mudderet: Er Rusland ved at begå den samme fejl for anden gang?,16.02.2023 00:00,,https://jyllands-posten.dk/international/ECE15061319/militaeranalytiker-mener-at-rusland-er-ved-at-begaa-samme-fejl-for-anden-gang/,Jyllands-Posten,https://jyllands-posten.dk/seneste/,"Få de seneste nyheder fra ind- og udland om samfund, erhverv, sport og kultur. ",Jyllandsposten,https://jyllands-posten.dk/seneste/,17.02.2023 07:18
Scholz besøger Biden i marts for at drøfte indsats i Ukraine,16.02.2023 00:00,,https://jyllands-posten.dk/international/ECE15065562/scholz-besoeger-biden-i-marts-for-at-droefte-indsats-i-ukraine/,Jyllands-Posten,https://jyllands-posten.dk/seneste/,"Få de seneste nyheder fra ind- og udland om samfund, erhverv, sport og kultur. ",Jyllandsposten,https://jyllands-posten.dk/seneste/,17.02.2023 07:18
De værste ødelæggelser i »en generation« har sat land i undtagelses-tilstand,16.02.2023 00:00,,https://jyllands-posten.dk/international/ECE15053731/ekstremt-vejr-har-sat-et-helt-land-i-undtagelsestilstand/,Jyllands-Posten,https://jyllands-posten.dk/seneste/,"Få de seneste nyheder fra ind- og udland om samfund, erhverv, sport og kultur. ",Jyllandsposten,https://jyllands-posten.dk/seneste/,17.02.2023 07:18
Ny spansk lov baner vej for betalte sygedage under menstruation,16.02.2023 00:00,,https://jyllands-posten.dk/international/europa/ECE15064177/ny-spansk-lov-baner-vej-for-betalte-sygedage-under-menstruation/,Jyllands-Posten,https://jyllands-posten.dk/seneste/,"Få de seneste nyheder fra ind- og udland om samfund, erhverv, sport og kultur. ",Jyllandsposten,https://jyllands-posten.dk/seneste/,17.02.2023 07:18
Pogacar forlængede perfekt sæsonstart med ny sejr,16.02.2023 00:00,,https://jyllands-posten.dk/sport/cykling/ECE15063995/pogacar-forlaengede-perfekt-saesonstart-med-ny-sejr/,Jyllands-Posten,https://jyllands-posten.dk/seneste/,"Få de seneste nyheder fra ind- og udland om samfund, erhverv, sport og kultur. ",Jyllandsposten,https://jyllands-posten.dk/seneste/,17.02.2023 07:18
Dansk badmintonhold gjorde rent bord i EM-gruppe,16.02.2023 00:00,,https://jyllands-posten.dk/sport/ECE15063729/dansk-badmintonhold-gjorde-rent-bord-i-emgruppe/,Jyllands-Posten,https://jyllands-posten.dk/seneste/,"Få de seneste nyheder fra ind- og udland om samfund, erhverv, sport og kultur. ",Jyllandsposten,https://jyllands-posten.dk/seneste/,17.02.2023 07:18
"Troels Lund Poulsen gik i forsvar, allerede inden kritikken var afsendt, men bredsiden udeblev",16.02.2023 00:00,,https://jyllands-posten.dk/politik/ECE15057755/oppositionen-stoetter-ministerens-melding-om-udsaettelse-af-forsvarsforhandlinger/,Jyllands-Posten,https://jyllands-posten.dk/seneste/,"Få de seneste nyheder fra ind- og udland om samfund, erhverv, sport og kultur. ",Jyllandsposten,https://jyllands-posten.dk/seneste/,17.02.2023 07:18
DMI advarer om »farligt vejr«: Her rammer stormen Otto,16.02.2023 00:00,,https://jyllands-posten.dk/indland/ECE15060897/beredskabsstyrelsen-oeger-beredskabet-i-to-byer-som-forberedelse-paa-stormen-otto/,Jyllands-Posten,https://jyllands-posten.dk/seneste/,"Få de seneste nyheder fra ind- og udland om samfund, erhverv, sport og kultur. ",Jyllandsposten,https://jyllands-posten.dk/seneste/,17.02.2023 07:18
Ny næstformand i Nye Borgerlige undskylder kommentarer på Facebook,16.02.2023 00:00,,https://jyllands-posten.dk/politik/ECE15063484/ny-naestformand-i-nye-borgerlige-undskylder-kommentarer-paa-facebook/,Jyllands-Posten,https://jyllands-posten.dk/seneste/,"Få de seneste nyheder fra ind- og udland om samfund, erhverv, sport og kultur. ",Jyllandsposten,https://jyllands-posten.dk/seneste/,17.02.2023 07:18
Shiffrin sikrede sig syvende VM-guld med sejr i storslalom,16.02.2023 00:00,,https://jyllands-posten.dk/import/importjp/ritzau/ECE15063090/shiffrin-sikrede-sig-syvende-vmguld-med-sejr-i-storslalom/,Jyllands-Posten,https://jyllands-posten.dk/seneste/,"Få de seneste nyheder fra ind- og udland om samfund, erhverv, sport og kultur. ",Jyllandsposten,https://jyllands-posten.dk/seneste/,17.02.2023 07:18
FCM må se bort fra angribere i EL-kamp mod Sporting,16.02.2023 00:00,,https://jyllands-posten.dk/sport/fodbold/ECE15062782/fcm-maa-se-bort-fra-angribere-i-elkamp-mod-sporting/,Jyllands-Posten,https://jyllands-posten.dk/seneste/,"Få de seneste nyheder fra ind- og udland om samfund, erhverv, sport og kultur. ",Jyllandsposten,https://jyllands-posten.dk/seneste/,17.02.2023 07:18
DBU har tiltag på vej efter fangrupperings farvel,16.02.2023 00:00,,https://jyllands-posten.dk/sport/fodbold/ECE15062464/dbu-har-tiltag-paa-vej-efter-fangrupperings-farvel/,Jyllands-Posten,https://jyllands-posten.dk/seneste/,"Få de seneste nyheder fra ind- og udland om samfund, erhverv, sport og kultur. ",Jyllandsposten,https://jyllands-posten.dk/seneste/,17.02.2023 07:18
Norge vil sende 51 milliarder kroner fra olieindtægter til Ukraine,16.02.2023 00:00,,https://jyllands-posten.dk/international/ECE15061862/norge-vil-sende-51-milliarder-kroner-fra-olieindtaegter-til-ukraine/,Jyllands-Posten,https://jyllands-posten.dk/seneste/,"Få de seneste nyheder fra ind- og udland om samfund, erhverv, sport og kultur. ",Jyllandsposten,https://jyllands-posten.dk/seneste/,17.02.2023 07:18
Dommer har afvist at forhøje erstatning for 466 døgn bag tremmer,16.02.2023 00:00,,https://jyllands-posten.dk/indland/ECE15061483/dommer-har-afvist-at-forhoeje-erstatning-for-466-doegn-bag-tremmer/,Jyllands-Posten,https://jyllands-posten.dk/seneste/,"Få de seneste nyheder fra ind- og udland om samfund, erhverv, sport og kultur. ",Jyllandsposten,https://jyllands-posten.dk/seneste/,17.02.2023 07:18
BMW i søgelyset efter tre danske bilbrande over kort tid,16.02.2023 00:00,,https://jyllands-posten.dk/biler/ECE15016549/bmw-i-soegelyset-efter-tre-bilbrande-over-kort-tid/,Jyllands-Posten,https://jyllands-posten.dk/seneste/,"Få de seneste nyheder fra ind- og udland om samfund, erhverv, sport og kultur. ",Jyllandsposten,https://jyllands-posten.dk/seneste/,17.02.2023 07:18
Paul Rudd tilbage som Ant-man Desværre bliver det ikke alle gode gange tre,16.02.2023 00:00,,https://jyllands-posten.dk/kultur/film/ECE15024637/paul-rudd-er-tilbage-som-antman/,Jyllands-Posten,https://jyllands-posten.dk/seneste/,"Få de seneste nyheder fra ind- og udland om samfund, erhverv, sport og kultur. ",Jyllandsposten,https://jyllands-posten.dk/seneste/,17.02.2023 07:18
Det er blevet sværere at få overblik over corona: Men ny metode til at overvåge danskernes sygdom er på vej,16.02.2023 00:00,,https://jyllands-posten.dk/indland/ECE15055609/i-januar-tabte-baade-covid-og-influenza-pusten-men-begge-er-nu-i-fremmarch/,Jyllands-Posten,https://jyllands-posten.dk/seneste/,"Få de seneste nyheder fra ind- og udland om samfund, erhverv, sport og kultur. ",Jyllandsposten,https://jyllands-posten.dk/seneste/,17.02.2023 07:18
Hvideruslands Lukasjenko: Vi går ikke ind i krigen mod Ukraine,16.02.2023 00:00,,https://jyllands-posten.dk/international/ECE15057867/hvideruslands-lukasjenko-vi-gaar-ikke-ind-i-krigen-mod-ukraine/,Jyllands-Posten,https://jyllands-posten.dk/seneste/,"Få de seneste nyheder fra ind- og udland om samfund, erhverv, sport og kultur. ",Jyllandsposten,https://jyllands-posten.dk/seneste/,17.02.2023 07:18
Justice for Carl Bloch,16.02.2023 00:00,,https://jyllands-posten.dk/kultur/ECE15043160/halvnoegne-helte-en-faengslet-konge-flirtende-kvinder-og-en-meget-menneskelig-jesus-carl-bloch-taler-til-de-store-foelelser/,Jyllands-Posten,https://jyllands-posten.dk/seneste/,"Få de seneste nyheder fra ind- og udland om samfund, erhverv, sport og kultur. ",Jyllandsposten,https://jyllands-posten.dk/seneste/,17.02.2023 07:18
Spansk anklager undersøger Barcelona-betalinger til dommer,16.02.2023 00:00,,https://jyllands-posten.dk/sport/fodbold/ECE15059521/spansk-anklager-undersoeger-barcelonabetalinger-til-dommer/,Jyllands-Posten,https://jyllands-posten.dk/seneste/,"Få de seneste nyheder fra ind- og udland om samfund, erhverv, sport og kultur. ",Jyllandsposten,https://jyllands-posten.dk/seneste/,17.02.2023 07:18
Danmark mangler beredskab mod unges misbrug af vanedannende piller,16.02.2023 00:00,,https://jyllands-posten.dk/indland/ECE15059426/danmark-mangler-beredskab-mod-unges-misbrug-af-vanedannende-piller/,Jyllands-Posten,https://jyllands-posten.dk/seneste/,"Få de seneste nyheder fra ind- og udland om samfund, erhverv, sport og kultur. ",Jyllandsposten,https://jyllands-posten.dk/seneste/,17.02.2023 07:18
Regeringen uklar i mælet om hjælp til fattige indvandrerfamilier,16.02.2023 00:00,,https://jyllands-posten.dk/politik/ECE15058338/regeringen-uklar-i-maelet-om-hjaelp-til-fattige-indvandrerfamilier/,Jyllands-Posten,https://jyllands-posten.dk/seneste/,"Få de seneste nyheder fra ind- og udland om samfund, erhverv, sport og kultur. ",Jyllandsposten,https://jyllands-posten.dk/seneste/,17.02.2023 07:18
Supermarkedskæder trækker stikket: Nu vil onlinekæmpe hamstre kunder,16.02.2023 00:00,,https://jyllands-posten.dk/jperhverv/ECE14954338/dagligvaremarkedet-under-pres-wolt-vil-vinde-hjemmelevering-til-danskerne/,Jyllands-Posten,https://jyllands-posten.dk/seneste/,"Få de seneste nyheder fra ind- og udland om samfund, erhverv, sport og kultur. ",Jyllandsposten,https://jyllands-posten.dk/seneste/,17.02.2023 07:18
Vil du spise mindre kage og slik? Her er konkrete fif fra en ekspert i ernæring,16.02.2023 00:00,,https://jyllands-posten.dk/indland/ECE14992213/majke-joergensen-raadgiver-om-kost-saadan-kan-du-spise-mindre-kage-og-slik/,Jyllands-Posten,https://jyllands-posten.dk/seneste/,"Få de seneste nyheder fra ind- og udland om samfund, erhverv, sport og kultur. ",Jyllandsposten,https://jyllands-posten.dk/seneste/,17.02.2023 07:18
Nato-chef retter hård kritik mod Rasmus Paludan under møde i Tyrkiet,16.02.2023 00:00,,https://jyllands-posten.dk/international/ECE15057230/tyrkiet-aabner-for-at-lukke-finland-ind-i-nato-foer-sverige/,Jyllands-Posten,https://jyllands-posten.dk/seneste/,"Få de seneste nyheder fra ind- og udland om samfund, erhverv, sport og kultur. ",Jyllandsposten,https://jyllands-posten.dk/seneste/,17.02.2023 07:18
"Bordet er ryddet, ingen opdagede krisen, så Randers FC fløj igen under radaren",16.02.2023 00:00,,https://jyllands-posten.dk/sport/fodbold/ECE15043337/bordet-er-ryddet-ingen-opdagede-krisen-saa-randers-fc-floej-igen-under-radaren/,Jyllands-Posten,https://jyllands-posten.dk/seneste/,"Få de seneste nyheder fra ind- og udland om samfund, erhverv, sport og kultur. ",Jyllandsposten,https://jyllands-posten.dk/seneste/,17.02.2023 07:18
USA: Egyptisk veteranekstremist er ny leder af al-Qaeda,16.02.2023 00:00,,https://jyllands-posten.dk/international/ECE15055602/usa-egyptisk-veteranekstremist-er-ny-leder-af-alqaeda/,Jyllands-Posten,https://jyllands-posten.dk/seneste/,"Få de seneste nyheder fra ind- og udland om samfund, erhverv, sport og kultur. ",Jyllandsposten,https://jyllands-posten.dk/seneste/,17.02.2023 07:18
Tilbage fra skade: Alcaraz tager første sejr i 2023,16.02.2023 00:00,,https://jyllands-posten.dk/sport/tennis/ECE15052528/tilbage-fra-skade-alcaraz-tager-foerste-sejr-i-2023/,Jyllands-Posten,https://jyllands-posten.dk/seneste/,"Få de seneste nyheder fra ind- og udland om samfund, erhverv, sport og kultur. ",Jyllandsposten,https://jyllands-posten.dk/seneste/,17.02.2023 07:18
Skovmanden skabte sig en omfattende erhvervskarriere,16.02.2023 00:00,,https://jyllands-posten.dk/indland/ECE14923308/skovmanden-skabte-sig-en-omfattende-erhvervskarriere/,Jyllands-Posten,https://jyllands-posten.dk/seneste/,"Få de seneste nyheder fra ind- og udland om samfund, erhverv, sport og kultur. ",Jyllandsposten,https://jyllands-posten.dk/seneste/,17.02.2023 07:18
FC Midtjylland møder storklub: For 22 år siden valgte klubben en usædvanlig måde at forberede sig på,16.02.2023 00:00,,https://jyllands-posten.dk/sport/fodbold/ECE14958272/denne-gang-faar-fc-midtjylland-ikke-sand-i-shortsene/,Jyllands-Posten,https://jyllands-posten.dk/seneste/,"Få de seneste nyheder fra ind- og udland om samfund, erhverv, sport og kultur. ",Jyllandsposten,https://jyllands-posten.dk/seneste/,17.02.2023 07:18
Halvt så mange vil være chef: »Bryd janteloven og spring ud i det«,16.02.2023 00:00,,https://jyllands-posten.dk/jperhverv/ECE14921679/faa-ansatte-herhjemme-droemmer-om-at-blive-ledere-danskerne-er-maaske-en-lille-smule-magelige/,Jyllands-Posten,https://jyllands-posten.dk/seneste/,"Få de seneste nyheder fra ind- og udland om samfund, erhverv, sport og kultur. ",Jyllandsposten,https://jyllands-posten.dk/seneste/,17.02.2023 07:18
Dæmoner i parcelhusidyllen: Svenske krimidebutanter og en nerveflossende amerikansk toer,16.02.2023 00:00,,https://jyllands-posten.dk/kultur/litteratur/ECE15011476/svenske-krimidebutanter-og-en-nerveflossende-amerikansk-toer/,Jyllands-Posten,https://jyllands-posten.dk/seneste/,"Få de seneste nyheder fra ind- og udland om samfund, erhverv, sport og kultur. ",Jyllandsposten,https://jyllands-posten.dk/seneste/,17.02.2023 07:18
DMI varsler farligt vejr: Stormen Otto nærmer sig,16.02.2023 00:00,,https://jyllands-posten.dk/indland/ECE15051077/dmi-varsler-storm-med-vindstoed-op-til-orkanstyrke/,Jyllands-Posten,https://jyllands-posten.dk/seneste/,"Få de seneste nyheder fra ind- og udland om samfund, erhverv, sport og kultur. ",Jyllandsposten,https://jyllands-posten.dk/seneste/,17.02.2023 07:18
Kvinde fundet dræbt i rækkehus i Østjylland,16.02.2023 00:00,,https://jyllands-posten.dk/indland/ECE15050476/politiet-har-fundet-draebt-kvinde-i-raekkehus-i-oestjylland/,Jyllands-Posten,https://jyllands-posten.dk/seneste/,"Få de seneste nyheder fra ind- og udland om samfund, erhverv, sport og kultur. ",Jyllandsposten,https://jyllands-posten.dk/seneste/,17.02.2023 07:18
"Kun en tåbe frygter ikke en tur i supermarkedet: »Tæl til 10, før du putter noget i kurven«",16.02.2023 00:00,,https://jyllands-posten.dk/kultur/ECE14912588/saadan-trigger-firmaer-dig-til-at-koebe-alt-det-usunde/,Jyllands-Posten,https://jyllands-posten.dk/seneste/,"Få de seneste nyheder fra ind- og udland om samfund, erhverv, sport og kultur. ",Jyllandsposten,https://jyllands-posten.dk/seneste/,17.02.2023 07:18
Han plejer formuen hos nogle af Danmarks mest velhavende familier,16.02.2023 00:00,,https://jyllands-posten.dk/jperhverv/ECE14736904/nielsulrik-mousten-har-det-fantastisk-jeg-arbejder-ikke-helt-saa-haardt-som-jeg-gjorde-i-gamle-dage/,Jyllands-Posten,https://jyllands-posten.dk/seneste/,"Få de seneste nyheder fra ind- og udland om samfund, erhverv, sport og kultur. ",Jyllandsposten,https://jyllands-posten.dk/seneste/,17.02.2023 07:18
"Hvem vil kunne afløse Ellemann? Den magtfulde, den populære, nordsjællænderen eller den mindst kantede?",16.02.2023 00:00,,https://jyllands-posten.dk/podcast/undergulvtaeppet/ECE15045777/hvem-er-venstres-plan-b-hvis-det-vaerste-sker/,Jyllands-Posten,https://jyllands-posten.dk/seneste/,"Få de seneste nyheder fra ind- og udland om samfund, erhverv, sport og kultur. ",Jyllandsposten,https://jyllands-posten.dk/seneste/,17.02.2023 07:18
Elefanter i krig: »Du har stjålet vores familiefirma«,16.02.2023 00:00,,https://jyllands-posten.dk/jperhverv/ECE14901668/elefanter-i-krig-du-har-stjaalet-vores-familiefirma/,Jyllands-Posten,https://jyllands-posten.dk/seneste/,"Få de seneste nyheder fra ind- og udland om samfund, erhverv, sport og kultur. ",Jyllandsposten,https://jyllands-posten.dk/seneste/,17.02.2023 07:18
Kvindelandsholdet tabte VM-testkamp i Frankrig knebent,16.02.2023 00:00,,https://jyllands-posten.dk/sport/fodbold/ECE15046126/kvindelandsholdet-tabte-vmtestkamp-i-frankrig-knebent/,Jyllands-Posten,https://jyllands-posten.dk/seneste/,"Få de seneste nyheder fra ind- og udland om samfund, erhverv, sport og kultur. ",Jyllandsposten,https://jyllands-posten.dk/seneste/,17.02.2023 07:18
Frustreret og skadet Holger Rune trak sig fra ATP-turnering i Holland,16.02.2023 00:00,,https://jyllands-posten.dk/dagensoverblik/ECE15045800/nyhedsoverblik/,Jyllands-Posten,https://jyllands-posten.dk/seneste/,"Få de seneste nyheder fra ind- og udland om samfund, erhverv, sport og kultur. ",Jyllandsposten,https://jyllands-posten.dk/seneste/,17.02.2023 07:18
Minister-vikar kommer med en uventet melding om forsvarsmilliarder,16.02.2023 00:00,,https://jyllands-posten.dk/indland/ECE15008361/foer-mente-venstre-at-det-hastede-nu-udskyder-forsvarsministeren-forhandlinger-om-forsvarsforlig/,Jyllands-Posten,https://jyllands-posten.dk/seneste/,"Få de seneste nyheder fra ind- og udland om samfund, erhverv, sport og kultur. ",Jyllandsposten,https://jyllands-posten.dk/seneste/,17.02.2023 07:18
Dortmund besejrede Chelsea,15.02.2023 00:00,,https://jyllands-posten.dk/sport/fodbold/ECE15045810/dortmund-besejrede-chelsea/,Jyllands-Posten,https://jyllands-posten.dk/seneste/,"Få de seneste nyheder fra ind- og udland om samfund, erhverv, sport og kultur. ",Jyllandsposten,https://jyllands-posten.dk/seneste/,17.02.2023 07:18
Real Madrid bankede bundprop og haler ind på Barcelona,15.02.2023 00:00,,https://jyllands-posten.dk/sport/fodbold/ECE15045811/real-madrid-bankede-bundprop-og-haler-ind-paa-barcelona/,Jyllands-Posten,https://jyllands-posten.dk/seneste/,"Få de seneste nyheder fra ind- og udland om samfund, erhverv, sport og kultur. ",Jyllandsposten,https://jyllands-posten.dk/seneste/,17.02.2023 07:18
700 passagerfly bliver på jorden under strejke i München fredag,15.02.2023 00:00,,https://jyllands-posten.dk/international/europa/ECE15045807/700-passagerfly-bliver-paa-jorden-under-strejke-i-munchen-fredag/,Jyllands-Posten,https://jyllands-posten.dk/seneste/,"Få de seneste nyheder fra ind- og udland om samfund, erhverv, sport og kultur. ",Jyllandsposten,https://jyllands-posten.dk/seneste/,17.02.2023 07:18
Sejr i topbrag: City har indhentet Arsenal,15.02.2023 00:00,,https://jyllands-posten.dk/sport/fodbold/ECE15045802/sejr-i-topbrag-city-har-indhentet-arsenal/,Jyllands-Posten,https://jyllands-posten.dk/seneste/,"Få de seneste nyheder fra ind- og udland om samfund, erhverv, sport og kultur. ",Jyllandsposten,https://jyllands-posten.dk/seneste/,17.02.2023 07:18
