title,published,text,link,og:site_name,og:url,site_description,name,url,scrape_time
Den røde konge af Aalborg takker af,01.04.2023 00:00,,https://politiken.dk/indland/art9284497/Den-r%C3%B8de-konge-af-Aalborg-takker-af,Politiken,https://politiken.dk/nyheder/,"Hold dig opdateret pÃ¥ de seneste nyheder pÃ¥ politiken.dk: Seneste Politiken, Seneste Danmark, Seneste Kultur og Seneste Internationalt. ",Politiken,https://politiken.dk/nyheder/,31.03.2023 07:16
»Grotesk« og »forkasteligt«:Â Cheminova sælger forbudt nervegift til Pakistan og Libanon,01.04.2023 00:00,,https://politiken.dk/indland/art9276112/%C2%BBGrotesk%C2%AB-og-%C2%BBforkasteligt%C2%AB-Cheminova-s%C3%A6lger-forbudt-nervegift-til-Pakistan-og-Libanon,Politiken,https://politiken.dk/nyheder/,"Hold dig opdateret pÃ¥ de seneste nyheder pÃ¥ politiken.dk: Seneste Politiken, Seneste Danmark, Seneste Kultur og Seneste Internationalt. ",Politiken,https://politiken.dk/nyheder/,31.03.2023 07:16
Forsvarer kalder Fields-sag uhyre tragisk for alle,01.04.2023 00:00,,https://politiken.dk/indland/art9286846/Forsvarer-kalder-Fields-sag-uhyre-tragisk-for-alle,Politiken,https://politiken.dk/nyheder/,"Hold dig opdateret pÃ¥ de seneste nyheder pÃ¥ politiken.dk: Seneste Politiken, Seneste Danmark, Seneste Kultur og Seneste Internationalt. ",Politiken,https://politiken.dk/nyheder/,31.03.2023 07:16
Politi beslaglægger værdier for 11 millioner i stor hashsag,01.04.2023 00:00,,https://politiken.dk/indland/art9286776/Politi-beslagl%C3%A6gger-v%C3%A6rdier-for-11-millioner-i-stor-hashsag,Politiken,https://politiken.dk/nyheder/,"Hold dig opdateret pÃ¥ de seneste nyheder pÃ¥ politiken.dk: Seneste Politiken, Seneste Danmark, Seneste Kultur og Seneste Internationalt. ",Politiken,https://politiken.dk/nyheder/,31.03.2023 07:16
Læge og forfatter blæser til frihedskamp: »Ingen forældre har en jordisk chance for at modstå presset fra techgiganterne«,01.04.2023 00:00,,https://politiken.dk/indland/art9282678/%C2%BBIngen-for%C3%A6ldre-har-en-jordisk-chance-for-at-modst%C3%A5-presset-fra-techgiganterne%C2%AB,Politiken,https://politiken.dk/nyheder/,"Hold dig opdateret pÃ¥ de seneste nyheder pÃ¥ politiken.dk: Seneste Politiken, Seneste Danmark, Seneste Kultur og Seneste Internationalt. ",Politiken,https://politiken.dk/nyheder/,31.03.2023 07:16
52-årig mand er sigtet for voldtægt og tvang over Snapchat,01.04.2023 00:00,,https://politiken.dk/indland/art9286420/52-%C3%A5rig-mand-er-sigtet-for-voldt%C3%A6gt-og-tvang-over-Snapchat,Politiken,https://politiken.dk/nyheder/,"Hold dig opdateret pÃ¥ de seneste nyheder pÃ¥ politiken.dk: Seneste Politiken, Seneste Danmark, Seneste Kultur og Seneste Internationalt. ",Politiken,https://politiken.dk/nyheder/,31.03.2023 07:16
Se grafen: Så mange af Arne-pension-modtagerne er nedslidte,01.04.2023 00:00,,https://politiken.dk/indland/art9284640/Se-grafen-S%C3%A5-mange-af-Arne-pension-modtagerne-er-nedslidte,Politiken,https://politiken.dk/nyheder/,"Hold dig opdateret pÃ¥ de seneste nyheder pÃ¥ politiken.dk: Seneste Politiken, Seneste Danmark, Seneste Kultur og Seneste Internationalt. ",Politiken,https://politiken.dk/nyheder/,31.03.2023 07:16
Formand for indfødsretsudvalg får kritik for at røbe fortrolig oplysning om kommende dansker,01.04.2023 00:00,,https://politiken.dk/indland/art9275576/Formand-for-indf%C3%B8dsretsudvalg-f%C3%A5r-kritik-for-at-r%C3%B8be-fortrolig-oplysning-om-kommende-dansker,Politiken,https://politiken.dk/nyheder/,"Hold dig opdateret pÃ¥ de seneste nyheder pÃ¥ politiken.dk: Seneste Politiken, Seneste Danmark, Seneste Kultur og Seneste Internationalt. ",Politiken,https://politiken.dk/nyheder/,31.03.2023 07:16
Energistyrelsen: Objekt bjærget ved Nord Stream 2,01.04.2023 00:00,,https://politiken.dk/indland/art9286161/Objekt-bj%C3%A6rget-ved-Nord-Stream-2,Politiken,https://politiken.dk/nyheder/,"Hold dig opdateret pÃ¥ de seneste nyheder pÃ¥ politiken.dk: Seneste Politiken, Seneste Danmark, Seneste Kultur og Seneste Internationalt. ",Politiken,https://politiken.dk/nyheder/,31.03.2023 07:16
Mand tiltalt for tre drab og drabsforsøg i Fields,01.04.2023 00:00,,https://politiken.dk/indland/art9285805/Mand-tiltalt-for-tre-drab-og-drabsfors%C3%B8g-i-Fields,Politiken,https://politiken.dk/nyheder/,"Hold dig opdateret pÃ¥ de seneste nyheder pÃ¥ politiken.dk: Seneste Politiken, Seneste Danmark, Seneste Kultur og Seneste Internationalt. ",Politiken,https://politiken.dk/nyheder/,31.03.2023 07:16
Højesteret: Frihedsberøvet udlænding skal løslades,01.04.2023 00:00,,https://politiken.dk/indland/art9285778/Frihedsber%C3%B8vet-udl%C3%A6nding-skal-l%C3%B8slades,Politiken,https://politiken.dk/nyheder/,"Hold dig opdateret pÃ¥ de seneste nyheder pÃ¥ politiken.dk: Seneste Politiken, Seneste Danmark, Seneste Kultur og Seneste Internationalt. ",Politiken,https://politiken.dk/nyheder/,31.03.2023 07:16
Partier er usikre: Er der penge og vilje til at følge ideerne fra klimagruppe?,01.04.2023 00:00,,https://politiken.dk/indland/art9282637/Er-der-penge-og-vilje-til-at-f%C3%B8lge-ideerne-fra-klimagruppe,Politiken,https://politiken.dk/nyheder/,"Hold dig opdateret pÃ¥ de seneste nyheder pÃ¥ politiken.dk: Seneste Politiken, Seneste Danmark, Seneste Kultur og Seneste Internationalt. ",Politiken,https://politiken.dk/nyheder/,31.03.2023 07:16
Politiet: 17-årig varetægtsfængslet for at affyre skud fra maskinpistol mod villa,01.04.2023 00:00,,https://politiken.dk/indland/art9285664/17-%C3%A5rig-varet%C3%A6gtsf%C3%A6ngslet-for-at-affyre-skud-fra-maskinpistol-mod-villa,Politiken,https://politiken.dk/nyheder/,"Hold dig opdateret pÃ¥ de seneste nyheder pÃ¥ politiken.dk: Seneste Politiken, Seneste Danmark, Seneste Kultur og Seneste Internationalt. ",Politiken,https://politiken.dk/nyheder/,31.03.2023 07:16
"Uddannelsesminister slår nu fast: Det er ikke ultimativt for regeringen, at kandidatuddannelser skal forkortes",01.04.2023 00:00,,https://politiken.dk/indland/art9284898/Det-er-ikke-ultimativt-for-regeringen-at-kandidatuddannelser-skal-forkortes,Politiken,https://politiken.dk/nyheder/,"Hold dig opdateret pÃ¥ de seneste nyheder pÃ¥ politiken.dk: Seneste Politiken, Seneste Danmark, Seneste Kultur og Seneste Internationalt. ",Politiken,https://politiken.dk/nyheder/,31.03.2023 07:16
Eksperter: Statsministeriet fjernede selv kritik af Barbara Bertelsen i minksag,01.04.2023 00:00,,https://politiken.dk/indland/art9283845/Statsministeriet-fjernede-selv-kritik-af-Barbara-Bertelsen-i-minksag,Politiken,https://politiken.dk/nyheder/,"Hold dig opdateret pÃ¥ de seneste nyheder pÃ¥ politiken.dk: Seneste Politiken, Seneste Danmark, Seneste Kultur og Seneste Internationalt. ",Politiken,https://politiken.dk/nyheder/,31.03.2023 07:16
Liv som husmor og hustru i IS giver fire års fængsel,01.04.2023 00:00,,https://politiken.dk/indland/art9285006/Liv-som-husmor-og-hustru-i-IS-giver-fire-%C3%A5rs-f%C3%A6ngsel,Politiken,https://politiken.dk/nyheder/,"Hold dig opdateret pÃ¥ de seneste nyheder pÃ¥ politiken.dk: Seneste Politiken, Seneste Danmark, Seneste Kultur og Seneste Internationalt. ",Politiken,https://politiken.dk/nyheder/,31.03.2023 07:16
Otte partier indgår alliance i forsøget på at redde kandidatuddannelser fra at blive kortere,01.04.2023 00:00,,https://politiken.dk/indland/art9284267/Otte-partier-indg%C3%A5r-alliance-i-fors%C3%B8get-p%C3%A5-at-redde-kandidatuddannelser-fra-at-blive-kortere,Politiken,https://politiken.dk/nyheder/,"Hold dig opdateret pÃ¥ de seneste nyheder pÃ¥ politiken.dk: Seneste Politiken, Seneste Danmark, Seneste Kultur og Seneste Internationalt. ",Politiken,https://politiken.dk/nyheder/,31.03.2023 07:16
Regeringen fremsætter lovforslag om undersøgelseskommission i FE-sagen på mandag,01.04.2023 00:00,,https://politiken.dk/indland/art9284721/Regeringen-frems%C3%A6tter-lovforslag-om-unders%C3%B8gelseskommission-i-FE-sagen-p%C3%A5-mandag,Politiken,https://politiken.dk/nyheder/,"Hold dig opdateret pÃ¥ de seneste nyheder pÃ¥ politiken.dk: Seneste Politiken, Seneste Danmark, Seneste Kultur og Seneste Internationalt. ",Politiken,https://politiken.dk/nyheder/,31.03.2023 07:16
Voldsomme detaljer: Anklageskriftet mod manden tiltalt for drabet på Mia Skadhauge Stevn er offentliggjort,01.04.2023 00:00,,https://politiken.dk/indland/art9284294/Anklageskriftet-mod-manden-tiltalt-for-drabet-p%C3%A5-Mia-Skadhauge-Stevn-er-offentliggjort,Politiken,https://politiken.dk/nyheder/,"Hold dig opdateret pÃ¥ de seneste nyheder pÃ¥ politiken.dk: Seneste Politiken, Seneste Danmark, Seneste Kultur og Seneste Internationalt. ",Politiken,https://politiken.dk/nyheder/,31.03.2023 07:16
Christiania træffer det »modige valg« om almene boliger i fristaden,01.04.2023 00:00,,https://politiken.dk/indland/kobenhavn/art9253017/Christiania-tr%C3%A6ffer-det-%C2%BBmodige-valg%C2%AB-om-almene-boliger-i-fristaden,Politiken,https://politiken.dk/nyheder/,"Hold dig opdateret pÃ¥ de seneste nyheder pÃ¥ politiken.dk: Seneste Politiken, Seneste Danmark, Seneste Kultur og Seneste Internationalt. ",Politiken,https://politiken.dk/nyheder/,31.03.2023 07:16
Fire nye øjne skal finde nye veje til lynudfasning af gas og mere sol og vind på land,29.03.2023 00:00,,https://politiken.dk/indland/art9275725/Fire-nye-%C3%B8jne-skal-finde-nye-veje-til-lynudfasning-af-gas-og-mere-sol-og-vind-p%C3%A5-land,Politiken,https://politiken.dk/nyheder/,"Hold dig opdateret pÃ¥ de seneste nyheder pÃ¥ politiken.dk: Seneste Politiken, Seneste Danmark, Seneste Kultur og Seneste Internationalt. ",Politiken,https://politiken.dk/nyheder/,31.03.2023 07:16
Pædagoger ligger i bunden: Sådan er lønforskellene i det offentlige,29.03.2023 00:00,,https://politiken.dk/indland/art9277052/S%C3%A5dan-er-l%C3%B8nforskellene-i-det-offentlige,Politiken,https://politiken.dk/nyheder/,"Hold dig opdateret pÃ¥ de seneste nyheder pÃ¥ politiken.dk: Seneste Politiken, Seneste Danmark, Seneste Kultur og Seneste Internationalt. ",Politiken,https://politiken.dk/nyheder/,31.03.2023 07:16
Rapport: 4 ud af 10 på Arne-pension føler sig ikke nedslidte,29.03.2023 00:00,,https://politiken.dk/indland/art9284284/4-ud-af-10-p%C3%A5-Arne-pension-f%C3%B8ler-sig-ikke-nedslidte,Politiken,https://politiken.dk/nyheder/,"Hold dig opdateret pÃ¥ de seneste nyheder pÃ¥ politiken.dk: Seneste Politiken, Seneste Danmark, Seneste Kultur og Seneste Internationalt. ",Politiken,https://politiken.dk/nyheder/,31.03.2023 07:16
»Det giver ingen mening«: Eksperter stiller borgerforslag for at stoppe børns frie adgang til sociale medier,29.03.2023 00:00,,https://politiken.dk/indland/art9282016/Eksperter-stiller-borgerforslag-for-at-stoppe-b%C3%B8rns-frie-adgang-til-sociale-medier,Politiken,https://politiken.dk/nyheder/,"Hold dig opdateret pÃ¥ de seneste nyheder pÃ¥ politiken.dk: Seneste Politiken, Seneste Danmark, Seneste Kultur og Seneste Internationalt. ",Politiken,https://politiken.dk/nyheder/,31.03.2023 07:16
"Råd: Hver anden skole har ingen plan, hvis elever krænkes på nettet",29.03.2023 00:00,,https://politiken.dk/indland/uddannelse/art9284184/Hver-anden-skole-har-ingen-plan-hvis-elever-kr%C3%A6nkes-p%C3%A5-nettet,Politiken,https://politiken.dk/nyheder/,"Hold dig opdateret pÃ¥ de seneste nyheder pÃ¥ politiken.dk: Seneste Politiken, Seneste Danmark, Seneste Kultur og Seneste Internationalt. ",Politiken,https://politiken.dk/nyheder/,31.03.2023 07:16
Politiken søger syv journalistpraktikanter,29.03.2023 00:00,,https://politiken.dk/indland/uddannelse/art8166234/Politiken-s%C3%B8ger-syv-journalistpraktikanter,Politiken,https://politiken.dk/nyheder/,"Hold dig opdateret pÃ¥ de seneste nyheder pÃ¥ politiken.dk: Seneste Politiken, Seneste Danmark, Seneste Kultur og Seneste Internationalt. ",Politiken,https://politiken.dk/nyheder/,31.03.2023 07:16
Jeppe Kofod vil tilbage til Bruxelles,28.03.2023 00:00,,https://politiken.dk/indland/art9284142/Jeppe-Kofod-vil-tilbage-til-Bruxelles,Politiken,https://politiken.dk/nyheder/,"Hold dig opdateret pÃ¥ de seneste nyheder pÃ¥ politiken.dk: Seneste Politiken, Seneste Danmark, Seneste Kultur og Seneste Internationalt. ",Politiken,https://politiken.dk/nyheder/,31.03.2023 07:16
Tomme øldåser fundet i bilen: Mand sigtet for at være fuld under dødsulykke med høj fart,28.03.2023 00:00,,https://politiken.dk/indland/art9284141/Mand-sigtet-for-at-v%C3%A6re-fuld-under-d%C3%B8dsulykke-med-h%C3%B8j-fart,Politiken,https://politiken.dk/nyheder/,"Hold dig opdateret pÃ¥ de seneste nyheder pÃ¥ politiken.dk: Seneste Politiken, Seneste Danmark, Seneste Kultur og Seneste Internationalt. ",Politiken,https://politiken.dk/nyheder/,31.03.2023 07:16
TV 2 vækker realitystjerne til live med kunstig intelligens,01.03.2023 00:00,,https://politiken.dk/kultur/art9288176/TV-2-v%C3%A6kker-realitystjerne-til-live-med-kunstig-intelligens,Politiken,https://politiken.dk/nyheder/,"Hold dig opdateret pÃ¥ de seneste nyheder pÃ¥ politiken.dk: Seneste Politiken, Seneste Danmark, Seneste Kultur og Seneste Internationalt. ",Politiken,https://politiken.dk/nyheder/,31.03.2023 07:16
Han fik Lukas Graham til at lyde som en filosof og Ed Sheeran som en eksperimenterende tolvtonemusiker,02.03.2023 00:00,,https://politiken.dk/kultur/musik/art9283298/Han-fik-Lukas-Graham-til-at-lyde-som-en-filosof-og-Ed-Sheeran-som-en-eksperimenterende-tolvtonemusiker,Politiken,https://politiken.dk/nyheder/,"Hold dig opdateret pÃ¥ de seneste nyheder pÃ¥ politiken.dk: Seneste Politiken, Seneste Danmark, Seneste Kultur og Seneste Internationalt. ",Politiken,https://politiken.dk/nyheder/,31.03.2023 07:16
Ben Affleck er faldet over en sko og går i legendes fodspor,10.03.2023 00:00,,https://politiken.dk/kultur/film_og_tv/art9170568/Ben-Affleck-er-faldet-over-en-sko-og-g%C3%A5r-i-legendes-fodspor,Politiken,https://politiken.dk/nyheder/,"Hold dig opdateret pÃ¥ de seneste nyheder pÃ¥ politiken.dk: Seneste Politiken, Seneste Danmark, Seneste Kultur og Seneste Internationalt. ",Politiken,https://politiken.dk/nyheder/,31.03.2023 07:16
Bayern nægter at levere berømt Picasso-maleri tilbage,12.03.2023 00:00,,https://politiken.dk/kultur/art9282070/Bayern-n%C3%A6gter-at-levere-ber%C3%B8mt-Picasso-maleri-tilbage,Politiken,https://politiken.dk/nyheder/,"Hold dig opdateret pÃ¥ de seneste nyheder pÃ¥ politiken.dk: Seneste Politiken, Seneste Danmark, Seneste Kultur og Seneste Internationalt. ",Politiken,https://politiken.dk/nyheder/,31.03.2023 07:16
"»Jeg har ventet på denne bog, som jeg engang ventede på en ny plade af David Bowie«",13.03.2023 00:00,,https://politiken.dk/kultur/boger/art9276360/%C2%BBJeg-har-ventet-p%C3%A5-denne-bog-som-jeg-engang-ventede-p%C3%A5-en-ny-plade-af-David-Bowie%C2%AB,Politiken,https://politiken.dk/nyheder/,"Hold dig opdateret pÃ¥ de seneste nyheder pÃ¥ politiken.dk: Seneste Politiken, Seneste Danmark, Seneste Kultur og Seneste Internationalt. ",Politiken,https://politiken.dk/nyheder/,31.03.2023 07:16
"En dag, hvor den medieliderlige kunstner ikke var omtalt i avisen, var en spildt dag",16.03.2023 00:00,,https://politiken.dk/kultur/kunst/art9263966/En-dag-hvor-den-medieliderlige-kunstner-ikke-var-omtalt-i-avisen-var-en-spildt-dag,Politiken,https://politiken.dk/nyheder/,"Hold dig opdateret pÃ¥ de seneste nyheder pÃ¥ politiken.dk: Seneste Politiken, Seneste Danmark, Seneste Kultur og Seneste Internationalt. ",Politiken,https://politiken.dk/nyheder/,31.03.2023 07:16
Huda Fahmy er en stolt hijabi,17.03.2023 00:00,,https://politiken.dk/kultur/boger/art9281981/Huda-Fahmy-er-en-stolt-hijabi,Politiken,https://politiken.dk/nyheder/,"Hold dig opdateret pÃ¥ de seneste nyheder pÃ¥ politiken.dk: Seneste Politiken, Seneste Danmark, Seneste Kultur og Seneste Internationalt. ",Politiken,https://politiken.dk/nyheder/,31.03.2023 07:16
"Titlen giver ikke megen mening, men det gør filmen til gengæld",18.03.2023 00:00,,https://politiken.dk/kultur/film_og_tv/art9244733/Titlen-giver-ikke-megen-mening-men-det-g%C3%B8r-filmen-til-geng%C3%A6ld,Politiken,https://politiken.dk/nyheder/,"Hold dig opdateret pÃ¥ de seneste nyheder pÃ¥ politiken.dk: Seneste Politiken, Seneste Danmark, Seneste Kultur og Seneste Internationalt. ",Politiken,https://politiken.dk/nyheder/,31.03.2023 07:16
Drama i toppen af kultureliten mangler erotik og dramatik,19.03.2023 00:00,,https://politiken.dk/kultur/film_og_tv/art9233055/Drama-i-toppen-af-kultureliten-mangler-erotik-og-dramatik,Politiken,https://politiken.dk/nyheder/,"Hold dig opdateret pÃ¥ de seneste nyheder pÃ¥ politiken.dk: Seneste Politiken, Seneste Danmark, Seneste Kultur og Seneste Internationalt. ",Politiken,https://politiken.dk/nyheder/,31.03.2023 07:16
Russisk efterretningstjeneste: Amerikansk journalist anholdt for mistanke om spionage,23.03.2023 00:00,,https://politiken.dk/kultur/art9287423/Amerikansk-journalist-anholdt-for-mistanke-om-spionage,Politiken,https://politiken.dk/nyheder/,"Hold dig opdateret pÃ¥ de seneste nyheder pÃ¥ politiken.dk: Seneste Politiken, Seneste Danmark, Seneste Kultur og Seneste Internationalt. ",Politiken,https://politiken.dk/nyheder/,31.03.2023 07:16
Musikredaktør: Roskilde Festival ryster for alvor de aflyste år af sig med overdådigt program,01.04.2023 00:00,,https://politiken.dk/kultur/musik/art9284788/Roskilde-Festival-ryster-for-alvor-de-aflyste-%C3%A5r-af-sig-med-overd%C3%A5digt-program,Politiken,https://politiken.dk/nyheder/,"Hold dig opdateret pÃ¥ de seneste nyheder pÃ¥ politiken.dk: Seneste Politiken, Seneste Danmark, Seneste Kultur og Seneste Internationalt. ",Politiken,https://politiken.dk/nyheder/,31.03.2023 07:16
Alle navne er offentliggjort: Dansk hitband åbner Orange Scene,01.04.2023 00:00,,https://politiken.dk/kultur/art9284786/Dansk-hitband-%C3%A5bner-Orange-Scene,Politiken,https://politiken.dk/nyheder/,"Hold dig opdateret pÃ¥ de seneste nyheder pÃ¥ politiken.dk: Seneste Politiken, Seneste Danmark, Seneste Kultur og Seneste Internationalt. ",Politiken,https://politiken.dk/nyheder/,31.03.2023 07:16
Tarantino: Manuskriptet til min allersidste film er færdigt,01.04.2023 00:00,,https://politiken.dk/kultur/film_og_tv/art9287119/Manuskriptet-til-min-allersidste-film-er-f%C3%A6rdigt,Politiken,https://politiken.dk/nyheder/,"Hold dig opdateret pÃ¥ de seneste nyheder pÃ¥ politiken.dk: Seneste Politiken, Seneste Danmark, Seneste Kultur og Seneste Internationalt. ",Politiken,https://politiken.dk/nyheder/,31.03.2023 07:16
Fjumset-elskelig førsteelsker er endt som hofnar i fantasyfilm,01.04.2023 00:00,,https://politiken.dk/kultur/film_og_tv/art9244741/Fjumset-elskelig-f%C3%B8rsteelsker-er-endt-som-hofnar-i-fantasyfilm,Politiken,https://politiken.dk/nyheder/,"Hold dig opdateret pÃ¥ de seneste nyheder pÃ¥ politiken.dk: Seneste Politiken, Seneste Danmark, Seneste Kultur og Seneste Internationalt. ",Politiken,https://politiken.dk/nyheder/,31.03.2023 07:16
Podcast vil fortælle hemmeligheder fra omklædningsrummet. Men det ender helt galt,01.04.2023 00:00,,https://politiken.dk/kultur/set_og_hoert/art9187923/Podcast-vil-fort%C3%A6lle-hemmeligheder-fra-omkl%C3%A6dningsrummet.-Men-det-ender-helt-galt,Politiken,https://politiken.dk/nyheder/,"Hold dig opdateret pÃ¥ de seneste nyheder pÃ¥ politiken.dk: Seneste Politiken, Seneste Danmark, Seneste Kultur og Seneste Internationalt. ",Politiken,https://politiken.dk/nyheder/,31.03.2023 07:16
"Nej, du vil ikke giftes med farmand",01.04.2023 00:00,,https://politiken.dk/kultur/film_og_tv/art9233057/Nej-du-vil-ikke-giftes-med-farmand,Politiken,https://politiken.dk/nyheder/,"Hold dig opdateret pÃ¥ de seneste nyheder pÃ¥ politiken.dk: Seneste Politiken, Seneste Danmark, Seneste Kultur og Seneste Internationalt. ",Politiken,https://politiken.dk/nyheder/,31.03.2023 07:16
"Middelklassebarnet følte sig udenfor i Holte og Hellerup: »Klasse er noget, der gennemsyrer alt«",01.04.2023 00:00,,https://politiken.dk/kultur/art9256280/Middelklassebarnet-f%C3%B8lte-sig-udenfor-i-Holte-og-Hellerup-%C2%BBKlasse-er-noget-der-gennemsyrer-alt%C2%AB,Politiken,https://politiken.dk/nyheder/,"Hold dig opdateret pÃ¥ de seneste nyheder pÃ¥ politiken.dk: Seneste Politiken, Seneste Danmark, Seneste Kultur og Seneste Internationalt. ",Politiken,https://politiken.dk/nyheder/,31.03.2023 07:16
Pernille Tranberg: Angsten for TikTok er kun reel i én sammenhæng,01.04.2023 00:00,,https://politiken.dk/kultur/art9285058/Angsten-for-TikTok-er-kun-reel-i-%C3%A9n-sammenh%C3%A6ng,Politiken,https://politiken.dk/nyheder/,"Hold dig opdateret pÃ¥ de seneste nyheder pÃ¥ politiken.dk: Seneste Politiken, Seneste Danmark, Seneste Kultur og Seneste Internationalt. ",Politiken,https://politiken.dk/nyheder/,31.03.2023 07:16
Omstridt chefdirigent skal være tv-vært,01.04.2023 00:00,,https://politiken.dk/kultur/art9286059/Omstridt-chefdirigent-skal-v%C3%A6re-tv-v%C3%A6rt,Politiken,https://politiken.dk/nyheder/,"Hold dig opdateret pÃ¥ de seneste nyheder pÃ¥ politiken.dk: Seneste Politiken, Seneste Danmark, Seneste Kultur og Seneste Internationalt. ",Politiken,https://politiken.dk/nyheder/,31.03.2023 07:16
Børneavisen vinder stor pris i London,01.04.2023 00:00,,https://politiken.dk/kultur/medier/art9284939/B%C3%B8rneavisen-vinder-stor-pris-i-London,Politiken,https://politiken.dk/nyheder/,"Hold dig opdateret pÃ¥ de seneste nyheder pÃ¥ politiken.dk: Seneste Politiken, Seneste Danmark, Seneste Kultur og Seneste Internationalt. ",Politiken,https://politiken.dk/nyheder/,31.03.2023 07:16
"5 hjerter: Vi er heldige, når litteraturen evner at være oprørsk og vidunderlig",01.04.2023 00:00,,https://politiken.dk/kultur/boger/art9271784/Vi-er-heldige-n%C3%A5r-litteraturen-evner-at-v%C3%A6re-opr%C3%B8rsk-og-vidunderlig,Politiken,https://politiken.dk/nyheder/,"Hold dig opdateret pÃ¥ de seneste nyheder pÃ¥ politiken.dk: Seneste Politiken, Seneste Danmark, Seneste Kultur og Seneste Internationalt. ",Politiken,https://politiken.dk/nyheder/,31.03.2023 07:16
»Hul i hovedet«: Udflytning rammer historisk dansebygning i København,01.04.2023 00:00,,https://politiken.dk/kultur/art9273222/Udflytning-rammer-historisk-dansebygning-i-K%C3%B8benhavn,Politiken,https://politiken.dk/nyheder/,"Hold dig opdateret pÃ¥ de seneste nyheder pÃ¥ politiken.dk: Seneste Politiken, Seneste Danmark, Seneste Kultur og Seneste Internationalt. ",Politiken,https://politiken.dk/nyheder/,31.03.2023 07:16
"Politikens kunstanmelder: Nu gør jeg noget, som jeg ikke kan huske, om jeg nogensinde har gjort før",01.04.2023 00:00,,https://politiken.dk/kultur/kunst/art9276176/Nu-g%C3%B8r-jeg-noget-som-jeg-ikke-kan-huske-om-jeg-nogensinde-har-gjort-f%C3%B8r,Politiken,https://politiken.dk/nyheder/,"Hold dig opdateret pÃ¥ de seneste nyheder pÃ¥ politiken.dk: Seneste Politiken, Seneste Danmark, Seneste Kultur og Seneste Internationalt. ",Politiken,https://politiken.dk/nyheder/,31.03.2023 07:16
Henrik Saxgren: Jeg leder efter revner og sprækker i grundfjeldet,29.03.2023 00:00,,https://politiken.dk/kultur/art9266807/Jeg-leder-efter-revner-og-spr%C3%A6kker-i-grundfjeldet,Politiken,https://politiken.dk/nyheder/,"Hold dig opdateret pÃ¥ de seneste nyheder pÃ¥ politiken.dk: Seneste Politiken, Seneste Danmark, Seneste Kultur og Seneste Internationalt. ",Politiken,https://politiken.dk/nyheder/,31.03.2023 07:16
Domstol genindfører drabsdom mod løsladt podcast-hovedperson,29.03.2023 00:00,,https://politiken.dk/kultur/medier/art9284128/Domstol-genindf%C3%B8rer-drabsdom-mod-l%C3%B8sladt-podcast-hovedperson,Politiken,https://politiken.dk/nyheder/,"Hold dig opdateret pÃ¥ de seneste nyheder pÃ¥ politiken.dk: Seneste Politiken, Seneste Danmark, Seneste Kultur og Seneste Internationalt. ",Politiken,https://politiken.dk/nyheder/,31.03.2023 07:16
Amatørarkæolog har fundet over 450 stykker danefæ på en hemmelig mark i Hornsherred,29.03.2023 00:00,,https://politiken.dk/kultur/art9277517/Amat%C3%B8rark%C3%A6olog-har-fundet-over-450-stykker-danef%C3%A6-p%C3%A5-en-hemmelig-mark-i-Hornsherred,Politiken,https://politiken.dk/nyheder/,"Hold dig opdateret pÃ¥ de seneste nyheder pÃ¥ politiken.dk: Seneste Politiken, Seneste Danmark, Seneste Kultur og Seneste Internationalt. ",Politiken,https://politiken.dk/nyheder/,31.03.2023 07:16
»Lamme af lir drog de i flok mod bækkenbassinet med de røde lygter i slikke dikke pikke-kvarteret«,28.03.2023 00:00,,https://politiken.dk/kultur/boger/boganmeldelser/faglitteratur_boger/art9271280/%C2%BBLamme-af-lir-drog-de-i-flok-mod-b%C3%A6kkenbassinet-med-de-r%C3%B8de-lygter-i-slikke-dikke-pikke-kvarteret%C2%AB,Politiken,https://politiken.dk/nyheder/,"Hold dig opdateret pÃ¥ de seneste nyheder pÃ¥ politiken.dk: Seneste Politiken, Seneste Danmark, Seneste Kultur og Seneste Internationalt. ",Politiken,https://politiken.dk/nyheder/,31.03.2023 07:16
Lige nu brillerer tysk kunstner i et galleri på Flæsketorvet med bevidst skjulte objekterÂ,28.03.2023 00:00,,https://politiken.dk/kultur/kunst/art9269463/Lige-nu-brillerer-tysk-kunstner-i-et-galleri-p%C3%A5-Fl%C3%A6sketorvet-med-bevidst-skjulte-objekter,Politiken,https://politiken.dk/nyheder/,"Hold dig opdateret pÃ¥ de seneste nyheder pÃ¥ politiken.dk: Seneste Politiken, Seneste Danmark, Seneste Kultur og Seneste Internationalt. ",Politiken,https://politiken.dk/nyheder/,31.03.2023 07:16
Det sker for tusindvis af danske kvinder hvert år. Men for mange er det stadig skamfuldt at tale om,28.03.2023 00:00,,https://politiken.dk/ibyen/art9220506/Det-sker-for-tusindvis-af-danske-kvinder-hvert-%C3%A5r.-Men-for-mange-er-det-stadig-skamfuldt-at-tale-om,Politiken,https://politiken.dk/nyheder/,"Hold dig opdateret pÃ¥ de seneste nyheder pÃ¥ politiken.dk: Seneste Politiken, Seneste Danmark, Seneste Kultur og Seneste Internationalt. ",Politiken,https://politiken.dk/nyheder/,31.03.2023 07:16
