title,published,text,link,og:site_name,og:url,site_description,name,url,scrape_time
Estlands centrum-højre regering er sikker på valgsejr,06.03.2023 06:37,,https://jyllands-posten.dk/international/europa/ECE15263266/estlands-centrumhoejre-regering-er-sikker-paa-valgsejr/,Jyllands-Posten,https://jyllands-posten.dk/seneste/,"Få de seneste nyheder fra ind- og udland om samfund, erhverv, sport og kultur. ",Jyllandsposten,https://jyllands-posten.dk/seneste/,06.03.2023 07:18
Djokovic trækker sig fra Indian Wells midt i strid om visum,06.03.2023 06:35,,https://jyllands-posten.dk/sport/ECE15263289/djokovic-traekker-sig-fra-indian-wells-midt-i-strid-om-visum/,Jyllands-Posten,https://jyllands-posten.dk/seneste/,"Få de seneste nyheder fra ind- og udland om samfund, erhverv, sport og kultur. ",Jyllandsposten,https://jyllands-posten.dk/seneste/,06.03.2023 07:18
Salah slår Fowler og har nu scoret flest ligamål for Liverpool,06.03.2023 06:34,,https://jyllands-posten.dk/sport/ECE15263277/salah-slaar-fowler-og-har-nu-scoret-flest-ligamaal-for-liverpool/,Jyllands-Posten,https://jyllands-posten.dk/seneste/,"Få de seneste nyheder fra ind- og udland om samfund, erhverv, sport og kultur. ",Jyllandsposten,https://jyllands-posten.dk/seneste/,06.03.2023 07:18
Real Madrids guldhåb lider nyt knæk med uafgjort,06.03.2023 06:33,,https://jyllands-posten.dk/sport/ECE15263252/real-madrids-guldhaab-lider-nyt-knaek-med-uafgjort/,Jyllands-Posten,https://jyllands-posten.dk/seneste/,"Få de seneste nyheder fra ind- og udland om samfund, erhverv, sport og kultur. ",Jyllandsposten,https://jyllands-posten.dk/seneste/,06.03.2023 07:18
OB-anfører efter 0-7 og ballade: En uge i modgang,06.03.2023 06:32,,https://jyllands-posten.dk/sport/ECE15263248/obanfoerer-efter-07-og-ballade-en-uge-i-modgang/,Jyllands-Posten,https://jyllands-posten.dk/seneste/,"Få de seneste nyheder fra ind- og udland om samfund, erhverv, sport og kultur. ",Jyllandsposten,https://jyllands-posten.dk/seneste/,06.03.2023 07:18
"Er det forjættede land et grusomt sted? Nogle smiler, andre ryster på hovedet af ny undersøgelse",06.03.2023 06:10,,https://jyllands-posten.dk/kultur/ECE15248873/er-det-forjaettede-land-et-grusomt-sted/,Jyllands-Posten,https://jyllands-posten.dk/seneste/,"Få de seneste nyheder fra ind- og udland om samfund, erhverv, sport og kultur. ",Jyllandsposten,https://jyllands-posten.dk/seneste/,06.03.2023 07:18
Gnags-guitaristen Per Frost er død,06.03.2023 06:09,,https://jyllands-posten.dk/kultur/ECE15263301/gnagsguitaristen-per-christian-frost-er-doed/,Jyllands-Posten,https://jyllands-posten.dk/seneste/,"Få de seneste nyheder fra ind- og udland om samfund, erhverv, sport og kultur. ",Jyllandsposten,https://jyllands-posten.dk/seneste/,06.03.2023 07:18
Afsløringer fortæller nyt om Putins enorme formue,06.03.2023 06:00,,https://jyllands-posten.dk/international/ECE15221517/nyt-lys-over-vladimir-putins-hemmelige-pengemaskine/,Jyllands-Posten,https://jyllands-posten.dk/seneste/,"Få de seneste nyheder fra ind- og udland om samfund, erhverv, sport og kultur. ",Jyllandsposten,https://jyllands-posten.dk/seneste/,06.03.2023 07:18
DMI udvider snestorms-varsel,06.03.2023 05:28,,https://jyllands-posten.dk/dagensoverblik/ECE15263203/nyhedsoverblik/,Jyllands-Posten,https://jyllands-posten.dk/seneste/,"Få de seneste nyheder fra ind- og udland om samfund, erhverv, sport og kultur. ",Jyllandsposten,https://jyllands-posten.dk/seneste/,06.03.2023 07:18
"Mette Frederiksen kendte til ubetalt regning, der blev skjult for danskerne",06.03.2023 05:00,,https://jyllands-posten.dk/politik/ECE15228037/mette-frederiksen-kendte-til-ubetalt-regning-der-blev-skjult-for-danskerne/,Jyllands-Posten,https://jyllands-posten.dk/seneste/,"Få de seneste nyheder fra ind- og udland om samfund, erhverv, sport og kultur. ",Jyllandsposten,https://jyllands-posten.dk/seneste/,06.03.2023 07:18
FCK-træner blæste til angreb i jagt på bedste målscore,05.03.2023 00:00,,https://jyllands-posten.dk/sport/fodbold/ECE15263223/fcktraener-blaeste-til-angreb-i-jagt-paa-bedste-maalscore/,Jyllands-Posten,https://jyllands-posten.dk/seneste/,"Få de seneste nyheder fra ind- og udland om samfund, erhverv, sport og kultur. ",Jyllandsposten,https://jyllands-posten.dk/seneste/,06.03.2023 07:18
Stationsforstander fængslet efter græsk togulykke,05.03.2023 00:00,,https://jyllands-posten.dk/international/europa/ECE15263238/stationsforstander-faengslet-efter-graesk-togulykke/,Jyllands-Posten,https://jyllands-posten.dk/seneste/,"Få de seneste nyheder fra ind- og udland om samfund, erhverv, sport og kultur. ",Jyllandsposten,https://jyllands-posten.dk/seneste/,06.03.2023 07:18
Rusland går mod en demografisk katastrofe,05.03.2023 00:00,,https://jyllands-posten.dk/international/ECE15263213/rusland-gaar-mod-en-demografisk-katastrofe/,Jyllands-Posten,https://jyllands-posten.dk/seneste/,"Få de seneste nyheder fra ind- og udland om samfund, erhverv, sport og kultur. ",Jyllandsposten,https://jyllands-posten.dk/seneste/,06.03.2023 07:18
Jürgen Klopp: Vi viste hvad vi kan,05.03.2023 00:00,,https://jyllands-posten.dk/sport/fodbold/ECE15263187/jurgen-klopp-vi-viste-hvad-vi-kan/,Jyllands-Posten,https://jyllands-posten.dk/seneste/,"Få de seneste nyheder fra ind- og udland om samfund, erhverv, sport og kultur. ",Jyllandsposten,https://jyllands-posten.dk/seneste/,06.03.2023 07:18
FCK tangerede rekord og fuldendte perfekt søndag,05.03.2023 00:00,,https://jyllands-posten.dk/sport/fodbold/ECE15263186/fck-tangerede-rekord-og-fuldendte-perfekt-soendag/,Jyllands-Posten,https://jyllands-posten.dk/seneste/,"Få de seneste nyheder fra ind- og udland om samfund, erhverv, sport og kultur. ",Jyllandsposten,https://jyllands-posten.dk/seneste/,06.03.2023 07:18
"Overblikket: Silkeborgs overtidshug, stort comeback af Randers FC og Lyngbys sensation",05.03.2023 00:00,,https://jyllands-posten.dk/sport/fodbold/ECE15244518/silkeborgs-overtidshug-stort-comeback-af-randers-fc-og-lyngbys-sensation/,Jyllands-Posten,https://jyllands-posten.dk/seneste/,"Få de seneste nyheder fra ind- og udland om samfund, erhverv, sport og kultur. ",Jyllandsposten,https://jyllands-posten.dk/seneste/,06.03.2023 07:18
Bjelland gjorde lyncomeback: Troede karrieren var slut,05.03.2023 00:00,,https://jyllands-posten.dk/sport/fodbold/ECE15263178/bjelland-gjorde-lyncomeback-troede-karrieren-var-slut/,Jyllands-Posten,https://jyllands-posten.dk/seneste/,"Få de seneste nyheder fra ind- og udland om samfund, erhverv, sport og kultur. ",Jyllandsposten,https://jyllands-posten.dk/seneste/,06.03.2023 07:18
United-træner efter ydmygelse: Det var uprofessionelt,05.03.2023 00:00,,https://jyllands-posten.dk/sport/fodbold/ECE15263177/unitedtraener-efter-ydmygelse-det-var-uprofessionelt/,Jyllands-Posten,https://jyllands-posten.dk/seneste/,"Få de seneste nyheder fra ind- og udland om samfund, erhverv, sport og kultur. ",Jyllandsposten,https://jyllands-posten.dk/seneste/,06.03.2023 07:18
Partier vil give undskyldning til piger fra anstalt på Sprogø,05.03.2023 00:00,,https://jyllands-posten.dk/indland/ECE15263163/partier-vil-give-undskyldning-til-piger-fra-anstalt-paa-sprogoe/,Jyllands-Posten,https://jyllands-posten.dk/seneste/,"Få de seneste nyheder fra ind- og udland om samfund, erhverv, sport og kultur. ",Jyllandsposten,https://jyllands-posten.dk/seneste/,06.03.2023 07:18
Liverpool ydmygede United i historisk afklapsning,05.03.2023 00:00,,https://jyllands-posten.dk/sport/fodbold/ECE15263121/liverpool-ydmygede-united-i-historisk-afklapsning/,Jyllands-Posten,https://jyllands-posten.dk/seneste/,"Få de seneste nyheder fra ind- og udland om samfund, erhverv, sport og kultur. ",Jyllandsposten,https://jyllands-posten.dk/seneste/,06.03.2023 07:18
Ekspert: »Det var en anonym og skuffende start for Haas«,05.03.2023 00:00,,https://jyllands-posten.dk/sport/formel1/ECE15104186/ekspert-det-var-en-anonym-og-skuffende-start-for-haas/,Jyllands-Posten,https://jyllands-posten.dk/seneste/,"Få de seneste nyheder fra ind- og udland om samfund, erhverv, sport og kultur. ",Jyllandsposten,https://jyllands-posten.dk/seneste/,06.03.2023 07:18
Ukrainsk efterretningschef: Rusland løber tør for våben,05.03.2023 00:00,,https://jyllands-posten.dk/international/europa/ECE15263101/ukrainsk-efterretningschef-rusland-loeber-toer-for-vaaben/,Jyllands-Posten,https://jyllands-posten.dk/seneste/,"Få de seneste nyheder fra ind- og udland om samfund, erhverv, sport og kultur. ",Jyllandsposten,https://jyllands-posten.dk/seneste/,06.03.2023 07:18
Britiske efterretninger: Russere fik ordre til at angribe med feltspader,05.03.2023 00:00,,https://jyllands-posten.dk/international/europa/ECE15263063/britiske-efterretninger-russere-fik-ordre-til-at-angribe-med-feltspader/,Jyllands-Posten,https://jyllands-posten.dk/seneste/,"Få de seneste nyheder fra ind- og udland om samfund, erhverv, sport og kultur. ",Jyllandsposten,https://jyllands-posten.dk/seneste/,06.03.2023 07:18
Ny ballade om brexit kan blive en bombe under 25 års fred i Nordirland,05.03.2023 00:00,,https://jyllands-posten.dk/international/europa/ECE15189571/ny-ballade-om-brexit-kan-blive-en-bombe-under-25-aars-fred-i-nordirland/,Jyllands-Posten,https://jyllands-posten.dk/seneste/,"Få de seneste nyheder fra ind- og udland om samfund, erhverv, sport og kultur. ",Jyllandsposten,https://jyllands-posten.dk/seneste/,06.03.2023 07:18
"Grønt er godt for øjnene, og derfor bør du have stedsegrønne planter i haven",05.03.2023 00:00,,https://jyllands-posten.dk/bolig/ECE15189936/groent-er-godt-for-oejnene-og-derfor-boer-du-have-stedsegroenne-planter-i-haven/,Jyllands-Posten,https://jyllands-posten.dk/seneste/,"Få de seneste nyheder fra ind- og udland om samfund, erhverv, sport og kultur. ",Jyllandsposten,https://jyllands-posten.dk/seneste/,06.03.2023 07:18
Optimistisk Magnussen holder hovedet højt efter skidt åbner,05.03.2023 00:00,,https://jyllands-posten.dk/sport/formel1/ECE15263097/optimistisk-magnussen-holder-hovedet-hoejt-efter-skidt-aabner/,Jyllands-Posten,https://jyllands-posten.dk/seneste/,"Få de seneste nyheder fra ind- og udland om samfund, erhverv, sport og kultur. ",Jyllandsposten,https://jyllands-posten.dk/seneste/,06.03.2023 07:18
Danmark tabte Golden League-triumf på gulvet mod Holland,05.03.2023 00:00,,https://jyllands-posten.dk/sport/handbold/ECE15263093/danmark-tabte-golden-leaguetriumf-paa-gulvet-mod-holland/,Jyllands-Posten,https://jyllands-posten.dk/seneste/,"Få de seneste nyheder fra ind- og udland om samfund, erhverv, sport og kultur. ",Jyllandsposten,https://jyllands-posten.dk/seneste/,06.03.2023 07:18
Vingegaard fik Pogacar til at opgive udbrudsforsøg,05.03.2023 00:00,,https://jyllands-posten.dk/sport/cykling/ECE15263076/vingegaard-fik-pogacar-til-at-opgive-udbrudsforsoeg/,Jyllands-Posten,https://jyllands-posten.dk/seneste/,"Få de seneste nyheder fra ind- og udland om samfund, erhverv, sport og kultur. ",Jyllandsposten,https://jyllands-posten.dk/seneste/,06.03.2023 07:18
Barcelona sled sig til smal sejr over bundhold,05.03.2023 00:00,,https://jyllands-posten.dk/sport/fodbold/ECE15263066/barcelona-sled-sig-til-smal-sejr-over-bundhold/,Jyllands-Posten,https://jyllands-posten.dk/seneste/,"Få de seneste nyheder fra ind- og udland om samfund, erhverv, sport og kultur. ",Jyllandsposten,https://jyllands-posten.dk/seneste/,06.03.2023 07:18
Aggressive Lyngby slog Brøndby i tempofyldt duel,05.03.2023 00:00,,https://jyllands-posten.dk/sport/fodbold/ECE15263055/aggressive-lyngby-slog-broendby-i-tempofyldt-duel/,Jyllands-Posten,https://jyllands-posten.dk/seneste/,"Få de seneste nyheder fra ind- og udland om samfund, erhverv, sport og kultur. ",Jyllandsposten,https://jyllands-posten.dk/seneste/,06.03.2023 07:18
Magtbalancen er vendt: Pludselig får grøn dansk sværvægter langt flere opkald fra USA end Europa,05.03.2023 00:00,,https://jyllands-posten.dk/ECE15249744/groen-handelskrig-der-er-masser-af-groenne-stoettekroner-i-europa-men-danske-svaervaegtere-rykker-mod-usa/,Jyllands-Posten,https://jyllands-posten.dk/seneste/,"Få de seneste nyheder fra ind- og udland om samfund, erhverv, sport og kultur. ",Jyllandsposten,https://jyllands-posten.dk/seneste/,06.03.2023 07:18
»Det er lidt komisk at spille så dårligt og alligevel blive matchvinder.«,05.03.2023 00:00,,https://jyllands-posten.dk/sport/fodbold/ECE15244416/alle-har-brug-for-en-frelsende-engel-og-saadan-en-dukkede-op-i-silkeborg/,Jyllands-Posten,https://jyllands-posten.dk/seneste/,"Få de seneste nyheder fra ind- og udland om samfund, erhverv, sport og kultur. ",Jyllandsposten,https://jyllands-posten.dk/seneste/,06.03.2023 07:18
Viborg i top-6: Det bliver nogle sindssygt fede kampe,05.03.2023 00:00,,https://jyllands-posten.dk/sport/fodbold/ECE15263044/viborg-i-top6-det-bliver-nogle-sindssygt-fede-kampe/,Jyllands-Posten,https://jyllands-posten.dk/seneste/,"Få de seneste nyheder fra ind- og udland om samfund, erhverv, sport og kultur. ",Jyllandsposten,https://jyllands-posten.dk/seneste/,06.03.2023 07:18
Max Verstappen med uhyggelig stærk start – Kevin Magnussen i bunden,05.03.2023 00:00,,https://jyllands-posten.dk/sport/formel1/ECE15262927/max-verstappen-med-uhyggelig-staerk-start-kevin-magnussen-i-bunden/,Jyllands-Posten,https://jyllands-posten.dk/seneste/,"Få de seneste nyheder fra ind- og udland om samfund, erhverv, sport og kultur. ",Jyllandsposten,https://jyllands-posten.dk/seneste/,06.03.2023 07:18
Vejle buldrer videre mod oprykning til Superligaen,05.03.2023 00:00,,https://jyllands-posten.dk/sport/fodbold/ECE15262999/vejle-buldrer-videre-mod-oprykning-til-superligaen/,Jyllands-Posten,https://jyllands-posten.dk/seneste/,"Få de seneste nyheder fra ind- og udland om samfund, erhverv, sport og kultur. ",Jyllandsposten,https://jyllands-posten.dk/seneste/,06.03.2023 07:18
Belgisk mester holdt Mads Pedersen bag sig i Paris-Nice,05.03.2023 00:00,,https://jyllands-posten.dk/sport/cykling/ECE15262996/belgisk-mester-holdt-mads-pedersen-bag-sig-i-parisnice/,Jyllands-Posten,https://jyllands-posten.dk/seneste/,"Få de seneste nyheder fra ind- og udland om samfund, erhverv, sport og kultur. ",Jyllandsposten,https://jyllands-posten.dk/seneste/,06.03.2023 07:18
En invasion af Taiwan vil få enorme omkostninger for alle,05.03.2023 00:00,,https://jyllands-posten.dk/international/ECE15189416/kina-vil-tabe-krig-i-taiwan-men-omkostningerne-bliver-enorme/,Jyllands-Posten,https://jyllands-posten.dk/seneste/,"Få de seneste nyheder fra ind- og udland om samfund, erhverv, sport og kultur. ",Jyllandsposten,https://jyllands-posten.dk/seneste/,06.03.2023 07:18
Ekspert om militære øvelser på Bornholm: Bekymringen for invasion og sabotage har skærpet Hjemmeværnets indsats,05.03.2023 00:00,,https://jyllands-posten.dk/indland/ECE15262816/militaeranalytiker-vi-vil-se-flere-af-den-slags-oevelser-i-fremtiden/,Jyllands-Posten,https://jyllands-posten.dk/seneste/,"Få de seneste nyheder fra ind- og udland om samfund, erhverv, sport og kultur. ",Jyllandsposten,https://jyllands-posten.dk/seneste/,06.03.2023 07:18
Braithwaite scorede igen for Espanyol,05.03.2023 00:00,,https://jyllands-posten.dk/sport/fodbold/ECE15262961/braithwaite-scorede-igen-for-espanyol/,Jyllands-Posten,https://jyllands-posten.dk/seneste/,"Få de seneste nyheder fra ind- og udland om samfund, erhverv, sport og kultur. ",Jyllandsposten,https://jyllands-posten.dk/seneste/,06.03.2023 07:18
Silkeborg stak kæp i FCN-hjulet med sen sejr,05.03.2023 00:00,,https://jyllands-posten.dk/sport/fodbold/ECE15262958/silkeborg-stak-kaep-i-fcnhjulet-med-sen-sejr/,Jyllands-Posten,https://jyllands-posten.dk/seneste/,"Få de seneste nyheder fra ind- og udland om samfund, erhverv, sport og kultur. ",Jyllandsposten,https://jyllands-posten.dk/seneste/,06.03.2023 07:18
Comeback i anden halvleg sikrede Randers et point i Viborg,05.03.2023 00:00,,https://jyllands-posten.dk/sport/fodbold/ECE15262954/comeback-i-anden-halvleg-sikrede-randers-et-point-i-viborg/,Jyllands-Posten,https://jyllands-posten.dk/seneste/,"Få de seneste nyheder fra ind- og udland om samfund, erhverv, sport og kultur. ",Jyllandsposten,https://jyllands-posten.dk/seneste/,06.03.2023 07:18
Forsker: FN-aftale kan give flere tun i Danmark,05.03.2023 00:00,,https://jyllands-posten.dk/international/ECE15262906/forsker-fnaftale-kan-give-flere-tun-i-danmark/,Jyllands-Posten,https://jyllands-posten.dk/seneste/,"Få de seneste nyheder fra ind- og udland om samfund, erhverv, sport og kultur. ",Jyllandsposten,https://jyllands-posten.dk/seneste/,06.03.2023 07:18
Herning buldrer videre på isen inden slutspil,05.03.2023 00:00,,https://jyllands-posten.dk/sport/ECE15262947/herning-buldrer-videre-paa-isen-inden-slutspil/,Jyllands-Posten,https://jyllands-posten.dk/seneste/,"Få de seneste nyheder fra ind- og udland om samfund, erhverv, sport og kultur. ",Jyllandsposten,https://jyllands-posten.dk/seneste/,06.03.2023 07:18
Verstappen vandt suverænt i Bahrain,05.03.2023 00:00,,https://jyllands-posten.dk/sport/formel1/ECE15262901/liveblog-formel-1-grandprix-i-bahrain/,Jyllands-Posten,https://jyllands-posten.dk/seneste/,"Få de seneste nyheder fra ind- og udland om samfund, erhverv, sport og kultur. ",Jyllandsposten,https://jyllands-posten.dk/seneste/,06.03.2023 07:18
"Udnævnt som European Capital of Gastronomy 2023: »For tyve år siden ville det have været utænkeligt, at nogen rejste til Stockholm for bare at spise«",05.03.2023 00:00,,https://jyllands-posten.dk/rejser/ECE15109810/for-tyve-aar-siden-ville-det-have-vaeret-utaenkeligt-at-nogen-rejste-til-stockholm-for-bare-at-spise/,Jyllands-Posten,https://jyllands-posten.dk/seneste/,"Få de seneste nyheder fra ind- og udland om samfund, erhverv, sport og kultur. ",Jyllandsposten,https://jyllands-posten.dk/seneste/,06.03.2023 07:18
Danske tegne-talenter tager kampen op med Tintin,05.03.2023 00:00,,https://jyllands-posten.dk/kultur/ECE14900323/tintin-foerer-stadig-men-mange-nye-og-anderledes-danske-tegneserier-vinder-terraen/,Jyllands-Posten,https://jyllands-posten.dk/seneste/,"Få de seneste nyheder fra ind- og udland om samfund, erhverv, sport og kultur. ",Jyllandsposten,https://jyllands-posten.dk/seneste/,06.03.2023 07:18
Kreativt univers i ydmygt rækkehus,05.03.2023 00:00,,https://jyllands-posten.dk/bolig/ECE14939084/kreativt-univers-i-ydmygt-raekkehus/,Jyllands-Posten,https://jyllands-posten.dk/seneste/,"Få de seneste nyheder fra ind- og udland om samfund, erhverv, sport og kultur. ",Jyllandsposten,https://jyllands-posten.dk/seneste/,06.03.2023 07:18
DMI advarer: »Farligt vejr« rammer hele Danmark,05.03.2023 00:00,,https://jyllands-posten.dk/indland/ECE15262820/dmi-advarer-farligt-vejr-rammer-hele-danmark/,Jyllands-Posten,https://jyllands-posten.dk/seneste/,"Få de seneste nyheder fra ind- og udland om samfund, erhverv, sport og kultur. ",Jyllandsposten,https://jyllands-posten.dk/seneste/,06.03.2023 07:18
To mistænkte mænd er fængslet efter knivstik på Mors,05.03.2023 00:00,,https://jyllands-posten.dk/indland/ECE15262806/to-mistaenkte-maend-er-faengslet-efter-knivstik-paa-mors/,Jyllands-Posten,https://jyllands-posten.dk/seneste/,"Få de seneste nyheder fra ind- og udland om samfund, erhverv, sport og kultur. ",Jyllandsposten,https://jyllands-posten.dk/seneste/,06.03.2023 07:18
Vrede grækere støder sammen med politi i Athen efter togtragedie,05.03.2023 00:00,,https://jyllands-posten.dk/international/europa/ECE15262830/vrede-graekere-stoeder-sammen-med-politi-i-athen-efter-togtragedie/,Jyllands-Posten,https://jyllands-posten.dk/seneste/,"Få de seneste nyheder fra ind- og udland om samfund, erhverv, sport og kultur. ",Jyllandsposten,https://jyllands-posten.dk/seneste/,06.03.2023 07:18
Kina satser på teknologisk selvforsyning: Nu får Xi Jinping officielt sin tredje præsidentperiode,05.03.2023 00:00,,https://jyllands-posten.dk/international/asien/ECE15189391/nu-faar-xi-jinping-officielt-sin-tredje-praesidentperiode/,Jyllands-Posten,https://jyllands-posten.dk/seneste/,"Få de seneste nyheder fra ind- og udland om samfund, erhverv, sport og kultur. ",Jyllandsposten,https://jyllands-posten.dk/seneste/,06.03.2023 07:18
"Da det første russiske superfly landede på Bornholm, skabte det et dilemma, der stadig lever 70 år senere",05.03.2023 00:00,,https://jyllands-posten.dk/nyviden/ECE15018432/frank-jarecki-landede-sit-mig15-jagerfly-paa-bornholm-for-70-aar-siden/,Jyllands-Posten,https://jyllands-posten.dk/seneste/,"Få de seneste nyheder fra ind- og udland om samfund, erhverv, sport og kultur. ",Jyllandsposten,https://jyllands-posten.dk/seneste/,06.03.2023 07:18
Aarhus-kok vil gøre torskerogn til en gastronomisk oplevelse,05.03.2023 00:00,,https://jyllands-posten.dk/livsstil/madvin/ECE15189147/en-madoplevelse-afhaenger-af-hele-stemningen-omkring-maaltidet/,Jyllands-Posten,https://jyllands-posten.dk/seneste/,"Få de seneste nyheder fra ind- og udland om samfund, erhverv, sport og kultur. ",Jyllandsposten,https://jyllands-posten.dk/seneste/,06.03.2023 07:18
Ny Brøndby-træner: Talnørden fra Aarhus har knækket koden,05.03.2023 00:00,,https://jyllands-posten.dk/sport/fodbold/ECE15223441/skildpadde-maaske-men-han-taenker-til-gengaeld-hurtigt/,Jyllands-Posten,https://jyllands-posten.dk/seneste/,"Få de seneste nyheder fra ind- og udland om samfund, erhverv, sport og kultur. ",Jyllandsposten,https://jyllands-posten.dk/seneste/,06.03.2023 07:18
"DMI har trukket en streg hen over Danmark, der viser, hvor der kan falde 25 cm sne",05.03.2023 00:00,,https://jyllands-posten.dk/indland/ECE15262696/tirsdagens-snevejr-forventes-at-give-trafikale-udfordringer/,Jyllands-Posten,https://jyllands-posten.dk/seneste/,"Få de seneste nyheder fra ind- og udland om samfund, erhverv, sport og kultur. ",Jyllandsposten,https://jyllands-posten.dk/seneste/,06.03.2023 07:18
Efter 10 definerende år: »Nu er jeg klar til at grave et spadestik dybere«,05.03.2023 00:00,,https://jyllands-posten.dk/kultur/ECE15190631/det-kilder-fortsat-i-maven-om-morgenen/,Jyllands-Posten,https://jyllands-posten.dk/seneste/,"Få de seneste nyheder fra ind- og udland om samfund, erhverv, sport og kultur. ",Jyllandsposten,https://jyllands-posten.dk/seneste/,06.03.2023 07:18
Musicalens stjerne er blevet et radiohit,05.03.2023 00:00,,https://jyllands-posten.dk/kultur/ECE15190626/musicalens-stjerne-er-blevet-et-radiohit/,Jyllands-Posten,https://jyllands-posten.dk/seneste/,"Få de seneste nyheder fra ind- og udland om samfund, erhverv, sport og kultur. ",Jyllandsposten,https://jyllands-posten.dk/seneste/,06.03.2023 07:18
Politi og forsvar undersøger stort brag i Ballerup - to indlagt,05.03.2023 00:00,,https://jyllands-posten.dk/indland/ECE15262698/politi-og-forsvar-undersoeger-rudeknusende-brag-i-ballerup/,Jyllands-Posten,https://jyllands-posten.dk/seneste/,"Få de seneste nyheder fra ind- og udland om samfund, erhverv, sport og kultur. ",Jyllandsposten,https://jyllands-posten.dk/seneste/,06.03.2023 07:18
Biden snublede på vej op i Air Force One: Nu ulmer tabubelagt diskussion igen,05.03.2023 00:00,,https://jyllands-posten.dk/international/usa/ECE15202947/er-amerikanerne-ved-at-vaere-traette-af-gamle-praesidenter/,Jyllands-Posten,https://jyllands-posten.dk/seneste/,"Få de seneste nyheder fra ind- og udland om samfund, erhverv, sport og kultur. ",Jyllandsposten,https://jyllands-posten.dk/seneste/,06.03.2023 07:18
"JP-bilredaktør: Den nye hybrid er solid og komfortabel, men kors, hvor er den kedelig",05.03.2023 00:00,,https://jyllands-posten.dk/biler/ECE15198731/corollanavnet-staar-stadig-for-paalidelighed-og-holdbarhed-men-heller-ikke-saa-meget-mere/,Jyllands-Posten,https://jyllands-posten.dk/seneste/,"Få de seneste nyheder fra ind- og udland om samfund, erhverv, sport og kultur. ",Jyllandsposten,https://jyllands-posten.dk/seneste/,06.03.2023 07:18
Ny bog: Svensk par driver en restaurant med hummus som omdrejningspunkt,05.03.2023 00:00,,https://jyllands-posten.dk/livsstil/madvin/ECE15151335/hummus-for-viderekomne-de-mikser-mellemoestlige-og-skandinaviske-madtraditioner-og-skaber-helt-nye-smagsoplevelser/,Jyllands-Posten,https://jyllands-posten.dk/seneste/,"Få de seneste nyheder fra ind- og udland om samfund, erhverv, sport og kultur. ",Jyllandsposten,https://jyllands-posten.dk/seneste/,06.03.2023 07:18
Civile flygter fra Bakhmut - tænketank spår delvis retræte,05.03.2023 00:00,,https://jyllands-posten.dk/international/europa/ECE15262535/civile-flygter-fra-bakhmut-taenketank-spaar-delvis-retraete/,Jyllands-Posten,https://jyllands-posten.dk/seneste/,"Få de seneste nyheder fra ind- og udland om samfund, erhverv, sport og kultur. ",Jyllandsposten,https://jyllands-posten.dk/seneste/,06.03.2023 07:18
Bolsonaro fik rockstjernemodtagelse ved konference i USA,05.03.2023 00:00,,https://jyllands-posten.dk/international/ECE15262526/bolsonaro-fik-rockstjernemodtagelse-ved-konference-i-usa/,Jyllands-Posten,https://jyllands-posten.dk/seneste/,"Få de seneste nyheder fra ind- og udland om samfund, erhverv, sport og kultur. ",Jyllandsposten,https://jyllands-posten.dk/seneste/,06.03.2023 07:18
Muligt nyt Nato-mål på tre procent kan koste 28 milliarder kroner,05.03.2023 00:00,,https://jyllands-posten.dk/indland/ECE15262546/muligt-nyt-natomaal-paa-tre-procent-kan-koste-28-milliarder-kroner/,Jyllands-Posten,https://jyllands-posten.dk/seneste/,"Få de seneste nyheder fra ind- og udland om samfund, erhverv, sport og kultur. ",Jyllandsposten,https://jyllands-posten.dk/seneste/,06.03.2023 07:18
Formel 1-ekspert: Kevin Magnussen vinder let over sin holdkammerat,05.03.2023 00:00,,https://jyllands-posten.dk/sport/formel1/ECE15104175/red-bull-vinder-igen-men-sidder-paa-en-tikkende-bombe/,Jyllands-Posten,https://jyllands-posten.dk/seneste/,"Få de seneste nyheder fra ind- og udland om samfund, erhverv, sport og kultur. ",Jyllandsposten,https://jyllands-posten.dk/seneste/,06.03.2023 07:18
