title,published,text,link,og:site_name,og:url,site_description,name,url,scrape_time
"Anmelder: »Det er pragtfuld læsning, som enhver bør unde sig selv«",16.12.2022 00:00,,https://politiken.dk/kultur/boger/art9109463/%C2%BBDet-er-pragtfuld-l%C3%A6sning-som-enhver-b%C3%B8r-unde-sig-selv%C2%AB,Politiken,https://politiken.dk/nyheder/,"Hold dig opdateret pÃ¥ de seneste nyheder pÃ¥ politiken.dk: Seneste Politiken, Seneste Danmark, Seneste Kultur og Seneste Internationalt. ",Politiken,https://politiken.dk/nyheder/,12.12.2022 07:20
"Ny bog sætter fokus på kvindernes rolle i dansk landbrug: »Han siger, at han får aldrig et billigere udmugningsanlæg end det, han har. Det har altid været mig«",18.12.2022 00:00,,https://politiken.dk/kultur/art9100037/%C2%BBHan-siger-at-han-f%C3%A5r-aldrig-et-billigere-udmugningsanl%C3%A6g-end-det-han-har.-Det-har-altid-v%C3%A6ret-mig%C2%AB,Politiken,https://politiken.dk/nyheder/,"Hold dig opdateret pÃ¥ de seneste nyheder pÃ¥ politiken.dk: Seneste Politiken, Seneste Danmark, Seneste Kultur og Seneste Internationalt. ",Politiken,https://politiken.dk/nyheder/,12.12.2022 07:20
Peter Høeg gik veltalende ind i det minerede område,21.12.2022 00:00,,https://politiken.dk/kultur/set_og_hoert/art9116263/Peter-H%C3%B8eg-gik-veltalende-ind-i-det-minerede-omr%C3%A5de,Politiken,https://politiken.dk/nyheder/,"Hold dig opdateret pÃ¥ de seneste nyheder pÃ¥ politiken.dk: Seneste Politiken, Seneste Danmark, Seneste Kultur og Seneste Internationalt. ",Politiken,https://politiken.dk/nyheder/,12.12.2022 07:20
Mathias Kryger: H.C. Andersens utålmodige grantræ minder mig om at være single i 2022,22.12.2022 00:00,,https://politiken.dk/kultur/art8988686/H.C.-Andersens-ut%C3%A5lmodige-grantr%C3%A6-minder-mig-om-at-v%C3%A6re-single-i-2022,Politiken,https://politiken.dk/nyheder/,"Hold dig opdateret pÃ¥ de seneste nyheder pÃ¥ politiken.dk: Seneste Politiken, Seneste Danmark, Seneste Kultur og Seneste Internationalt. ",Politiken,https://politiken.dk/nyheder/,12.12.2022 07:20
Zlatko Buric kåret til Bedste Europæiske Skuespiller,13.12.2022 00:00,,https://politiken.dk/kultur/film_og_tv/art9118149/Zlatko-Buric-k%C3%A5ret-til-Bedste-Europ%C3%A6iske-Skuespiller,Politiken,https://politiken.dk/nyheder/,"Hold dig opdateret pÃ¥ de seneste nyheder pÃ¥ politiken.dk: Seneste Politiken, Seneste Danmark, Seneste Kultur og Seneste Internationalt. ",Politiken,https://politiken.dk/nyheder/,12.12.2022 07:20
"5 hjerter: Dette er krimien for dem, som ellers snobbet rynker på næsen ad den slags",13.12.2022 00:00,,https://politiken.dk/kultur/boger/boganmeldelser/skonlitteratur_boger/art9114126/Dette-er-krimien-for-dem-som-ellers-snobbet-rynker-p%C3%A5-n%C3%A6sen-ad-den-slags,Politiken,https://politiken.dk/nyheder/,"Hold dig opdateret pÃ¥ de seneste nyheder pÃ¥ politiken.dk: Seneste Politiken, Seneste Danmark, Seneste Kultur og Seneste Internationalt. ",Politiken,https://politiken.dk/nyheder/,12.12.2022 07:20
Cowboys med Marlboro-cigaretter rider gennem Louisiana. Det er vildt godt,13.12.2022 00:00,,https://politiken.dk/kultur/kunst/art9091629/Cowboys-med-Marlboro-cigaretter-rider-gennem-Louisiana.-Det-er-vildt-godt,Politiken,https://politiken.dk/nyheder/,"Hold dig opdateret pÃ¥ de seneste nyheder pÃ¥ politiken.dk: Seneste Politiken, Seneste Danmark, Seneste Kultur og Seneste Internationalt. ",Politiken,https://politiken.dk/nyheder/,12.12.2022 07:20
DR bruger samme greb som i 1991. Det virker forbilledligt,13.12.2022 00:00,,https://politiken.dk/kultur/set_og_hoert/art8977162/DR-bruger-samme-greb-som-i-1991.-Det-virker-forbilledligt,Politiken,https://politiken.dk/nyheder/,"Hold dig opdateret pÃ¥ de seneste nyheder pÃ¥ politiken.dk: Seneste Politiken, Seneste Danmark, Seneste Kultur og Seneste Internationalt. ",Politiken,https://politiken.dk/nyheder/,12.12.2022 07:20
Javier Bardem glitrer med veloplagt upålidelighed i familiefilm om en sød krokodille,13.12.2022 00:00,,https://politiken.dk/kultur/film_og_tv/art9057109/Javier-Bardem-glitrer-med-veloplagt-up%C3%A5lidelighed-i-familiefilm-om-en-s%C3%B8d-krokodille,Politiken,https://politiken.dk/nyheder/,"Hold dig opdateret pÃ¥ de seneste nyheder pÃ¥ politiken.dk: Seneste Politiken, Seneste Danmark, Seneste Kultur og Seneste Internationalt. ",Politiken,https://politiken.dk/nyheder/,12.12.2022 07:20
Bestsellerforfatters bog er en finger lige i synet på Putin,13.12.2022 00:00,,https://politiken.dk/kultur/boger/art9109320/Bestsellerforfatters-bog-er-en-finger-lige-i-synet-p%C3%A5-Putin,Politiken,https://politiken.dk/nyheder/,"Hold dig opdateret pÃ¥ de seneste nyheder pÃ¥ politiken.dk: Seneste Politiken, Seneste Danmark, Seneste Kultur og Seneste Internationalt. ",Politiken,https://politiken.dk/nyheder/,12.12.2022 07:20
Læg en hård pakke under træet: Anmelderne udvælger årets bedste bøger,13.12.2022 00:00,,https://politiken.dk/kultur/boger/art9100302/L%C3%A6g-en-h%C3%A5rd-pakke-under-tr%C3%A6et-Anmelderne-udv%C3%A6lger-%C3%A5rets-bedste-b%C3%B8ger,Politiken,https://politiken.dk/nyheder/,"Hold dig opdateret pÃ¥ de seneste nyheder pÃ¥ politiken.dk: Seneste Politiken, Seneste Danmark, Seneste Kultur og Seneste Internationalt. ",Politiken,https://politiken.dk/nyheder/,12.12.2022 07:20
Norsk minister er rystet efter artikel om TikTok og træningsvideoer,13.12.2022 00:00,,https://politiken.dk/kultur/art9117348/Norsk-minister-er-rystet-efter-artikel-om-TikTok-og-tr%C3%A6ningsvideoer,Politiken,https://politiken.dk/nyheder/,"Hold dig opdateret pÃ¥ de seneste nyheder pÃ¥ politiken.dk: Seneste Politiken, Seneste Danmark, Seneste Kultur og Seneste Internationalt. ",Politiken,https://politiken.dk/nyheder/,12.12.2022 07:20
Møgforkælet pendant til Lille Per er totalt ude af kontrol,09.12.2022 00:00,,https://politiken.dk/kultur/film_og_tv/art8982590/M%C3%B8gfork%C3%A6let-pendant-til-Lille-Per-er-totalt-ude-af-kontrol,Politiken,https://politiken.dk/nyheder/,"Hold dig opdateret pÃ¥ de seneste nyheder pÃ¥ politiken.dk: Seneste Politiken, Seneste Danmark, Seneste Kultur og Seneste Internationalt. ",Politiken,https://politiken.dk/nyheder/,12.12.2022 07:20
"»Der sidder I og ser -Disney Sjov-, helt intetanende om jeres moderløse fremtid«, tænkte jeg",09.12.2022 00:00,,https://politiken.dk/kultur/art9081938/%C2%BBDer-sidder-I-og-ser-%E2%80%99Disney-Sjov%E2%80%99-helt-intetanende-om-jeres-moderl%C3%B8se-fremtid%C2%AB-t%C3%A6nkte-jeg,Politiken,https://politiken.dk/nyheder/,"Hold dig opdateret pÃ¥ de seneste nyheder pÃ¥ politiken.dk: Seneste Politiken, Seneste Danmark, Seneste Kultur og Seneste Internationalt. ",Politiken,https://politiken.dk/nyheder/,12.12.2022 07:20
Som altid synger hun fra et sted mellem blå mærker og begær,09.12.2022 00:00,,https://politiken.dk/kultur/musik/art9111355/Som-altid-synger-hun-fra-et-sted-mellem-bl%C3%A5-m%C3%A6rker-og-beg%C3%A6r,Politiken,https://politiken.dk/nyheder/,"Hold dig opdateret pÃ¥ de seneste nyheder pÃ¥ politiken.dk: Seneste Politiken, Seneste Danmark, Seneste Kultur og Seneste Internationalt. ",Politiken,https://politiken.dk/nyheder/,12.12.2022 07:20
TV 2 får kritik for betalt cykeltur til Berlin,09.12.2022 00:00,,https://politiken.dk/kultur/medier/art9116585/TV-2-f%C3%A5r-kritik-for-betalt-cykeltur-til-Berlin,Politiken,https://politiken.dk/nyheder/,"Hold dig opdateret pÃ¥ de seneste nyheder pÃ¥ politiken.dk: Seneste Politiken, Seneste Danmark, Seneste Kultur og Seneste Internationalt. ",Politiken,https://politiken.dk/nyheder/,12.12.2022 07:20
"På et tidspunkt sagde min mand til mig: »Det er virkelig mærkeligt, at du skælder ud over, at nogen tilbyder dig et job. Jeg tror, du skal tage et år mere, Christine«",09.12.2022 00:00,,https://politiken.dk/kultur/art9059560/%C2%BBDet-er-virkelig-m%C3%A6rkeligt-at-du-sk%C3%A6lder-ud-over-at-nogen-tilbyder-dig-et-job.-Jeg-tror-du-skal-tage-et-%C3%A5r-mere-Christine%C2%AB,Politiken,https://politiken.dk/nyheder/,"Hold dig opdateret pÃ¥ de seneste nyheder pÃ¥ politiken.dk: Seneste Politiken, Seneste Danmark, Seneste Kultur og Seneste Internationalt. ",Politiken,https://politiken.dk/nyheder/,12.12.2022 07:20
"Lady Gaga, Beyoncé og Madonna vil have hendes beats. Her er den dj, alle spørger efter",09.12.2022 00:00,,https://politiken.dk/kultur/musik/art9109683/Lady-Gaga-Beyonc%C3%A9-og-Madonna-vil-have-hendes-beats.-Her-er-den-dj-alle-sp%C3%B8rger-efter,Politiken,https://politiken.dk/nyheder/,"Hold dig opdateret pÃ¥ de seneste nyheder pÃ¥ politiken.dk: Seneste Politiken, Seneste Danmark, Seneste Kultur og Seneste Internationalt. ",Politiken,https://politiken.dk/nyheder/,12.12.2022 07:20
Fire journalistiske projekter er nomineret til Cavlingprisen,09.12.2022 00:00,,https://politiken.dk/kultur/medier/art9114866/Fire-journalistiske-projekter-er-nomineret-til-Cavlingprisen,Politiken,https://politiken.dk/nyheder/,"Hold dig opdateret pÃ¥ de seneste nyheder pÃ¥ politiken.dk: Seneste Politiken, Seneste Danmark, Seneste Kultur og Seneste Internationalt. ",Politiken,https://politiken.dk/nyheder/,12.12.2022 07:20
Jes Stein Pedersen: Bogfolk tager dig igennem årets udgivelser,09.12.2022 00:00,,https://politiken.dk/podcast/bogfolk/art9114004/Bogfolk-tager-dig-igennem-%C3%A5rets-udgivelser,Politiken,https://politiken.dk/nyheder/,"Hold dig opdateret pÃ¥ de seneste nyheder pÃ¥ politiken.dk: Seneste Politiken, Seneste Danmark, Seneste Kultur og Seneste Internationalt. ",Politiken,https://politiken.dk/nyheder/,12.12.2022 07:20
Dokumentarserien om Harry og Meghan virker i lange sekvenser som en pinagtig reklamefilm,09.12.2022 00:00,,https://politiken.dk/kultur/film_og_tv/art9113424/Dokumentarserien-om-Harry-og-Meghan-virker-i-lange-sekvenser-som-en-pinagtig-reklamefilm,Politiken,https://politiken.dk/nyheder/,"Hold dig opdateret pÃ¥ de seneste nyheder pÃ¥ politiken.dk: Seneste Politiken, Seneste Danmark, Seneste Kultur og Seneste Internationalt. ",Politiken,https://politiken.dk/nyheder/,12.12.2022 07:20
MGP-vinder Emma Pi i kras kritik af anmelderrost DR-dokumentar: »Det er forkert og løgn«,09.12.2022 00:00,,https://politiken.dk/kultur/art9112498/%C2%BBDet-er-forkert-og-l%C3%B8gn%C2%AB,Politiken,https://politiken.dk/nyheder/,"Hold dig opdateret pÃ¥ de seneste nyheder pÃ¥ politiken.dk: Seneste Politiken, Seneste Danmark, Seneste Kultur og Seneste Internationalt. ",Politiken,https://politiken.dk/nyheder/,12.12.2022 07:20
"Kim Skotte: Naturen skal beskyttes mod os selv, og det haster",09.12.2022 00:00,,https://politiken.dk/debat/klummer/art9112151/Naturen-skal-beskyttes-mod-os-selv-og-det-haster,Politiken,https://politiken.dk/nyheder/,"Hold dig opdateret pÃ¥ de seneste nyheder pÃ¥ politiken.dk: Seneste Politiken, Seneste Danmark, Seneste Kultur og Seneste Internationalt. ",Politiken,https://politiken.dk/nyheder/,12.12.2022 07:20
Mediechef irettesætter medarbejder for åben mikrofon,09.12.2022 00:00,,https://politiken.dk/kultur/set_og_hoert/art9112441/Mediechef-irettes%C3%A6tter-medarbejder-for-%C3%A5ben-mikrofon,Politiken,https://politiken.dk/nyheder/,"Hold dig opdateret pÃ¥ de seneste nyheder pÃ¥ politiken.dk: Seneste Politiken, Seneste Danmark, Seneste Kultur og Seneste Internationalt. ",Politiken,https://politiken.dk/nyheder/,12.12.2022 07:20
En 1.300 år gammel halskæde har fået engelske arkæologer til at spærre øjnene op,09.12.2022 00:00,,https://politiken.dk/kultur/historie/art9114386/En-1.300-%C3%A5r-gammel-halsk%C3%A6de-har-f%C3%A5et-engelske-ark%C3%A6ologer-til-at-sp%C3%A6rre-%C3%B8jnene-op,Politiken,https://politiken.dk/nyheder/,"Hold dig opdateret pÃ¥ de seneste nyheder pÃ¥ politiken.dk: Seneste Politiken, Seneste Danmark, Seneste Kultur og Seneste Internationalt. ",Politiken,https://politiken.dk/nyheder/,12.12.2022 07:20
Kanye West bliver frataget doktorgrad,09.12.2022 00:00,,https://politiken.dk/kultur/art9116302/Kanye-West-bliver-frataget-doktorgrad,Politiken,https://politiken.dk/nyheder/,"Hold dig opdateret pÃ¥ de seneste nyheder pÃ¥ politiken.dk: Seneste Politiken, Seneste Danmark, Seneste Kultur og Seneste Internationalt. ",Politiken,https://politiken.dk/nyheder/,12.12.2022 07:20
"Kim Skotte: Der er tre gode grunde til, at denne film lykkes",08.12.2022 00:00,,https://politiken.dk/kultur/film_og_tv/art8982605/Kim-Skotte-Der-er-tre-gode-grunde-til-at-denne-film-lykkes,Politiken,https://politiken.dk/nyheder/,"Hold dig opdateret pÃ¥ de seneste nyheder pÃ¥ politiken.dk: Seneste Politiken, Seneste Danmark, Seneste Kultur og Seneste Internationalt. ",Politiken,https://politiken.dk/nyheder/,12.12.2022 07:20
"Den kan fortælle jokes, løse universitetsopgaver og svare på, om der er liv efter døden. Men er den farlig?",08.12.2022 00:00,,https://politiken.dk/kultur/art9111050/Den-kan-fort%C3%A6lle-jokes-l%C3%B8se-universitetsopgaver-og-svare-p%C3%A5-om-der-er-liv-efter-d%C3%B8den.-Men-er-den-farlig,Politiken,https://politiken.dk/nyheder/,"Hold dig opdateret pÃ¥ de seneste nyheder pÃ¥ politiken.dk: Seneste Politiken, Seneste Danmark, Seneste Kultur og Seneste Internationalt. ",Politiken,https://politiken.dk/nyheder/,12.12.2022 07:20
Det er en af tidens største modetrends. Men ingen taler om den grumme bagside,08.12.2022 00:00,,https://politiken.dk/ibyen/art8997567/Det-er-en-af-tidens-st%C3%B8rste-modetrends.-Men-ingen-taler-om-den-grumme-bagside,Politiken,https://politiken.dk/nyheder/,"Hold dig opdateret pÃ¥ de seneste nyheder pÃ¥ politiken.dk: Seneste Politiken, Seneste Danmark, Seneste Kultur og Seneste Internationalt. ",Politiken,https://politiken.dk/nyheder/,12.12.2022 07:20
Harry & Meghan-dokumentar sender britiske medier i selvsving,08.12.2022 00:00,,https://politiken.dk/kultur/film_og_tv/art9113625/Harry-Meghan-dokumentar-sender-britiske-medier-i-selvsving,Politiken,https://politiken.dk/nyheder/,"Hold dig opdateret pÃ¥ de seneste nyheder pÃ¥ politiken.dk: Seneste Politiken, Seneste Danmark, Seneste Kultur og Seneste Internationalt. ",Politiken,https://politiken.dk/nyheder/,12.12.2022 07:20
"Der er en ret væsentlig detalje, som filmen om Emily BrontÃ« misser",08.12.2022 00:00,,https://politiken.dk/kultur/film_og_tv/art8982588/Der-er-en-ret-v%C3%A6sentlig-detalje-som-filmen-om-Emily-Bront%C3%AB-misser,Politiken,https://politiken.dk/nyheder/,"Hold dig opdateret pÃ¥ de seneste nyheder pÃ¥ politiken.dk: Seneste Politiken, Seneste Danmark, Seneste Kultur og Seneste Internationalt. ",Politiken,https://politiken.dk/nyheder/,12.12.2022 07:20
Infernal tager fusen på Politikens anmelder,08.12.2022 00:00,,https://politiken.dk/kultur/musik/art9094109/Infernal-tager-fusen-p%C3%A5-Politikens-anmelder,Politiken,https://politiken.dk/nyheder/,"Hold dig opdateret pÃ¥ de seneste nyheder pÃ¥ politiken.dk: Seneste Politiken, Seneste Danmark, Seneste Kultur og Seneste Internationalt. ",Politiken,https://politiken.dk/nyheder/,12.12.2022 07:20
Den grønlandsk-danske film har været syv år undervejs. Nu får den premiere på prestigefyldt festival,08.12.2022 00:00,,https://politiken.dk/kultur/film_og_tv/art9113626/Den-gr%C3%B8nlandsk-danske-film-har-v%C3%A6ret-syv-%C3%A5r-undervejs.-Nu-f%C3%A5r-den-premiere-p%C3%A5-prestigefyldt-festival,Politiken,https://politiken.dk/nyheder/,"Hold dig opdateret pÃ¥ de seneste nyheder pÃ¥ politiken.dk: Seneste Politiken, Seneste Danmark, Seneste Kultur og Seneste Internationalt. ",Politiken,https://politiken.dk/nyheder/,12.12.2022 07:20
"5 hjerter fra Kim Skotte: Der er ikke meget, der kan måle sig med en musical som denne",08.12.2022 00:00,,https://politiken.dk/kultur/art9108131/Der-er-ikke-meget-der-kan-m%C3%A5le-sig-med-en-musical-som-denne,Politiken,https://politiken.dk/nyheder/,"Hold dig opdateret pÃ¥ de seneste nyheder pÃ¥ politiken.dk: Seneste Politiken, Seneste Danmark, Seneste Kultur og Seneste Internationalt. ",Politiken,https://politiken.dk/nyheder/,12.12.2022 07:20
"Var kong Charles andet end en kluntet klodsmajor, da han var prins?",08.12.2022 00:00,,https://politiken.dk/kultur/set_og_hoert/art8977161/Var-kong-Charles-andet-end-en-kluntet-klodsmajor-da-han-var-prins,Politiken,https://politiken.dk/nyheder/,"Hold dig opdateret pÃ¥ de seneste nyheder pÃ¥ politiken.dk: Seneste Politiken, Seneste Danmark, Seneste Kultur og Seneste Internationalt. ",Politiken,https://politiken.dk/nyheder/,12.12.2022 07:20
I Albertslund koster borgmesterportrættet 200 kroner. I Rudersdal vil man bruge 250 ... tusinde,08.12.2022 00:00,,https://politiken.dk/kultur/kunst/art9113782/I-Albertslund-koster-borgmesterportr%C3%A6ttet-200-kroner.-I-Rudersdal-vil-man-bruge-250-...-tusinde,Politiken,https://politiken.dk/nyheder/,"Hold dig opdateret pÃ¥ de seneste nyheder pÃ¥ politiken.dk: Seneste Politiken, Seneste Danmark, Seneste Kultur og Seneste Internationalt. ",Politiken,https://politiken.dk/nyheder/,12.12.2022 07:20
»Før havde jeg det fint med at sidde derhjemme og kigge ind i en væg«,08.12.2022 00:00,,https://politiken.dk/kultur/art9064364/%C2%BBF%C3%B8r-havde-jeg-det-fint-med-at-sidde-derhjemme-og-kigge-ind-i-en-v%C3%A6g%C2%AB,Politiken,https://politiken.dk/nyheder/,"Hold dig opdateret pÃ¥ de seneste nyheder pÃ¥ politiken.dk: Seneste Politiken, Seneste Danmark, Seneste Kultur og Seneste Internationalt. ",Politiken,https://politiken.dk/nyheder/,12.12.2022 07:20
Mediernes angreb på DR er forfejlet,08.12.2022 00:00,,https://politiken.dk/kultur/medier/art9061669/Mediernes-angreb-p%C3%A5-DR-er-forfejlet,Politiken,https://politiken.dk/nyheder/,"Hold dig opdateret pÃ¥ de seneste nyheder pÃ¥ politiken.dk: Seneste Politiken, Seneste Danmark, Seneste Kultur og Seneste Internationalt. ",Politiken,https://politiken.dk/nyheder/,12.12.2022 07:20
Hvor langt vil du gå for at få et barn?,07.12.2022 00:00,,https://politiken.dk/kultur/film_og_tv/art8918830/Hvor-langt-vil-du-g%C3%A5-for-at-f%C3%A5-et-barn,Politiken,https://politiken.dk/nyheder/,"Hold dig opdateret pÃ¥ de seneste nyheder pÃ¥ politiken.dk: Seneste Politiken, Seneste Danmark, Seneste Kultur og Seneste Internationalt. ",Politiken,https://politiken.dk/nyheder/,12.12.2022 07:20
Ny bog giver os en perlerække af uventede indblik i Putins psyke,07.12.2022 00:00,,https://politiken.dk/kultur/boger/art9110256/Ny-bog-giver-os-en-perler%C3%A6kke-af-uventede-indblik-i-Putins-psyke,Politiken,https://politiken.dk/nyheder/,"Hold dig opdateret pÃ¥ de seneste nyheder pÃ¥ politiken.dk: Seneste Politiken, Seneste Danmark, Seneste Kultur og Seneste Internationalt. ",Politiken,https://politiken.dk/nyheder/,12.12.2022 07:20
"Det fik en opblomstring under corona, og der er stadig mere at hente i det univers",07.12.2022 00:00,,https://politiken.dk/kultur/set_og_hoert/art8977127/Det-fik-en-opblomstring-under-corona-og-der-er-stadig-mere-at-hente-i-det-univers,Politiken,https://politiken.dk/nyheder/,"Hold dig opdateret pÃ¥ de seneste nyheder pÃ¥ politiken.dk: Seneste Politiken, Seneste Danmark, Seneste Kultur og Seneste Internationalt. ",Politiken,https://politiken.dk/nyheder/,12.12.2022 07:20
"De danske anmeldere aner ikke, hvilket ben de skal stå på",07.12.2022 00:00,,https://politiken.dk/kultur/boger/art9109378/De-danske-anmeldere-aner-ikke-hvilket-ben-de-skal-st%C3%A5-p%C3%A5,Politiken,https://politiken.dk/nyheder/,"Hold dig opdateret pÃ¥ de seneste nyheder pÃ¥ politiken.dk: Seneste Politiken, Seneste Danmark, Seneste Kultur og Seneste Internationalt. ",Politiken,https://politiken.dk/nyheder/,12.12.2022 07:20
Advokater bag Sankt Annæ-undersøgelse får alvorlig kritik,07.12.2022 00:00,,https://politiken.dk/kultur/art9113056/Advokater-bag-Sankt-Ann%C3%A6-unders%C3%B8gelse-f%C3%A5r-alvorlig-kritik,Politiken,https://politiken.dk/nyheder/,"Hold dig opdateret pÃ¥ de seneste nyheder pÃ¥ politiken.dk: Seneste Politiken, Seneste Danmark, Seneste Kultur og Seneste Internationalt. ",Politiken,https://politiken.dk/nyheder/,12.12.2022 07:20
Herman Bangs gammeljomfru er skiftet ud med den røde dominatrix,07.12.2022 00:00,,https://politiken.dk/kultur/scene/art9108335/Herman-Bangs-gammeljomfru-er-skiftet-ud-med-den-r%C3%B8de-dominatrix,Politiken,https://politiken.dk/nyheder/,"Hold dig opdateret pÃ¥ de seneste nyheder pÃ¥ politiken.dk: Seneste Politiken, Seneste Danmark, Seneste Kultur og Seneste Internationalt. ",Politiken,https://politiken.dk/nyheder/,12.12.2022 07:20
Begejstringen for monstrene smitter i skandinavisk stjerneinstruktørs Netflix-basker,07.12.2022 00:00,,https://politiken.dk/kultur/film_og_tv/art8996110/Begejstringen-for-monstrene-smitter-i-skandinavisk-stjerneinstrukt%C3%B8rs-Netflix-basker,Politiken,https://politiken.dk/nyheder/,"Hold dig opdateret pÃ¥ de seneste nyheder pÃ¥ politiken.dk: Seneste Politiken, Seneste Danmark, Seneste Kultur og Seneste Internationalt. ",Politiken,https://politiken.dk/nyheder/,12.12.2022 07:20
Iran henretter ung mand efter protester mod præstestyret,01.12.2022 00:00,,https://politiken.dk/udland/art9118543/Iran-henretter-ung-mand-efter-protester-mod-pr%C3%A6stestyret,Politiken,https://politiken.dk/nyheder/,"Hold dig opdateret pÃ¥ de seneste nyheder pÃ¥ politiken.dk: Seneste Politiken, Seneste Danmark, Seneste Kultur og Seneste Internationalt. ",Politiken,https://politiken.dk/nyheder/,12.12.2022 07:20
Ny lov: Afviste asylansøgere skal ud af Frankrig i ekspresfart,01.12.2022 00:00,,https://politiken.dk/udland/art9112557/Ny-lov-Afviste-asylans%C3%B8gere-skal-ud-af-Frankrig-i-ekspresfart,Politiken,https://politiken.dk/nyheder/,"Hold dig opdateret pÃ¥ de seneste nyheder pÃ¥ politiken.dk: Seneste Politiken, Seneste Danmark, Seneste Kultur og Seneste Internationalt. ",Politiken,https://politiken.dk/nyheder/,12.12.2022 07:20
USAs finansminister forventer lavere inflation næste år,02.12.2022 00:00,,https://politiken.dk/udland/art9118512/USAs-finansminister-forventer-lavere-inflation-n%C3%A6ste-%C3%A5r,Politiken,https://politiken.dk/nyheder/,"Hold dig opdateret pÃ¥ de seneste nyheder pÃ¥ politiken.dk: Seneste Politiken, Seneste Danmark, Seneste Kultur og Seneste Internationalt. ",Politiken,https://politiken.dk/nyheder/,12.12.2022 07:20
Peruanske demonstranter kræver fængslet ekspræsident løsladt,02.12.2022 00:00,,https://politiken.dk/udland/art9118507/Peruanske-demonstranter-kr%C3%A6ver-f%C3%A6ngslet-ekspr%C3%A6sident-l%C3%B8sladt,Politiken,https://politiken.dk/nyheder/,"Hold dig opdateret pÃ¥ de seneste nyheder pÃ¥ politiken.dk: Seneste Politiken, Seneste Danmark, Seneste Kultur og Seneste Internationalt. ",Politiken,https://politiken.dk/nyheder/,12.12.2022 07:20
27 dødfundne migranter i Zambia menes at være døde af sult,02.12.2022 00:00,,https://politiken.dk/udland/art9118502/27-d%C3%B8dfundne-migranter-i-Zambia-menes-at-v%C3%A6re-d%C3%B8de-af-sult,Politiken,https://politiken.dk/nyheder/,"Hold dig opdateret pÃ¥ de seneste nyheder pÃ¥ politiken.dk: Seneste Politiken, Seneste Danmark, Seneste Kultur og Seneste Internationalt. ",Politiken,https://politiken.dk/nyheder/,12.12.2022 07:20
Kina sender corona-app på pension efter mere end to år,02.12.2022 00:00,,https://politiken.dk/udland/art9118516/Kina-sender-corona-app-p%C3%A5-pension-efter-mere-end-to-%C3%A5r,Politiken,https://politiken.dk/nyheder/,"Hold dig opdateret pÃ¥ de seneste nyheder pÃ¥ politiken.dk: Seneste Politiken, Seneste Danmark, Seneste Kultur og Seneste Internationalt. ",Politiken,https://politiken.dk/nyheder/,12.12.2022 07:20
Biden lover Zelenskyj at styrke Ukraines luftforsvar,02.12.2022 00:00,,https://politiken.dk/udland/art9118510/Biden-lover-Zelenskyj-at-styrke-Ukraines-luftforsvar,Politiken,https://politiken.dk/nyheder/,"Hold dig opdateret pÃ¥ de seneste nyheder pÃ¥ politiken.dk: Seneste Politiken, Seneste Danmark, Seneste Kultur og Seneste Internationalt. ",Politiken,https://politiken.dk/nyheder/,12.12.2022 07:20
»Jeg slår jer alle sammen ihjel«: Mand skyder og dræber tre kvinder på beboermøde i Rom,11.12.2022 00:00,,https://politiken.dk/udland/art9118454/Mand-skyder-og-dr%C3%A6ber-tre-kvinder-p%C3%A5-beboerm%C3%B8de-i-Rom,Politiken,https://politiken.dk/nyheder/,"Hold dig opdateret pÃ¥ de seneste nyheder pÃ¥ politiken.dk: Seneste Politiken, Seneste Danmark, Seneste Kultur og Seneste Internationalt. ",Politiken,https://politiken.dk/nyheder/,12.12.2022 07:20
Denne gang står Viktor OrbÃ¡n fuldstændig mutters alene. Selv polakkerne er rasende på ham,12.12.2022 00:00,,https://politiken.dk/udland/art9114452/Denne-gang-st%C3%A5r-Viktor-Orb%C3%A1n-fuldst%C3%A6ndig-mutters-alene.-Selv-polakkerne-er-rasende-p%C3%A5-ham,Politiken,https://politiken.dk/nyheder/,"Hold dig opdateret pÃ¥ de seneste nyheder pÃ¥ politiken.dk: Seneste Politiken, Seneste Danmark, Seneste Kultur og Seneste Internationalt. ",Politiken,https://politiken.dk/nyheder/,12.12.2022 07:20
Mand mistænkt for Lockerbie-bombe fængslet i USA,16.12.2022 00:00,,https://politiken.dk/udland/art9118281/Mand-mist%C3%A6nkt-for-Lockerbie-bombe-f%C3%A6ngslet-i-USA,Politiken,https://politiken.dk/nyheder/,"Hold dig opdateret pÃ¥ de seneste nyheder pÃ¥ politiken.dk: Seneste Politiken, Seneste Danmark, Seneste Kultur og Seneste Internationalt. ",Politiken,https://politiken.dk/nyheder/,12.12.2022 07:20
Daniel Ellsberg advarer om risiko for dommedagsscenario - medmindre Rusland og Ukraine indleder forhandlinger,19.12.2022 00:00,,https://politiken.dk/udland/art9077513/Daniel-Ellsberg-advarer-om-risiko-for-dommedagsscenario-%E2%80%93-medmindre-Rusland-og-Ukraine-indleder-forhandlinger,Politiken,https://politiken.dk/nyheder/,"Hold dig opdateret pÃ¥ de seneste nyheder pÃ¥ politiken.dk: Seneste Politiken, Seneste Danmark, Seneste Kultur og Seneste Internationalt. ",Politiken,https://politiken.dk/nyheder/,12.12.2022 07:20
