title,published,text,link,og:site_name,og:url,site_description,name,url,scrape_time
Fogh: Vent med at fjerne store bededag til efter et valg,28.01.2023 00:00,,https://politiken.dk/indland/art9185984/Vent-med-at-fjerne-store-bededag-til-efter-et-valg,Politiken,https://politiken.dk/nyheder/,"Hold dig opdateret pÃ¥ de seneste nyheder pÃ¥ politiken.dk: Seneste Politiken, Seneste Danmark, Seneste Kultur og Seneste Internationalt. ",Politiken,https://politiken.dk/nyheder/,27.01.2023 07:17
70-årig advokat hiver Domstolsstyrelsen i retten for ulovlig aldersdiskrimination. Nu fjerner styrelsen aldersgrænse,28.01.2023 00:00,,https://politiken.dk/indland/art9180553/70-%C3%A5rig-advokat-hiver-Domstolsstyrelsen-i-retten-for-ulovlig-aldersdiskrimination.-Nu-fjerner-styrelsen-aldersgr%C3%A6nse,Politiken,https://politiken.dk/nyheder/,"Hold dig opdateret pÃ¥ de seneste nyheder pÃ¥ politiken.dk: Seneste Politiken, Seneste Danmark, Seneste Kultur og Seneste Internationalt. ",Politiken,https://politiken.dk/nyheder/,27.01.2023 07:17
Kosovo kræver bistandsmillioner for fængselsaftale,28.01.2023 00:00,,https://politiken.dk/indland/politik/art9185935/Kosovo-kr%C3%A6ver-bistandsmillioner-for-f%C3%A6ngselsaftale,Politiken,https://politiken.dk/nyheder/,"Hold dig opdateret pÃ¥ de seneste nyheder pÃ¥ politiken.dk: Seneste Politiken, Seneste Danmark, Seneste Kultur og Seneste Internationalt. ",Politiken,https://politiken.dk/nyheder/,27.01.2023 07:17
Ellemann om ultimatum: Vi er kommet videre,28.01.2023 00:00,,https://politiken.dk/indland/politik/art9185814/Vi-er-kommet-videre,Politiken,https://politiken.dk/nyheder/,"Hold dig opdateret pÃ¥ de seneste nyheder pÃ¥ politiken.dk: Seneste Politiken, Seneste Danmark, Seneste Kultur og Seneste Internationalt. ",Politiken,https://politiken.dk/nyheder/,27.01.2023 07:17
Ellemann vil have værnepligt for kvinder,28.01.2023 00:00,,https://politiken.dk/indland/art9185818/Ellemann-vil-have-v%C3%A6rnepligt-for-kvinder,Politiken,https://politiken.dk/nyheder/,"Hold dig opdateret pÃ¥ de seneste nyheder pÃ¥ politiken.dk: Seneste Politiken, Seneste Danmark, Seneste Kultur og Seneste Internationalt. ",Politiken,https://politiken.dk/nyheder/,27.01.2023 07:17
28-årig betegner drab i Dragør som nødværge,28.01.2023 00:00,,https://politiken.dk/indland/art9185696/28-%C3%A5rig-betegner-drab-i-Drag%C3%B8r-som-n%C3%B8dv%C3%A6rge,Politiken,https://politiken.dk/nyheder/,"Hold dig opdateret pÃ¥ de seneste nyheder pÃ¥ politiken.dk: Seneste Politiken, Seneste Danmark, Seneste Kultur og Seneste Internationalt. ",Politiken,https://politiken.dk/nyheder/,27.01.2023 07:17
Ellemann har orienteret ordførere om kritisk og censureret Nato-rapport,28.01.2023 00:00,,https://politiken.dk/indland/art9185708/Ellemann-har-orienteret-ordf%C3%B8rere-om-kritisk-og-censureret-Nato-rapport,Politiken,https://politiken.dk/nyheder/,"Hold dig opdateret pÃ¥ de seneste nyheder pÃ¥ politiken.dk: Seneste Politiken, Seneste Danmark, Seneste Kultur og Seneste Internationalt. ",Politiken,https://politiken.dk/nyheder/,27.01.2023 07:17
Fristen er udløbet: Lars Boje Mathiesen er eneste formandskandidat,28.01.2023 00:00,,https://politiken.dk/indland/politik/art9185421/Lars-Boje-Mathiesen-er-eneste-formandskandidat,Politiken,https://politiken.dk/nyheder/,"Hold dig opdateret pÃ¥ de seneste nyheder pÃ¥ politiken.dk: Seneste Politiken, Seneste Danmark, Seneste Kultur og Seneste Internationalt. ",Politiken,https://politiken.dk/nyheder/,27.01.2023 07:17
Fuld kaptajn får bøde for grundstødning ud for Bornholm,28.01.2023 00:00,,https://politiken.dk/indland/art9185168/Fuld-kaptajn-f%C3%A5r-b%C3%B8de-for-grundst%C3%B8dning-ud-for-Bornholm,Politiken,https://politiken.dk/nyheder/,"Hold dig opdateret pÃ¥ de seneste nyheder pÃ¥ politiken.dk: Seneste Politiken, Seneste Danmark, Seneste Kultur og Seneste Internationalt. ",Politiken,https://politiken.dk/nyheder/,27.01.2023 07:17
Udlændingeminister tror på modtagecenter inden for fem år,28.01.2023 00:00,,https://politiken.dk/indland/art9184713/Udl%C3%A6ndingeminister-tror-p%C3%A5-modtagecenter-inden-for-fem-%C3%A5r,Politiken,https://politiken.dk/nyheder/,"Hold dig opdateret pÃ¥ de seneste nyheder pÃ¥ politiken.dk: Seneste Politiken, Seneste Danmark, Seneste Kultur og Seneste Internationalt. ",Politiken,https://politiken.dk/nyheder/,27.01.2023 07:17
Kompromis sætter højtprofileret Rwanda-plan på pause,28.01.2023 00:00,,https://politiken.dk/indland/art9184149/Kompromis-s%C3%A6tter-h%C3%B8jtprofileret-Rwanda-plan-p%C3%A5-pause,Politiken,https://politiken.dk/nyheder/,"Hold dig opdateret pÃ¥ de seneste nyheder pÃ¥ politiken.dk: Seneste Politiken, Seneste Danmark, Seneste Kultur og Seneste Internationalt. ",Politiken,https://politiken.dk/nyheder/,27.01.2023 07:17
Mand omkommet i lejlighedsbrand på Frederiksberg,28.01.2023 00:00,,https://politiken.dk/indland/art9184055/Mand-omkommet-i-lejlighedsbrand-p%C3%A5-Frederiksberg,Politiken,https://politiken.dk/nyheder/,"Hold dig opdateret pÃ¥ de seneste nyheder pÃ¥ politiken.dk: Seneste Politiken, Seneste Danmark, Seneste Kultur og Seneste Internationalt. ",Politiken,https://politiken.dk/nyheder/,27.01.2023 07:17
Grovhed overtrumfer aldersrabat: 88-årig idømt tre års fængsel for overgreb,28.01.2023 00:00,,https://politiken.dk/indland/art9184010/88-%C3%A5rig-id%C3%B8mt-tre-%C3%A5rs-f%C3%A6ngsel-for-overgreb,Politiken,https://politiken.dk/nyheder/,"Hold dig opdateret pÃ¥ de seneste nyheder pÃ¥ politiken.dk: Seneste Politiken, Seneste Danmark, Seneste Kultur og Seneste Internationalt. ",Politiken,https://politiken.dk/nyheder/,27.01.2023 07:17
"Mennesker som Fateh er låst fast i deres misbrug, fordi hjælpen er flere kilometer væk",24.01.2023 00:00,,https://politiken.dk/indland/art9174735/Mennesker-som-Fateh-er-l%C3%A5st-fast-i-deres-misbrug-fordi-hj%C3%A6lpen-er-flere-kilometer-v%C3%A6k,Politiken,https://politiken.dk/nyheder/,"Hold dig opdateret pÃ¥ de seneste nyheder pÃ¥ politiken.dk: Seneste Politiken, Seneste Danmark, Seneste Kultur og Seneste Internationalt. ",Politiken,https://politiken.dk/nyheder/,27.01.2023 07:17
Ãndring af 130 år gammel lov skal justere tiden i Danmark,24.01.2023 00:00,,https://politiken.dk/indland/art9183767/%C3%86ndring-af-130-%C3%A5r-gammel-lov-skal-justere-tiden-i-Danmark,Politiken,https://politiken.dk/nyheder/,"Hold dig opdateret pÃ¥ de seneste nyheder pÃ¥ politiken.dk: Seneste Politiken, Seneste Danmark, Seneste Kultur og Seneste Internationalt. ",Politiken,https://politiken.dk/nyheder/,27.01.2023 07:17
Ãl efter vin giver mig de værste tømmermænd. Er der en god forklaring?,24.01.2023 00:00,,https://politiken.dk/forbrugogliv/sundhedogmotion/art9170293/%C3%98l-efter-vin-giver-mig-de-v%C3%A6rste-t%C3%B8mmerm%C3%A6nd.-Er-der-en-god-forklaring,Politiken,https://politiken.dk/nyheder/,"Hold dig opdateret pÃ¥ de seneste nyheder pÃ¥ politiken.dk: Seneste Politiken, Seneste Danmark, Seneste Kultur og Seneste Internationalt. ",Politiken,https://politiken.dk/nyheder/,27.01.2023 07:17
Elisabet Svane: Partiet er i »yderst store vanskeligheder«,24.01.2023 00:00,,https://politiken.dk/indland/art9183587/Partiet-er-i-%C2%BByderst-store-vanskeligheder%C2%AB,Politiken,https://politiken.dk/nyheder/,"Hold dig opdateret pÃ¥ de seneste nyheder pÃ¥ politiken.dk: Seneste Politiken, Seneste Danmark, Seneste Kultur og Seneste Internationalt. ",Politiken,https://politiken.dk/nyheder/,27.01.2023 07:17
Det Etiske Råd anbefaler at lempe loven om rugemødre,24.01.2023 00:00,,https://politiken.dk/indland/art9183744/Det-Etiske-R%C3%A5d-anbefaler-at-lempe-loven-om-rugem%C3%B8dre,Politiken,https://politiken.dk/nyheder/,"Hold dig opdateret pÃ¥ de seneste nyheder pÃ¥ politiken.dk: Seneste Politiken, Seneste Danmark, Seneste Kultur og Seneste Internationalt. ",Politiken,https://politiken.dk/nyheder/,27.01.2023 07:17
Overlæge slår fast: Plejehjemsbeboere fik medicin der kan slå ihjel,24.01.2023 00:00,,https://politiken.dk/indland/art9183631/Plejehjemsbeboere-fik-medicin-der-kan-sl%C3%A5-ihjel,Politiken,https://politiken.dk/nyheder/,"Hold dig opdateret pÃ¥ de seneste nyheder pÃ¥ politiken.dk: Seneste Politiken, Seneste Danmark, Seneste Kultur og Seneste Internationalt. ",Politiken,https://politiken.dk/nyheder/,27.01.2023 07:17
"Mette Thiesen: Vejen til DF er kortere, når Mikkel Bjørn er med",24.01.2023 00:00,,https://politiken.dk/indland/politik/art9183684/Vejen-til-DF-er-kortere-n%C3%A5r-Mikkel-Bj%C3%B8rn-er-med,Politiken,https://politiken.dk/nyheder/,"Hold dig opdateret pÃ¥ de seneste nyheder pÃ¥ politiken.dk: Seneste Politiken, Seneste Danmark, Seneste Kultur og Seneste Internationalt. ",Politiken,https://politiken.dk/nyheder/,27.01.2023 07:17
Socialdemokrat: Ungdomshuset må sige undskyld,24.01.2023 00:00,,https://politiken.dk/indland/art9182724/Socialdemokrat-Ungdomshuset-m%C3%A5-sige-undskyld,Politiken,https://politiken.dk/nyheder/,"Hold dig opdateret pÃ¥ de seneste nyheder pÃ¥ politiken.dk: Seneste Politiken, Seneste Danmark, Seneste Kultur og Seneste Internationalt. ",Politiken,https://politiken.dk/nyheder/,27.01.2023 07:17
»Der efterlades ikke meget plads til samarbejde«: Formandsfavorit er årsag til exit og uro i Nye Borgerlige,24.01.2023 00:00,,https://politiken.dk/indland/politik/art9182992/Formandsfavorit-er-%C3%A5rsag-til-exit-og-uro-i-Nye-Borgerlige,Politiken,https://politiken.dk/nyheder/,"Hold dig opdateret pÃ¥ de seneste nyheder pÃ¥ politiken.dk: Seneste Politiken, Seneste Danmark, Seneste Kultur og Seneste Internationalt. ",Politiken,https://politiken.dk/nyheder/,27.01.2023 07:17
Mikkel Bjørn følte sig truet med eksklusion og oplevede »dybt bekymrende« retning fra Lars Boje,24.01.2023 00:00,,https://politiken.dk/indland/politik/art9183033/Mikkel-Bj%C3%B8rn-f%C3%B8lte-sig-truet-med-eksklusion-og-oplevede-%C2%BBdybt-bekymrende%C2%AB-retning-fra-Lars-Boje,Politiken,https://politiken.dk/nyheder/,"Hold dig opdateret pÃ¥ de seneste nyheder pÃ¥ politiken.dk: Seneste Politiken, Seneste Danmark, Seneste Kultur og Seneste Internationalt. ",Politiken,https://politiken.dk/nyheder/,27.01.2023 07:17
"En smånymfes bekendelser: »Så længe jeg ikke har vished for min skønhed, kan jeg ikke føle lyst«",02.01.2023 00:00,,https://politiken.dk/podcast/bogfolk/art9180763/%C2%BBS%C3%A5-l%C3%A6nge-jeg-ikke-har-vished-for-min-sk%C3%B8nhed-kan-jeg-ikke-f%C3%B8le-lyst%C2%AB,Politiken,https://politiken.dk/nyheder/,"Hold dig opdateret pÃ¥ de seneste nyheder pÃ¥ politiken.dk: Seneste Politiken, Seneste Danmark, Seneste Kultur og Seneste Internationalt. ",Politiken,https://politiken.dk/nyheder/,27.01.2023 07:17
Vi sagde det også i 2022 ... det holder stadig: Et smukkere dansk jazzalbum kommer du ikke til at høre i år,09.01.2023 00:00,,https://politiken.dk/kultur/musik/art9170267/Vi-sagde-det-ogs%C3%A5-i-2022-...-det-holder-stadig-Et-smukkere-dansk-jazzalbum-kommer-du-ikke-til-at-h%C3%B8re-i-%C3%A5r,Politiken,https://politiken.dk/nyheder/,"Hold dig opdateret pÃ¥ de seneste nyheder pÃ¥ politiken.dk: Seneste Politiken, Seneste Danmark, Seneste Kultur og Seneste Internationalt. ",Politiken,https://politiken.dk/nyheder/,27.01.2023 07:17
"Christian Bengtson: »Hele min barndom har jeg leget med dem i bunden af samfundet, og at jeg nu leger med dem på toppen. Der er bare så uendelig langt«",12.01.2023 00:00,,https://politiken.dk/kultur/art9151072/Christian-Bengtson-%C2%BBHele-min-barndom-har-jeg-leget-med-dem-i-bunden-af-samfundet-og-at-jeg-nu-leger-med-dem-p%C3%A5-toppen.-Der-er-bare-s%C3%A5-uendelig-langt%C2%AB,Politiken,https://politiken.dk/nyheder/,"Hold dig opdateret pÃ¥ de seneste nyheder pÃ¥ politiken.dk: Seneste Politiken, Seneste Danmark, Seneste Kultur og Seneste Internationalt. ",Politiken,https://politiken.dk/nyheder/,27.01.2023 07:17
Jesper Wung-Sung har forstemmende lidt at byde på i sin nye bog,13.01.2023 00:00,,https://politiken.dk/kultur/boger/art9182134/Jesper-Wung-Sung-har-forstemmende-lidt-at-byde-p%C3%A5-i-sin-nye-bog,Politiken,https://politiken.dk/nyheder/,"Hold dig opdateret pÃ¥ de seneste nyheder pÃ¥ politiken.dk: Seneste Politiken, Seneste Danmark, Seneste Kultur og Seneste Internationalt. ",Politiken,https://politiken.dk/nyheder/,27.01.2023 07:17
"»Hvis du råber ad mig, begynder jeg jo at græde«, svarer den lille pige, hvortil hun med et overdøvende »UD!« bortvises",14.01.2023 00:00,,https://politiken.dk/kultur/set_og_hoert/art9138339/%C2%BBHvis-du-r%C3%A5ber-ad-mig-begynder-jeg-jo-at-gr%C3%A6de%C2%AB-svarer-den-lille-pige-hvortil-hun-med-et-overd%C3%B8vende-%C2%BBUD%C2%AB-bortvises,Politiken,https://politiken.dk/nyheder/,"Hold dig opdateret pÃ¥ de seneste nyheder pÃ¥ politiken.dk: Seneste Politiken, Seneste Danmark, Seneste Kultur og Seneste Internationalt. ",Politiken,https://politiken.dk/nyheder/,27.01.2023 07:17
»Det var som en krigszone«: Deltagere klager over Netflix-optagelser til -Squid Game--realityshow,14.01.2023 00:00,,https://politiken.dk/kultur/film_og_tv/art9186042/%C2%BBDet-var-som-en-krigszone%C2%AB-Deltagere-klager-over-Netflix-optagelser-til-%E2%80%99Squid-Game%E2%80%99-realityshow,Politiken,https://politiken.dk/nyheder/,"Hold dig opdateret pÃ¥ de seneste nyheder pÃ¥ politiken.dk: Seneste Politiken, Seneste Danmark, Seneste Kultur og Seneste Internationalt. ",Politiken,https://politiken.dk/nyheder/,27.01.2023 07:17
»Det her handler ikke om populisme eller meningsmålinger«: Kulturminister redder Dannebrog ved Kronborg Slot på 43 minutter,15.01.2023 00:00,,https://politiken.dk/kultur/art9187657/%C2%BBDet-her-handler-ikke-om-populisme-eller-meningsm%C3%A5linger%C2%AB-Kulturminister-redder-Dannebrog-ved-Kronborg-Slot-p%C3%A5-43-minutter,Politiken,https://politiken.dk/nyheder/,"Hold dig opdateret pÃ¥ de seneste nyheder pÃ¥ politiken.dk: Seneste Politiken, Seneste Danmark, Seneste Kultur og Seneste Internationalt. ",Politiken,https://politiken.dk/nyheder/,27.01.2023 07:17
Kovending: 24syv-direktør lægger sig fladt ned,16.01.2023 00:00,,https://politiken.dk/kultur/medier/art9186393/Kovending-24syv-direkt%C3%B8r-l%C3%A6gger-sig-fladt-ned,Politiken,https://politiken.dk/nyheder/,"Hold dig opdateret pÃ¥ de seneste nyheder pÃ¥ politiken.dk: Seneste Politiken, Seneste Danmark, Seneste Kultur og Seneste Internationalt. ",Politiken,https://politiken.dk/nyheder/,27.01.2023 07:17
Ritt Bjerregaard giver det sidste ord til Mikael Bertelsen,16.01.2023 00:00,,https://politiken.dk/kultur/art9187398/Ritt-Bjerregaard-giver-det-sidste-ord-til-Mikael-Bertelsen,Politiken,https://politiken.dk/nyheder/,"Hold dig opdateret pÃ¥ de seneste nyheder pÃ¥ politiken.dk: Seneste Politiken, Seneste Danmark, Seneste Kultur og Seneste Internationalt. ",Politiken,https://politiken.dk/nyheder/,27.01.2023 07:17
Denne film fortæller overbevisende om livet som blind,17.01.2023 00:00,,https://politiken.dk/kultur/film_og_tv/art9171399/Denne-film-fort%C3%A6ller-overbevisende-om-livet-som-blind,Politiken,https://politiken.dk/nyheder/,"Hold dig opdateret pÃ¥ de seneste nyheder pÃ¥ politiken.dk: Seneste Politiken, Seneste Danmark, Seneste Kultur og Seneste Internationalt. ",Politiken,https://politiken.dk/nyheder/,27.01.2023 07:17
Overblik: Her er alle de Oscar-nominerede film - og hvor du kan se dem,18.01.2023 00:00,,https://politiken.dk/kultur/film_og_tv/art9175023/Overblik-Her-er-alle-de-Oscar-nominerede-film-og-hvor-du-kan-se-dem,Politiken,https://politiken.dk/nyheder/,"Hold dig opdateret pÃ¥ de seneste nyheder pÃ¥ politiken.dk: Seneste Politiken, Seneste Danmark, Seneste Kultur og Seneste Internationalt. ",Politiken,https://politiken.dk/nyheder/,27.01.2023 07:17
"Det sproglige fingeraftryk afslører, hvor meget Clinton-parret selv har skrevet af deres bestsellere",18.01.2023 00:00,,https://politiken.dk/kultur/boger/art9180555/Det-sproglige-fingeraftryk-afsl%C3%B8rer-hvor-meget-Clinton-parret-selv-har-skrevet-af-deres-bestsellere,Politiken,https://politiken.dk/nyheder/,"Hold dig opdateret pÃ¥ de seneste nyheder pÃ¥ politiken.dk: Seneste Politiken, Seneste Danmark, Seneste Kultur og Seneste Internationalt. ",Politiken,https://politiken.dk/nyheder/,27.01.2023 07:17
"Er hun her om et halvt år? Måske ikke. Så nyd festen, så længe den varer",20.01.2023 00:00,,https://politiken.dk/kultur/musik/art9180990/Er-hun-her-om-et-halvt-%C3%A5r-M%C3%A5ske-ikke.-S%C3%A5-nyd-festen-s%C3%A5-l%C3%A6nge-den-varer,Politiken,https://politiken.dk/nyheder/,"Hold dig opdateret pÃ¥ de seneste nyheder pÃ¥ politiken.dk: Seneste Politiken, Seneste Danmark, Seneste Kultur og Seneste Internationalt. ",Politiken,https://politiken.dk/nyheder/,27.01.2023 07:17
Streaming overhaler flow-tv for første gang nogensinde,21.01.2023 00:00,,https://politiken.dk/kultur/medier/art9186285/Streaming-overhaler-flow-tv-for-f%C3%B8rste-gang-nogensinde,Politiken,https://politiken.dk/nyheder/,"Hold dig opdateret pÃ¥ de seneste nyheder pÃ¥ politiken.dk: Seneste Politiken, Seneste Danmark, Seneste Kultur og Seneste Internationalt. ",Politiken,https://politiken.dk/nyheder/,27.01.2023 07:17
A hva- for noget? Må man nu heller ikke sige -mumie- længere?,22.01.2023 00:00,,https://politiken.dk/kultur/art9184594/A-hva%E2%80%99-for-noget-M%C3%A5-man-nu-heller-ikke-sige-%E2%80%99mumie%E2%80%99-l%C3%A6ngere,Politiken,https://politiken.dk/nyheder/,"Hold dig opdateret pÃ¥ de seneste nyheder pÃ¥ politiken.dk: Seneste Politiken, Seneste Danmark, Seneste Kultur og Seneste Internationalt. ",Politiken,https://politiken.dk/nyheder/,27.01.2023 07:17
5 hjerter: Han ligner mere og mere en arvtager til Coen-brødrene,28.01.2023 00:00,,https://politiken.dk/kultur/film_og_tv/art9148647/Han-ligner-mere-og-mere-en-arvtager-til-Coen-br%C3%B8drene,Politiken,https://politiken.dk/nyheder/,"Hold dig opdateret pÃ¥ de seneste nyheder pÃ¥ politiken.dk: Seneste Politiken, Seneste Danmark, Seneste Kultur og Seneste Internationalt. ",Politiken,https://politiken.dk/nyheder/,27.01.2023 07:17
Kritisk BBC-dokumentar anklager premierminister for at være medskyldig i massakre. Nu bandlyses den,28.01.2023 00:00,,https://politiken.dk/kultur/art9181203/Kritisk-BBC-dokumentar-anklager-premierminister-for-at-v%C3%A6re-medskyldig-i-massakre.-Nu-bandlyses-den,Politiken,https://politiken.dk/nyheder/,"Hold dig opdateret pÃ¥ de seneste nyheder pÃ¥ politiken.dk: Seneste Politiken, Seneste Danmark, Seneste Kultur og Seneste Internationalt. ",Politiken,https://politiken.dk/nyheder/,27.01.2023 07:17
Hvad stiller man op med to mesterforførere lige før lukketid?,28.01.2023 00:00,,https://politiken.dk/kultur/scene/art9181362/Hvad-stiller-man-op-med-to-mesterforf%C3%B8rere-lige-f%C3%B8r-lukketid,Politiken,https://politiken.dk/nyheder/,"Hold dig opdateret pÃ¥ de seneste nyheder pÃ¥ politiken.dk: Seneste Politiken, Seneste Danmark, Seneste Kultur og Seneste Internationalt. ",Politiken,https://politiken.dk/nyheder/,27.01.2023 07:17
Prisvindende forfatter: Selvfølgelig var det skamfuldt at være flygtning,28.01.2023 00:00,,https://politiken.dk/kultur/boger/art9149979/Selvf%C3%B8lgelig-var-det-skamfuldt-at-v%C3%A6re-flygtning,Politiken,https://politiken.dk/nyheder/,"Hold dig opdateret pÃ¥ de seneste nyheder pÃ¥ politiken.dk: Seneste Politiken, Seneste Danmark, Seneste Kultur og Seneste Internationalt. ",Politiken,https://politiken.dk/nyheder/,27.01.2023 07:17
Jørgen Leth erklærer sin kærlighed til dansk mesterguitarist i ny film,28.01.2023 00:00,,https://politiken.dk/kultur/film_og_tv/art9148649/J%C3%B8rgen-Leth-erkl%C3%A6rer-sin-k%C3%A6rlighed-til-dansk-mesterguitarist-i-ny-film,Politiken,https://politiken.dk/nyheder/,"Hold dig opdateret pÃ¥ de seneste nyheder pÃ¥ politiken.dk: Seneste Politiken, Seneste Danmark, Seneste Kultur og Seneste Internationalt. ",Politiken,https://politiken.dk/nyheder/,27.01.2023 07:17
I 3.000 år har det været et mysterium. Nu er det blevet løst i København,28.01.2023 00:00,,https://politiken.dk/kultur/art9172912/I-3.000-%C3%A5r-har-det-v%C3%A6ret-et-mysterium.-Nu-er-det-blevet-l%C3%B8st-i-K%C3%B8benhavn,Politiken,https://politiken.dk/nyheder/,"Hold dig opdateret pÃ¥ de seneste nyheder pÃ¥ politiken.dk: Seneste Politiken, Seneste Danmark, Seneste Kultur og Seneste Internationalt. ",Politiken,https://politiken.dk/nyheder/,27.01.2023 07:17
»Absurd«: Københavnske film bliver optaget på Fyn og i Jylland,28.01.2023 00:00,,https://politiken.dk/kultur/art9174878/K%C3%B8benhavnske-film-bliver-optaget-p%C3%A5-Fyn-og-i-Jylland,Politiken,https://politiken.dk/nyheder/,"Hold dig opdateret pÃ¥ de seneste nyheder pÃ¥ politiken.dk: Seneste Politiken, Seneste Danmark, Seneste Kultur og Seneste Internationalt. ",Politiken,https://politiken.dk/nyheder/,27.01.2023 07:17
DRs opklaring af havørnedrab er som en vellykket krimi,28.01.2023 00:00,,https://politiken.dk/kultur/set_og_hoert/art9126615/DRs-opklaring-af-hav%C3%B8rnedrab-er-som-en-vellykket-krimi,Politiken,https://politiken.dk/nyheder/,"Hold dig opdateret pÃ¥ de seneste nyheder pÃ¥ politiken.dk: Seneste Politiken, Seneste Danmark, Seneste Kultur og Seneste Internationalt. ",Politiken,https://politiken.dk/nyheder/,27.01.2023 07:17
Mac DeMarcos nye album er ren Ikea-core: Brugsmusik af bedste skuffe. Og perfekt at samle reoler til,28.01.2023 00:00,,https://politiken.dk/kultur/musik/art9170662/Mac-DeMarcos-nye-album-er-ren-Ikea-core-Brugsmusik-af-bedste-skuffe.-Og-perfekt-at-samle-reoler-til,Politiken,https://politiken.dk/nyheder/,"Hold dig opdateret pÃ¥ de seneste nyheder pÃ¥ politiken.dk: Seneste Politiken, Seneste Danmark, Seneste Kultur og Seneste Internationalt. ",Politiken,https://politiken.dk/nyheder/,27.01.2023 07:17
Provokunstners underskrift i højre side af Jorn-maleri viste sig at blive meget dyr,28.01.2023 00:00,,https://politiken.dk/kultur/art9185240/Provokunstners-underskrift-i-h%C3%B8jre-side-af-Jorn-maleri-viste-sig-at-blive-meget-dyr,Politiken,https://politiken.dk/nyheder/,"Hold dig opdateret pÃ¥ de seneste nyheder pÃ¥ politiken.dk: Seneste Politiken, Seneste Danmark, Seneste Kultur og Seneste Internationalt. ",Politiken,https://politiken.dk/nyheder/,27.01.2023 07:17
De nominerede til årets værste film er offentliggjort. Film om Marilyn Monroe kan løbe med otte priser,28.01.2023 00:00,,https://politiken.dk/kultur/film_og_tv/art9183967/De-nominerede-til-%C3%A5rets-v%C3%A6rste-film-er-offentliggjort.-Film-om-Marilyn-Monroe-kan-l%C3%B8be-med-otte-priser,Politiken,https://politiken.dk/nyheder/,"Hold dig opdateret pÃ¥ de seneste nyheder pÃ¥ politiken.dk: Seneste Politiken, Seneste Danmark, Seneste Kultur og Seneste Internationalt. ",Politiken,https://politiken.dk/nyheder/,27.01.2023 07:17
Skaberen af hyldet kultserie smides på porten efter voldssag,28.01.2023 00:00,,https://politiken.dk/kultur/film_og_tv/art9183969/Skaberen-af-hyldet-kultserie-smides-p%C3%A5-porten-efter-voldssag,Politiken,https://politiken.dk/nyheder/,"Hold dig opdateret pÃ¥ de seneste nyheder pÃ¥ politiken.dk: Seneste Politiken, Seneste Danmark, Seneste Kultur og Seneste Internationalt. ",Politiken,https://politiken.dk/nyheder/,27.01.2023 07:17
Henrik Palle: Vejrtricket i Aftenshowet er aldeles irriterende,28.01.2023 00:00,,https://politiken.dk/kultur/set_og_hoert/art9138338/Vejrtricket-i-Aftenshowet-er-aldeles-irriterende,Politiken,https://politiken.dk/nyheder/,"Hold dig opdateret pÃ¥ de seneste nyheder pÃ¥ politiken.dk: Seneste Politiken, Seneste Danmark, Seneste Kultur og Seneste Internationalt. ",Politiken,https://politiken.dk/nyheder/,27.01.2023 07:17
Mike Tyson anklaget for at tæve og voldtage kvinde i limousine,25.01.2023 00:00,,https://politiken.dk/udland/art9183949/Mike-Tyson-anklaget-for-at-t%C3%A6ve-og-voldtage-kvinde-i-limousine,Politiken,https://politiken.dk/nyheder/,"Hold dig opdateret pÃ¥ de seneste nyheder pÃ¥ politiken.dk: Seneste Politiken, Seneste Danmark, Seneste Kultur og Seneste Internationalt. ",Politiken,https://politiken.dk/nyheder/,27.01.2023 07:17
"Magtforsker: Hvis du er i tvivl om, at kongehuset har magt, skal du bare se på, hvor meget de allerrigeste fedter for dem",25.01.2023 00:00,,https://politiken.dk/kultur/art9165599/Hvis-du-er-i-tvivl-om-at-kongehuset-har-magt-skal-du-bare-se-p%C3%A5-hvor-meget-de-allerrigeste-fedter-for-dem,Politiken,https://politiken.dk/nyheder/,"Hold dig opdateret pÃ¥ de seneste nyheder pÃ¥ politiken.dk: Seneste Politiken, Seneste Danmark, Seneste Kultur og Seneste Internationalt. ",Politiken,https://politiken.dk/nyheder/,27.01.2023 07:17
"1, 2, 3, 4, 5, 6: Her er planen mod det store problem i dansk musik",25.01.2023 00:00,,https://politiken.dk/kultur/art9182604/Her-er-planen-mod-det-store-problem-i-dansk-musik,Politiken,https://politiken.dk/nyheder/,"Hold dig opdateret pÃ¥ de seneste nyheder pÃ¥ politiken.dk: Seneste Politiken, Seneste Danmark, Seneste Kultur og Seneste Internationalt. ",Politiken,https://politiken.dk/nyheder/,27.01.2023 07:17
"Jeg var nærmest rystet i min grundvold, fordi deltagerne var blottet for fornuft i en grad, så det blev for meget af det gode",24.01.2023 00:00,,https://politiken.dk/kultur/set_og_hoert/art9138337/Jeg-var-n%C3%A6rmest-rystet-i-min-grundvold-fordi-deltagerne-var-blottet-for-fornuft-i-en-grad-s%C3%A5-det-blev-for-meget-af-det-gode,Politiken,https://politiken.dk/nyheder/,"Hold dig opdateret pÃ¥ de seneste nyheder pÃ¥ politiken.dk: Seneste Politiken, Seneste Danmark, Seneste Kultur og Seneste Internationalt. ",Politiken,https://politiken.dk/nyheder/,27.01.2023 07:17
»Hvordan er du i sengen?«. Ãldres snak om sex og penge hitter på kinesisk tv,24.01.2023 00:00,,https://politiken.dk/kultur/art9170250/%C2%BBHvordan-er-du-i-sengen%C2%AB.-%C3%86ldres-snak-om-sex-og-penge-hitter-p%C3%A5-kinesisk-tv,Politiken,https://politiken.dk/nyheder/,"Hold dig opdateret pÃ¥ de seneste nyheder pÃ¥ politiken.dk: Seneste Politiken, Seneste Danmark, Seneste Kultur og Seneste Internationalt. ",Politiken,https://politiken.dk/nyheder/,27.01.2023 07:17
