title,published,text,link,og:site_name,og:url,site_description,name,url,scrape_time
"Flere anmelder krænkelser på gymnasierne: »Skolerne skal ikke selv begynde at afhøre parterne eller det, der ligner«",11.12.2022 07:00,,https://jyllands-posten.dk/indland/ECE14653165/metoo-og-whistleblowerordninger-har-gjort-det-mere-okay-at-tale-om/,,,"FÃ¥ de seneste nyheder fra ind- og udland om samfund, erhverv, sport og kultur. ",Jyllandsposten,https://jyllands-posten.dk/seneste/,11.12.2022 07:17
Jyllands-Postens journalist advarede Morten Albæk inden interviewet: »Jeg kommer til at gå kritisk til værks«,11.12.2022 06:35,,https://jyllands-posten.dk/kultur/ECE14605203/jeg-tror-paa-at-det-banale-kan-indeholde-nogle-vaesentlige-kvaliteter/,,,"FÃ¥ de seneste nyheder fra ind- og udland om samfund, erhverv, sport og kultur. ",Jyllandsposten,https://jyllands-posten.dk/seneste/,11.12.2022 07:17
Syg sundhed: Dårlig idé at få et hjerteanfald op til jul på ferien til London,11.12.2022 06:10,,https://jyllands-posten.dk/international/europa/ECE14670105/hoej-feber-og-masser-af-benbrud-danmark-og-resten-af-europa-har-ondt-i-sundhedsvaesnet/,,,"FÃ¥ de seneste nyheder fra ind- og udland om samfund, erhverv, sport og kultur. ",Jyllandsposten,https://jyllands-posten.dk/seneste/,11.12.2022 07:17
Marokkofans eksploderer i jubel i store dele af verden,11.12.2022 02:41,,https://jyllands-posten.dk/sport/fodbold/ECE14681930/marokkofans-eksploderer-i-jubel-i-store-dele-af-verden/,,,"FÃ¥ de seneste nyheder fra ind- og udland om samfund, erhverv, sport og kultur. ",Jyllandsposten,https://jyllands-posten.dk/seneste/,11.12.2022 07:17
"Dagens låge: Hvornår var det nu, det var?",11.12.2022 00:01,,https://jyllands-posten.dk/indland/ECE14681416/hvornaar-var-det-nu-det-var/,,,"FÃ¥ de seneste nyheder fra ind- og udland om samfund, erhverv, sport og kultur. ",Jyllandsposten,https://jyllands-posten.dk/seneste/,11.12.2022 07:17
Dansk-kroater vinder filmpris ved europæisk uddeling,10.12.2022 00:00,,https://jyllands-posten.dk/kultur/ECE14681885/danskkroater-vinder-filmpris-ved-europaeisk-uddeling/,,,"FÃ¥ de seneste nyheder fra ind- og udland om samfund, erhverv, sport og kultur. ",Jyllandsposten,https://jyllands-posten.dk/seneste/,11.12.2022 07:17
Peru har fået ny regering under store protester,10.12.2022 00:00,,https://jyllands-posten.dk/international/ECE14681865/peru-har-faaet-ny-regering-under-store-protester/,,,"FÃ¥ de seneste nyheder fra ind- og udland om samfund, erhverv, sport og kultur. ",Jyllandsposten,https://jyllands-posten.dk/seneste/,11.12.2022 07:17
Brændt straffespark blev afgørende: Frankrig har sendt England ud af VM,10.12.2022 00:00,,https://jyllands-posten.dk/sport/fodbold/ECE14681854/kane-braendte-straffe-i-fransk-sejr-over-england/,,,"FÃ¥ de seneste nyheder fra ind- og udland om samfund, erhverv, sport og kultur. ",Jyllandsposten,https://jyllands-posten.dk/seneste/,11.12.2022 07:17
Bænket Ronaldo forlod VM i tårer efter Portugals exit,10.12.2022 00:00,,https://jyllands-posten.dk/sport/fodbold/ECE14681837/baenket-ronaldo-forlod-vm-i-taarer-efter-portugals-exit/,,,"FÃ¥ de seneste nyheder fra ind- og udland om samfund, erhverv, sport og kultur. ",Jyllandsposten,https://jyllands-posten.dk/seneste/,11.12.2022 07:17
Direktør for Mødrehjælpen: Pressede familier har tænkt på julen siden sidste sommer,10.12.2022 00:00,,https://jyllands-posten.dk/indland/ECE14589019/rekordmange-familier-har-soegt-om-julehjaelp-hos-organisation-direktoeren-hoerer-svaere-fortaellinger/,,,"FÃ¥ de seneste nyheder fra ind- og udland om samfund, erhverv, sport og kultur. ",Jyllandsposten,https://jyllands-posten.dk/seneste/,11.12.2022 07:17
Etniske spændinger har fået Kosovo til at udskyde lokalvalg i serbisk område,10.12.2022 00:00,,https://jyllands-posten.dk/international/europa/ECE14681827/etniske-spaendinger-har-faaet-kosovo-til-at-udskyde-lokalvalg-i-serbisk-omraade/,,,"FÃ¥ de seneste nyheder fra ind- og udland om samfund, erhverv, sport og kultur. ",Jyllandsposten,https://jyllands-posten.dk/seneste/,11.12.2022 07:17
Slut: Brændt straffespark blev afgørende i VM-brag mellem England og Frankrig,10.12.2022 00:00,,https://jyllands-posten.dk/sport/fodbold/ECE14681820/liveblog-england-frankrig/,,,"FÃ¥ de seneste nyheder fra ind- og udland om samfund, erhverv, sport og kultur. ",Jyllandsposten,https://jyllands-posten.dk/seneste/,11.12.2022 07:17
"Vesten forsøger at smadre Putins guldæg: Ãt skib afslører, at olie fra Putins ""spøgelsesflåde"" stadig kan nå Danmark",10.12.2022 00:00,,https://jyllands-posten.dk/international/europa/ECE14634658/et-skib-afsloerer-at-olie-fra-putins-spoegelsesflaade-kan-naa-danmark/,,,"FÃ¥ de seneste nyheder fra ind- og udland om samfund, erhverv, sport og kultur. ",Jyllandsposten,https://jyllands-posten.dk/seneste/,11.12.2022 07:17
Biden fik en kold skulder: Dette vakuum har Kina prompte udnyttet,10.12.2022 00:00,,https://jyllands-posten.dk/international/ECE14653633/kinesisk-fremstoed-i-den-arabiske-verden/,,,"FÃ¥ de seneste nyheder fra ind- og udland om samfund, erhverv, sport og kultur. ",Jyllandsposten,https://jyllands-posten.dk/seneste/,11.12.2022 07:17
VU-formand: Ãn ting kan være farligere for Venstre end en bred regering,10.12.2022 00:00,,https://jyllands-posten.dk/politik/ECE14680815/vuformand-en-ting-kan-vaere-farligere-for-venstre-end-en-bred-regering/,,,"FÃ¥ de seneste nyheder fra ind- og udland om samfund, erhverv, sport og kultur. ",Jyllandsposten,https://jyllands-posten.dk/seneste/,11.12.2022 07:17
Historie: Marokko er første afrikanske land i en VM-semifinale,10.12.2022 00:00,,https://jyllands-posten.dk/sport/fodbold/ECE14656339/loeverne-fra-atlasbjergene-har-aedt-sig-ind-i-vmhistorien/,,,"FÃ¥ de seneste nyheder fra ind- og udland om samfund, erhverv, sport og kultur. ",Jyllandsposten,https://jyllands-posten.dk/seneste/,11.12.2022 07:17
Knallertkører i kritisk tilstand efter soloulykke,10.12.2022 00:00,,https://jyllands-posten.dk/indland/ECE14681792/knallertkoerer-i-kritisk-tilstand-efter-soloulykke/,,,"FÃ¥ de seneste nyheder fra ind- og udland om samfund, erhverv, sport og kultur. ",Jyllandsposten,https://jyllands-posten.dk/seneste/,11.12.2022 07:17
Fifa åbner disciplinærsag efter dramatisk kvartfinale,10.12.2022 00:00,,https://jyllands-posten.dk/sport/fodbold/ECE14681782/fifa-aabner-disciplinaersag-efter-dramatisk-kvartfinale/,,,"FÃ¥ de seneste nyheder fra ind- og udland om samfund, erhverv, sport og kultur. ",Jyllandsposten,https://jyllands-posten.dk/seneste/,11.12.2022 07:17
"KIF Kolding har overgået alle forventninger: »Det vil være useriøst at sige, jeg ikke er overrasket«",10.12.2022 00:00,,https://jyllands-posten.dk/sport/handbold/ECE14681626/kif-koldingtoget-buldrer-videre-efter-sejr-over-nordsjaelland/,,,"FÃ¥ de seneste nyheder fra ind- og udland om samfund, erhverv, sport og kultur. ",Jyllandsposten,https://jyllands-posten.dk/seneste/,11.12.2022 07:17
Morten Meldal har fået Nobelpris af Sveriges konge,10.12.2022 00:00,,https://jyllands-posten.dk/international/europa/ECE14681774/morten-meldal-har-faaet-nobelpris-af-sveriges-konge/,,,"FÃ¥ de seneste nyheder fra ind- og udland om samfund, erhverv, sport og kultur. ",Jyllandsposten,https://jyllands-posten.dk/seneste/,11.12.2022 07:17
"Ballade ramte belastet gymnasium: Nu har det vendt udviklingen og taler varmt for en aftale, der fordeler unge efter forældrenes indtægt",10.12.2022 00:00,,https://jyllands-posten.dk/indland/ECE14671542/belastet-gymnasium-vendte-udviklingen-og-taler-varmt-for-en-fordeling-af-unge/,,,"FÃ¥ de seneste nyheder fra ind- og udland om samfund, erhverv, sport og kultur. ",Jyllandsposten,https://jyllands-posten.dk/seneste/,11.12.2022 07:17
Snowden: Har russisk pas og flere gange udtalt sig om Danmark,10.12.2022 00:00,,https://jyllands-posten.dk/international/ECE14653909/manden-som-har-traade-til-fesagen-har-faaet-russisk-pas/,,,"FÃ¥ de seneste nyheder fra ind- og udland om samfund, erhverv, sport og kultur. ",Jyllandsposten,https://jyllands-posten.dk/seneste/,11.12.2022 07:17
"Hjulmand om VM-nedtur: »Undskyld, vi er her«",10.12.2022 00:00,,https://jyllands-posten.dk/sport/fodbold/ECE14681746/hjulmand-leder-stadig-efter-forklaring-paa-vmnedtur/,,,"FÃ¥ de seneste nyheder fra ind- og udland om samfund, erhverv, sport og kultur. ",Jyllandsposten,https://jyllands-posten.dk/seneste/,11.12.2022 07:17
Slutfløjt: Det første afrikanske land nogensinde er klar til en VM-semifinale,10.12.2022 00:00,,https://jyllands-posten.dk/sport/fodbold/ECE14681716/liveblog-marokko-portugal/,,,"FÃ¥ de seneste nyheder fra ind- og udland om samfund, erhverv, sport og kultur. ",Jyllandsposten,https://jyllands-posten.dk/seneste/,11.12.2022 07:17
"8 ud af 10 kommer til skade på lærepladsen: Det skyldes en tavshedskultur, mener en forsker",10.12.2022 00:00,,https://jyllands-posten.dk/indland/ECE14653175/de-forsoeger-at-foelge-med-i-svendene-og-mesterens-tempo/,,,"FÃ¥ de seneste nyheder fra ind- og udland om samfund, erhverv, sport og kultur. ",Jyllandsposten,https://jyllands-posten.dk/seneste/,11.12.2022 07:17
JP til gymnasiefest: I Roskilde skal alkometertest og gule kort forhindre dødsdruk,10.12.2022 00:00,,https://jyllands-posten.dk/indland/ECE14657017/vi-er-ikke-ude-paa-at-saette-en-kaep-i-hjulet-paa-deres-fest/,,,"FÃ¥ de seneste nyheder fra ind- og udland om samfund, erhverv, sport og kultur. ",Jyllandsposten,https://jyllands-posten.dk/seneste/,11.12.2022 07:17
Presset Axelsen har spillet sig i stor finale,10.12.2022 00:00,,https://jyllands-posten.dk/sport/ECE14681687/presset-axelsen-har-spillet-sig-i-stor-finale/,,,"FÃ¥ de seneste nyheder fra ind- og udland om samfund, erhverv, sport og kultur. ",Jyllandsposten,https://jyllands-posten.dk/seneste/,11.12.2022 07:17
Neuer har brækket benet i skiulykke og er færdig for sæsonen,10.12.2022 00:00,,https://jyllands-posten.dk/sport/fodbold/ECE14681651/neuer-har-braekket-benet-i-skiulykke-og-er-faerdig-for-saesonen/,,,"FÃ¥ de seneste nyheder fra ind- og udland om samfund, erhverv, sport og kultur. ",Jyllandsposten,https://jyllands-posten.dk/seneste/,11.12.2022 07:17
Politioperation mod gidseltager i Dresden er afsluttet,10.12.2022 00:00,,https://jyllands-posten.dk/international/europa/ECE14681670/politioperation-mod-gidseltager-i-dresden-er-afsluttet/,,,"FÃ¥ de seneste nyheder fra ind- og udland om samfund, erhverv, sport og kultur. ",Jyllandsposten,https://jyllands-posten.dk/seneste/,11.12.2022 07:17
Kommune vil betale sanktionerede kontanthjælpsmodtagere tilbage,10.12.2022 00:00,,https://jyllands-posten.dk/indland/ECE14681672/kommune-vil-betale-sanktionerede-kontanthjaelpsmodtagere-tilbage/,,,"FÃ¥ de seneste nyheder fra ind- og udland om samfund, erhverv, sport og kultur. ",Jyllandsposten,https://jyllands-posten.dk/seneste/,11.12.2022 07:17
Fire partier er til fælles forhandlinger om ny regering lørdag,10.12.2022 00:00,,https://jyllands-posten.dk/politik/ECE14681684/fire-partier-er-til-faelles-forhandlinger-om-ny-regering-loerdag/,,,"FÃ¥ de seneste nyheder fra ind- og udland om samfund, erhverv, sport og kultur. ",Jyllandsposten,https://jyllands-posten.dk/seneste/,11.12.2022 07:17
Politioperation mod gidseltager i Dresden afsluttet,10.12.2022 00:00,,https://jyllands-posten.dk/international/ECE14681631/politioperation-mod-gidseltager-i-dresden-afsluttet/,,,"FÃ¥ de seneste nyheder fra ind- og udland om samfund, erhverv, sport og kultur. ",Jyllandsposten,https://jyllands-posten.dk/seneste/,11.12.2022 07:17
Neuer brækker benet i skiulykke og er færdig for sæsonen,10.12.2022 00:00,,https://jyllands-posten.dk/sport/fodbold/ECE14681640/neuer-braekker-benet-i-skiulykke-og-er-faerdig-for-saesonen/,,,"FÃ¥ de seneste nyheder fra ind- og udland om samfund, erhverv, sport og kultur. ",Jyllandsposten,https://jyllands-posten.dk/seneste/,11.12.2022 07:17
En dræbt og 12 andre savnet efter eksplosion på Jersey,10.12.2022 00:00,,https://jyllands-posten.dk/international/ECE14681620/en-draebt-og-12-andre-savnet-efter-eksplosion-paa-jersey/,,,"FÃ¥ de seneste nyheder fra ind- og udland om samfund, erhverv, sport og kultur. ",Jyllandsposten,https://jyllands-posten.dk/seneste/,11.12.2022 07:17
Nye stjerner giver kvalitet og uro i Team Esbjerg,10.12.2022 00:00,,https://jyllands-posten.dk/sport/handbold/ECE14655156/nye-stjerner-giver-kvalitet-og-uro-i-team-esbjerg/,,,"FÃ¥ de seneste nyheder fra ind- og udland om samfund, erhverv, sport og kultur. ",Jyllandsposten,https://jyllands-posten.dk/seneste/,11.12.2022 07:17
"Nu trues Ellemann med konkrete konsekvenser, hvis han går i regering med Mette Frederiksen",10.12.2022 00:00,,https://jyllands-posten.dk/politik/ECE14677443/venstres-ungdom-truer-med-konkrete-konsekvenser-hvis-ellemann-gaar-i-regering-med-socialdemokratiet/,,,"FÃ¥ de seneste nyheder fra ind- og udland om samfund, erhverv, sport og kultur. ",Jyllandsposten,https://jyllands-posten.dk/seneste/,11.12.2022 07:17
"Lea Ypi havde aldrig spurgt sig selv om betydningen af frihed, før den dag hun krammede Stalin",10.12.2022 00:00,,https://jyllands-posten.dk/kultur/ECE14649517/lea-ypi-voksede-op-i-en-loegn-maaske-goer-du-ogsaa/,,,"FÃ¥ de seneste nyheder fra ind- og udland om samfund, erhverv, sport og kultur. ",Jyllandsposten,https://jyllands-posten.dk/seneste/,11.12.2022 07:17
Lørdag aften venter et uhyre sjældent slag mellem to europæiske stormagter,10.12.2022 00:00,,https://jyllands-posten.dk/sport/fodbold/ECE14671404/drillerier-bloede-punkter-og-et-par-hits-ved-poolen-fra-robbie-williams/,,,"FÃ¥ de seneste nyheder fra ind- og udland om samfund, erhverv, sport og kultur. ",Jyllandsposten,https://jyllands-posten.dk/seneste/,11.12.2022 07:17
Fondsbørsens førstemand drømte om aktier allerede som barn,10.12.2022 00:00,,https://jyllands-posten.dk/indland/ECE14581886/fondsboersens-foerstemand-droemte-om-aktier-allerede-som-barn/,,,"FÃ¥ de seneste nyheder fra ind- og udland om samfund, erhverv, sport og kultur. ",Jyllandsposten,https://jyllands-posten.dk/seneste/,11.12.2022 07:17
Politi rykker ind med narkohunde på eksklusiv natklub,10.12.2022 00:00,,https://jyllands-posten.dk/indland/ECE14681458/politi-rykker-ind-med-narkohunde-paa-eksklusiv-natklub/,,,"FÃ¥ de seneste nyheder fra ind- og udland om samfund, erhverv, sport og kultur. ",Jyllandsposten,https://jyllands-posten.dk/seneste/,11.12.2022 07:17
"»Jeg kan få ondt i maven og tænke: Er det virkelig dét her, jeg vil«",10.12.2022 00:00,,https://jyllands-posten.dk/kultur/ECE14581895/jeg-kan-faa-ondt-i-maven-og-taenke-er-det-virkelig-det-her-jeg-vil/,,,"FÃ¥ de seneste nyheder fra ind- og udland om samfund, erhverv, sport og kultur. ",Jyllandsposten,https://jyllands-posten.dk/seneste/,11.12.2022 07:17
Pris og kvalitet stemmer: Til gengæld tårner flere andre problemer sig op for helt ny elbil,10.12.2022 00:00,,https://jyllands-posten.dk/biler/ECE14657087/paa-papiret-ligner-byd-atto-3-et-hit-men-virkeligheden-rammer-haardt/,,,"FÃ¥ de seneste nyheder fra ind- og udland om samfund, erhverv, sport og kultur. ",Jyllandsposten,https://jyllands-posten.dk/seneste/,11.12.2022 07:17
67-årig mand dør efter lejlighedsbrand i Tune,10.12.2022 00:00,,https://jyllands-posten.dk/indland/ECE14681449/67aarig-mand-doer-efter-lejlighedsbrand-i-tune/,,,"FÃ¥ de seneste nyheder fra ind- og udland om samfund, erhverv, sport og kultur. ",Jyllandsposten,https://jyllands-posten.dk/seneste/,11.12.2022 07:17
Blindtest af marcipan: »Måske politiet kan bruge den til at lave fingeraftryk. Man skal i hvert fald ikke spise det«,10.12.2022 00:00,,https://jyllands-posten.dk/livsstil/madvin/ECE14626435/maaske-politiet-kan-bruge-den-til-at-lave-fingeraftryk-man-skal-i-hvert-fald-ikke-spise-det/,,,"FÃ¥ de seneste nyheder fra ind- og udland om samfund, erhverv, sport og kultur. ",Jyllandsposten,https://jyllands-posten.dk/seneste/,11.12.2022 07:17
Michelinkokkens julespecialitet: Asien møder Danmark i andeæbleskiver med blommekompot,10.12.2022 00:00,,https://jyllands-posten.dk/livsstil/madvin/ECE14637922/jeg-kan-godt-lide-den-klassiske-danske-juleand-men-dele-af-anden-egner-sig-efter-min-mening-daarligt-til-den-type-tilberedning/,,,"FÃ¥ de seneste nyheder fra ind- og udland om samfund, erhverv, sport og kultur. ",Jyllandsposten,https://jyllands-posten.dk/seneste/,11.12.2022 07:17
Kendt prodemokratisk aktivist får ny dom i Hongkong,10.12.2022 00:00,,https://jyllands-posten.dk/international/ECE14681427/kendt-prodemokratisk-aktivist-faar-ny-dom-i-hongkong/,,,"FÃ¥ de seneste nyheder fra ind- og udland om samfund, erhverv, sport og kultur. ",Jyllandsposten,https://jyllands-posten.dk/seneste/,11.12.2022 07:17
VM på Spidsen: Vi burde hylde syndebukkene i stedet for at udskamme dem,10.12.2022 00:00,,https://jyllands-posten.dk/sport/fodbold/ECE14678388/vi-burde-hylde-syndebukkene-i-stedet-for-at-udskamme-dem/,,,"FÃ¥ de seneste nyheder fra ind- og udland om samfund, erhverv, sport og kultur. ",Jyllandsposten,https://jyllands-posten.dk/seneste/,11.12.2022 07:17
Lugten af olie hænger tungt over område i Kansas efter stort læk,10.12.2022 00:00,,https://jyllands-posten.dk/international/usa/ECE14681400/lugten-af-olie-haenger-tungt-over-omraade-i-kansas-efter-stort-laek/,,,"FÃ¥ de seneste nyheder fra ind- og udland om samfund, erhverv, sport og kultur. ",Jyllandsposten,https://jyllands-posten.dk/seneste/,11.12.2022 07:17
Intens rengøring eller en hurtig gåtur kan forlænge livet,10.12.2022 00:00,,https://jyllands-posten.dk/indland/ECE14681406/intens-rengoering-eller-en-hurtig-gaatur-kan-forlaenge-livet/,,,"FÃ¥ de seneste nyheder fra ind- og udland om samfund, erhverv, sport og kultur. ",Jyllandsposten,https://jyllands-posten.dk/seneste/,11.12.2022 07:17
Britisk rapport varsler kraftige stramninger: Illegale migranter skal anbringes i lukkede lejre og får et umuligt valg,10.12.2022 00:00,,https://jyllands-posten.dk/international/europa/ECE14656298/presset-britisk-regering-vil-stramme-asyllove/,,,"FÃ¥ de seneste nyheder fra ind- og udland om samfund, erhverv, sport og kultur. ",Jyllandsposten,https://jyllands-posten.dk/seneste/,11.12.2022 07:17
To dødsfald og en genoplivning: Den grusomme nattevagt som blev til 12 års fængsel til en dansk sygeplejerske,10.12.2022 00:00,,https://jyllands-posten.dk/kultur/ECE14563722/han-bidrog-til-afsloeringen-af-den-danske-sygeplejerske-doemt-for-drabsforsoeg/,,,"FÃ¥ de seneste nyheder fra ind- og udland om samfund, erhverv, sport og kultur. ",Jyllandsposten,https://jyllands-posten.dk/seneste/,11.12.2022 07:17
Analyse: Kryptisk opdatering fra Løkke antyder et svært problem for Mette Frederiksen,10.12.2022 00:00,,https://jyllands-posten.dk/politik/ECE14678120/presset-tager-til-mod-mette-frederiksen-i-regeringsforhandlingers-slutspurt/,,,"FÃ¥ de seneste nyheder fra ind- og udland om samfund, erhverv, sport og kultur. ",Jyllandsposten,https://jyllands-posten.dk/seneste/,11.12.2022 07:17
Liveblog: Rusland menes at have modificeret »dødens plæneklipper« til vinterkrig,10.12.2022 00:00,,https://jyllands-posten.dk/international/europa/ECE14428885/her-er-seneste-nyt-om-krigen-i-ukraine/,,,"FÃ¥ de seneste nyheder fra ind- og udland om samfund, erhverv, sport og kultur. ",Jyllandsposten,https://jyllands-posten.dk/seneste/,11.12.2022 07:17
"Amerikansk journalist er død under VM-dækning: »Jeg tror, at han blev dræbt«",10.12.2022 00:00,,https://jyllands-posten.dk/international/ECE14681407/amerikansk-sportsjournalist-er-doed-efter-kollaps-under-vmdaekning/,,,"FÃ¥ de seneste nyheder fra ind- og udland om samfund, erhverv, sport og kultur. ",Jyllandsposten,https://jyllands-posten.dk/seneste/,11.12.2022 07:17
Argentina eliminerede Holland efter kæmpe drama ved VM,09.12.2022 00:00,,https://jyllands-posten.dk/sport/fodbold/ECE14681380/argentina-eliminerede-holland-efter-kaempe-drama-ved-vm/,,,"FÃ¥ de seneste nyheder fra ind- og udland om samfund, erhverv, sport og kultur. ",Jyllandsposten,https://jyllands-posten.dk/seneste/,11.12.2022 07:17
Styrelse sætter sanktionering af kontanthjælpsmodtagere i bero,09.12.2022 00:00,,https://jyllands-posten.dk/indland/ECE14681371/styrelse-saetter-sanktionering-af-kontanthjaelpsmodtagere-i-bero/,,,"FÃ¥ de seneste nyheder fra ind- og udland om samfund, erhverv, sport og kultur. ",Jyllandsposten,https://jyllands-posten.dk/seneste/,11.12.2022 07:17
Eksbetjent får over tre års fængsel i sag om drab på George Floyd,09.12.2022 00:00,,https://jyllands-posten.dk/international/usa/ECE14681365/eksbetjent-faar-over-tre-aars-faengsel-i-sag-om-drab-paa-george-floyd/,,,"FÃ¥ de seneste nyheder fra ind- og udland om samfund, erhverv, sport og kultur. ",Jyllandsposten,https://jyllands-posten.dk/seneste/,11.12.2022 07:17
Ib Michaels sommerhus strækker sig til galaksens grænse,09.12.2022 00:00,,https://jyllands-posten.dk/rejser/ECE14654967/ib-michaels-sommerhus-straekker-sig-til-galaksens-graense/,,,"FÃ¥ de seneste nyheder fra ind- og udland om samfund, erhverv, sport og kultur. ",Jyllandsposten,https://jyllands-posten.dk/seneste/,11.12.2022 07:17
Holland vil tage to nye atomkraftværker i brug i 2035,09.12.2022 00:00,,https://jyllands-posten.dk/international/europa/ECE14681312/holland-vil-tage-to-nye-atomkraftvaerker-i-brug-i-2035/,,,"FÃ¥ de seneste nyheder fra ind- og udland om samfund, erhverv, sport og kultur. ",Jyllandsposten,https://jyllands-posten.dk/seneste/,11.12.2022 07:17
"Debat om blå bøger: »Jeg mener ikke, at vi har hele ansvaret for hvert eneste komma og bogstav«",09.12.2022 00:00,,https://jyllands-posten.dk/indland/ECE14661845/er-tiden-loebet-fra-elevernes-anekdoter-om-ballade-og-bommerter/,,,"FÃ¥ de seneste nyheder fra ind- og udland om samfund, erhverv, sport og kultur. ",Jyllandsposten,https://jyllands-posten.dk/seneste/,11.12.2022 07:17
Vildt VM-drama: Argentina slår Holland ud af VM,09.12.2022 00:00,,https://jyllands-posten.dk/sport/fodbold/ECE14681166/liveblog-holland-argentina/,,,"FÃ¥ de seneste nyheder fra ind- og udland om samfund, erhverv, sport og kultur. ",Jyllandsposten,https://jyllands-posten.dk/seneste/,11.12.2022 07:17
"Begæret konkurs af staten: Løkkes topfigur i Folketinget betalte ikke den skat, han skulle",09.12.2022 00:00,,https://jyllands-posten.dk/politik/ECE14672386/loekkes-topfigur-i-folketinget-betalte-ikke-den-skat-han-skulle/,,,"FÃ¥ de seneste nyheder fra ind- og udland om samfund, erhverv, sport og kultur. ",Jyllandsposten,https://jyllands-posten.dk/seneste/,11.12.2022 07:17
Nato-chef frygter storkrig og 5 andre vigtige historier,09.12.2022 00:00,,https://jyllands-posten.dk/dagensoverblik/ECE14681039/de-6-vigtigste-nyheder-fredag-den-9-december/,,,"FÃ¥ de seneste nyheder fra ind- og udland om samfund, erhverv, sport og kultur. ",Jyllandsposten,https://jyllands-posten.dk/seneste/,11.12.2022 07:17
"Kroaterne knuste de store drømme, og tårerne fik frit løb hos de kulørte stjerner",09.12.2022 00:00,,https://jyllands-posten.dk/sport/fodbold/ECE14656328/kroaterne-knuste-de-store-droemme-og-taarerne-fik-frit-loeb-hos-de-kuloerte-stjerner/,,,"FÃ¥ de seneste nyheder fra ind- og udland om samfund, erhverv, sport og kultur. ",Jyllandsposten,https://jyllands-posten.dk/seneste/,11.12.2022 07:17
»Dumt«: Putin håner Vestens prisloft på russisk olie,09.12.2022 00:00,,https://jyllands-posten.dk/international/ECE14681135/putin-truer-med-at-mindske-ruslands-olieproduktion/,,,"FÃ¥ de seneste nyheder fra ind- og udland om samfund, erhverv, sport og kultur. ",Jyllandsposten,https://jyllands-posten.dk/seneste/,11.12.2022 07:17
Butikskrigen: Rema 1000 får med ét hug mange nye discountbutikker,09.12.2022 00:00,,https://jyllands-posten.dk/jperhverv/ECE14679546/remachef-tager-stort-hop-med-koeb-af-aldibutikker/,,,"FÃ¥ de seneste nyheder fra ind- og udland om samfund, erhverv, sport og kultur. ",Jyllandsposten,https://jyllands-posten.dk/seneste/,11.12.2022 07:17
Dinodrengen fra -Cirkus Jul- burde få sin egen bogserie,09.12.2022 00:00,,https://jyllands-posten.dk/kultur/teater/ECE14674084/dinodrengen-og-klovnen-harry-laerer-en-vigtig-pointe-i-cirkus-jul/,,,"FÃ¥ de seneste nyheder fra ind- og udland om samfund, erhverv, sport og kultur. ",Jyllandsposten,https://jyllands-posten.dk/seneste/,11.12.2022 07:17
FDM: Hastighed og afstand er altafgørende for trafikanter i sneen,09.12.2022 00:00,,https://jyllands-posten.dk/indland/ECE14680007/vinterdaek-og-sneplove-skal-hjaelpe-trafikanter-gennem-sneen/,,,"FÃ¥ de seneste nyheder fra ind- og udland om samfund, erhverv, sport og kultur. ",Jyllandsposten,https://jyllands-posten.dk/seneste/,11.12.2022 07:17
"Han stod til årtier i fængsel i USA, men »dødens købmand« fik ret i trodsig besked",09.12.2022 00:00,,https://jyllands-posten.dk/international/ECE14678237/doedens-koebmand-er-igen-paa-fri-fod/,,,"FÃ¥ de seneste nyheder fra ind- og udland om samfund, erhverv, sport og kultur. ",Jyllandsposten,https://jyllands-posten.dk/seneste/,11.12.2022 07:17
Rutebus havnede i grøften: Tre kørt til tjek på sygehuset,09.12.2022 00:00,,https://jyllands-posten.dk/indland/ECE14681040/rutebus-havnede-i-groeften-tre-koert-til-tjek-paa-sygehuset/,,,"FÃ¥ de seneste nyheder fra ind- og udland om samfund, erhverv, sport og kultur. ",Jyllandsposten,https://jyllands-posten.dk/seneste/,11.12.2022 07:17
Litauisk mand mistænkes i sag om næsten 200 indbrud,09.12.2022 00:00,,https://jyllands-posten.dk/indland/ECE14680932/litauisk-mand-mistaenkes-i-sag-om-naesten-200-indbrud/,,,"FÃ¥ de seneste nyheder fra ind- og udland om samfund, erhverv, sport og kultur. ",Jyllandsposten,https://jyllands-posten.dk/seneste/,11.12.2022 07:17
Kraftig menstruation er mulig bivirkning efter coronavaccination,09.12.2022 00:00,,https://jyllands-posten.dk/indland/ECE14680915/kraftig-menstruation-er-mulig-bivirkning-efter-coronavaccination/,,,"FÃ¥ de seneste nyheder fra ind- og udland om samfund, erhverv, sport og kultur. ",Jyllandsposten,https://jyllands-posten.dk/seneste/,11.12.2022 07:17
