title,published,text,link,og:site_name,og:url,site_description,name,url,scrape_time
"Skuespillere siger nej til stereotype roller: Unge i dag stiller meget større krav, end vi gamle røvhuller gjorde",14.02.2023 00:00,"Skuespillere siger nej til stereotype roller: 'Unge i dag stiller meget større krav, end vi gamle røvhuller gjorde'",https://www.dr.dk,DR,https://www.dr.dk/nyheder,"DR nyheder - Hold dig opdateret. Få de seneste nyheder fra Danmark og udlandet. Læs om de største sager, Kultur, Politik, Viden & Sport her",DR,https://www.dr.dk/nyheder,17.02.2023 07:18
Tysk lufthavnsstrejke er begyndt: Syv lufthavne er berørt,15.02.2023 00:00,"Flere steder i Tyskland er en storstilet strejke sat i gang. Strejken påvirker lufttrafikken i store dele af landet, og ifølge lufthavnsforeningen ADV vil strejken føre til godt 2.340 flyaflysninger.Det skriver det tyske medie Tagesschau.I alt er syv lufthavne involveret i strejken. Det gælder lufthavne i Frankfurt, München, Stuttgart, Hamborg, Dortmund, Hannover og Bremen.Det er fagforeningen ver.di, der har opfordret ansatte i lufthavnene til at strejke. Arbejdsnedlæggelsen begyndte tidligt i morges og forventes at slutte i aften.Fagforeningen og dens medlemmer er i strid med den tyske regering og lokale myndigheder om deres løn. Ver.di kræver en lønstigning på 10,5 procent eller minimum 500 euro (3.724 danske kroner) mere om måneden for omkring 2,5 millioner offentligt ansatte.",https://www.dr.dk,DR,https://www.dr.dk/nyheder,"DR nyheder - Hold dig opdateret. Få de seneste nyheder fra Danmark og udlandet. Læs om de største sager, Kultur, Politik, Viden & Sport her",DR,https://www.dr.dk/nyheder,17.02.2023 07:18
Blev jagtet af politi i seks dage: Nu erklærer 26-årig amerikaner sig skyldig i drab,19.02.2023 00:00,"Den 26-årige Peter Manfredonia fra Connecticut i USA erkendte sig i går skyldig i anklager om mord og kidnapning.Manfredonia har indrømmet, at han i 2020 skød en tidligere skolekammerat og kidnappede mandens kæreste. To dage senere dræbte han endnu en mand og sårede en med et sværd.Det skriver nyhedsbureauet AP.Hans forbrydelser førte til en seks dage lang eftersøgning i flere stater. Jagten endte med, at Manfredonia blev fanget af myndighederne i staten Maryland.Han har nu indvilliget i at acceptere en fængselsdom på 55 år, når han i april står til at skulle modtage dom.- Peter og jeg undersøgte forskellige forsvar, og dette var Peters valg om, hvordan man skulle løse sagen, fortalte hans advokat Michael Dolan efter torsdagens høring.",https://www.dr.dk,DR,https://www.dr.dk/nyheder,"DR nyheder - Hold dig opdateret. Få de seneste nyheder fra Danmark og udlandet. Læs om de største sager, Kultur, Politik, Viden & Sport her",DR,https://www.dr.dk/nyheder,17.02.2023 07:18
Ukraines regering opfordrer civile til at forlade sønderbombede Bakhmut omgående,17.02.2047 00:00,"Forlad den krigshærgede og sønderbombede by Bakhmut omgående.Sådan lyder opfordringen fra Ukraines vicepremierminister, Iryna Veresjtsjuk, der ifølge eget udsagn er ""overrasket"" over, at der fortsat befinder sig omkring 6.000 civile i byen.- De, der vælger at blive i Bakhmut, bringer sig selv og deres kære i fare, skaber yderligere risici for militæret og politiet, og forhindrer vores forsvars- og sikkerhedsstyrker i at fungere ordentligt i byen, skriver hun ifølge CNN på Telegram.Hvis Bakhmut indtages af russerne, kan det være en trædesten på vej mod større byer i Donetsk-regionen, skriver Ritzau.Ved fronten omkring Bakhmut bliver ét af krigens blodigste slag udkæmpet. Lyt til Genstart om krigens hærgen i byen.",https://www.dr.dk,DR,https://www.dr.dk/nyheder,"DR nyheder - Hold dig opdateret. Få de seneste nyheder fra Danmark og udlandet. Læs om de største sager, Kultur, Politik, Viden & Sport her",DR,https://www.dr.dk/nyheder,17.02.2023 07:18
Britiske grænsevagter strejker i Calais og Dover: Smid nogle penge på bordet,17.02.2023 07:15,"En strejke rammer i dag Storbritanniens grænseovergange, herunder grænseovergangene ved Dover i England og Calais i Frankrig.Grænsevagterne og deres fagforening er utilfredse med deres løn, pensions- og arbejdsforhold og har valgt at nedlægge arbejdet hele weekenden.Formanden for grænsevagternes fagforening, PCS, Mark Serwotka, siger, at myndighederne har valgt at hyre uuddannet personale ind i weekenden.Han opfordrer ifølge Sky News regeringen til at ""smide penge på bordet for at sikre, at fuldt uddannede, erfarne fagfolk bevogter vores grænser"".Samtidig strejker også britiske ambulancefolk på grund af en strid over lønforholdene.- Regeringen synes at tro, at GMB-medlemmer vil lade sig narre ved at lade som om, at dette års stigning i leveomkostninger ikke er sket. De tager fejl, siger Stuart Richards, formanden for ambulancefolkenes fagforening, GMB.En række faggrupper i Storbritannien har gennem længere tid demonstreret for højere løn og bedre arbejdsvilkår. Nye strejker er planlagt for sygeplejersker og jernbanefolk den 1. marts, skriver Sky News.",https://www.dr.dk,DR,https://www.dr.dk/nyheder,"DR nyheder - Hold dig opdateret. Få de seneste nyheder fra Danmark og udlandet. Læs om de største sager, Kultur, Politik, Viden & Sport her",DR,https://www.dr.dk/nyheder,17.02.2023 07:18
Løkke mødes med toppolitikere i Tyskland for at drøfte sikkerhed,17.02.2023 07:07,"I dag begynder den årlige sikkerhedskonference med nogle af de førende politikere, erhvervsfolk og organisationer.Den afholdes i München, og fra Danmark deltager udenrigsminister Lars Løkke Rasmussen (M) både i dag og i morgen for at drøfte sikkerhed og udenrigspolitiske emner.USA's vicepræsident Kamala Harris deltager også.Timingen for konferencen er lidt uheldig, idet der er varslet strejke i Münchens lufthavn og flere andre tyske lufthavne fra i dag. Mindst 700 fly er aflyst alene i den tyske millionby.Der vil dog blive foretaget undtagelsesvise flyvninger. Det gælder i nødstilfælde samt med ledere, der skal deltage i konferencen, oplyste lufthavnen forleden.",https://www.dr.dk,DR,https://www.dr.dk/nyheder,"DR nyheder - Hold dig opdateret. Få de seneste nyheder fra Danmark og udlandet. Læs om de største sager, Kultur, Politik, Viden & Sport her",DR,https://www.dr.dk/nyheder,17.02.2023 07:18
Taiwan undersøger nedfalden vejrballon med kinesiske tegn,17.02.2023 07:06,"Taiwan har fundet en nedstyrtet vejrballon på en ø i Taiwan.Ballonen menes at komme fra Kina, fordi den indeholder en lille instrumentboks med kinesiske tegn, oplyser militæret i Taiwan.Den faldt ned på øen Dongyin, som er en del af Matsu-øgruppen, der kontrolleres af Taiwan.- Den foreløbige undersøgelse har fastslået, at det var rester af et meteorologisk måleinstrument. Det er blevet indsamlet af de relevante afdelinger for yderligere undersøgelse, udtaler Taiwans hær i en kort meddelelse.USA og andre lande er særligt opmærksomme på flyvende objekter med mulig forbindelse til Kina og kinesiske spionage i disse dage.Taiwan, som i Kinas øjne er en del af kinesisk territorium, har de seneste år klaget over øget chikane fra kinesisk militærs side.Ifølge forsvarsministeren i Taiwan, Chiu Kuo-cheng, har man nu sendt et eksperthold til øen- Hæren vil ikke drage forhastede konklusioner blot ved at se på udseendet. Svarene vil først komme efter en undersøgelse, siger Chiu Kuo-cheng.",https://www.dr.dk,DR,https://www.dr.dk/nyheder,"DR nyheder - Hold dig opdateret. Få de seneste nyheder fra Danmark og udlandet. Læs om de største sager, Kultur, Politik, Viden & Sport her",DR,https://www.dr.dk/nyheder,17.02.2023 07:18
Sådan kommer stormen Otto til at påvirke fredagens trafik,17.02.2023 07:12,Sådan kommer stormen Otto til at påvirke fredagens trafik,https://www.dr.dk,DR,https://www.dr.dk/nyheder,"DR nyheder - Hold dig opdateret. Få de seneste nyheder fra Danmark og udlandet. Læs om de største sager, Kultur, Politik, Viden & Sport her",DR,https://www.dr.dk/nyheder,17.02.2023 07:18
Fredag giver regn og storm,17.02.2023 06:24,"Dagen vil starte ganske roligt i hele landet, hvor første del af døgnet vil være præget af den front med regn, der trækker ind over os.Det giver mellem 8 og 15 millimeter, så det bliver også en regnfuld dag. Temperaturen ligger i dag mellem 7 og 11 grader. Fra i eftermiddag omkring klokken 15 går vinden i nordvest og det blæser kraftigt op.Der er varslet kategori 2-vejr i det meste af Nordjylland, ned langs dele af Vestkysten samt på Læsø og den nordlige del af Djursland. Her er forventningen, at der bliver storm med vindstød af orkanstyrke.I store områder af Jylland, Sjælland og Bornholm er der varslet kategori 1-vejr, hvor vinden vil nå et niveau af stormende kuling med vindstød af stormstyrke. Varslet gælder fra klokken 15 til klokken 23.",https://www.dr.dk,DR,https://www.dr.dk/nyheder,"DR nyheder - Hold dig opdateret. Få de seneste nyheder fra Danmark og udlandet. Læs om de største sager, Kultur, Politik, Viden & Sport her",DR,https://www.dr.dk/nyheder,17.02.2023 07:18
"Offentligt ansatte mister millioner i genetillæg, når store bededag afskaffes: Tyveri ved højlys dag",17.02.2023 06:15,"Offentligt ansatte mister millioner i genetillæg, når store bededag afskaffes: 'Tyveri ved højlys dag'",https://www.dr.dk,DR,https://www.dr.dk/nyheder,"DR nyheder - Hold dig opdateret. Få de seneste nyheder fra Danmark og udlandet. Læs om de største sager, Kultur, Politik, Viden & Sport her",DR,https://www.dr.dk/nyheder,17.02.2023 07:18
Kina erklærer afgørende sejr over covid-19,17.02.2023 06:14,"I Kina mener landets politbureau nu, at den kinesiske regering er lykkes med at besejre covid-19.Det skriver nyhedsbureauet Reuters.Det gik ellers voldsomt for sig, da Kina i starten af året sløjfede de sidste coronarestriktioner, hvor historier og billeder af tætpakkede hospitaler gik viralt.Ifølge mediet påstår Kina selv, at omkring 80.000 personer døde som følge af covid-19 i de to måneder, der fulgte, efter restriktionerne blev droppet.Men nu er kampen mod sygdommen forbi, og Kina har taget en ""afgørende sejr"" mod coronavirus, lyder det nu fra myndighederne.- En stor afgørende sejr i epidemiforebyggelse og -kontrol er opnået.- Med en kontinuerlig indsats for at optimere covid-19-forebyggelse og kontrolforanstaltninger siden november 2022, har Kinas covid-19-reaktion gjort en glidende overgang på relativt kort tid, lød det fra politbureauet efter et møde torsdag.",https://www.dr.dk,DR,https://www.dr.dk/nyheder,"DR nyheder - Hold dig opdateret. Få de seneste nyheder fra Danmark og udlandet. Læs om de største sager, Kultur, Politik, Viden & Sport her",DR,https://www.dr.dk/nyheder,17.02.2023 07:18
Sydafrika er med i flådeøvelse med Kina og Rusland,17.02.2023 05:49,"Sydafrika ventes i dag at begynde en flådeøvelse med Kina og Rusland.Ifølge nyhedsbureauet Reuters har øvelsen ført til intern kritik i landet, og der er samtidig frygt for, at den vil kunne påvirke landets relationer til vestlige lande.Alligevel fastholder Sydafrika, at de stiller sig neutralt i forhold til krigen mellem Rusland og Ukraine. Sidste år afholdt landet sig også fra at stemme om en FN-resolution om fordømmelse af Ruslands annektering af dele af Ukraine.- Sydafrika har som enhver uafhængig og suveræn stat retten til at pleje de udenrigsrelationer, som er i overensstemmelse med nationale interesser, udtalte det sydafrikanske udenrigsministerium i januar.Flådeøvelsen vil være den anden af sin slags. I november 2019 blev en lignende øvelse afholdt i Cape Town.",https://www.dr.dk,DR,https://www.dr.dk/nyheder,"DR nyheder - Hold dig opdateret. Få de seneste nyheder fra Danmark og udlandet. Læs om de største sager, Kultur, Politik, Viden & Sport her",DR,https://www.dr.dk/nyheder,17.02.2023 07:18
Wagner-leder: Ruslands monstrøse bureaukrati sænker farten på landets offensiv,17.02.2023 05:28,"Der er tegn på spændinger mellem Ruslands hær og det private militærfirma Wagner-gruppen.I hvert fald langer grundlægger og leder af gruppen, Jevgenij Prigozjin, ud efter Ruslands militærstrategier på sociale medier.Det skriver Ritzau med henvisning til AFP.Prigozjin siger blandt andet, at det kan tage flere måneder, før det lykkes russiske tropper at indtage den sønderbombede by Bakhmut i Ukraine.- Jeg tror, at det bliver i marts eller april, spår Prigozjin om Ruslands mulige overtagelse af Bakhmut.- Fremgangen kommer ikke til at gå så hurtigt, som vi gerne vil have. Bakhmut kunne være blevet indtaget før nytår, hvis ikke det var for vores monstrøse militære bureaukrati, siger Wagner-lederen.Wagner-gruppen er et privat militærfirma, der sender sine soldater ud for at kæmpe flere steder i verden. Udover Ukraine har gruppen blandt andet været aktiv i Syrien og Mali.Gruppen har desuden hvervet soldater fra russiske fængsler, men ifølge Prigozjin er den praksis stoppet.",https://www.dr.dk,DR,https://www.dr.dk/nyheder,"DR nyheder - Hold dig opdateret. Få de seneste nyheder fra Danmark og udlandet. Læs om de største sager, Kultur, Politik, Viden & Sport her",DR,https://www.dr.dk/nyheder,17.02.2023 07:18
Danmark skal hjælpe med at rense Indiens hellige flod,18.02.2023 23:56,Danmark skal hjælpe med at rense Indiens hellige flod,https://www.dr.dk,DR,https://www.dr.dk/nyheder,"DR nyheder - Hold dig opdateret. Få de seneste nyheder fra Danmark og udlandet. Læs om de største sager, Kultur, Politik, Viden & Sport her",DR,https://www.dr.dk/nyheder,17.02.2023 07:18
Efter lægetjek: Biden er fortsat egnet til præsidentjobbet,18.02.2023 23:51,"USA's præsident, 80-årige Joe Biden, er fortsat kampdygtig rent helbredsmæssigt til at varetage sit job som statsoverhoved.Sådan lyder det fra Det Hvide Hus' læge efter en større lægeundersøgelse af præsidenten.Biden er ""egnet til tjeneste og udfører fuldt ud alle sine forpligtelser, uden nogen undtagelser"", lyder det konklusionen ifølge Reuters.Lægetjekket tog tre timer og var det andet, siden Joe Biden blev taget i ed som USA's præsident i 2021.",https://www.dr.dk,DR,https://www.dr.dk/nyheder,"DR nyheder - Hold dig opdateret. Få de seneste nyheder fra Danmark og udlandet. Læs om de største sager, Kultur, Politik, Viden & Sport her",DR,https://www.dr.dk/nyheder,17.02.2023 07:18
Skandaleramt europaparlamentariker skal blive bag tremmer,18.02.2023 23:17,"Den græske europaparlamentariker Eva Kaili, der er sigtet for blandt andet at have modtaget tusindvis af euro i bestikkelse i den såkaldte Qatargate, skal forblive bag tremmer i mindst to måneder.Det har en belgisk dommer i dag besluttet efter et retsmøde i Bruxelles.Eva Kaili har siddet varetægtsfængslet i den belgiske hovedstad siden den 9. december sidste år, hvor korruptionsskandalen begyndte at rulle.Den græske politiker har en blot 23 måneder gammel datter, som hun ifølge sine advokater kun må se to gange om måneden.Og faren til datteren, italieneren Francesco Giorgi, sidder ligeledes varetægtsfængslet i sagen, hvor han er sigtet for at havde modtaget bestikkelse og deltaget i hvidvask af penge.Derfor havde Eva Kailis advokater, som tidligere har betegnet fængslingen som ""tortur"", presset på for, at hun skulle løslades med en elektronisk fodlænke, så hun kunne være sammen med sin datter.Men det afviste dommeren altså i dag, skriver den belgiske avis Le Soir.",https://www.dr.dk,DR,https://www.dr.dk/nyheder,"DR nyheder - Hold dig opdateret. Få de seneste nyheder fra Danmark og udlandet. Læs om de største sager, Kultur, Politik, Viden & Sport her",DR,https://www.dr.dk/nyheder,17.02.2023 07:18
Moldova har fået en ny regering,18.02.2023 23:17,"Moldovas parlament har i dag godkendt en ny regering, efter at den tidligere i sidste uge pludseligt trådte af, da premierminister Natalia Gavrilita meldte sin afgang.Landets nye leder hedder Dorin Recean. Og han har lovet at ville føre en mere pro-vestlig politik i landet, som er Europas fattigste, under slogannet ""velstand, sikkerhed og et europæisk Moldova"". Det skriver Reuters.Et flertal på 62 ud af 101 medlemmer af Moldovas parlament har godkendt ham som ny leder.Den tidligere regering i Moldova holdt i 18 måneder.",https://www.dr.dk,DR,https://www.dr.dk/nyheder,"DR nyheder - Hold dig opdateret. Få de seneste nyheder fra Danmark og udlandet. Læs om de største sager, Kultur, Politik, Viden & Sport her",DR,https://www.dr.dk/nyheder,17.02.2023 07:18
"FCM var ti sekunder fra miraklet, men tager til Herning med alle muligheder",18.02.2023 23:05,"FCM var ti sekunder fra miraklet, men tager til Herning med alle muligheder",https://www.dr.dk,DR,https://www.dr.dk/nyheder,"DR nyheder - Hold dig opdateret. Få de seneste nyheder fra Danmark og udlandet. Læs om de største sager, Kultur, Politik, Viden & Sport her",DR,https://www.dr.dk/nyheder,17.02.2023 07:18
Skadet Holger Rune trækker sig i Rotterdam,18.02.2023 22:51,"En frustreret Holger Rune er overraskende ude af ATP 500-turneringen ABN Amro Open i hollandske Rotterdam.Torsdag trak den 19-årige dansker sig fra opgøret mod hjemmebanefavoritten Gijs Brouwer, der er nummer 160 på verdensranglisten, ved stillingen 4-6, 0-4.Rune fik behandling for et problem med sit højre håndled og forsøgte at spille videre, men efter et parti gav han fortabt.Rune forklarede efter opgøret, at han haft ondt i håndleddet efter et fald under Australian Open i januar.- Jeg har spillet igennem lidt smerte, men i dag gjorde det mere og mere ondt, som kampen skred frem, og til sidst gjorde det for ondt til at fortsætte, siger Holger Rune til TV 2 Sport.",https://www.dr.dk,DR,https://www.dr.dk/nyheder,"DR nyheder - Hold dig opdateret. Få de seneste nyheder fra Danmark og udlandet. Læs om de største sager, Kultur, Politik, Viden & Sport her",DR,https://www.dr.dk/nyheder,17.02.2023 07:18
Mordet på transkønnet teenager har fået vreden til at boble på de britiske øer,18.02.2023 22:44,Mordet på transkønnet teenager har fået vreden til at boble på de britiske øer,https://www.dr.dk,DR,https://www.dr.dk/nyheder,"DR nyheder - Hold dig opdateret. Få de seneste nyheder fra Danmark og udlandet. Læs om de største sager, Kultur, Politik, Viden & Sport her",DR,https://www.dr.dk/nyheder,17.02.2023 07:18
Biden har peget på forsker som USAs første arktiske ambassadør,18.02.2023 22:19,"USA skal have sin første arktiske ambassadør, og nu har præsident Joe Biden peget på den person, som han mener skal have titlen.Det blev Michael Sfraga, som er forsker og er fra delstaten Alaska. Det skriver det amerikanske forsvars-medie Stars and Stripes.Sfraga sidder lige nu som formand for en amerikansk forskningskommission i Arktis. Han har forsket i området og har stort kendskab til arktisk geografi og politik, skriver mediet.Kongressen skal godkende ham, før han kan tiltræde.Den nyoprettede stilling skal fremme USA's interesser i Arktis, som er blevet et område med stor geopolitisk interesse.",https://www.dr.dk,DR,https://www.dr.dk/nyheder,"DR nyheder - Hold dig opdateret. Få de seneste nyheder fra Danmark og udlandet. Læs om de største sager, Kultur, Politik, Viden & Sport her",DR,https://www.dr.dk/nyheder,17.02.2023 07:18
USA fordømmer israelsk soldats overfald på palæstinensisk aktivist,18.02.2023 22:04,"Det amerikanske kontor for palæstinensiske anliggender fordømmer nu en israelsk soldats angreb på den palæstinensiske aktivist Issa Amro.Soldaten blev filmet overfalde aktivisten, der viste den anerkendte amerikanske journalist Lawrence Wright rundt i Hebron på den besatte Vestbred i mandags.Videoen, som er optaget af den belgiske fotograf Barbara Debeuckelaere, kan ses her. Vi skal advare om billeder, der kan være ubehagelige:Det israelske militær har siden fængslet soldaten i 10 dage, hvilket amerikanerne anerkender.Samtidig opfordrer man de israelske myndigheder til ikke at ""ty til urimelig vold nogetsteds, herunder ved checkpoints.(Foto: © Screenshot fra Twitter)Men meldingen fra Israels kontroversielle nye sikkerhedsminister, Itamar Ben-Gvir, er imidlertid, at han ""bakker fuldt op om soldaten, der ikke forblev tavs.Soldater skal gives støtte, ikke fængselsdomme"", siger han ifølge den israelske avis The Jerusalem Post.",https://www.dr.dk,DR,https://www.dr.dk/nyheder,"DR nyheder - Hold dig opdateret. Få de seneste nyheder fra Danmark og udlandet. Læs om de største sager, Kultur, Politik, Viden & Sport her",DR,https://www.dr.dk/nyheder,17.02.2023 07:18
Die Hard-skuespilleren Bruce Willis har fået demens,18.02.2023 21:34,"Skuespilleren Bruce Willis, der for knap et år siden indstillede karrieren, er blevet diagnosticeret med frontotemporal demens.Det oplyser hans ekskone, skuespilleren Demi Moore, i et opslag på Instagram.Familien annoncerede i marts sidste år, at 67-årige Willis led af afasi, der giver kognitive vanskeligheder. Siden da har han fået det værre, skriver Demi Moore.- Bruces tilstand er blevet forværret, og vi har nu fået en mere specifik diagnose: Frontotemporal demens. Desværre er udfordringer med kommunikation kun et symptom på sygdommen, skriver hun.- Selvom det er smerteligt, er det også en lettelse endelig at have en klar diagnose.Bruce Willis er kendt for Blockbuster-baskere som ""Die Hard""-filmene, ""Hostage"" og ""Sin City"".",https://www.dr.dk,DR,https://www.dr.dk/nyheder,"DR nyheder - Hold dig opdateret. Få de seneste nyheder fra Danmark og udlandet. Læs om de største sager, Kultur, Politik, Viden & Sport her",DR,https://www.dr.dk/nyheder,17.02.2023 07:18
Amerikansk senator indlægger sig selv med alvorlig depression,18.02.2023 21:20,"Senatoren i den amerikanske delstat Pennsylvania, John Fetterman, har indlagt sig selv for at modtage behandling for en alvorlig klinisk depression.Den 53-årige demokrat, der fik en alvorlig blodprop sidste år, blev mandag vurderet af Kongressens læge, som anbefalede indlæggelse.Det udtaler Fettermans stabschef, Adam Jentleson, i en erklæring torsdag, skriver Reuters.- Mens John har oplevet depression af og til gennem hele sit liv, er det først blevet alvorligt i løbet af de seneste uger, udtaler Jentleson.- Efter at have undersøgt John, har lægerne fortalte os, at John får den pleje, han har brug, og at han snart vil komme tilbage til sig selv.Fetterman oplevede efter blodproppen i maj sidste år problemer med at opfange talte sætninger, hvilket blandt andet var en stor udfordring under valgkampens debatter.Han formåede på trods af det at vinde et afgørende sæde i Senatet, som var med til at bevare demokraternes flertal.",https://www.dr.dk,DR,https://www.dr.dk/nyheder,"DR nyheder - Hold dig opdateret. Få de seneste nyheder fra Danmark og udlandet. Læs om de største sager, Kultur, Politik, Viden & Sport her",DR,https://www.dr.dk/nyheder,17.02.2023 07:18
Rusland og Ukraine udveksler hundredvis af krigsfanger,18.02.2023 21:08,"101 krigsfanger på hver side af konflikten er blevet udvekslet mellem Rusland og Ukraine. Det oplyser myndigheder fra begge lande, skriver nyhedsbureauet Reuters.Forsvarsdepartementet i Rusland var det første til at meddele om fangeudvekslingen.- Militære transportfly fra det russiske luftforsvar henter de løsladte soldater til Moskva for behandling og rehabilitering på medicinske institutioner under forsvarsministeriet, lyder det i en skriftlig udtalelse.Derefter lød det fra Volodymyr Zelenskyjs præsidentkontor, at 101 personer var blevet sendt fra russiske krigsfangelejre tilbage til Ukraine. 100 soldater og én civil, fortæller Zelenskyjs stabschef, Andrij Jermak.",https://www.dr.dk,DR,https://www.dr.dk/nyheder,"DR nyheder - Hold dig opdateret. Få de seneste nyheder fra Danmark og udlandet. Læs om de største sager, Kultur, Politik, Viden & Sport her",DR,https://www.dr.dk/nyheder,17.02.2023 07:18
Barcelona og United deler i underholdende gigantmøde,18.02.2023 21:04,"Der var dømt gigantmøde på næstøverste hylde inden for europæisk fodbold, da FC Barcelona torsdag tog imod Manchester United.De to storklubber mødtes på Camp Nou i den første af to 16.-delsfinaler i Europa League, i hvad der endte med at blive en underholdende affære.Kampen endte 2-2, efter at både Barcelona og United undervejs havde været foran. Alle mål blev scoret i anden halvleg.Dermed er det altså helt åbent inden næste uges returkamp på Old Trafford.Andreas Christensen startede på bænken for Barcelona, men kom på banen midtvejs i anden halvleg. Christian Eriksen er fortsat ude med en ankelskade for United./ritzau/",https://www.dr.dk,DR,https://www.dr.dk/nyheder,"DR nyheder - Hold dig opdateret. Få de seneste nyheder fra Danmark og udlandet. Læs om de største sager, Kultur, Politik, Viden & Sport her",DR,https://www.dr.dk/nyheder,17.02.2023 07:18
