title,published,text,link,og:site_name,og:url,site_description,name,url,scrape_time
Præsident Zelenskyj beder endnu engang om flere våben og yderligere sanktioner mod Rusland,26.01.2023 00:00,"- Den russiske aggression kan og bør kun stoppes med passende våben. Terrorstaten vil ikke forstå andet.- Våben på slagmarken. Våben, der beskytter vores himmel.Sådan lyder det blandt andet i den seneste tale fra den ukrainske præsident, Volodymyr Zelenskyj.Flere missiler havde i går direkte kurs mod Ukraine, og flere blev sendt i retning mod hovedstaden Kyiv. Langt hovedparten blev skudt ned - men missilerne, der ramte landjorden, resulterede i store ødelæggelser, og mindst 11 personer mistede livet.Zelenskyj vil udover flere våben også have yderligere sanktioner mod Rusland. Både økonomiske og politiske.",https://www.dr.dk,DR,https://www.dr.dk/nyheder,"DR nyheder - Hold dig opdateret. Få de seneste nyheder fra Danmark og udlandet. Læs om de største sager, Kultur, Politik, Viden & Sport her",DR,https://www.dr.dk/nyheder,27.01.2023 07:17
"I Memphis mindes de den 29-årige mand, der døde efter at være blevet anholdt af fem politibetjente",27.01.2037 00:00,"Indbyggere i Memphis i Tennessee i USA var i nat dansk tid på gaden for fredeligt at protestere, efter at den 29-årige Tyre Nichols tidligere på måneden døde efter en brutal anholdelse af fem politibetjente.- Retfærdighed for Tyre, råbte de fremmødte blandt andet, og Tyre Nichols mor var også mødt op.- Jeg vil, at alle protesterer fredeligt, sagde hun blandt andet.Tyre Nichols døde på hospitalet den 10. januar. (Foto: © FACEBOOK/DEANDRE NICHOLS, Ritzau Scanpix)Forventningen er, at Tyre Nichols død og anholdelsen af de fem betjente kan betyde store protester i USA. Den amerikanske præsident, Joe Biden, opfordrer til, at eventuelle protester udspiller sig fredeligt.Tyre Nichols blev anholdt i forbindelse med et trafikstop og døde tre dage senere af indre blødninger.Mange venter lige nu på, at optagelserne fra de tidligere politimænds kropskameraer bliver frigivet. Optagelserne vil afsløre, hvad der skete under anholdelsen.",https://www.dr.dk,DR,https://www.dr.dk/nyheder,"DR nyheder - Hold dig opdateret. Få de seneste nyheder fra Danmark og udlandet. Læs om de største sager, Kultur, Politik, Viden & Sport her",DR,https://www.dr.dk/nyheder,27.01.2023 07:17
Regn og frost giver ekstremt hullede veje,27.01.2039 00:00,Regn og frost giver ekstremt hullede veje,https://www.dr.dk,DR,https://www.dr.dk/nyheder,"DR nyheder - Hold dig opdateret. Få de seneste nyheder fra Danmark og udlandet. Læs om de største sager, Kultur, Politik, Viden & Sport her",DR,https://www.dr.dk/nyheder,27.01.2023 07:17
"Danmark skal være med til at undersøge, om russiske ledere kan retsforfølges",27.01.2023 07:05,"Den danske regering kommer til at indgå i en kernegruppe af lande, som skal undersøge, hvordan russiske ledere kan retsforfølges for Ruslands agression mod Ukraine.Det skriver Udenrigsministeriet i en pressemeddelelse.I takt med at områder i Ukraine er blevet befriet, er flere historier om massegrave og overgreb kommet frem.Det er beretninger som disse, der understreger behovet for retsforfølgelse af russiske forbrydelser, påpeger udenrigsminister Lars Løkke Rasmussen (M).- Det her er også et spørgsmål om vores ansvar for den internationale retsorden og staters suverænitet. Derfor har vi taget imod ukrainernes invitation om at være med i kernegruppen. Her vil vi bringe vores juridiske ekspertise til bordet for at sikre, at russiske ledere stilles til ansvar for Ruslands aggression, lyder det fra udenrigsministeren.",https://www.dr.dk,DR,https://www.dr.dk/nyheder,"DR nyheder - Hold dig opdateret. Få de seneste nyheder fra Danmark og udlandet. Læs om de største sager, Kultur, Politik, Viden & Sport her",DR,https://www.dr.dk/nyheder,27.01.2023 07:17
"Rød-hvide favoritter? Ja, men Spanien er Danmarks onde ånd i knockout-kampe",27.01.2023 07:04,"Rød-hvide favoritter? Ja, men Spanien er Danmarks onde ånd i knockout-kampe",https://www.dr.dk,DR,https://www.dr.dk/nyheder,"DR nyheder - Hold dig opdateret. Få de seneste nyheder fra Danmark og udlandet. Læs om de største sager, Kultur, Politik, Viden & Sport her",DR,https://www.dr.dk/nyheder,27.01.2023 07:17
Fredag giver tørvejr og sol til næsten hele landet,27.01.2023 06:29,"Dagens vejr ligner på mange måder en kopi af torsdagens dog med den tilføjelse, at der vil være endnu færre skyer mod øst, så større dele af Sjælland og øerne omkring vil få udsigt til en blå himmel.Der vil dog senere være skyer i områder ud mod Østersøen, så muligheden for at nyde solen er ikke ensartet i hele landet.Temperaturen starter de fleste steder på den kølige side af frysepunktet, men vi når i dag et niveau mellem 0 og 4 graders varme.Vinden er svag til jævn fra nordlige retninger, men drejer senere mod vest. Temperaturen i nat vil igen være under frysepunktet i det meste af landet.",https://www.dr.dk,DR,https://www.dr.dk/nyheder,"DR nyheder - Hold dig opdateret. Få de seneste nyheder fra Danmark og udlandet. Læs om de største sager, Kultur, Politik, Viden & Sport her",DR,https://www.dr.dk/nyheder,27.01.2023 07:17
Amerikanerne svinger kortet i stor stil trods frygt for økonomisk krise: Det er godt nyt for amerikanerne og præsident Biden,27.01.2023 06:25,Amerikanerne svinger kortet i stor stil trods frygt for økonomisk krise: 'Det er godt nyt for amerikanerne og præsident Biden' ,https://www.dr.dk,DR,https://www.dr.dk/nyheder,"DR nyheder - Hold dig opdateret. Få de seneste nyheder fra Danmark og udlandet. Læs om de største sager, Kultur, Politik, Viden & Sport her",DR,https://www.dr.dk/nyheder,27.01.2023 07:17
Israel udfører angreb i Gaza som modsvar på raketangreb,27.01.2023 06:05,"Den israelske hær oplyser ifølge nyhedsbureauet AFP, at den har udført et missilangreb i Gaza som modsvar på et raketangreb.- Den israelske forsvarsstyrke angriber lige nu i Gazastriben, lyder det i en udtalelse fra den israelske hær.Israelsk militær oplyser, at to raketter blev affyret fra Gaza omkring midnat lokal tid. Kort tid efter foretog Israel et missilangreb som modsvar, hvor der herefter blev affyret yderligere tre raketter fra Gaza.Ingen gruppering har taget skylden for raketterne, der er blevet affyret fra Gaza.Missil- og raketangrebene sker, mens spændingerne mellem parterne spidser til. Ifølge palæstinensiske embedsmænd trængte israelske styrker i går ind i byen Jenin på Vestbredden og dræbte ni personer.Den israelske hær hævder, at den har været i skudvekslinger med militante islamister under en operation for at bekæmpe terror.",https://www.dr.dk,DR,https://www.dr.dk/nyheder,"DR nyheder - Hold dig opdateret. Få de seneste nyheder fra Danmark og udlandet. Læs om de største sager, Kultur, Politik, Viden & Sport her",DR,https://www.dr.dk/nyheder,27.01.2023 07:17
Millionerne er på vej: Gaskunder har udsigt til store udbetalinger,27.01.2023 06:01,Millionerne er på vej: Gaskunder har udsigt til store udbetalinger,https://www.dr.dk,DR,https://www.dr.dk/nyheder,"DR nyheder - Hold dig opdateret. Få de seneste nyheder fra Danmark og udlandet. Læs om de største sager, Kultur, Politik, Viden & Sport her",DR,https://www.dr.dk/nyheder,27.01.2023 07:17
Hvert år forurener og skader vi den danske natur og klimaet for 250 milliarder,27.01.2023 06:00,Hvert år forurener og skader vi den danske natur og klimaet for 250 milliarder,https://www.dr.dk,DR,https://www.dr.dk/nyheder,"DR nyheder - Hold dig opdateret. Få de seneste nyheder fra Danmark og udlandet. Læs om de største sager, Kultur, Politik, Viden & Sport her",DR,https://www.dr.dk/nyheder,27.01.2023 07:17
Arkæologer finder ny mumie - kan være den ældste nogensinde,27.01.2023 05:52,"Arkæologer i Saqqara, der fungerede som hovedstad i oldtidens Egypten, har fundet en mumie, som muligvis er den ældste af sin slags.Mumien er 4300 år gammel og hed Hekahepes, skriver Reuters.Det var i bunden af en 15 meter dyb skakt, at det ældgamle lig dukkede op. Fundet er sket ved Trinpyramiden, som ligger lidt uden for Egyptens hovedstad, Kairo.- Mumien her kan være den ældste og mest komplette mumie, som nogensinde er blevet fundet i Egypten, siger Zahi Hawass, som er chef for holdet af arkæologer på stedet.Arkæologer i Egypten gør generelt store fremskridt for tiden.For knap to uger siden kunne landets myndigheder oplyse, at der var var blevet opdaget en 3500 år gammel grav i byen Luxor. Arkæologerne mener, at den indeholder jordiske rester af en royal fra det 18. dynasti.",https://www.dr.dk,DR,https://www.dr.dk/nyheder,"DR nyheder - Hold dig opdateret. Få de seneste nyheder fra Danmark og udlandet. Læs om de største sager, Kultur, Politik, Viden & Sport her",DR,https://www.dr.dk/nyheder,27.01.2023 07:17
51-årig varetægtsfængslet i sag om dødfunden kvinde,27.01.2023 05:31,"En 51-årig mand, der er sigtet for at voldtage en 23-årig kvinde, som torsdag morgen blev fundet død i sin lejlighed i Roskilde, er blevet varetægtsfængslet.Det fortæller vagtchef ved Midt- og Vestsjællands Politi Henrik Olesen til Ritzau.Manden var torsdag aften i grundlovsforhør, hvor sigtelsen blev læst op for ham.Dommeren valgte at følge anklagerens begæring om at holde retsmødet for lukkede døre, og derfor udebliver de nærmere detaljer om sagen indtil videre.Der er desuden nedlagt navneforbud i sagen.",https://www.dr.dk,DR,https://www.dr.dk/nyheder,"DR nyheder - Hold dig opdateret. Få de seneste nyheder fra Danmark og udlandet. Læs om de største sager, Kultur, Politik, Viden & Sport her",DR,https://www.dr.dk/nyheder,27.01.2023 07:17
Beredskab har fuld kontrol over brand i København,27.01.2023 05:12,"21 køretøjer og 49 brandmænd var til stede ved en brand på Damhus Boulevard på den københavnske vestegn i nat.Flammerne havde spredt sig til en bygning, der er under renovering, og som dermed ikke er beboet.Alligevel blev det nødvendigt at evakuere seks personer fra nabobygningerne, oplyser politiet. Det er endnu ikke muligt at sige noget om brandårsagen.- Vi skal selvfølgelig have undersøgt det, når branden er slukket.- Det hele skal køle af, før vores teknikere kan komme ind og undersøge det, siger han.På Twitter oplyser Hovedstadens Beredskab, at langt de fleste brandmænd er sendt hjem, men at flere vil være til stede omkring branden i løbet af formiddagen.",https://www.dr.dk,DR,https://www.dr.dk/nyheder,"DR nyheder - Hold dig opdateret. Få de seneste nyheder fra Danmark og udlandet. Læs om de største sager, Kultur, Politik, Viden & Sport her",DR,https://www.dr.dk/nyheder,27.01.2023 07:17
Amerikansk militær hævder at have dræbt IS-leder i Somalia,28.01.2023 23:56,"I en pressemeddelelse fra Pentagon hævder det amerikanske forsvarsministerium at have dræbt den somaliske IS-leder Bilal al-Sudani.Efter ordre fra den amerikanske præsident Joe Biden har amerikansk militær gennemført et angreb i det nordlige Somalia, der udover al-Sudani også dræbte en række medlemmer af Islamisk Stat.I pressemeddelelsen skriver de, at al-Sudani var ansvarlig for Islamisk Stats voksende tilstedeværelse i Afrika og finansierede gruppens operationer.Ingen civile kom til skade under operationen, og der meldes ikke om tilskadekomne amerikanske soldater.",https://www.dr.dk,DR,https://www.dr.dk/nyheder,"DR nyheder - Hold dig opdateret. Få de seneste nyheder fra Danmark og udlandet. Læs om de største sager, Kultur, Politik, Viden & Sport her",DR,https://www.dr.dk/nyheder,27.01.2023 07:17
Angreb på pendlere sender canadisk politi til offentlig transport i Toronto,28.01.2023 23:44,"Pendlere i Canadas største by Toronto har været udsat for en stribe tilfældige angreb i så høj grad, at politiet nu skal udstationeres i metro og på togstationer.Der er tale om 80 betjente, der skal sikre pendlernes sikkerhed. Det meddeler Torontos politichef Myron Demkiw ifølge The Guardian.Betjentene sendes mod den offentlige transport efter opfordring fra de ansatte i togene, der også har været udsat for vold.The Guardian skriver, at der i løbet af de sidste par dage har været angreb på pendlere og ansatte med knive eller kanyler.",https://www.dr.dk,DR,https://www.dr.dk/nyheder,"DR nyheder - Hold dig opdateret. Få de seneste nyheder fra Danmark og udlandet. Læs om de største sager, Kultur, Politik, Viden & Sport her",DR,https://www.dr.dk/nyheder,27.01.2023 07:17
Biden opfordrer til rolige protester efter anholdelse af fem tidligere politimænd,28.01.2023 23:15,"Den amerikanske præsident Joe Biden beder om fredelige optog i kølvandet på, at fem forhenværende politibetjente er blevet anholdt for mordet på 29-årige Tyre Nichols.I en pressemeddelelse fra Det Hvide Hus opfordrer Biden alle til at ikke at lade vold styre eventuelle protester i forbindelse med anholdelserne.- Forargelse er forståelig, men vold er aldrig acceptabelt. Tyres død er en smertefuld påmindelse om, at vi skal gøre mere for at sikre, at vores strafferetlige system lever op til løftet om retfærdighed og upartisk retfærdighed, ligebehandling og værdighed for alle, skriver Biden.Tyre Nichols blev anholdt i forbindelse med et trafikstop. Han døde tre dage senere af indre blødninger.De fem tidligere politibetjente, der først blev fyret, men siden anholdt i forbindelse med 29-årige Tyre Nichols død. (Foto: © MPD)",https://www.dr.dk,DR,https://www.dr.dk/nyheder,"DR nyheder - Hold dig opdateret. Få de seneste nyheder fra Danmark og udlandet. Læs om de største sager, Kultur, Politik, Viden & Sport her",DR,https://www.dr.dk/nyheder,27.01.2023 07:17
Arkæologer erklærer fund af mumie til Egyptens ældste,28.01.2023 22:28,"En gammel faraos gravkammer er blevet opdaget nær Kairo i Egypten. Her har arkæologer fundet, hvad de vurderer som den ældste mumie gravet op i Egypten nogensinde.The Guardian skriver, at mumien kan dateres 4.300 år tilbage, og at den blev fundet 15 meter under jorden sammen med andre gravkamre.Den her mumie kan være den ældste og mest velbevarede mumie fundet i Egypten til dato, siger Zahi Hawass, der leder den arkæologiske ekspedition.Mumiens navn er Hekashepes, og sammen med den blev også fundet flere forskellige statuer.Egyptiske arbejdere ved udgravningen. (Foto: © KHALED DESOUKI, Ritzau Scanpix)Sammen med mumien blev også statuer fundet. De forestiller en mand og hans kone med deres tjenestefolk. (Foto: © Khaled Desouki, Ritzau Scanpix)Gravkammeret blev fundet nær Cairo. (Foto: © Khaled Desouki, Ritzau Scanpix)Her arbejder en arkæolog forsigtigt. (Foto: © Khaled Desouki, Ritzau Scanpix)Ekspeditionens leder Zahi Hawass holder et pressemøde for at offentliggøre fundet. (Foto: © Khaled Desouki, Ritzau Scanpix)1 / 5Egyptiske arbejdere ved udgravningen. (Foto: © KHALED DESOUKI, Ritzau Scanpix)1 / 5Sammen med mumien blev også statuer fundet. De forestiller en mand og hans kone med deres tjenestefolk. (Foto: © Khaled Desouki, Ritzau Scanpix)2 / 5Gravkammeret blev fundet nær Cairo. (Foto: © Khaled Desouki, Ritzau Scanpix)3 / 5Her arbejder en arkæolog forsigtigt. (Foto: © Khaled Desouki, Ritzau Scanpix)4 / 5Ekspeditionens leder Zahi Hawass holder et pressemøde for at offentliggøre fundet. (Foto: © Khaled Desouki, Ritzau Scanpix)5 / 5",https://www.dr.dk,DR,https://www.dr.dk/nyheder,"DR nyheder - Hold dig opdateret. Få de seneste nyheder fra Danmark og udlandet. Læs om de største sager, Kultur, Politik, Viden & Sport her",DR,https://www.dr.dk/nyheder,27.01.2023 07:17
USA lukker hackerhjemmeside brugt til afpresning,28.01.2023 21:58,"Det amerikanske justitsministerium har slået til mod en international hackergruppe ved navn Hive og lukket dens hjemmeside ned.Det oplyser det amerikanske justitsministerium, skriver nyhedsbureauet Reuters.Hive har via tasterne afpresset ofre for mere end 100 millioner dollar, hvilket svarer til næsten 700 millioner kroner. Desuden står gruppen bag cyberangreb på over 1500 virksomheder ved at bruge ransomware.Ransomware er en computervirus, der bruges til at stjæle data, som kun gives tilbage imod en betaling af løsepenge.Indsatsen mod Hive er et samarbejde mellem amerikanske, tyske og hollandske myndigheder. Ingen er blevet tilbageholdt i sagen, men FBI sender en advarsel ud til Hives hackere.- Alle, der har været involveret med Hive, skal være bekymrede for mulig anholdelse, siger FBIs direktør Christopher Wray.",https://www.dr.dk,DR,https://www.dr.dk/nyheder,"DR nyheder - Hold dig opdateret. Få de seneste nyheder fra Danmark og udlandet. Læs om de største sager, Kultur, Politik, Viden & Sport her",DR,https://www.dr.dk/nyheder,27.01.2023 07:17
Forsvarslektor advarer mod at overvurdere effekten af nye kampvogne: Slå koldt vand i blodet,28.01.2023 21:24,Forsvarslektor advarer mod at overvurdere effekten af nye kampvogne: 'Slå koldt vand i blodet',https://www.dr.dk,DR,https://www.dr.dk/nyheder,"DR nyheder - Hold dig opdateret. Få de seneste nyheder fra Danmark og udlandet. Læs om de største sager, Kultur, Politik, Viden & Sport her",DR,https://www.dr.dk/nyheder,27.01.2023 07:17
Ecuador erklærer krig mod illegal minedrift,28.01.2023 21:12,"Illegal minedrift er et voksende problem i Ecuador, og nu udråber landets regering det som en national sikkerhedstrussel.For udover at tage arbejdet fra minearbejderne, så har illegal minedrift tråde til hvidvaskning og ulovlig våbenhandel, skriver nyhedsbureauet Reuters.Ecuadors regering vil derfor støtte internationale virksomheder, der fører lovlig minedrift. Særligt i Amazonas, hvor der er store reserver af guld og kobber.Landets forsvarsminister, Diego Ordonez, siger ifølge Reuters, at de vil bemande miner med bevæbnede styrker, der skal sikre områderne.- Ulovlig minedrift er en del af kæden af våbenhandel og handel med sprængstoffer og hvidvaskning af penge, og derfor betragtes det som en aktivitet, der angriber den nationale sikkerhed, siger Diego Ordonez og tilføjer, at illegal minedrift også er en miljøtrussel.",https://www.dr.dk,DR,https://www.dr.dk/nyheder,"DR nyheder - Hold dig opdateret. Få de seneste nyheder fra Danmark og udlandet. Læs om de største sager, Kultur, Politik, Viden & Sport her",DR,https://www.dr.dk/nyheder,27.01.2023 07:17
Fem politibetjente anholdt i USA for drab på 29-årig mand,28.01.2023 21:02,"Fem sorte politibetjente i Memphis i delstaten Tennessee er blevet anholdt og sigtet for drab på en sort mand, der døde efter en arrestation i begyndelsen af januar.Det skriver New York Times.De fem betjente blev i sidste uge fyret af politiet, efter at de blev anklaget for at have brugt unødig vold mod den 29-årige Tyre Nichols i forbindelse med en anholdelse efter et trafikstop. Nichols døde tre dage senere af indre blødninger.Hændelsen er blevet filmet på betjentenes kropskameraer, og videoerne ventes at blive offentliggjort fredag, skriver nyhedsbureauet Reuters.",https://www.dr.dk,DR,https://www.dr.dk/nyheder,"DR nyheder - Hold dig opdateret. Få de seneste nyheder fra Danmark og udlandet. Læs om de største sager, Kultur, Politik, Viden & Sport her",DR,https://www.dr.dk/nyheder,27.01.2023 07:17
Forsvaret trodser kritik: Forhandler med israelsk selskab om indkøb af nye våben,28.01.2023 20:50,Forsvaret trodser kritik: Forhandler med israelsk selskab om indkøb af nye våben,https://www.dr.dk,DR,https://www.dr.dk/nyheder,"DR nyheder - Hold dig opdateret. Få de seneste nyheder fra Danmark og udlandet. Læs om de største sager, Kultur, Politik, Viden & Sport her",DR,https://www.dr.dk/nyheder,27.01.2023 07:17
"Energiselskaber skal tilbagebetale 1,2 milliarder kroner",28.01.2023 20:33,"Som følge af energikrisen endte danske energiselskaber med at tjene ekstraordinært mange penge, men nu skal de betale 1,2 milliarder kroner af indtjeningen tilbage.Det oplyser skatteminister Jeppe Bruus (S) til Finans.- Samlet set vil der i 2023 være et provenu på 1,2 milliarder kroner. De penge vil vi føre tilbage til forbrugerne i forbindelse med de forestående forhandlinger om inflationshjælp, siger han.Skatteministeriet forudser, at fossile energiselskaber vil sende 800 millioner kroner i statskassen.",https://www.dr.dk,DR,https://www.dr.dk/nyheder,"DR nyheder - Hold dig opdateret. Få de seneste nyheder fra Danmark og udlandet. Læs om de største sager, Kultur, Politik, Viden & Sport her",DR,https://www.dr.dk/nyheder,27.01.2023 07:17
Lille bysamfund stod sammen i sorgen: Dræbte piger mindet med tændte fakler,28.01.2023 20:19,Lille bysamfund stod sammen i sorgen: Dræbte piger mindet med tændte fakler,https://www.dr.dk,DR,https://www.dr.dk/nyheder,"DR nyheder - Hold dig opdateret. Få de seneste nyheder fra Danmark og udlandet. Læs om de største sager, Kultur, Politik, Viden & Sport her",DR,https://www.dr.dk/nyheder,27.01.2023 07:17
Kulturminister reagerer lynhurtigt: Dannebrog vajer igen over Kronborg Slot i morgen,28.01.2023 20:09,"Nyheden om, at den daglige hejsning af Dannebrog ved Kronborg Slot var droppet i en spareøvelse, fik kulturministeren til at reagere hurtigt.På under en time var problemet løst, og det danske flag kommer igen til at vaje over det nordsjællandske slot i morgen.Siden 1600-tallet har Dannebrog blafret i vinden på Kronborg, og den tradition ville ministeren bevare.Han ringede derfor omgående til Slots- og Kulturstyrelsen og fik dem til at omgøre beslutningen.- Som politiker arbejder man nogle gange med problemer, der tager lang tid at løse. Heldigvis er der også problemer, der tager kort tid at løse. Det her var en af de sidstnævnte, siger Jakob Engel-Schmidt til Ritzau.Fra årsskiftet har der ikke været flaget med Dannebrog på Kronborg Slot, fordi Slots- og Kulturstyrelsen havde fjernet de faste vagter og i stedet ladet overvågningen af slottet ske fra vagtstuen på Amalienborg.Det skulle spare én million kroner om året.- Der bliver fundet en markant billigere løsning. Det arbejder jeg med styrelsen om at sikre, siger Jakob Engel-Schmidt.",https://www.dr.dk,DR,https://www.dr.dk/nyheder,"DR nyheder - Hold dig opdateret. Få de seneste nyheder fra Danmark og udlandet. Læs om de største sager, Kultur, Politik, Viden & Sport her",DR,https://www.dr.dk/nyheder,27.01.2023 07:17
TikTok vokser markant blandt unge voksne: Det er vilde tal,28.01.2023 20:08,TikTok vokser markant blandt unge voksne: 'Det er vilde tal',https://www.dr.dk,DR,https://www.dr.dk/nyheder,"DR nyheder - Hold dig opdateret. Få de seneste nyheder fra Danmark og udlandet. Læs om de største sager, Kultur, Politik, Viden & Sport her",DR,https://www.dr.dk/nyheder,27.01.2023 07:17
Spansk politi efterforsker hadforbrydelse mod fodboldspiller,28.01.2023 19:32,"Spansk politi har åbnet en efterforskning, efter en sort-farvet dukke er blevet fundet hængende fra en bro i Madrid.CNN skriver, at dukken var iført fodboldtrøje fra klubben Real Madrid med den brasilianske spiller Vinícius Juniors navn og nummer på ryggen. På broen, der ikke ligger langt fra Real Madrids træningsbaner, var også et banner med teksten 'Madrid hader Real'. Banneret var fjernet, inden politiet nåede frem til broen.Spansk politi efterforsker dukken som en mulig hadforbrydelse.Dukken er fundet forud for Real Madrids opgør mod lokalrivalerne Atletico Madrid i aften i den spanske pokalturnering Copa del Rey.Atletico Madrid har på Twitter taget afstand fra dukken. En gerning klubben kalder for uacceptabel.",https://www.dr.dk,DR,https://www.dr.dk/nyheder,"DR nyheder - Hold dig opdateret. Få de seneste nyheder fra Danmark og udlandet. Læs om de største sager, Kultur, Politik, Viden & Sport her",DR,https://www.dr.dk/nyheder,27.01.2023 07:17
Danmark har trecifret millionbeløb på spil i tysk svindelbanks konkurs,28.01.2023 19:28,Danmark har trecifret millionbeløb på spil i tysk svindelbanks konkurs,https://www.dr.dk,DR,https://www.dr.dk/nyheder,"DR nyheder - Hold dig opdateret. Få de seneste nyheder fra Danmark og udlandet. Læs om de største sager, Kultur, Politik, Viden & Sport her",DR,https://www.dr.dk/nyheder,27.01.2023 07:17
Tidligere vicepræsidenter og præsidenter i USA opfordres til at lede efter klassificerede dokumenter,28.01.2023 19:11,"Først blev der fundet klassificerede dokumenter hos den tidligere præsident Donald Trump, efterfølgende er der fundet flere hos den siddende præsident Joe Biden og sidenhen hos Trumps tidligere vicepræsident, Mike Pence.Nu opfordrer det amerikanske nationalarkiv alle tidligere præsidenter og vicepræsidenter til at kigge skuffer, pengeskabe eller andre steder igennem for glemte klassificerede dokumenter, skriver CNN.Nationalarkivet har derfor sendt et brev til alle fra de seneste seks præsidentperioder – fra Ronald Reagans administration i 1980 til Joe Bidens administration i dag.Forleden kom det frem, at amerikanske embedsfolk fandt yderligere seks klassificerede dokumenter i Joe Bidens hjem i Delaware efter en frivillig søgning godkendt af Biden selv.",https://www.dr.dk,DR,https://www.dr.dk/nyheder,"DR nyheder - Hold dig opdateret. Få de seneste nyheder fra Danmark og udlandet. Læs om de største sager, Kultur, Politik, Viden & Sport her",DR,https://www.dr.dk/nyheder,27.01.2023 07:17
