title,published,text,link,og:site_name,og:url,site_description,name,url,scrape_time
"Politik Næstformand påstod, at vacciner slog børn ihjel, og at minister skulle dømmes ved retsopgør – nu beklager hun",18.02.2023 00:00,,https://www.berlingske.dk/politik/naestformand-paastod-at-vacciner-slog-boern-ihjel-og-at-minister-skulle,Berlingske.dk,https://www.berlingske.dk/nyheder,Læs alle nyhederne fra Danmark og resten af verden på berlingske.dk. Med Berlingske Nyheder får du det seneste nyhedsoverblik fra både ind- og udland. ,Berlingske,https://www.berlingske.dk/nyheder,17.02.2023 07:18
Internationalt Norge sender 51 milliarder kroner fra olieindtægter til Ukraine,18.02.2023 00:00,,https://www.berlingske.dk/internationalt/norge-sender-51-milliarder-kroner-fra-olieindtaegter-til-ukraine,Berlingske.dk,https://www.berlingske.dk/nyheder,Læs alle nyhederne fra Danmark og resten af verden på berlingske.dk. Med Berlingske Nyheder får du det seneste nyhedsoverblik fra både ind- og udland. ,Berlingske,https://www.berlingske.dk/nyheder,17.02.2023 07:18
Samfund Dommer afviser at forhøje erstatning for 466 døgn bag tremmer,18.02.2023 00:00,,https://www.berlingske.dk/samfund/dommer-afviser-at-forhoeje-erstatning-for-466-doegn-bag-tremmer,Berlingske.dk,https://www.berlingske.dk/nyheder,Læs alle nyhederne fra Danmark og resten af verden på berlingske.dk. Med Berlingske Nyheder får du det seneste nyhedsoverblik fra både ind- og udland. ,Berlingske,https://www.berlingske.dk/nyheder,17.02.2023 07:18
Samfund 44-årig mand tilstår knivdrab på sin mor,18.02.2023 00:00,,https://www.berlingske.dk/samfund/44-aarig-mand-tilstaar-knivdrab-paa-sin-mor,Berlingske.dk,https://www.berlingske.dk/nyheder,Læs alle nyhederne fra Danmark og resten af verden på berlingske.dk. Med Berlingske Nyheder får du det seneste nyhedsoverblik fra både ind- og udland. ,Berlingske,https://www.berlingske.dk/nyheder,17.02.2023 07:18
Samfund Abonnement Verdens ældste kvinde er død. Sådan får vi så langt et liv som muligt,18.02.2023 00:00,,https://www.berlingske.dk/samfund/verdens-aeldste-kvinde-er-doed-saadan-faar-vi-saa-langt-et-liv-som-muligt,Berlingske.dk,https://www.berlingske.dk/nyheder,Læs alle nyhederne fra Danmark og resten af verden på berlingske.dk. Med Berlingske Nyheder får du det seneste nyhedsoverblik fra både ind- og udland. ,Berlingske,https://www.berlingske.dk/nyheder,17.02.2023 07:18
Der venter en -udfordrende vejrdag-: Stormen Otto tager fat fra 15-tiden,01.02.2023 00:00,,https://politiken.dk/indland/art9218224/Der-venter-en-%E2%80%99udfordrende-vejrdag%E2%80%99-Stormen-Otto-tager-fat-fra-15-tiden,Politiken,https://politiken.dk/nyheder/,"Hold dig opdateret pÃ¥ de seneste nyheder pÃ¥ politiken.dk: Seneste Politiken, Seneste Danmark, Seneste Kultur og Seneste Internationalt. ",Politiken,https://politiken.dk/nyheder/,17.02.2023 07:18
Wagner-leder langer ud efter bureaukrati i Ruslands militær,01.02.2023 00:00,,https://politiken.dk/udland/art9218171/Wagner-leder-langer-ud-efter-bureaukrati-i-Ruslands-milit%C3%A6r,Politiken,https://politiken.dk/nyheder/,"Hold dig opdateret pÃ¥ de seneste nyheder pÃ¥ politiken.dk: Seneste Politiken, Seneste Danmark, Seneste Kultur og Seneste Internationalt. ",Politiken,https://politiken.dk/nyheder/,17.02.2023 07:18
Belgien beholder korruptionssigtede EU-politikere bag tremmer,01.02.2023 00:00,,https://politiken.dk/udland/art9218208/Belgien-beholder-korruptionssigtede-EU-politikere-bag-tremmer,Politiken,https://politiken.dk/nyheder/,"Hold dig opdateret pÃ¥ de seneste nyheder pÃ¥ politiken.dk: Seneste Politiken, Seneste Danmark, Seneste Kultur og Seneste Internationalt. ",Politiken,https://politiken.dk/nyheder/,17.02.2023 07:18
Taiwan undersøger nedfalden vejrballon - formodentlig fra Kina,01.02.2023 00:00,,https://politiken.dk/udland/art9218213/Taiwan-unders%C3%B8ger-nedfalden-vejrballon-%E2%80%93-formodentlig-fra-Kina,Politiken,https://politiken.dk/nyheder/,"Hold dig opdateret pÃ¥ de seneste nyheder pÃ¥ politiken.dk: Seneste Politiken, Seneste Danmark, Seneste Kultur og Seneste Internationalt. ",Politiken,https://politiken.dk/nyheder/,17.02.2023 07:18
"Martin Damm bryder sig ikke om, når det handler om ham selv",03.02.2023 00:00,,https://politiken.dk/navne/art9177982/Martin-Damm-bryder-sig-ikke-om-n%C3%A5r-det-handler-om-ham-selv,Politiken,https://politiken.dk/nyheder/,"Hold dig opdateret pÃ¥ de seneste nyheder pÃ¥ politiken.dk: Seneste Politiken, Seneste Danmark, Seneste Kultur og Seneste Internationalt. ",Politiken,https://politiken.dk/nyheder/,17.02.2023 07:18
Fik du hørt? Lise Nørgaard betalte prisen for sin nysgerrighed,04.02.2023 00:00,,https://politiken.dk/podcast/dulyttertilpolitiken/art9210301/Lise-N%C3%B8rgaard-betalte-prisen-for-sin-nysgerrighed,Politiken,https://politiken.dk/nyheder/,"Hold dig opdateret pÃ¥ de seneste nyheder pÃ¥ politiken.dk: Seneste Politiken, Seneste Danmark, Seneste Kultur og Seneste Internationalt. ",Politiken,https://politiken.dk/nyheder/,17.02.2023 07:18
Læge: Joe Biden er fortsat i fin form til præsidentjobbet,08.02.2023 00:00,,https://politiken.dk/udland/art9218160/Joe-Biden-er-fortsat-i-fin-form-til-pr%C3%A6sidentjobbet,Politiken,https://politiken.dk/nyheder/,"Hold dig opdateret pÃ¥ de seneste nyheder pÃ¥ politiken.dk: Seneste Politiken, Seneste Danmark, Seneste Kultur og Seneste Internationalt. ",Politiken,https://politiken.dk/nyheder/,17.02.2023 07:18
Sturgeons afløser skal findes om seks uger,08.02.2023 00:00,,https://politiken.dk/udland/art9218158/Sturgeons-afl%C3%B8ser-skal-findes-om-seks-uger,Politiken,https://politiken.dk/nyheder/,"Hold dig opdateret pÃ¥ de seneste nyheder pÃ¥ politiken.dk: Seneste Politiken, Seneste Danmark, Seneste Kultur og Seneste Internationalt. ",Politiken,https://politiken.dk/nyheder/,17.02.2023 07:18
Sen udligning frarøver FCM sensationel sejr,09.02.2023 00:00,,https://politiken.dk/sport/art9218147/Sen-udligning-frar%C3%B8ver-FCM-sensationel-sejr,Politiken,https://politiken.dk/nyheder/,"Hold dig opdateret pÃ¥ de seneste nyheder pÃ¥ politiken.dk: Seneste Politiken, Seneste Danmark, Seneste Kultur og Seneste Internationalt. ",Politiken,https://politiken.dk/nyheder/,17.02.2023 07:18
Frustreret Holger Rune trækker sig med skade i Rotterdam,09.02.2023 00:00,,https://politiken.dk/sport/art9218145/Frustreret-Holger-Rune-tr%C3%A6kker-sig-med-skade-i-Rotterdam,Politiken,https://politiken.dk/nyheder/,"Hold dig opdateret pÃ¥ de seneste nyheder pÃ¥ politiken.dk: Seneste Politiken, Seneste Danmark, Seneste Kultur og Seneste Internationalt. ",Politiken,https://politiken.dk/nyheder/,17.02.2023 07:18
"Det er en flot musikalsk opsætning, men teksten halter",10.02.2023 00:00,,https://politiken.dk/kultur/scene/art9193279/Det-er-en-flot-musikalsk-ops%C3%A6tning-men-teksten-halter,Politiken,https://politiken.dk/nyheder/,"Hold dig opdateret pÃ¥ de seneste nyheder pÃ¥ politiken.dk: Seneste Politiken, Seneste Danmark, Seneste Kultur og Seneste Internationalt. ",Politiken,https://politiken.dk/nyheder/,17.02.2023 07:18
Bruce Willis har fået konstateret demens,10.02.2023 00:00,,https://politiken.dk/kultur/art9218128/Bruce-Willis-har-f%C3%A5et-konstateret-demens,Politiken,https://politiken.dk/nyheder/,"Hold dig opdateret pÃ¥ de seneste nyheder pÃ¥ politiken.dk: Seneste Politiken, Seneste Danmark, Seneste Kultur og Seneste Internationalt. ",Politiken,https://politiken.dk/nyheder/,17.02.2023 07:18
Politiken mener: Joe Biden skal give faklen videre,11.02.2023 00:00,,https://politiken.dk/debat/ledere/art9216986/Joe-Biden-skal-give-faklen-videre,Politiken,https://politiken.dk/nyheder/,"Hold dig opdateret pÃ¥ de seneste nyheder pÃ¥ politiken.dk: Seneste Politiken, Seneste Danmark, Seneste Kultur og Seneste Internationalt. ",Politiken,https://politiken.dk/nyheder/,17.02.2023 07:18
"Der er sorte skyer i horisonten i byggebranchen: »Når vi skal arbejde, til vi er over 70 år, bliver det altså til meget løn, som vi går glip af«",11.02.2023 00:00,,https://politiken.dk/indland/art9201603/%C2%BBN%C3%A5r-vi-skal-arbejde-til-vi-er-over-70-%C3%A5r-bliver-det-alts%C3%A5-til-meget-l%C3%B8n-som-vi-g%C3%A5r-glip-af%C2%AB,Politiken,https://politiken.dk/nyheder/,"Hold dig opdateret pÃ¥ de seneste nyheder pÃ¥ politiken.dk: Seneste Politiken, Seneste Danmark, Seneste Kultur og Seneste Internationalt. ",Politiken,https://politiken.dk/nyheder/,17.02.2023 07:18
Fodboldfest nåede vilde højder på et kogende Camp Nou i Barcelona,11.02.2023 00:00,,https://politiken.dk/sport/fodbold/art9217903/Fodboldfest-n%C3%A5ede-vilde-h%C3%B8jder-p%C3%A5-et-kogende-Camp-Nou-i-Barcelona,Politiken,https://politiken.dk/nyheder/,"Hold dig opdateret pÃ¥ de seneste nyheder pÃ¥ politiken.dk: Seneste Politiken, Seneste Danmark, Seneste Kultur og Seneste Internationalt. ",Politiken,https://politiken.dk/nyheder/,17.02.2023 07:18
Biden: Nedskudte luftobjekter næppe brugt til spionage,11.02.2023 00:00,,https://politiken.dk/udland/art9218079/Nedskudte-luftobjekter-n%C3%A6ppe-brugt-til-spionage,Politiken,https://politiken.dk/nyheder/,"Hold dig opdateret pÃ¥ de seneste nyheder pÃ¥ politiken.dk: Seneste Politiken, Seneste Danmark, Seneste Kultur og Seneste Internationalt. ",Politiken,https://politiken.dk/nyheder/,17.02.2023 07:18
Dronningen mødte Putin i 2014: Jeg har aldrig set så kolde øjne,12.02.2023 00:00,,https://politiken.dk/indland/art9218067/Jeg-har-aldrig-set-s%C3%A5-kolde-%C3%B8jne,Politiken,https://politiken.dk/nyheder/,"Hold dig opdateret pÃ¥ de seneste nyheder pÃ¥ politiken.dk: Seneste Politiken, Seneste Danmark, Seneste Kultur og Seneste Internationalt. ",Politiken,https://politiken.dk/nyheder/,17.02.2023 07:18
"Kunstanmelderens bedste trick? »Ifør dig virkelig store og meget mørke solbriller, så ingen kan spore angsten i dine øjne«",12.02.2023 00:00,,https://politiken.dk/ibyen/art9138102/Kunstanmelderens-bedste-trick-%C2%BBIf%C3%B8r-dig-virkelig-store-og-meget-m%C3%B8rke-solbriller-s%C3%A5-ingen-kan-spore-angsten-i-dine-%C3%B8jne%C2%AB,Politiken,https://politiken.dk/nyheder/,"Hold dig opdateret pÃ¥ de seneste nyheder pÃ¥ politiken.dk: Seneste Politiken, Seneste Danmark, Seneste Kultur og Seneste Internationalt. ",Politiken,https://politiken.dk/nyheder/,17.02.2023 07:18
Kokosmel fra Rema 1000 tilbagekaldes,13.02.2023 00:00,,https://politiken.dk/forbrugogliv/forbrug/art9217993/Kokosmel-fra-Rema-1000-tilbagekaldes,Politiken,https://politiken.dk/nyheder/,"Hold dig opdateret pÃ¥ de seneste nyheder pÃ¥ politiken.dk: Seneste Politiken, Seneste Danmark, Seneste Kultur og Seneste Internationalt. ",Politiken,https://politiken.dk/nyheder/,17.02.2023 07:18
"Sarah Skarum: Skammen forsvinder ikke, men den svinder ind, når der sættes ord på den",14.02.2023 00:00,,https://politiken.dk/kultur/set_og_hoert/art9187881/Skammen-forsvinder-ikke-men-den-svinder-ind-n%C3%A5r-der-s%C3%A6ttes-ord-p%C3%A5-den,Politiken,https://politiken.dk/nyheder/,"Hold dig opdateret pÃ¥ de seneste nyheder pÃ¥ politiken.dk: Seneste Politiken, Seneste Danmark, Seneste Kultur og Seneste Internationalt. ",Politiken,https://politiken.dk/nyheder/,17.02.2023 07:18
Stormen Otto får Oslofærgen til at aflyse afgange,14.02.2023 00:00,,https://politiken.dk/indland/art9217981/Stormen-Otto-f%C3%A5r-Oslof%C3%A6rgen-til-at-aflyse-afgange,Politiken,https://politiken.dk/nyheder/,"Hold dig opdateret pÃ¥ de seneste nyheder pÃ¥ politiken.dk: Seneste Politiken, Seneste Danmark, Seneste Kultur og Seneste Internationalt. ",Politiken,https://politiken.dk/nyheder/,17.02.2023 07:18
"Peter Wivel: Vi fører ikke krig imod Rusland. Vi forsvarer Ukraine mod den despotiske kolonimagt, Putin har skabt",14.02.2023 00:00,,https://politiken.dk/debat/klummer/art9214594/Vi-f%C3%B8rer-ikke-krig-imod-Rusland.-Vi-forsvarer-Ukraine-mod-den-despotiske-kolonimagt-Putin-har-skabt,Politiken,https://politiken.dk/nyheder/,"Hold dig opdateret pÃ¥ de seneste nyheder pÃ¥ politiken.dk: Seneste Politiken, Seneste Danmark, Seneste Kultur og Seneste Internationalt. ",Politiken,https://politiken.dk/nyheder/,17.02.2023 07:18
"Professor efter flere sanktioner: »Det tager lang tid, måske fire-seks år, før Ruslands evne til at føre krig vil være alvorligt svækket«",15.02.2023 00:00,,https://politiken.dk/udland/art9215424/%C2%BBDet-tager-lang-tid-m%C3%A5ske-fire-seks-%C3%A5r-f%C3%B8r-Ruslands-evne-til-at-f%C3%B8re-krig-vil-v%C3%A6re-alvorligt-sv%C3%A6kket%C2%AB,Politiken,https://politiken.dk/nyheder/,"Hold dig opdateret pÃ¥ de seneste nyheder pÃ¥ politiken.dk: Seneste Politiken, Seneste Danmark, Seneste Kultur og Seneste Internationalt. ",Politiken,https://politiken.dk/nyheder/,17.02.2023 07:18
Peter Wivel: Habermas melder sig igen ind i krigsdebatten,15.02.2023 00:00,,https://politiken.dk/debat/art9217353/Habermas-melder-sig-igen-ind-i-krigsdebatten,Politiken,https://politiken.dk/nyheder/,"Hold dig opdateret pÃ¥ de seneste nyheder pÃ¥ politiken.dk: Seneste Politiken, Seneste Danmark, Seneste Kultur og Seneste Internationalt. ",Politiken,https://politiken.dk/nyheder/,17.02.2023 07:18
"Maersk-skib nægtet adgang til spansk havn: »Vi var ikke bekendt med, at der kunne være et problem«",16.02.2023 00:00,,https://politiken.dk/udland/art9217786/%C2%BBVi-var-ikke-bekendt-med-at-der-kunne-v%C3%A6re-et-problem%C2%AB,Politiken,https://politiken.dk/nyheder/,"Hold dig opdateret pÃ¥ de seneste nyheder pÃ¥ politiken.dk: Seneste Politiken, Seneste Danmark, Seneste Kultur og Seneste Internationalt. ",Politiken,https://politiken.dk/nyheder/,17.02.2023 07:18
Nye Borgerliges næstformand beklager opslag på sociale medier,16.02.2023 00:00,,https://politiken.dk/indland/art9217662/Nye-Borgerliges-n%C3%A6stformand-beklager-opslag-p%C3%A5-sociale-medier,Politiken,https://politiken.dk/nyheder/,"Hold dig opdateret pÃ¥ de seneste nyheder pÃ¥ politiken.dk: Seneste Politiken, Seneste Danmark, Seneste Kultur og Seneste Internationalt. ",Politiken,https://politiken.dk/nyheder/,17.02.2023 07:18
Spanien godkender lov om menstruation som første land i Europa,16.02.2023 00:00,,https://politiken.dk/udland/art9217724/Spanien-godkender-lov-om-menstruation-som-f%C3%B8rste-land-i-Europa,Politiken,https://politiken.dk/nyheder/,"Hold dig opdateret pÃ¥ de seneste nyheder pÃ¥ politiken.dk: Seneste Politiken, Seneste Danmark, Seneste Kultur og Seneste Internationalt. ",Politiken,https://politiken.dk/nyheder/,17.02.2023 07:18
Stigende corona i spildevandet tyder på mørketal for smittede,16.02.2023 00:00,,https://politiken.dk/forbrugogliv/sundhedogmotion/art9217714/Stigende-corona-i-spildevandet-tyder-p%C3%A5-m%C3%B8rketal-for-smittede,Politiken,https://politiken.dk/nyheder/,"Hold dig opdateret pÃ¥ de seneste nyheder pÃ¥ politiken.dk: Seneste Politiken, Seneste Danmark, Seneste Kultur og Seneste Internationalt. ",Politiken,https://politiken.dk/nyheder/,17.02.2023 07:18
"Lena Dunham, Cynthia Nixon og flere hundrede andre går til angreb på verdens mest prisvindende avis",16.02.2023 00:00,,https://politiken.dk/kultur/art9216747/Lena-Dunham-Cynthia-Nixon-og-flere-hundrede-andre-g%C3%A5r-til-angreb-p%C3%A5-verdens-mest-prisvindende-avis,Politiken,https://politiken.dk/nyheder/,"Hold dig opdateret pÃ¥ de seneste nyheder pÃ¥ politiken.dk: Seneste Politiken, Seneste Danmark, Seneste Kultur og Seneste Internationalt. ",Politiken,https://politiken.dk/nyheder/,17.02.2023 07:18
Det er giftig og saftig socialrealisme. Ã rets guilty pleasure,16.02.2023 00:00,,https://politiken.dk/kultur/boger/art9190890/Det-er-giftig-og-saftig-socialrealisme.-%C3%85rets-guilty-pleasure,Politiken,https://politiken.dk/nyheder/,"Hold dig opdateret pÃ¥ de seneste nyheder pÃ¥ politiken.dk: Seneste Politiken, Seneste Danmark, Seneste Kultur og Seneste Internationalt. ",Politiken,https://politiken.dk/nyheder/,17.02.2023 07:18
Sociolog: Voldtægtsanklagerne mod Nick Carter er tankevækkende,16.02.2023 00:00,,https://politiken.dk/debat/kroniken/art9204497/Voldt%C3%A6gtsanklagerne-mod-Nick-Carter-er-tankev%C3%A6kkende,Politiken,https://politiken.dk/nyheder/,"Hold dig opdateret pÃ¥ de seneste nyheder pÃ¥ politiken.dk: Seneste Politiken, Seneste Danmark, Seneste Kultur og Seneste Internationalt. ",Politiken,https://politiken.dk/nyheder/,17.02.2023 07:18
Se kortet: Her er danskernes indkomst steget mest over 10 år,17.02.2023 00:00,,https://politiken.dk/oekonomi/privatoekonomi/art9216709/Her-er-danskernes-indkomst-steget-mest-over-10-%C3%A5r,Politiken,https://politiken.dk/nyheder/,"Hold dig opdateret pÃ¥ de seneste nyheder pÃ¥ politiken.dk: Seneste Politiken, Seneste Danmark, Seneste Kultur og Seneste Internationalt. ",Politiken,https://politiken.dk/nyheder/,17.02.2023 07:18
Norge sender 51 milliarder kroner fra olieindtægter til Ukraine,17.02.2023 00:00,,https://politiken.dk/udland/art9217349/Norge-sender-51-milliarder-kroner-fra-olieindt%C3%A6gter-til-Ukraine,Politiken,https://politiken.dk/nyheder/,"Hold dig opdateret pÃ¥ de seneste nyheder pÃ¥ politiken.dk: Seneste Politiken, Seneste Danmark, Seneste Kultur og Seneste Internationalt. ",Politiken,https://politiken.dk/nyheder/,17.02.2023 07:18
28-årig blev forvekslet med en anden: Dommer afviser at forhøje erstatning for 466 døgn bag tremmer,18.02.2023 00:00,,https://politiken.dk/indland/art9217320/Dommer-afviser-at-forh%C3%B8je-erstatning-for-466-d%C3%B8gn-bag-tremmer,Politiken,https://politiken.dk/nyheder/,"Hold dig opdateret pÃ¥ de seneste nyheder pÃ¥ politiken.dk: Seneste Politiken, Seneste Danmark, Seneste Kultur og Seneste Internationalt. ",Politiken,https://politiken.dk/nyheder/,17.02.2023 07:18
"Når sneen endelig falder i Danmark og bliver liggende, er der kun ét at gøre",18.02.2023 00:00,,https://politiken.dk/rejser/ferieidanmark/art9130985/N%C3%A5r-sneen-endelig-falder-i-Danmark-og-bliver-liggende-er-der-kun-%C3%A9t-at-g%C3%B8re,Politiken,https://politiken.dk/nyheder/,"Hold dig opdateret pÃ¥ de seneste nyheder pÃ¥ politiken.dk: Seneste Politiken, Seneste Danmark, Seneste Kultur og Seneste Internationalt. ",Politiken,https://politiken.dk/nyheder/,17.02.2023 07:18
Pernille Tranberg: Kampen mod de falske nyheder virker håbløs,18.02.2023 00:00,,https://politiken.dk/kultur/medier/art9215815/Kampen-mod-de-falske-nyheder-virker-h%C3%A5bl%C3%B8s,Politiken,https://politiken.dk/nyheder/,"Hold dig opdateret pÃ¥ de seneste nyheder pÃ¥ politiken.dk: Seneste Politiken, Seneste Danmark, Seneste Kultur og Seneste Internationalt. ",Politiken,https://politiken.dk/nyheder/,17.02.2023 07:18
17-årig reddet ud efter at have tilbragt 248 timer i sammenstyrtet bygning,19.02.2023 00:00,,https://politiken.dk/udland/art9217135/17-%C3%A5rig-reddet-ud-efter-at-have-tilbragt-248-timer-i-sammenstyrtet-bygning,Politiken,https://politiken.dk/nyheder/,"Hold dig opdateret pÃ¥ de seneste nyheder pÃ¥ politiken.dk: Seneste Politiken, Seneste Danmark, Seneste Kultur og Seneste Internationalt. ",Politiken,https://politiken.dk/nyheder/,17.02.2023 07:18
FC Barcelona betalte næstformand i dommerkomité 10 millioner kroner fra 2016 til 2018,19.02.2023 00:00,,https://politiken.dk/sport/fodbold/art9217085/FC-Barcelona-betalte-n%C3%A6stformand-i-dommerkomit%C3%A9-10-millioner-kroner-fra-2016-til-2018,Politiken,https://politiken.dk/nyheder/,"Hold dig opdateret pÃ¥ de seneste nyheder pÃ¥ politiken.dk: Seneste Politiken, Seneste Danmark, Seneste Kultur og Seneste Internationalt. ",Politiken,https://politiken.dk/nyheder/,17.02.2023 07:18
Stjerneforfatter vender tilbage efter 13 års stilhed,19.02.2023 00:00,,https://politiken.dk/kultur/boger/art9212942/Stjerneforfatter-vender-tilbage-efter-13-%C3%A5rs-stilhed,Politiken,https://politiken.dk/nyheder/,"Hold dig opdateret pÃ¥ de seneste nyheder pÃ¥ politiken.dk: Seneste Politiken, Seneste Danmark, Seneste Kultur og Seneste Internationalt. ",Politiken,https://politiken.dk/nyheder/,17.02.2023 07:18
Nekrolog: Ikonisk bikini gjorde hende til et af de største sexsymboler,20.02.2023 00:00,,https://politiken.dk/navne/art9216668/Ikonisk-bikini-gjorde-hende-til-et-af-de-st%C3%B8rste-sexsymboler,Politiken,https://politiken.dk/nyheder/,"Hold dig opdateret pÃ¥ de seneste nyheder pÃ¥ politiken.dk: Seneste Politiken, Seneste Danmark, Seneste Kultur og Seneste Internationalt. ",Politiken,https://politiken.dk/nyheder/,17.02.2023 07:18
Lukasjenko: »Vi går ikke ind i krigen«,20.02.2023 00:00,,https://politiken.dk/udland/art9216965/%C2%BBVi-g%C3%A5r-ikke-ind-i-krigen%C2%AB,Politiken,https://politiken.dk/nyheder/,"Hold dig opdateret pÃ¥ de seneste nyheder pÃ¥ politiken.dk: Seneste Politiken, Seneste Danmark, Seneste Kultur og Seneste Internationalt. ",Politiken,https://politiken.dk/nyheder/,17.02.2023 07:18
Der venter en -udfordrende vejrdag-: Stormen Otto tager fat fra 15-tiden,01.02.2023 00:00,,https://politiken.dk/indland/art9218224/Der-venter-en-%E2%80%99udfordrende-vejrdag%E2%80%99-Stormen-Otto-tager-fat-fra-15-tiden,Politiken,https://politiken.dk/nyheder/,"Hold dig opdateret pÃ¥ de seneste nyheder pÃ¥ politiken.dk: Seneste Politiken, Seneste Danmark, Seneste Kultur og Seneste Internationalt. ",Politiken,https://politiken.dk/nyheder/,17.02.2023 07:18
Elselskaber bryder loven på stribe: 24 gange på fire år er de blevet politianmeldt,01.02.2023 00:00,,https://politiken.dk/indland/art9215390/Elselskaber-bryder-loven-p%C3%A5-stribe-24-gange-p%C3%A5-fire-%C3%A5r-er-de-blevet-politianmeldt,Politiken,https://politiken.dk/nyheder/,"Hold dig opdateret pÃ¥ de seneste nyheder pÃ¥ politiken.dk: Seneste Politiken, Seneste Danmark, Seneste Kultur og Seneste Internationalt. ",Politiken,https://politiken.dk/nyheder/,17.02.2023 07:18
"Der er sorte skyer i horisonten i byggebranchen: »Når vi skal arbejde, til vi er over 70 år, bliver det altså til meget løn, som vi går glip af«",11.02.2023 00:00,,https://politiken.dk/indland/art9201603/%C2%BBN%C3%A5r-vi-skal-arbejde-til-vi-er-over-70-%C3%A5r-bliver-det-alts%C3%A5-til-meget-l%C3%B8n-som-vi-g%C3%A5r-glip-af%C2%AB,Politiken,https://politiken.dk/nyheder/,"Hold dig opdateret pÃ¥ de seneste nyheder pÃ¥ politiken.dk: Seneste Politiken, Seneste Danmark, Seneste Kultur og Seneste Internationalt. ",Politiken,https://politiken.dk/nyheder/,17.02.2023 07:18
Dronningen mødte Putin i 2014: Jeg har aldrig set så kolde øjne,12.02.2023 00:00,,https://politiken.dk/indland/art9218067/Jeg-har-aldrig-set-s%C3%A5-kolde-%C3%B8jne,Politiken,https://politiken.dk/nyheder/,"Hold dig opdateret pÃ¥ de seneste nyheder pÃ¥ politiken.dk: Seneste Politiken, Seneste Danmark, Seneste Kultur og Seneste Internationalt. ",Politiken,https://politiken.dk/nyheder/,17.02.2023 07:18
Stormen Otto får Oslofærgen til at aflyse afgange,14.02.2023 00:00,,https://politiken.dk/indland/art9217981/Stormen-Otto-f%C3%A5r-Oslof%C3%A6rgen-til-at-aflyse-afgange,Politiken,https://politiken.dk/nyheder/,"Hold dig opdateret pÃ¥ de seneste nyheder pÃ¥ politiken.dk: Seneste Politiken, Seneste Danmark, Seneste Kultur og Seneste Internationalt. ",Politiken,https://politiken.dk/nyheder/,17.02.2023 07:18
Nye Borgerliges næstformand beklager opslag på sociale medier,16.02.2023 00:00,,https://politiken.dk/indland/art9217662/Nye-Borgerliges-n%C3%A6stformand-beklager-opslag-p%C3%A5-sociale-medier,Politiken,https://politiken.dk/nyheder/,"Hold dig opdateret pÃ¥ de seneste nyheder pÃ¥ politiken.dk: Seneste Politiken, Seneste Danmark, Seneste Kultur og Seneste Internationalt. ",Politiken,https://politiken.dk/nyheder/,17.02.2023 07:18
Se kortet: Her er danskernes indkomst steget mest over 10 år,17.02.2023 00:00,,https://politiken.dk/oekonomi/privatoekonomi/art9216709/Her-er-danskernes-indkomst-steget-mest-over-10-%C3%A5r,Politiken,https://politiken.dk/nyheder/,"Hold dig opdateret pÃ¥ de seneste nyheder pÃ¥ politiken.dk: Seneste Politiken, Seneste Danmark, Seneste Kultur og Seneste Internationalt. ",Politiken,https://politiken.dk/nyheder/,17.02.2023 07:18
28-årig blev forvekslet med en anden: Dommer afviser at forhøje erstatning for 466 døgn bag tremmer,18.02.2023 00:00,,https://politiken.dk/indland/art9217320/Dommer-afviser-at-forh%C3%B8je-erstatning-for-466-d%C3%B8gn-bag-tremmer,Politiken,https://politiken.dk/nyheder/,"Hold dig opdateret pÃ¥ de seneste nyheder pÃ¥ politiken.dk: Seneste Politiken, Seneste Danmark, Seneste Kultur og Seneste Internationalt. ",Politiken,https://politiken.dk/nyheder/,17.02.2023 07:18
Stort byggeprojekt er nu mere end tre milliarder dyrere end planlagt - og forsinket på sjette år,21.02.2023 00:00,,https://politiken.dk/indland/art9216037/Stort-byggeprojekt-er-nu-mere-end-tre-milliarder-dyrere-end-planlagt-%E2%80%93-og-forsinket-p%C3%A5-sjette-%C3%A5r,Politiken,https://politiken.dk/nyheder/,"Hold dig opdateret pÃ¥ de seneste nyheder pÃ¥ politiken.dk: Seneste Politiken, Seneste Danmark, Seneste Kultur og Seneste Internationalt. ",Politiken,https://politiken.dk/nyheder/,17.02.2023 07:18
Albaner vil frifindes efter myndigheders fejl ved udlevering,21.02.2023 00:00,,https://politiken.dk/indland/art9216801/Albaner-vil-frifindes-efter-myndigheders-fejl-ved-udlevering,Politiken,https://politiken.dk/nyheder/,"Hold dig opdateret pÃ¥ de seneste nyheder pÃ¥ politiken.dk: Seneste Politiken, Seneste Danmark, Seneste Kultur og Seneste Internationalt. ",Politiken,https://politiken.dk/nyheder/,17.02.2023 07:18
Husk at lukke vinduer og døre. Nu kommer Otto,22.02.2023 00:00,,https://politiken.dk/indland/art9216806/Husk-at-lukke-vinduer-og-d%C3%B8re.-Nu-kommer-Otto,Politiken,https://politiken.dk/nyheder/,"Hold dig opdateret pÃ¥ de seneste nyheder pÃ¥ politiken.dk: Seneste Politiken, Seneste Danmark, Seneste Kultur og Seneste Internationalt. ",Politiken,https://politiken.dk/nyheder/,17.02.2023 07:18
