title,published,text,link,og:site_name,og:url,site_description,name,url,scrape_time
Fra praktisk foranstaltning til æstetisk element: »Der er gået mode i gardiner«,30.04.2023 00:00,,https://jyllands-posten.dk/bolig/ECE15663705/fra-praktisk-foranstaltning-til-aestetisk-element-der-er-gaaet-mode-i-gardiner/,Jyllands-Posten,https://jyllands-posten.dk/seneste/,"Få de seneste nyheder fra ind- og udland om samfund, erhverv, sport og kultur. ",Jyllandsposten,https://jyllands-posten.dk/seneste/,01.05.2023 07:17
"Lizette Risgaards fald sker på en »paradoksal« baggrund, mener ekspert",30.04.2023 00:00,,https://jyllands-posten.dk/indland/ECE15706919/lizette-risgaard-snublede-i-de-maerkesager-hun-skubbede-foran-sig/,Jyllands-Posten,https://jyllands-posten.dk/seneste/,"Få de seneste nyheder fra ind- og udland om samfund, erhverv, sport og kultur. ",Jyllandsposten,https://jyllands-posten.dk/seneste/,01.05.2023 07:17
"Efter en bekymrende fredning befandt Brøndby-chefen sig midt i infernoet, der pludselig kulminerede lige ved hans bænk",30.04.2023 00:00,,https://jyllands-posten.dk/sport/fodbold/ECE15701223/rivalopgoeret-skabte-den-bedste-fredning-jesper-soerensen-kunne-faa/,Jyllands-Posten,https://jyllands-posten.dk/seneste/,"Få de seneste nyheder fra ind- og udland om samfund, erhverv, sport og kultur. ",Jyllandsposten,https://jyllands-posten.dk/seneste/,01.05.2023 07:17
Efter fem dages kamp for sit liv vågnede Emilie Aaen uden venstre ben: »Så jeg kastede mig ud i at være ung og udødelig«,30.04.2023 00:00,,https://jyllands-posten.dk/sport/ECE15317601/efter-fem-dages-kamp-for-sit-liv-vaagnede-19aarige-emilie-aaen-uden-sit-venstre-ben/,Jyllands-Posten,https://jyllands-posten.dk/seneste/,"Få de seneste nyheder fra ind- og udland om samfund, erhverv, sport og kultur. ",Jyllandsposten,https://jyllands-posten.dk/seneste/,01.05.2023 07:17
Esbjerg sled sig til et godt udgangspunkt i Champions League,30.04.2023 00:00,,https://jyllands-posten.dk/sport/handbold/ECE15704078/esbjerg-sled-sig-til-et-godt-udgangspunkt-i-champions-league/,Jyllands-Posten,https://jyllands-posten.dk/seneste/,"Få de seneste nyheder fra ind- og udland om samfund, erhverv, sport og kultur. ",Jyllandsposten,https://jyllands-posten.dk/seneste/,01.05.2023 07:17
"Hvad sker der, hvis man bevidst opsøger en ulv? Danske forskere lavede sjældent ""Rødhætte-forsøg""",30.04.2023 00:00,,https://jyllands-posten.dk/indland/ECE15704340/danske-forskere-lavede-et-sjaeldent-roedhaetteforsoeg-med-en-gpsmaerket-ulv/,Jyllands-Posten,https://jyllands-posten.dk/seneste/,"Få de seneste nyheder fra ind- og udland om samfund, erhverv, sport og kultur. ",Jyllandsposten,https://jyllands-posten.dk/seneste/,01.05.2023 07:17
Bayern tilkæmpede sig førsteplads med sene mål mod Hertha,30.04.2023 00:00,,https://jyllands-posten.dk/sport/fodbold/ECE15707054/bayern-tilkaempede-sig-foersteplads-med-sene-maal-mod-hertha/,Jyllands-Posten,https://jyllands-posten.dk/seneste/,"Få de seneste nyheder fra ind- og udland om samfund, erhverv, sport og kultur. ",Jyllandsposten,https://jyllands-posten.dk/seneste/,01.05.2023 07:17
City fortsatte stime og tog førstepladsen fra Arsenal,30.04.2023 00:00,,https://jyllands-posten.dk/sport/fodbold/ECE15707033/city-fortsatte-stime-og-tog-foerstepladsen-fra-arsenal/,Jyllands-Posten,https://jyllands-posten.dk/seneste/,"Få de seneste nyheder fra ind- og udland om samfund, erhverv, sport og kultur. ",Jyllandsposten,https://jyllands-posten.dk/seneste/,01.05.2023 07:17
Napoli smed føring og udsætter italiensk guldfest,30.04.2023 00:00,,https://jyllands-posten.dk/sport/fodbold/ECE15707036/napoli-smed-foering-og-udsaetter-italiensk-guldfest/,Jyllands-Posten,https://jyllands-posten.dk/seneste/,"Få de seneste nyheder fra ind- og udland om samfund, erhverv, sport og kultur. ",Jyllandsposten,https://jyllands-posten.dk/seneste/,01.05.2023 07:17
På tur i Nairobis slum: Klimatilpasning får storbyens fattigste til at tænke kreativt,30.04.2023 00:00,,https://jyllands-posten.dk/rejser/ECE15566714/klimatilpasning-faar-storbyens-fattigste-til-at-taenke-kreativt/,Jyllands-Posten,https://jyllands-posten.dk/seneste/,"Få de seneste nyheder fra ind- og udland om samfund, erhverv, sport og kultur. ",Jyllandsposten,https://jyllands-posten.dk/seneste/,01.05.2023 07:17
Fungerende FH-formand Lizette Risgaard kommer til at stjæle opmærksomhed 1. maj,30.04.2023 00:00,,https://jyllands-posten.dk/indland/ECE15707012/fungerende-fhformand-ved-godt-at-lizette-risgaard-vil-fylde-1-maj/,Jyllands-Posten,https://jyllands-posten.dk/seneste/,"Få de seneste nyheder fra ind- og udland om samfund, erhverv, sport og kultur. ",Jyllandsposten,https://jyllands-posten.dk/seneste/,01.05.2023 07:17
Drømmestart sendte Vejle tættere på Superligaen,30.04.2023 00:00,,https://jyllands-posten.dk/sport/fodbold/ECE15707015/droemmestart-sendte-vejle-taettere-paa-superligaen/,Jyllands-Posten,https://jyllands-posten.dk/seneste/,"Få de seneste nyheder fra ind- og udland om samfund, erhverv, sport og kultur. ",Jyllandsposten,https://jyllands-posten.dk/seneste/,01.05.2023 07:17
Magnussen fik ikke udnyttet bilens fulde potentiale i Baku,30.04.2023 00:00,,https://jyllands-posten.dk/sport/formel1/ECE15701262/magnussen-fik-ikke-udnyttet-bilens-fulde-potentiale-i-baku/,Jyllands-Posten,https://jyllands-posten.dk/seneste/,"Få de seneste nyheder fra ind- og udland om samfund, erhverv, sport og kultur. ",Jyllandsposten,https://jyllands-posten.dk/seneste/,01.05.2023 07:17
Analyse: Lizette Risgaards fald kan trække dybe spor i fagbevægelsen,30.04.2023 00:00,,https://jyllands-posten.dk/jperhverv/ECE15706979/lizette-risgaards-fald-kan-traekke-dybe-spor-i-fagbevaegelsen/,Jyllands-Posten,https://jyllands-posten.dk/seneste/,"Få de seneste nyheder fra ind- og udland om samfund, erhverv, sport og kultur. ",Jyllandsposten,https://jyllands-posten.dk/seneste/,01.05.2023 07:17
Viborg nærmer sig toppen med flot sejr over Randers,30.04.2023 00:00,,https://jyllands-posten.dk/sport/fodbold/ECE15706987/viborg-naermer-sig-toppen-med-flot-sejr-over-randers/,Jyllands-Posten,https://jyllands-posten.dk/seneste/,"Få de seneste nyheder fra ind- og udland om samfund, erhverv, sport og kultur. ",Jyllandsposten,https://jyllands-posten.dk/seneste/,01.05.2023 07:17
Kampe optrappet i Sudan før våbenhviles udløb,30.04.2023 00:00,,https://jyllands-posten.dk/international/Afrika/ECE15706991/kampe-optrappet-i-sudan-foer-vaabenhviles-udloeb/,Jyllands-Posten,https://jyllands-posten.dk/seneste/,"Få de seneste nyheder fra ind- og udland om samfund, erhverv, sport og kultur. ",Jyllandsposten,https://jyllands-posten.dk/seneste/,01.05.2023 07:17
Frækt straffespark gav AaB liv i overlevelseskampen,30.04.2023 00:00,,https://jyllands-posten.dk/sport/fodbold/ECE15706988/fraekt-straffespark-gav-aab-liv-i-overlevelseskampen/,Jyllands-Posten,https://jyllands-posten.dk/seneste/,"Få de seneste nyheder fra ind- og udland om samfund, erhverv, sport og kultur. ",Jyllandsposten,https://jyllands-posten.dk/seneste/,01.05.2023 07:17
Erdogan kalder dem terrorister: Snart kan de afgøre hans skæbne,30.04.2023 00:00,,https://jyllands-posten.dk/international/ECE15616119/erdogans-skaebne-kan-blive-afgjort-af-tyrkiets-kurdere/,Jyllands-Posten,https://jyllands-posten.dk/seneste/,"Få de seneste nyheder fra ind- og udland om samfund, erhverv, sport og kultur. ",Jyllandsposten,https://jyllands-posten.dk/seneste/,01.05.2023 07:17
"Geografisk skævvridning: »Folk mister synet, mens de står på ventelisten«",30.04.2023 00:00,,https://jyllands-posten.dk/indland/ECE15706547/geografisk-skaevvridning-folk-mister-synet-mens-de-staar-paa-ventelisten/,Jyllands-Posten,https://jyllands-posten.dk/seneste/,"Få de seneste nyheder fra ind- og udland om samfund, erhverv, sport og kultur. ",Jyllandsposten,https://jyllands-posten.dk/seneste/,01.05.2023 07:17
Magnussen måtte kigge langt efter Red Bulls racere,30.04.2023 00:00,,https://jyllands-posten.dk/sport/formel1/ECE15706940/magnussen-sluttede-som-nummer-13-i-red-bulls-legestue/,Jyllands-Posten,https://jyllands-posten.dk/seneste/,"Få de seneste nyheder fra ind- og udland om samfund, erhverv, sport og kultur. ",Jyllandsposten,https://jyllands-posten.dk/seneste/,01.05.2023 07:17
Glem alt om Frankrig og Tyskland: Her er Europas nye militære stormagt,30.04.2023 00:00,,https://jyllands-posten.dk/international/europa/ECE15274671/polen-er-europas-nye-militaere-stormagt/,Jyllands-Posten,https://jyllands-posten.dk/seneste/,"Få de seneste nyheder fra ind- og udland om samfund, erhverv, sport og kultur. ",Jyllandsposten,https://jyllands-posten.dk/seneste/,01.05.2023 07:17
80-årige Biden blev grillet for sin alder til middag med pressen,30.04.2023 00:00,,https://jyllands-posten.dk/international/ECE15706721/80aarige-biden-blev-grillet-for-sin-alder-til-middag-med-pressen/,Jyllands-Posten,https://jyllands-posten.dk/seneste/,"Få de seneste nyheder fra ind- og udland om samfund, erhverv, sport og kultur. ",Jyllandsposten,https://jyllands-posten.dk/seneste/,01.05.2023 07:17
Konflikt mellem grupper af unge mænd førte til knivstik,30.04.2023 00:00,,https://jyllands-posten.dk/indland/ECE15706730/konflikt-mellem-grupper-af-unge-maend-foerte-til-knivstik/,Jyllands-Posten,https://jyllands-posten.dk/seneste/,"Få de seneste nyheder fra ind- og udland om samfund, erhverv, sport og kultur. ",Jyllandsposten,https://jyllands-posten.dk/seneste/,01.05.2023 07:17
FN-diplomater holder hemmeligt møde om Taliban,30.04.2023 00:00,,https://jyllands-posten.dk/international/ECE15706853/fndiplomater-holder-hemmeligt-moede-om-taliban/,Jyllands-Posten,https://jyllands-posten.dk/seneste/,"Få de seneste nyheder fra ind- og udland om samfund, erhverv, sport og kultur. ",Jyllandsposten,https://jyllands-posten.dk/seneste/,01.05.2023 07:17
"Symbol på storklubbens problemer: »Nogle forventede nok, at jeg snød fire mænd og smækkede den op i krogen, men sådan er virkeligheden bare ikke«",30.04.2023 00:00,,https://jyllands-posten.dk/sport/fodbold/ECE15700893/nogle-forventede-nok-at-jeg-snoed-fire-maend-og-smaekkede-den-op-i-krogen-men-saadan-er-virkeligheden-bare-ikke/,Jyllands-Posten,https://jyllands-posten.dk/seneste/,"Få de seneste nyheder fra ind- og udland om samfund, erhverv, sport og kultur. ",Jyllandsposten,https://jyllands-posten.dk/seneste/,01.05.2023 07:17
Ekspert om Risgaards exit: »Jeg har aldrig set noget lignende«,30.04.2023 00:00,,https://jyllands-posten.dk/indland/ECE15706698/lizette-risgaard-traekker-sig-som-formand-det-betyder-det-for-fagbevaegelsen/,Jyllands-Posten,https://jyllands-posten.dk/seneste/,"Få de seneste nyheder fra ind- og udland om samfund, erhverv, sport og kultur. ",Jyllandsposten,https://jyllands-posten.dk/seneste/,01.05.2023 07:17
Ny Superligatræner: »Han er verdens kærligste mand og far«,30.04.2023 00:00,,https://jyllands-posten.dk/sport/fodbold/ECE15699849/hvis-chelsea-ringer-og-vil-have-en-ny-traener-faar-han-svaert-ved-at-sige-nej-tak/,Jyllands-Posten,https://jyllands-posten.dk/seneste/,"Få de seneste nyheder fra ind- og udland om samfund, erhverv, sport og kultur. ",Jyllandsposten,https://jyllands-posten.dk/seneste/,01.05.2023 07:17
Konsulent har kvittet elitecykling for bestandigt,30.04.2023 00:00,,https://jyllands-posten.dk/sport/ECE15613418/michael-blaudzun-har-kvittet-elitecykling-for-bestandigt/,Jyllands-Posten,https://jyllands-posten.dk/seneste/,"Få de seneste nyheder fra ind- og udland om samfund, erhverv, sport og kultur. ",Jyllandsposten,https://jyllands-posten.dk/seneste/,01.05.2023 07:17
Ukrainsk højskoleelev i Danmark: »Jeg har haft dårlig samvittighed over at være i sikkerhed«,30.04.2023 00:00,,https://jyllands-posten.dk/indland/ECE15655831/19aarige-olesia-vdovych-har-for-en-stund-faaet-et-afbraek-fra-en-hverdag-praeget-af-krig/,Jyllands-Posten,https://jyllands-posten.dk/seneste/,"Få de seneste nyheder fra ind- og udland om samfund, erhverv, sport og kultur. ",Jyllandsposten,https://jyllands-posten.dk/seneste/,01.05.2023 07:17
"HK-formand om Risgaard: Det er ærgerligt, at det her bliver hendes sidste ord",30.04.2023 00:00,,https://jyllands-posten.dk/indland/ECE15706708/nu-saetter-hkformand-anja-c-jensen-ord-paa-lizette-risgaards-afgang/,Jyllands-Posten,https://jyllands-posten.dk/seneste/,"Få de seneste nyheder fra ind- og udland om samfund, erhverv, sport og kultur. ",Jyllandsposten,https://jyllands-posten.dk/seneste/,01.05.2023 07:17
Sådan skete det: Lizette Risgaards fald,30.04.2023 00:00,,https://jyllands-posten.dk/indland/ECE15706723/overblik-saadan-endte-lizette-risgaard-med-at-maatte-traekke-sig/,Jyllands-Posten,https://jyllands-posten.dk/seneste/,"Få de seneste nyheder fra ind- og udland om samfund, erhverv, sport og kultur. ",Jyllandsposten,https://jyllands-posten.dk/seneste/,01.05.2023 07:17
"Første test: Audis elbil har fået kæmpebatteri, men har fortsat én stor ulempe",30.04.2023 00:00,,https://jyllands-posten.dk/biler/ECE15668699/den-store-audi-etron-har-faaet-det-batteri-den-fortjener-men-er-det-nok/,Jyllands-Posten,https://jyllands-posten.dk/seneste/,"Få de seneste nyheder fra ind- og udland om samfund, erhverv, sport og kultur. ",Jyllandsposten,https://jyllands-posten.dk/seneste/,01.05.2023 07:17
FOA: Det er endnu for tidligt at pege på ny formand,30.04.2023 00:00,,https://jyllands-posten.dk/indland/ECE15706699/lizette-risgaard-har-trukket-sig-som-formand-for-fh-faa-seneste-nyt-her/,Jyllands-Posten,https://jyllands-posten.dk/seneste/,"Få de seneste nyheder fra ind- og udland om samfund, erhverv, sport og kultur. ",Jyllandsposten,https://jyllands-posten.dk/seneste/,01.05.2023 07:17
Frustrationer over »team-beslutninger«: Kan Magnussen mærke presset fra sin nye holdkammerat?,30.04.2023 00:00,,https://jyllands-posten.dk/sport/formel1/ECE15270676/magnussens-nye-holdkammerat-udfordrer-ham/,Jyllands-Posten,https://jyllands-posten.dk/seneste/,"Få de seneste nyheder fra ind- og udland om samfund, erhverv, sport og kultur. ",Jyllandsposten,https://jyllands-posten.dk/seneste/,01.05.2023 07:17
Lizette Risgaard trækker sig som formand for FH,30.04.2023 00:00,,https://jyllands-posten.dk/indland/ECE15706676/lizette-risgaard-traekker-sig-som-formand-for-fh/,Jyllands-Posten,https://jyllands-posten.dk/seneste/,"Få de seneste nyheder fra ind- og udland om samfund, erhverv, sport og kultur. ",Jyllandsposten,https://jyllands-posten.dk/seneste/,01.05.2023 07:17
De gjorde ham til en stor mand. Det skulle de aldrig have gjort,30.04.2023 00:00,,https://jyllands-posten.dk/international/usa/ECE15699593/de-gjorde-ham-til-en-stor-mand-det-skulle-de-aldrig-have-gjort/,Jyllands-Posten,https://jyllands-posten.dk/seneste/,"Få de seneste nyheder fra ind- og udland om samfund, erhverv, sport og kultur. ",Jyllandsposten,https://jyllands-posten.dk/seneste/,01.05.2023 07:17
Danske forsvarsspillere triumferede i fransk pokalfinale,30.04.2023 00:00,,https://jyllands-posten.dk/sport/ECE15706637/danske-forsvarsspillere-triumferede-i-fransk-pokalfinale/,Jyllands-Posten,https://jyllands-posten.dk/seneste/,"Få de seneste nyheder fra ind- og udland om samfund, erhverv, sport og kultur. ",Jyllandsposten,https://jyllands-posten.dk/seneste/,01.05.2023 07:17
Leon Madsen efter skuffelse: Det var en lortedag,30.04.2023 00:00,,https://jyllands-posten.dk/sport/ECE15706633/leon-madsen-efter-skuffelse-det-var-en-lortedag/,Jyllands-Posten,https://jyllands-posten.dk/seneste/,"Få de seneste nyheder fra ind- og udland om samfund, erhverv, sport og kultur. ",Jyllandsposten,https://jyllands-posten.dk/seneste/,01.05.2023 07:17
Andreas Christensen scorede sit første mål for Barcelona,30.04.2023 00:00,,https://jyllands-posten.dk/sport/ECE15706638/andreas-christensen-scorede-sit-foerste-maal-for-barcelona/,Jyllands-Posten,https://jyllands-posten.dk/seneste/,"Få de seneste nyheder fra ind- og udland om samfund, erhverv, sport og kultur. ",Jyllandsposten,https://jyllands-posten.dk/seneste/,01.05.2023 07:17
"Forsvarsministeren har en plan, som selv en fireårig kan forstå",30.04.2023 00:00,,https://jyllands-posten.dk/indland/ECE15660279/arktis-og-kongeriget-danmark-staar-oeverst-paa-forsvarsministerens-liste/,Jyllands-Posten,https://jyllands-posten.dk/seneste/,"Få de seneste nyheder fra ind- og udland om samfund, erhverv, sport og kultur. ",Jyllandsposten,https://jyllands-posten.dk/seneste/,01.05.2023 07:17
Forsvar: Kursen justeres før vigtigt forlig,30.04.2023 00:00,,https://jyllands-posten.dk/politik/ECE15700145/regeringen-vil-opruste-i-arktis-og-sender-oestersoeen-ned-paa-andenpladsen/,Jyllands-Posten,https://jyllands-posten.dk/seneste/,"Få de seneste nyheder fra ind- og udland om samfund, erhverv, sport og kultur. ",Jyllandsposten,https://jyllands-posten.dk/seneste/,01.05.2023 07:17
"Kirsten Olesen: »Jeg er blevet fyret, og det er jo sådan, det er«",30.04.2023 00:00,,https://jyllands-posten.dk/kultur/ECE15639113/kirsten-olesen-kan-ikke-fortaelle-sjove-historier-fra-gamle-dage-for-folk-vil-sige-whaat-skete-det/,Jyllands-Posten,https://jyllands-posten.dk/seneste/,"Få de seneste nyheder fra ind- og udland om samfund, erhverv, sport og kultur. ",Jyllandsposten,https://jyllands-posten.dk/seneste/,01.05.2023 07:17
Paven vil være fredsmægler,30.04.2023 00:00,,https://jyllands-posten.dk/dagensoverblik/ECE15706625/nyhedsoverblik/,Jyllands-Posten,https://jyllands-posten.dk/seneste/,"Få de seneste nyheder fra ind- og udland om samfund, erhverv, sport og kultur. ",Jyllandsposten,https://jyllands-posten.dk/seneste/,01.05.2023 07:17
Luften er gået ud af stort anlagt udlændingestramning: Har haft »meget begrænset« betydning,30.04.2023 00:00,,https://jyllands-posten.dk/politik/ECE15702110/paa-christiansborg-blev-det-kaldt-et-nybrud-i-udlaendingepolitikken-nu-undsiger-professor-den-udlaegning/,Jyllands-Posten,https://jyllands-posten.dk/seneste/,"Få de seneste nyheder fra ind- og udland om samfund, erhverv, sport og kultur. ",Jyllandsposten,https://jyllands-posten.dk/seneste/,01.05.2023 07:17
Tysk fodboldforbund erkender dommerfejl i Dortmund-kamp,29.04.2023 00:00,,https://jyllands-posten.dk/sport/fodbold/ECE15706624/tysk-fodboldforbund-erkender-dommerfejl-i-dortmundkamp/,Jyllands-Posten,https://jyllands-posten.dk/seneste/,"Få de seneste nyheder fra ind- og udland om samfund, erhverv, sport og kultur. ",Jyllandsposten,https://jyllands-posten.dk/seneste/,01.05.2023 07:17
Svensk statsminister tror på dansk idé om modtagecenter,29.04.2023 00:00,,https://jyllands-posten.dk/international/europa/ECE15706628/svensk-statsminister-tror-paa-dansk-ide-om-modtagecenter/,Jyllands-Posten,https://jyllands-posten.dk/seneste/,"Få de seneste nyheder fra ind- og udland om samfund, erhverv, sport og kultur. ",Jyllandsposten,https://jyllands-posten.dk/seneste/,01.05.2023 07:17
"Overblik: Her er de forbund, som vil af med Lizette Risgaard",29.04.2023 00:00,,https://jyllands-posten.dk/jperhverv/ECE15706617/overblik-medlemsforbund-traekker-stoetten-til-lizette-risgaard/,Jyllands-Posten,https://jyllands-posten.dk/seneste/,"Få de seneste nyheder fra ind- og udland om samfund, erhverv, sport og kultur. ",Jyllandsposten,https://jyllands-posten.dk/seneste/,01.05.2023 07:17
Leon Madsen skuffede i regnfuld VM-premiere,29.04.2023 00:00,,https://jyllands-posten.dk/sport/ECE15706618/leon-madsen-skuffede-i-regnfuld-vmpremiere/,Jyllands-Posten,https://jyllands-posten.dk/seneste/,"Få de seneste nyheder fra ind- og udland om samfund, erhverv, sport og kultur. ",Jyllandsposten,https://jyllands-posten.dk/seneste/,01.05.2023 07:17
Regeringen vil forbyde cannabislignende stof,29.04.2023 00:00,,https://jyllands-posten.dk/politik/ECE15706612/regeringen-vil-forbyde-det-cannabislignende-hhc/,Jyllands-Posten,https://jyllands-posten.dk/seneste/,"Få de seneste nyheder fra ind- og udland om samfund, erhverv, sport og kultur. ",Jyllandsposten,https://jyllands-posten.dk/seneste/,01.05.2023 07:17
Benzema laver hattrick i sejr med brasilianske genistreger,29.04.2023 00:00,,https://jyllands-posten.dk/sport/fodbold/ECE15706601/benzema-laver-hattrick-i-sejr-med-brasilianske-genistreger/,Jyllands-Posten,https://jyllands-posten.dk/seneste/,"Få de seneste nyheder fra ind- og udland om samfund, erhverv, sport og kultur. ",Jyllandsposten,https://jyllands-posten.dk/seneste/,01.05.2023 07:17
Lille have med store oplevelser,29.04.2023 00:00,,https://jyllands-posten.dk/bolig/ECE15655777/lille-have-med-store-oplevelser/,Jyllands-Posten,https://jyllands-posten.dk/seneste/,"Få de seneste nyheder fra ind- og udland om samfund, erhverv, sport og kultur. ",Jyllandsposten,https://jyllands-posten.dk/seneste/,01.05.2023 07:17
Russisk milits er trængt: »Hver dag stabler vi tusindvis af lig«,29.04.2023 00:00,,https://jyllands-posten.dk/international/europa/ECE15706569/russisk-milits-traengt-i-bakhmut-uden-vaaben-maa-vi-flygte-eller-doe/,Jyllands-Posten,https://jyllands-posten.dk/seneste/,"Få de seneste nyheder fra ind- og udland om samfund, erhverv, sport og kultur. ",Jyllandsposten,https://jyllands-posten.dk/seneste/,01.05.2023 07:17
Regioner kommer med en indrømmelse: Her har vi svigtet,29.04.2023 00:00,,https://jyllands-posten.dk/indland/ECE15706073/regioner-erkender-svigt-i-sag-om-uberettigede-opslag-i-patientjournaler/,Jyllands-Posten,https://jyllands-posten.dk/seneste/,"Få de seneste nyheder fra ind- og udland om samfund, erhverv, sport og kultur. ",Jyllandsposten,https://jyllands-posten.dk/seneste/,01.05.2023 07:17
Ishockeyherrer tog tredje sejr på stribe inden VM,29.04.2023 00:00,,https://jyllands-posten.dk/sport/ECE15706576/ishockeyherrer-tog-tredje-sejr-paa-stribe-inden-vm/,Jyllands-Posten,https://jyllands-posten.dk/seneste/,"Få de seneste nyheder fra ind- og udland om samfund, erhverv, sport og kultur. ",Jyllandsposten,https://jyllands-posten.dk/seneste/,01.05.2023 07:17
Lindstrøm fik comeback i ny Frankfurt-skuffelse,29.04.2023 00:00,,https://jyllands-posten.dk/sport/fodbold/ECE15706550/lindstroem-fik-comeback-i-ny-frankfurtskuffelse/,Jyllands-Posten,https://jyllands-posten.dk/seneste/,"Få de seneste nyheder fra ind- og udland om samfund, erhverv, sport og kultur. ",Jyllandsposten,https://jyllands-posten.dk/seneste/,01.05.2023 07:17
"I Barcelona driller de manden, der snart kan blive Niklas Landins nye legekammerat",29.04.2023 00:00,,https://jyllands-posten.dk/sport/ECE15669580/maaske-skal-thomas-blachmans-ord-snart-benyttes-paa-landsholdet/,Jyllands-Posten,https://jyllands-posten.dk/seneste/,"Få de seneste nyheder fra ind- og udland om samfund, erhverv, sport og kultur. ",Jyllandsposten,https://jyllands-posten.dk/seneste/,01.05.2023 07:17
Brighton slagtede Wolves i sin største Premier League-sejr,29.04.2023 00:00,,https://jyllands-posten.dk/sport/fodbold/ECE15706565/brighton-slagtede-wolves-i-sin-stoerste-premier-leaguesejr/,Jyllands-Posten,https://jyllands-posten.dk/seneste/,"Få de seneste nyheder fra ind- og udland om samfund, erhverv, sport og kultur. ",Jyllandsposten,https://jyllands-posten.dk/seneste/,01.05.2023 07:17
"Ombord på jomfruturen: »Jeg sagde til min kone, at vi skulle tage den første flyver, for det ville jeg gerne opleve«",29.04.2023 00:00,,https://jyllands-posten.dk/rejser/ECE15706314/jeg-sagde-til-min-kone-at-vi-skulle-tage-den-foerste-flyver-for-det-ville-jeg-gerne-opleve/,Jyllands-Posten,https://jyllands-posten.dk/seneste/,"Få de seneste nyheder fra ind- og udland om samfund, erhverv, sport og kultur. ",Jyllandsposten,https://jyllands-posten.dk/seneste/,01.05.2023 07:17
Nikolaj Jacobsen fejrede opsigtsvækkende aftale på bedste vis,29.04.2023 00:00,,https://jyllands-posten.dk/sport/ECE15669583/nikolaj-jacobsen-fejrede-opsigtsvaekkende-aftale-paa-bedste-vis/,Jyllands-Posten,https://jyllands-posten.dk/seneste/,"Få de seneste nyheder fra ind- og udland om samfund, erhverv, sport og kultur. ",Jyllandsposten,https://jyllands-posten.dk/seneste/,01.05.2023 07:17
Hans Lindberg skifter til dansk barndomsklub,29.04.2023 00:00,,https://jyllands-posten.dk/sport/handbold/ECE15706529/hans-lindberg-skifter-til-dansk-barndomsklub/,Jyllands-Posten,https://jyllands-posten.dk/seneste/,"Få de seneste nyheder fra ind- og udland om samfund, erhverv, sport og kultur. ",Jyllandsposten,https://jyllands-posten.dk/seneste/,01.05.2023 07:17
"Naboer klagede over larm: Så skød gerningsmand et barn og fire voksne, »som var det henrettelser«",29.04.2023 00:00,,https://jyllands-posten.dk/international/usa/ECE15706516/mand-gik-amok-i-texas-og-skoed-et-barn-og-fire-voksne/,Jyllands-Posten,https://jyllands-posten.dk/seneste/,"Få de seneste nyheder fra ind- og udland om samfund, erhverv, sport og kultur. ",Jyllandsposten,https://jyllands-posten.dk/seneste/,01.05.2023 07:17
Magnussen spejdede forgæves efter point i første sprintløb,29.04.2023 00:00,,https://jyllands-posten.dk/sport/formel1/ECE15706505/magnussen-spejdede-forgaeves-efter-point-i-foerste-sprintloeb/,Jyllands-Posten,https://jyllands-posten.dk/seneste/,"Få de seneste nyheder fra ind- og udland om samfund, erhverv, sport og kultur. ",Jyllandsposten,https://jyllands-posten.dk/seneste/,01.05.2023 07:17
Hvidovre tog stort skridt mod Superligaen,29.04.2023 00:00,,https://jyllands-posten.dk/sport/fodbold/ECE15706509/hvidovre-tog-stort-skridt-mod-superligaen/,Jyllands-Posten,https://jyllands-posten.dk/seneste/,"Få de seneste nyheder fra ind- og udland om samfund, erhverv, sport og kultur. ",Jyllandsposten,https://jyllands-posten.dk/seneste/,01.05.2023 07:17
"Forsøgslandmand: »Det er ikke, fordi vi skal til at bruge heste igen, men vi skal kombinere de to verdener«",29.04.2023 00:00,,https://jyllands-posten.dk/jperhverv/ECE15616443/det-er-ikke-fordi-vi-skal-til-at-bruge-heste-igen-men-vi-skal-kombinere-de-to-verdener/,Jyllands-Posten,https://jyllands-posten.dk/seneste/,"Få de seneste nyheder fra ind- og udland om samfund, erhverv, sport og kultur. ",Jyllandsposten,https://jyllands-posten.dk/seneste/,01.05.2023 07:17
