title,published,text,link,og:site_name,og:url,site_description,name,url,scrape_time
"Elisabet Svane: »Undervejs har hun fjernet en del mennesker, der sidder og godter sig nu«",03.05.2023 00:00,,https://politiken.dk/indland/art9329609/%C2%BBUndervejs-har-hun-fjernet-en-del-mennesker-der-sidder-og-godter-sig-nu%C2%AB,Politiken,https://politiken.dk/nyheder/,"Hold dig opdateret pÃ¥ de seneste nyheder pÃ¥ politiken.dk: Seneste Politiken, Seneste Danmark, Seneste Kultur og Seneste Internationalt. ",Politiken,https://politiken.dk/nyheder/,02.05.2023 07:16
At åbne eller lukke dørene - det er sagen,03.05.2023 00:00,,https://politiken.dk/indland/art9321175/At-%C3%A5bne-eller-lukke-d%C3%B8rene-%E2%80%93-det-er-sagen,Politiken,https://politiken.dk/nyheder/,"Hold dig opdateret pÃ¥ de seneste nyheder pÃ¥ politiken.dk: Seneste Politiken, Seneste Danmark, Seneste Kultur og Seneste Internationalt. ",Politiken,https://politiken.dk/nyheder/,02.05.2023 07:16
"Time for time: Sådan gik det for sig, da Lizette Risgaard trak sig som FH-formand",30.05.2023 00:00,,https://politiken.dk/indland/art9329573/Time-for-time-S%C3%A5dan-gik-det-for-sig-da-Lizette-Risgaard-trak-sig-som-FH-formand,Politiken,https://politiken.dk/nyheder/,"Hold dig opdateret pÃ¥ de seneste nyheder pÃ¥ politiken.dk: Seneste Politiken, Seneste Danmark, Seneste Kultur og Seneste Internationalt. ",Politiken,https://politiken.dk/nyheder/,02.05.2023 07:16
Lizette Risgaard trækker sig som formand,30.05.2023 00:00,,https://politiken.dk/indland/art9329565/Lizette-Risgaard-tr%C3%A6kker-sig-som-formand,Politiken,https://politiken.dk/nyheder/,"Hold dig opdateret pÃ¥ de seneste nyheder pÃ¥ politiken.dk: Seneste Politiken, Seneste Danmark, Seneste Kultur og Seneste Internationalt. ",Politiken,https://politiken.dk/nyheder/,02.05.2023 07:16
FH bekræfter kendskab til tidligere Lizette Risgaard-episoder,30.05.2023 00:00,,https://politiken.dk/indland/art9329556/FH-bekr%C3%A6fter-kendskab-til-tidligere-Lizette-Risgaard-episoder,Politiken,https://politiken.dk/nyheder/,"Hold dig opdateret pÃ¥ de seneste nyheder pÃ¥ politiken.dk: Seneste Politiken, Seneste Danmark, Seneste Kultur og Seneste Internationalt. ",Politiken,https://politiken.dk/nyheder/,02.05.2023 07:16
"Mette Frederiksen har fundet en uventet ven i udlandet, der roser hendes idé om et modtagecenter",30.05.2023 00:00,,https://politiken.dk/indland/art9315348/Mette-Frederiksen-har-fundet-en-uventet-ven-i-udlandet-der-roser-hendes-id%C3%A9-om-et-modtagecenter,Politiken,https://politiken.dk/nyheder/,"Hold dig opdateret pÃ¥ de seneste nyheder pÃ¥ politiken.dk: Seneste Politiken, Seneste Danmark, Seneste Kultur og Seneste Internationalt. ",Politiken,https://politiken.dk/nyheder/,02.05.2023 07:16
"Anklager truer: Vi lader spionsager falde, hvis retten åbner dørene",30.05.2023 00:00,,https://politiken.dk/indland/art9322668/Anklager-truer-Vi-lader-spionsager-falde-hvis-retten-%C3%A5bner-d%C3%B8rene,Politiken,https://politiken.dk/nyheder/,"Hold dig opdateret pÃ¥ de seneste nyheder pÃ¥ politiken.dk: Seneste Politiken, Seneste Danmark, Seneste Kultur og Seneste Internationalt. ",Politiken,https://politiken.dk/nyheder/,02.05.2023 07:16
Konflikt mellem grupper af unge mænd førte til knivstik,30.05.2023 00:00,,https://politiken.dk/indland/art9329551/Konflikt-mellem-grupper-af-unge-m%C3%A6nd-f%C3%B8rte-til-knivstik,Politiken,https://politiken.dk/nyheder/,"Hold dig opdateret pÃ¥ de seneste nyheder pÃ¥ politiken.dk: Seneste Politiken, Seneste Danmark, Seneste Kultur og Seneste Internationalt. ",Politiken,https://politiken.dk/nyheder/,02.05.2023 07:16
Langstrakt krisemøde endte som midnatsforestilling,30.05.2023 00:00,,https://politiken.dk/indland/art9329535/Langstrakt-krisem%C3%B8de-endte-som-midnatsforestilling,Politiken,https://politiken.dk/nyheder/,"Hold dig opdateret pÃ¥ de seneste nyheder pÃ¥ politiken.dk: Seneste Politiken, Seneste Danmark, Seneste Kultur og Seneste Internationalt. ",Politiken,https://politiken.dk/nyheder/,02.05.2023 07:16
Svensk statsminister om Mette Frederiksens modtagecenter: Vi kommer til at lande der,29.05.2023 00:00,,https://politiken.dk/indland/art9327800/Svensk-statsminister-om-Mette-Frederiksens-modtagecenter-Vi-kommer-til-at-lande-der,Politiken,https://politiken.dk/nyheder/,"Hold dig opdateret pÃ¥ de seneste nyheder pÃ¥ politiken.dk: Seneste Politiken, Seneste Danmark, Seneste Kultur og Seneste Internationalt. ",Politiken,https://politiken.dk/nyheder/,02.05.2023 07:16
En ny type fans fylder på kendt tribune. Nu spreder kritikken sig,29.05.2023 00:00,,https://politiken.dk/ibyen/art9313427/En-ny-type-fans-fylder-p%C3%A5-kendt-tribune.-Nu-spreder-kritikken-sig,Politiken,https://politiken.dk/nyheder/,"Hold dig opdateret pÃ¥ de seneste nyheder pÃ¥ politiken.dk: Seneste Politiken, Seneste Danmark, Seneste Kultur og Seneste Internationalt. ",Politiken,https://politiken.dk/nyheder/,02.05.2023 07:16
Slankemedicin gav Pia Pedersen livsglæden tilbage. Men økonomien bekymrer hende voldsomt,29.05.2023 00:00,,https://politiken.dk/forbrugogliv/sundhedogmotion/art9293226/Slankemedicin-gav-Pia-Pedersen-livsgl%C3%A6den-tilbage.-Men-%C3%B8konomien-bekymrer-hende-voldsomt,Politiken,https://politiken.dk/nyheder/,"Hold dig opdateret pÃ¥ de seneste nyheder pÃ¥ politiken.dk: Seneste Politiken, Seneste Danmark, Seneste Kultur og Seneste Internationalt. ",Politiken,https://politiken.dk/nyheder/,02.05.2023 07:16
Professor: Personer med stor gavn af Wegovy har simpelthen ikke råd,29.05.2023 00:00,,https://politiken.dk/forbrugogliv/sundhedogmotion/art9325957/Personer-med-stor-gavn-af-Wegovy-har-simpelthen-ikke-r%C3%A5d,Politiken,https://politiken.dk/nyheder/,"Hold dig opdateret pÃ¥ de seneste nyheder pÃ¥ politiken.dk: Seneste Politiken, Seneste Danmark, Seneste Kultur og Seneste Internationalt. ",Politiken,https://politiken.dk/nyheder/,02.05.2023 07:16
Topfolk i fagbevægelsen er indkaldt til nyt krisemøde,29.05.2023 00:00,,https://politiken.dk/indland/art9329455/Topfolk-i-fagbev%C3%A6gelsen-er-indkaldt-til-nyt-krisem%C3%B8de,Politiken,https://politiken.dk/nyheder/,"Hold dig opdateret pÃ¥ de seneste nyheder pÃ¥ politiken.dk: Seneste Politiken, Seneste Danmark, Seneste Kultur og Seneste Internationalt. ",Politiken,https://politiken.dk/nyheder/,02.05.2023 07:16
"Spørgsmålet er, om Lizette Risgaard vil gå planken ud",29.05.2023 00:00,,https://politiken.dk/indland/art9329381/Sp%C3%B8rgsm%C3%A5let-er-om-Lizette-Risgaard-vil-g%C3%A5-planken-ud,Politiken,https://politiken.dk/nyheder/,"Hold dig opdateret pÃ¥ de seneste nyheder pÃ¥ politiken.dk: Seneste Politiken, Seneste Danmark, Seneste Kultur og Seneste Internationalt. ",Politiken,https://politiken.dk/nyheder/,02.05.2023 07:16
Overblik: Hvem støtter stadig Lizette Risgaard - og hvem gør ikke?,29.05.2023 00:00,,https://politiken.dk/indland/art9329282/Hvem-st%C3%B8tter-stadig-Lizette-Risgaard-%E2%80%93-og-hvem-g%C3%B8r-ikke,Politiken,https://politiken.dk/nyheder/,"Hold dig opdateret pÃ¥ de seneste nyheder pÃ¥ politiken.dk: Seneste Politiken, Seneste Danmark, Seneste Kultur og Seneste Internationalt. ",Politiken,https://politiken.dk/nyheder/,02.05.2023 07:16
Scandinavian Star-ofre vil sagsøge Søfartsstyrelsen,29.05.2023 00:00,,https://politiken.dk/indland/art9329324/Scandinavian-Star-ofre-vil-sags%C3%B8ge-S%C3%B8fartsstyrelsen,Politiken,https://politiken.dk/nyheder/,"Hold dig opdateret pÃ¥ de seneste nyheder pÃ¥ politiken.dk: Seneste Politiken, Seneste Danmark, Seneste Kultur og Seneste Internationalt. ",Politiken,https://politiken.dk/nyheder/,02.05.2023 07:16
"Prispatruljen: Store bededag nærmer sig, og det betyder tilbud på smør",29.05.2023 00:00,,https://politiken.dk/indland/art9318358/Store-bededag-n%C3%A6rmer-sig-og-det-betyder-tilbud-p%C3%A5-sm%C3%B8r,Politiken,https://politiken.dk/nyheder/,"Hold dig opdateret pÃ¥ de seneste nyheder pÃ¥ politiken.dk: Seneste Politiken, Seneste Danmark, Seneste Kultur og Seneste Internationalt. ",Politiken,https://politiken.dk/nyheder/,02.05.2023 07:16
Læger tiltalt: Gav piloter helbredsattester uden autorisation,29.05.2023 00:00,,https://politiken.dk/indland/art9329286/Gav-piloter-helbredsattester-uden-autorisation,Politiken,https://politiken.dk/nyheder/,"Hold dig opdateret pÃ¥ de seneste nyheder pÃ¥ politiken.dk: Seneste Politiken, Seneste Danmark, Seneste Kultur og Seneste Internationalt. ",Politiken,https://politiken.dk/nyheder/,02.05.2023 07:16
Flere forbund trækker støtten til Lizette Risgaard,29.05.2023 00:00,,https://politiken.dk/indland/art9329278/Flere-forbund-tr%C3%A6kker-st%C3%B8tten-til-Lizette-Risgaard,Politiken,https://politiken.dk/nyheder/,"Hold dig opdateret pÃ¥ de seneste nyheder pÃ¥ politiken.dk: Seneste Politiken, Seneste Danmark, Seneste Kultur og Seneste Internationalt. ",Politiken,https://politiken.dk/nyheder/,02.05.2023 07:16
Magt og kontrol driver seriemorderen og serievoldtægtsmanden,29.05.2023 00:00,,https://politiken.dk/indland/art9324762/Magt-og-kontrol-driver-seriemorderen-og-serievoldt%C3%A6gtsmanden,Politiken,https://politiken.dk/nyheder/,"Hold dig opdateret pÃ¥ de seneste nyheder pÃ¥ politiken.dk: Seneste Politiken, Seneste Danmark, Seneste Kultur og Seneste Internationalt. ",Politiken,https://politiken.dk/nyheder/,02.05.2023 07:16
Fagbosser og erhvervsliv takker ja til regeringens trepartsinvitation,29.05.2023 00:00,,https://politiken.dk/indland/art9329256/Fagbosser-og-erhvervsliv-takker-ja-til-regeringens-trepartsinvitation,Politiken,https://politiken.dk/nyheder/,"Hold dig opdateret pÃ¥ de seneste nyheder pÃ¥ politiken.dk: Seneste Politiken, Seneste Danmark, Seneste Kultur og Seneste Internationalt. ",Politiken,https://politiken.dk/nyheder/,02.05.2023 07:16
Miav: Stjerner på stribe hylder en af verdens mest kendte katte,17.05.2023 00:00,,https://politiken.dk/kultur/mode/art9331995/Miav-Stjerner-p%C3%A5-stribe-hylder-en-af-verdens-mest-kendte-katte,Politiken,https://politiken.dk/nyheder/,"Hold dig opdateret pÃ¥ de seneste nyheder pÃ¥ politiken.dk: Seneste Politiken, Seneste Danmark, Seneste Kultur og Seneste Internationalt. ",Politiken,https://politiken.dk/nyheder/,02.05.2023 07:16
Rygtet talte sandt: Afdød nobelprisvinder havde endnu en bog i arkivet,02.05.2039 00:00,,https://politiken.dk/kultur/boger/art9327489/Rygtet-talte-sandt-Afd%C3%B8d-nobelprisvinder-havde-endnu-en-bog-i-arkivet,Politiken,https://politiken.dk/nyheder/,"Hold dig opdateret pÃ¥ de seneste nyheder pÃ¥ politiken.dk: Seneste Politiken, Seneste Danmark, Seneste Kultur og Seneste Internationalt. ",Politiken,https://politiken.dk/nyheder/,02.05.2023 07:16
Hollywood-forfattere indleder strejke efter sammenbrud,02.05.2023 00:00,,https://politiken.dk/kultur/film_og_tv/art9331994/Hollywood-forfattere-indleder-strejke-efter-sammenbrud,Politiken,https://politiken.dk/nyheder/,"Hold dig opdateret pÃ¥ de seneste nyheder pÃ¥ politiken.dk: Seneste Politiken, Seneste Danmark, Seneste Kultur og Seneste Internationalt. ",Politiken,https://politiken.dk/nyheder/,02.05.2023 07:16
Folk- og countrymusiker Gordon Lightfoot er død,02.05.2023 00:00,,https://politiken.dk/kultur/musik/art9331980/Folk-og-countrymusiker-Gordon-Lightfoot-er-d%C3%B8d,Politiken,https://politiken.dk/nyheder/,"Hold dig opdateret pÃ¥ de seneste nyheder pÃ¥ politiken.dk: Seneste Politiken, Seneste Danmark, Seneste Kultur og Seneste Internationalt. ",Politiken,https://politiken.dk/nyheder/,02.05.2023 07:16
"Her er syv biograffilm, vi glæder os til i maj: Kan man holde døden på afstand ved at gå og gå og gå?",10.05.2023 00:00,,https://politiken.dk/kultur/film_og_tv/art9170573/Kan-man-holde-d%C3%B8den-p%C3%A5-afstand-ved-at-g%C3%A5-og-g%C3%A5-og-g%C3%A5,Politiken,https://politiken.dk/nyheder/,"Hold dig opdateret pÃ¥ de seneste nyheder pÃ¥ politiken.dk: Seneste Politiken, Seneste Danmark, Seneste Kultur og Seneste Internationalt. ",Politiken,https://politiken.dk/nyheder/,02.05.2023 07:16
Balladen er ikke slut: Nu sagsøger aktionærerer Adidas,13.05.2023 00:00,,https://politiken.dk/kultur/art9330168/Nu-sags%C3%B8ger-aktion%C3%A6rerer-Adidas,Politiken,https://politiken.dk/nyheder/,"Hold dig opdateret pÃ¥ de seneste nyheder pÃ¥ politiken.dk: Seneste Politiken, Seneste Danmark, Seneste Kultur og Seneste Internationalt. ",Politiken,https://politiken.dk/nyheder/,02.05.2023 07:16
"Mens han skriver portrættet, dukker den portrætteredes dødsannonce frem på skærmen",15.05.2023 00:00,,https://politiken.dk/kultur/boger/boganmeldelser/skonlitteratur_boger/art9324710/Mens-han-skriver-portr%C3%A6ttet-dukker-den-portr%C3%A6tteredes-d%C3%B8dsannonce-frem-p%C3%A5-sk%C3%A6rmen,Politiken,https://politiken.dk/nyheder/,"Hold dig opdateret pÃ¥ de seneste nyheder pÃ¥ politiken.dk: Seneste Politiken, Seneste Danmark, Seneste Kultur og Seneste Internationalt. ",Politiken,https://politiken.dk/nyheder/,02.05.2023 07:16
34 nye kunstnere springer ud: Blot kan vi herfra sige tillykke,17.05.2023 00:00,,https://politiken.dk/kultur/kunst/art9321900/34-nye-kunstnere-springer-ud-Blot-kan-vi-herfra-sige-tillykke,Politiken,https://politiken.dk/nyheder/,"Hold dig opdateret pÃ¥ de seneste nyheder pÃ¥ politiken.dk: Seneste Politiken, Seneste Danmark, Seneste Kultur og Seneste Internationalt. ",Politiken,https://politiken.dk/nyheder/,02.05.2023 07:16
"Smådesperat proklamerer 63-årige Henrik Prip: »Det er nu, jeg peaker!«",17.05.2023 00:00,,https://politiken.dk/kultur/scene/art9193351/%C2%BBDet-er-nu-jeg-peaker%C2%AB,Politiken,https://politiken.dk/nyheder/,"Hold dig opdateret pÃ¥ de seneste nyheder pÃ¥ politiken.dk: Seneste Politiken, Seneste Danmark, Seneste Kultur og Seneste Internationalt. ",Politiken,https://politiken.dk/nyheder/,02.05.2023 07:16
Anmelder: Jeg har ikke set noget lignende herhjemme. Det var sensationelt,19.05.2023 00:00,,https://politiken.dk/kultur/musik/art9312705/Jeg-har-ikke-set-noget-lignende-herhjemme.-Det-var-sensationelt,Politiken,https://politiken.dk/nyheder/,"Hold dig opdateret pÃ¥ de seneste nyheder pÃ¥ politiken.dk: Seneste Politiken, Seneste Danmark, Seneste Kultur og Seneste Internationalt. ",Politiken,https://politiken.dk/nyheder/,02.05.2023 07:16
Hun har kun udgivet to sange og allerede blevet kaldt en tiltrængt lussing rettet direkte mod dansk musikindustri,19.05.2023 00:00,,https://politiken.dk/ibyen/art9246186/Hun-har-kun-udgivet-to-sange-og-allerede-blevet-kaldt-en-tiltr%C3%A6ngt-lussing-rettet-direkte-mod-dansk-musikindustri,Politiken,https://politiken.dk/nyheder/,"Hold dig opdateret pÃ¥ de seneste nyheder pÃ¥ politiken.dk: Seneste Politiken, Seneste Danmark, Seneste Kultur og Seneste Internationalt. ",Politiken,https://politiken.dk/nyheder/,02.05.2023 07:16
Den tyske mor fra Instagram er genial,21.05.2023 00:00,,https://politiken.dk/kultur/set_og_hoert/art9281340/Den-tyske-mor-fra-Instagram-er-genial,Politiken,https://politiken.dk/nyheder/,"Hold dig opdateret pÃ¥ de seneste nyheder pÃ¥ politiken.dk: Seneste Politiken, Seneste Danmark, Seneste Kultur og Seneste Internationalt. ",Politiken,https://politiken.dk/nyheder/,02.05.2023 07:16
"Hvad kalder man det, når forældre lider af omsorgstræthed?",22.05.2023 00:00,,https://politiken.dk/kultur/art9328302/Hvad-kalder-man-det-n%C3%A5r-for%C3%A6ldre-lider-af-omsorgstr%C3%A6thed,Politiken,https://politiken.dk/nyheder/,"Hold dig opdateret pÃ¥ de seneste nyheder pÃ¥ politiken.dk: Seneste Politiken, Seneste Danmark, Seneste Kultur og Seneste Internationalt. ",Politiken,https://politiken.dk/nyheder/,02.05.2023 07:16
"5 hjerter: Hvad i helvede er det, Knausgård har gang i?Â",03.05.2023 00:00,,https://politiken.dk/kultur/boger/boganmeldelser/skonlitteratur_boger/art9319570/Hvad-i-helvede-er-det-Knausg%C3%A5rd-har-gang-i,Politiken,https://politiken.dk/nyheder/,"Hold dig opdateret pÃ¥ de seneste nyheder pÃ¥ politiken.dk: Seneste Politiken, Seneste Danmark, Seneste Kultur og Seneste Internationalt. ",Politiken,https://politiken.dk/nyheder/,02.05.2023 07:16
Norden er blevet mere sexet. Og det skal nu udnyttes,03.05.2023 00:00,,https://politiken.dk/kultur/art9319644/Norden-er-blevet-mere-sexet.-Og-det-skal-nu-udnyttes,Politiken,https://politiken.dk/nyheder/,"Hold dig opdateret pÃ¥ de seneste nyheder pÃ¥ politiken.dk: Seneste Politiken, Seneste Danmark, Seneste Kultur og Seneste Internationalt. ",Politiken,https://politiken.dk/nyheder/,02.05.2023 07:16
Amerikansk rigmand bruger to millioner dollars om året på at holde sig ung. Jeg forstår ham - næsten,03.05.2023 00:00,,https://politiken.dk/kultur/boger/art9318193/Amerikansk-rigmand-bruger-to-millioner-dollars-om-%C3%A5ret-p%C3%A5-at-holde-sig-ung.-Jeg-forst%C3%A5r-ham-%E2%80%93-n%C3%A6sten,Politiken,https://politiken.dk/nyheder/,"Hold dig opdateret pÃ¥ de seneste nyheder pÃ¥ politiken.dk: Seneste Politiken, Seneste Danmark, Seneste Kultur og Seneste Internationalt. ",Politiken,https://politiken.dk/nyheder/,02.05.2023 07:16
"Her er de seks mest interessante film og serier, du bør streame i maj",03.05.2023 00:00,,https://politiken.dk/kultur/film_og_tv/art9170492/Her-er-de-seks-mest-interessante-film-og-serier-du-b%C3%B8r-streame-i-maj,Politiken,https://politiken.dk/nyheder/,"Hold dig opdateret pÃ¥ de seneste nyheder pÃ¥ politiken.dk: Seneste Politiken, Seneste Danmark, Seneste Kultur og Seneste Internationalt. ",Politiken,https://politiken.dk/nyheder/,02.05.2023 07:16
Vi kender dem alle i mere eller mindre fortyndet udgave: De løsgående menneskelige missiler,03.05.2023 00:00,,https://politiken.dk/kultur/boger/boganmeldelser/faglitteratur_boger/art9319681/Vi-kender-dem-alle-i-mere-eller-mindre-fortyndet-udgave-De-l%C3%B8sg%C3%A5ende-menneskelige-missiler,Politiken,https://politiken.dk/nyheder/,"Hold dig opdateret pÃ¥ de seneste nyheder pÃ¥ politiken.dk: Seneste Politiken, Seneste Danmark, Seneste Kultur og Seneste Internationalt. ",Politiken,https://politiken.dk/nyheder/,02.05.2023 07:16
Alle de mandlige karakterer får hugget dilleren af,03.05.2023 00:00,,https://politiken.dk/kultur/scene/art9284567/Alle-de-mandlige-karakterer-f%C3%A5r-hugget-dilleren-af,Politiken,https://politiken.dk/nyheder/,"Hold dig opdateret pÃ¥ de seneste nyheder pÃ¥ politiken.dk: Seneste Politiken, Seneste Danmark, Seneste Kultur og Seneste Internationalt. ",Politiken,https://politiken.dk/nyheder/,02.05.2023 07:16
Hollywoodselskaber overbød hinanden for at få rettighederne til hendes thrillere,03.05.2023 00:00,,https://politiken.dk/kultur/boger/art9318181/Hollywoodselskaber-overb%C3%B8d-hinanden-for-at-f%C3%A5-rettighederne-til-hendes-thrillere,Politiken,https://politiken.dk/nyheder/,"Hold dig opdateret pÃ¥ de seneste nyheder pÃ¥ politiken.dk: Seneste Politiken, Seneste Danmark, Seneste Kultur og Seneste Internationalt. ",Politiken,https://politiken.dk/nyheder/,02.05.2023 07:16
Nu står verden ikke længere. Livgarden er gået til scenen!,03.05.2023 00:00,,https://politiken.dk/kultur/scene/art9177041/Nu-st%C3%A5r-verden-ikke-l%C3%A6ngere.-Livgarden-er-g%C3%A5et-til-scenen,Politiken,https://politiken.dk/nyheder/,"Hold dig opdateret pÃ¥ de seneste nyheder pÃ¥ politiken.dk: Seneste Politiken, Seneste Danmark, Seneste Kultur og Seneste Internationalt. ",Politiken,https://politiken.dk/nyheder/,02.05.2023 07:16
Så er der ellers dømt dansk dødsdisco,03.05.2023 00:00,,https://politiken.dk/kultur/musik/art9320654/S%C3%A5-er-der-ellers-d%C3%B8mt-dansk-d%C3%B8dsdisco,Politiken,https://politiken.dk/nyheder/,"Hold dig opdateret pÃ¥ de seneste nyheder pÃ¥ politiken.dk: Seneste Politiken, Seneste Danmark, Seneste Kultur og Seneste Internationalt. ",Politiken,https://politiken.dk/nyheder/,02.05.2023 07:16
"Skulle en dansende diskoand være bedre, bare fordi den er fra gamle dage?",03.05.2023 00:00,,https://politiken.dk/kultur/set_og_hoert/art9322441/Skulle-en-dansende-diskoand-v%C3%A6re-bedre-bare-fordi-den-er-fra-gamle-dage,Politiken,https://politiken.dk/nyheder/,"Hold dig opdateret pÃ¥ de seneste nyheder pÃ¥ politiken.dk: Seneste Politiken, Seneste Danmark, Seneste Kultur og Seneste Internationalt. ",Politiken,https://politiken.dk/nyheder/,02.05.2023 07:16
Stjerneinstruktør: Venskab kan også være forbundet med hjertesorg,03.05.2023 00:00,,https://politiken.dk/kultur/film_og_tv/art9320156/Stjerneinstrukt%C3%B8r-Venskab-kan-ogs%C3%A5-v%C3%A6re-forbundet-med-hjertesorg,Politiken,https://politiken.dk/nyheder/,"Hold dig opdateret pÃ¥ de seneste nyheder pÃ¥ politiken.dk: Seneste Politiken, Seneste Danmark, Seneste Kultur og Seneste Internationalt. ",Politiken,https://politiken.dk/nyheder/,02.05.2023 07:16
80-årige Biden bliver grillet for sin alder til middag med pressen,03.05.2023 00:00,,https://politiken.dk/kultur/art9329590/80-%C3%A5rige-Biden-bliver-grillet-for-sin-alder-til-middag-med-pressen,Politiken,https://politiken.dk/nyheder/,"Hold dig opdateret pÃ¥ de seneste nyheder pÃ¥ politiken.dk: Seneste Politiken, Seneste Danmark, Seneste Kultur og Seneste Internationalt. ",Politiken,https://politiken.dk/nyheder/,02.05.2023 07:16
Alle taler om de tre dage med spektakulært design i København. Så her er fem gode råd,03.05.2023 00:00,,https://politiken.dk/kultur/design/art9296340/Alle-taler-om-de-tre-dage-med-spektakul%C3%A6rt-design-i-K%C3%B8benhavn.-S%C3%A5-her-er-fem-gode-r%C3%A5d,Politiken,https://politiken.dk/nyheder/,"Hold dig opdateret pÃ¥ de seneste nyheder pÃ¥ politiken.dk: Seneste Politiken, Seneste Danmark, Seneste Kultur og Seneste Internationalt. ",Politiken,https://politiken.dk/nyheder/,02.05.2023 07:16
"Ondskabens kostskole: Her skulle pigerne ordne vasketøj - et pænt ord for, at de blev voldtaget i vaskekælderen af en præst",30.05.2023 00:00,,https://politiken.dk/kultur/set_og_hoert/art9281358/Ondskabens-kostskole-Her-skulle-pigerne-ordne-vasket%C3%B8j-et-p%C3%A6nt-ord-for-at-de-blev-voldtaget-i-vaskek%C3%A6lderen-af-en-pr%C3%A6st,Politiken,https://politiken.dk/nyheder/,"Hold dig opdateret pÃ¥ de seneste nyheder pÃ¥ politiken.dk: Seneste Politiken, Seneste Danmark, Seneste Kultur og Seneste Internationalt. ",Politiken,https://politiken.dk/nyheder/,02.05.2023 07:16
Hellere for meget dig selv end for lidt,30.05.2023 00:00,,https://politiken.dk/kultur/musik/art9312707/Hellere-for-meget-dig-selv-end-for-lidt,Politiken,https://politiken.dk/nyheder/,"Hold dig opdateret pÃ¥ de seneste nyheder pÃ¥ politiken.dk: Seneste Politiken, Seneste Danmark, Seneste Kultur og Seneste Internationalt. ",Politiken,https://politiken.dk/nyheder/,02.05.2023 07:16
"Jeg troede, at verden anno Dirrty var klar til en kvinde, der nød sin egen krop og seksualitet. Men nej",29.05.2023 00:00,,https://politiken.dk/kultur/art8989215/Jeg-troede-at-verden-anno-Dirrty-var-klar-til-en-kvinde-der-n%C3%B8d-sin-egen-krop-og-seksualitet.-Men-nej,Politiken,https://politiken.dk/nyheder/,"Hold dig opdateret pÃ¥ de seneste nyheder pÃ¥ politiken.dk: Seneste Politiken, Seneste Danmark, Seneste Kultur og Seneste Internationalt. ",Politiken,https://politiken.dk/nyheder/,02.05.2023 07:16
Josephine Park kender ikke telefon-testen: Uden at vide det afslører den danske Netflixstjerne sig som millenial,29.05.2023 00:00,,https://politiken.dk/kultur/art9292177/Uden-at-vide-det-afsl%C3%B8rer-den-danske-Netflixstjerne-sig-som-millenial,Politiken,https://politiken.dk/nyheder/,"Hold dig opdateret pÃ¥ de seneste nyheder pÃ¥ politiken.dk: Seneste Politiken, Seneste Danmark, Seneste Kultur og Seneste Internationalt. ",Politiken,https://politiken.dk/nyheder/,02.05.2023 07:16
Kan man være for doven til at gøre det af med sig selv?,29.05.2023 00:00,,https://politiken.dk/kultur/boger/art9318359/Kan-man-v%C3%A6re-for-doven-til-at-g%C3%B8re-det-af-med-sig-selv,Politiken,https://politiken.dk/nyheder/,"Hold dig opdateret pÃ¥ de seneste nyheder pÃ¥ politiken.dk: Seneste Politiken, Seneste Danmark, Seneste Kultur og Seneste Internationalt. ",Politiken,https://politiken.dk/nyheder/,02.05.2023 07:16
Ballet hylder ikonisk heavy metal-band,29.05.2023 00:00,,https://politiken.dk/kultur/art9327187/Ballet-hylder-ikonisk-heavy-metal-band,Politiken,https://politiken.dk/nyheder/,"Hold dig opdateret pÃ¥ de seneste nyheder pÃ¥ politiken.dk: Seneste Politiken, Seneste Danmark, Seneste Kultur og Seneste Internationalt. ",Politiken,https://politiken.dk/nyheder/,02.05.2023 07:16
Flyvende papirfisk kan også være godt design,29.05.2023 00:00,,https://politiken.dk/kultur/art9284926/Flyvende-papirfisk-kan-ogs%C3%A5-v%C3%A6re-godt-design,Politiken,https://politiken.dk/nyheder/,"Hold dig opdateret pÃ¥ de seneste nyheder pÃ¥ politiken.dk: Seneste Politiken, Seneste Danmark, Seneste Kultur og Seneste Internationalt. ",Politiken,https://politiken.dk/nyheder/,02.05.2023 07:16
Irma-hønen forekommer decideret vingeskudt på Folkeklubbens nye album,29.05.2023 00:00,,https://politiken.dk/kultur/musik/art9302461/Irma-h%C3%B8nen-forekommer-decideret-vingeskudt-p%C3%A5-Folkeklubbens-nye-album,Politiken,https://politiken.dk/nyheder/,"Hold dig opdateret pÃ¥ de seneste nyheder pÃ¥ politiken.dk: Seneste Politiken, Seneste Danmark, Seneste Kultur og Seneste Internationalt. ",Politiken,https://politiken.dk/nyheder/,02.05.2023 07:16
"Som forælder er jeg tumlet ind i en underkategori af bøger, som sjældent omtales og aldrig som litteratur",29.05.2023 00:00,,https://politiken.dk/kultur/boger/art9318345/Som-for%C3%A6lder-er-jeg-tumlet-ind-i-en-underkategori-af-b%C3%B8ger-som-sj%C3%A6ldent-omtales-og-aldrig-som-litteratur,Politiken,https://politiken.dk/nyheder/,"Hold dig opdateret pÃ¥ de seneste nyheder pÃ¥ politiken.dk: Seneste Politiken, Seneste Danmark, Seneste Kultur og Seneste Internationalt. ",Politiken,https://politiken.dk/nyheder/,02.05.2023 07:16
