title,published,text,link,og:site_name,og:url,site_description,name,url,scrape_time
Sygehuse får ansvar for udskrevne patienter de tre første døgn,05.12.2022 00:00,"For at nedbringe antallet af genindlæggelser på landets sygehuse, vil Danske Regioner indføre en ny ordning, hvor sygehuset de første tre døgn efter udskrivelsen er ansvarlig for patienten, skriver Ritzau. I 2021 måtte cirka 10.000 patienter over 67 år genindlægges, kort efter at de var udskrevet.",https://nyheder.tv2.dk/live/2022-12-12-nyhedsoverblik,nyheder.tv2.dk,https://nyheder.tv2.dk/live/2022-12-12-nyhedsoverblik,"Vi giver dig dagens nyheder, mens de sker. Du kan tippe TV 2s journalist her.
",TV2,https://nyheder.tv2.dk/live/2022-12-12-nyhedsoverblik,12.12.2022 07:20
USAs finansminister forventer lavere inflation næste år,05.12.2022 00:00,"Den amerikanske finansminister, Janet Yellen, forudser en betydelig reduktion i den amerikanske inflation i 2023. Det siger hun i et interview i programmet ""60 Minutes"" på tv-kanalen CBS, skriver Ritzau. Finansministeren har tidligere været direktør for den amerikanske centralbank.",https://nyheder.tv2.dk/live/2022-12-12-nyhedsoverblik,nyheder.tv2.dk,https://nyheder.tv2.dk/live/2022-12-12-nyhedsoverblik,"Vi giver dig dagens nyheder, mens de sker. Du kan tippe TV 2s journalist her.
",TV2,https://nyheder.tv2.dk/live/2022-12-12-nyhedsoverblik,12.12.2022 07:20
Biden lover Zelenskyj at styrke Ukraines luftforsvar,05.12.2022 00:00,"USA's præsident, Joe Biden, har under en telefonsamtale med sin ukrainske kollega, Volodymyr Zelenskyj, gjort det klart, at USA prioriterer at styrke Ukraines luftforsvar. Det skal ske ved at prioritere den hjælp, USA tilbyder Ukraine. Det oplyser Det Hvide Hus, skriver Ritzau. ",https://nyheder.tv2.dk/live/2022-12-12-nyhedsoverblik,nyheder.tv2.dk,https://nyheder.tv2.dk/live/2022-12-12-nyhedsoverblik,"Vi giver dig dagens nyheder, mens de sker. Du kan tippe TV 2s journalist her.
",TV2,https://nyheder.tv2.dk/live/2022-12-12-nyhedsoverblik,12.12.2022 07:20
Ukendte personer dumper 27 døde migranter langs vej i Zambia,05.12.2022 00:00,"Ligene af 27 formodede etiopiske migranter, som er fundet i et område nord for Zambias hovedstad, Lusaka, menes at være døde af ""sult og udmattelse"". Det oplyser zambisk politi søndag ifølge AFP, skriver Ritzau. Ofrene er alle mænd i alderen mellem 20 og 38 år.",https://nyheder.tv2.dk/live/2022-12-12-nyhedsoverblik,nyheder.tv2.dk,https://nyheder.tv2.dk/live/2022-12-12-nyhedsoverblik,"Vi giver dig dagens nyheder, mens de sker. Du kan tippe TV 2s journalist her.
",TV2,https://nyheder.tv2.dk/live/2022-12-12-nyhedsoverblik,12.12.2022 07:20
Østjyske venstrefolk frygter for partiets troværdighed,05.12.2022 00:00,"Bekymringen stiger i Venstres østjyske bagland, efter at partiets formand, Jakob Ellemann-Jensen, søndag droppede et krav om en advokatvurdering i Minksagen. Det fortæller regionsrådsmedlem i Region Midtjylland for Venstre Anders G. Christensen til TV2 Østjylland.",https://nyheder.tv2.dk/live/2022-12-12-nyhedsoverblik,nyheder.tv2.dk,https://nyheder.tv2.dk/live/2022-12-12-nyhedsoverblik,"Vi giver dig dagens nyheder, mens de sker. Du kan tippe TV 2s journalist her.
",TV2,https://nyheder.tv2.dk/live/2022-12-12-nyhedsoverblik,12.12.2022 07:20
Brændende skraldebjerg på højde med Taj Mahal: Indiens megalossepladser tegner dystert for klimaet,12.12.2022 08:10,,https://jyllands-posten.dk/international/ECE14681975/et-skraldebjerg-paa-hoejde-med-taj-mahal-indiens-braendende-lossepladser-tegner-dystert-for-klimaet/,,,"FÃ¥ de seneste nyheder fra ind- og udland om samfund, erhverv, sport og kultur. ",Jyllandsposten,https://jyllands-posten.dk/seneste/,12.12.2022 07:20
USAs finansminister forventer lavere inflation næste år,12.12.2022 07:38,,https://jyllands-posten.dk/international/usa/ECE14682630/usas-finansminister-forventer-lavere-inflation-naeste-aar/,,,"FÃ¥ de seneste nyheder fra ind- og udland om samfund, erhverv, sport og kultur. ",Jyllandsposten,https://jyllands-posten.dk/seneste/,12.12.2022 07:20
Messi forgudes. Men hjemme i Argentina er alt også totalt kaos,12.12.2022 06:45,,https://jyllands-posten.dk/international/ECE14672150/messi-giver-dem-haab-for-hjemme-i-argentina-er-alt-totalt-kaos/?st=1,,,"FÃ¥ de seneste nyheder fra ind- og udland om samfund, erhverv, sport og kultur. ",Jyllandsposten,https://jyllands-posten.dk/seneste/,12.12.2022 07:20
Lars Eller lavede point - danskere skinnede på isen i NHL,12.12.2022 06:36,,https://jyllands-posten.dk/sport/ECE14682626/lars-eller-lavede-point-danskere-skinnede-paa-isen-i-nhl/,,,"FÃ¥ de seneste nyheder fra ind- og udland om samfund, erhverv, sport og kultur. ",Jyllandsposten,https://jyllands-posten.dk/seneste/,12.12.2022 07:20
Kina sender corona-app på pension efter mere end to år,12.12.2022 06:35,,https://jyllands-posten.dk/international/asien/ECE14682632/kina-sender-coronaapp-paa-pension-efter-mere-end-to-aar/,,,"FÃ¥ de seneste nyheder fra ind- og udland om samfund, erhverv, sport og kultur. ",Jyllandsposten,https://jyllands-posten.dk/seneste/,12.12.2022 07:20
De gamle mod de unge: Det grå guld kan sagtens vinde VM,12.12.2022 06:30,,https://jyllands-posten.dk/sport/fodbold/ECE14656434/de-gamle-mod-de-unge-det-graa-guld-kan-sagtens-vinde-vm/,,,"FÃ¥ de seneste nyheder fra ind- og udland om samfund, erhverv, sport og kultur. ",Jyllandsposten,https://jyllands-posten.dk/seneste/,12.12.2022 07:20
Boganmeldelse Om at genantænde en død glød,12.12.2022 06:24,,https://jyllands-posten.dk/kultur/litteratur/ECE14671927/anmeldelse-af-69-daemoner-om-at-genantaende-en-doed-gloed/,,,"FÃ¥ de seneste nyheder fra ind- og udland om samfund, erhverv, sport og kultur. ",Jyllandsposten,https://jyllands-posten.dk/seneste/,12.12.2022 07:20
Peruanske demonstranter kræver fængslet ekspræsident løsladt,12.12.2022 06:21,,https://jyllands-posten.dk/international/ECE14682619/peruanske-demonstranter-kraever-faengslet-ekspraesident-loesladt/,,,"FÃ¥ de seneste nyheder fra ind- og udland om samfund, erhverv, sport og kultur. ",Jyllandsposten,https://jyllands-posten.dk/seneste/,12.12.2022 07:20
Hun fik topjob: Ville kort efter stikke af fra det hele,12.12.2022 06:15,,https://jyllands-posten.dk/jperhverv/ECE14649534/aerlig-talt-taenkte-jeg-at-det-ville-vaere-et-nemt-spring-at-blive-topchef/,,,"FÃ¥ de seneste nyheder fra ind- og udland om samfund, erhverv, sport og kultur. ",Jyllandsposten,https://jyllands-posten.dk/seneste/,12.12.2022 07:20
Guvernør: Mange dræbt i angreb mod Wagner-gruppens hovedkvarter,12.12.2022 05:56,,https://jyllands-posten.dk/international/ECE14682577/guvernoer-mange-draebt-i-angreb-mod-wagnergruppens-hovedkvarter/,,,"FÃ¥ de seneste nyheder fra ind- og udland om samfund, erhverv, sport og kultur. ",Jyllandsposten,https://jyllands-posten.dk/seneste/,12.12.2022 07:20
53-årig mand er død i soloulykke i Nykøbing Sjælland,12.12.2022 05:39,,https://jyllands-posten.dk/indland/ECE14682634/53aarig-mand-er-doed-i-soloulykke-i-nykoebing-sjaelland/,,,"FÃ¥ de seneste nyheder fra ind- og udland om samfund, erhverv, sport og kultur. ",Jyllandsposten,https://jyllands-posten.dk/seneste/,12.12.2022 07:20
Biden lover Zelenskyj at styrke Ukraines luftforsvar,12.12.2022 05:34,,https://jyllands-posten.dk/international/ECE14682623/biden-lover-zelenskyj-at-styrke-ukraines-luftforsvar/,,,"FÃ¥ de seneste nyheder fra ind- og udland om samfund, erhverv, sport og kultur. ",Jyllandsposten,https://jyllands-posten.dk/seneste/,12.12.2022 07:20
"Efter 50 års status quo, bliver Danmarks forhold til abort bragt i spil: »Rådets medlemmer har fundet, at tiden er inde nu«",12.12.2022 05:30,,https://jyllands-posten.dk/politik/ECE14675855/alle-muligheder-er-i-spil-naar-det-etiske-raad-aabner-foelsom-debat-er-abortgraensen-paa-12-uger-den-rigtige/,,,"FÃ¥ de seneste nyheder fra ind- og udland om samfund, erhverv, sport og kultur. ",Jyllandsposten,https://jyllands-posten.dk/seneste/,12.12.2022 07:20
Quiz og vind: Hvad hedder Ukraines præsident?,12.12.2022 00:01,,https://jyllands-posten.dk/indland/ECE14681418/hvad-hedder-ukraines-praesident/,,,"FÃ¥ de seneste nyheder fra ind- og udland om samfund, erhverv, sport og kultur. ",Jyllandsposten,https://jyllands-posten.dk/seneste/,12.12.2022 07:20
Magnussen og farmand blev nummer syv i 12-timers-løb,11.12.2022 00:00,,https://jyllands-posten.dk/sport/ECE14682548/magnussen-og-farmand-blev-nummer-syv-i-12timersloeb/,,,"FÃ¥ de seneste nyheder fra ind- og udland om samfund, erhverv, sport og kultur. ",Jyllandsposten,https://jyllands-posten.dk/seneste/,12.12.2022 07:20
Mand har skudt og dræbt tre kvinder på beboermøde i Rom,11.12.2022 00:00,,https://jyllands-posten.dk/international/europa/ECE14682518/mand-har-skudt-og-draebt-tre-kvinder-paa-beboermoede-i-rom/,,,"FÃ¥ de seneste nyheder fra ind- og udland om samfund, erhverv, sport og kultur. ",Jyllandsposten,https://jyllands-posten.dk/seneste/,12.12.2022 07:20
Pape kalder U-vending i Minksagen for Mette Frederiksens første sejr,11.12.2022 00:00,,https://jyllands-posten.dk/politik/ECE14682510/pape-kalder-uvending-i-minksagen-for-mette-frederiksens-foerste-sejr/,,,"FÃ¥ de seneste nyheder fra ind- og udland om samfund, erhverv, sport og kultur. ",Jyllandsposten,https://jyllands-posten.dk/seneste/,12.12.2022 07:20
51-årig mand har mistet livet efter kæntring i Lillebælt,11.12.2022 00:00,,https://jyllands-posten.dk/indland/ECE14682492/51aarig-mand-har-mistet-livet-efter-kaentring-i-lillebaelt/,,,"FÃ¥ de seneste nyheder fra ind- og udland om samfund, erhverv, sport og kultur. ",Jyllandsposten,https://jyllands-posten.dk/seneste/,12.12.2022 07:20
Dansk målmand tager til Tyskland i jagt på spilletid,11.12.2022 00:00,,https://jyllands-posten.dk/sport/fodbold/ECE14682486/dansk-maalmand-tager-til-tyskland-i-jagt-paa-spilletid/,,,"FÃ¥ de seneste nyheder fra ind- og udland om samfund, erhverv, sport og kultur. ",Jyllandsposten,https://jyllands-posten.dk/seneste/,12.12.2022 07:20
"Lav selv et smukt juletræ, der ikke fylder hele stuen",11.12.2022 00:00,,https://jyllands-posten.dk/bolig/ECE14653176/lav-selv-et-smukt-juletrae-der-ikke-fylder-hele-stuen/,,,"FÃ¥ de seneste nyheder fra ind- og udland om samfund, erhverv, sport og kultur. ",Jyllandsposten,https://jyllands-posten.dk/seneste/,12.12.2022 07:20
DMI: Flere sneområder er på vej og »giver nogle ret tætte snebyger«,11.12.2022 00:00,,https://jyllands-posten.dk/indland/ECE14682060/ugen-starter-roligt-ud-men-langsomt-indtager-kulden-og-sneen-klaeder-landet-i-hvidt/,,,"FÃ¥ de seneste nyheder fra ind- og udland om samfund, erhverv, sport og kultur. ",Jyllandsposten,https://jyllands-posten.dk/seneste/,12.12.2022 07:20
Rumkapsel er tilbage på Jorden efter tur rundt om Månen,11.12.2022 00:00,,https://jyllands-posten.dk/international/ECE14682460/rumkapsel-er-tilbage-paa-jorden-efter-tur-rundt-om-maanen/,,,"FÃ¥ de seneste nyheder fra ind- og udland om samfund, erhverv, sport og kultur. ",Jyllandsposten,https://jyllands-posten.dk/seneste/,12.12.2022 07:20
Mette Frederiksen om bred regering: Jeg er optimistisk,11.12.2022 00:00,,https://jyllands-posten.dk/politik/ECE14682455/mette-frederiksen-om-bred-regering-jeg-er-optimistisk/,,,"FÃ¥ de seneste nyheder fra ind- og udland om samfund, erhverv, sport og kultur. ",Jyllandsposten,https://jyllands-posten.dk/seneste/,12.12.2022 07:20
"Milliarder på vej til Forsvaret: De første kan bogstaveligt talt ende i kloakken, og ekspert tror ikke på grundlæggende ændring",11.12.2022 00:00,,https://jyllands-posten.dk/politik/ECE14653740/kanonerne-koeres-i-stilling-men-forsvaret-kaemper-med-at-finde-folk-som-kan-betjene-dem/,,,"FÃ¥ de seneste nyheder fra ind- og udland om samfund, erhverv, sport og kultur. ",Jyllandsposten,https://jyllands-posten.dk/seneste/,12.12.2022 07:20
"Rengøring uden skadelig kemi: Skur komfuret med sukkerknalder, og kom stivnet stearin til livs med en fodhøvl",11.12.2022 00:00,,https://jyllands-posten.dk/bolig/ECE14631142/skur-komfuret-med-sukkerknalder-og-kom-stivnet-stearin-til-livs-med-en-fodhoevl/,,,"FÃ¥ de seneste nyheder fra ind- og udland om samfund, erhverv, sport og kultur. ",Jyllandsposten,https://jyllands-posten.dk/seneste/,12.12.2022 07:20
Borgerlige partier langer ud efter Venstre og Moderaterne: »tillidsbrud« og »en demokratisk fadæse«,11.12.2022 00:00,,https://jyllands-posten.dk/politik/ECE14682281/borgerlige-partier-langer-ud-efter-venstre-og-moderaterne-tillidsbrud-og-en-demokratisk-fadaese/,,,"FÃ¥ de seneste nyheder fra ind- og udland om samfund, erhverv, sport og kultur. ",Jyllandsposten,https://jyllands-posten.dk/seneste/,12.12.2022 07:20
Tårnhøj inflation kaster tyrkerne ud i fattigdom og kan koste Erdogan magten,11.12.2022 00:00,,https://jyllands-posten.dk/international/ECE14655367/taarnhoej-inflation-kaster-tyrkerne-ud-i-fattigdom-og-kan-koste-erdogan-magten/,,,"FÃ¥ de seneste nyheder fra ind- og udland om samfund, erhverv, sport og kultur. ",Jyllandsposten,https://jyllands-posten.dk/seneste/,12.12.2022 07:20
Betalt omtale: TV 2-chef tager konsekvensen,11.12.2022 00:00,,https://jyllands-posten.dk/indland/ECE14680991/tv-2-stopper-med-betalt-omtale-i-vejrudsigter/,,,"FÃ¥ de seneste nyheder fra ind- og udland om samfund, erhverv, sport og kultur. ",Jyllandsposten,https://jyllands-posten.dk/seneste/,12.12.2022 07:20
»En ganske kølig politisk betaling«: JPs analytiker ser en aftale være »meget tæt på« efter løftebrud,11.12.2022 00:00,,https://jyllands-posten.dk/politik/ECE14682257/jps-politiske-analytiker-mette-frederiksen-bliver-fredet-fordi-venstre-og-moderaterne-gerne-vil-i-regering/,,,"FÃ¥ de seneste nyheder fra ind- og udland om samfund, erhverv, sport og kultur. ",Jyllandsposten,https://jyllands-posten.dk/seneste/,12.12.2022 07:20
Jernbaneforbund ser stigning i antal af nærved-påkørsler af tog,11.12.2022 00:00,,https://jyllands-posten.dk/indland/ECE14682364/jernbaneforbund-ser-stigning-i-antal-af-naervedpaakoersler-af-tog/,,,"FÃ¥ de seneste nyheder fra ind- og udland om samfund, erhverv, sport og kultur. ",Jyllandsposten,https://jyllands-posten.dk/seneste/,12.12.2022 07:20
Støjberg: Venstres U-vending om mink er et stort tillidsbrud,11.12.2022 00:00,,https://jyllands-posten.dk/politik/ECE14682354/stoejberg-venstres-uvending-om-mink-er-et-stort-tillidsbrud/,,,"FÃ¥ de seneste nyheder fra ind- og udland om samfund, erhverv, sport og kultur. ",Jyllandsposten,https://jyllands-posten.dk/seneste/,12.12.2022 07:20
Ronaldo sætter ord på exit: Min VM-drøm sluttede i går,11.12.2022 00:00,,https://jyllands-posten.dk/sport/fodbold/ECE14682329/ronaldo-saetter-ord-paa-exit-min-vmdroem-sluttede-i-gaar/,,,"FÃ¥ de seneste nyheder fra ind- og udland om samfund, erhverv, sport og kultur. ",Jyllandsposten,https://jyllands-posten.dk/seneste/,12.12.2022 07:20
Ellemann dropper krav om advokatvurdering i Minksagen,11.12.2022 00:00,,https://jyllands-posten.dk/politik/ECE14682318/ellemann-dropper-krav-om-advokatvurdering-i-minksagen/,,,"FÃ¥ de seneste nyheder fra ind- og udland om samfund, erhverv, sport og kultur. ",Jyllandsposten,https://jyllands-posten.dk/seneste/,12.12.2022 07:20
61-årig mand er dræbt af skud i Grønland,11.12.2022 00:00,,https://jyllands-posten.dk/indland/ECE14682316/61aarig-mand-er-draebt-af-skud-i-groenland/,,,"FÃ¥ de seneste nyheder fra ind- og udland om samfund, erhverv, sport og kultur. ",Jyllandsposten,https://jyllands-posten.dk/seneste/,12.12.2022 07:20
Coronaen satte usynlige spor i vores hoveder: »Disse fordomme har vist sig at være udbredte og dybe«,11.12.2022 00:00,,https://jyllands-posten.dk/indland/ECE14678584/professor-corona-har-skabt-en-ny-type-fordomme/,,,"FÃ¥ de seneste nyheder fra ind- og udland om samfund, erhverv, sport og kultur. ",Jyllandsposten,https://jyllands-posten.dk/seneste/,12.12.2022 07:20
Minkavlere vil kigge fremad og have afklaring på erstatning,11.12.2022 00:00,,https://jyllands-posten.dk/politik/ECE14682291/minkavlere-vil-kigge-fremad-og-have-afklaring-paa-erstatning/,,,"FÃ¥ de seneste nyheder fra ind- og udland om samfund, erhverv, sport og kultur. ",Jyllandsposten,https://jyllands-posten.dk/seneste/,12.12.2022 07:20
Julen varer længe...: 5 gode råd til at barbere elregningen i den dyre juletid,11.12.2022 00:00,,https://jyllands-posten.dk/indland/ECE14681513/hver-tredje-dansker-vil-gentaenke-julen-i-aar/,,,"FÃ¥ de seneste nyheder fra ind- og udland om samfund, erhverv, sport og kultur. ",Jyllandsposten,https://jyllands-posten.dk/seneste/,12.12.2022 07:20
Mand mistænkt for Lockerbie-bombe er blevet fængslet i USA,11.12.2022 00:00,,https://jyllands-posten.dk/international/usa/ECE14682253/mand-mistaenkt-for-lockerbiebombe-er-blevet-faengslet-i-usa/,,,"FÃ¥ de seneste nyheder fra ind- og udland om samfund, erhverv, sport og kultur. ",Jyllandsposten,https://jyllands-posten.dk/seneste/,12.12.2022 07:20
Antallet af højreekstreme er steget markant i Tyskland,11.12.2022 00:00,,https://jyllands-posten.dk/international/europa/ECE14682234/antallet-af-hoejreekstreme-er-steget-markant-i-tyskland/,,,"FÃ¥ de seneste nyheder fra ind- og udland om samfund, erhverv, sport og kultur. ",Jyllandsposten,https://jyllands-posten.dk/seneste/,12.12.2022 07:20
Mathias Gidsel gør comeback og forlænger med Berlin-klub,11.12.2022 00:00,,https://jyllands-posten.dk/sport/handbold/ECE14682224/mathias-gidsel-goer-comeback-og-forlaenger-med-berlinklub/,,,"FÃ¥ de seneste nyheder fra ind- og udland om samfund, erhverv, sport og kultur. ",Jyllandsposten,https://jyllands-posten.dk/seneste/,12.12.2022 07:20
To kvinder er fængslet for at smugle kokain,11.12.2022 00:00,,https://jyllands-posten.dk/indland/ECE14682202/to-kvinder-er-faengslet-for-at-smugle-kokain/,,,"FÃ¥ de seneste nyheder fra ind- og udland om samfund, erhverv, sport og kultur. ",Jyllandsposten,https://jyllands-posten.dk/seneste/,12.12.2022 07:20
"Løkke: Vi kan ikke føde regering, der undersøger statsministeren",11.12.2022 00:00,,https://jyllands-posten.dk/politik/ECE14682195/loekke-vi-kan-ikke-foede-regering-der-undersoeger-statsministeren/,,,"FÃ¥ de seneste nyheder fra ind- og udland om samfund, erhverv, sport og kultur. ",Jyllandsposten,https://jyllands-posten.dk/seneste/,12.12.2022 07:20
Knust Kane tager ansvaret for engelsk VM-exit,11.12.2022 00:00,,https://jyllands-posten.dk/sport/fodbold/ECE14682162/knust-kane-tager-ansvaret-for-engelsk-vmexit/,,,"FÃ¥ de seneste nyheder fra ind- og udland om samfund, erhverv, sport og kultur. ",Jyllandsposten,https://jyllands-posten.dk/seneste/,12.12.2022 07:20
Britiske læger lovpriser ny vellykket kræftbehandling,11.12.2022 00:00,,https://jyllands-posten.dk/international/ECE14682158/britiske-laeger-lovpriser-ny-vellykket-kraeftbehandling/,,,"FÃ¥ de seneste nyheder fra ind- og udland om samfund, erhverv, sport og kultur. ",Jyllandsposten,https://jyllands-posten.dk/seneste/,12.12.2022 07:20
"En konkret ting i aftaleteksten var blandt årsagerne til, at SF forlod forhandlingerne",11.12.2022 00:00,,https://jyllands-posten.dk/politik/ECE14682081/topskattelettelser-var-en-af-aarsagerne-til-sfexit-fra-forhandlinger/,,,"FÃ¥ de seneste nyheder fra ind- og udland om samfund, erhverv, sport og kultur. ",Jyllandsposten,https://jyllands-posten.dk/seneste/,12.12.2022 07:20
Som at give Ku Klux Klan nøglerne til USA-s justitsministerium: Konturerne af ny israelsk regering udløser alarm,11.12.2022 00:00,,https://jyllands-posten.dk/international/ECE14657655/netanyahu-vil-give-den-ekstreme-hoejrefloej-kontrol-over-palaestinenserne/,,,"FÃ¥ de seneste nyheder fra ind- og udland om samfund, erhverv, sport og kultur. ",Jyllandsposten,https://jyllands-posten.dk/seneste/,12.12.2022 07:20
"Er den for kedelig? Spørgmålet melder sig efter mødet med ny SUV, der er uden store højdepunkter",11.12.2022 00:00,,https://jyllands-posten.dk/biler/ECE14673725/corolla-overgiver-sig-og-omfavner-trenden/,,,"FÃ¥ de seneste nyheder fra ind- og udland om samfund, erhverv, sport og kultur. ",Jyllandsposten,https://jyllands-posten.dk/seneste/,12.12.2022 07:20
Arne Hyldgaard kæmper for sin cubanske kone: »Det danske system pisser hende op og ned ad ryggen«,11.12.2022 00:00,,https://jyllands-posten.dk/indland/ECE14621406/arne-hyldgaard-kaemper-det-danske-system-pisser-hende-op-og-ned-ad-ryggen/,,,"FÃ¥ de seneste nyheder fra ind- og udland om samfund, erhverv, sport og kultur. ",Jyllandsposten,https://jyllands-posten.dk/seneste/,12.12.2022 07:20
Viktor Axelsen gør det igen: Sejren sætter punktum for et perfekt år,11.12.2022 00:00,,https://jyllands-posten.dk/sport/ECE14655157/viktor-axelsen-vandt-saesonfinalen-og-satte-punktum-for-perfekt-aar/,,,"FÃ¥ de seneste nyheder fra ind- og udland om samfund, erhverv, sport og kultur. ",Jyllandsposten,https://jyllands-posten.dk/seneste/,12.12.2022 07:20
Her er tre opskrifter på anderledes julebag,11.12.2022 00:00,,https://jyllands-posten.dk/livsstil/madvin/ECE14634986/julebag-er-mere-end-vaniljekranse-og-brunkager-hvis-du-spoerger-micki-cheng/,,,"FÃ¥ de seneste nyheder fra ind- og udland om samfund, erhverv, sport og kultur. ",Jyllandsposten,https://jyllands-posten.dk/seneste/,12.12.2022 07:20
Topskattelettelser var en af årsagerne til SF-exit fra forhandlinger,11.12.2022 00:00,,https://jyllands-posten.dk/import/importjp/ritzau/ECE14682072/topskattelettelser-var-en-af-aarsagerne-til-sfexit-fra-forhandlinger/,,,"FÃ¥ de seneste nyheder fra ind- og udland om samfund, erhverv, sport og kultur. ",Jyllandsposten,https://jyllands-posten.dk/seneste/,12.12.2022 07:20
"Sne og frostgrader venter: Det sætter grundejere på en opgave og kan blive dyrt, hvis den ikke løses",11.12.2022 00:00,,https://jyllands-posten.dk/indland/ECE14681983/sne-og-frostgrader-venter-det-saetter-grundejere-paa-en-opgave-og-bliver-dyrt-hvis-den-ikke-loeses/,,,"FÃ¥ de seneste nyheder fra ind- og udland om samfund, erhverv, sport og kultur. ",Jyllandsposten,https://jyllands-posten.dk/seneste/,12.12.2022 07:20
Kom indenfor i kunstsamlerens afdæmpede julehjem: »Jeg slipper aldrig kunsten helt«,11.12.2022 00:00,,https://jyllands-posten.dk/bolig/ECE14649043/kom-indenfor-i-kunstsamlerens-afdaempede-julehjem-jeg-slipper-aldrig-kunsten-helt/,,,"FÃ¥ de seneste nyheder fra ind- og udland om samfund, erhverv, sport og kultur. ",Jyllandsposten,https://jyllands-posten.dk/seneste/,12.12.2022 07:20
Borgere i hele landet kan sende livevideo til alarmcentralen,11.12.2022 00:00,,https://jyllands-posten.dk/indland/ECE14682030/borgere-i-hele-landet-kan-sende-livevideo-til-alarmcentralen/,,,"FÃ¥ de seneste nyheder fra ind- og udland om samfund, erhverv, sport og kultur. ",Jyllandsposten,https://jyllands-posten.dk/seneste/,12.12.2022 07:20
Præsidenten havde flere millioner gemt i sin sofa. Skandalen kunne ikke ramme på et værre tidspunkt,11.12.2022 00:00,,https://jyllands-posten.dk/international/ECE14665137/cyril-ramaphosa-havde-flere-millioner-gemt-i-sin-sofa-skandalen-kunne-ikke-ramme-paa-et-vaerre-tidspunkt/,,,"FÃ¥ de seneste nyheder fra ind- og udland om samfund, erhverv, sport og kultur. ",Jyllandsposten,https://jyllands-posten.dk/seneste/,12.12.2022 07:20
Han implementerer dansk arbejdskultur i Tyskland,11.12.2022 00:00,,https://jyllands-posten.dk/jperhverv/ECE14660193/han-implementerer-dansk-arbejdskultur-i-tyskland/,,,"FÃ¥ de seneste nyheder fra ind- og udland om samfund, erhverv, sport og kultur. ",Jyllandsposten,https://jyllands-posten.dk/seneste/,12.12.2022 07:20
Twitter vil gøre betalingsservice dyrere for Apple-brugere,11.12.2022 00:00,,https://jyllands-posten.dk/international/ECE14681931/twitter-vil-goere-betalingsservice-dyrere-for-applebrugere/,,,"FÃ¥ de seneste nyheder fra ind- og udland om samfund, erhverv, sport og kultur. ",Jyllandsposten,https://jyllands-posten.dk/seneste/,12.12.2022 07:20
Ãndring fra mandag: Gaskunders regning kommer til at se anderledes ud,11.12.2022 00:00,,https://jyllands-posten.dk/indland/ECE14681971/gaskunder-kan-fremover-slippe-for-misvisende-regninger/,,,"FÃ¥ de seneste nyheder fra ind- og udland om samfund, erhverv, sport og kultur. ",Jyllandsposten,https://jyllands-posten.dk/seneste/,12.12.2022 07:20
Det ydmyge geni: Niels Bohr praktiserede åbenhed - Churchill så højforræderi,11.12.2022 00:00,,https://jyllands-posten.dk/kultur/litteratur/ECE14632568/alle-kan-vaere-med-i-historien-om-niels-bohrs-vej-til-erkendelsens-yderste-graense/,,,"FÃ¥ de seneste nyheder fra ind- og udland om samfund, erhverv, sport og kultur. ",Jyllandsposten,https://jyllands-posten.dk/seneste/,12.12.2022 07:20
"Dansk fan nåede fire VM-kampe på to dage: Debatten om ""plasticfans"" er lidt mærkelig",11.12.2022 00:00,,https://jyllands-posten.dk/sport/fodbold/ECE14678131/dansk-fan-naaede-fire-vmkampe-paa-to-dage-debatten-om-plasticfans-er-lidt-maerkelig/,,,"FÃ¥ de seneste nyheder fra ind- og udland om samfund, erhverv, sport og kultur. ",Jyllandsposten,https://jyllands-posten.dk/seneste/,12.12.2022 07:20
Mand forlod ambulance og blev påkørt og dræbt på motorvejen,11.12.2022 00:00,,https://jyllands-posten.dk/indland/ECE14681937/mand-forlod-ambulance-og-blev-paakoert-paa-motorvejen/,,,"FÃ¥ de seneste nyheder fra ind- og udland om samfund, erhverv, sport og kultur. ",Jyllandsposten,https://jyllands-posten.dk/seneste/,12.12.2022 07:20
Prismodtager: Den russiske regering kom med en bøn til os,11.12.2022 00:00,,https://jyllands-posten.dk/international/ECE14681941/nobelprismodtager-russisk-regering-har-bedt-os-takke-nej-til-pris/,,,"FÃ¥ de seneste nyheder fra ind- og udland om samfund, erhverv, sport og kultur. ",Jyllandsposten,https://jyllands-posten.dk/seneste/,12.12.2022 07:20
