title,published,text,link,og:site_name,og:url,site_description,name,url,scrape_time
Isaksen strålede igen: »Han er klar til landsholdet«,20.02.2023 00:00,,https://jyllands-posten.dk/sport/fodbold/ECE15106321/isaksen-straalede-for-fcm-han-er-klar-til-landsholdet/,Jyllands-Posten,https://jyllands-posten.dk/seneste/,"Få de seneste nyheder fra ind- og udland om samfund, erhverv, sport og kultur. ",Jyllandsposten,https://jyllands-posten.dk/seneste/,21.02.2023 07:17
Kong Harald sendte takkebrev for vase til Putin efter invasionen,20.02.2023 00:00,,https://jyllands-posten.dk/international/europa/ECE15106328/kong-harald-sendte-takkebrev-for-vase-til-putin-efter-invasionen/,Jyllands-Posten,https://jyllands-posten.dk/seneste/,"Få de seneste nyheder fra ind- og udland om samfund, erhverv, sport og kultur. ",Jyllandsposten,https://jyllands-posten.dk/seneste/,21.02.2023 07:17
Hver fjerde ukrainer ønsker at blive i Danmark efter krigen,20.02.2023 00:00,,https://jyllands-posten.dk/indland/ECE15106323/hver-fjerde-ukrainer-oensker-at-blive-i-danmark-efter-krigen/,Jyllands-Posten,https://jyllands-posten.dk/seneste/,"Få de seneste nyheder fra ind- og udland om samfund, erhverv, sport og kultur. ",Jyllandsposten,https://jyllands-posten.dk/seneste/,21.02.2023 07:17
Tyrkiets regering vil bygge 200.000 boliger efter jordskælv,20.02.2023 00:00,,https://jyllands-posten.dk/international/ECE15106144/tyrkiets-regering-vil-bygge-200000-boliger-efter-jordskaelv/,Jyllands-Posten,https://jyllands-posten.dk/seneste/,"Få de seneste nyheder fra ind- og udland om samfund, erhverv, sport og kultur. ",Jyllandsposten,https://jyllands-posten.dk/seneste/,21.02.2023 07:17
Børn med muskelsvindsygdom kan blive symptomfri med nyt tiltag,20.02.2023 00:00,,https://jyllands-posten.dk/indland/ECE15106241/boern-med-muskelsvindsygdom-kan-blive-symptomfri-med-nyt-tiltag/,Jyllands-Posten,https://jyllands-posten.dk/seneste/,"Få de seneste nyheder fra ind- og udland om samfund, erhverv, sport og kultur. ",Jyllandsposten,https://jyllands-posten.dk/seneste/,21.02.2023 07:17
Lars Løkke: Der er ikke rigtigt meget godt at sige om Iran,20.02.2023 00:00,,https://jyllands-posten.dk/international/ECE15106281/loekke-om-nye-sanktioner-hele-iranpolitikken-boer-gentaenkes/,Jyllands-Posten,https://jyllands-posten.dk/seneste/,"Få de seneste nyheder fra ind- og udland om samfund, erhverv, sport og kultur. ",Jyllandsposten,https://jyllands-posten.dk/seneste/,21.02.2023 07:17
51 soldater meldes dræbt af jihadister i angreb i Burkina Faso,20.02.2023 00:00,,https://jyllands-posten.dk/international/Afrika/ECE15106267/51-soldater-meldes-draebt-af-jihadister-i-angreb-i-burkina-faso/,Jyllands-Posten,https://jyllands-posten.dk/seneste/,"Få de seneste nyheder fra ind- og udland om samfund, erhverv, sport og kultur. ",Jyllandsposten,https://jyllands-posten.dk/seneste/,21.02.2023 07:17
Denne mandag aften lignede Claus Steinleins tanke ren logik,20.02.2023 00:00,,https://jyllands-posten.dk/sport/fodbold/ECE15074694/isaksen-tryllede-fcm-tilbage-paa-ret-kurs/,Jyllands-Posten,https://jyllands-posten.dk/seneste/,"Få de seneste nyheder fra ind- og udland om samfund, erhverv, sport og kultur. ",Jyllandsposten,https://jyllands-posten.dk/seneste/,21.02.2023 07:17
Over 30 lande i fælles opråb til IOC: Udeluk russere fra OL,20.02.2023 00:00,,https://jyllands-posten.dk/sport/ECE15106190/over-30-lande-i-faelles-opraab-til-ioc-udeluk-russere-fra-ol/,Jyllands-Posten,https://jyllands-posten.dk/seneste/,"Få de seneste nyheder fra ind- og udland om samfund, erhverv, sport og kultur. ",Jyllandsposten,https://jyllands-posten.dk/seneste/,21.02.2023 07:17
Danmark sender 42 mobile boliger til jordskælvsramte Tyrkiet,20.02.2023 00:00,,https://jyllands-posten.dk/indland/ECE15106207/danmark-sender-42-mobile-boliger-til-jordskaelvsramte-tyrkiet/,Jyllands-Posten,https://jyllands-posten.dk/seneste/,"Få de seneste nyheder fra ind- og udland om samfund, erhverv, sport og kultur. ",Jyllandsposten,https://jyllands-posten.dk/seneste/,21.02.2023 07:17
Ung mand alvorligt såret efter knivstikkeri i København,20.02.2023 00:00,,https://jyllands-posten.dk/indland/ECE15106235/ung-mand-alvorligt-saaret-efter-knivstikkeri-i-koebenhavn/,Jyllands-Posten,https://jyllands-posten.dk/seneste/,"Få de seneste nyheder fra ind- og udland om samfund, erhverv, sport og kultur. ",Jyllandsposten,https://jyllands-posten.dk/seneste/,21.02.2023 07:17
Usikre tider på boligmarkedet kan få ejendomsmæglere og boligejere til at tage nye midler i brug,20.02.2023 00:00,,https://jyllands-posten.dk/bolig/ECE14989680/usikre-tider-paa-boligmarkedet-kan-faa-ejendomsmaeglere-og-boligejere-til-at-tage-nye-midler-i-brug/,Jyllands-Posten,https://jyllands-posten.dk/seneste/,"Få de seneste nyheder fra ind- og udland om samfund, erhverv, sport og kultur. ",Jyllandsposten,https://jyllands-posten.dk/seneste/,21.02.2023 07:17
Superliga-spiller melder sig syg efter »ubehagelige kommentarer«,20.02.2023 00:00,,https://jyllands-posten.dk/sport/fodbold/ECE15106196/obs-yankuba-minteh-er-sygemeldt-efter-ubehagelige-oplevelser/,Jyllands-Posten,https://jyllands-posten.dk/seneste/,"Få de seneste nyheder fra ind- og udland om samfund, erhverv, sport og kultur. ",Jyllandsposten,https://jyllands-posten.dk/seneste/,21.02.2023 07:17
Munter aften i byen med Randers Teaters ”Soulmates”,20.02.2023 00:00,,https://jyllands-posten.dk/kultur/teater/ECE15067612/anmeldelse-soulmates-er-musikteater-der-bringer-smilet-frem/,Jyllands-Posten,https://jyllands-posten.dk/seneste/,"Få de seneste nyheder fra ind- og udland om samfund, erhverv, sport og kultur. ",Jyllandsposten,https://jyllands-posten.dk/seneste/,21.02.2023 07:17
Tre dræbt: Nyt skælv har rystet region mellem Syrien og Tyrkiet,20.02.2023 00:00,,https://jyllands-posten.dk/international/ECE15106166/nyt-jordskaelv-mellem-syrien-og-tyrkiet-har-draebttre/,Jyllands-Posten,https://jyllands-posten.dk/seneste/,"Få de seneste nyheder fra ind- og udland om samfund, erhverv, sport og kultur. ",Jyllandsposten,https://jyllands-posten.dk/seneste/,21.02.2023 07:17
Topchef forsvarer sin hyre på 30 millioner kroner,20.02.2023 00:00,,https://jyllands-posten.dk/jperhverv/ECE15033895/topchef-forsvarer-hyre-paa-30-mio-min-loen-vil-ogsaa-bevaege-sig-ned-i-nedgangsaar/,Jyllands-Posten,https://jyllands-posten.dk/seneste/,"Få de seneste nyheder fra ind- og udland om samfund, erhverv, sport og kultur. ",Jyllandsposten,https://jyllands-posten.dk/seneste/,21.02.2023 07:17
Tilsynet skulle holde øje med forsyningsselskaber: Overpriser for 62 mio. kr. på energi er landet ved forbrugerne,20.02.2023 00:00,,https://jyllands-posten.dk/indland/ECE15105029/statsrevisorerne-kritiserer-tilsyn-med-forsyningsselskaber/,Jyllands-Posten,https://jyllands-posten.dk/seneste/,"Få de seneste nyheder fra ind- og udland om samfund, erhverv, sport og kultur. ",Jyllandsposten,https://jyllands-posten.dk/seneste/,21.02.2023 07:17
Nu frygter mange Putins modtræk. Det kan måske komme allerede tirsdag,20.02.2023 00:00,,https://jyllands-posten.dk/international/ECE15104800/bidens-historiske-rejse-presser-putin-men-han-vidste-besked/,Jyllands-Posten,https://jyllands-posten.dk/seneste/,"Få de seneste nyheder fra ind- og udland om samfund, erhverv, sport og kultur. ",Jyllandsposten,https://jyllands-posten.dk/seneste/,21.02.2023 07:17
Aftale om overenskomst: »Arbejdsgiverne har læst skriften på væggen«,20.02.2023 00:00,,https://jyllands-posten.dk/jperhverv/ECE15104569/lettelse-og-glaede-ovenpaa-aftale-om-overenskomst/,Jyllands-Posten,https://jyllands-posten.dk/seneste/,"Få de seneste nyheder fra ind- og udland om samfund, erhverv, sport og kultur. ",Jyllandsposten,https://jyllands-posten.dk/seneste/,21.02.2023 07:17
Seniorforsker: Biden sender stærke signaler til Putin,20.02.2023 00:00,,https://jyllands-posten.dk/international/ECE15105911/bidens-besoeg-i-kyiv-sender-staerkt-signal-om-stoette-siger-forsker/,Jyllands-Posten,https://jyllands-posten.dk/seneste/,"Få de seneste nyheder fra ind- og udland om samfund, erhverv, sport og kultur. ",Jyllandsposten,https://jyllands-posten.dk/seneste/,21.02.2023 07:17
10 år i magtens centrum: Smeden fra Kerteminde er en af landets mest magtfulde,20.02.2023 00:00,,https://jyllands-posten.dk/jperhverv/ECE15103906/metalbossen-er-en-fagbevaegelsen-classic/,Jyllands-Posten,https://jyllands-posten.dk/seneste/,"Få de seneste nyheder fra ind- og udland om samfund, erhverv, sport og kultur. ",Jyllandsposten,https://jyllands-posten.dk/seneste/,21.02.2023 07:17
Fejl hos teleselskaber gjorde det svært at ringe til politiet,20.02.2023 00:00,,https://jyllands-posten.dk/indland/ECE15106071/fejl-hos-teleselskaber-gjorde-det-svaert-at-ringe-til-politiet/,Jyllands-Posten,https://jyllands-posten.dk/seneste/,"Få de seneste nyheder fra ind- og udland om samfund, erhverv, sport og kultur. ",Jyllandsposten,https://jyllands-posten.dk/seneste/,21.02.2023 07:17
Underfundigt selvstudium: En charmerende pamflet om forfatterens evige dilemma,20.02.2023 00:00,,https://jyllands-posten.dk/kultur/litteratur/ECE15081716/kunsten-at-leve-af-virkeligheden-uden-at-lade-sig-spise-op-af-den/,Jyllands-Posten,https://jyllands-posten.dk/seneste/,"Få de seneste nyheder fra ind- og udland om samfund, erhverv, sport og kultur. ",Jyllandsposten,https://jyllands-posten.dk/seneste/,21.02.2023 07:17
På tærsklen til en krise stopper Israel for nye bosættelser,20.02.2023 00:00,,https://jyllands-posten.dk/international/mideast/ECE15106032/israel-stopper-for-nye-bosaettelser-i-periode-efter-krise/,Jyllands-Posten,https://jyllands-posten.dk/seneste/,"Få de seneste nyheder fra ind- og udland om samfund, erhverv, sport og kultur. ",Jyllandsposten,https://jyllands-posten.dk/seneste/,21.02.2023 07:17
Gældsstyrelsen har inddrevet rekordhøjt milliardbeløb med ny metode,20.02.2023 00:00,,https://jyllands-posten.dk/indland/ECE15104971/gaeldsstyrelsen-inddriver-rekordhoejt-milliardbeloeb-med-ny-metode/,Jyllands-Posten,https://jyllands-posten.dk/seneste/,"Få de seneste nyheder fra ind- og udland om samfund, erhverv, sport og kultur. ",Jyllandsposten,https://jyllands-posten.dk/seneste/,21.02.2023 07:17
Med et pennestrøg sejlede Ruslands største rederi uden om sanktioner. Og der er intet sket ved det,20.02.2023 00:00,,https://jyllands-posten.dk/international/europa/ECE15103453/tredjelande-kan-undergrave-europas-sanktioner-imod-rusland-uden-konsekvenser/,Jyllands-Posten,https://jyllands-posten.dk/seneste/,"Få de seneste nyheder fra ind- og udland om samfund, erhverv, sport og kultur. ",Jyllandsposten,https://jyllands-posten.dk/seneste/,21.02.2023 07:17
Sveriges militære sikkerhedstjeneste advarer mod Rusland og Kina,20.02.2023 00:00,,https://jyllands-posten.dk/international/europa/ECE15105900/sveriges-militaere-sikkerhedstjeneste-advarer-mod-rusland/,Jyllands-Posten,https://jyllands-posten.dk/seneste/,"Få de seneste nyheder fra ind- og udland om samfund, erhverv, sport og kultur. ",Jyllandsposten,https://jyllands-posten.dk/seneste/,21.02.2023 07:17
Hundredvis af kinesiske kameraer kan udgøre sikkerhedsrisiko,20.02.2023 00:00,,https://jyllands-posten.dk/international/ECE15011371/hundredvis-af-kinesiske-kameraer-kan-udgoere-sikkerhedsrisiko/,Jyllands-Posten,https://jyllands-posten.dk/seneste/,"Få de seneste nyheder fra ind- og udland om samfund, erhverv, sport og kultur. ",Jyllandsposten,https://jyllands-posten.dk/seneste/,21.02.2023 07:17
"Folketingsmedlem dropper sagsanlæg mod teatret, der fyrede ham",20.02.2023 00:00,,https://jyllands-posten.dk/kultur/ECE15105709/jon-stephensen-dropper-sagsanlaeg-mod-avenyt/,Jyllands-Posten,https://jyllands-posten.dk/seneste/,"Få de seneste nyheder fra ind- og udland om samfund, erhverv, sport og kultur. ",Jyllandsposten,https://jyllands-posten.dk/seneste/,21.02.2023 07:17
Yderligere to tilfælde med multiresistente bakterier fra Dicillin,20.02.2023 00:00,,https://jyllands-posten.dk/indland/ECE15105761/yderligere-to-tilfaelde-med-multiresistente-bakterier-fra-dicillin/,Jyllands-Posten,https://jyllands-posten.dk/seneste/,"Få de seneste nyheder fra ind- og udland om samfund, erhverv, sport og kultur. ",Jyllandsposten,https://jyllands-posten.dk/seneste/,21.02.2023 07:17
Rusland blev varslet om Bidens besøg i Kyiv,20.02.2023 00:00,,https://jyllands-posten.dk/international/ECE15105584/rusland-blev-varslet-om-bidens-besoeg-i-kyiv/,Jyllands-Posten,https://jyllands-posten.dk/seneste/,"Få de seneste nyheder fra ind- og udland om samfund, erhverv, sport og kultur. ",Jyllandsposten,https://jyllands-posten.dk/seneste/,21.02.2023 07:17
Sveriges konge har det godt efter operation,20.02.2023 00:00,,https://jyllands-posten.dk/international/europa/ECE15105339/sveriges-konge-carl-gustaf-har-det-godt-efter-operation-i-hjertet/,Jyllands-Posten,https://jyllands-posten.dk/seneste/,"Få de seneste nyheder fra ind- og udland om samfund, erhverv, sport og kultur. ",Jyllandsposten,https://jyllands-posten.dk/seneste/,21.02.2023 07:17
"Et døgn i russisk tv: Her fikser Putin detaljerne, mens Vestens aggression lurer i alle hjørner",20.02.2023 00:00,,https://jyllands-posten.dk/international/ECE15053241/et-doegn-i-russisk-tv-hvor-krigen-er-saa-godt-som-vundet/,Jyllands-Posten,https://jyllands-posten.dk/seneste/,"Få de seneste nyheder fra ind- og udland om samfund, erhverv, sport og kultur. ",Jyllandsposten,https://jyllands-posten.dk/seneste/,21.02.2023 07:17
Manden kendt som klædeskabsmorderen får nej til prøveudskrivelse,20.02.2023 00:00,,https://jyllands-posten.dk/indland/ECE15105272/manden-kendt-som-klaedeskabsmorderen-faar-nej-til-proeveudskrivelse/,Jyllands-Posten,https://jyllands-posten.dk/seneste/,"Få de seneste nyheder fra ind- og udland om samfund, erhverv, sport og kultur. ",Jyllandsposten,https://jyllands-posten.dk/seneste/,21.02.2023 07:17
Zelenskyj: Kinesisk alliance med Rusland vil udløse verdenskrig,20.02.2023 00:00,,https://jyllands-posten.dk/international/ECE15104892/zelenskyj-kinesisk-alliance-med-rusland-vil-udloese-verdenskrig/,Jyllands-Posten,https://jyllands-posten.dk/seneste/,"Få de seneste nyheder fra ind- og udland om samfund, erhverv, sport og kultur. ",Jyllandsposten,https://jyllands-posten.dk/seneste/,21.02.2023 07:17
Nikolaj Jacobsen giver yngre kræfter chancen i testkampe,20.02.2023 00:00,,https://jyllands-posten.dk/sport/handbold/ECE15104773/nikolaj-jacobsen-giver-yngre-kraefter-chancen-i-testkampe/,Jyllands-Posten,https://jyllands-posten.dk/seneste/,"Få de seneste nyheder fra ind- og udland om samfund, erhverv, sport og kultur. ",Jyllandsposten,https://jyllands-posten.dk/seneste/,21.02.2023 07:17
Kontroversiel næstformand trak sig efter 13 dage: Nu reagerer partiet,20.02.2023 00:00,,https://jyllands-posten.dk/indland/ECE15104657/nye-borgerlige-tager-afstand-fra-afgaaet-naestformand/,Jyllands-Posten,https://jyllands-posten.dk/seneste/,"Få de seneste nyheder fra ind- og udland om samfund, erhverv, sport og kultur. ",Jyllandsposten,https://jyllands-posten.dk/seneste/,21.02.2023 07:17
Syv millioner børns mentale sundhed er truet efter jordskælv,20.02.2023 00:00,,https://jyllands-posten.dk/international/ECE15104559/syv-millioner-boerns-mentale-sundhed-er-truet-efter-jordskaelv/,Jyllands-Posten,https://jyllands-posten.dk/seneste/,"Få de seneste nyheder fra ind- og udland om samfund, erhverv, sport og kultur. ",Jyllandsposten,https://jyllands-posten.dk/seneste/,21.02.2023 07:17
Nye supersygehuse bliver seks år forsinket og meget dyrere end ventet,20.02.2023 00:00,,https://jyllands-posten.dk/indland/ECE15104197/overblik-nye-supersygehuse-bliver-seks-aar-forsinket-og-meget-dyrere-end-ventet/,Jyllands-Posten,https://jyllands-posten.dk/seneste/,"Få de seneste nyheder fra ind- og udland om samfund, erhverv, sport og kultur. ",Jyllandsposten,https://jyllands-posten.dk/seneste/,21.02.2023 07:17
Grøn løsning brager frem: Elkunder jagter billig strøm,20.02.2023 00:00,,https://jyllands-posten.dk/jperhverv/ECE15103642/daekker-485000-husstandes-elforbrug-solceller-gaar-som-varmt-broed/,Jyllands-Posten,https://jyllands-posten.dk/seneste/,"Få de seneste nyheder fra ind- og udland om samfund, erhverv, sport og kultur. ",Jyllandsposten,https://jyllands-posten.dk/seneste/,21.02.2023 07:17
Han lever fortsat med reggaen,20.02.2023 00:00,,https://jyllands-posten.dk/kultur/ECE15019409/han-lever-fortsat-med-reggaen/,Jyllands-Posten,https://jyllands-posten.dk/seneste/,"Få de seneste nyheder fra ind- og udland om samfund, erhverv, sport og kultur. ",Jyllandsposten,https://jyllands-posten.dk/seneste/,21.02.2023 07:17
DBU fratager agent licens efter dom for skattesvindel,20.02.2023 00:00,,https://jyllands-posten.dk/sport/fodbold/ECE15104000/dbu-fratager-agent-licens-efter-dom-for-skattesvindel/,Jyllands-Posten,https://jyllands-posten.dk/seneste/,"Få de seneste nyheder fra ind- og udland om samfund, erhverv, sport og kultur. ",Jyllandsposten,https://jyllands-posten.dk/seneste/,21.02.2023 07:17
Tirsdag kan blive en skæbnedag i krigen: Ukraine og Vesten venter Putins tale med nervøsitet,20.02.2023 00:00,,https://jyllands-posten.dk/international/europa/ECE14428885/her-er-seneste-nyt-om-krigen-i-ukraine/,Jyllands-Posten,https://jyllands-posten.dk/seneste/,"Få de seneste nyheder fra ind- og udland om samfund, erhverv, sport og kultur. ",Jyllandsposten,https://jyllands-posten.dk/seneste/,21.02.2023 07:17
Efter en række kontroversielle opslag om coronavirus: Nye Borgerliges næstformand trækker sig,20.02.2023 00:00,,https://jyllands-posten.dk/politik/ECE15104367/nye-borgerliges-naestformand-stopper-efter-knap-to-uger/,Jyllands-Posten,https://jyllands-posten.dk/seneste/,"Få de seneste nyheder fra ind- og udland om samfund, erhverv, sport og kultur. ",Jyllandsposten,https://jyllands-posten.dk/seneste/,21.02.2023 07:17
"Putin vil så gerne sammenlignes med store og grusomme forgængere - eksperten ser dog en ironisk parallel til zaren, der endte i fiasko",20.02.2023 00:00,,https://jyllands-posten.dk/international/ECE14862018/god-zar-eller-brutal-tyran/,Jyllands-Posten,https://jyllands-posten.dk/seneste/,"Få de seneste nyheder fra ind- og udland om samfund, erhverv, sport og kultur. ",Jyllandsposten,https://jyllands-posten.dk/seneste/,21.02.2023 07:17
Kina: USA skal ikke blande sig i vores forhold til Rusland,20.02.2023 00:00,,https://jyllands-posten.dk/international/ECE15103841/kina-usa-skal-ikke-blande-sig-i-vores-forhold-til-rusland/,Jyllands-Posten,https://jyllands-posten.dk/seneste/,"Få de seneste nyheder fra ind- og udland om samfund, erhverv, sport og kultur. ",Jyllandsposten,https://jyllands-posten.dk/seneste/,21.02.2023 07:17
Sådan narrede Biden alle og sneg sig ind i Kyiv i al hemmelighed,20.02.2023 00:00,,https://jyllands-posten.dk/international/ECE15104052/saadan-narrede-biden-alle-og-sneg-sig-ind-i-kyiv-i-al-hemmelighed/,Jyllands-Posten,https://jyllands-posten.dk/seneste/,"Få de seneste nyheder fra ind- og udland om samfund, erhverv, sport og kultur. ",Jyllandsposten,https://jyllands-posten.dk/seneste/,21.02.2023 07:17
Feriemesse fejrer 25-års jubilæum med safaritema,20.02.2023 00:00,,https://jyllands-posten.dk/rejser/ECE15013049/feriemesse-fejrer-25aars-jubilaeum-med-safaritema/,Jyllands-Posten,https://jyllands-posten.dk/seneste/,"Få de seneste nyheder fra ind- og udland om samfund, erhverv, sport og kultur. ",Jyllandsposten,https://jyllands-posten.dk/seneste/,21.02.2023 07:17
Erdoğan er måske ved at bløde op: »Det er et kærkomment og godt budskab fra Tyrkiet«,20.02.2023 00:00,,https://jyllands-posten.dk/international/europa/ECE15103650/tyrkiet-er-klar-til-at-holde-flere-moeder-med-sverige-og-finland/,Jyllands-Posten,https://jyllands-posten.dk/seneste/,"Få de seneste nyheder fra ind- og udland om samfund, erhverv, sport og kultur. ",Jyllandsposten,https://jyllands-posten.dk/seneste/,21.02.2023 07:17
Silas Holst gjorde hele Danmark vild med dans,20.02.2023 00:00,,https://jyllands-posten.dk/kultur/ECE15019296/silasholst-gjorde-hele-danmark-vild-med-dans/,Jyllands-Posten,https://jyllands-posten.dk/seneste/,"Få de seneste nyheder fra ind- og udland om samfund, erhverv, sport og kultur. ",Jyllandsposten,https://jyllands-posten.dk/seneste/,21.02.2023 07:17
Ukraine-krigen koster Europa direkte adgang til rummet,20.02.2023 00:00,,https://jyllands-posten.dk/international/ECE15011733/europa-har-skrottet-rumsamarbejde-med-kina/,Jyllands-Posten,https://jyllands-posten.dk/seneste/,"Få de seneste nyheder fra ind- og udland om samfund, erhverv, sport og kultur. ",Jyllandsposten,https://jyllands-posten.dk/seneste/,21.02.2023 07:17
Jeppe Rasmussen har rejst 100 mio. kr. på ryggen af egen sygdom,20.02.2023 00:00,,https://jyllands-posten.dk/jperhverv/ECE15042605/jeppe-rasmussen-startede-pharmavirksomhed-med-baggrund-i-egen-sygdom/,Jyllands-Posten,https://jyllands-posten.dk/seneste/,"Få de seneste nyheder fra ind- og udland om samfund, erhverv, sport og kultur. ",Jyllandsposten,https://jyllands-posten.dk/seneste/,21.02.2023 07:17
Flere udlændinge holdes som gidsler i Papua Ny Guinea,20.02.2023 00:00,,https://jyllands-posten.dk/international/ECE15103523/flere-udlaendinge-holdes-som-gidsler-i-papua-ny-guinea/,Jyllands-Posten,https://jyllands-posten.dk/seneste/,"Få de seneste nyheder fra ind- og udland om samfund, erhverv, sport og kultur. ",Jyllandsposten,https://jyllands-posten.dk/seneste/,21.02.2023 07:17
En plantebaseret p-pille til rotter skal gøre gift overflødigt,20.02.2023 00:00,,https://jyllands-posten.dk/indland/ECE15103553/en-plantebaseret-ppille-til-rotter-skal-goere-gift-overfloedigt/,Jyllands-Posten,https://jyllands-posten.dk/seneste/,"Få de seneste nyheder fra ind- og udland om samfund, erhverv, sport og kultur. ",Jyllandsposten,https://jyllands-posten.dk/seneste/,21.02.2023 07:17
"Konsekvenser af krigen: Døde sportsfolk, udelukkelser og milliardæren, der mistede sin klub",20.02.2023 00:00,,https://jyllands-posten.dk/sport/ECE15026299/doede-sportsfolk-udelukkelser-og-milliardaeren-der-mistede-sin-klub/,Jyllands-Posten,https://jyllands-posten.dk/seneste/,"Få de seneste nyheder fra ind- og udland om samfund, erhverv, sport og kultur. ",Jyllandsposten,https://jyllands-posten.dk/seneste/,21.02.2023 07:17
Antropolog: Tag en tur i børnehaven og lær om samarbejdets natur,20.02.2023 00:00,,https://jyllands-posten.dk/nyviden/ECE15011640/antropolog-saadan-virker-samarbejde/,Jyllands-Posten,https://jyllands-posten.dk/seneste/,"Få de seneste nyheder fra ind- og udland om samfund, erhverv, sport og kultur. ",Jyllandsposten,https://jyllands-posten.dk/seneste/,21.02.2023 07:17
Forskere hædres for ny viden om Parkinsons og bæredygtige batterier,20.02.2023 00:00,,https://jyllands-posten.dk/indland/ECE15102913/forskere-haedres-for-ny-viden-om-parkinsons-og-baeredygtige-batterier/,Jyllands-Posten,https://jyllands-posten.dk/seneste/,"Få de seneste nyheder fra ind- og udland om samfund, erhverv, sport og kultur. ",Jyllandsposten,https://jyllands-posten.dk/seneste/,21.02.2023 07:17
Klimaafgift kan gøre hele landbrugssektoren teknisk insolvent,20.02.2023 00:00,,https://jyllands-posten.dk/jperhverv/ECE15075816/klimaafgift-kan-goere-hele-landbrugssektoren-teknisk-insolvent/,Jyllands-Posten,https://jyllands-posten.dk/seneste/,"Få de seneste nyheder fra ind- og udland om samfund, erhverv, sport og kultur. ",Jyllandsposten,https://jyllands-posten.dk/seneste/,21.02.2023 07:17
Minister vil i år bane vej for en femdobling af dansk havvind,20.02.2023 00:00,,https://jyllands-posten.dk/indland/ECE15102901/minister-vil-i-aar-bane-vej-for-en-femdobling-af-dansk-havvind/,Jyllands-Posten,https://jyllands-posten.dk/seneste/,"Få de seneste nyheder fra ind- og udland om samfund, erhverv, sport og kultur. ",Jyllandsposten,https://jyllands-posten.dk/seneste/,21.02.2023 07:17
Slaget om de slidte danskeres pension er i fuld gang,20.02.2023 00:00,,https://jyllands-posten.dk/indland/ECE15102900/slaget-om-de-slidte-danskeres-pension-er-i-fuld-gang/,Jyllands-Posten,https://jyllands-posten.dk/seneste/,"Få de seneste nyheder fra ind- og udland om samfund, erhverv, sport og kultur. ",Jyllandsposten,https://jyllands-posten.dk/seneste/,21.02.2023 07:17
Zelenskyj: Macron spilder sin tid på dialog med Rusland,20.02.2023 00:00,,https://jyllands-posten.dk/international/ECE15102893/zelenskyj-macron-spilder-sin-tid-paa-dialog-med-rusland/,Jyllands-Posten,https://jyllands-posten.dk/seneste/,"Få de seneste nyheder fra ind- og udland om samfund, erhverv, sport og kultur. ",Jyllandsposten,https://jyllands-posten.dk/seneste/,21.02.2023 07:17
"Krigsforsker advarer forældre: »Hvis jeg var dig, ville jeg slette Tiktok på dit barns mobil«",20.02.2023 00:00,,https://jyllands-posten.dk/kultur/ECE15044038/forsker-i-hybrid-krigsfoerelse-advarer-foraeldre-var-jeg-dig-ville-jeg-slette-tiktok-paa-dit-barns-mobil/,Jyllands-Posten,https://jyllands-posten.dk/seneste/,"Få de seneste nyheder fra ind- og udland om samfund, erhverv, sport og kultur. ",Jyllandsposten,https://jyllands-posten.dk/seneste/,21.02.2023 07:17
Hele nabolag står under vand efter dødeligt regnvejr i Brasilien,20.02.2023 00:00,,https://jyllands-posten.dk/international/ECE15102899/hele-nabolag-staar-under-vand-efter-doedeligt-regnvejr-i-brasilien/,Jyllands-Posten,https://jyllands-posten.dk/seneste/,"Få de seneste nyheder fra ind- og udland om samfund, erhverv, sport og kultur. ",Jyllandsposten,https://jyllands-posten.dk/seneste/,21.02.2023 07:17
Nordkorea foretager sin tredje større missiltest i år,20.02.2023 00:00,,https://jyllands-posten.dk/international/ECE15102268/nordkorea-foretager-sin-tredje-stoerre-missiltest-i-aar/,Jyllands-Posten,https://jyllands-posten.dk/seneste/,"Få de seneste nyheder fra ind- og udland om samfund, erhverv, sport og kultur. ",Jyllandsposten,https://jyllands-posten.dk/seneste/,21.02.2023 07:17
