title,published,text,link,og:site_name,og:url,site_description,name,url,scrape_time
Mand kendt som klædeskabsmorderen får nej til prøveudskrivelse,18.02.2023 00:00,,https://politiken.dk/indland/art9221055/Mand-kendt-som-kl%C3%A6deskabsmorderen-f%C3%A5r-nej-til-pr%C3%B8veudskrivelse,Politiken,https://politiken.dk/nyheder/,"Hold dig opdateret pÃ¥ de seneste nyheder pÃ¥ politiken.dk: Seneste Politiken, Seneste Danmark, Seneste Kultur og Seneste Internationalt. ",Politiken,https://politiken.dk/nyheder/,21.02.2023 07:17
Kø ved Lillebæltsbroen efter uheld og brand i lastbil,19.02.2023 00:00,,https://politiken.dk/indland/art9220962/K%C3%B8-ved-Lilleb%C3%A6ltsbroen-efter-uheld-og-brand-i-lastbil,Politiken,https://politiken.dk/nyheder/,"Hold dig opdateret pÃ¥ de seneste nyheder pÃ¥ politiken.dk: Seneste Politiken, Seneste Danmark, Seneste Kultur og Seneste Internationalt. ",Politiken,https://politiken.dk/nyheder/,21.02.2023 07:17
FællesÂ­tillidsmand kalder overenskomstÂ­aftale »imponerende«,19.02.2023 00:00,,https://politiken.dk/indland/art9220478/F%C3%A6lles%C2%ADtillidsmand-kalder-overenskomst%C2%ADaftale-%C2%BBimponerende%C2%AB,Politiken,https://politiken.dk/nyheder/,"Hold dig opdateret pÃ¥ de seneste nyheder pÃ¥ politiken.dk: Seneste Politiken, Seneste Danmark, Seneste Kultur og Seneste Internationalt. ",Politiken,https://politiken.dk/nyheder/,21.02.2023 07:17
Nyvalgt næstformand trækker sig hos Nye Borgerlige,20.02.2023 00:00,,https://politiken.dk/indland/politik/art9220783/Nyvalgt-n%C3%A6stformand-tr%C3%A6kker-sig-hos-Nye-Borgerlige,Politiken,https://politiken.dk/nyheder/,"Hold dig opdateret pÃ¥ de seneste nyheder pÃ¥ politiken.dk: Seneste Politiken, Seneste Danmark, Seneste Kultur og Seneste Internationalt. ",Politiken,https://politiken.dk/nyheder/,21.02.2023 07:17
Plantebaseret p-pille til rotter skal gøre gift overflødigt,22.02.2023 00:00,,https://politiken.dk/indland/art9220523/Plantebaseret-p-pille-til-rotter-skal-g%C3%B8re-gift-overfl%C3%B8digt,Politiken,https://politiken.dk/nyheder/,"Hold dig opdateret pÃ¥ de seneste nyheder pÃ¥ politiken.dk: Seneste Politiken, Seneste Danmark, Seneste Kultur og Seneste Internationalt. ",Politiken,https://politiken.dk/nyheder/,21.02.2023 07:17
Pessimismen aftager fortsat hos forbrugerne,23.02.2023 00:00,,https://politiken.dk/indland/art9220423/Pessimismen-aftager-fortsat-hos-forbrugerne,Politiken,https://politiken.dk/nyheder/,"Hold dig opdateret pÃ¥ de seneste nyheder pÃ¥ politiken.dk: Seneste Politiken, Seneste Danmark, Seneste Kultur og Seneste Internationalt. ",Politiken,https://politiken.dk/nyheder/,21.02.2023 07:17
Ugens vejr bliver en blandet fornøjelse med blæst og nattefrost,22.02.2023 00:00,,https://politiken.dk/indland/art9220373/Ugens-vejr-bliver-en-blandet-forn%C3%B8jelse-med-bl%C3%A6st-og-nattefrost,Politiken,https://politiken.dk/nyheder/,"Hold dig opdateret pÃ¥ de seneste nyheder pÃ¥ politiken.dk: Seneste Politiken, Seneste Danmark, Seneste Kultur og Seneste Internationalt. ",Politiken,https://politiken.dk/nyheder/,21.02.2023 07:17
Nu er hver ottende fuldtidsansat i Danmark udlænding,22.02.2023 00:00,,https://politiken.dk/indland/art9220363/Nu-er-hver-ottende-fuldtidsansat-i-Danmark-udl%C3%A6nding,Politiken,https://politiken.dk/nyheder/,"Hold dig opdateret pÃ¥ de seneste nyheder pÃ¥ politiken.dk: Seneste Politiken, Seneste Danmark, Seneste Kultur og Seneste Internationalt. ",Politiken,https://politiken.dk/nyheder/,21.02.2023 07:17
Mænd er flygtet fra forulykket bil efter politijagt ved Solrød,22.02.2023 00:00,,https://politiken.dk/indland/art9220364/M%C3%A6nd-er-flygtet-fra-forulykket-bil-efter-politijagt-ved-Solr%C3%B8d,Politiken,https://politiken.dk/nyheder/,"Hold dig opdateret pÃ¥ de seneste nyheder pÃ¥ politiken.dk: Seneste Politiken, Seneste Danmark, Seneste Kultur og Seneste Internationalt. ",Politiken,https://politiken.dk/nyheder/,21.02.2023 07:17
Rigsrevision slår alarm over forsinket supersygehus,22.02.2023 00:00,,https://politiken.dk/indland/art9220337/Rigsrevision-sl%C3%A5r-alarm-over-forsinket-supersygehus,Politiken,https://politiken.dk/nyheder/,"Hold dig opdateret pÃ¥ de seneste nyheder pÃ¥ politiken.dk: Seneste Politiken, Seneste Danmark, Seneste Kultur og Seneste Internationalt. ",Politiken,https://politiken.dk/nyheder/,21.02.2023 07:17
"Prispatruljen har ligget i dvale siden valget, og ingen kan svare på, om den lever",22.02.2023 00:00,,https://politiken.dk/indland/art9216008/Prispatruljen-har-ligget-i-dvale-siden-valget-og-ingen-kan-svare-p%C3%A5-om-den-lever,Politiken,https://politiken.dk/nyheder/,"Hold dig opdateret pÃ¥ de seneste nyheder pÃ¥ politiken.dk: Seneste Politiken, Seneste Danmark, Seneste Kultur og Seneste Internationalt. ",Politiken,https://politiken.dk/nyheder/,21.02.2023 07:17
Eksperter: Lønaftale kan ende som en afstemning om store bededag,22.02.2023 00:00,,https://politiken.dk/indland/art9220158/Eksperter-L%C3%B8naftale-kan-ende-som-en-afstemning-om-store-bededag,Politiken,https://politiken.dk/nyheder/,"Hold dig opdateret pÃ¥ de seneste nyheder pÃ¥ politiken.dk: Seneste Politiken, Seneste Danmark, Seneste Kultur og Seneste Internationalt. ",Politiken,https://politiken.dk/nyheder/,21.02.2023 07:17
Cheføkonom: Ny overenskomstaftale kan presse nogle virksomheder,22.02.2023 00:00,,https://politiken.dk/indland/art9220302/Chef%C3%B8konom-Ny-overenskomstaftale-kan-presse-nogle-virksomheder,Politiken,https://politiken.dk/nyheder/,"Hold dig opdateret pÃ¥ de seneste nyheder pÃ¥ politiken.dk: Seneste Politiken, Seneste Danmark, Seneste Kultur og Seneste Internationalt. ",Politiken,https://politiken.dk/nyheder/,21.02.2023 07:17
"Eksperter efterlyser opmærksomhed på unge mænds relationer: »Det er en gruppe, som hober en række sårbarhedsfaktorer op«",22.02.2023 00:00,,https://politiken.dk/indland/art9220097/%C2%BBDet-er-en-gruppe-som-hober-en-r%C3%A6kke-s%C3%A5rbarhedsfaktorer-op%C2%AB,Politiken,https://politiken.dk/nyheder/,"Hold dig opdateret pÃ¥ de seneste nyheder pÃ¥ politiken.dk: Seneste Politiken, Seneste Danmark, Seneste Kultur og Seneste Internationalt. ",Politiken,https://politiken.dk/nyheder/,21.02.2023 07:17
Store bededag-kompensation er ikke en del af ny aftale,22.02.2023 00:00,,https://politiken.dk/indland/art9220254/Store-bededag-kompensation-er-ikke-en-del-af-ny-aftale,Politiken,https://politiken.dk/nyheder/,"Hold dig opdateret pÃ¥ de seneste nyheder pÃ¥ politiken.dk: Seneste Politiken, Seneste Danmark, Seneste Kultur og Seneste Internationalt. ",Politiken,https://politiken.dk/nyheder/,21.02.2023 07:17
Overblik: Her er hovedpunkterne i den nye overenskomstaftale,22.02.2023 00:00,,https://politiken.dk/indland/art9220241/Her-er-hovedpunkterne-i-den-nye-overenskomstaftale,Politiken,https://politiken.dk/nyheder/,"Hold dig opdateret pÃ¥ de seneste nyheder pÃ¥ politiken.dk: Seneste Politiken, Seneste Danmark, Seneste Kultur og Seneste Internationalt. ",Politiken,https://politiken.dk/nyheder/,21.02.2023 07:17
"Ekspert: »Bare det, at parterne har landet en aftale, er ret imponerende, fordi de har haft alle odds imod sig«",22.02.2023 00:00,,https://politiken.dk/indland/art9220230/Ekspert-%C2%BBBare-det-at-parterne-har-landet-en-aftale-er-ret-imponerende-fordi-de-har-haft-alle-odds-imod-sig%C2%AB,Politiken,https://politiken.dk/nyheder/,"Hold dig opdateret pÃ¥ de seneste nyheder pÃ¥ politiken.dk: Seneste Politiken, Seneste Danmark, Seneste Kultur og Seneste Internationalt. ",Politiken,https://politiken.dk/nyheder/,21.02.2023 07:17
Fængselsansat stukket i halsen med tilspidset tandbørste,22.02.2023 00:00,,https://politiken.dk/indland/art9220178/F%C3%A6ngselsansat-stukket-i-halsen-med-tilspidset-tandb%C3%B8rste,Politiken,https://politiken.dk/nyheder/,"Hold dig opdateret pÃ¥ de seneste nyheder pÃ¥ politiken.dk: Seneste Politiken, Seneste Danmark, Seneste Kultur og Seneste Internationalt. ",Politiken,https://politiken.dk/nyheder/,21.02.2023 07:17
Ny overenskomstaftale: Løn stiger mindst fire procent over to år for 230.000 ansatte,22.02.2023 00:00,,https://politiken.dk/indland/art9220185/Ny-overenskomstaftale-L%C3%B8n-stiger-mindst-fire-procent-over-to-%C3%A5r-for-230.000-ansatte,Politiken,https://politiken.dk/nyheder/,"Hold dig opdateret pÃ¥ de seneste nyheder pÃ¥ politiken.dk: Seneste Politiken, Seneste Danmark, Seneste Kultur og Seneste Internationalt. ",Politiken,https://politiken.dk/nyheder/,21.02.2023 07:17
Sådan forløb pressemødet,22.02.2023 00:00,,https://politiken.dk/indland/art9220161/S%C3%A5dan-forl%C3%B8b-pressem%C3%B8det,Politiken,https://politiken.dk/nyheder/,"Hold dig opdateret pÃ¥ de seneste nyheder pÃ¥ politiken.dk: Seneste Politiken, Seneste Danmark, Seneste Kultur og Seneste Internationalt. ",Politiken,https://politiken.dk/nyheder/,21.02.2023 07:17
Politi finder omkommet person under eftersøgning,22.02.2023 00:00,,https://politiken.dk/indland/art9220144/Politi-finder-omkommet-person-under-efters%C3%B8gning,Politiken,https://politiken.dk/nyheder/,"Hold dig opdateret pÃ¥ de seneste nyheder pÃ¥ politiken.dk: Seneste Politiken, Seneste Danmark, Seneste Kultur og Seneste Internationalt. ",Politiken,https://politiken.dk/nyheder/,21.02.2023 07:17
Industrien er enige om overenskomst,22.02.2023 00:00,,https://politiken.dk/indland/art9220140/Industrien-er-enige-om-overenskomst,Politiken,https://politiken.dk/nyheder/,"Hold dig opdateret pÃ¥ de seneste nyheder pÃ¥ politiken.dk: Seneste Politiken, Seneste Danmark, Seneste Kultur og Seneste Internationalt. ",Politiken,https://politiken.dk/nyheder/,21.02.2023 07:17
57-årig sigtes for at skyde 42-årig med haglgevær,22.02.2023 00:00,,https://politiken.dk/indland/art9220125/57-%C3%A5rig-sigtes-for-at-skyde-42-%C3%A5rig-med-haglgev%C3%A6r,Politiken,https://politiken.dk/nyheder/,"Hold dig opdateret pÃ¥ de seneste nyheder pÃ¥ politiken.dk: Seneste Politiken, Seneste Danmark, Seneste Kultur og Seneste Internationalt. ",Politiken,https://politiken.dk/nyheder/,21.02.2023 07:17
Før kørte retssager mod åbenmundede spioner for åbne døre - den tid er forbi,22.02.2023 00:00,,https://politiken.dk/indland/art9213496/F%C3%B8r-k%C3%B8rte-retssager-mod-%C3%A5benmundede-spioner-for-%C3%A5bne-d%C3%B8re-%E2%80%93-den-tid-er-forbi,Politiken,https://politiken.dk/nyheder/,"Hold dig opdateret pÃ¥ de seneste nyheder pÃ¥ politiken.dk: Seneste Politiken, Seneste Danmark, Seneste Kultur og Seneste Internationalt. ",Politiken,https://politiken.dk/nyheder/,21.02.2023 07:17
Fængselsansat stukket i halsen med tilspidset tandbørste,22.02.2023 00:00,,https://politiken.dk/indland/art9220093/F%C3%A6ngselsansat-stukket-i-halsen-med-tilspidset-tandb%C3%B8rste,Politiken,https://politiken.dk/nyheder/,"Hold dig opdateret pÃ¥ de seneste nyheder pÃ¥ politiken.dk: Seneste Politiken, Seneste Danmark, Seneste Kultur og Seneste Internationalt. ",Politiken,https://politiken.dk/nyheder/,21.02.2023 07:17
Mistrivsel hos børn og unge forplanter sig til forældre,19.02.2023 00:00,,https://politiken.dk/forbrugogliv/sundhedogmotion/art9205731/Mistrivsel-hos-b%C3%B8rn-og-unge-forplanter-sig-til-for%C3%A6ldre,Politiken,https://politiken.dk/nyheder/,"Hold dig opdateret pÃ¥ de seneste nyheder pÃ¥ politiken.dk: Seneste Politiken, Seneste Danmark, Seneste Kultur og Seneste Internationalt. ",Politiken,https://politiken.dk/nyheder/,21.02.2023 07:17
"»Det lyder af meget, meget små tal«: Efter fire år med lov om psykisk vold er 12 blevet straffet",19.02.2023 00:00,,https://politiken.dk/indland/art9220067/Efter-fire-%C3%A5r-med-lov-om-psykisk-vold-er-12-blevet-straffet,Politiken,https://politiken.dk/nyheder/,"Hold dig opdateret pÃ¥ de seneste nyheder pÃ¥ politiken.dk: Seneste Politiken, Seneste Danmark, Seneste Kultur og Seneste Internationalt. ",Politiken,https://politiken.dk/nyheder/,21.02.2023 07:17
Michael Ziegler har kræft. Tankerne svinger mellem håb og håbløshed,18.02.2023 00:00,,https://politiken.dk/indland/art9206175/Michael-Ziegler-har-kr%C3%A6ft.-Tankerne-svinger-mellem-h%C3%A5b-og-h%C3%A5bl%C3%B8shed,Politiken,https://politiken.dk/nyheder/,"Hold dig opdateret pÃ¥ de seneste nyheder pÃ¥ politiken.dk: Seneste Politiken, Seneste Danmark, Seneste Kultur og Seneste Internationalt. ",Politiken,https://politiken.dk/nyheder/,21.02.2023 07:17
Elselskaber bryder systematisk loven ifølge forbrugerÂ­ombudsmand: »Der bør kunne idømmes fængselsstraf«,18.02.2023 00:00,,https://politiken.dk/indland/art9218875/Elselskaber-bryder-systematisk-loven-if%C3%B8lge-forbruger%C2%ADombudsmand-%C2%BBDer-b%C3%B8r-kunne-id%C3%B8mmes-f%C3%A6ngselsstraf%C2%AB,Politiken,https://politiken.dk/nyheder/,"Hold dig opdateret pÃ¥ de seneste nyheder pÃ¥ politiken.dk: Seneste Politiken, Seneste Danmark, Seneste Kultur og Seneste Internationalt. ",Politiken,https://politiken.dk/nyheder/,21.02.2023 07:17
Stormen Otto påvirker weekendens flytrafik i Københavns Lufthavn,18.02.2023 00:00,,https://politiken.dk/indland/art9219771/Stormen-Otto-p%C3%A5virker-weekendens-flytrafik-i-K%C3%B8benhavns-Lufthavn,Politiken,https://politiken.dk/nyheder/,"Hold dig opdateret pÃ¥ de seneste nyheder pÃ¥ politiken.dk: Seneste Politiken, Seneste Danmark, Seneste Kultur og Seneste Internationalt. ",Politiken,https://politiken.dk/nyheder/,21.02.2023 07:17
Overblik over stormen Otto: Ãn by slog vindrekord,18.02.2023 00:00,,https://politiken.dk/indland/art9219737/%C3%89n-by-slog-vindrekord,Politiken,https://politiken.dk/nyheder/,"Hold dig opdateret pÃ¥ de seneste nyheder pÃ¥ politiken.dk: Seneste Politiken, Seneste Danmark, Seneste Kultur og Seneste Internationalt. ",Politiken,https://politiken.dk/nyheder/,21.02.2023 07:17
Der lå slaver under asfalten ved Hollænderdybet. Og et flere hundrede år gammelt Nem-ID under Rådhuspladsen,18.02.2023 00:00,,https://politiken.dk/kultur/art9207706/Der-l%C3%A5-slaver-under-asfalten-ved-Holl%C3%A6nderdybet.-Og-et-flere-hundrede-%C3%A5r-gammelt-Nem-ID-under-R%C3%A5dhuspladsen,Politiken,https://politiken.dk/nyheder/,"Hold dig opdateret pÃ¥ de seneste nyheder pÃ¥ politiken.dk: Seneste Politiken, Seneste Danmark, Seneste Kultur og Seneste Internationalt. ",Politiken,https://politiken.dk/nyheder/,21.02.2023 07:17
"Vi er vilde med discount, men rundt omkring popper specialbutikkerne op",18.02.2023 00:00,,https://politiken.dk/indland/art9204203/Vi-er-vilde-med-discount-men-rundt-omkring-popper-specialbutikkerne-op,Politiken,https://politiken.dk/nyheder/,"Hold dig opdateret pÃ¥ de seneste nyheder pÃ¥ politiken.dk: Seneste Politiken, Seneste Danmark, Seneste Kultur og Seneste Internationalt. ",Politiken,https://politiken.dk/nyheder/,21.02.2023 07:17
Minister fryder sig efter eksperters afvisning af asylmodel,18.02.2023 00:00,,https://politiken.dk/indland/art9219718/Minister-fryder-sig-efter-eksperters-afvisning-af-asylmodel,Politiken,https://politiken.dk/nyheder/,"Hold dig opdateret pÃ¥ de seneste nyheder pÃ¥ politiken.dk: Seneste Politiken, Seneste Danmark, Seneste Kultur og Seneste Internationalt. ",Politiken,https://politiken.dk/nyheder/,21.02.2023 07:17
De har skrevet de syv bedste bøger i 2022: Hvem skal have din stemme?,01.02.2023 00:00,,https://politiken.dk/kultur/boger/interview_boger/art9157889/Hvem-skal-have-din-stemme,Politiken,https://politiken.dk/nyheder/,"Hold dig opdateret pÃ¥ de seneste nyheder pÃ¥ politiken.dk: Seneste Politiken, Seneste Danmark, Seneste Kultur og Seneste Internationalt. ",Politiken,https://politiken.dk/nyheder/,21.02.2023 07:17
Anklagere går efter markant mildere dom i sag mod Alec Baldwin,08.02.2023 00:00,,https://politiken.dk/kultur/art9222413/Anklagere-g%C3%A5r-efter-markant-mildere-dom-i-sag-mod-Alec-Baldwin,Politiken,https://politiken.dk/nyheder/,"Hold dig opdateret pÃ¥ de seneste nyheder pÃ¥ politiken.dk: Seneste Politiken, Seneste Danmark, Seneste Kultur og Seneste Internationalt. ",Politiken,https://politiken.dk/nyheder/,21.02.2023 07:17
Bryan Cranstons ansigt er i sig selv anden sæson af serien Your Honor værd,09.02.2023 00:00,,https://politiken.dk/kultur/film_og_tv/art9148730/Bryan-Cranstons-ansigt-er-i-sig-selv-anden-s%C3%A6son-af-serien-Your-Honor-v%C3%A6rd,Politiken,https://politiken.dk/nyheder/,"Hold dig opdateret pÃ¥ de seneste nyheder pÃ¥ politiken.dk: Seneste Politiken, Seneste Danmark, Seneste Kultur og Seneste Internationalt. ",Politiken,https://politiken.dk/nyheder/,21.02.2023 07:17
"Av, av - Løkke får en omgang med grovfilen: Simon Ammitzbøll-Bille har skrevet den politiske tabers beretning",11.02.2023 00:00,,https://politiken.dk/kultur/boger/boganmeldelser/faglitteratur_boger/art9220271/Simon-Ammitzb%C3%B8ll-Bille-har-skrevet-den-politiske-tabers-beretning,Politiken,https://politiken.dk/nyheder/,"Hold dig opdateret pÃ¥ de seneste nyheder pÃ¥ politiken.dk: Seneste Politiken, Seneste Danmark, Seneste Kultur og Seneste Internationalt. ",Politiken,https://politiken.dk/nyheder/,21.02.2023 07:17
"Det er jo til tider noget forbandet vrøvl, han skriver",11.02.2023 00:00,,https://politiken.dk/kultur/boger/boganmeldelser/faglitteratur_boger/art9198822/Det-er-jo-til-tider-noget-forbandet-vr%C3%B8vl-han-skriver,Politiken,https://politiken.dk/nyheder/,"Hold dig opdateret pÃ¥ de seneste nyheder pÃ¥ politiken.dk: Seneste Politiken, Seneste Danmark, Seneste Kultur og Seneste Internationalt. ",Politiken,https://politiken.dk/nyheder/,21.02.2023 07:17
"Familiemedlemmerne har det med at forsvinde ud på toilettet. De har nemlig en del, de skal af med",12.02.2023 00:00,,https://politiken.dk/kultur/art9193307/Familiemedlemmerne-har-det-med-at-forsvinde-ud-p%C3%A5-toilettet.-De-har-nemlig-en-del-de-skal-af-med,Politiken,https://politiken.dk/nyheder/,"Hold dig opdateret pÃ¥ de seneste nyheder pÃ¥ politiken.dk: Seneste Politiken, Seneste Danmark, Seneste Kultur og Seneste Internationalt. ",Politiken,https://politiken.dk/nyheder/,21.02.2023 07:17
Nekrolog: Hele det klassiske musikliv kendte og elskede Tutter Givskov,15.02.2023 00:00,,https://politiken.dk/navne/art9220855/Hele-det-klassiske-musikliv-kendte-og-elskede-Tutter-Givskov,Politiken,https://politiken.dk/nyheder/,"Hold dig opdateret pÃ¥ de seneste nyheder pÃ¥ politiken.dk: Seneste Politiken, Seneste Danmark, Seneste Kultur og Seneste Internationalt. ",Politiken,https://politiken.dk/nyheder/,21.02.2023 07:17
"4 hjerter: Det er nærmest, så det fræser øregangen op",15.02.2023 00:00,,https://politiken.dk/kultur/art9193301/Det-er-n%C3%A6rmest-s%C3%A5-det-fr%C3%A6ser-%C3%B8regangen-op,Politiken,https://politiken.dk/nyheder/,"Hold dig opdateret pÃ¥ de seneste nyheder pÃ¥ politiken.dk: Seneste Politiken, Seneste Danmark, Seneste Kultur og Seneste Internationalt. ",Politiken,https://politiken.dk/nyheder/,21.02.2023 07:17
"»Jeg skal dø. Du skal dø. Vi skal allesammen dø. Mit navn er Marc Maron, og jeg er komiker«",16.02.2023 00:00,,https://politiken.dk/kultur/set_og_hoert/art9187886/%C2%BBJeg-skal-d%C3%B8.-Du-skal-d%C3%B8.-Vi-skal-allesammen-d%C3%B8.-Mit-navn-er-Marc-Maron-og-jeg-er-komiker%C2%AB,Politiken,https://politiken.dk/nyheder/,"Hold dig opdateret pÃ¥ de seneste nyheder pÃ¥ politiken.dk: Seneste Politiken, Seneste Danmark, Seneste Kultur og Seneste Internationalt. ",Politiken,https://politiken.dk/nyheder/,21.02.2023 07:17
Tidligere direktør dropper sag om lovbrud mod teater,16.02.2023 00:00,,https://politiken.dk/kultur/art9222133/Tidligere-direkt%C3%B8r-dropper-sag-om-lovbrud-mod-teater,Politiken,https://politiken.dk/nyheder/,"Hold dig opdateret pÃ¥ de seneste nyheder pÃ¥ politiken.dk: Seneste Politiken, Seneste Danmark, Seneste Kultur og Seneste Internationalt. ",Politiken,https://politiken.dk/nyheder/,21.02.2023 07:17
"Nogle er mere lige end andre, når de rammes af stress og sygdom",18.02.2023 00:00,,https://politiken.dk/kultur/set_og_hoert/art9187885/Nogle-er-mere-lige-end-andre-n%C3%A5r-de-rammes-af-stress-og-sygdom,Politiken,https://politiken.dk/nyheder/,"Hold dig opdateret pÃ¥ de seneste nyheder pÃ¥ politiken.dk: Seneste Politiken, Seneste Danmark, Seneste Kultur og Seneste Internationalt. ",Politiken,https://politiken.dk/nyheder/,21.02.2023 07:17
"Vil du sikre dig, at du ikke bliver hacket på Facebook? Så skal du betale",19.02.2023 00:00,,https://politiken.dk/kultur/art9220456/Vil-du-sikre-dig-at-du-ikke-bliver-hacket-p%C3%A5-Facebook-S%C3%A5-skal-du-betale,Politiken,https://politiken.dk/nyheder/,"Hold dig opdateret pÃ¥ de seneste nyheder pÃ¥ politiken.dk: Seneste Politiken, Seneste Danmark, Seneste Kultur og Seneste Internationalt. ",Politiken,https://politiken.dk/nyheder/,21.02.2023 07:17
"Hvem er du egentlig, når det gælder feedbacksignaler: Rolf Sørensen eller Jørgen Leth?",21.02.2023 00:00,,https://politiken.dk/kultur/art9128354/Hvem-er-du-egentlig-n%C3%A5r-det-g%C3%A6lder-feedbacksignaler-Rolf-S%C3%B8rensen-eller-J%C3%B8rgen-Leth,Politiken,https://politiken.dk/nyheder/,"Hold dig opdateret pÃ¥ de seneste nyheder pÃ¥ politiken.dk: Seneste Politiken, Seneste Danmark, Seneste Kultur og Seneste Internationalt. ",Politiken,https://politiken.dk/nyheder/,21.02.2023 07:17
Helt ny byform er skudt op på bar mark: »Jeg oplevede nærmest en festivalstemning«,23.02.2023 00:00,,https://politiken.dk/kultur/art9188882/%C2%BBJeg-oplevede-n%C3%A6rmest-en-festivalstemning%C2%AB,Politiken,https://politiken.dk/nyheder/,"Hold dig opdateret pÃ¥ de seneste nyheder pÃ¥ politiken.dk: Seneste Politiken, Seneste Danmark, Seneste Kultur og Seneste Internationalt. ",Politiken,https://politiken.dk/nyheder/,21.02.2023 07:17
Dansk oscarvinder misser britisk filmpris,23.02.2023 00:00,,https://politiken.dk/kultur/film_og_tv/art9220336/Dansk-oscarvinder-misser-britisk-filmpris,Politiken,https://politiken.dk/nyheder/,"Hold dig opdateret pÃ¥ de seneste nyheder pÃ¥ politiken.dk: Seneste Politiken, Seneste Danmark, Seneste Kultur og Seneste Internationalt. ",Politiken,https://politiken.dk/nyheder/,21.02.2023 07:17
"Kendt forfatter i oprør: »Roald Dahl var ikke nogen engel, men dette er absurd censur«",23.02.2023 00:00,,https://politiken.dk/kultur/art9220377/Kendt-forfatter-i-opr%C3%B8r-%C2%BBRoald-Dahl-var-ikke-nogen-engel-men-dette-er-absurd-censur%C2%AB,Politiken,https://politiken.dk/nyheder/,"Hold dig opdateret pÃ¥ de seneste nyheder pÃ¥ politiken.dk: Seneste Politiken, Seneste Danmark, Seneste Kultur og Seneste Internationalt. ",Politiken,https://politiken.dk/nyheder/,21.02.2023 07:17
"Sean Penn ryger og drikker sig gennem Ukraine, indtil han står bare 150 meter fra fronten",22.02.2023 00:00,,https://politiken.dk/kultur/art9218530/Sean-Penn-ryger-og-drikker-sig-gennem-Ukraine-indtil-han-st%C3%A5r-bare-150-meter-fra-fronten,Politiken,https://politiken.dk/nyheder/,"Hold dig opdateret pÃ¥ de seneste nyheder pÃ¥ politiken.dk: Seneste Politiken, Seneste Danmark, Seneste Kultur og Seneste Internationalt. ",Politiken,https://politiken.dk/nyheder/,21.02.2023 07:17
Nye oversættelser af da Vincis notesbøger afdækker opsigtsvækkende tanker om tyngdekraften,22.02.2023 00:00,,https://politiken.dk/kultur/art9218921/Nye-overs%C3%A6ttelser-af-da-Vincis-notesb%C3%B8ger-afd%C3%A6kker-opsigtsv%C3%A6kkende-tanker-om-tyngdekraften,Politiken,https://politiken.dk/nyheder/,"Hold dig opdateret pÃ¥ de seneste nyheder pÃ¥ politiken.dk: Seneste Politiken, Seneste Danmark, Seneste Kultur og Seneste Internationalt. ",Politiken,https://politiken.dk/nyheder/,21.02.2023 07:17
"Godnat til det stride lille bæst, der hjemsøger os i drømmene",22.02.2023 00:00,,https://politiken.dk/kultur/boger/art9214280/Godnat-til-det-stride-lille-b%C3%A6st-der-hjems%C3%B8ger-os-i-dr%C3%B8mmene,Politiken,https://politiken.dk/nyheder/,"Hold dig opdateret pÃ¥ de seneste nyheder pÃ¥ politiken.dk: Seneste Politiken, Seneste Danmark, Seneste Kultur og Seneste Internationalt. ",Politiken,https://politiken.dk/nyheder/,21.02.2023 07:17
"Mød Djævelen, hans heks af en eks og deres fanden af en datter. Det er virkelig morsomt",22.02.2023 00:00,,https://politiken.dk/kultur/set_og_hoert/art9187884/M%C3%B8d-Dj%C3%A6velen-hans-heks-af-en-eks-og-deres-fanden-af-en-datter.-Det-er-virkelig-morsomt,Politiken,https://politiken.dk/nyheder/,"Hold dig opdateret pÃ¥ de seneste nyheder pÃ¥ politiken.dk: Seneste Politiken, Seneste Danmark, Seneste Kultur og Seneste Internationalt. ",Politiken,https://politiken.dk/nyheder/,21.02.2023 07:17
De er et af dansk pops mest interessante eksperimenter,22.02.2023 00:00,,https://politiken.dk/kultur/musik/art9183125/De-er-et-af-dansk-pops-mest-interessante-eksperimenter,Politiken,https://politiken.dk/nyheder/,"Hold dig opdateret pÃ¥ de seneste nyheder pÃ¥ politiken.dk: Seneste Politiken, Seneste Danmark, Seneste Kultur og Seneste Internationalt. ",Politiken,https://politiken.dk/nyheder/,21.02.2023 07:17
Han var 49 år om at skrive sin forrygende roman. Og så begik han selvmord,22.02.2023 00:00,,https://politiken.dk/kultur/boger/boganmeldelser/skonlitteratur_boger/art9214029/Han-var-49-%C3%A5r-om-at-skrive-sin-forrygende-roman.-Og-s%C3%A5-begik-han-selvmord,Politiken,https://politiken.dk/nyheder/,"Hold dig opdateret pÃ¥ de seneste nyheder pÃ¥ politiken.dk: Seneste Politiken, Seneste Danmark, Seneste Kultur og Seneste Internationalt. ",Politiken,https://politiken.dk/nyheder/,21.02.2023 07:17
"Vi hører musik hele tiden. Men hvad nu, hvis vi har glemt, hvad musik faktisk kan?",22.02.2023 00:00,,https://politiken.dk/kultur/boger/art9215732/Vi-h%C3%B8rer-musik-hele-tiden.-Men-hvad-nu-hvis-vi-har-glemt-hvad-musik-faktisk-kan,Politiken,https://politiken.dk/nyheder/,"Hold dig opdateret pÃ¥ de seneste nyheder pÃ¥ politiken.dk: Seneste Politiken, Seneste Danmark, Seneste Kultur og Seneste Internationalt. ",Politiken,https://politiken.dk/nyheder/,21.02.2023 07:17
