title,published,text,link,og:site_name,og:url,site_description,name,url,scrape_time
Masseflugten af russere og russisk kapital har givet en lille gruppe lande økonomiske vinger,30.03.2023 00:00,,https://jyllands-posten.dk/international/ECE14945573/masseflugten-af-russere-har-givet-en-lille-gruppe-lande-oekonomiske-vinger/,Jyllands-Posten,https://jyllands-posten.dk/seneste/,"Få de seneste nyheder fra ind- og udland om samfund, erhverv, sport og kultur. ",Jyllandsposten,https://jyllands-posten.dk/seneste/,31.03.2023 07:16
"Læger advarede om lange ventetider, men blev ignoreret: Mail afslører central del af forløbet",30.03.2023 00:00,,https://jyllands-posten.dk/indland/ECE15490382/laeger-raabte-op-om-lang-ventetid-for-kraeftsyge-men-blev-ikke-hoert/,Jyllands-Posten,https://jyllands-posten.dk/seneste/,"Få de seneste nyheder fra ind- og udland om samfund, erhverv, sport og kultur. ",Jyllandsposten,https://jyllands-posten.dk/seneste/,31.03.2023 07:16
"Loyal dokumentarfilm: Det er barskt og vigtigt at høre helt unge mennesker fortælle om, hvorfor de ikke kan bo hjemme",30.03.2023 00:00,,https://jyllands-posten.dk/kultur/film/ECE15487687/fin-dokumentarfilm-om-et-sted-hvor-man-ikke-bare-skal-passe-sig-selv/,Jyllands-Posten,https://jyllands-posten.dk/seneste/,"Få de seneste nyheder fra ind- og udland om samfund, erhverv, sport og kultur. ",Jyllandsposten,https://jyllands-posten.dk/seneste/,31.03.2023 07:16
Insektmonstrene kommer: Med Michael Larsen på Ærø og Lone Theils i London og Liverpool,30.03.2023 00:00,,https://jyllands-posten.dk/kultur/litteratur/ECE15468894/med-michael-larsen-paa-aeroe-og-lone-theils-i-london-og-liverpool/,Jyllands-Posten,https://jyllands-posten.dk/seneste/,"Få de seneste nyheder fra ind- og udland om samfund, erhverv, sport og kultur. ",Jyllandsposten,https://jyllands-posten.dk/seneste/,31.03.2023 07:16
"Ekspert om »tophemmelig« spionsag: »Det vil være meget naivt af os at gå ud fra, at de russiske myndigheder har ret«",30.03.2023 00:00,,https://jyllands-posten.dk/international/ECE15495913/rusland-anholder-amerikansk-journalist-for-spionage-ifoelge-ekspert-er-det-naivt-at-stole-paa-rusland/,Jyllands-Posten,https://jyllands-posten.dk/seneste/,"Få de seneste nyheder fra ind- og udland om samfund, erhverv, sport og kultur. ",Jyllandsposten,https://jyllands-posten.dk/seneste/,31.03.2023 07:16
25-årig mand idømmes et års fængsel for grooming og sextortion,30.03.2023 00:00,,https://jyllands-posten.dk/indland/ECE15498499/25aarig-mand-idoemmes-et-aars-faengsel-for-grooming-og-sextortion/,Jyllands-Posten,https://jyllands-posten.dk/seneste/,"Få de seneste nyheder fra ind- og udland om samfund, erhverv, sport og kultur. ",Jyllandsposten,https://jyllands-posten.dk/seneste/,31.03.2023 07:16
Næsten 2000 køretøjer beslaglagt som følge af vanvidskørsel,30.03.2023 00:00,,https://jyllands-posten.dk/indland/ECE15498673/naesten-2000-koeretoejer-beslaglagt-som-foelge-af-vanvidskoersel/,Jyllands-Posten,https://jyllands-posten.dk/seneste/,"Få de seneste nyheder fra ind- og udland om samfund, erhverv, sport og kultur. ",Jyllandsposten,https://jyllands-posten.dk/seneste/,31.03.2023 07:16
Ni personer meldes dræbt i helikopterulykke i USAs hær,30.03.2023 00:00,,https://jyllands-posten.dk/international/usa/ECE15497774/ni-personer-meldes-draebt-i-helikopterulykke-i-usas-haer/,Jyllands-Posten,https://jyllands-posten.dk/seneste/,"Få de seneste nyheder fra ind- og udland om samfund, erhverv, sport og kultur. ",Jyllandsposten,https://jyllands-posten.dk/seneste/,31.03.2023 07:16
Statsministeren og Østrigs kansler skal diskutere migration fredag,30.03.2023 00:00,,https://jyllands-posten.dk/politik/ECE15497432/statsministeren-og-oestrigs-kansler-skal-diskutere-migration-fredag/,Jyllands-Posten,https://jyllands-posten.dk/seneste/,"Få de seneste nyheder fra ind- og udland om samfund, erhverv, sport og kultur. ",Jyllandsposten,https://jyllands-posten.dk/seneste/,31.03.2023 07:16
SSI: Covid-19 er stadig omkring - smitte stiger fortsat,30.03.2023 00:00,,https://jyllands-posten.dk/indland/ECE15497603/ssi-covid19-er-stadig-omkring-smitte-stiger-fortsat/,Jyllands-Posten,https://jyllands-posten.dk/seneste/,"Få de seneste nyheder fra ind- og udland om samfund, erhverv, sport og kultur. ",Jyllandsposten,https://jyllands-posten.dk/seneste/,31.03.2023 07:16
"Se billederne: Granaterne bragede, da vestjyske klitplantager dannede ramme om enorm militærøvelse",30.03.2023 00:00,,https://jyllands-posten.dk/indland/ECE15491857/se-billederne-granaterne-bragede-da-vestjyske-klitplantager-dannede-ramme-om-enorm-militaeroevelse/,Jyllands-Posten,https://jyllands-posten.dk/seneste/,"Få de seneste nyheder fra ind- og udland om samfund, erhverv, sport og kultur. ",Jyllandsposten,https://jyllands-posten.dk/seneste/,31.03.2023 07:16
Landsret udviser irakisk mand i seks år trods barn i Danmark,30.03.2023 00:00,,https://jyllands-posten.dk/indland/ECE15495858/landsret-udviser-irakisk-mand-i-seks-aar-trods-barn-i-danmark/,Jyllands-Posten,https://jyllands-posten.dk/seneste/,"Få de seneste nyheder fra ind- og udland om samfund, erhverv, sport og kultur. ",Jyllandsposten,https://jyllands-posten.dk/seneste/,31.03.2023 07:16
"Minister indskærper tavshedspligt, efter DFer røbede fortrolig oplysning om kommende dansker",30.03.2023 00:00,,https://jyllands-posten.dk/politik/ECE15494952/minister-indskaerper-politikeres-tavshedspligt-efter-offentliggoerelse-af-fortrolige-oplysninger/,Jyllands-Posten,https://jyllands-posten.dk/seneste/,"Få de seneste nyheder fra ind- og udland om samfund, erhverv, sport og kultur. ",Jyllandsposten,https://jyllands-posten.dk/seneste/,31.03.2023 07:16
"Laura var 15 år, da hun ringede på døren til et krisecenter for børn: »Jeg var så ked af det, og en dag smuttede jeg bare hjemmefra«",30.03.2023 00:00,,https://jyllands-posten.dk/indland/ECE15363020/et-hjem-for-boern-der-ikke-kan-vaere-derhjemme/,Jyllands-Posten,https://jyllands-posten.dk/seneste/,"Få de seneste nyheder fra ind- og udland om samfund, erhverv, sport og kultur. ",Jyllandsposten,https://jyllands-posten.dk/seneste/,31.03.2023 07:16
Efter hård kritik af skjulte tillæg: Energidirektør føler sig kastet under bussen,30.03.2023 00:00,,https://jyllands-posten.dk/jperhverv/ECE15490165/vindstoeddirektoer-aergrer-sig-alle-haenges-til-toerre-i-kritik-af-skjulte-tillaeg/,Jyllands-Posten,https://jyllands-posten.dk/seneste/,"Få de seneste nyheder fra ind- og udland om samfund, erhverv, sport og kultur. ",Jyllandsposten,https://jyllands-posten.dk/seneste/,31.03.2023 07:16
Domstol tillader offentliggørelsen af sexfilm med skandaleforfatter,30.03.2023 00:00,,https://jyllands-posten.dk/kultur/ECE15486642/domstol-tillader-offentliggoerelsen-af-sexfilm-med-skandaleforfatter/,Jyllands-Posten,https://jyllands-posten.dk/seneste/,"Få de seneste nyheder fra ind- og udland om samfund, erhverv, sport og kultur. ",Jyllandsposten,https://jyllands-posten.dk/seneste/,31.03.2023 07:16
AaB og direktør Thomas Bælum skilles senest i april,30.03.2023 00:00,,https://jyllands-posten.dk/sport/fodbold/ECE15493818/aab-og-direktoer-thomas-baelum-skilles-senest-i-april/,Jyllands-Posten,https://jyllands-posten.dk/seneste/,"Få de seneste nyheder fra ind- og udland om samfund, erhverv, sport og kultur. ",Jyllandsposten,https://jyllands-posten.dk/seneste/,31.03.2023 07:16
Underviser dømt for at have sex med 17-årig elev,30.03.2023 00:00,,https://jyllands-posten.dk/indland/ECE15493562/underviser-doemt-for-at-have-sex-med-17aarig-elev/,Jyllands-Posten,https://jyllands-posten.dk/seneste/,"Få de seneste nyheder fra ind- og udland om samfund, erhverv, sport og kultur. ",Jyllandsposten,https://jyllands-posten.dk/seneste/,31.03.2023 07:16
Pirater har stadig styring over dansk skib: Besætning har låst sig inde i sikkerhedsrum,30.03.2023 00:00,,https://jyllands-posten.dk/international/Afrika/ECE15489574/besat-af-pirater-paa-6-doegn-dansk-skib-laa-260-km-ud-for-congos-kyst-da-pirater-gik-om-bord/,Jyllands-Posten,https://jyllands-posten.dk/seneste/,"Få de seneste nyheder fra ind- og udland om samfund, erhverv, sport og kultur. ",Jyllandsposten,https://jyllands-posten.dk/seneste/,31.03.2023 07:16
"Fire stjerner: Du behøver ikke at have stået i regnvejr med en plasticøkse for at blive underholdt af ""Dungeons & Dragons""",30.03.2023 00:00,,https://jyllands-posten.dk/kultur/film/ECE15485611/chris-pine-er-hovedattraktionen-i-et-uhoejtideligt-rollespilseventyr/,Jyllands-Posten,https://jyllands-posten.dk/seneste/,"Få de seneste nyheder fra ind- og udland om samfund, erhverv, sport og kultur. ",Jyllandsposten,https://jyllands-posten.dk/seneste/,31.03.2023 07:16
Stigende energipriser er med til at give kongehuset millionunderskud,30.03.2023 00:00,,https://jyllands-posten.dk/indland/ECE15491893/stigende-energipriser-er-med-til-at-give-kongehuset-millionunderskud/,Jyllands-Posten,https://jyllands-posten.dk/seneste/,"Få de seneste nyheder fra ind- og udland om samfund, erhverv, sport og kultur. ",Jyllandsposten,https://jyllands-posten.dk/seneste/,31.03.2023 07:16
"Kold skulder til bestseller-filmatisering: »Utilgængelig, uvedkommende og forvrænget«",30.03.2023 00:00,,https://jyllands-posten.dk/kultur/film/ECE15479960/kaempe-bjoernetjeneste/,Jyllands-Posten,https://jyllands-posten.dk/seneste/,"Få de seneste nyheder fra ind- og udland om samfund, erhverv, sport og kultur. ",Jyllandsposten,https://jyllands-posten.dk/seneste/,31.03.2023 07:16
Thomas Frank er Årets Træner for anden gang,30.03.2023 00:00,,https://jyllands-posten.dk/sport/fodbold/ECE15491805/thomas-frank-er-aarets-traener-for-anden-gang/,Jyllands-Posten,https://jyllands-posten.dk/seneste/,"Få de seneste nyheder fra ind- og udland om samfund, erhverv, sport og kultur. ",Jyllandsposten,https://jyllands-posten.dk/seneste/,31.03.2023 07:16
EU-formand vil indgå i et »ambitiøst parnerskab« med Kina,30.03.2023 00:00,,https://jyllands-posten.dk/import/importjp/ritzau/ECE15491662/von-der-leyen-eu-skal-indgaa-ambitioest-partnerskab-med-kina/,Jyllands-Posten,https://jyllands-posten.dk/seneste/,"Få de seneste nyheder fra ind- og udland om samfund, erhverv, sport og kultur. ",Jyllandsposten,https://jyllands-posten.dk/seneste/,31.03.2023 07:16
Bolsonaro er tilbage i Brasilien efter tre måneder i USA,30.03.2023 00:00,,https://jyllands-posten.dk/international/ECE15491755/bolsonaro-er-tilbage-i-brasilien-efter-tre-maaneder-i-usa/,Jyllands-Posten,https://jyllands-posten.dk/seneste/,"Få de seneste nyheder fra ind- og udland om samfund, erhverv, sport og kultur. ",Jyllandsposten,https://jyllands-posten.dk/seneste/,31.03.2023 07:16
"Fædrenes vrede nedarves Forfatteren Alex Schulman har fået vreden og jalousien i vuggegave og vil undersøge hvorfor i ""Brænd alle mine breve""",30.03.2023 00:00,,https://jyllands-posten.dk/kultur/film/ECE15484220/den-oedelaeggende-jalousi/,Jyllands-Posten,https://jyllands-posten.dk/seneste/,"Få de seneste nyheder fra ind- og udland om samfund, erhverv, sport og kultur. ",Jyllandsposten,https://jyllands-posten.dk/seneste/,31.03.2023 07:16
Avis afslører egen rolle i slavehandel og lover millionerstatning,30.03.2023 00:00,,https://jyllands-posten.dk/international/europa/ECE15484988/avis-blev-grundlagt-paa-slavepenge-nu-lover-den-millionerstatning/,Jyllands-Posten,https://jyllands-posten.dk/seneste/,"Få de seneste nyheder fra ind- og udland om samfund, erhverv, sport og kultur. ",Jyllandsposten,https://jyllands-posten.dk/seneste/,31.03.2023 07:16
"Læs hele afgørelsen om eksamenssnyd, som ikke kom med i Jacob Marks »hudløst ærlige« bog",30.03.2023 00:00,,https://jyllands-posten.dk/politik/ECE15485257/laes-hele-afgoerelsen-om-eksamenssnyd-som-ikke-kom-med-i-jacob-marks-hudloest-aerlige-bog/,Jyllands-Posten,https://jyllands-posten.dk/seneste/,"Få de seneste nyheder fra ind- og udland om samfund, erhverv, sport og kultur. ",Jyllandsposten,https://jyllands-posten.dk/seneste/,31.03.2023 07:16
Politisk analytiker undrer sig: Hvorfor blev Barbara Bertelsen pludseligt en del af rigspolitichefens sag?,30.03.2023 00:00,,https://jyllands-posten.dk/politik/ECE15489165/der-er-sat-juridisk-punktum-for-minksagens-hovedpersoner-men-jps-politiske-analytiker-undrer-sig-stadig-over-to-ting/,Jyllands-Posten,https://jyllands-posten.dk/seneste/,"Få de seneste nyheder fra ind- og udland om samfund, erhverv, sport og kultur. ",Jyllandsposten,https://jyllands-posten.dk/seneste/,31.03.2023 07:16
Vil ikke have russere med: Dansk forbund aflyser internationalt stævne,30.03.2023 00:00,,https://jyllands-posten.dk/sport/ECE15490297/russisk-deltagelse-faar-dansk-forbund-til-at-aflyse-faegtestaevne/,Jyllands-Posten,https://jyllands-posten.dk/seneste/,"Få de seneste nyheder fra ind- og udland om samfund, erhverv, sport og kultur. ",Jyllandsposten,https://jyllands-posten.dk/seneste/,31.03.2023 07:16
Milliondyr indsats lader til at have virket: »Vi tager imod selv det mindste antal med kyshånd«,30.03.2023 00:00,,https://jyllands-posten.dk/indland/ECE15484114/efter-milliondyr-indsats-oensker-flere-at-blive-faengselsbetjent/,Jyllands-Posten,https://jyllands-posten.dk/seneste/,"Få de seneste nyheder fra ind- og udland om samfund, erhverv, sport og kultur. ",Jyllandsposten,https://jyllands-posten.dk/seneste/,31.03.2023 07:16
Ti børnehaver og legepladser skal undersøges for PFAS i Syddanmark,30.03.2023 00:00,,https://jyllands-posten.dk/indland/ECE15490117/ti-boernehaver-og-legepladser-skal-undersoeges-for-pfas-i-syddanmark/,Jyllands-Posten,https://jyllands-posten.dk/seneste/,"Få de seneste nyheder fra ind- og udland om samfund, erhverv, sport og kultur. ",Jyllandsposten,https://jyllands-posten.dk/seneste/,31.03.2023 07:16
Journalist for amerikansk avis er anholdt i Rusland for spionage,30.03.2023 00:00,,https://jyllands-posten.dk/international/ECE15490089/journalist-for-amerikansk-avis-er-anholdt-i-rusland-for-spionage/,Jyllands-Posten,https://jyllands-posten.dk/seneste/,"Få de seneste nyheder fra ind- og udland om samfund, erhverv, sport og kultur. ",Jyllandsposten,https://jyllands-posten.dk/seneste/,31.03.2023 07:16
Russisk far pågrebet: Datteren lavede vred skoletegning om krigen,30.03.2023 00:00,,https://jyllands-posten.dk/international/ECE15489841/russisk-far-paagrebet-datteren-lavede-vred-skoletegning-om-krigen/,Jyllands-Posten,https://jyllands-posten.dk/seneste/,"Få de seneste nyheder fra ind- og udland om samfund, erhverv, sport og kultur. ",Jyllandsposten,https://jyllands-posten.dk/seneste/,31.03.2023 07:16
Ny aftale i EU skal øge andelen af vedvarende energi i 2030,30.03.2023 00:00,,https://jyllands-posten.dk/international/europa/ECE15489715/ny-aftale-i-eu-skal-oege-andelen-af-vedvarende-energi-i-2030/,Jyllands-Posten,https://jyllands-posten.dk/seneste/,"Få de seneste nyheder fra ind- og udland om samfund, erhverv, sport og kultur. ",Jyllandsposten,https://jyllands-posten.dk/seneste/,31.03.2023 07:16
Dansk popgruppe har vind i sejlene: Blæst åbner Roskilde Festival,30.03.2023 00:00,,https://jyllands-posten.dk/import/importjp/ritzau/ECE15489555/dansk-popgruppe-har-vind-i-sejlene-blaest-aabner-roskilde-festival/,Jyllands-Posten,https://jyllands-posten.dk/seneste/,"Få de seneste nyheder fra ind- og udland om samfund, erhverv, sport og kultur. ",Jyllandsposten,https://jyllands-posten.dk/seneste/,31.03.2023 07:16
Lyngby forventer nulregnskab efter ventet underskud,30.03.2023 00:00,,https://jyllands-posten.dk/sport/fodbold/ECE15489640/lyngby-forventer-nulregnskab-efter-ventet-underskud/,Jyllands-Posten,https://jyllands-posten.dk/seneste/,"Få de seneste nyheder fra ind- og udland om samfund, erhverv, sport og kultur. ",Jyllandsposten,https://jyllands-posten.dk/seneste/,31.03.2023 07:16
Kirkbis overskud reddes af en bestemt årsag,30.03.2023 00:00,,https://jyllands-posten.dk/jperhverv/ECE15477330/lego-redder-kirkbipengetanken-fra-underskud/,Jyllands-Posten,https://jyllands-posten.dk/seneste/,"Få de seneste nyheder fra ind- og udland om samfund, erhverv, sport og kultur. ",Jyllandsposten,https://jyllands-posten.dk/seneste/,31.03.2023 07:16
"»Priskrig« har gjort det billigere at købe ind i svenske supermarkeder, men danskerne skal ikke regne med prisfald herhjemme lige nu",30.03.2023 00:00,,https://jyllands-posten.dk/indland/ECE15485646/i-sverige-er-der-udbrudt-priskrig-mellem-supermarkederne-skal-danskerne-ogsaa-forvente-billigere-foedevarer/,Jyllands-Posten,https://jyllands-posten.dk/seneste/,"Få de seneste nyheder fra ind- og udland om samfund, erhverv, sport og kultur. ",Jyllandsposten,https://jyllands-posten.dk/seneste/,31.03.2023 07:16
Discount i inflationskrisen: Rema 1000 vinder kunder,30.03.2023 00:00,,https://jyllands-posten.dk/jperhverv/ECE15471048/remachef-henrik-burkal-jeg-har-aldrig-foer-set-saa-markante-aendringer-i-forbruget/,Jyllands-Posten,https://jyllands-posten.dk/seneste/,"Få de seneste nyheder fra ind- og udland om samfund, erhverv, sport og kultur. ",Jyllandsposten,https://jyllands-posten.dk/seneste/,31.03.2023 07:16
Region blev advaret om problemer på kræftafdeling i efteråret,30.03.2023 00:00,,https://jyllands-posten.dk/indland/ECE15489163/region-blev-advaret-om-problemer-paa-kraeftafdeling-i-efteraaret/,Jyllands-Posten,https://jyllands-posten.dk/seneste/,"Få de seneste nyheder fra ind- og udland om samfund, erhverv, sport og kultur. ",Jyllandsposten,https://jyllands-posten.dk/seneste/,31.03.2023 07:16
Første navne klar til grønne koncerter,30.03.2023 00:00,,https://jyllands-posten.dk/kultur/ECE15489096/foerste-navne-klar-til-groenne-koncerter/,Jyllands-Posten,https://jyllands-posten.dk/seneste/,"Få de seneste nyheder fra ind- og udland om samfund, erhverv, sport og kultur. ",Jyllandsposten,https://jyllands-posten.dk/seneste/,31.03.2023 07:16
Norsk roman med skyhøje ambitioner: Når døden måske ikke er definitiv,30.03.2023 00:00,,https://jyllands-posten.dk/kultur/litteratur/ECE15469611/naar-doeden-maaske-ikke-er-definitiv/,Jyllands-Posten,https://jyllands-posten.dk/seneste/,"Få de seneste nyheder fra ind- og udland om samfund, erhverv, sport og kultur. ",Jyllandsposten,https://jyllands-posten.dk/seneste/,31.03.2023 07:16
"Nogen mente, at det var lettere, hvis Leonora Christina Skov var død: »Det var træls, når forfatteren stadig levede«",30.03.2023 00:00,,https://jyllands-posten.dk/kultur/ECE15275458/da-jeg-moedte-leonoras-laesere-taenkte-jeg-hvad-har-jeg-gang-i/,Jyllands-Posten,https://jyllands-posten.dk/seneste/,"Få de seneste nyheder fra ind- og udland om samfund, erhverv, sport og kultur. ",Jyllandsposten,https://jyllands-posten.dk/seneste/,31.03.2023 07:16
66.189 indlæggelser kan undgås: Penge og hænder at spare på en bestemt type patienter,30.03.2023 00:00,,https://jyllands-posten.dk/indland/ECE15485966/66189-indlaeggelser-kan-forebygges/,Jyllands-Posten,https://jyllands-posten.dk/seneste/,"Få de seneste nyheder fra ind- og udland om samfund, erhverv, sport og kultur. ",Jyllandsposten,https://jyllands-posten.dk/seneste/,31.03.2023 07:16
Ældre kunder særlig ramt: Telefonregning vokser 27 pct.,30.03.2023 00:00,,https://jyllands-posten.dk/jperhverv/ECE15486419/aeldre-telekunder-i-klemme-derfor-gennemfoerer-vi-absolut-ikke-denne-prisstigning-med-glaede/,Jyllands-Posten,https://jyllands-posten.dk/seneste/,"Få de seneste nyheder fra ind- og udland om samfund, erhverv, sport og kultur. ",Jyllandsposten,https://jyllands-posten.dk/seneste/,31.03.2023 07:16
Hvad i alverden: Minkmysteriet skaber undren på flere punkter,30.03.2023 00:00,,https://jyllands-posten.dk/podcast/undergulvtaeppet/ECE15487862/minkmysteriet-skaber-undren-paa-flere-punkter/,Jyllands-Posten,https://jyllands-posten.dk/seneste/,"Få de seneste nyheder fra ind- og udland om samfund, erhverv, sport og kultur. ",Jyllandsposten,https://jyllands-posten.dk/seneste/,31.03.2023 07:16
Erdogan: Putin besøger os måske til indvielse af atomreaktor,30.03.2023 00:00,,https://jyllands-posten.dk/international/ECE15488210/erdogan-putin-besoeger-os-maaske-til-indvielse-af-atomreaktor/,Jyllands-Posten,https://jyllands-posten.dk/seneste/,"Få de seneste nyheder fra ind- og udland om samfund, erhverv, sport og kultur. ",Jyllandsposten,https://jyllands-posten.dk/seneste/,31.03.2023 07:16
Social udsatte dør i gennemsnit 17 år før andre borgere,30.03.2023 00:00,,https://jyllands-posten.dk/politik/ECE15488558/social-udsatte-doer-i-gennemsnit-17-aar-foer-andre-borgere/,Jyllands-Posten,https://jyllands-posten.dk/seneste/,"Få de seneste nyheder fra ind- og udland om samfund, erhverv, sport og kultur. ",Jyllandsposten,https://jyllands-posten.dk/seneste/,31.03.2023 07:16
Tarantino: Manuskriptet til min sidste film er færdiggjort,30.03.2023 00:00,,https://jyllands-posten.dk/international/ECE15488992/tarantino-manuskriptet-til-min-sidste-film-er-faerdiggjort/,Jyllands-Posten,https://jyllands-posten.dk/seneste/,"Få de seneste nyheder fra ind- og udland om samfund, erhverv, sport og kultur. ",Jyllandsposten,https://jyllands-posten.dk/seneste/,31.03.2023 07:16
Putin indkalder flere nye rekrutter med nyt dekret,30.03.2023 00:00,,https://jyllands-posten.dk/dagensoverblik/ECE15487763/nyhedsoverblik/,Jyllands-Posten,https://jyllands-posten.dk/seneste/,"Få de seneste nyheder fra ind- og udland om samfund, erhverv, sport og kultur. ",Jyllandsposten,https://jyllands-posten.dk/seneste/,31.03.2023 07:16
"Var Trump gift med en spion? »Det er på det tidspunkt, du siger: Banke, banke på! Kan du huske din vidunderlige tid i Moskva«",30.03.2023 00:00,,https://jyllands-posten.dk/international/usa/ECE15485345/hemmelige-dokumenter-fra-fbi-afsloerer-giftig-sag-var-trump-gift-med-en-spion/,Jyllands-Posten,https://jyllands-posten.dk/seneste/,"Få de seneste nyheder fra ind- og udland om samfund, erhverv, sport og kultur. ",Jyllandsposten,https://jyllands-posten.dk/seneste/,31.03.2023 07:16
Stemmesluger afsløret i snyd: Seks år efter beskrev han sagen i rost bog. Men centrale dele af sagen blev holdt skjult,30.03.2023 00:00,,https://jyllands-posten.dk/politik/ECE15449272/jacob-mark-blev-taget-i-plagiat-og-fortalte-en-forkert-historie-om-det/,Jyllands-Posten,https://jyllands-posten.dk/seneste/,"Få de seneste nyheder fra ind- og udland om samfund, erhverv, sport og kultur. ",Jyllandsposten,https://jyllands-posten.dk/seneste/,31.03.2023 07:16
Topembedsmand i EU omplaceres efter betalte rejser til Qatar,29.03.2023 00:00,,https://jyllands-posten.dk/international/europa/ECE15487873/topembedsmand-i-eu-omplaceres-efter-betalte-rejser-til-qatar/,Jyllands-Posten,https://jyllands-posten.dk/seneste/,"Få de seneste nyheder fra ind- og udland om samfund, erhverv, sport og kultur. ",Jyllandsposten,https://jyllands-posten.dk/seneste/,31.03.2023 07:16
Rapport: Danmark kan ikke leve op til EU-krav med vandmiljøplan,29.03.2023 00:00,,https://jyllands-posten.dk/politik/ECE15487712/rapport-danmark-kan-ikke-leve-op-til-eukrav-med-vandmiljoeplan/,Jyllands-Posten,https://jyllands-posten.dk/seneste/,"Få de seneste nyheder fra ind- og udland om samfund, erhverv, sport og kultur. ",Jyllandsposten,https://jyllands-posten.dk/seneste/,31.03.2023 07:16
Flere end 20 unge dræbt ved angreb på partimøde i DR Congo,29.03.2023 00:00,,https://jyllands-posten.dk/international/Afrika/ECE15487774/flere-end-20-unge-draebt-ved-angreb-paa-partimoede-i-dr-congo/,Jyllands-Posten,https://jyllands-posten.dk/seneste/,"Få de seneste nyheder fra ind- og udland om samfund, erhverv, sport og kultur. ",Jyllandsposten,https://jyllands-posten.dk/seneste/,31.03.2023 07:16
BSH vandt og tager point med videre til slutspil,29.03.2023 00:00,,https://jyllands-posten.dk/sport/handbold/ECE15487742/bsh-vandt-og-tager-point-med-videre-til-slutspil/,Jyllands-Posten,https://jyllands-posten.dk/seneste/,"Få de seneste nyheder fra ind- og udland om samfund, erhverv, sport og kultur. ",Jyllandsposten,https://jyllands-posten.dk/seneste/,31.03.2023 07:16
Tottenham-direktør får karantæne i hele verden,29.03.2023 00:00,,https://jyllands-posten.dk/sport/fodbold/ECE15487714/tottenhamdirektoer-faar-verdensomspaendende-karantaene/,Jyllands-Posten,https://jyllands-posten.dk/seneste/,"Få de seneste nyheder fra ind- og udland om samfund, erhverv, sport og kultur. ",Jyllandsposten,https://jyllands-posten.dk/seneste/,31.03.2023 07:16
Ministerium undersøger muligt forbud mod Satudarah,29.03.2023 00:00,,https://jyllands-posten.dk/indland/ECE15487695/ministerium-undersoeger-muligt-forbud-mod-satudarah/,Jyllands-Posten,https://jyllands-posten.dk/seneste/,"Få de seneste nyheder fra ind- og udland om samfund, erhverv, sport og kultur. ",Jyllandsposten,https://jyllands-posten.dk/seneste/,31.03.2023 07:16
Region får lov til at bruge 454 millioner ekstra på supersygehus,29.03.2023 00:00,,https://jyllands-posten.dk/indland/ECE15487688/region-faar-lov-til-at-bruge-454-millioner-ekstra-paa-supersygehus/,Jyllands-Posten,https://jyllands-posten.dk/seneste/,"Få de seneste nyheder fra ind- og udland om samfund, erhverv, sport og kultur. ",Jyllandsposten,https://jyllands-posten.dk/seneste/,31.03.2023 07:16
"Her taler mennesker, vi sjældent hører om",29.03.2023 00:00,,https://jyllands-posten.dk/kultur/litteratur/ECE15278790/her-taler-mennesker-vi-sjaeldent-hoerer-om/,Jyllands-Posten,https://jyllands-posten.dk/seneste/,"Få de seneste nyheder fra ind- og udland om samfund, erhverv, sport og kultur. ",Jyllandsposten,https://jyllands-posten.dk/seneste/,31.03.2023 07:16
Syv personer fængslet i sager om mulige terrorangreb i Belgien,29.03.2023 00:00,,https://jyllands-posten.dk/international/europa/ECE15487686/syv-personer-faengslet-i-sager-om-mulige-terrorangreb-i-belgien/,Jyllands-Posten,https://jyllands-posten.dk/seneste/,"Få de seneste nyheder fra ind- og udland om samfund, erhverv, sport og kultur. ",Jyllandsposten,https://jyllands-posten.dk/seneste/,31.03.2023 07:16
