title,published,text,link,og:site_name,og:url,site_description,name,url,scrape_time
Patologer gør uhyggeligt fund ved undersøgelse af lig fra dødskult i Kenya,02.05.2023 00:00,,https://politiken.dk/udland/art9331976/Patologer-g%C3%B8r-uhyggeligt-fund-ved-unders%C3%B8gelse-af-lig-fra-d%C3%B8dskult-i-Kenya,Politiken,https://politiken.dk/nyheder/,"Hold dig opdateret pÃ¥ de seneste nyheder pÃ¥ politiken.dk: Seneste Politiken, Seneste Danmark, Seneste Kultur og Seneste Internationalt. ",Politiken,https://politiken.dk/nyheder/,02.05.2023 07:16
Ukraine hævder at skubbe russiske styrker ud af dele af Bakhmut,03.05.2023 00:00,,https://politiken.dk/udland/art9331970/Ukraine-h%C3%A6vder-at-skubbe-russiske-styrker-ud-af-dele-af-Bakhmut,Politiken,https://politiken.dk/nyheder/,"Hold dig opdateret pÃ¥ de seneste nyheder pÃ¥ politiken.dk: Seneste Politiken, Seneste Danmark, Seneste Kultur og Seneste Internationalt. ",Politiken,https://politiken.dk/nyheder/,02.05.2023 07:16
Han bestyrer dronningens penge,03.05.2023 00:00,,https://politiken.dk/navne/art9278568/Han-bestyrer-dronningens-penge,Politiken,https://politiken.dk/nyheder/,"Hold dig opdateret pÃ¥ de seneste nyheder pÃ¥ politiken.dk: Seneste Politiken, Seneste Danmark, Seneste Kultur og Seneste Internationalt. ",Politiken,https://politiken.dk/nyheder/,02.05.2023 07:16
Da Lizette Risgaard begik karakter-selvmord,04.05.2023 00:00,,https://politiken.dk/podcast/dulyttertilpolitiken/art9331226/Da-Lizette-Risgaard-begik-karakter-selvmord,Politiken,https://politiken.dk/nyheder/,"Hold dig opdateret pÃ¥ de seneste nyheder pÃ¥ politiken.dk: Seneste Politiken, Seneste Danmark, Seneste Kultur og Seneste Internationalt. ",Politiken,https://politiken.dk/nyheder/,02.05.2023 07:16
USAs finansminister: Statskassen kan lammes 1. juni,09.05.2023 00:00,,https://politiken.dk/udland/int_usa/art9331959/Statskassen-kan-lammes-1.-juni,Politiken,https://politiken.dk/nyheder/,"Hold dig opdateret pÃ¥ de seneste nyheder pÃ¥ politiken.dk: Seneste Politiken, Seneste Danmark, Seneste Kultur og Seneste Internationalt. ",Politiken,https://politiken.dk/nyheder/,02.05.2023 07:16
Sundhedsvæsnet i Sudan kan kollapse om få dage: Læger må lave lungedræn af sodavandsflasker,10.05.2023 00:00,,https://politiken.dk/udland/art9330157/Sundhedsv%C3%A6snet-i-Sudan-kan-kollapse-om-f%C3%A5-dage-L%C3%A6ger-m%C3%A5-lave-lungedr%C3%A6n-af-sodavandsflasker,Politiken,https://politiken.dk/nyheder/,"Hold dig opdateret pÃ¥ de seneste nyheder pÃ¥ politiken.dk: Seneste Politiken, Seneste Danmark, Seneste Kultur og Seneste Internationalt. ",Politiken,https://politiken.dk/nyheder/,02.05.2023 07:16
"Her er syv biograffilm, vi glæder os til i maj: Kan man holde døden på afstand ved at gå og gå og gå?",10.05.2023 00:00,,https://politiken.dk/kultur/film_og_tv/art9170573/Kan-man-holde-d%C3%B8den-p%C3%A5-afstand-ved-at-g%C3%A5-og-g%C3%A5-og-g%C3%A5,Politiken,https://politiken.dk/nyheder/,"Hold dig opdateret pÃ¥ de seneste nyheder pÃ¥ politiken.dk: Seneste Politiken, Seneste Danmark, Seneste Kultur og Seneste Internationalt. ",Politiken,https://politiken.dk/nyheder/,02.05.2023 07:16
To er anholdt i forbindelse med knivstikkeri i København,11.05.2023 00:00,,https://politiken.dk/indland/kobenhavn/art9331900/To-er-anholdt-i-forbindelse-med-knivstikkeri-i-K%C3%B8benhavn,Politiken,https://politiken.dk/nyheder/,"Hold dig opdateret pÃ¥ de seneste nyheder pÃ¥ politiken.dk: Seneste Politiken, Seneste Danmark, Seneste Kultur og Seneste Internationalt. ",Politiken,https://politiken.dk/nyheder/,02.05.2023 07:16
Valget af Risgaards afløser bliver et skæbnevalg for FH,11.05.2023 00:00,,https://politiken.dk/debat/ledere/art9330792/Valget-af-Risgaards-afl%C3%B8ser-bliver-et-sk%C3%A6bnevalg-for-FH,Politiken,https://politiken.dk/nyheder/,"Hold dig opdateret pÃ¥ de seneste nyheder pÃ¥ politiken.dk: Seneste Politiken, Seneste Danmark, Seneste Kultur og Seneste Internationalt. ",Politiken,https://politiken.dk/nyheder/,02.05.2023 07:16
Ibyen tipper: Københavns elektroniske undergrund har fået et nyt spot,11.05.2023 00:00,,https://politiken.dk/ibyen/art9330921/K%C3%B8benhavns-elektroniske-undergrund-har-f%C3%A5et-et-nyt-spot,Politiken,https://politiken.dk/nyheder/,"Hold dig opdateret pÃ¥ de seneste nyheder pÃ¥ politiken.dk: Seneste Politiken, Seneste Danmark, Seneste Kultur og Seneste Internationalt. ",Politiken,https://politiken.dk/nyheder/,02.05.2023 07:16
"Direktør: »Da jeg begyndte at fortælle folk om vores adfærdsregler på teatret, blev de vrede«",11.05.2023 00:00,,https://politiken.dk/kultur/art9323734/%C2%BBDa-jeg-begyndte-at-fort%C3%A6lle-folk-om-vores-adf%C3%A6rdsregler-p%C3%A5-teatret-blev-de-vrede%C2%AB,Politiken,https://politiken.dk/nyheder/,"Hold dig opdateret pÃ¥ de seneste nyheder pÃ¥ politiken.dk: Seneste Politiken, Seneste Danmark, Seneste Kultur og Seneste Internationalt. ",Politiken,https://politiken.dk/nyheder/,02.05.2023 07:16
På havnen i Vejle gik en ulv pludselig ind foran deres bil,11.05.2023 00:00,,https://politiken.dk/indland/art9331837/P%C3%A5-havnen-i-Vejle-gik-en-ulv-pludselig-ind-foran-deres-bil,Politiken,https://politiken.dk/nyheder/,"Hold dig opdateret pÃ¥ de seneste nyheder pÃ¥ politiken.dk: Seneste Politiken, Seneste Danmark, Seneste Kultur og Seneste Internationalt. ",Politiken,https://politiken.dk/nyheder/,02.05.2023 07:16
København Zoo skal have ny direktør efter seks år,12.05.2023 00:00,,https://politiken.dk/indland/kobenhavn/art9331874/K%C3%B8benhavn-Zoo-skal-have-ny-direkt%C3%B8r-efter-seks-%C3%A5r,Politiken,https://politiken.dk/nyheder/,"Hold dig opdateret pÃ¥ de seneste nyheder pÃ¥ politiken.dk: Seneste Politiken, Seneste Danmark, Seneste Kultur og Seneste Internationalt. ",Politiken,https://politiken.dk/nyheder/,02.05.2023 07:16
Elisabet Svane: Der er udløbsdato på alt. Også vreden over store bededag,12.05.2023 00:00,,https://politiken.dk/indland/art9330926/Der-er-udl%C3%B8bsdato-p%C3%A5-alt.-Ogs%C3%A5-vreden-over-store-bededag,Politiken,https://politiken.dk/nyheder/,"Hold dig opdateret pÃ¥ de seneste nyheder pÃ¥ politiken.dk: Seneste Politiken, Seneste Danmark, Seneste Kultur og Seneste Internationalt. ",Politiken,https://politiken.dk/nyheder/,02.05.2023 07:16
108 politifolk såret i voldsomme sammenstød i Frankrig,13.05.2023 00:00,,https://politiken.dk/udland/art9331856/108-politifolk-s%C3%A5ret-i-voldsomme-sammenst%C3%B8d-i-Frankrig,Politiken,https://politiken.dk/nyheder/,"Hold dig opdateret pÃ¥ de seneste nyheder pÃ¥ politiken.dk: Seneste Politiken, Seneste Danmark, Seneste Kultur og Seneste Internationalt. ",Politiken,https://politiken.dk/nyheder/,02.05.2023 07:16
Balladen er ikke slut: Nu sagsøger aktionærerer Adidas,13.05.2023 00:00,,https://politiken.dk/kultur/art9330168/Nu-sags%C3%B8ger-aktion%C3%A6rerer-Adidas,Politiken,https://politiken.dk/nyheder/,"Hold dig opdateret pÃ¥ de seneste nyheder pÃ¥ politiken.dk: Seneste Politiken, Seneste Danmark, Seneste Kultur og Seneste Internationalt. ",Politiken,https://politiken.dk/nyheder/,02.05.2023 07:16
Der var kun nærige klapsalver til den fungerende formand på fagbevægelsens store dag,13.05.2023 00:00,,https://politiken.dk/indland/politik/art9329835/Der-var-kun-n%C3%A6rige-klapsalver-til-den-fungerende-formand-p%C3%A5-fagbev%C3%A6gelsens-store-dag,Politiken,https://politiken.dk/nyheder/,"Hold dig opdateret pÃ¥ de seneste nyheder pÃ¥ politiken.dk: Seneste Politiken, Seneste Danmark, Seneste Kultur og Seneste Internationalt. ",Politiken,https://politiken.dk/nyheder/,02.05.2023 07:16
Konflikt forsinker fortsat tusindvis af flypassagerer i København,14.05.2023 00:00,,https://politiken.dk/rejser/art9331814/Konflikt-forsinker-fortsat-tusindvis-af-flypassagerer-i-K%C3%B8benhavn,Politiken,https://politiken.dk/nyheder/,"Hold dig opdateret pÃ¥ de seneste nyheder pÃ¥ politiken.dk: Seneste Politiken, Seneste Danmark, Seneste Kultur og Seneste Internationalt. ",Politiken,https://politiken.dk/nyheder/,02.05.2023 07:16
Guide til stjernehimlen i maj: Se tre planeter i selskab med stjerneskud og Månen,14.05.2023 00:00,,https://politiken.dk/viden/Viden/art9322070/Se-tre-planeter-i-selskab-med-stjerneskud-og-M%C3%A5nen,Politiken,https://politiken.dk/nyheder/,"Hold dig opdateret pÃ¥ de seneste nyheder pÃ¥ politiken.dk: Seneste Politiken, Seneste Danmark, Seneste Kultur og Seneste Internationalt. ",Politiken,https://politiken.dk/nyheder/,02.05.2023 07:16
"Mens han skriver portrættet, dukker den portrætteredes dødsannonce frem på skærmen",15.05.2023 00:00,,https://politiken.dk/kultur/boger/boganmeldelser/skonlitteratur_boger/art9324710/Mens-han-skriver-portr%C3%A6ttet-dukker-den-portr%C3%A6tteredes-d%C3%B8dsannonce-frem-p%C3%A5-sk%C3%A6rmen,Politiken,https://politiken.dk/nyheder/,"Hold dig opdateret pÃ¥ de seneste nyheder pÃ¥ politiken.dk: Seneste Politiken, Seneste Danmark, Seneste Kultur og Seneste Internationalt. ",Politiken,https://politiken.dk/nyheder/,02.05.2023 07:16
Cyklist kommer alvorligt til skade i trafikulykke i Køge,15.05.2023 00:00,,https://politiken.dk/indland/art9331783/Cyklist-kommer-alvorligt-til-skade-i-trafikulykke-i-K%C3%B8ge,Politiken,https://politiken.dk/nyheder/,"Hold dig opdateret pÃ¥ de seneste nyheder pÃ¥ politiken.dk: Seneste Politiken, Seneste Danmark, Seneste Kultur og Seneste Internationalt. ",Politiken,https://politiken.dk/nyheder/,02.05.2023 07:16
Første sending med medicinsk nødhjælp er landet i uroramte Sudan,16.05.2023 00:00,,https://politiken.dk/udland/art9331736/F%C3%B8rste-sending-med-medicinsk-n%C3%B8dhj%C3%A6lp-er-landet-i-uroramte-Sudan,Politiken,https://politiken.dk/nyheder/,"Hold dig opdateret pÃ¥ de seneste nyheder pÃ¥ politiken.dk: Seneste Politiken, Seneste Danmark, Seneste Kultur og Seneste Internationalt. ",Politiken,https://politiken.dk/nyheder/,02.05.2023 07:16
Lækket dokument udpeger EUs fire nye venner,16.05.2023 00:00,,https://politiken.dk/debat/signatur/art9326342/L%C3%A6kket-dokument-udpeger-EUs-fire-nye-venner,Politiken,https://politiken.dk/nyheder/,"Hold dig opdateret pÃ¥ de seneste nyheder pÃ¥ politiken.dk: Seneste Politiken, Seneste Danmark, Seneste Kultur og Seneste Internationalt. ",Politiken,https://politiken.dk/nyheder/,02.05.2023 07:16
34 nye kunstnere springer ud: Blot kan vi herfra sige tillykke,17.05.2023 00:00,,https://politiken.dk/kultur/kunst/art9321900/34-nye-kunstnere-springer-ud-Blot-kan-vi-herfra-sige-tillykke,Politiken,https://politiken.dk/nyheder/,"Hold dig opdateret pÃ¥ de seneste nyheder pÃ¥ politiken.dk: Seneste Politiken, Seneste Danmark, Seneste Kultur og Seneste Internationalt. ",Politiken,https://politiken.dk/nyheder/,02.05.2023 07:16
"Smådesperat proklamerer 63-årige Henrik Prip: »Det er nu, jeg peaker!«",17.05.2023 00:00,,https://politiken.dk/kultur/scene/art9193351/%C2%BBDet-er-nu-jeg-peaker%C2%AB,Politiken,https://politiken.dk/nyheder/,"Hold dig opdateret pÃ¥ de seneste nyheder pÃ¥ politiken.dk: Seneste Politiken, Seneste Danmark, Seneste Kultur og Seneste Internationalt. ",Politiken,https://politiken.dk/nyheder/,02.05.2023 07:16
"Drab, tortur og ødelæggelser: Russerne pålagt at betale erstatning for angreb på georgierne",17.05.2023 00:00,,https://politiken.dk/udland/art9330122/Russerne-p%C3%A5lagt-at-betale-erstatning-for-angreb-p%C3%A5-georgierne,Politiken,https://politiken.dk/nyheder/,"Hold dig opdateret pÃ¥ de seneste nyheder pÃ¥ politiken.dk: Seneste Politiken, Seneste Danmark, Seneste Kultur og Seneste Internationalt. ",Politiken,https://politiken.dk/nyheder/,02.05.2023 07:16
26-årig landbrugslærling faldt i foderblander og døde,17.05.2023 00:00,,https://politiken.dk/indland/art9331462/26-%C3%A5rig-landbrugsl%C3%A6rling-faldt-i-foderblander-og-d%C3%B8de,Politiken,https://politiken.dk/nyheder/,"Hold dig opdateret pÃ¥ de seneste nyheder pÃ¥ politiken.dk: Seneste Politiken, Seneste Danmark, Seneste Kultur og Seneste Internationalt. ",Politiken,https://politiken.dk/nyheder/,02.05.2023 07:16
Forsker: Skolereformen var en fiasko. Fat det dog nu,18.05.2023 00:00,,https://politiken.dk/debat/kroniken/art9322125/Skolereformen-var-en-fiasko.-Fat-det-dog-nu,Politiken,https://politiken.dk/nyheder/,"Hold dig opdateret pÃ¥ de seneste nyheder pÃ¥ politiken.dk: Seneste Politiken, Seneste Danmark, Seneste Kultur og Seneste Internationalt. ",Politiken,https://politiken.dk/nyheder/,02.05.2023 07:16
Trump-lejr vil have retssag om voldtægt erklæret ugyldig,18.05.2023 00:00,,https://politiken.dk/udland/art9331287/Trump-lejr-vil-have-retssag-om-voldt%C3%A6gt-erkl%C3%A6ret-ugyldig,Politiken,https://politiken.dk/nyheder/,"Hold dig opdateret pÃ¥ de seneste nyheder pÃ¥ politiken.dk: Seneste Politiken, Seneste Danmark, Seneste Kultur og Seneste Internationalt. ",Politiken,https://politiken.dk/nyheder/,02.05.2023 07:16
"Mette Frederiksen: »Jeg tror ikke på, at jeg er uvelkommen«",19.05.2023 00:00,,https://politiken.dk/indland/politik/art9330549/%C2%BBJeg-tror-ikke-p%C3%A5-at-jeg-er-uvelkommen%C2%AB,Politiken,https://politiken.dk/nyheder/,"Hold dig opdateret pÃ¥ de seneste nyheder pÃ¥ politiken.dk: Seneste Politiken, Seneste Danmark, Seneste Kultur og Seneste Internationalt. ",Politiken,https://politiken.dk/nyheder/,02.05.2023 07:16
Hver femte borger i Danmark bruger fortsat mindre el end normalt,23.05.2023 00:00,,https://politiken.dk/indland/art9331986/Hver-femte-borger-i-Danmark-bruger-fortsat-mindre-el-end-normalt,Politiken,https://politiken.dk/nyheder/,"Hold dig opdateret pÃ¥ de seneste nyheder pÃ¥ politiken.dk: Seneste Politiken, Seneste Danmark, Seneste Kultur og Seneste Internationalt. ",Politiken,https://politiken.dk/nyheder/,02.05.2023 07:16
Flere navne bringes i spil som afløser for Lizette Risgaard,01.05.2023 00:00,,https://politiken.dk/indland/art9331732/Flere-navne-bringes-i-spil-som-afl%C3%B8ser-for-Lizette-Risgaard,Politiken,https://politiken.dk/nyheder/,"Hold dig opdateret pÃ¥ de seneste nyheder pÃ¥ politiken.dk: Seneste Politiken, Seneste Danmark, Seneste Kultur og Seneste Internationalt. ",Politiken,https://politiken.dk/nyheder/,02.05.2023 07:16
De er »usynlige spøgelser« i det danske samfund - og en ny sårbarhed er kommet til,02.05.2023 00:00,,https://politiken.dk/indland/art9283551/De-er-%C2%BBusynlige-sp%C3%B8gelser%C2%AB-i-det-danske-samfund-%E2%80%93-og-en-ny-s%C3%A5rbarhed-er-kommet-til,Politiken,https://politiken.dk/nyheder/,"Hold dig opdateret pÃ¥ de seneste nyheder pÃ¥ politiken.dk: Seneste Politiken, Seneste Danmark, Seneste Kultur og Seneste Internationalt. ",Politiken,https://politiken.dk/nyheder/,02.05.2023 07:16
SF og Radikale er imod anbefaling om at afskaffe 10. klasse,02.05.2023 00:00,,https://politiken.dk/indland/uddannelse/art9331982/SF-og-Radikale-er-imod-anbefaling-om-at-afskaffe-10.-klasse,Politiken,https://politiken.dk/nyheder/,"Hold dig opdateret pÃ¥ de seneste nyheder pÃ¥ politiken.dk: Seneste Politiken, Seneste Danmark, Seneste Kultur og Seneste Internationalt. ",Politiken,https://politiken.dk/nyheder/,02.05.2023 07:16
To er anholdt i forbindelse med knivstikkeri i København,11.05.2023 00:00,,https://politiken.dk/indland/kobenhavn/art9331900/To-er-anholdt-i-forbindelse-med-knivstikkeri-i-K%C3%B8benhavn,Politiken,https://politiken.dk/nyheder/,"Hold dig opdateret pÃ¥ de seneste nyheder pÃ¥ politiken.dk: Seneste Politiken, Seneste Danmark, Seneste Kultur og Seneste Internationalt. ",Politiken,https://politiken.dk/nyheder/,02.05.2023 07:16
Reformkommission foreslår opgør med 10. klasse og efterskoler,11.05.2023 00:00,,https://politiken.dk/indland/art9331897/Reformkommission-foresl%C3%A5r-opg%C3%B8r-med-10.-klasse-og-efterskoler,Politiken,https://politiken.dk/nyheder/,"Hold dig opdateret pÃ¥ de seneste nyheder pÃ¥ politiken.dk: Seneste Politiken, Seneste Danmark, Seneste Kultur og Seneste Internationalt. ",Politiken,https://politiken.dk/nyheder/,02.05.2023 07:16
På havnen i Vejle gik en ulv pludselig ind foran deres bil,11.05.2023 00:00,,https://politiken.dk/indland/art9331837/P%C3%A5-havnen-i-Vejle-gik-en-ulv-pludselig-ind-foran-deres-bil,Politiken,https://politiken.dk/nyheder/,"Hold dig opdateret pÃ¥ de seneste nyheder pÃ¥ politiken.dk: Seneste Politiken, Seneste Danmark, Seneste Kultur og Seneste Internationalt. ",Politiken,https://politiken.dk/nyheder/,02.05.2023 07:16
København Zoo skal have ny direktør efter seks år,12.05.2023 00:00,,https://politiken.dk/indland/kobenhavn/art9331874/K%C3%B8benhavn-Zoo-skal-have-ny-direkt%C3%B8r-efter-seks-%C3%A5r,Politiken,https://politiken.dk/nyheder/,"Hold dig opdateret pÃ¥ de seneste nyheder pÃ¥ politiken.dk: Seneste Politiken, Seneste Danmark, Seneste Kultur og Seneste Internationalt. ",Politiken,https://politiken.dk/nyheder/,02.05.2023 07:16
Elisabet Svane: Der er udløbsdato på alt. Også vreden over store bededag,12.05.2023 00:00,,https://politiken.dk/indland/art9330926/Der-er-udl%C3%B8bsdato-p%C3%A5-alt.-Ogs%C3%A5-vreden-over-store-bededag,Politiken,https://politiken.dk/nyheder/,"Hold dig opdateret pÃ¥ de seneste nyheder pÃ¥ politiken.dk: Seneste Politiken, Seneste Danmark, Seneste Kultur og Seneste Internationalt. ",Politiken,https://politiken.dk/nyheder/,02.05.2023 07:16
Der var kun nærige klapsalver til den fungerende formand på fagbevægelsens store dag,13.05.2023 00:00,,https://politiken.dk/indland/politik/art9329835/Der-var-kun-n%C3%A6rige-klapsalver-til-den-fungerende-formand-p%C3%A5-fagbev%C3%A6gelsens-store-dag,Politiken,https://politiken.dk/nyheder/,"Hold dig opdateret pÃ¥ de seneste nyheder pÃ¥ politiken.dk: Seneste Politiken, Seneste Danmark, Seneste Kultur og Seneste Internationalt. ",Politiken,https://politiken.dk/nyheder/,02.05.2023 07:16
Cyklist kommer alvorligt til skade i trafikulykke i Køge,15.05.2023 00:00,,https://politiken.dk/indland/art9331783/Cyklist-kommer-alvorligt-til-skade-i-trafikulykke-i-K%C3%B8ge,Politiken,https://politiken.dk/nyheder/,"Hold dig opdateret pÃ¥ de seneste nyheder pÃ¥ politiken.dk: Seneste Politiken, Seneste Danmark, Seneste Kultur og Seneste Internationalt. ",Politiken,https://politiken.dk/nyheder/,02.05.2023 07:16
Syv personer ønsker at afløse Søren Brostrøm,17.05.2023 00:00,,https://politiken.dk/indland/art9331497/Syv-personer-%C3%B8nsker-at-afl%C3%B8se-S%C3%B8ren-Brostr%C3%B8m,Politiken,https://politiken.dk/nyheder/,"Hold dig opdateret pÃ¥ de seneste nyheder pÃ¥ politiken.dk: Seneste Politiken, Seneste Danmark, Seneste Kultur og Seneste Internationalt. ",Politiken,https://politiken.dk/nyheder/,02.05.2023 07:16
26-årig landbrugslærling faldt i foderblander og døde,17.05.2023 00:00,,https://politiken.dk/indland/art9331462/26-%C3%A5rig-landbrugsl%C3%A6rling-faldt-i-foderblander-og-d%C3%B8de,Politiken,https://politiken.dk/nyheder/,"Hold dig opdateret pÃ¥ de seneste nyheder pÃ¥ politiken.dk: Seneste Politiken, Seneste Danmark, Seneste Kultur og Seneste Internationalt. ",Politiken,https://politiken.dk/nyheder/,02.05.2023 07:16
"Mette Frederiksen: »Jeg tror ikke på, at jeg er uvelkommen«",19.05.2023 00:00,,https://politiken.dk/indland/politik/art9330549/%C2%BBJeg-tror-ikke-p%C3%A5-at-jeg-er-uvelkommen%C2%AB,Politiken,https://politiken.dk/nyheder/,"Hold dig opdateret pÃ¥ de seneste nyheder pÃ¥ politiken.dk: Seneste Politiken, Seneste Danmark, Seneste Kultur og Seneste Internationalt. ",Politiken,https://politiken.dk/nyheder/,02.05.2023 07:16
"Først skrev Kofod, at han var færdig med politik. Men nu tyder kort sms på noget andet",19.05.2023 00:00,,https://politiken.dk/indland/art9330845/F%C3%B8rst-skrev-Kofod-at-han-var-f%C3%A6rdig-med-politik.-Men-nu-tyder-kort-sms-p%C3%A5-noget-andet,Politiken,https://politiken.dk/nyheder/,"Hold dig opdateret pÃ¥ de seneste nyheder pÃ¥ politiken.dk: Seneste Politiken, Seneste Danmark, Seneste Kultur og Seneste Internationalt. ",Politiken,https://politiken.dk/nyheder/,02.05.2023 07:16
Frederiksen italesætter anstrengt forhold til fagbevægelse,20.05.2023 00:00,,https://politiken.dk/indland/art9330270/Frederiksen-itales%C3%A6tter-anstrengt-forhold-til-fagbev%C3%A6gelse,Politiken,https://politiken.dk/nyheder/,"Hold dig opdateret pÃ¥ de seneste nyheder pÃ¥ politiken.dk: Seneste Politiken, Seneste Danmark, Seneste Kultur og Seneste Internationalt. ",Politiken,https://politiken.dk/nyheder/,02.05.2023 07:16
Minister overvejer sejlforbud nær havvindmøller efter spionagesag,20.05.2023 00:00,,https://politiken.dk/indland/art9330870/Minister-overvejer-sejlforbud-n%C3%A6r-havvindm%C3%B8ller-efter-spionagesag,Politiken,https://politiken.dk/nyheder/,"Hold dig opdateret pÃ¥ de seneste nyheder pÃ¥ politiken.dk: Seneste Politiken, Seneste Danmark, Seneste Kultur og Seneste Internationalt. ",Politiken,https://politiken.dk/nyheder/,02.05.2023 07:16
Tyven havde efterladt et visitkort i Lars Dahlagers wc-kumme,20.05.2023 00:00,,https://politiken.dk/indland/art9323267/Tyven-havde-efterladt-et-visitkort-i-Lars-Dahlagers-wc-kumme,Politiken,https://politiken.dk/nyheder/,"Hold dig opdateret pÃ¥ de seneste nyheder pÃ¥ politiken.dk: Seneste Politiken, Seneste Danmark, Seneste Kultur og Seneste Internationalt. ",Politiken,https://politiken.dk/nyheder/,02.05.2023 07:16
Første interview med fotograf kører helt af sporet: »Jeg er egentlig rystet. Jeg forstår dig slet ikke«,20.05.2023 00:00,,https://politiken.dk/indland/art9287872/%C2%BBJeg-er-egentlig-rystet.-Jeg-forst%C3%A5r-dig-slet-ikke%C2%AB,Politiken,https://politiken.dk/nyheder/,"Hold dig opdateret pÃ¥ de seneste nyheder pÃ¥ politiken.dk: Seneste Politiken, Seneste Danmark, Seneste Kultur og Seneste Internationalt. ",Politiken,https://politiken.dk/nyheder/,02.05.2023 07:16
Jeppe Kofod forlader Folketinget: »Jeg glæder mig sindssygt til nye udfordringer«,03.05.2023 00:00,,https://politiken.dk/indland/politik/art9330084/%C2%BBJeg-gl%C3%A6der-mig-sindssygt-til-nye-udfordringer%C2%AB,Politiken,https://politiken.dk/nyheder/,"Hold dig opdateret pÃ¥ de seneste nyheder pÃ¥ politiken.dk: Seneste Politiken, Seneste Danmark, Seneste Kultur og Seneste Internationalt. ",Politiken,https://politiken.dk/nyheder/,02.05.2023 07:16
"»Man kan selvfølgelig ikke være formand i FH, hvis man har krænket sine yngre medarbejdere«",03.05.2023 00:00,,https://politiken.dk/indland/art9330005/%C2%BBMan-kan-selvf%C3%B8lgelig-ikke-v%C3%A6re-formand-i-FH-hvis-man-har-kr%C3%A6nket-sine-yngre-medarbejdere%C2%AB,Politiken,https://politiken.dk/nyheder/,"Hold dig opdateret pÃ¥ de seneste nyheder pÃ¥ politiken.dk: Seneste Politiken, Seneste Danmark, Seneste Kultur og Seneste Internationalt. ",Politiken,https://politiken.dk/nyheder/,02.05.2023 07:16
Fagbevægelsens nye frontfigur: Det er altid gået hurtigt for Morten Skov Christiansen,03.05.2023 00:00,,https://politiken.dk/indland/art9329722/Det-er-altid-g%C3%A5et-hurtigt-for-Morten-Skov-Christiansen,Politiken,https://politiken.dk/nyheder/,"Hold dig opdateret pÃ¥ de seneste nyheder pÃ¥ politiken.dk: Seneste Politiken, Seneste Danmark, Seneste Kultur og Seneste Internationalt. ",Politiken,https://politiken.dk/nyheder/,02.05.2023 07:16
Ombudsmanden: Digitaliseringen har ført til omsiggribende banale problemer for borgerne,03.05.2023 00:00,,https://politiken.dk/indland/art9309922/Digitaliseringen-har-f%C3%B8rt-til-omsiggribende-banale-problemer-for-borgerne,Politiken,https://politiken.dk/nyheder/,"Hold dig opdateret pÃ¥ de seneste nyheder pÃ¥ politiken.dk: Seneste Politiken, Seneste Danmark, Seneste Kultur og Seneste Internationalt. ",Politiken,https://politiken.dk/nyheder/,02.05.2023 07:16
Flere potentielle konspirationsteorier blev luftet på dramatisk krisemøde inden Lizette Risgaards afgang,03.05.2023 00:00,,https://politiken.dk/indland/art9329637/Flere-potentielle-konspirationsteorier-blev-luftet-p%C3%A5-dramatisk-krisem%C3%B8de-inden-Lizette-Risgaards-afgang,Politiken,https://politiken.dk/nyheder/,"Hold dig opdateret pÃ¥ de seneste nyheder pÃ¥ politiken.dk: Seneste Politiken, Seneste Danmark, Seneste Kultur og Seneste Internationalt. ",Politiken,https://politiken.dk/nyheder/,02.05.2023 07:16
"Hun købte en knaldrød Tesla for at vise, at HK er in the house - i weekenden blev det tydeligt for enhver",03.05.2023 00:00,,https://politiken.dk/indland/art9329721/Hun-k%C3%B8bte-en-knaldr%C3%B8d-Tesla-for-at-vise-at-HK-er-in-the-house-%E2%80%93-i-weekenden-blev-det-tydeligt-for-enhver,Politiken,https://politiken.dk/nyheder/,"Hold dig opdateret pÃ¥ de seneste nyheder pÃ¥ politiken.dk: Seneste Politiken, Seneste Danmark, Seneste Kultur og Seneste Internationalt. ",Politiken,https://politiken.dk/nyheder/,02.05.2023 07:16
"Her er de fem typer boomere, du bør lære at kende",03.05.2023 00:00,,https://politiken.dk/indland/art9323882/Her-er-de-fem-typer-boomere-du-b%C3%B8r-l%C3%A6re-at-kende,Politiken,https://politiken.dk/nyheder/,"Hold dig opdateret pÃ¥ de seneste nyheder pÃ¥ politiken.dk: Seneste Politiken, Seneste Danmark, Seneste Kultur og Seneste Internationalt. ",Politiken,https://politiken.dk/nyheder/,02.05.2023 07:16
Store fagforbund: Rigtigt af Lizette at gå af,03.05.2023 00:00,,https://politiken.dk/indland/art9329677/Rigtigt-af-Lizette-at-g%C3%A5-af,Politiken,https://politiken.dk/nyheder/,"Hold dig opdateret pÃ¥ de seneste nyheder pÃ¥ politiken.dk: Seneste Politiken, Seneste Danmark, Seneste Kultur og Seneste Internationalt. ",Politiken,https://politiken.dk/nyheder/,02.05.2023 07:16
Mand er død i arbejdsulykke på en landejendom,03.05.2023 00:00,,https://politiken.dk/indland/art9329629/Mand-er-d%C3%B8d-i-arbejdsulykke-p%C3%A5-en-landejendom,Politiken,https://politiken.dk/nyheder/,"Hold dig opdateret pÃ¥ de seneste nyheder pÃ¥ politiken.dk: Seneste Politiken, Seneste Danmark, Seneste Kultur og Seneste Internationalt. ",Politiken,https://politiken.dk/nyheder/,02.05.2023 07:16
