title,published,text,link,og:site_name,og:url,site_description,name,url,scrape_time
Samfund Lærere og elever flygter fra »fremtidens skole«,13.12.2022 00:00,,https://www.berlingske.dk/samfund/laerere-og-elever-flygter-fra-fremtidens-skole,Berlingske.dk,https://www.berlingske.dk/nyheder,Læs alle nyhederne fra Danmark og resten af verden på berlingske.dk. Med Berlingske Nyheder får du det seneste nyhedsoverblik fra både ind- og udland. ,Berlingske,https://www.berlingske.dk/nyheder,12.12.2022 07:20
Samfund 61-årig mand dræbt af skud i Grønland,13.12.2022 00:00,,https://www.berlingske.dk/samfund/61-aarig-mand-draebt-af-skud-i-groenland,Berlingske.dk,https://www.berlingske.dk/nyheder,Læs alle nyhederne fra Danmark og resten af verden på berlingske.dk. Med Berlingske Nyheder får du det seneste nyhedsoverblik fra både ind- og udland. ,Berlingske,https://www.berlingske.dk/nyheder,12.12.2022 07:20
"Samfund Abonnement Hjort har ændret syn på FE-sagen: »Jeg er død, inden denne sag er overstået«",13.12.2022 00:00,,https://www.berlingske.dk/samfund/hjort-har-aendret-syn-paa-fe-sagen-jeg-er-doed-inden-denne-sag-er,Berlingske.dk,https://www.berlingske.dk/nyheder,Læs alle nyhederne fra Danmark og resten af verden på berlingske.dk. Med Berlingske Nyheder får du det seneste nyhedsoverblik fra både ind- og udland. ,Berlingske,https://www.berlingske.dk/nyheder,12.12.2022 07:20
Politik Minkavlere vil kigge fremad og have afklaring på erstatning,13.12.2022 00:00,,https://www.berlingske.dk/politik/minkavlere-vil-kigge-fremad-og-have-afklaring-paa-erstatning,Berlingske.dk,https://www.berlingske.dk/nyheder,Læs alle nyhederne fra Danmark og resten af verden på berlingske.dk. Med Berlingske Nyheder får du det seneste nyhedsoverblik fra både ind- og udland. ,Berlingske,https://www.berlingske.dk/nyheder,12.12.2022 07:20
Internationalt Mand mistænkt for Lockerbie-bombe fængslet i USA,13.12.2022 00:00,,https://www.berlingske.dk/internationalt/mand-mistaenkt-for-lockerbie-bombe-faengslet-i-usa,Berlingske.dk,https://www.berlingske.dk/nyheder,Læs alle nyhederne fra Danmark og resten af verden på berlingske.dk. Med Berlingske Nyheder får du det seneste nyhedsoverblik fra både ind- og udland. ,Berlingske,https://www.berlingske.dk/nyheder,12.12.2022 07:20
Internationalt Antallet af højreekstreme er steget markant i Tyskland,13.12.2022 00:00,,https://www.berlingske.dk/internationalt/antallet-af-hoejreekstreme-er-steget-markant-i-tyskland,Berlingske.dk,https://www.berlingske.dk/nyheder,Læs alle nyhederne fra Danmark og resten af verden på berlingske.dk. Med Berlingske Nyheder får du det seneste nyhedsoverblik fra både ind- og udland. ,Berlingske,https://www.berlingske.dk/nyheder,12.12.2022 07:20
Samfund To kvinder er fængslet for at smugle kokain,13.12.2022 00:00,,https://www.berlingske.dk/samfund/to-kvinder-er-faengslet-for-at-smugle-kokain,Berlingske.dk,https://www.berlingske.dk/nyheder,Læs alle nyhederne fra Danmark og resten af verden på berlingske.dk. Med Berlingske Nyheder får du det seneste nyhedsoverblik fra både ind- og udland. ,Berlingske,https://www.berlingske.dk/nyheder,12.12.2022 07:20
Politik Løkke: Vi kan ikke føde regering der undersøger statsminister,13.12.2022 00:00,,https://www.berlingske.dk/politik/loekke-vi-kan-ikke-foede-regering-der-undersoeger-statsminister,Berlingske.dk,https://www.berlingske.dk/nyheder,Læs alle nyhederne fra Danmark og resten af verden på berlingske.dk. Med Berlingske Nyheder får du det seneste nyhedsoverblik fra både ind- og udland. ,Berlingske,https://www.berlingske.dk/nyheder,12.12.2022 07:20
Internationalt Britiske læger lovpriser ny vellykket kræftbehandling,13.12.2022 00:00,,https://www.berlingske.dk/internationalt/britiske-laeger-lovpriser-ny-vellykket-kraeftbehandling,Berlingske.dk,https://www.berlingske.dk/nyheder,Læs alle nyhederne fra Danmark og resten af verden på berlingske.dk. Med Berlingske Nyheder får du det seneste nyhedsoverblik fra både ind- og udland. ,Berlingske,https://www.berlingske.dk/nyheder,12.12.2022 07:20
Danmark Abonnement Lars Findsen er »vred og forarget« – og fortryder intet,13.12.2022 00:00,,https://www.berlingske.dk/danmark/lars-findsen-er-vred-og-forarget-og-fortryder-intet,Berlingske.dk,https://www.berlingske.dk/nyheder,Læs alle nyhederne fra Danmark og resten af verden på berlingske.dk. Med Berlingske Nyheder får du det seneste nyhedsoverblik fra både ind- og udland. ,Berlingske,https://www.berlingske.dk/nyheder,12.12.2022 07:20
Samfund Nyt retsmøde mandag i processen mod Lars Findsen,13.12.2022 00:00,,https://www.berlingske.dk/samfund/nyt-retsmoede-mandag-i-processen-mod-lars-findsen,Berlingske.dk,https://www.berlingske.dk/nyheder,Læs alle nyhederne fra Danmark og resten af verden på berlingske.dk. Med Berlingske Nyheder får du det seneste nyhedsoverblik fra både ind- og udland. ,Berlingske,https://www.berlingske.dk/nyheder,12.12.2022 07:20
Internationalt Eksplosion på kanaløen Jersey kan have kostet 15 livet,13.12.2022 00:00,,https://www.berlingske.dk/internationalt/eksplosion-paa-kanaloeen-jersey-kan-have-kostet-15-livet,Berlingske.dk,https://www.berlingske.dk/nyheder,Læs alle nyhederne fra Danmark og resten af verden på berlingske.dk. Med Berlingske Nyheder får du det seneste nyhedsoverblik fra både ind- og udland. ,Berlingske,https://www.berlingske.dk/nyheder,12.12.2022 07:20
Mærsk finder ny topchef i egne rækker,02.12.2022 00:00,,https://politiken.dk/indland/art9118608/M%C3%A6rsk-finder-ny-topchef-i-egne-r%C3%A6kker,Politiken,https://politiken.dk/nyheder/,"Hold dig opdateret pÃ¥ de seneste nyheder pÃ¥ politiken.dk: Seneste Politiken, Seneste Danmark, Seneste Kultur og Seneste Internationalt. ",Politiken,https://politiken.dk/nyheder/,12.12.2022 07:20
"Stadion kan genopstå på den anden side af kloden, når VM fylder 100 år",14.12.2022 00:00,,https://politiken.dk/sport/art9114709/Stadion-kan-genopst%C3%A5-p%C3%A5-den-anden-side-af-kloden-n%C3%A5r-VM-fylder-100-%C3%A5r,Politiken,https://politiken.dk/nyheder/,"Hold dig opdateret pÃ¥ de seneste nyheder pÃ¥ politiken.dk: Seneste Politiken, Seneste Danmark, Seneste Kultur og Seneste Internationalt. ",Politiken,https://politiken.dk/nyheder/,12.12.2022 07:20
Ellemanns løftebrud viser politisk format,12.12.2044 00:00,,https://politiken.dk/debat/ledere/art9118518/Ellemanns-l%C3%B8ftebrud-viser-politisk-format,Politiken,https://politiken.dk/nyheder/,"Hold dig opdateret pÃ¥ de seneste nyheder pÃ¥ politiken.dk: Seneste Politiken, Seneste Danmark, Seneste Kultur og Seneste Internationalt. ",Politiken,https://politiken.dk/nyheder/,12.12.2022 07:20
Iran henretter ung mand efter protester mod præstestyret,01.12.2022 00:00,,https://politiken.dk/udland/art9118543/Iran-henretter-ung-mand-efter-protester-mod-pr%C3%A6stestyret,Politiken,https://politiken.dk/nyheder/,"Hold dig opdateret pÃ¥ de seneste nyheder pÃ¥ politiken.dk: Seneste Politiken, Seneste Danmark, Seneste Kultur og Seneste Internationalt. ",Politiken,https://politiken.dk/nyheder/,12.12.2022 07:20
Ny lov: Afviste asylansøgere skal ud af Frankrig i ekspresfart,01.12.2022 00:00,,https://politiken.dk/udland/art9112557/Ny-lov-Afviste-asylans%C3%B8gere-skal-ud-af-Frankrig-i-ekspresfart,Politiken,https://politiken.dk/nyheder/,"Hold dig opdateret pÃ¥ de seneste nyheder pÃ¥ politiken.dk: Seneste Politiken, Seneste Danmark, Seneste Kultur og Seneste Internationalt. ",Politiken,https://politiken.dk/nyheder/,12.12.2022 07:20
Iskold luft fra Arktis lægger Danmark i fryseren,01.12.2022 00:00,,https://politiken.dk/indland/art9118531/Iskold-luft-fra-Arktis-l%C3%A6gger-Danmark-i-fryseren,Politiken,https://politiken.dk/nyheder/,"Hold dig opdateret pÃ¥ de seneste nyheder pÃ¥ politiken.dk: Seneste Politiken, Seneste Danmark, Seneste Kultur og Seneste Internationalt. ",Politiken,https://politiken.dk/nyheder/,12.12.2022 07:20
Houellebecq springer helt ud som som islam-hader og frygter den store udskiftning af hvide med farvede og muslimer,02.12.2022 00:00,,https://politiken.dk/kultur/art9111742/Houellebecq-springer-helt-ud-som-som-islam-hader-og-frygter-den-store-udskiftning-af-hvide-med-farvede-og-muslimer,Politiken,https://politiken.dk/nyheder/,"Hold dig opdateret pÃ¥ de seneste nyheder pÃ¥ politiken.dk: Seneste Politiken, Seneste Danmark, Seneste Kultur og Seneste Internationalt. ",Politiken,https://politiken.dk/nyheder/,12.12.2022 07:20
USAs finansminister forventer lavere inflation næste år,02.12.2022 00:00,,https://politiken.dk/udland/art9118512/USAs-finansminister-forventer-lavere-inflation-n%C3%A6ste-%C3%A5r,Politiken,https://politiken.dk/nyheder/,"Hold dig opdateret pÃ¥ de seneste nyheder pÃ¥ politiken.dk: Seneste Politiken, Seneste Danmark, Seneste Kultur og Seneste Internationalt. ",Politiken,https://politiken.dk/nyheder/,12.12.2022 07:20
Telefonnummer skal spare ældre for genindlæggelser,02.12.2022 00:00,,https://politiken.dk/forbrugogliv/sundhedogmotion/art9118515/Telefonnummer-skal-spare-%C3%A6ldre-for-genindl%C3%A6ggelser,Politiken,https://politiken.dk/nyheder/,"Hold dig opdateret pÃ¥ de seneste nyheder pÃ¥ politiken.dk: Seneste Politiken, Seneste Danmark, Seneste Kultur og Seneste Internationalt. ",Politiken,https://politiken.dk/nyheder/,12.12.2022 07:20
Peruanske demonstranter kræver fængslet ekspræsident løsladt,02.12.2022 00:00,,https://politiken.dk/udland/art9118507/Peruanske-demonstranter-kr%C3%A6ver-f%C3%A6ngslet-ekspr%C3%A6sident-l%C3%B8sladt,Politiken,https://politiken.dk/nyheder/,"Hold dig opdateret pÃ¥ de seneste nyheder pÃ¥ politiken.dk: Seneste Politiken, Seneste Danmark, Seneste Kultur og Seneste Internationalt. ",Politiken,https://politiken.dk/nyheder/,12.12.2022 07:20
27 dødfundne migranter i Zambia menes at være døde af sult,02.12.2022 00:00,,https://politiken.dk/udland/art9118502/27-d%C3%B8dfundne-migranter-i-Zambia-menes-at-v%C3%A6re-d%C3%B8de-af-sult,Politiken,https://politiken.dk/nyheder/,"Hold dig opdateret pÃ¥ de seneste nyheder pÃ¥ politiken.dk: Seneste Politiken, Seneste Danmark, Seneste Kultur og Seneste Internationalt. ",Politiken,https://politiken.dk/nyheder/,12.12.2022 07:20
Kina sender corona-app på pension efter mere end to år,02.12.2022 00:00,,https://politiken.dk/udland/art9118516/Kina-sender-corona-app-p%C3%A5-pension-efter-mere-end-to-%C3%A5r,Politiken,https://politiken.dk/nyheder/,"Hold dig opdateret pÃ¥ de seneste nyheder pÃ¥ politiken.dk: Seneste Politiken, Seneste Danmark, Seneste Kultur og Seneste Internationalt. ",Politiken,https://politiken.dk/nyheder/,12.12.2022 07:20
Biden lover Zelenskyj at styrke Ukraines luftforsvar,02.12.2022 00:00,,https://politiken.dk/udland/art9118510/Biden-lover-Zelenskyj-at-styrke-Ukraines-luftforsvar,Politiken,https://politiken.dk/nyheder/,"Hold dig opdateret pÃ¥ de seneste nyheder pÃ¥ politiken.dk: Seneste Politiken, Seneste Danmark, Seneste Kultur og Seneste Internationalt. ",Politiken,https://politiken.dk/nyheder/,12.12.2022 07:20
Haber måtte vente tålmodigt på gennembruddet,02.12.2022 00:00,,https://politiken.dk/navne/art9087364/Haber-m%C3%A5tte-vente-t%C3%A5lmodigt-p%C3%A5-gennembruddet,Politiken,https://politiken.dk/nyheder/,"Hold dig opdateret pÃ¥ de seneste nyheder pÃ¥ politiken.dk: Seneste Politiken, Seneste Danmark, Seneste Kultur og Seneste Internationalt. ",Politiken,https://politiken.dk/nyheder/,12.12.2022 07:20
Hank III er værd at følge ned i plovfuren,02.12.2022 00:00,,https://politiken.dk/navne/art9087428/Hank-III-er-v%C3%A6rd-at-f%C3%B8lge-ned-i-plovfuren,Politiken,https://politiken.dk/nyheder/,"Hold dig opdateret pÃ¥ de seneste nyheder pÃ¥ politiken.dk: Seneste Politiken, Seneste Danmark, Seneste Kultur og Seneste Internationalt. ",Politiken,https://politiken.dk/nyheder/,12.12.2022 07:20
"Hun er en af Danmarks store forfattere, men hun takker nej til offentlige optrædener",03.12.2022 00:00,,https://politiken.dk/navne/art9076503/Hun-er-en-af-Danmarks-store-forfattere-men-hun-takker-nej-til-offentlige-optr%C3%A6dener,Politiken,https://politiken.dk/nyheder/,"Hold dig opdateret pÃ¥ de seneste nyheder pÃ¥ politiken.dk: Seneste Politiken, Seneste Danmark, Seneste Kultur og Seneste Internationalt. ",Politiken,https://politiken.dk/nyheder/,12.12.2022 07:20
Turen fra Ãstafrika til København blev en forrygende succes,03.12.2022 00:00,,https://politiken.dk/navne/art9112383/Turen-fra-%C3%98stafrika-til-K%C3%B8benhavn-blev-en-forrygende-succes,Politiken,https://politiken.dk/nyheder/,"Hold dig opdateret pÃ¥ de seneste nyheder pÃ¥ politiken.dk: Seneste Politiken, Seneste Danmark, Seneste Kultur og Seneste Internationalt. ",Politiken,https://politiken.dk/nyheder/,12.12.2022 07:20
Sådan blev julehittet big business. Her er årets bedste,04.12.2022 00:00,,https://politiken.dk/podcast/dulyttertilpolitiken/art9117356/S%C3%A5dan-blev-julehittet-big-business.-Her-er-%C3%A5rets-bedste,Politiken,https://politiken.dk/nyheder/,"Hold dig opdateret pÃ¥ de seneste nyheder pÃ¥ politiken.dk: Seneste Politiken, Seneste Danmark, Seneste Kultur og Seneste Internationalt. ",Politiken,https://politiken.dk/nyheder/,12.12.2022 07:20
Efterspurgt fedmemiddel til salg i Danmark,09.12.2022 00:00,,https://politiken.dk/forbrugogliv/sundhedogmotion/art9118486/Efterspurgt-fedmemiddel-til-salg-i-Danmark,Politiken,https://politiken.dk/nyheder/,"Hold dig opdateret pÃ¥ de seneste nyheder pÃ¥ politiken.dk: Seneste Politiken, Seneste Danmark, Seneste Kultur og Seneste Internationalt. ",Politiken,https://politiken.dk/nyheder/,12.12.2022 07:20
Det Etiske Råd vil se på om dansk abortgrænse bør ændres,10.12.2022 00:00,,https://politiken.dk/indland/art9118465/Det-Etiske-R%C3%A5d-vil-se-p%C3%A5-om-dansk-abortgr%C3%A6nse-b%C3%B8r-%C3%A6ndres,Politiken,https://politiken.dk/nyheder/,"Hold dig opdateret pÃ¥ de seneste nyheder pÃ¥ politiken.dk: Seneste Politiken, Seneste Danmark, Seneste Kultur og Seneste Internationalt. ",Politiken,https://politiken.dk/nyheder/,12.12.2022 07:20
"Hendes gæst konkluderer, at sex i højere grad har været udbytteøkonomi for hende end nydelse",10.12.2022 00:00,,https://politiken.dk/kultur/set_og_hoert/art8977163/Hendes-g%C3%A6st-konkluderer-at-sex-i-h%C3%B8jere-grad-har-v%C3%A6ret-udbytte%C3%B8konomi-for-hende-end-nydelse,Politiken,https://politiken.dk/nyheder/,"Hold dig opdateret pÃ¥ de seneste nyheder pÃ¥ politiken.dk: Seneste Politiken, Seneste Danmark, Seneste Kultur og Seneste Internationalt. ",Politiken,https://politiken.dk/nyheder/,12.12.2022 07:20
Rumkapsel er tilbage på Jorden efter tur rundt om Månen,10.12.2022 00:00,,https://politiken.dk/viden/Viden/art9118431/Rumkapsel-er-tilbage-p%C3%A5-Jorden-efter-tur-rundt-om-M%C3%A5nen,Politiken,https://politiken.dk/nyheder/,"Hold dig opdateret pÃ¥ de seneste nyheder pÃ¥ politiken.dk: Seneste Politiken, Seneste Danmark, Seneste Kultur og Seneste Internationalt. ",Politiken,https://politiken.dk/nyheder/,12.12.2022 07:20
Politiken mener: Pas på mændene i den kommende tid,11.12.2022 00:00,,https://politiken.dk/debat/ledere/art9114859/Pas-p%C3%A5-m%C3%A6ndene-i-den-kommende-tid,Politiken,https://politiken.dk/nyheder/,"Hold dig opdateret pÃ¥ de seneste nyheder pÃ¥ politiken.dk: Seneste Politiken, Seneste Danmark, Seneste Kultur og Seneste Internationalt. ",Politiken,https://politiken.dk/nyheder/,12.12.2022 07:20
Mand mister livet efter kæntring i Lillebælt,11.12.2022 00:00,,https://politiken.dk/indland/art9118442/Mand-mister-livet-efter-k%C3%A6ntring-i-Lilleb%C3%A6lt,Politiken,https://politiken.dk/nyheder/,"Hold dig opdateret pÃ¥ de seneste nyheder pÃ¥ politiken.dk: Seneste Politiken, Seneste Danmark, Seneste Kultur og Seneste Internationalt. ",Politiken,https://politiken.dk/nyheder/,12.12.2022 07:20
Omfattende efterforskning mod skandaleramt lægehus er nu afsluttet,11.12.2022 00:00,,https://politiken.dk/indland/art9114421/Omfattende-efterforskning-mod-skandaleramt-l%C3%A6gehus-er-nu-afsluttet,Politiken,https://politiken.dk/nyheder/,"Hold dig opdateret pÃ¥ de seneste nyheder pÃ¥ politiken.dk: Seneste Politiken, Seneste Danmark, Seneste Kultur og Seneste Internationalt. ",Politiken,https://politiken.dk/nyheder/,12.12.2022 07:20
Måske har vi større problemer end klimakrisen,11.12.2022 00:00,,https://politiken.dk/viden/art9108475/M%C3%A5ske-har-vi-st%C3%B8rre-problemer-end-klimakrisen,Politiken,https://politiken.dk/nyheder/,"Hold dig opdateret pÃ¥ de seneste nyheder pÃ¥ politiken.dk: Seneste Politiken, Seneste Danmark, Seneste Kultur og Seneste Internationalt. ",Politiken,https://politiken.dk/nyheder/,12.12.2022 07:20
»Jeg slår jer alle sammen ihjel«: Mand skyder og dræber tre kvinder på beboermøde i Rom,11.12.2022 00:00,,https://politiken.dk/udland/art9118454/Mand-skyder-og-dr%C3%A6ber-tre-kvinder-p%C3%A5-beboerm%C3%B8de-i-Rom,Politiken,https://politiken.dk/nyheder/,"Hold dig opdateret pÃ¥ de seneste nyheder pÃ¥ politiken.dk: Seneste Politiken, Seneste Danmark, Seneste Kultur og Seneste Internationalt. ",Politiken,https://politiken.dk/nyheder/,12.12.2022 07:20
"»Jeg har været domineret af de mænd. Magtfar, krigsfar, kunstnerfar, værtshusfar ...«",12.12.2022 00:00,,https://politiken.dk/kultur/boger/art9090820/%C2%BBJeg-har-v%C3%A6ret-domineret-af-de-m%C3%A6nd.-Magtfar-krigsfar-kunstnerfar-v%C3%A6rtshusfar-...%C2%AB,Politiken,https://politiken.dk/nyheder/,"Hold dig opdateret pÃ¥ de seneste nyheder pÃ¥ politiken.dk: Seneste Politiken, Seneste Danmark, Seneste Kultur og Seneste Internationalt. ",Politiken,https://politiken.dk/nyheder/,12.12.2022 07:20
Denne gang står Viktor OrbÃ¡n fuldstændig mutters alene. Selv polakkerne er rasende på ham,12.12.2022 00:00,,https://politiken.dk/udland/art9114452/Denne-gang-st%C3%A5r-Viktor-Orb%C3%A1n-fuldst%C3%A6ndig-mutters-alene.-Selv-polakkerne-er-rasende-p%C3%A5-ham,Politiken,https://politiken.dk/nyheder/,"Hold dig opdateret pÃ¥ de seneste nyheder pÃ¥ politiken.dk: Seneste Politiken, Seneste Danmark, Seneste Kultur og Seneste Internationalt. ",Politiken,https://politiken.dk/nyheder/,12.12.2022 07:20
"Hun er fyldt 101 år. Og når hun kigger på København i dag, lægger hun især mærke til noget særligt ved mændene ved Søerne",12.12.2022 00:00,,https://politiken.dk/ibyen/art9055829/Hun-er-fyldt-101-%C3%A5r.-Og-n%C3%A5r-hun-kigger-p%C3%A5-K%C3%B8benhavn-i-dag-l%C3%A6gger-hun-is%C3%A6r-m%C3%A6rke-til-noget-s%C3%A6rligt-ved-m%C3%A6ndene-ved-S%C3%B8erne,Politiken,https://politiken.dk/nyheder/,"Hold dig opdateret pÃ¥ de seneste nyheder pÃ¥ politiken.dk: Seneste Politiken, Seneste Danmark, Seneste Kultur og Seneste Internationalt. ",Politiken,https://politiken.dk/nyheder/,12.12.2022 07:20
"»Hvis man sælger en mindre lejlighed og skal flytte i noget større, er det en gylden mulighed«",12.12.2022 00:00,,https://politiken.dk/indland/art9118193/%C2%BBHvis-man-s%C3%A6lger-en-mindre-lejlighed-og-skal-flytte-i-noget-st%C3%B8rre-er-det-en-gylden-mulighed%C2%AB,Politiken,https://politiken.dk/nyheder/,"Hold dig opdateret pÃ¥ de seneste nyheder pÃ¥ politiken.dk: Seneste Politiken, Seneste Danmark, Seneste Kultur og Seneste Internationalt. ",Politiken,https://politiken.dk/nyheder/,12.12.2022 07:20
Mette Frederiksen forventer at forhandle om bred regering igen mandag,13.12.2022 00:00,,https://politiken.dk/indland/art9118416/Mette-Frederiksen-forventer-at-forhandle-om-bred-regering-igen-mandag,Politiken,https://politiken.dk/nyheder/,"Hold dig opdateret pÃ¥ de seneste nyheder pÃ¥ politiken.dk: Seneste Politiken, Seneste Danmark, Seneste Kultur og Seneste Internationalt. ",Politiken,https://politiken.dk/nyheder/,12.12.2022 07:20
Ronaldo sætter ord på exit: Min VM-drøm sluttede i går,13.12.2022 00:00,,https://politiken.dk/sport/art9118331/Min-VM-dr%C3%B8m-sluttede-i-g%C3%A5r,Politiken,https://politiken.dk/nyheder/,"Hold dig opdateret pÃ¥ de seneste nyheder pÃ¥ politiken.dk: Seneste Politiken, Seneste Danmark, Seneste Kultur og Seneste Internationalt. ",Politiken,https://politiken.dk/nyheder/,12.12.2022 07:20
Per Lykke: Nutidens svar på -Vinterbyøster- savnes,13.12.2022 00:00,,https://politiken.dk/debat/klummer/art9117203/Nutidens-svar-p%C3%A5-%E2%80%99Vinterby%C3%B8ster%E2%80%99-savnes,Politiken,https://politiken.dk/nyheder/,"Hold dig opdateret pÃ¥ de seneste nyheder pÃ¥ politiken.dk: Seneste Politiken, Seneste Danmark, Seneste Kultur og Seneste Internationalt. ",Politiken,https://politiken.dk/nyheder/,12.12.2022 07:20
"Dyrlæge for hjemløses hunde: »Jeg har lært, at samfundet kun er for os, der passer ind i kasser«",14.12.2022 00:00,,https://politiken.dk/indland/art9091067/%C2%BBJeg-har-l%C3%A6rt-at-samfundet-kun-er-for-os-der-passer-ind-i-kasser%C2%AB,Politiken,https://politiken.dk/nyheder/,"Hold dig opdateret pÃ¥ de seneste nyheder pÃ¥ politiken.dk: Seneste Politiken, Seneste Danmark, Seneste Kultur og Seneste Internationalt. ",Politiken,https://politiken.dk/nyheder/,12.12.2022 07:20
"Han er manden bag den berømte replik, som nærmest blev en landeplage. Lørdag modtog han yderst fornem pris",14.12.2022 00:00,,https://politiken.dk/kultur/film_og_tv/art9118203/Han-er-manden-bag-den-ber%C3%B8mte-replik-som-n%C3%A6rmest-blev-en-landeplage.-L%C3%B8rdag-modtog-han-yderst-fornem-pris,Politiken,https://politiken.dk/nyheder/,"Hold dig opdateret pÃ¥ de seneste nyheder pÃ¥ politiken.dk: Seneste Politiken, Seneste Danmark, Seneste Kultur og Seneste Internationalt. ",Politiken,https://politiken.dk/nyheder/,12.12.2022 07:20
"»Politik, når det er værst«: Blå partier tordner mod Ellemann og Løkke",14.12.2022 00:00,,https://politiken.dk/indland/art9118361/Bl%C3%A5-partier-tordner-mod-Ellemann-og-L%C3%B8kke,Politiken,https://politiken.dk/nyheder/,"Hold dig opdateret pÃ¥ de seneste nyheder pÃ¥ politiken.dk: Seneste Politiken, Seneste Danmark, Seneste Kultur og Seneste Internationalt. ",Politiken,https://politiken.dk/nyheder/,12.12.2022 07:20
"Længes du efter røgfyldte klubber og ny musik i gammel stil, er det et perfekt album",15.12.2022 00:00,,https://politiken.dk/kultur/musik/art9105537/L%C3%A6nges-du-efter-r%C3%B8gfyldte-klubber-og-ny-musik-i-gammel-stil-er-det-et-perfekt-album,Politiken,https://politiken.dk/nyheder/,"Hold dig opdateret pÃ¥ de seneste nyheder pÃ¥ politiken.dk: Seneste Politiken, Seneste Danmark, Seneste Kultur og Seneste Internationalt. ",Politiken,https://politiken.dk/nyheder/,12.12.2022 07:20
Ellemann dropper krav om advokatvurdering i Minksagen,15.12.2022 00:00,,https://politiken.dk/indland/art9118299/Ellemann-dropper-krav-om-advokatvurdering-i-Minksagen,Politiken,https://politiken.dk/nyheder/,"Hold dig opdateret pÃ¥ de seneste nyheder pÃ¥ politiken.dk: Seneste Politiken, Seneste Danmark, Seneste Kultur og Seneste Internationalt. ",Politiken,https://politiken.dk/nyheder/,12.12.2022 07:20
Flertal er væk: Ellemann erkender nyt løftebrud og dropper advokatvurdering i minksagen,15.12.2022 00:00,,https://politiken.dk/indland/art9118279/Ellemann-erkender-nyt-l%C3%B8ftebrud-og-dropper-advokatvurdering-i-minksagen,Politiken,https://politiken.dk/nyheder/,"Hold dig opdateret pÃ¥ de seneste nyheder pÃ¥ politiken.dk: Seneste Politiken, Seneste Danmark, Seneste Kultur og Seneste Internationalt. ",Politiken,https://politiken.dk/nyheder/,12.12.2022 07:20
Anden halvleg: Jeg orker ikke flere ønskesedler. Måske er jeg et skidt menneske,15.12.2022 00:00,,https://politiken.dk/indland/art9112396/Jeg-orker-ikke-flere-%C3%B8nskesedler.-M%C3%A5ske-er-jeg-et-skidt-menneske,Politiken,https://politiken.dk/nyheder/,"Hold dig opdateret pÃ¥ de seneste nyheder pÃ¥ politiken.dk: Seneste Politiken, Seneste Danmark, Seneste Kultur og Seneste Internationalt. ",Politiken,https://politiken.dk/nyheder/,12.12.2022 07:20
Julen sejles ind på Rhinen,16.12.2022 00:00,,https://politiken.dk/rejser/art8988626/Julen-sejles-ind-p%C3%A5-Rhinen,Politiken,https://politiken.dk/nyheder/,"Hold dig opdateret pÃ¥ de seneste nyheder pÃ¥ politiken.dk: Seneste Politiken, Seneste Danmark, Seneste Kultur og Seneste Internationalt. ",Politiken,https://politiken.dk/nyheder/,12.12.2022 07:20
"Anmelder: »Det er pragtfuld læsning, som enhver bør unde sig selv«",16.12.2022 00:00,,https://politiken.dk/kultur/boger/art9109463/%C2%BBDet-er-pragtfuld-l%C3%A6sning-som-enhver-b%C3%B8r-unde-sig-selv%C2%AB,Politiken,https://politiken.dk/nyheder/,"Hold dig opdateret pÃ¥ de seneste nyheder pÃ¥ politiken.dk: Seneste Politiken, Seneste Danmark, Seneste Kultur og Seneste Internationalt. ",Politiken,https://politiken.dk/nyheder/,12.12.2022 07:20
Mand mistænkt for Lockerbie-bombe fængslet i USA,16.12.2022 00:00,,https://politiken.dk/udland/art9118281/Mand-mist%C3%A6nkt-for-Lockerbie-bombe-f%C3%A6ngslet-i-USA,Politiken,https://politiken.dk/nyheder/,"Hold dig opdateret pÃ¥ de seneste nyheder pÃ¥ politiken.dk: Seneste Politiken, Seneste Danmark, Seneste Kultur og Seneste Internationalt. ",Politiken,https://politiken.dk/nyheder/,12.12.2022 07:20
Vi jævner den bæredygtige fremtid med jorden,17.12.2022 00:00,,https://politiken.dk/debat/kroniken/art9114951/Vi-j%C3%A6vner-den-b%C3%A6redygtige-fremtid-med-jorden,Politiken,https://politiken.dk/nyheder/,"Hold dig opdateret pÃ¥ de seneste nyheder pÃ¥ politiken.dk: Seneste Politiken, Seneste Danmark, Seneste Kultur og Seneste Internationalt. ",Politiken,https://politiken.dk/nyheder/,12.12.2022 07:20
"Ny bog sætter fokus på kvindernes rolle i dansk landbrug: »Han siger, at han får aldrig et billigere udmugningsanlæg end det, han har. Det har altid været mig«",18.12.2022 00:00,,https://politiken.dk/kultur/art9100037/%C2%BBHan-siger-at-han-f%C3%A5r-aldrig-et-billigere-udmugningsanl%C3%A6g-end-det-han-har.-Det-har-altid-v%C3%A6ret-mig%C2%AB,Politiken,https://politiken.dk/nyheder/,"Hold dig opdateret pÃ¥ de seneste nyheder pÃ¥ politiken.dk: Seneste Politiken, Seneste Danmark, Seneste Kultur og Seneste Internationalt. ",Politiken,https://politiken.dk/nyheder/,12.12.2022 07:20
