title,published,text,link,og:site_name,og:url,site_description,name,url,scrape_time
"Amalie Kestler: Mette Frederiksen mangler det, hun selv var for Thorning",02.05.2023 00:00,,https://politiken.dk/debat/klummer/art9305393/Mette-Frederiksen-mangler-det-hun-selv-var-for-Thorning,Politiken,https://politiken.dk/nyheder/,"Hold dig opdateret pÃ¥ de seneste nyheder pÃ¥ politiken.dk: Seneste Politiken, Seneste Danmark, Seneste Kultur og Seneste Internationalt. ",Politiken,https://politiken.dk/nyheder/,01.05.2023 07:17
200 betjente i Texas jager mand anklaget for at dræbe en række naboer,02.05.2023 00:00,,https://politiken.dk/udland/art9329956/200-betjente-i-Texas-jager-mand-anklaget-for-at-dr%C3%A6be-en-r%C3%A6kke-naboer,Politiken,https://politiken.dk/nyheder/,"Hold dig opdateret pÃ¥ de seneste nyheder pÃ¥ politiken.dk: Seneste Politiken, Seneste Danmark, Seneste Kultur og Seneste Internationalt. ",Politiken,https://politiken.dk/nyheder/,01.05.2023 07:17
Wagner-leder: »Denne modoffensiv kan blive en tragedie for vores land«,03.05.2023 00:00,,https://politiken.dk/udland/art9329957/%C2%BBDenne-modoffensiv-kan-blive-en-tragedie-for-vores-land%C2%AB,Politiken,https://politiken.dk/nyheder/,"Hold dig opdateret pÃ¥ de seneste nyheder pÃ¥ politiken.dk: Seneste Politiken, Seneste Danmark, Seneste Kultur og Seneste Internationalt. ",Politiken,https://politiken.dk/nyheder/,01.05.2023 07:17
Kunstig intelligens - skal vi juble eller være bange?,05.05.2023 00:00,,https://politiken.dk/podcast/dulyttertilpolitiken/art9328463/Kunstig-intelligens-%E2%80%93-skal-vi-juble-eller-v%C3%A6re-bange,Politiken,https://politiken.dk/nyheder/,"Hold dig opdateret pÃ¥ de seneste nyheder pÃ¥ politiken.dk: Seneste Politiken, Seneste Danmark, Seneste Kultur og Seneste Internationalt. ",Politiken,https://politiken.dk/nyheder/,01.05.2023 07:17
Holger Rune taber nattegyser i Madrid,08.05.2023 00:00,,https://politiken.dk/sport/tennis/art9329948/Holger-Rune-taber-nattegyser-i-Madrid,Politiken,https://politiken.dk/nyheder/,"Hold dig opdateret pÃ¥ de seneste nyheder pÃ¥ politiken.dk: Seneste Politiken, Seneste Danmark, Seneste Kultur og Seneste Internationalt. ",Politiken,https://politiken.dk/nyheder/,01.05.2023 07:17
Amerikansk rigmand bruger to millioner dollars om året på at holde sig ung. Jeg forstår ham - næsten,10.05.2023 00:00,,https://politiken.dk/kultur/boger/art9318193/Amerikansk-rigmand-bruger-to-millioner-dollars-om-%C3%A5ret-p%C3%A5-at-holde-sig-ung.-Jeg-forst%C3%A5r-ham-%E2%80%93-n%C3%A6sten,Politiken,https://politiken.dk/nyheder/,"Hold dig opdateret pÃ¥ de seneste nyheder pÃ¥ politiken.dk: Seneste Politiken, Seneste Danmark, Seneste Kultur og Seneste Internationalt. ",Politiken,https://politiken.dk/nyheder/,01.05.2023 07:17
Erdogan: Tyrkiske soldater har dræbt IS-leder i Syrien,10.05.2023 00:00,,https://politiken.dk/udland/art9329936/Tyrkiske-soldater-har-dr%C3%A6bt-IS-leder-i-Syrien,Politiken,https://politiken.dk/nyheder/,"Hold dig opdateret pÃ¥ de seneste nyheder pÃ¥ politiken.dk: Seneste Politiken, Seneste Danmark, Seneste Kultur og Seneste Internationalt. ",Politiken,https://politiken.dk/nyheder/,01.05.2023 07:17
Lastbilchauffør: Regeringens nye grønne initiativ på transportområdet er det rene greenwashing,10.05.2023 00:00,,https://politiken.dk/debat/art9326319/Regeringens-nye-gr%C3%B8nne-initiativ-p%C3%A5-transportomr%C3%A5det-er-det-rene-greenwashing,Politiken,https://politiken.dk/nyheder/,"Hold dig opdateret pÃ¥ de seneste nyheder pÃ¥ politiken.dk: Seneste Politiken, Seneste Danmark, Seneste Kultur og Seneste Internationalt. ",Politiken,https://politiken.dk/nyheder/,01.05.2023 07:17
"Her er de seks mest interessante film og serier, du bør streame i maj",10.05.2023 00:00,,https://politiken.dk/kultur/film_og_tv/art9170492/Her-er-de-seks-mest-interessante-film-og-serier-du-b%C3%B8r-streame-i-maj,Politiken,https://politiken.dk/nyheder/,"Hold dig opdateret pÃ¥ de seneste nyheder pÃ¥ politiken.dk: Seneste Politiken, Seneste Danmark, Seneste Kultur og Seneste Internationalt. ",Politiken,https://politiken.dk/nyheder/,01.05.2023 07:17
Alle skal yde mere siger regeringen. Så hvorfor sænker den skatten for de allerrigeste og mest privilegerede?,12.05.2023 00:00,,https://politiken.dk/debat/ledere/art9324896/Alle-skal-yde-mere-siger-regeringen.-S%C3%A5-hvorfor-s%C3%A6nker-den-skatten-for-de-allerrigeste-og-mest-privilegerede,Politiken,https://politiken.dk/nyheder/,"Hold dig opdateret pÃ¥ de seneste nyheder pÃ¥ politiken.dk: Seneste Politiken, Seneste Danmark, Seneste Kultur og Seneste Internationalt. ",Politiken,https://politiken.dk/nyheder/,01.05.2023 07:17
Vi kender dem alle i mere eller mindre fortyndet udgave: De løsgående menneskelige missiler,12.05.2023 00:00,,https://politiken.dk/kultur/boger/boganmeldelser/faglitteratur_boger/art9319681/Vi-kender-dem-alle-i-mere-eller-mindre-fortyndet-udgave-De-l%C3%B8sg%C3%A5ende-menneskelige-missiler,Politiken,https://politiken.dk/nyheder/,"Hold dig opdateret pÃ¥ de seneste nyheder pÃ¥ politiken.dk: Seneste Politiken, Seneste Danmark, Seneste Kultur og Seneste Internationalt. ",Politiken,https://politiken.dk/nyheder/,01.05.2023 07:17
AGF sparker trods træners hovedpine døren til mesterskabet på vid gab,12.05.2023 00:00,,https://politiken.dk/sport/art9322837/AGF-sparker-trods-tr%C3%A6ners-hovedpine-d%C3%B8ren-til-mesterskabet-p%C3%A5-vid-gab,Politiken,https://politiken.dk/nyheder/,"Hold dig opdateret pÃ¥ de seneste nyheder pÃ¥ politiken.dk: Seneste Politiken, Seneste Danmark, Seneste Kultur og Seneste Internationalt. ",Politiken,https://politiken.dk/nyheder/,01.05.2023 07:17
Færøerne booker historisk billet til håndbold-EM,12.05.2023 00:00,,https://politiken.dk/sport/haandbold/art9329864/F%C3%A6r%C3%B8erne-booker-historisk-billet-til-h%C3%A5ndbold-EM,Politiken,https://politiken.dk/nyheder/,"Hold dig opdateret pÃ¥ de seneste nyheder pÃ¥ politiken.dk: Seneste Politiken, Seneste Danmark, Seneste Kultur og Seneste Internationalt. ",Politiken,https://politiken.dk/nyheder/,01.05.2023 07:17
Efter en skidt sæson sætter Brøndby plaster på såret mod ærkerivalerne,12.05.2023 00:00,,https://politiken.dk/sport/art9322834/Efter-en-skidt-s%C3%A6son-s%C3%A6tter-Br%C3%B8ndby-plaster-p%C3%A5-s%C3%A5ret-mod-%C3%A6rkerivalerne,Politiken,https://politiken.dk/nyheder/,"Hold dig opdateret pÃ¥ de seneste nyheder pÃ¥ politiken.dk: Seneste Politiken, Seneste Danmark, Seneste Kultur og Seneste Internationalt. ",Politiken,https://politiken.dk/nyheder/,01.05.2023 07:17
Flere potentielle konspirationsteorier blev luftet på dramatisk krisemøde inden Lizette Risgaards afgang,13.05.2023 00:00,,https://politiken.dk/indland/art9329637/Flere-potentielle-konspirationsteorier-blev-luftet-p%C3%A5-dramatisk-krisem%C3%B8de-inden-Lizette-Risgaards-afgang,Politiken,https://politiken.dk/nyheder/,"Hold dig opdateret pÃ¥ de seneste nyheder pÃ¥ politiken.dk: Seneste Politiken, Seneste Danmark, Seneste Kultur og Seneste Internationalt. ",Politiken,https://politiken.dk/nyheder/,01.05.2023 07:17
Alle de mandlige karakterer får hugget dilleren af,14.05.2023 00:00,,https://politiken.dk/kultur/scene/art9284567/Alle-de-mandlige-karakterer-f%C3%A5r-hugget-dilleren-af,Politiken,https://politiken.dk/nyheder/,"Hold dig opdateret pÃ¥ de seneste nyheder pÃ¥ politiken.dk: Seneste Politiken, Seneste Danmark, Seneste Kultur og Seneste Internationalt. ",Politiken,https://politiken.dk/nyheder/,01.05.2023 07:17
"Sjælden titel til succes-danskere, mens festen i Napoli er udsat",14.05.2023 00:00,,https://politiken.dk/sport/art9328831/Sj%C3%A6lden-titel-til-succes-danskere-mens-festen-i-Napoli-er-udsat,Politiken,https://politiken.dk/nyheder/,"Hold dig opdateret pÃ¥ de seneste nyheder pÃ¥ politiken.dk: Seneste Politiken, Seneste Danmark, Seneste Kultur og Seneste Internationalt. ",Politiken,https://politiken.dk/nyheder/,01.05.2023 07:17
"Hun købte en knaldrød Tesla for at vise, at HK er in the house - i weekenden blev det tydeligt for enhver",14.05.2023 00:00,,https://politiken.dk/indland/art9329721/Hun-k%C3%B8bte-en-knaldr%C3%B8d-Tesla-for-at-vise-at-HK-er-in-the-house-%E2%80%93-i-weekenden-blev-det-tydeligt-for-enhver,Politiken,https://politiken.dk/nyheder/,"Hold dig opdateret pÃ¥ de seneste nyheder pÃ¥ politiken.dk: Seneste Politiken, Seneste Danmark, Seneste Kultur og Seneste Internationalt. ",Politiken,https://politiken.dk/nyheder/,01.05.2023 07:17
Sådan er det gået i weekendens dramatiske Superliga-runde,15.05.2023 00:00,,https://politiken.dk/sport/art9329118/S%C3%A5dan-er-det-g%C3%A5et-i-weekendens-dramatiske-Superliga-runde,Politiken,https://politiken.dk/nyheder/,"Hold dig opdateret pÃ¥ de seneste nyheder pÃ¥ politiken.dk: Seneste Politiken, Seneste Danmark, Seneste Kultur og Seneste Internationalt. ",Politiken,https://politiken.dk/nyheder/,01.05.2023 07:17
Hollywoodselskaber overbød hinanden for at få rettighederne til hendes thrillere,16.05.2023 00:00,,https://politiken.dk/kultur/boger/art9318181/Hollywoodselskaber-overb%C3%B8d-hinanden-for-at-f%C3%A5-rettighederne-til-hendes-thrillere,Politiken,https://politiken.dk/nyheder/,"Hold dig opdateret pÃ¥ de seneste nyheder pÃ¥ politiken.dk: Seneste Politiken, Seneste Danmark, Seneste Kultur og Seneste Internationalt. ",Politiken,https://politiken.dk/nyheder/,01.05.2023 07:17
Nu står verden ikke længere. Livgarden er gået til scenen!,17.05.2023 00:00,,https://politiken.dk/kultur/scene/art9177041/Nu-st%C3%A5r-verden-ikke-l%C3%A6ngere.-Livgarden-er-g%C3%A5et-til-scenen,Politiken,https://politiken.dk/nyheder/,"Hold dig opdateret pÃ¥ de seneste nyheder pÃ¥ politiken.dk: Seneste Politiken, Seneste Danmark, Seneste Kultur og Seneste Internationalt. ",Politiken,https://politiken.dk/nyheder/,01.05.2023 07:17
#SheToo? Liderlig kulturordfører får baghjul af kvindelig fagforeningsboss,17.05.2023 00:00,,https://politiken.dk/magasinet/sketiugen/art9317934/SheToo-Liderlig-kulturordf%C3%B8rer-f%C3%A5r-baghjul-af-kvindelig-fagforeningsboss,Politiken,https://politiken.dk/nyheder/,"Hold dig opdateret pÃ¥ de seneste nyheder pÃ¥ politiken.dk: Seneste Politiken, Seneste Danmark, Seneste Kultur og Seneste Internationalt. ",Politiken,https://politiken.dk/nyheder/,01.05.2023 07:17
Så er der ellers dømt dansk dødsdisco,17.05.2023 00:00,,https://politiken.dk/kultur/musik/art9320654/S%C3%A5-er-der-ellers-d%C3%B8mt-dansk-d%C3%B8dsdisco,Politiken,https://politiken.dk/nyheder/,"Hold dig opdateret pÃ¥ de seneste nyheder pÃ¥ politiken.dk: Seneste Politiken, Seneste Danmark, Seneste Kultur og Seneste Internationalt. ",Politiken,https://politiken.dk/nyheder/,01.05.2023 07:17
Studerende har forandret sig. Det skal uddannelserne også,17.05.2023 00:00,,https://politiken.dk/debat/kroniken/art9291162/Studerende-har-forandret-sig.-Det-skal-uddannelserne-ogs%C3%A5,Politiken,https://politiken.dk/nyheder/,"Hold dig opdateret pÃ¥ de seneste nyheder pÃ¥ politiken.dk: Seneste Politiken, Seneste Danmark, Seneste Kultur og Seneste Internationalt. ",Politiken,https://politiken.dk/nyheder/,01.05.2023 07:17
Magnussen slutter som nummer 13 i Red Bulls legestue,18.05.2023 00:00,,https://politiken.dk/sport/formel1/art9329735/Magnussen-slutter-som-nummer-13-i-Red-Bulls-legestue,Politiken,https://politiken.dk/nyheder/,"Hold dig opdateret pÃ¥ de seneste nyheder pÃ¥ politiken.dk: Seneste Politiken, Seneste Danmark, Seneste Kultur og Seneste Internationalt. ",Politiken,https://politiken.dk/nyheder/,01.05.2023 07:17
"Universiteter, pengefolk og virksomheder reagerer på Putin",18.05.2023 00:00,,https://politiken.dk/debat/klummer/jarlner/art9322817/Universiteter-pengefolk-og-virksomheder-reagerer-p%C3%A5-Putin,Politiken,https://politiken.dk/nyheder/,"Hold dig opdateret pÃ¥ de seneste nyheder pÃ¥ politiken.dk: Seneste Politiken, Seneste Danmark, Seneste Kultur og Seneste Internationalt. ",Politiken,https://politiken.dk/nyheder/,01.05.2023 07:17
Mindst 11 omkom ved gasudslip i det nordlige Indien,19.05.2023 00:00,,https://politiken.dk/udland/art9329718/Mindst-11-omkom-ved-gasudslip-i-det-nordlige-Indien,Politiken,https://politiken.dk/nyheder/,"Hold dig opdateret pÃ¥ de seneste nyheder pÃ¥ politiken.dk: Seneste Politiken, Seneste Danmark, Seneste Kultur og Seneste Internationalt. ",Politiken,https://politiken.dk/nyheder/,01.05.2023 07:17
FN-diplomater holder hemmeligt møde om Taleban,19.05.2023 00:00,,https://politiken.dk/udland/art9329682/FN-diplomater-holder-hemmeligt-m%C3%B8de-om-Taleban,Politiken,https://politiken.dk/nyheder/,"Hold dig opdateret pÃ¥ de seneste nyheder pÃ¥ politiken.dk: Seneste Politiken, Seneste Danmark, Seneste Kultur og Seneste Internationalt. ",Politiken,https://politiken.dk/nyheder/,01.05.2023 07:17
Store fagforbund: Rigtigt af Lizette at gå af,20.05.2023 00:00,,https://politiken.dk/indland/art9329677/Rigtigt-af-Lizette-at-g%C3%A5-af,Politiken,https://politiken.dk/nyheder/,"Hold dig opdateret pÃ¥ de seneste nyheder pÃ¥ politiken.dk: Seneste Politiken, Seneste Danmark, Seneste Kultur og Seneste Internationalt. ",Politiken,https://politiken.dk/nyheder/,01.05.2023 07:17
Biden mødes med Modi og andre ledere i Papua Ny Guinea,21.05.2023 00:00,,https://politiken.dk/udland/art9329638/Biden-m%C3%B8des-med-Modi-og-andre-ledere-i-Papua-Ny-Guinea,Politiken,https://politiken.dk/nyheder/,"Hold dig opdateret pÃ¥ de seneste nyheder pÃ¥ politiken.dk: Seneste Politiken, Seneste Danmark, Seneste Kultur og Seneste Internationalt. ",Politiken,https://politiken.dk/nyheder/,01.05.2023 07:17
Europas kamp mod migranter står i disse dage i Det Indiske Ocean,21.05.2023 00:00,,https://politiken.dk/udland/art9321457/Europas-kamp-mod-migranter-st%C3%A5r-i-disse-dage-i-Det-Indiske-Ocean,Politiken,https://politiken.dk/nyheder/,"Hold dig opdateret pÃ¥ de seneste nyheder pÃ¥ politiken.dk: Seneste Politiken, Seneste Danmark, Seneste Kultur og Seneste Internationalt. ",Politiken,https://politiken.dk/nyheder/,01.05.2023 07:17
Mand er død i arbejdsulykke på en landejendom,21.05.2023 00:00,,https://politiken.dk/indland/art9329629/Mand-er-d%C3%B8d-i-arbejdsulykke-p%C3%A5-en-landejendom,Politiken,https://politiken.dk/nyheder/,"Hold dig opdateret pÃ¥ de seneste nyheder pÃ¥ politiken.dk: Seneste Politiken, Seneste Danmark, Seneste Kultur og Seneste Internationalt. ",Politiken,https://politiken.dk/nyheder/,01.05.2023 07:17
"Elisabet Svane: »Undervejs har hun fjernet en del mennesker, der sidder og godter sig nu«",21.05.2023 00:00,,https://politiken.dk/indland/art9329609/%C2%BBUndervejs-har-hun-fjernet-en-del-mennesker-der-sidder-og-godter-sig-nu%C2%AB,Politiken,https://politiken.dk/nyheder/,"Hold dig opdateret pÃ¥ de seneste nyheder pÃ¥ politiken.dk: Seneste Politiken, Seneste Danmark, Seneste Kultur og Seneste Internationalt. ",Politiken,https://politiken.dk/nyheder/,01.05.2023 07:17
Republikanerne har fundet præsidentens svage punkt. Her er hele den sørgelige historie om Hunter Biden,21.05.2023 00:00,,https://politiken.dk/udland/art9279388/Republikanerne-har-fundet-pr%C3%A6sidentens-svage-punkt.-Her-er-hele-den-s%C3%B8rgelige-historie-om-Hunter-Biden,Politiken,https://politiken.dk/nyheder/,"Hold dig opdateret pÃ¥ de seneste nyheder pÃ¥ politiken.dk: Seneste Politiken, Seneste Danmark, Seneste Kultur og Seneste Internationalt. ",Politiken,https://politiken.dk/nyheder/,01.05.2023 07:17
Jeppe Kofod forlader Folketinget,10.05.2023 00:00,,https://politiken.dk/indland/politik/art9330084/Jeppe-Kofod-forlader-Folketinget,Politiken,https://politiken.dk/nyheder/,"Hold dig opdateret pÃ¥ de seneste nyheder pÃ¥ politiken.dk: Seneste Politiken, Seneste Danmark, Seneste Kultur og Seneste Internationalt. ",Politiken,https://politiken.dk/nyheder/,01.05.2023 07:17
Live: Om lidt taler Mette Frederiksen,01.05.2023 00:00,,https://politiken.dk/indland/art9330005/Om-lidt-taler-Mette-Frederiksen,Politiken,https://politiken.dk/nyheder/,"Hold dig opdateret pÃ¥ de seneste nyheder pÃ¥ politiken.dk: Seneste Politiken, Seneste Danmark, Seneste Kultur og Seneste Internationalt. ",Politiken,https://politiken.dk/nyheder/,01.05.2023 07:17
Fagbevægelsens nye frontfigur: Det er altid gået hurtigt for Morten Skov Christiansen,11.05.2023 00:00,,https://politiken.dk/indland/art9329722/Det-er-altid-g%C3%A5et-hurtigt-for-Morten-Skov-Christiansen,Politiken,https://politiken.dk/nyheder/,"Hold dig opdateret pÃ¥ de seneste nyheder pÃ¥ politiken.dk: Seneste Politiken, Seneste Danmark, Seneste Kultur og Seneste Internationalt. ",Politiken,https://politiken.dk/nyheder/,01.05.2023 07:17
Ombudsmanden: Digitaliseringen har ført til omsiggribende banale problemer for borgerne,12.05.2023 00:00,,https://politiken.dk/indland/art9309922/Digitaliseringen-har-f%C3%B8rt-til-omsiggribende-banale-problemer-for-borgerne,Politiken,https://politiken.dk/nyheder/,"Hold dig opdateret pÃ¥ de seneste nyheder pÃ¥ politiken.dk: Seneste Politiken, Seneste Danmark, Seneste Kultur og Seneste Internationalt. ",Politiken,https://politiken.dk/nyheder/,01.05.2023 07:17
Flere potentielle konspirationsteorier blev luftet på dramatisk krisemøde inden Lizette Risgaards afgang,13.05.2023 00:00,,https://politiken.dk/indland/art9329637/Flere-potentielle-konspirationsteorier-blev-luftet-p%C3%A5-dramatisk-krisem%C3%B8de-inden-Lizette-Risgaards-afgang,Politiken,https://politiken.dk/nyheder/,"Hold dig opdateret pÃ¥ de seneste nyheder pÃ¥ politiken.dk: Seneste Politiken, Seneste Danmark, Seneste Kultur og Seneste Internationalt. ",Politiken,https://politiken.dk/nyheder/,01.05.2023 07:17
"Hun købte en knaldrød Tesla for at vise, at HK er in the house - i weekenden blev det tydeligt for enhver",14.05.2023 00:00,,https://politiken.dk/indland/art9329721/Hun-k%C3%B8bte-en-knaldr%C3%B8d-Tesla-for-at-vise-at-HK-er-in-the-house-%E2%80%93-i-weekenden-blev-det-tydeligt-for-enhver,Politiken,https://politiken.dk/nyheder/,"Hold dig opdateret pÃ¥ de seneste nyheder pÃ¥ politiken.dk: Seneste Politiken, Seneste Danmark, Seneste Kultur og Seneste Internationalt. ",Politiken,https://politiken.dk/nyheder/,01.05.2023 07:17
"Her er de fem typer boomere, du bør lære at kende",17.05.2023 00:00,,https://politiken.dk/indland/art9323882/Her-er-de-fem-typer-boomere-du-b%C3%B8r-l%C3%A6re-at-kende,Politiken,https://politiken.dk/nyheder/,"Hold dig opdateret pÃ¥ de seneste nyheder pÃ¥ politiken.dk: Seneste Politiken, Seneste Danmark, Seneste Kultur og Seneste Internationalt. ",Politiken,https://politiken.dk/nyheder/,01.05.2023 07:17
Store fagforbund: Rigtigt af Lizette at gå af,20.05.2023 00:00,,https://politiken.dk/indland/art9329677/Rigtigt-af-Lizette-at-g%C3%A5-af,Politiken,https://politiken.dk/nyheder/,"Hold dig opdateret pÃ¥ de seneste nyheder pÃ¥ politiken.dk: Seneste Politiken, Seneste Danmark, Seneste Kultur og Seneste Internationalt. ",Politiken,https://politiken.dk/nyheder/,01.05.2023 07:17
Mand er død i arbejdsulykke på en landejendom,21.05.2023 00:00,,https://politiken.dk/indland/art9329629/Mand-er-d%C3%B8d-i-arbejdsulykke-p%C3%A5-en-landejendom,Politiken,https://politiken.dk/nyheder/,"Hold dig opdateret pÃ¥ de seneste nyheder pÃ¥ politiken.dk: Seneste Politiken, Seneste Danmark, Seneste Kultur og Seneste Internationalt. ",Politiken,https://politiken.dk/nyheder/,01.05.2023 07:17
"Elisabet Svane: »Undervejs har hun fjernet en del mennesker, der sidder og godter sig nu«",21.05.2023 00:00,,https://politiken.dk/indland/art9329609/%C2%BBUndervejs-har-hun-fjernet-en-del-mennesker-der-sidder-og-godter-sig-nu%C2%AB,Politiken,https://politiken.dk/nyheder/,"Hold dig opdateret pÃ¥ de seneste nyheder pÃ¥ politiken.dk: Seneste Politiken, Seneste Danmark, Seneste Kultur og Seneste Internationalt. ",Politiken,https://politiken.dk/nyheder/,01.05.2023 07:17
At åbne eller lukke dørene - det er sagen,22.05.2023 00:00,,https://politiken.dk/indland/art9321175/At-%C3%A5bne-eller-lukke-d%C3%B8rene-%E2%80%93-det-er-sagen,Politiken,https://politiken.dk/nyheder/,"Hold dig opdateret pÃ¥ de seneste nyheder pÃ¥ politiken.dk: Seneste Politiken, Seneste Danmark, Seneste Kultur og Seneste Internationalt. ",Politiken,https://politiken.dk/nyheder/,01.05.2023 07:17
"Time for time: Sådan gik det for sig, da Lizette Risgaard trak sig som FH-formand",02.05.2023 00:00,,https://politiken.dk/indland/art9329573/Time-for-time-S%C3%A5dan-gik-det-for-sig-da-Lizette-Risgaard-trak-sig-som-FH-formand,Politiken,https://politiken.dk/nyheder/,"Hold dig opdateret pÃ¥ de seneste nyheder pÃ¥ politiken.dk: Seneste Politiken, Seneste Danmark, Seneste Kultur og Seneste Internationalt. ",Politiken,https://politiken.dk/nyheder/,01.05.2023 07:17
Lizette Risgaard trækker sig som formand,02.05.2023 00:00,,https://politiken.dk/indland/art9329565/Lizette-Risgaard-tr%C3%A6kker-sig-som-formand,Politiken,https://politiken.dk/nyheder/,"Hold dig opdateret pÃ¥ de seneste nyheder pÃ¥ politiken.dk: Seneste Politiken, Seneste Danmark, Seneste Kultur og Seneste Internationalt. ",Politiken,https://politiken.dk/nyheder/,01.05.2023 07:17
FH bekræfter kendskab til tidligere Lizette Risgaard-episoder,02.05.2023 00:00,,https://politiken.dk/indland/art9329556/FH-bekr%C3%A6fter-kendskab-til-tidligere-Lizette-Risgaard-episoder,Politiken,https://politiken.dk/nyheder/,"Hold dig opdateret pÃ¥ de seneste nyheder pÃ¥ politiken.dk: Seneste Politiken, Seneste Danmark, Seneste Kultur og Seneste Internationalt. ",Politiken,https://politiken.dk/nyheder/,01.05.2023 07:17
"Mette Frederiksen har fundet en uventet ven i udlandet, der roser hendes idé om et modtagecenter",02.05.2023 00:00,,https://politiken.dk/indland/art9315348/Mette-Frederiksen-har-fundet-en-uventet-ven-i-udlandet-der-roser-hendes-id%C3%A9-om-et-modtagecenter,Politiken,https://politiken.dk/nyheder/,"Hold dig opdateret pÃ¥ de seneste nyheder pÃ¥ politiken.dk: Seneste Politiken, Seneste Danmark, Seneste Kultur og Seneste Internationalt. ",Politiken,https://politiken.dk/nyheder/,01.05.2023 07:17
"Anklager truer: Vi lader spionsager falde, hvis retten åbner dørene",02.05.2023 00:00,,https://politiken.dk/indland/art9322668/Anklager-truer-Vi-lader-spionsager-falde-hvis-retten-%C3%A5bner-d%C3%B8rene,Politiken,https://politiken.dk/nyheder/,"Hold dig opdateret pÃ¥ de seneste nyheder pÃ¥ politiken.dk: Seneste Politiken, Seneste Danmark, Seneste Kultur og Seneste Internationalt. ",Politiken,https://politiken.dk/nyheder/,01.05.2023 07:17
Konflikt mellem grupper af unge mænd førte til knivstik,02.05.2023 00:00,,https://politiken.dk/indland/art9329551/Konflikt-mellem-grupper-af-unge-m%C3%A6nd-f%C3%B8rte-til-knivstik,Politiken,https://politiken.dk/nyheder/,"Hold dig opdateret pÃ¥ de seneste nyheder pÃ¥ politiken.dk: Seneste Politiken, Seneste Danmark, Seneste Kultur og Seneste Internationalt. ",Politiken,https://politiken.dk/nyheder/,01.05.2023 07:17
Langstrakt krisemøde endte som midnatsforestilling,02.05.2023 00:00,,https://politiken.dk/indland/art9329535/Langstrakt-krisem%C3%B8de-endte-som-midnatsforestilling,Politiken,https://politiken.dk/nyheder/,"Hold dig opdateret pÃ¥ de seneste nyheder pÃ¥ politiken.dk: Seneste Politiken, Seneste Danmark, Seneste Kultur og Seneste Internationalt. ",Politiken,https://politiken.dk/nyheder/,01.05.2023 07:17
Svensk statsminister om Mette Frederiksens modtagecenter: Vi kommer til at lande der,02.05.2023 00:00,,https://politiken.dk/indland/art9327800/Svensk-statsminister-om-Mette-Frederiksens-modtagecenter-Vi-kommer-til-at-lande-der,Politiken,https://politiken.dk/nyheder/,"Hold dig opdateret pÃ¥ de seneste nyheder pÃ¥ politiken.dk: Seneste Politiken, Seneste Danmark, Seneste Kultur og Seneste Internationalt. ",Politiken,https://politiken.dk/nyheder/,01.05.2023 07:17
En ny type fans fylder på kendt tribune. Nu spreder kritikken sig,02.05.2023 00:00,,https://politiken.dk/ibyen/art9313427/En-ny-type-fans-fylder-p%C3%A5-kendt-tribune.-Nu-spreder-kritikken-sig,Politiken,https://politiken.dk/nyheder/,"Hold dig opdateret pÃ¥ de seneste nyheder pÃ¥ politiken.dk: Seneste Politiken, Seneste Danmark, Seneste Kultur og Seneste Internationalt. ",Politiken,https://politiken.dk/nyheder/,01.05.2023 07:17
Slankemedicin gav Pia Pedersen livsglæden tilbage. Men økonomien bekymrer hende voldsomt,02.05.2023 00:00,,https://politiken.dk/forbrugogliv/sundhedogmotion/art9293226/Slankemedicin-gav-Pia-Pedersen-livsgl%C3%A6den-tilbage.-Men-%C3%B8konomien-bekymrer-hende-voldsomt,Politiken,https://politiken.dk/nyheder/,"Hold dig opdateret pÃ¥ de seneste nyheder pÃ¥ politiken.dk: Seneste Politiken, Seneste Danmark, Seneste Kultur og Seneste Internationalt. ",Politiken,https://politiken.dk/nyheder/,01.05.2023 07:17
Professor: Personer med stor gavn af Wegovy har simpelthen ikke råd,02.05.2023 00:00,,https://politiken.dk/forbrugogliv/sundhedogmotion/art9325957/Personer-med-stor-gavn-af-Wegovy-har-simpelthen-ikke-r%C3%A5d,Politiken,https://politiken.dk/nyheder/,"Hold dig opdateret pÃ¥ de seneste nyheder pÃ¥ politiken.dk: Seneste Politiken, Seneste Danmark, Seneste Kultur og Seneste Internationalt. ",Politiken,https://politiken.dk/nyheder/,01.05.2023 07:17
Topfolk i fagbevægelsen er indkaldt til nyt krisemøde,02.05.2023 00:00,,https://politiken.dk/indland/art9329455/Topfolk-i-fagbev%C3%A6gelsen-er-indkaldt-til-nyt-krisem%C3%B8de,Politiken,https://politiken.dk/nyheder/,"Hold dig opdateret pÃ¥ de seneste nyheder pÃ¥ politiken.dk: Seneste Politiken, Seneste Danmark, Seneste Kultur og Seneste Internationalt. ",Politiken,https://politiken.dk/nyheder/,01.05.2023 07:17
"Spørgsmålet er, om Lizette Risgaard vil gå planken ud",02.05.2023 00:00,,https://politiken.dk/indland/art9329381/Sp%C3%B8rgsm%C3%A5let-er-om-Lizette-Risgaard-vil-g%C3%A5-planken-ud,Politiken,https://politiken.dk/nyheder/,"Hold dig opdateret pÃ¥ de seneste nyheder pÃ¥ politiken.dk: Seneste Politiken, Seneste Danmark, Seneste Kultur og Seneste Internationalt. ",Politiken,https://politiken.dk/nyheder/,01.05.2023 07:17
