title,published,text,link,og:site_name,og:url,site_description,name,url,scrape_time
Danmark Yderligere to tilfælde med multiresistente bakterier fra Dicillin,22.02.2023 00:00,,https://www.berlingske.dk/danmark/yderligere-to-tilfaelde-med-multiresistente-bakterier-fra-dicillin,Berlingske.dk,https://www.berlingske.dk/nyheder,Læs alle nyhederne fra Danmark og resten af verden på berlingske.dk. Med Berlingske Nyheder får du det seneste nyhedsoverblik fra både ind- og udland. ,Berlingske,https://www.berlingske.dk/nyheder,21.02.2023 07:17
Samfund I nordsjællandsk kommune vokser antallet af trafikulykker: »Det er ikke rar læsning«,22.02.2023 00:00,,https://www.berlingske.dk/samfund/i-nordsjaellandsk-kommune-vokser-antallet-af-trafikulykker-det-er-ikke-rar,Berlingske.dk,https://www.berlingske.dk/nyheder,Læs alle nyhederne fra Danmark og resten af verden på berlingske.dk. Med Berlingske Nyheder får du det seneste nyhedsoverblik fra både ind- og udland. ,Berlingske,https://www.berlingske.dk/nyheder,21.02.2023 07:17
Internationalt Rusland blev på forhånd informeret om Bidens besøg i Kyiv,22.02.2023 00:00,,https://www.berlingske.dk/internationalt/rusland-blev-paa-forhaand-informeret-om-bidens-besoeg-i-kyiv,Berlingske.dk,https://www.berlingske.dk/nyheder,Læs alle nyhederne fra Danmark og resten af verden på berlingske.dk. Med Berlingske Nyheder får du det seneste nyhedsoverblik fra både ind- og udland. ,Berlingske,https://www.berlingske.dk/nyheder,21.02.2023 07:17
Nu kan alle fra murersvende til matematiklærere indstilles til Undervisningsprisen,03.02.2023 00:00,,https://politiken.dk/indland/art9215977/Nu-kan-alle-fra-murersvende-til-matematikl%C3%A6rere-indstilles-til-Undervisningsprisen,Politiken,https://politiken.dk/nyheder/,"Hold dig opdateret pÃ¥ de seneste nyheder pÃ¥ politiken.dk: Seneste Politiken, Seneste Danmark, Seneste Kultur og Seneste Internationalt. ",Politiken,https://politiken.dk/nyheder/,21.02.2023 07:17
"Beskeden supermand fra FCM: »Det er ikke kun én kamp, som sender dig på landsholdet«",10.02.2023 00:00,,https://politiken.dk/sport/art9222496/%C2%BBDet-er-ikke-kun-%C3%A9n-kamp-som-sender-dig-p%C3%A5-landsholdet%C2%AB,Politiken,https://politiken.dk/nyheder/,"Hold dig opdateret pÃ¥ de seneste nyheder pÃ¥ politiken.dk: Seneste Politiken, Seneste Danmark, Seneste Kultur og Seneste Internationalt. ",Politiken,https://politiken.dk/nyheder/,21.02.2023 07:17
"Han var den Baldwin, der havde mest sex på film i 90-erne",17.02.2023 00:00,,https://politiken.dk/navne/art9178142/Han-var-den-Baldwin-der-havde-mest-sex-p%C3%A5-film-i-90%E2%80%99erne,Politiken,https://politiken.dk/nyheder/,"Hold dig opdateret pÃ¥ de seneste nyheder pÃ¥ politiken.dk: Seneste Politiken, Seneste Danmark, Seneste Kultur og Seneste Internationalt. ",Politiken,https://politiken.dk/nyheder/,21.02.2023 07:17
Lønmodtagere får over 4.000 kroner ekstra med nyt pensionstiltag,21.02.2055 00:00,,https://politiken.dk/indland/art9222444/L%C3%B8nmodtagere-f%C3%A5r-over-4.000-kroner-ekstra-med-nyt-pensionstiltag,Politiken,https://politiken.dk/nyheder/,"Hold dig opdateret pÃ¥ de seneste nyheder pÃ¥ politiken.dk: Seneste Politiken, Seneste Danmark, Seneste Kultur og Seneste Internationalt. ",Politiken,https://politiken.dk/nyheder/,21.02.2023 07:17
Kina er dybt bekymret over ukontrollerbar konflikt i Ukraine,01.02.2023 00:00,,https://politiken.dk/udland/art9222463/Kina-er-dybt-bekymret-over-ukontrollerbar-konflikt-i-Ukraine,Politiken,https://politiken.dk/nyheder/,"Hold dig opdateret pÃ¥ de seneste nyheder pÃ¥ politiken.dk: Seneste Politiken, Seneste Danmark, Seneste Kultur og Seneste Internationalt. ",Politiken,https://politiken.dk/nyheder/,21.02.2023 07:17
70 år: Pia Raug er så populær som nogensinde før,01.02.2023 00:00,,https://politiken.dk/navne/art9177971/Pia-Raug-er-s%C3%A5-popul%C3%A6r-som-nogensinde-f%C3%B8r,Politiken,https://politiken.dk/nyheder/,"Hold dig opdateret pÃ¥ de seneste nyheder pÃ¥ politiken.dk: Seneste Politiken, Seneste Danmark, Seneste Kultur og Seneste Internationalt. ",Politiken,https://politiken.dk/nyheder/,21.02.2023 07:17
50 år: Teaterinstruktøren er far til fire og kunstnerisk ophav til mere,01.02.2023 00:00,,https://politiken.dk/navne/art9177989/Teaterinstrukt%C3%B8ren-er-far-til-fire-og-kunstnerisk-ophav-til-mere,Politiken,https://politiken.dk/nyheder/,"Hold dig opdateret pÃ¥ de seneste nyheder pÃ¥ politiken.dk: Seneste Politiken, Seneste Danmark, Seneste Kultur og Seneste Internationalt. ",Politiken,https://politiken.dk/nyheder/,21.02.2023 07:17
»Det var som en lavine«: Dødstallet stiger efter jordskred i Brasilien,01.02.2023 00:00,,https://politiken.dk/udland/art9222447/D%C3%B8dstallet-stiger-efter-jordskred-i-Brasilien,Politiken,https://politiken.dk/nyheder/,"Hold dig opdateret pÃ¥ de seneste nyheder pÃ¥ politiken.dk: Seneste Politiken, Seneste Danmark, Seneste Kultur og Seneste Internationalt. ",Politiken,https://politiken.dk/nyheder/,21.02.2023 07:17
Minister vil afvente tiltag trods kritik af tilsyn med elpriser,02.02.2023 00:00,,https://politiken.dk/indland/art9222411/Minister-vil-afvente-tiltag-trods-kritik-af-tilsyn-med-elpriser,Politiken,https://politiken.dk/nyheder/,"Hold dig opdateret pÃ¥ de seneste nyheder pÃ¥ politiken.dk: Seneste Politiken, Seneste Danmark, Seneste Kultur og Seneste Internationalt. ",Politiken,https://politiken.dk/nyheder/,21.02.2023 07:17
Han filmede sin yndlingsbog og modtog stor international pris,02.02.2023 00:00,,https://politiken.dk/navne/art9214324/Han-filmede-sin-yndlingsbog-og-modtog-stor-international-pris,Politiken,https://politiken.dk/nyheder/,"Hold dig opdateret pÃ¥ de seneste nyheder pÃ¥ politiken.dk: Seneste Politiken, Seneste Danmark, Seneste Kultur og Seneste Internationalt. ",Politiken,https://politiken.dk/nyheder/,21.02.2023 07:17
"Omar Marzouk fylder 50: »Jeg har ikke rigtig noget - det hele er ramlet. Så ja, jeg synes da, jeg har ramt bunden«",02.02.2023 00:00,,https://politiken.dk/navne/art9175106/%C2%BBJeg-har-ikke-rigtig-noget-%E2%80%93-det-hele-er-ramlet.-S%C3%A5-ja-jeg-synes-da-jeg-har-ramt-bunden%C2%AB,Politiken,https://politiken.dk/nyheder/,"Hold dig opdateret pÃ¥ de seneste nyheder pÃ¥ politiken.dk: Seneste Politiken, Seneste Danmark, Seneste Kultur og Seneste Internationalt. ",Politiken,https://politiken.dk/nyheder/,21.02.2023 07:17
"Spotify-grundlægger fylder 40: Han ændrede lyden af popmusik, balancen i musikindustrien og saldoen på sin konto",03.02.2023 00:00,,https://politiken.dk/navne/art9072212/Han-%C3%A6ndrede-lyden-af-popmusik-balancen-i-musikindustrien-og-saldoen-p%C3%A5-sin-konto,Politiken,https://politiken.dk/nyheder/,"Hold dig opdateret pÃ¥ de seneste nyheder pÃ¥ politiken.dk: Seneste Politiken, Seneste Danmark, Seneste Kultur og Seneste Internationalt. ",Politiken,https://politiken.dk/nyheder/,21.02.2023 07:17
Sagen genåbnet: Blev Pablo Neruda giftmyrdet?,03.02.2023 00:00,,https://politiken.dk/podcast/dulyttertilpolitiken/art9221155/Sagen-gen%C3%A5bnet-Blev-Pablo-Neruda-giftmyrdet,Politiken,https://politiken.dk/nyheder/,"Hold dig opdateret pÃ¥ de seneste nyheder pÃ¥ politiken.dk: Seneste Politiken, Seneste Danmark, Seneste Kultur og Seneste Internationalt. ",Politiken,https://politiken.dk/nyheder/,21.02.2023 07:17
Kong Harald sendte takkebrev til Putin efter invasionen,09.02.2023 00:00,,https://politiken.dk/kultur/art9222406/Kong-Harald-sendte-takkebrev-til-Putin-efter-invasionen,Politiken,https://politiken.dk/nyheder/,"Hold dig opdateret pÃ¥ de seneste nyheder pÃ¥ politiken.dk: Seneste Politiken, Seneste Danmark, Seneste Kultur og Seneste Internationalt. ",Politiken,https://politiken.dk/nyheder/,21.02.2023 07:17
Bryan Cranstons ansigt er i sig selv anden sæson af serien Your Honor værd,09.02.2023 00:00,,https://politiken.dk/kultur/film_og_tv/art9148730/Bryan-Cranstons-ansigt-er-i-sig-selv-anden-s%C3%A6son-af-serien-Your-Honor-v%C3%A6rd,Politiken,https://politiken.dk/nyheder/,"Hold dig opdateret pÃ¥ de seneste nyheder pÃ¥ politiken.dk: Seneste Politiken, Seneste Danmark, Seneste Kultur og Seneste Internationalt. ",Politiken,https://politiken.dk/nyheder/,21.02.2023 07:17
Ibyen tipper: Berliner-klubben Berghain i en kælder på Vesterbro?,10.02.2023 00:00,,https://politiken.dk/ibyen/art9221405/Berliner-klubben-Berghain-i-en-k%C3%A6lder-p%C3%A5-Vesterbro,Politiken,https://politiken.dk/nyheder/,"Hold dig opdateret pÃ¥ de seneste nyheder pÃ¥ politiken.dk: Seneste Politiken, Seneste Danmark, Seneste Kultur og Seneste Internationalt. ",Politiken,https://politiken.dk/nyheder/,21.02.2023 07:17
Hver fjerde ukrainer ønsker at blive i Danmark efter krigen,10.02.2023 00:00,,https://politiken.dk/indland/art9222393/Hver-fjerde-ukrainer-%C3%B8nsker-at-blive-i-Danmark-efter-krigen,Politiken,https://politiken.dk/nyheder/,"Hold dig opdateret pÃ¥ de seneste nyheder pÃ¥ politiken.dk: Seneste Politiken, Seneste Danmark, Seneste Kultur og Seneste Internationalt. ",Politiken,https://politiken.dk/nyheder/,21.02.2023 07:17
"Dorte Hygum: Jeg ved, at man udmærket kan have et godt liv uden en kæreste, mens venner er svære at undvære",10.02.2023 00:00,,https://politiken.dk/debat/klummer/art9218880/Jeg-ved-at-man-udm%C3%A6rket-kan-have-et-godt-liv-uden-en-k%C3%A6reste-mens-venner-er-sv%C3%A6re-at-undv%C3%A6re,Politiken,https://politiken.dk/nyheder/,"Hold dig opdateret pÃ¥ de seneste nyheder pÃ¥ politiken.dk: Seneste Politiken, Seneste Danmark, Seneste Kultur og Seneste Internationalt. ",Politiken,https://politiken.dk/nyheder/,21.02.2023 07:17
Redningsarbejdet i Tyrkiet er slut. Nu gælder det oprydningen,11.02.2023 00:00,,https://politiken.dk/udland/art9220512/Redningsarbejdet-i-Tyrkiet-er-slut.-Nu-g%C3%A6lder-det-oprydningen,Politiken,https://politiken.dk/nyheder/,"Hold dig opdateret pÃ¥ de seneste nyheder pÃ¥ politiken.dk: Seneste Politiken, Seneste Danmark, Seneste Kultur og Seneste Internationalt. ",Politiken,https://politiken.dk/nyheder/,21.02.2023 07:17
Ustyrlig Gustav Isaksen sætter ild til stadion og knuser Viborg med hattrick på 20 minutter,11.02.2023 00:00,,https://politiken.dk/sport/fodbold/art9219581/Ustyrlig-Gustav-Isaksen-s%C3%A6tter-ild-til-stadion-og-knuser-Viborg-med-hattrick-p%C3%A5-20-minutter,Politiken,https://politiken.dk/nyheder/,"Hold dig opdateret pÃ¥ de seneste nyheder pÃ¥ politiken.dk: Seneste Politiken, Seneste Danmark, Seneste Kultur og Seneste Internationalt. ",Politiken,https://politiken.dk/nyheder/,21.02.2023 07:17
"Stem for overenskomstaftalen. Det sidste, Danmark har brug for, er en storkonflikt",11.02.2023 00:00,,https://politiken.dk/debat/ledere/art9220812/Stem-for-overenskomstaftalen.-Det-sidste-Danmark-har-brug-for-er-en-storkonflikt,Politiken,https://politiken.dk/nyheder/,"Hold dig opdateret pÃ¥ de seneste nyheder pÃ¥ politiken.dk: Seneste Politiken, Seneste Danmark, Seneste Kultur og Seneste Internationalt. ",Politiken,https://politiken.dk/nyheder/,21.02.2023 07:17
51 soldater dræbt af jihadister ved angreb i Burkina Faso,11.02.2023 00:00,,https://politiken.dk/udland/art9222378/51-soldater-dr%C3%A6bt-af-jihadister-ved-angreb-i-Burkina-Faso,Politiken,https://politiken.dk/nyheder/,"Hold dig opdateret pÃ¥ de seneste nyheder pÃ¥ politiken.dk: Seneste Politiken, Seneste Danmark, Seneste Kultur og Seneste Internationalt. ",Politiken,https://politiken.dk/nyheder/,21.02.2023 07:17
"Det er jo til tider noget forbandet vrøvl, han skriver",11.02.2023 00:00,,https://politiken.dk/kultur/boger/boganmeldelser/faglitteratur_boger/art9198822/Det-er-jo-til-tider-noget-forbandet-vr%C3%B8vl-han-skriver,Politiken,https://politiken.dk/nyheder/,"Hold dig opdateret pÃ¥ de seneste nyheder pÃ¥ politiken.dk: Seneste Politiken, Seneste Danmark, Seneste Kultur og Seneste Internationalt. ",Politiken,https://politiken.dk/nyheder/,21.02.2023 07:17
Løkke efter nye sanktioner: Hele Iran-politikken bør gentænkes,11.02.2023 00:00,,https://politiken.dk/indland/art9222367/Hele-Iran-politikken-b%C3%B8r-gent%C3%A6nkes,Politiken,https://politiken.dk/nyheder/,"Hold dig opdateret pÃ¥ de seneste nyheder pÃ¥ politiken.dk: Seneste Politiken, Seneste Danmark, Seneste Kultur og Seneste Internationalt. ",Politiken,https://politiken.dk/nyheder/,21.02.2023 07:17
Børn med muskelsvindsygdom kan blive symptomfri med nyt tiltag,11.02.2023 00:00,,https://politiken.dk/forbrugogliv/sundhedogmotion/art9222371/B%C3%B8rn-med-muskelsvindsygdom-kan-blive-symptomfri-med-nyt-tiltag,Politiken,https://politiken.dk/nyheder/,"Hold dig opdateret pÃ¥ de seneste nyheder pÃ¥ politiken.dk: Seneste Politiken, Seneste Danmark, Seneste Kultur og Seneste Internationalt. ",Politiken,https://politiken.dk/nyheder/,21.02.2023 07:17
Sveriges militære sikkerhedstjeneste advarer mod Rusland,11.02.2023 00:00,,https://politiken.dk/udland/art9222074/Sveriges-milit%C3%A6re-sikkerhedstjeneste-advarer-mod-Rusland,Politiken,https://politiken.dk/nyheder/,"Hold dig opdateret pÃ¥ de seneste nyheder pÃ¥ politiken.dk: Seneste Politiken, Seneste Danmark, Seneste Kultur og Seneste Internationalt. ",Politiken,https://politiken.dk/nyheder/,21.02.2023 07:17
Ung mand alvorligt såret efter knivstikkeri i København,12.02.2023 00:00,,https://politiken.dk/indland/art9222366/Ung-mand-alvorligt-s%C3%A5ret-efter-knivstikkeri-i-K%C3%B8benhavn,Politiken,https://politiken.dk/nyheder/,"Hold dig opdateret pÃ¥ de seneste nyheder pÃ¥ politiken.dk: Seneste Politiken, Seneste Danmark, Seneste Kultur og Seneste Internationalt. ",Politiken,https://politiken.dk/nyheder/,21.02.2023 07:17
Over 30 lande i fælles opråb til IOC: Udeluk russere fra OL,12.02.2023 00:00,,https://politiken.dk/sport/art9222353/Udeluk-russere-fra-OL,Politiken,https://politiken.dk/nyheder/,"Hold dig opdateret pÃ¥ de seneste nyheder pÃ¥ politiken.dk: Seneste Politiken, Seneste Danmark, Seneste Kultur og Seneste Internationalt. ",Politiken,https://politiken.dk/nyheder/,21.02.2023 07:17
Danmark sender 42 mobile boliger til jordskælvsramte Tyrkiet,12.02.2023 00:00,,https://politiken.dk/udland/art9222359/Danmark-sender-42-mobile-boliger-til-jordsk%C3%A6lvsramte-Tyrkiet,Politiken,https://politiken.dk/nyheder/,"Hold dig opdateret pÃ¥ de seneste nyheder pÃ¥ politiken.dk: Seneste Politiken, Seneste Danmark, Seneste Kultur og Seneste Internationalt. ",Politiken,https://politiken.dk/nyheder/,21.02.2023 07:17
"Familiemedlemmerne har det med at forsvinde ud på toilettet. De har nemlig en del, de skal af med",12.02.2023 00:00,,https://politiken.dk/kultur/art9193307/Familiemedlemmerne-har-det-med-at-forsvinde-ud-p%C3%A5-toilettet.-De-har-nemlig-en-del-de-skal-af-med,Politiken,https://politiken.dk/nyheder/,"Hold dig opdateret pÃ¥ de seneste nyheder pÃ¥ politiken.dk: Seneste Politiken, Seneste Danmark, Seneste Kultur og Seneste Internationalt. ",Politiken,https://politiken.dk/nyheder/,21.02.2023 07:17
"Over 200 kvæstet: Nyt skælv på 6,3 ryster region mellem Syrien og Tyrkiet",12.02.2023 00:00,,https://politiken.dk/udland/art9222338/Nyt-sk%C3%A6lv-p%C3%A5-63-ryster-region-mellem-Syrien-og-Tyrkiet,Politiken,https://politiken.dk/nyheder/,"Hold dig opdateret pÃ¥ de seneste nyheder pÃ¥ politiken.dk: Seneste Politiken, Seneste Danmark, Seneste Kultur og Seneste Internationalt. ",Politiken,https://politiken.dk/nyheder/,21.02.2023 07:17
"»Please, fortæl danskerne, hvor lykkelige ukrainerne er for at være her«",13.02.2023 00:00,,https://politiken.dk/indland/art9201860/%C2%BBPlease-fort%C3%A6l-danskerne-hvor-lykkelige-ukrainerne-er-for-at-v%C3%A6re-her%C2%AB,Politiken,https://politiken.dk/nyheder/,"Hold dig opdateret pÃ¥ de seneste nyheder pÃ¥ politiken.dk: Seneste Politiken, Seneste Danmark, Seneste Kultur og Seneste Internationalt. ",Politiken,https://politiken.dk/nyheder/,21.02.2023 07:17
Tyrkiets regering vil bygge 200.000 boliger efter jordskælv,13.02.2023 00:00,,https://politiken.dk/udland/art9222323/Tyrkiets-regering-vil-bygge-200.000-boliger-efter-jordsk%C3%A6lv,Politiken,https://politiken.dk/nyheder/,"Hold dig opdateret pÃ¥ de seneste nyheder pÃ¥ politiken.dk: Seneste Politiken, Seneste Danmark, Seneste Kultur og Seneste Internationalt. ",Politiken,https://politiken.dk/nyheder/,21.02.2023 07:17
Vilde videoer: Mand over bord og farlig storm rammer kæmpebådene i Sydney,13.02.2023 00:00,,https://politiken.dk/sport/art9220641/Mand-over-bord-og-farlig-storm-rammer-k%C3%A6mpeb%C3%A5dene-i-Sydney,Politiken,https://politiken.dk/nyheder/,"Hold dig opdateret pÃ¥ de seneste nyheder pÃ¥ politiken.dk: Seneste Politiken, Seneste Danmark, Seneste Kultur og Seneste Internationalt. ",Politiken,https://politiken.dk/nyheder/,21.02.2023 07:17
Fred eller konflikt?: Forstå slaget om 600.000 danskeres løn på et minut,13.02.2023 00:00,,https://politiken.dk/indland/art9220587/Forst%C3%A5-slaget-om-600.000-danskeres-l%C3%B8n-p%C3%A5-et-minut,Politiken,https://politiken.dk/nyheder/,"Hold dig opdateret pÃ¥ de seneste nyheder pÃ¥ politiken.dk: Seneste Politiken, Seneste Danmark, Seneste Kultur og Seneste Internationalt. ",Politiken,https://politiken.dk/nyheder/,21.02.2023 07:17
Folk på mindsteløn er vindere i ny lønaftale,13.02.2023 00:00,,https://politiken.dk/indland/art9220593/Folk-p%C3%A5-mindstel%C3%B8n-er-vindere-i-ny-l%C3%B8naftale,Politiken,https://politiken.dk/nyheder/,"Hold dig opdateret pÃ¥ de seneste nyheder pÃ¥ politiken.dk: Seneste Politiken, Seneste Danmark, Seneste Kultur og Seneste Internationalt. ",Politiken,https://politiken.dk/nyheder/,21.02.2023 07:17
Fejl hos teleselskaber gjorde det svært at ringe til politiet,14.02.2023 00:00,,https://politiken.dk/indland/art9222305/Fejl-hos-teleselskaber-gjorde-det-sv%C3%A6rt-at-ringe-til-politiet,Politiken,https://politiken.dk/nyheder/,"Hold dig opdateret pÃ¥ de seneste nyheder pÃ¥ politiken.dk: Seneste Politiken, Seneste Danmark, Seneste Kultur og Seneste Internationalt. ",Politiken,https://politiken.dk/nyheder/,21.02.2023 07:17
Israel stopper bosættelser i periode efter krise,14.02.2023 00:00,,https://politiken.dk/udland/art9222288/Israel-stopper-bos%C3%A6ttelser-i-periode-efter-krise,Politiken,https://politiken.dk/nyheder/,"Hold dig opdateret pÃ¥ de seneste nyheder pÃ¥ politiken.dk: Seneste Politiken, Seneste Danmark, Seneste Kultur og Seneste Internationalt. ",Politiken,https://politiken.dk/nyheder/,21.02.2023 07:17
"Statsrevisorer i skarp kritik: Forbrugerne betaler overpris for el, gas og varme",15.02.2023 00:00,,https://politiken.dk/indland/art9220987/Forbrugerne-betaler-overpris-for-el-gas-og-varme,Politiken,https://politiken.dk/nyheder/,"Hold dig opdateret pÃ¥ de seneste nyheder pÃ¥ politiken.dk: Seneste Politiken, Seneste Danmark, Seneste Kultur og Seneste Internationalt. ",Politiken,https://politiken.dk/nyheder/,21.02.2023 07:17
"Han var lige ved at droppe ud, men så kom han i lære hos ham fra -I hus til halsen-",03.02.2023 00:00,,https://politiken.dk/indland/uddannelse/undervisningsprisen/art9215852/Han-var-lige-ved-at-droppe-ud-men-s%C3%A5-kom-han-i-l%C3%A6re-hos-ham-fra-%E2%80%99I-hus-til-halsen%E2%80%99,Politiken,https://politiken.dk/nyheder/,"Hold dig opdateret pÃ¥ de seneste nyheder pÃ¥ politiken.dk: Seneste Politiken, Seneste Danmark, Seneste Kultur og Seneste Internationalt. ",Politiken,https://politiken.dk/nyheder/,21.02.2023 07:17
Nu kan alle fra murersvende til matematiklærere indstilles til Undervisningsprisen,03.02.2023 00:00,,https://politiken.dk/indland/art9215977/Nu-kan-alle-fra-murersvende-til-matematikl%C3%A6rere-indstilles-til-Undervisningsprisen,Politiken,https://politiken.dk/nyheder/,"Hold dig opdateret pÃ¥ de seneste nyheder pÃ¥ politiken.dk: Seneste Politiken, Seneste Danmark, Seneste Kultur og Seneste Internationalt. ",Politiken,https://politiken.dk/nyheder/,21.02.2023 07:17
Lønmodtagere får over 4.000 kroner ekstra med nyt pensionstiltag,21.02.2055 00:00,,https://politiken.dk/indland/art9222444/L%C3%B8nmodtagere-f%C3%A5r-over-4.000-kroner-ekstra-med-nyt-pensionstiltag,Politiken,https://politiken.dk/nyheder/,"Hold dig opdateret pÃ¥ de seneste nyheder pÃ¥ politiken.dk: Seneste Politiken, Seneste Danmark, Seneste Kultur og Seneste Internationalt. ",Politiken,https://politiken.dk/nyheder/,21.02.2023 07:17
Simon Emil Ammitzbøll-Bille prøvede at få Anders Samuelsen til at trække sig som leder fra Liberal Alliance,01.02.2023 00:00,,https://politiken.dk/indland/politik/art9215524/Simon-Emil-Ammitzb%C3%B8ll-Bille-pr%C3%B8vede-at-f%C3%A5-Anders-Samuelsen-til-at-tr%C3%A6kke-sig-som-leder-fra-Liberal-Alliance,Politiken,https://politiken.dk/nyheder/,"Hold dig opdateret pÃ¥ de seneste nyheder pÃ¥ politiken.dk: Seneste Politiken, Seneste Danmark, Seneste Kultur og Seneste Internationalt. ",Politiken,https://politiken.dk/nyheder/,21.02.2023 07:17
Minister vil afvente tiltag trods kritik af tilsyn med elpriser,02.02.2023 00:00,,https://politiken.dk/indland/art9222411/Minister-vil-afvente-tiltag-trods-kritik-af-tilsyn-med-elpriser,Politiken,https://politiken.dk/nyheder/,"Hold dig opdateret pÃ¥ de seneste nyheder pÃ¥ politiken.dk: Seneste Politiken, Seneste Danmark, Seneste Kultur og Seneste Internationalt. ",Politiken,https://politiken.dk/nyheder/,21.02.2023 07:17
Hver fjerde ukrainer ønsker at blive i Danmark efter krigen,10.02.2023 00:00,,https://politiken.dk/indland/art9222393/Hver-fjerde-ukrainer-%C3%B8nsker-at-blive-i-Danmark-efter-krigen,Politiken,https://politiken.dk/nyheder/,"Hold dig opdateret pÃ¥ de seneste nyheder pÃ¥ politiken.dk: Seneste Politiken, Seneste Danmark, Seneste Kultur og Seneste Internationalt. ",Politiken,https://politiken.dk/nyheder/,21.02.2023 07:17
Løkke efter nye sanktioner: Hele Iran-politikken bør gentænkes,11.02.2023 00:00,,https://politiken.dk/indland/art9222367/Hele-Iran-politikken-b%C3%B8r-gent%C3%A6nkes,Politiken,https://politiken.dk/nyheder/,"Hold dig opdateret pÃ¥ de seneste nyheder pÃ¥ politiken.dk: Seneste Politiken, Seneste Danmark, Seneste Kultur og Seneste Internationalt. ",Politiken,https://politiken.dk/nyheder/,21.02.2023 07:17
Ung mand alvorligt såret efter knivstikkeri i København,12.02.2023 00:00,,https://politiken.dk/indland/art9222366/Ung-mand-alvorligt-s%C3%A5ret-efter-knivstikkeri-i-K%C3%B8benhavn,Politiken,https://politiken.dk/nyheder/,"Hold dig opdateret pÃ¥ de seneste nyheder pÃ¥ politiken.dk: Seneste Politiken, Seneste Danmark, Seneste Kultur og Seneste Internationalt. ",Politiken,https://politiken.dk/nyheder/,21.02.2023 07:17
"»Please, fortæl danskerne, hvor lykkelige ukrainerne er for at være her«",13.02.2023 00:00,,https://politiken.dk/indland/art9201860/%C2%BBPlease-fort%C3%A6l-danskerne-hvor-lykkelige-ukrainerne-er-for-at-v%C3%A6re-her%C2%AB,Politiken,https://politiken.dk/nyheder/,"Hold dig opdateret pÃ¥ de seneste nyheder pÃ¥ politiken.dk: Seneste Politiken, Seneste Danmark, Seneste Kultur og Seneste Internationalt. ",Politiken,https://politiken.dk/nyheder/,21.02.2023 07:17
Fred eller konflikt?: Forstå slaget om 600.000 danskeres løn på et minut,13.02.2023 00:00,,https://politiken.dk/indland/art9220587/Forst%C3%A5-slaget-om-600.000-danskeres-l%C3%B8n-p%C3%A5-et-minut,Politiken,https://politiken.dk/nyheder/,"Hold dig opdateret pÃ¥ de seneste nyheder pÃ¥ politiken.dk: Seneste Politiken, Seneste Danmark, Seneste Kultur og Seneste Internationalt. ",Politiken,https://politiken.dk/nyheder/,21.02.2023 07:17
Folk på mindsteløn er vindere i ny lønaftale,13.02.2023 00:00,,https://politiken.dk/indland/art9220593/Folk-p%C3%A5-mindstel%C3%B8n-er-vindere-i-ny-l%C3%B8naftale,Politiken,https://politiken.dk/nyheder/,"Hold dig opdateret pÃ¥ de seneste nyheder pÃ¥ politiken.dk: Seneste Politiken, Seneste Danmark, Seneste Kultur og Seneste Internationalt. ",Politiken,https://politiken.dk/nyheder/,21.02.2023 07:17
Fejl hos teleselskaber gjorde det svært at ringe til politiet,14.02.2023 00:00,,https://politiken.dk/indland/art9222305/Fejl-hos-teleselskaber-gjorde-det-sv%C3%A6rt-at-ringe-til-politiet,Politiken,https://politiken.dk/nyheder/,"Hold dig opdateret pÃ¥ de seneste nyheder pÃ¥ politiken.dk: Seneste Politiken, Seneste Danmark, Seneste Kultur og Seneste Internationalt. ",Politiken,https://politiken.dk/nyheder/,21.02.2023 07:17
"Statsrevisorer i skarp kritik: Forbrugerne betaler overpris for el, gas og varme",15.02.2023 00:00,,https://politiken.dk/indland/art9220987/Forbrugerne-betaler-overpris-for-el-gas-og-varme,Politiken,https://politiken.dk/nyheder/,"Hold dig opdateret pÃ¥ de seneste nyheder pÃ¥ politiken.dk: Seneste Politiken, Seneste Danmark, Seneste Kultur og Seneste Internationalt. ",Politiken,https://politiken.dk/nyheder/,21.02.2023 07:17
"Minister lover, at prispatrulje fortsætter trods sin dvale",15.02.2023 00:00,,https://politiken.dk/indland/art9220576/Minister-lover-at-prispatrulje-forts%C3%A6tter-trods-sin-dvale,Politiken,https://politiken.dk/nyheder/,"Hold dig opdateret pÃ¥ de seneste nyheder pÃ¥ politiken.dk: Seneste Politiken, Seneste Danmark, Seneste Kultur og Seneste Internationalt. ",Politiken,https://politiken.dk/nyheder/,21.02.2023 07:17
"Wow, mit brev kom frem på under 17 timer",16.02.2023 00:00,,https://politiken.dk/indland/art9181334/Wow-mit-brev-kom-frem-p%C3%A5-under-17-timer,Politiken,https://politiken.dk/nyheder/,"Hold dig opdateret pÃ¥ de seneste nyheder pÃ¥ politiken.dk: Seneste Politiken, Seneste Danmark, Seneste Kultur og Seneste Internationalt. ",Politiken,https://politiken.dk/nyheder/,21.02.2023 07:17
Gældsstyrelsen inddriver rekordhøjt milliardbeløb med ny metode,18.02.2023 00:00,,https://politiken.dk/indland/art9221221/G%C3%A6ldsstyrelsen-inddriver-rekordh%C3%B8jt-milliardbel%C3%B8b-med-ny-metode,Politiken,https://politiken.dk/nyheder/,"Hold dig opdateret pÃ¥ de seneste nyheder pÃ¥ politiken.dk: Seneste Politiken, Seneste Danmark, Seneste Kultur og Seneste Internationalt. ",Politiken,https://politiken.dk/nyheder/,21.02.2023 07:17
