title,published,text,link,og:site_name,og:url,site_description,name,url,scrape_time
Overblik: Hvem støtter stadig Lizette Risgaard - og hvem gør ikke?,02.05.2023 00:00,,https://politiken.dk/indland/art9329282/Hvem-st%C3%B8tter-stadig-Lizette-Risgaard-%E2%80%93-og-hvem-g%C3%B8r-ikke,Politiken,https://politiken.dk/nyheder/,"Hold dig opdateret pÃ¥ de seneste nyheder pÃ¥ politiken.dk: Seneste Politiken, Seneste Danmark, Seneste Kultur og Seneste Internationalt. ",Politiken,https://politiken.dk/nyheder/,01.05.2023 07:17
Scandinavian Star-ofre vil sagsøge Søfartsstyrelsen,02.05.2023 00:00,,https://politiken.dk/indland/art9329324/Scandinavian-Star-ofre-vil-sags%C3%B8ge-S%C3%B8fartsstyrelsen,Politiken,https://politiken.dk/nyheder/,"Hold dig opdateret pÃ¥ de seneste nyheder pÃ¥ politiken.dk: Seneste Politiken, Seneste Danmark, Seneste Kultur og Seneste Internationalt. ",Politiken,https://politiken.dk/nyheder/,01.05.2023 07:17
"Prispatruljen: Store bededag nærmer sig, og det betyder tilbud på smør",02.05.2023 00:00,,https://politiken.dk/indland/art9318358/Store-bededag-n%C3%A6rmer-sig-og-det-betyder-tilbud-p%C3%A5-sm%C3%B8r,Politiken,https://politiken.dk/nyheder/,"Hold dig opdateret pÃ¥ de seneste nyheder pÃ¥ politiken.dk: Seneste Politiken, Seneste Danmark, Seneste Kultur og Seneste Internationalt. ",Politiken,https://politiken.dk/nyheder/,01.05.2023 07:17
Læger tiltalt: Gav piloter helbredsattester uden autorisation,02.05.2023 00:00,,https://politiken.dk/indland/art9329286/Gav-piloter-helbredsattester-uden-autorisation,Politiken,https://politiken.dk/nyheder/,"Hold dig opdateret pÃ¥ de seneste nyheder pÃ¥ politiken.dk: Seneste Politiken, Seneste Danmark, Seneste Kultur og Seneste Internationalt. ",Politiken,https://politiken.dk/nyheder/,01.05.2023 07:17
Flere forbund trækker støtten til Lizette Risgaard,02.05.2023 00:00,,https://politiken.dk/indland/art9329278/Flere-forbund-tr%C3%A6kker-st%C3%B8tten-til-Lizette-Risgaard,Politiken,https://politiken.dk/nyheder/,"Hold dig opdateret pÃ¥ de seneste nyheder pÃ¥ politiken.dk: Seneste Politiken, Seneste Danmark, Seneste Kultur og Seneste Internationalt. ",Politiken,https://politiken.dk/nyheder/,01.05.2023 07:17
Magt og kontrol driver seriemorderen og serievoldtægtsmanden,02.05.2023 00:00,,https://politiken.dk/indland/art9324762/Magt-og-kontrol-driver-seriemorderen-og-serievoldt%C3%A6gtsmanden,Politiken,https://politiken.dk/nyheder/,"Hold dig opdateret pÃ¥ de seneste nyheder pÃ¥ politiken.dk: Seneste Politiken, Seneste Danmark, Seneste Kultur og Seneste Internationalt. ",Politiken,https://politiken.dk/nyheder/,01.05.2023 07:17
Fagbosser og erhvervsliv takker ja til regeringens trepartsinvitation,02.05.2023 00:00,,https://politiken.dk/indland/art9329256/Fagbosser-og-erhvervsliv-takker-ja-til-regeringens-trepartsinvitation,Politiken,https://politiken.dk/nyheder/,"Hold dig opdateret pÃ¥ de seneste nyheder pÃ¥ politiken.dk: Seneste Politiken, Seneste Danmark, Seneste Kultur og Seneste Internationalt. ",Politiken,https://politiken.dk/nyheder/,01.05.2023 07:17
"»Det foregår ganske udbredt i toppen. Også blandt dem, der stiller sig frem og siger, at nu skal det være anderledes«",02.05.2023 00:00,,https://politiken.dk/indland/art9328100/%C2%BBDet-foreg%C3%A5r-ganske-udbredt-i-toppen.-Ogs%C3%A5-blandt-dem-der-stiller-sig-frem-og-siger-at-nu-skal-det-v%C3%A6re-anderledes%C2%AB,Politiken,https://politiken.dk/nyheder/,"Hold dig opdateret pÃ¥ de seneste nyheder pÃ¥ politiken.dk: Seneste Politiken, Seneste Danmark, Seneste Kultur og Seneste Internationalt. ",Politiken,https://politiken.dk/nyheder/,01.05.2023 07:17
Ny hovedtaler erstatter Lizette Risgaard i Fælledparken 1. maj,02.05.2023 00:00,,https://politiken.dk/indland/art9329258/Ny-hovedtaler-erstatter-Lizette-Risgaard-i-F%C3%A6lledparken-1.-maj,Politiken,https://politiken.dk/nyheder/,"Hold dig opdateret pÃ¥ de seneste nyheder pÃ¥ politiken.dk: Seneste Politiken, Seneste Danmark, Seneste Kultur og Seneste Internationalt. ",Politiken,https://politiken.dk/nyheder/,01.05.2023 07:17
"Mens fagbevægelsen står i #MeToo-flammer, er der et godt tilbud fra regeringen",29.05.2023 00:00,,https://politiken.dk/indland/art9326069/Mens-fagbev%C3%A6gelsen-st%C3%A5r-i-MeToo-flammer-er-der-et-godt-tilbud-fra-regeringen,Politiken,https://politiken.dk/nyheder/,"Hold dig opdateret pÃ¥ de seneste nyheder pÃ¥ politiken.dk: Seneste Politiken, Seneste Danmark, Seneste Kultur og Seneste Internationalt. ",Politiken,https://politiken.dk/nyheder/,01.05.2023 07:17
Lederskribenter øjner ingen vej tilbage til FH for Risgaard,29.05.2023 00:00,,https://politiken.dk/indland/art9329210/Lederskribenter-%C3%B8jner-ingen-vej-tilbage-til-FH-for-Risgaard,Politiken,https://politiken.dk/nyheder/,"Hold dig opdateret pÃ¥ de seneste nyheder pÃ¥ politiken.dk: Seneste Politiken, Seneste Danmark, Seneste Kultur og Seneste Internationalt. ",Politiken,https://politiken.dk/nyheder/,01.05.2023 07:17
Regeringstop efter kritik af pensionsplaner: »Har vi selv fundet den perfekte løsning? Det er ikke sikkert«,29.05.2023 00:00,,https://politiken.dk/indland/politik/art9327392/Regeringstop-efter-kritik-af-pensionsplaner-%C2%BBHar-vi-selv-fundet-den-perfekte-l%C3%B8sning-Det-er-ikke-sikkert%C2%AB,Politiken,https://politiken.dk/nyheder/,"Hold dig opdateret pÃ¥ de seneste nyheder pÃ¥ politiken.dk: Seneste Politiken, Seneste Danmark, Seneste Kultur og Seneste Internationalt. ",Politiken,https://politiken.dk/nyheder/,01.05.2023 07:17
Nyt overfald får christianitter til at frygte reel bandekrig,29.05.2023 00:00,,https://politiken.dk/indland/art9329206/Nyt-overfald-f%C3%A5r-christianitter-til-at-frygte-reel-bandekrig,Politiken,https://politiken.dk/nyheder/,"Hold dig opdateret pÃ¥ de seneste nyheder pÃ¥ politiken.dk: Seneste Politiken, Seneste Danmark, Seneste Kultur og Seneste Internationalt. ",Politiken,https://politiken.dk/nyheder/,01.05.2023 07:17
Ung mand overfaldet med slag og knivstik på Christiania,29.05.2023 00:00,,https://politiken.dk/indland/art9329215/Ung-mand-overfaldet-med-slag-og-knivstik-p%C3%A5-Christiania,Politiken,https://politiken.dk/nyheder/,"Hold dig opdateret pÃ¥ de seneste nyheder pÃ¥ politiken.dk: Seneste Politiken, Seneste Danmark, Seneste Kultur og Seneste Internationalt. ",Politiken,https://politiken.dk/nyheder/,01.05.2023 07:17
Mænd tiltalt for at planlægge knivangreb på gravid kvinde,29.05.2023 00:00,,https://politiken.dk/indland/art9329217/M%C3%A6nd-tiltalt-for-at-planl%C3%A6gge-knivangreb-p%C3%A5-gravid-kvinde,Politiken,https://politiken.dk/nyheder/,"Hold dig opdateret pÃ¥ de seneste nyheder pÃ¥ politiken.dk: Seneste Politiken, Seneste Danmark, Seneste Kultur og Seneste Internationalt. ",Politiken,https://politiken.dk/nyheder/,01.05.2023 07:17
19 naturaktivister frihedsberøvet til demonstration i København,29.05.2023 00:00,,https://politiken.dk/indland/art9329200/19-naturaktivister-frihedsber%C3%B8vet-til-demonstration-i-K%C3%B8benhavn,Politiken,https://politiken.dk/nyheder/,"Hold dig opdateret pÃ¥ de seneste nyheder pÃ¥ politiken.dk: Seneste Politiken, Seneste Danmark, Seneste Kultur og Seneste Internationalt. ",Politiken,https://politiken.dk/nyheder/,01.05.2023 07:17
Formænd forsøgte at dæmpe Lizette Risgaards alkoholindtag,29.05.2023 00:00,,https://politiken.dk/indland/art9328603/Form%C3%A6nd-fors%C3%B8gte-at-d%C3%A6mpe-Lizette-Risgaards-alkoholindtag,Politiken,https://politiken.dk/nyheder/,"Hold dig opdateret pÃ¥ de seneste nyheder pÃ¥ politiken.dk: Seneste Politiken, Seneste Danmark, Seneste Kultur og Seneste Internationalt. ",Politiken,https://politiken.dk/nyheder/,01.05.2023 07:17
"Han har en lang erfaring med en udfordret elevgruppe. Derfor så han også, at hun gemte på noget",28.05.2023 00:00,,https://politiken.dk/indland/uddannelse/undervisningsprisen/art9323699/Han-har-en-lang-erfaring-med-en-udfordret-elevgruppe.-Derfor-s%C3%A5-han-ogs%C3%A5-at-hun-gemte-p%C3%A5-noget,Politiken,https://politiken.dk/nyheder/,"Hold dig opdateret pÃ¥ de seneste nyheder pÃ¥ politiken.dk: Seneste Politiken, Seneste Danmark, Seneste Kultur og Seneste Internationalt. ",Politiken,https://politiken.dk/nyheder/,01.05.2023 07:17
Næstformand afløser Risgaard,28.05.2023 00:00,,https://politiken.dk/indland/art9329123/N%C3%A6stformand-afl%C3%B8ser-Risgaard,Politiken,https://politiken.dk/nyheder/,"Hold dig opdateret pÃ¥ de seneste nyheder pÃ¥ politiken.dk: Seneste Politiken, Seneste Danmark, Seneste Kultur og Seneste Internationalt. ",Politiken,https://politiken.dk/nyheder/,01.05.2023 07:17
Portræt: Lizette Risgaard fejlvurderede spillereglerne for lønmodtagernes frontfigur,28.05.2023 00:00,,https://politiken.dk/indland/art9324294/Lizette-Risgaard-fejlvurderede-spillereglerne-for-l%C3%B8nmodtagernes-frontfigur,Politiken,https://politiken.dk/nyheder/,"Hold dig opdateret pÃ¥ de seneste nyheder pÃ¥ politiken.dk: Seneste Politiken, Seneste Danmark, Seneste Kultur og Seneste Internationalt. ",Politiken,https://politiken.dk/nyheder/,01.05.2023 07:17
"Synligt rystet gav Lizette Risgaard en fuldtonet beklagelse, men så begyndte støtten at sive",28.05.2023 00:00,,https://politiken.dk/indland/art9327805/Synligt-rystet-gav-Lizette-Risgaard-en-fuldtonet-beklagelse-men-s%C3%A5-begyndte-st%C3%B8tten-at-sive,Politiken,https://politiken.dk/nyheder/,"Hold dig opdateret pÃ¥ de seneste nyheder pÃ¥ politiken.dk: Seneste Politiken, Seneste Danmark, Seneste Kultur og Seneste Internationalt. ",Politiken,https://politiken.dk/nyheder/,01.05.2023 07:17
Togene holder stille mellem Skanderborg og Fredericia efter påkørsel,28.05.2023 00:00,,https://politiken.dk/indland/art9329045/Togene-holder-stille-mellem-Skanderborg-og-Fredericia-efter-p%C3%A5k%C3%B8rsel,Politiken,https://politiken.dk/nyheder/,"Hold dig opdateret pÃ¥ de seneste nyheder pÃ¥ politiken.dk: Seneste Politiken, Seneste Danmark, Seneste Kultur og Seneste Internationalt. ",Politiken,https://politiken.dk/nyheder/,01.05.2023 07:17
Lizette Risgaard går på orlov,28.05.2023 00:00,,https://politiken.dk/indland/art9329044/Lizette-Risgaard-g%C3%A5r-p%C3%A5-orlov,Politiken,https://politiken.dk/nyheder/,"Hold dig opdateret pÃ¥ de seneste nyheder pÃ¥ politiken.dk: Seneste Politiken, Seneste Danmark, Seneste Kultur og Seneste Internationalt. ",Politiken,https://politiken.dk/nyheder/,01.05.2023 07:17
En tydeligt chokeret Lizette Risgaard sagde undskyld i alle varianter,28.05.2023 00:00,,https://politiken.dk/indland/art9328656/En-tydeligt-chokeret-Lizette-Risgaard-sagde-undskyld-i-alle-varianter,Politiken,https://politiken.dk/nyheder/,"Hold dig opdateret pÃ¥ de seneste nyheder pÃ¥ politiken.dk: Seneste Politiken, Seneste Danmark, Seneste Kultur og Seneste Internationalt. ",Politiken,https://politiken.dk/nyheder/,01.05.2023 07:17
Fakta: Her er FHs adfærdskodeks,28.05.2023 00:00,,https://politiken.dk/indland/art9328953/Fakta-Her-er-FHs-adf%C3%A6rdskodeks,Politiken,https://politiken.dk/nyheder/,"Hold dig opdateret pÃ¥ de seneste nyheder pÃ¥ politiken.dk: Seneste Politiken, Seneste Danmark, Seneste Kultur og Seneste Internationalt. ",Politiken,https://politiken.dk/nyheder/,01.05.2023 07:17
Finanstilsynets eks-topchef er tiltalt for at spytte på p-vagt,28.05.2023 00:00,,https://politiken.dk/indland/art9328730/Finanstilsynets-eks-topchef-er-tiltalt-for-at-spytte-p%C3%A5-p-vagt,Politiken,https://politiken.dk/nyheder/,"Hold dig opdateret pÃ¥ de seneste nyheder pÃ¥ politiken.dk: Seneste Politiken, Seneste Danmark, Seneste Kultur og Seneste Internationalt. ",Politiken,https://politiken.dk/nyheder/,01.05.2023 07:17
"5 hjerter: Det er djævelsk godt gjort, Knausgård",01.05.2035 00:00,,https://politiken.dk/kultur/boger/boganmeldelser/skonlitteratur_boger/art9319570/Det-er-dj%C3%A6velsk-godt-gjort-Knausg%C3%A5rd,Politiken,https://politiken.dk/nyheder/,"Hold dig opdateret pÃ¥ de seneste nyheder pÃ¥ politiken.dk: Seneste Politiken, Seneste Danmark, Seneste Kultur og Seneste Internationalt. ",Politiken,https://politiken.dk/nyheder/,01.05.2023 07:17
Amerikansk rigmand bruger to millioner dollars om året på at holde sig ung. Jeg forstår ham - næsten,10.05.2023 00:00,,https://politiken.dk/kultur/boger/art9318193/Amerikansk-rigmand-bruger-to-millioner-dollars-om-%C3%A5ret-p%C3%A5-at-holde-sig-ung.-Jeg-forst%C3%A5r-ham-%E2%80%93-n%C3%A6sten,Politiken,https://politiken.dk/nyheder/,"Hold dig opdateret pÃ¥ de seneste nyheder pÃ¥ politiken.dk: Seneste Politiken, Seneste Danmark, Seneste Kultur og Seneste Internationalt. ",Politiken,https://politiken.dk/nyheder/,01.05.2023 07:17
"Her er de seks mest interessante film og serier, du bør streame i maj",10.05.2023 00:00,,https://politiken.dk/kultur/film_og_tv/art9170492/Her-er-de-seks-mest-interessante-film-og-serier-du-b%C3%B8r-streame-i-maj,Politiken,https://politiken.dk/nyheder/,"Hold dig opdateret pÃ¥ de seneste nyheder pÃ¥ politiken.dk: Seneste Politiken, Seneste Danmark, Seneste Kultur og Seneste Internationalt. ",Politiken,https://politiken.dk/nyheder/,01.05.2023 07:17
Vi kender dem alle i mere eller mindre fortyndet udgave: De løsgående menneskelige missiler,12.05.2023 00:00,,https://politiken.dk/kultur/boger/boganmeldelser/faglitteratur_boger/art9319681/Vi-kender-dem-alle-i-mere-eller-mindre-fortyndet-udgave-De-l%C3%B8sg%C3%A5ende-menneskelige-missiler,Politiken,https://politiken.dk/nyheder/,"Hold dig opdateret pÃ¥ de seneste nyheder pÃ¥ politiken.dk: Seneste Politiken, Seneste Danmark, Seneste Kultur og Seneste Internationalt. ",Politiken,https://politiken.dk/nyheder/,01.05.2023 07:17
Alle de mandlige karakterer får hugget dilleren af,14.05.2023 00:00,,https://politiken.dk/kultur/scene/art9284567/Alle-de-mandlige-karakterer-f%C3%A5r-hugget-dilleren-af,Politiken,https://politiken.dk/nyheder/,"Hold dig opdateret pÃ¥ de seneste nyheder pÃ¥ politiken.dk: Seneste Politiken, Seneste Danmark, Seneste Kultur og Seneste Internationalt. ",Politiken,https://politiken.dk/nyheder/,01.05.2023 07:17
Hollywoodselskaber overbød hinanden for at få rettighederne til hendes thrillere,16.05.2023 00:00,,https://politiken.dk/kultur/boger/art9318181/Hollywoodselskaber-overb%C3%B8d-hinanden-for-at-f%C3%A5-rettighederne-til-hendes-thrillere,Politiken,https://politiken.dk/nyheder/,"Hold dig opdateret pÃ¥ de seneste nyheder pÃ¥ politiken.dk: Seneste Politiken, Seneste Danmark, Seneste Kultur og Seneste Internationalt. ",Politiken,https://politiken.dk/nyheder/,01.05.2023 07:17
Nu står verden ikke længere. Livgarden er gået til scenen!,17.05.2023 00:00,,https://politiken.dk/kultur/scene/art9177041/Nu-st%C3%A5r-verden-ikke-l%C3%A6ngere.-Livgarden-er-g%C3%A5et-til-scenen,Politiken,https://politiken.dk/nyheder/,"Hold dig opdateret pÃ¥ de seneste nyheder pÃ¥ politiken.dk: Seneste Politiken, Seneste Danmark, Seneste Kultur og Seneste Internationalt. ",Politiken,https://politiken.dk/nyheder/,01.05.2023 07:17
Så er der ellers dømt dansk dødsdisco,17.05.2023 00:00,,https://politiken.dk/kultur/musik/art9320654/S%C3%A5-er-der-ellers-d%C3%B8mt-dansk-d%C3%B8dsdisco,Politiken,https://politiken.dk/nyheder/,"Hold dig opdateret pÃ¥ de seneste nyheder pÃ¥ politiken.dk: Seneste Politiken, Seneste Danmark, Seneste Kultur og Seneste Internationalt. ",Politiken,https://politiken.dk/nyheder/,01.05.2023 07:17
"Skulle en dansende diskoand være bedre, bare fordi den er fra gamle dage?",19.05.2023 00:00,,https://politiken.dk/kultur/set_og_hoert/art9322441/Skulle-en-dansende-diskoand-v%C3%A6re-bedre-bare-fordi-den-er-fra-gamle-dage,Politiken,https://politiken.dk/nyheder/,"Hold dig opdateret pÃ¥ de seneste nyheder pÃ¥ politiken.dk: Seneste Politiken, Seneste Danmark, Seneste Kultur og Seneste Internationalt. ",Politiken,https://politiken.dk/nyheder/,01.05.2023 07:17
Stjerneinstruktør: Venskab kan også være forbundet med hjertesorg,20.05.2023 00:00,,https://politiken.dk/kultur/film_og_tv/art9320156/Stjerneinstrukt%C3%B8r-Venskab-kan-ogs%C3%A5-v%C3%A6re-forbundet-med-hjertesorg,Politiken,https://politiken.dk/nyheder/,"Hold dig opdateret pÃ¥ de seneste nyheder pÃ¥ politiken.dk: Seneste Politiken, Seneste Danmark, Seneste Kultur og Seneste Internationalt. ",Politiken,https://politiken.dk/nyheder/,01.05.2023 07:17
80-årige Biden bliver grillet for sin alder til middag med pressen,23.05.2023 00:00,,https://politiken.dk/kultur/art9329590/80-%C3%A5rige-Biden-bliver-grillet-for-sin-alder-til-middag-med-pressen,Politiken,https://politiken.dk/nyheder/,"Hold dig opdateret pÃ¥ de seneste nyheder pÃ¥ politiken.dk: Seneste Politiken, Seneste Danmark, Seneste Kultur og Seneste Internationalt. ",Politiken,https://politiken.dk/nyheder/,01.05.2023 07:17
Alle taler om de tre dage med spektakulært design i København. Så her er fem gode råd,23.05.2023 00:00,,https://politiken.dk/kultur/design/art9296340/Alle-taler-om-de-tre-dage-med-spektakul%C3%A6rt-design-i-K%C3%B8benhavn.-S%C3%A5-her-er-fem-gode-r%C3%A5d,Politiken,https://politiken.dk/nyheder/,"Hold dig opdateret pÃ¥ de seneste nyheder pÃ¥ politiken.dk: Seneste Politiken, Seneste Danmark, Seneste Kultur og Seneste Internationalt. ",Politiken,https://politiken.dk/nyheder/,01.05.2023 07:17
"Ondskabens kostskole: Her skulle pigerne ordne vasketøj - et pænt ord for, at de blev voldtaget i vaskekælderen af en præst",02.05.2023 00:00,,https://politiken.dk/kultur/set_og_hoert/art9281358/Ondskabens-kostskole-Her-skulle-pigerne-ordne-vasket%C3%B8j-et-p%C3%A6nt-ord-for-at-de-blev-voldtaget-i-vaskek%C3%A6lderen-af-en-pr%C3%A6st,Politiken,https://politiken.dk/nyheder/,"Hold dig opdateret pÃ¥ de seneste nyheder pÃ¥ politiken.dk: Seneste Politiken, Seneste Danmark, Seneste Kultur og Seneste Internationalt. ",Politiken,https://politiken.dk/nyheder/,01.05.2023 07:17
Hellere for meget dig selv end for lidt,02.05.2023 00:00,,https://politiken.dk/kultur/musik/art9312707/Hellere-for-meget-dig-selv-end-for-lidt,Politiken,https://politiken.dk/nyheder/,"Hold dig opdateret pÃ¥ de seneste nyheder pÃ¥ politiken.dk: Seneste Politiken, Seneste Danmark, Seneste Kultur og Seneste Internationalt. ",Politiken,https://politiken.dk/nyheder/,01.05.2023 07:17
"Jeg troede, at verden anno Dirrty var klar til en kvinde, der nød sin egen krop og seksualitet. Men nej",02.05.2023 00:00,,https://politiken.dk/kultur/art8989215/Jeg-troede-at-verden-anno-Dirrty-var-klar-til-en-kvinde-der-n%C3%B8d-sin-egen-krop-og-seksualitet.-Men-nej,Politiken,https://politiken.dk/nyheder/,"Hold dig opdateret pÃ¥ de seneste nyheder pÃ¥ politiken.dk: Seneste Politiken, Seneste Danmark, Seneste Kultur og Seneste Internationalt. ",Politiken,https://politiken.dk/nyheder/,01.05.2023 07:17
Kan man være for doven til at gøre det af med sig selv?,02.05.2023 00:00,,https://politiken.dk/kultur/boger/art9318359/Kan-man-v%C3%A6re-for-doven-til-at-g%C3%B8re-det-af-med-sig-selv,Politiken,https://politiken.dk/nyheder/,"Hold dig opdateret pÃ¥ de seneste nyheder pÃ¥ politiken.dk: Seneste Politiken, Seneste Danmark, Seneste Kultur og Seneste Internationalt. ",Politiken,https://politiken.dk/nyheder/,01.05.2023 07:17
Ballet hylder ikonisk heavy metal-band,02.05.2023 00:00,,https://politiken.dk/kultur/art9327187/Ballet-hylder-ikonisk-heavy-metal-band,Politiken,https://politiken.dk/nyheder/,"Hold dig opdateret pÃ¥ de seneste nyheder pÃ¥ politiken.dk: Seneste Politiken, Seneste Danmark, Seneste Kultur og Seneste Internationalt. ",Politiken,https://politiken.dk/nyheder/,01.05.2023 07:17
Flyvende papirfisk kan også være godt design,02.05.2023 00:00,,https://politiken.dk/kultur/art9284926/Flyvende-papirfisk-kan-ogs%C3%A5-v%C3%A6re-godt-design,Politiken,https://politiken.dk/nyheder/,"Hold dig opdateret pÃ¥ de seneste nyheder pÃ¥ politiken.dk: Seneste Politiken, Seneste Danmark, Seneste Kultur og Seneste Internationalt. ",Politiken,https://politiken.dk/nyheder/,01.05.2023 07:17
Irma-hønen forekommer decideret vingeskudt på Folkeklubbens nye album,02.05.2023 00:00,,https://politiken.dk/kultur/musik/art9302461/Irma-h%C3%B8nen-forekommer-decideret-vingeskudt-p%C3%A5-Folkeklubbens-nye-album,Politiken,https://politiken.dk/nyheder/,"Hold dig opdateret pÃ¥ de seneste nyheder pÃ¥ politiken.dk: Seneste Politiken, Seneste Danmark, Seneste Kultur og Seneste Internationalt. ",Politiken,https://politiken.dk/nyheder/,01.05.2023 07:17
"Som forælder er jeg tumlet ind i en underkategori af bøger, som sjældent omtales og aldrig som litteratur",02.05.2023 00:00,,https://politiken.dk/kultur/boger/art9318345/Som-for%C3%A6lder-er-jeg-tumlet-ind-i-en-underkategori-af-b%C3%B8ger-som-sj%C3%A6ldent-omtales-og-aldrig-som-litteratur,Politiken,https://politiken.dk/nyheder/,"Hold dig opdateret pÃ¥ de seneste nyheder pÃ¥ politiken.dk: Seneste Politiken, Seneste Danmark, Seneste Kultur og Seneste Internationalt. ",Politiken,https://politiken.dk/nyheder/,01.05.2023 07:17
"Mathias Kryger: Det var kunstnerens vanvid, jeg kom efter, men jeg endte med selv at blive skør",02.05.2023 00:00,,https://politiken.dk/kultur/kunst/art9304385/Mathias-Kryger-Det-var-kunstnerens-vanvid-jeg-kom-efter-men-jeg-endte-med-selv-at-blive-sk%C3%B8r,Politiken,https://politiken.dk/nyheder/,"Hold dig opdateret pÃ¥ de seneste nyheder pÃ¥ politiken.dk: Seneste Politiken, Seneste Danmark, Seneste Kultur og Seneste Internationalt. ",Politiken,https://politiken.dk/nyheder/,01.05.2023 07:17
Kulturkrigen mod bøger buldrer derudad i England,02.05.2023 00:00,,https://politiken.dk/kultur/boger/art9315626/Kulturkrigen-mod-b%C3%B8ger-buldrer-derudad-i-England,Politiken,https://politiken.dk/nyheder/,"Hold dig opdateret pÃ¥ de seneste nyheder pÃ¥ politiken.dk: Seneste Politiken, Seneste Danmark, Seneste Kultur og Seneste Internationalt. ",Politiken,https://politiken.dk/nyheder/,01.05.2023 07:17
"Han blev født i 1564, men hans personer lever i bedste velgående",29.05.2023 00:00,,https://politiken.dk/kultur/boger/art9318176/Han-blev-f%C3%B8dt-i-1564-men-hans-personer-lever-i-bedste-velg%C3%A5ende,Politiken,https://politiken.dk/nyheder/,"Hold dig opdateret pÃ¥ de seneste nyheder pÃ¥ politiken.dk: Seneste Politiken, Seneste Danmark, Seneste Kultur og Seneste Internationalt. ",Politiken,https://politiken.dk/nyheder/,01.05.2023 07:17
»I sidste ende er der ikke rigtig andet at afgøre sagerne ud fra end ord«,29.05.2023 00:00,,https://politiken.dk/kultur/art9312502/%C2%BBI-sidste-ende-er-der-ikke-rigtig-andet-at-afg%C3%B8re-sagerne-ud-fra-end-ord%C2%AB,Politiken,https://politiken.dk/nyheder/,"Hold dig opdateret pÃ¥ de seneste nyheder pÃ¥ politiken.dk: Seneste Politiken, Seneste Danmark, Seneste Kultur og Seneste Internationalt. ",Politiken,https://politiken.dk/nyheder/,01.05.2023 07:17
WEEKEND. Stor guide: Det skal du høre på sommerens festivaler,29.05.2023 00:00,,https://politiken.dk/podcast/dulyttertilpolitiken/art9324456/WEEKEND.-Stor-guide-Det-skal-du-h%C3%B8re-p%C3%A5-sommerens-festivaler,Politiken,https://politiken.dk/nyheder/,"Hold dig opdateret pÃ¥ de seneste nyheder pÃ¥ politiken.dk: Seneste Politiken, Seneste Danmark, Seneste Kultur og Seneste Internationalt. ",Politiken,https://politiken.dk/nyheder/,01.05.2023 07:17
PJ Harvey kaster med sten,28.05.2023 00:00,,https://politiken.dk/kultur/musik/art9320659/PJ-Harvey-kaster-med-sten,Politiken,https://politiken.dk/nyheder/,"Hold dig opdateret pÃ¥ de seneste nyheder pÃ¥ politiken.dk: Seneste Politiken, Seneste Danmark, Seneste Kultur og Seneste Internationalt. ",Politiken,https://politiken.dk/nyheder/,01.05.2023 07:17
"5 hjerter: Et vidunderligt, hedonistisk kollaps",28.05.2023 00:00,,https://politiken.dk/kultur/art9322887/Et-vidunderligt-hedonistisk-kollaps,Politiken,https://politiken.dk/nyheder/,"Hold dig opdateret pÃ¥ de seneste nyheder pÃ¥ politiken.dk: Seneste Politiken, Seneste Danmark, Seneste Kultur og Seneste Internationalt. ",Politiken,https://politiken.dk/nyheder/,01.05.2023 07:17
Skuespillerinden Stina Rautelin fra Beck-filmene er død - 59 år,28.05.2023 00:00,,https://politiken.dk/kultur/film_og_tv/art9329120/Skuespillerinden-Stina-Rautelin-fra-Beck-filmene-er-d%C3%B8d-59-%C3%A5r,Politiken,https://politiken.dk/nyheder/,"Hold dig opdateret pÃ¥ de seneste nyheder pÃ¥ politiken.dk: Seneste Politiken, Seneste Danmark, Seneste Kultur og Seneste Internationalt. ",Politiken,https://politiken.dk/nyheder/,01.05.2023 07:17
"Vi kender typen, men mangler ord. Og nu er det nok",28.05.2023 00:00,,https://politiken.dk/kultur/art9273357/Vi-kender-typen-men-mangler-ord.-Og-nu-er-det-nok,Politiken,https://politiken.dk/nyheder/,"Hold dig opdateret pÃ¥ de seneste nyheder pÃ¥ politiken.dk: Seneste Politiken, Seneste Danmark, Seneste Kultur og Seneste Internationalt. ",Politiken,https://politiken.dk/nyheder/,01.05.2023 07:17
Stjerneskuespiller anklager sladdermedie for indbrud i hans hjem,28.05.2023 00:00,,https://politiken.dk/kultur/art9327304/Stjerneskuespiller-anklager-sladdermedie-for-indbrud-i-hans-hjem,Politiken,https://politiken.dk/nyheder/,"Hold dig opdateret pÃ¥ de seneste nyheder pÃ¥ politiken.dk: Seneste Politiken, Seneste Danmark, Seneste Kultur og Seneste Internationalt. ",Politiken,https://politiken.dk/nyheder/,01.05.2023 07:17
Hvad med en gang brystkasserytmik for viderekomne?,28.05.2023 00:00,,https://politiken.dk/kultur/scene/art9294554/Hvad-med-en-gang-brystkasserytmik-for-viderekomne,Politiken,https://politiken.dk/nyheder/,"Hold dig opdateret pÃ¥ de seneste nyheder pÃ¥ politiken.dk: Seneste Politiken, Seneste Danmark, Seneste Kultur og Seneste Internationalt. ",Politiken,https://politiken.dk/nyheder/,01.05.2023 07:17
Dansk Instagram-stjerne dømt for skjult reklame,28.05.2023 00:00,,https://politiken.dk/kultur/medier/art9328413/Dansk-Instagram-stjerne-d%C3%B8mt-for-skjult-reklame,Politiken,https://politiken.dk/nyheder/,"Hold dig opdateret pÃ¥ de seneste nyheder pÃ¥ politiken.dk: Seneste Politiken, Seneste Danmark, Seneste Kultur og Seneste Internationalt. ",Politiken,https://politiken.dk/nyheder/,01.05.2023 07:17
